id	filename	tokens	lemmas
947591	tlg0007.tlg018.perseus-grc2	ἐμοὶ τῆς τῶν βίων ἅψασθαι μὲν γραφῆς συνέβη διʼ ἑτέρους, ἐπιμένειν δὲ καὶ φιλοχωρεῖν ἤδη καὶ διʼ ἐμαυτόν, ὥσπερ ἐν ἐσόπτρῳ τῇ ἱστορίᾳ πειρώμενον ἁμῶς γέ πως κοσμεῖν καὶ ἀφομοιοῦν πρὸς τὰς ἐκείνων ἀρετὰς τὸν βίον.	ὁ ὁ βίος ἅπτω μέν γραφή συμβαίνω διά ἕτερος , ἐπιμένω δέ καί  ἤδη καί  ἐμαυτοῦ , ὥσπερ ἐν ἔσοπτρον ὁ ἱστορία  ἁμός γε πως κοσμέω καί ἀφομοιόω πρός ὁ ἐκεῖνος ἀρετή ὁ βίος .
947592	tlg0007.tlg018.perseus-grc2	οὐδὲν γὰρ ἀλλʼ ἢ συνδιαιτήσει καὶ συμβιώσει τὸ γινόμενον ἔοικεν, ὅταν ὥσπερ ἐπιξενούμενον ἕκαστον αὐτῶν ἐν μέρει διὰ τῆς ἱστορίας ὑποδεχόμενοι καὶ παραλαμβάνοντες ἀναθεωρῶμεν ὅσσος ἔην οἷός τε, τὰ κυριώτατα καὶ κάλλιστα πρὸς γνῶσιν ἀπὸ τῶν πράξεων λαμβάνοντες.	οὐδείς γάρ  τίη  καί  ὁ  ἔοικα , ὅταν ὥσπερ  ἕκαστος αὐτός ἐν μέρος διά ὁ ἱστορία  καί παραλαμβάνω  ὅσος εἰμί  τε , ὁ κύριος καί καλός πρός γιγνώσκω ἀπό ὁ πρᾶξις λαμβάνω .
947593	tlg0007.tlg018.perseus-grc2	φεῦ, φεῦ·	φεῦ , φεῦ ·
947594	tlg0007.tlg018.perseus-grc2	τί τούτου χάρμα μεῖζον ἂν λάβοις, καὶ πρὸς ἐπανόρθωσιν ἠθῶν ἐνεργότερον;	τι οὗτος χάρμα μέγας ἐάν λαμβάνω , καί πρός ἐπανόρθωσις ἦθος ἐνεργός ;
947595	tlg0007.tlg018.perseus-grc2	Δημόκριτος μὲν γὰρ εὔχεσθαί φησι δεῖν ὅπως εὐλόγχων εἰδώλων τυγχάνωμεν καὶ τὰ σύμφυλα καὶ τὰ χρηστὰ μᾶλλον ἡμῖν ἐκ τοῦ περιέχοντος ἢ τὰ φαῦλα καὶ τὰ σκαιὰ συμφέρηται, λόγον οὔτʼ ἀληθῆ καὶ πρὸς ἀπεράντους ἐκφέροντα δεισιδαιμονίας εἰς φιλοσοφίαν καταβάλλων ἡμεῖς δὲ τῇ περὶ τὴν ἱστορίαν διατριβῇ καὶ τῆς γραφῆς τῇ συνηθείᾳ παρασκευάζομεν ἑαυτούς, τὰς τῶν ἀρίστων καὶ δοκιμωτάτων μνήμας ὑποδεχομένους ἀεὶ ταῖς ψυχαῖς, εἴ τι φαῦλον ἢ κακόηθες ἢ ἀγεννὲς αἱ τῶν συνόντων ἐξ ἀνάγκης ὁμιλίαι προσβάλλουσιν, ἐκκρούειν καὶ διωθεῖσθαι, πρὸς τὰ κάλλιστα τῶν παραδειγμάτων ἵλεω καὶ πρᾳεῖαν ἀποστρέφοντες τὴν διάνοιαν.	Δημόκριτος μέν γάρ  φημί δέω ὅπως  εἴδωλον τυγχάνω καί ὁ  καί ὁ χρηστός μᾶλλον  ἐκ ὁ περιέχω τίη ὁ φαῦλος καί ὁ σκαιός  , λόγος  ἀληθής καί πρός ἀπέραντος  δεισιδαιμονία εἰς φιλοσοφία καταβάλλω  δέ ὁ περί ὁ ἱστορία  καί ὁ γραφή ὁ συνήθεια παρασκευάζω ἑαυτοῦ , ὁ ὁ ἄριστος καί δόκιμος μνήμη  ἀεί ὁ ψυχή , εἰ τι  τίη κακοήθης τίη ἀγεννής ὁ ὁ σύνειμι ἐκ ἀνάγκη ὁμιλία  , ἐκκρούω καί διωθέω , πρός ὁ καλός ὁ παράδειγμα  καί  ἀποστρέφω ὁ διάνοια .
947596	tlg0007.tlg018.perseus-grc2	ὧν ἐν τῷ παρόντι προκεχειρίσμεθά σοι τὸν Τιμολέοντος τοῦ Κορινθίου καὶ τὸν Αἰμιλίου Παύλου βίον, ἀνδρῶν οὐ μόνον ταῖς αἱρέσεσιν, ἀλλὰ καὶ ταῖς τύχαις ἀγαθαῖς ὁμοίως κεχρημένων ἐπὶ τὰ πράγματα, καὶ διαμφισβήτησιν παρεξόντων πότερον εὐποτμίᾳ, μᾶλλον ἢ φρονήσει τὰ μέγιστα τῶν πεπραγμένων κατώρθωσαν.	ὅς ἐν ὁ πάρειμι   ὁ Τιμολέων ὁ  καί ὁ Αἰμίλιος Παῦλος βίος , ἀνήρ οὐ μόνος ὁ αἵρεσις , ἀλλά καί ὁ τύχη ἀγαθός ὅμοιος  ἐπί ὁ πρᾶγμα , καί διαμφισβήτησις  πότερος  , μᾶλλον ἤ φρονέω ὁ μέγας ὁ πράσσω κατορθόω .
947597	tlg0007.tlg018.perseus-grc2	τὰ μὲν Συρακοσίων πράγματα πρὸ τῆς Τιμολέοντος εἰς Σικελίαν ἀποστολῆς οὕτως εἶχεν.	ὁ μέν  πρᾶγμα πρό ὁ Τιμολέων εἰς Σικελία ἀποστολή οὕτως ἔχω .
947598	tlg0007.tlg018.perseus-grc2	ἐπεὶ Δίων μὲν ἐξελάσας Διονύσιον τὸν τύραννον εὐθὺς ἀνῃρέθη δόλῳ καὶ διέστησαν οἱ σὺν Δίωνι Συρακοσίους ἐλευθερώσαντες, ἡ δὲ πόλις ἄλλον ἐξ ἄλλου μεταβάλλουσα συνεχῶς τύραννον ὑπὸ πλήθους κακῶν μικρὸν ἀπέλειπεν ἔρημος εἶναι, τῆς δʼ ἄλλης Σικελίας ἡ μὲν ἀνάστατος καὶ ἄπολις παντάπασιν ἤδη διὰ τοὺς πολέμους ὑπῆρχεν, αἱ δὲ πλεῖσται πόλεις ὑπὸ βαρβάρων μιγάδων καὶ στρατιωτῶν ἀμίσθων κατείχοντο, ῥᾳδίως προσιεμένων τὰς μεταβολὰς τῶν δυναστειῶν, Διονύσιος ἔτει δεκάτῳ ξένους συναγαγὼν καὶ τὸν τότε κρατοῦντα τῶν Συρακοσίων Νυσαῖον ἐξελάσας, ἀνέλαβε τὰ πράγματα πάλιν καὶ καθειστήκει τύραννος ἐξ ἀρχῆς, παραλόγως μὲν ὑπὸ μικρᾶς δυνάμεως τὴν μεγίστην τῶν πώποτε τυραννίδων ἀπολέσας, παραλογώτερον δʼ αὖθις ἐκ φυγάδος καὶ ταπεινοῦ τῶν ἐκβαλόντων κύριος γενόμενος.	Δίων μέν ἐξελαύνω Διονύσιος ὁ τύραννος εὐθύς ἀναιρέω δόλος καί διΐστημι ὁ σύν Δίων  ἐλευθερόω , ὁ δέ πόλις ἄλλος ἐκ ἄλλος  συνεχής τύραννος ὑπό πλῆθος κακός μικρός ἀπολείπω ἐρῆμος εἰμί , ὁ δέ ἄλλος Σικελία ὁ μέν ἀνάστατος καί ἄπολις παντάπασι ἤδη διά ὁ πόλεμος ὑπάρχω , ὁ δέ πλεῖστος πόλις ὑπό βάρβαρος μιγάς καί στρατιώτης  κατέχω , ῥᾴδιος προσίημι ὁ μεταβολή ὁ δυναστεία , Διονύσιος ἔτος δέκατος ξένος συνάγω καί ὁ τότε κρατέω ὁ   ἐξελαύνω , ἀναλαμβάνω ὁ πρᾶγμα πάλιν καί καθίστημι τύραννος ἐκ ἀρχή , παράλογος μέν ὑπό μικρός δύναμις ὁ μέγας ὁ πώποτε τυραννίς ἀπόλλυμι , παράλογος δέ αὖθις ἐκ φυγάς καί  ὁ  κύριος2 γίγνομαι .
947599	tlg0007.tlg018.perseus-grc2	οἱ μὲν οὖν ὑπομείναντες ἐν τῇ πόλει τῶν Συρακοσίων ἐδούλευον οὔτʼ ἄλλως ἐπιεικεῖ τυράννῳ καὶ τότε παντάπασιν ὑπὸ συμφορῶν ἀπηγριωμένῳ τὴν ψυχήν, οἱ δὲ βέλτιστοι καὶ γνωριμώτατοι πρὸς Ἱκέτην τραπέντες τὸν δυναστεύοντα τῶν Λεοντίνων ἐπέτρεψαν αὑτοὺς ἐκείνῳ καὶ στρατηγὸν εἵλοντο τοῦ πολέμου, βελτίω μὲν οὐδενὸς ὄντα τῶν ὁμολογουμένως τυράννων, ἑτέραν δʼ οὐκ ἔχοντες ἀποστροφὴν, καὶ πιστεύσαντες Συρακουσίῳ τὸ γένος ὄντι καὶ κεκτημένῳ δύναμιν ἀξιόμαχον πρὸς τὸν τύραννον.	ὁ μέν οὖν ὑπομένω ἐν ὁ πόλις ὁ  δουλεύω  ἄλλος ἐπιεικής τύραννος καί τότε παντάπασι ὑπό συμφορά  ὁ ψυχή , ὁ δέ βέλτιστος καί γνώριμος πρός  τέρπω ὁ δυναστεύω ὁ Λεοντῖνοι ἐπιτρέπω ἑαυτοῦ ἐκεῖνος καί στρατηγός αἱρέω ὁ πόλεμος , βελτίων μέν  εἰμί ὁ ὁμολογέω τύραννος , ἕτερος δέ οὐ ἔχω ἀποστροφή , καί πιστεύω  ὁ γένος εἰμί καί  δύναμις ἀξιόμαχος πρός ὁ τύραννος .
947600	tlg0007.tlg018.perseus-grc2	ἐν τούτῳ δὲ Καρχηδονίων στόλῳ μεγάλῳ παραγενομένων εἰς Σικελίαν καὶ τοῖς πράγμασιν ἐπαιωρουμένων φοβηθέντες οἱ Σικελιῶται πρεσβείαν ἐβούλοντο πέμπειν εἰς τὴν Ἑλλάδα καὶ παρὰ Κορινθίων βοήθειαν αἰτεῖν, οὐ μόνον διὰ τὴν συγγένειαν οὐδʼ ἀφʼ ὧν ἤδη πολλάκις εὐεργέτηντο πιστεύοντες ἐκείνοις, ἀλλὰ καὶ καθόλου τὴν πόλιν ὁρῶντες φιλελεύθερον καὶ μισοτύραννον οὖσαν ἀεί, καὶ τῶν πολέμων τοὺς πλείστους καὶ μεγίστους πεπολεμηκυῖαν οὐχ ὑπὲρ ἡγεμονίας καὶ πλεονεξίας, ἀλλʼ ὑπὲρ τῆς τῶν Ἑλλήνων ἐλευθερίας.	ἐν οὗτος δέ  στόλος μέγας παραγίγνομαι εἰς Σικελία καί ὁ πρᾶγμα  φοβέω ὁ Σικελιώτης πρεσβεία βούλομαι πέμπω εἰς ὁ Ἑλλάς καί παρά  βοήθεια αἰτέω , οὐ μόνος διά ὁ συγγένεια οὐδέ ἀπό ὅς ἤδη πολλάκις εὐεργετέω πιστεύω ἐκεῖνος , ἀλλά καί καθόλου ὁ πόλις ὁράω  καί  εἰμί ἀεί , καί ὁ πόλεμος ὁ πλεῖστος καί μέγας πολεμέω οὐ ὑπέρ ἡγεμονία καί πλεονεξία , ἀλλά ὑπέρ ὁ ὁ Ἕλλην ἐλευθερία .
947601	tlg0007.tlg018.perseus-grc2	ὁ δʼ Ἱκέτης, ἅτε δὴ τῆς στρατηγίας ὑπόθεσιν τὴν τυραννίδα πεποιημένος, οὐ τὴν Συρακουσίων ἐλευθερίαν, κρύφα μὲν ἤδη πρὸς τοὺς Καρχηδονίους διείλεκτο, φανερῶς δὲ τοὺς Συρακουσίους ἐπῄνει καὶ τοὺς πρέσβεις εἰς Πελοπόννησον συνεξέπεμψεν, οὐ βουλόμενος ἐλθεῖν συμμαχίαν ἐκεῖθεν, ἀλλʼ ἐάν, ὅπερ εἰκὸς ἦν, οἱ Κορίνθιοι διὰ τὰς Ἑλληνικὰς ταραχὰς καὶ ἀσχολίας ἀπείπωσι τὴν βοήθειαν, ἐλπίζων ῥᾷον ἐπὶ τοὺς Καρχηδονίους τὰ πράγματα μετάξειν καὶ χρήσεσθαι συμμάχοις καὶ συναγωνισταῖς ἐκείνοις ἐπὶ τοὺς Συρακουσίους ἢ κατὰ τοῦ τυράννου, ταῦτα μὲν οὖν ὀλίγον ὕστερον ἐξηλέγχθη.	ὁ δέ  ,  δή ὁ στρατηγία ὑπόθεσις ὁ τυραννίς ποιέω , οὐ ὁ  ἐλευθερία , κρύφα μέν ἤδη πρός ὁ  λέγω , φανερός δέ ὁ  ἐπαινέω καί ὁ πρέσβυς εἰς Πελοπόννησος συνεκπέμπω , οὐ  ἔρχομαι συμμαχία ἐκεῖθεν ,  ἐάν , ὅς ἔοικα εἰμί , ὁ  διά ὁ Ἑλληνικός ταραχή καί ἀσχολία  ὁ βοήθεια , ἐλπίζω ῥᾴδιος ἐπί ὁ  ὁ πρᾶγμα μετάγω καί χράομαι σύμμαχος καί συναγωνιστής ἐκεῖνος ἐπί ὁ  ἤ κατά ὁ τύραννος , οὗτος μέν οὖν ὀλίγος ὕστερον ἐξελέγχω .
947602	tlg0007.tlg018.perseus-grc2	τῶν δὲ πρέσβεων παραγενομένων, οἱ Κορίνθιοι, κήδεσθαι μὲν ἀεὶ τῶν ἀποικίδων πόλεων καὶ μάλιστα τῆς Συρακουσίων εἰωθότες, οὐδενὸς δʼ αὐτοὺς τότε τῶν Ἑλληνικῶν κατὰ τύχην παρενοχλοῦντος, ἀλλʼ ἐν εἰρήνῃ καὶ σχολῇ διάγοντες, ἐψηφίσαντο προθύμως βοηθεῖν.	ὁ δέ πρέσβυς παραγίγνομαι , ὁ  , κήδω μέν ἀεί ὁ ἀποικίς πόλις καί μάλιστα ὁ  εἴωθα ,  δέ αὐτός τότε ὁ Ἑλληνικός κατά τύχη παρενοχλέω ,  ἐν εἰρήνη καί σχολή διάγω , ψηφίζω πρόθυμος βοηθέω .
947603	tlg0007.tlg018.perseus-grc2	ζητουμένου δὲ στρατηγοῦ καὶ τῶν ἀρχόντων γραφόντων καὶ προβαλλομένων τοὺς εὐδοκιμεῖν ἐν τῇ πόλει σπουδάζοντας, εἷς ἐκ τῶν πολλῶν ἀναστὰς ὠνόμασε Τιμολέοντα τὸν Τιμοδήμου, μήτε προσιόντα τοῖς κοινοῖς ἔτι μήτε ἐλπίδος τοιαύτης γενόμενον ἢ προαιρέσεως, ἀλλὰ θεοῦ τινος, ὡς ἔοικεν, εἷς νοῦν ἐμβαλόντος τῷ ἀνθρώπῳ·	ζητέω δέ στρατηγός καί ὁ ἄρχων γράφω καί προβάλλω ὁ εὐδοκιμέω ἐν ὁ πόλις σπουδάζω ,  ἐκ ὁ πολύς ἀνίστημι ὀνομάζω Τιμολέων ὁ  , μήτε πρόσειμι2 ὁ κοινός ἔτι  ἐλπίς τοιοῦτος γίγνομαι ἤ προαίρεσις , ἀλλά θεός  , ὡς ἔοικα ,  νόος ἐμβάλλω τῷ ἄνθρωπος ·
947604	tlg0007.tlg018.perseus-grc2	τοσαύτη καὶ περὶ τὴν αἵρεσιν εὐθὺς ἔλαμψε τύχης εὐμένεια καὶ ταῖς ἄλλαις πράξεσιν ἐπηκολούθησε χάρις ἐπικοσμοῦσα τὴν ἀρετὴν τοῦ ἀνδρός.	τοσοῦτος καί περί ὁ αἵρεσις εὐθύς λάμπω τύχη εὐμένεια καί ὁ ἄλλος πρᾶξις ἐπακολουθέω χάρις  ὁ ἀρετή ὁ ἀνήρ .
947605	tlg0007.tlg018.perseus-grc2	ἦν μὲν οὖν γονέων ἐπιφανῶν ἐν τῇ πόλει, Τιμοδήμου καὶ Δημαρίστης, φιλόπατρις δὲ καὶ πρᾷος διαφερόντως ὅσα μὴ σφόδρα μισοτύραννος εἶναι καὶ μισοπόνηρος.	εἰμί μέν οὖν γονεύς ἐπιφανής ἐν ὁ πόλις ,  καί  , φιλόπατρις δέ καί πρᾶος διαφερόντως ὅσος μή σφόδρα  εἰμί καί μισοπόνηρος .
947606	tlg0007.tlg018.perseus-grc2	ἐν δὲ τοῖς πολέμοις οὕτω καλῶς καὶ ὁμαλῶς ἐκέκρατο τὴν φύσιν ὥστε πολλὴν μὲν ἐν νέῳ σύνεσιν, οὐκ ἐλάττω δὲ γηρῶντος ἀνδρείαν ἐπιφαίνεσθαι ταῖς πράξεσιν.	ἐν δέ ὁ πόλεμος οὕτως καλός καί ὁμαλός  ὁ φύσις ὥστε πολύς μέν ἐν νέος σύνεσις , οὐ ἐλάσσων δέ  ἀνδρεία ἐπιφαίνω ὁ πρᾶξις .
947607	tlg0007.tlg018.perseus-grc2	ἀδελφὸν δʼ εἶχε Τιμοφάνην, πρεσβύτερον, οὐδὲν αὐτῷ προσόμοιον, ἀλλʼ ἔμπληκτον καὶ διεφθαρμένον ἔρωτι μοναρχίας ὑπὸ φίλων φαύλων καὶ ξένων στρατιωτικῶν ἀεὶ περὶ αὐτὸν ὄντων, ἔχειν τι δοκοῦντα ῥαγδαῖον ἐν ταῖς στρατείαις καὶ φιλοκίνδυνον.	ἀδελφός δέ ἔχω  , πρέσβυς ,  αὐτός προσόμοιος ,  ἔμπληκτος καί διαφθείρω  μοναρχία ὑπό φίλος  καί ξένος στρατιωτικός ἀεί περί αὐτός εἰμί , ἔχω τι δοκέω  ἐν ὁ στρατεία καί φιλοκίνδυνος .
947608	tlg0007.tlg018.perseus-grc2	ᾧ καὶ τοὺς πολίτας προσαγόμενος ὡς ἀνὴρ πολεμικὸς καὶ δραστήριος ἐφʼ ἡγεμονιῶν ἐτάττετο.	ὅς καί ὁ πολίτης  ὡς ἀνήρ πολεμικός καί δραστήριος ἐπί  τάσσω .
947609	tlg0007.tlg018.perseus-grc2	καὶ πρὸς ταῦτα Τιμολέων αὐτῷ συνήργει, τὰ μὲν ἁμαρτήματα παντάπασιν ἀποκρύπτων ἢ μικρὰ φαίνεσθαι ποιῶν, ἃ δʼ ἡ φύσις ἐξέφερεν ἀστεῖα κατακοσμῶν καὶ συναύξων.	καί πρός οὗτος  αὐτός  , ὁ μέν ἁμάρτημα παντάπασι ἀποκρύπτω τίη μικρός φαίνω ποιέω , ὅς δέ ὁ φύσις ἐκφέρω ἀστεῖος  καί  .
947610	tlg0007.tlg018.perseus-grc2	ἐν δὲ τῇ πρὸς Ἀργείους καὶ Κλεωναίους μάχῃ τῶν Κορινθίων ὁ μὲν Τιμολέων ἔτυχεν ἐν τοῖς ὁπλίταις τεταγμένος, τὸν δὲ Τιμοφάνην τῶν ἱππέων ἡγούμενον καταλαμβάνει κίνδυνος ὀξύς.	ἐν δέ ὁ πρός  καί  μάχη ὁ  ὁ μέν Τιμολέων τυγχάνω ἐν ὁ ὁπλίτης τάσσω , ὁ δέ  ὁ ἱππεύς  καταλαμβάνω κίνδυνος ὀξύς2 .
947611	tlg0007.tlg018.perseus-grc2	ὁ γὰρ ἵππος αὐτὸν ἀπεσείσατο πληγῇ περιπεσὼν εἰς τοὺς πολεμίους, καὶ τῶν ἑταίρων οἱ μὲν εὐθὺς ἐσκορπίσθησαν φοβηθέντες, οἱ δὲ παραμείναντες ὀλίγοι πρὸς πολλοὺς μαχόμενοι χαλεπῶς ἀντεῖχον.	ὁ γάρ ἵππος αὐτός ἀποσείω πληγή περιπίπτω εἰς ὁ πολέμιος , καί ὁ ἑταῖρος ὁ μέν εὐθύς  φοβέω , ὁ δέ παραμένω ὀλίγος πρός πολύς  χαλεπός ἀντέχω .
947612	tlg0007.tlg018.perseus-grc2	ὡς οὖν ὁ Τιμολέων κατεῖδε τὸ συμβεβηκός, δρόμῳ προσβοηθήσας καὶ τὴν ἀσπίδα τοῦ Τιμοφάνους κειμένου προθέμενος, καὶ πολλὰ μὲν ἀκοντίσματα, πολλὰς δὲ πληγὰς ἐκ χειρὸς ἀναδεξάμενος εἰς τὸ σῶμα καὶ τὰ ὅπλα, μόλις ἐώσατο τοὺς πολεμίους καὶ διέσωσε τὸν ἀδελφόν.	ὡς οὖν ὁ Τιμολέων καθοράω ὁ  , δρόμος  καί ὁ ἀσπίς ὁ Τιμοφάνης   , καί πολύς μέν ἀκόντισμα , πολύς δέ πληγή ἐκ χείρ ἀναδέχομαι εἰς ὁ σῶμα καί ὁ ὅπλον , μόλις  ὁ πολέμιος καί διασῴζω ὁ ἀδελφός .
947613	tlg0007.tlg018.perseus-grc2	ἐπεὶ δʼ οἱ Κορίνθιοι δεδιότες μὴ πάθοιεν οἷα καὶ πρότερον ὑπὸ τῶν συμμάχων ἀποβαλόντες τὴν πόλιν, ἐψηφίσαντο τρέφειν ξένους τετρακοσίους καὶ τούτων ἄρχοντα Τιμοφάνην κατέστησαν, ὁ δὲ τῶν καλῶν καὶ δικαίων ὑπεριδὼν εὐθὺς ἐπέραινεν ἐξ ὧν ποιήσεται τὴν πόλινὑφʼ αὐτῷ, καὶ συχνοὺς ἀνελὼν ἀκρίτους τῶν πρώτων πολιτῶν ἀνέδειξεν αὐτὸς ἑαυτὸν τύραννον, βαρέως φέρων ὁ Τιμολέων, καὶ συμφορὰν ποιούμενος ἑαυτοῦ τὴν ἐκείνου κακίαν, ἐπεχείρησε μὲν αὐτῷ διαλέγεσθαι καὶ παρακαλεῖν ἀφέντα τὴν μανίαν καὶ δυστυχίαν τῆς ἐπιθυμίας ἐκείνης ζητεῖν τινα τῶν ἡμαρτημένων ἐπανόρθωσιν πρὸς τοὺς πολίτας, ἀπωσαμένου δʼ ἐκείνου καὶ καταφρονήσαντος, οὕτω παραλαβὼν τῶν μὲν οἰκείων Αἰσχύλον, ἀδελφόν ὄντα τῆς Τιμοφάνους γυναικός, τῶν δὲ φίλων τὸν μάντιν ὃν Σάτυρον μὲν Θεόπομπος, Ἔφορος δὲ καὶ Τίμαιος Ὀρθαγόραν ὀνομάζουσι, καὶ διαλιπὼν ἡμέρας ὀλίγας αὖθις ἀνέβη πρὸς τὸν ἀδελφόν καὶ περιστάντες αὐτὸν οἱ τρεῖς καθικέτευον ἀλλὰ νῦν γε χρησάμενον λογισμῷ μεταβαλέσθαι.	ἐπεί δέ ὁ  δείδω μή πάσχω οἷος καί πρότερος ὑπό ὁ  ἀποβάλλω ὁ πόλις , ψηφίζω τρέφω ξένος τετρακόσιοι καί οὗτος ἄρχω  καθίστημι , ὁ δέ ὁ καλός καί δίκαιος ὑπεροράω εὐθύς ἐπιρραίνω ἐκ ὅς ποιέω ὁ πόλις ὑφʼ αὐτός , καί συχνός ἀναιρέω ἄκριτος ὁ πρῶτος πολίτης ἀναδείκνυμι αὐτός  τύραννος , βαρύς φέρω ὁ Τιμολέων , καί συμφορά ποιέω ἑαυτοῦ ὁ ἐκεῖνος κακία , ἐπιχειρέω μέν αὐτός διαλέγω καί παρακαλέω  ὁ μανία καί δυστυχία ὁ ἐπιθυμία ἐκεῖνος ζητέω τις ὁ ἁμαρτάνω  πρός ὁ πολίτης , ἀπωθέω δέ ἐκεῖνος καί καταφρονέω , οὕτως παραλαμβάνω ὁ μέν οἰκεῖος Αἰσχύλος , ἀδελφός εἰμί ὁ Τιμοφάνης γυνή , ὁ δέ  ὁ μάντις ὅς Σάτυρος μέν Θεόπομπος , Ἔφορος δέ καί Τίμαιος  ὀνομάζω , καί διαλείπω ἡμέρα ὀλίγος αὖθις ἀναβαίνω πρός ὁ ἀδελφός καί περιίστημι αὐτός ὁ  καθικετεύω ἀλλά νῦν γε  λογισμός μεταβάλλω .
947614	tlg0007.tlg018.perseus-grc2	τοῦ δὲ Τιμοφάνους πρῶτον μὲν αὐτῶν καταγελῶντος, ἔπειτα δὲ πρὸς ὀργὴν ἐκφερομένου καὶ χαλεπαίνοντος, ὁ μὲν Τιμολέων ἀποχωρήσας μικρὸν αὐτοῦ καὶ συγκαλυψάμενος εἱστήκει δακρύων, ἐκεῖνοι δὲ τὰ ξίφη σπασάμενοι ταχὺ διαφθείρουσιν αὐτόν.	ὁ δέ Τιμοφάνης πρῶτος μέν αὐτός  , ἔπειτα δέ πρός ὀργή  καί χαλεπαίνω , ὁ μέν Τιμολέων ἀποχωρέω μικρός αὐτός καί  ἵστημι δάκρυον , ἐκεῖνος δέ ὁ ξίφος  ταχύς διαφθείρω αὐτός .
