id	filename	tokens	lemmas
183704	tlg0031.tlg004.perseus-grc2	οὐκέτι λέγω ὑμᾶς δούλους, ὅτι ὁ δοῦλος οὐκ οἶδεν τί ποιεῖ αὐτοῦ ὁ κύριος·	οὐκέτι λέγω  δοῦλος , ὅτι2 ὁ δοῦλος οὐ οἶδα τι ποιέω αὐτός ὁ κύριος2 ·
183705	tlg0031.tlg004.perseus-grc2	ὑμᾶς δὲ εἴρηκα φίλους, ὅτι πάντα ἃ ἤκουσα παρὰ τοῦ πατρός μου ἐγνώρισα ὑμῖν.	σύ δέ λέγω φίλος , ὅτι2 πᾶς ὅς ἀκούω παρά ὁ πατήρ  γνωρίζω  .
183706	tlg0031.tlg004.perseus-grc2	οὐχ ὑμεῖς με ἐξελέξασθε, ἀλλʼ ἐγὼ ἐξελεξάμην ὑμᾶς, καὶ ἔθηκα ὑμᾶς ἵνα ὑμεῖς ὑπάγητε καὶ καρπὸν φέρητε καὶ ὁ καρπὸς ὑμῶν μένῃ, ἵνα ὅτι ἂν αἰτήσητε τὸν πατέρα ἐν τῷ ὀνόματί μου δῷ ὑμῖν.	οὐ    , ἀλλά  ἐκλέγω  , καί τίθημι  ἵνα σύ  καί καρπός  καί ὁ καρπός ὑμός μένω , ἵνα ὅτι ἄν αἰτέω ὁ πατήρ ἐν ὁ ὄνομα  δίδωμι  .
183707	tlg0031.tlg004.perseus-grc2	Ταῦτα ἐντέλλομαι ὑμῖν ἵνα ἀγαπᾶτε ἀλλήλους.	ἐντέλλω  ἵνα  ἀλλήλων .
183708	tlg0031.tlg004.perseus-grc2	Εἰ ὁ κόσμος ὑμᾶς μισεῖ, γινώσκετε ὅτι ἐμὲ πρῶτον ὑμῶν μεμίσηκεν.	εἰ ὁ κόσμος  μισέω , γιγνώσκω ὅτι2  πρῶτος ὑμός μισέω .
183709	tlg0031.tlg004.perseus-grc2	εἰ ἐκ τοῦ κόσμου ἦτε, ὁ κόσμος ἂν τὸ ἴδιον ἐφίλει·	εἰ ἐκ ὁ κόσμος εἰμί , ὁ κόσμος ἄν ὁ ἴδιος φιλέω ·
183710	tlg0031.tlg004.perseus-grc2	ὅτι δὲ ἐκ τοῦ κόσμου οὐκ ἐστέ, ἀλλʼ ἐγὼ ἐξελεξάμην ὑμᾶς ἐκ τοῦ κόσμου, διὰ τοῦτο μισεῖ ὑμᾶς ὁ κόσμος.	ὅτι2 δέ ἐκ ὁ  οὐ εἰμί , ἀλλά  ἐκλέγω  ἐκ ὁ  , διά οὗτος μισέω  ὁ κόσμος .
183711	tlg0031.tlg004.perseus-grc2	μνημονεύετε τοῦ λόγου οὗ ἐγὼ εἶπον ὑμῖν Οὐκ ἔστιν δοῦλος μείζων τοῦ κυρίου αὐτοῦ·	μνημονεύω ὁ λόγος οὗ  λέγω   εἰμί δοῦλος μέγας ὁ κύριος αὐτός ·
183712	tlg0031.tlg004.perseus-grc2	εἰ ἐμὲ ἐδίωξαν, καὶ ὑμᾶς διώξουσιν·	εἰ  διώκω , καί   ·
183713	tlg0031.tlg004.perseus-grc2	εἰ τὸν λόγον μου ἐτήρησαν, καὶ τὸν ὑμέτερον τηρήσουσιν.	εἰ ὁ λόγος ἐγώ τηρέω , καί ὁ ὑμέτερος  .
183714	tlg0031.tlg004.perseus-grc2	ἀλλὰ ταῦτα πάντα ποιήσουσιν εἰς ὑμᾶς διὰ τὸ ὄνομά μου, ὅτι οὐκ οἴδασιν τὸν πέμψαντά με.	ἀλλά οὗτος πᾶς ποιέω εἰς  διά ὁ ὄνομα  , ὅτι2 οὐ  ὁ πέμπω  .
183715	tlg0031.tlg004.perseus-grc2	Εἰ μὴ ἦλθον καὶ ἐλάλησα αὐτοῖς, ἁμαρτίαν οὐκ εἴχοσαν·	εἰ μή ἔρχομαι καί λαλέω αὐτός , ἁμαρτία οὐ  ·
183716	tlg0031.tlg004.perseus-grc2	νῦν δὲ πρόφασιν οὐκ ἔχουσιν περὶ τῆς ἁμαρτίας αὐτῶν.	νῦν δέ πρόφασις οὐ ἔχω περί ὁ ἁμαρτία αὐτός .
183717	tlg0031.tlg004.perseus-grc2	ὁ ἐμὲ μισῶν καὶ τὸν πατέρα μου μισεῖ.	ὁ  μισέω καί ὁ πατήρ ἐγώ μισέω .
183718	tlg0031.tlg004.perseus-grc2	εἰ τὰ ἔργα μὴ ἐποίησα ἐν αὐτοῖς ἃ οὐδεὶς ἄλλος ἐποίησεν, ἁμαρτίαν οὐκ εἴχοσαν·	εἰ ὁ ἔργον μή ποιέω ἐν αὐτός ὅς  ἄλλος ποιέω , ἁμαρτία οὐ  ·
183719	tlg0031.tlg004.perseus-grc2	νῦν δὲ καὶ ἑωράκασιν καὶ μεμισήκασιν καὶ ἐμὲ καὶ τὸν πατέρα μου.	νῦν δέ καί ὁράω καί μισέω καί  καί ὁ πατήρ  .
183720	tlg0031.tlg004.perseus-grc2	ἀλλʼ ἵνα πληρωθῇ ὁ λόγος ὁ ἐν τῷ νόμῳ αὐτῶν γεγραμμένος ὅτι Ἐμίσησάν με δωρεάν.	ἵνα  ὁ λόγος ὁ ἐν ὁ νόμος αὐτός γράφω ὅτι2 μισέω  δωρεά .
183721	tlg0031.tlg004.perseus-grc2	Ὅταν ἔλθῃ ὁ παράκλητος ὃν ἐγὼ πέμψω ὑμῖν παρὰ τοῦ πατρός, τὸ πνεῦμα τῆς ἀληθείας ὃ παρὰ τοῦ πατρὸς ἐκπορεύεται, ἐκεῖνος μαρτυρήσει περὶ ἐμοῦ·	ἔρχομαι ὁ παράκλητος ὅς  πέμπω  παρά ὁ πατήρ , ὁ πνεῦμα ὁ ἀλήθεια ὅς παρά ὁ πατήρ ἐκπορεύω , ἐκεῖνος μαρτυρέω περί  ·
183722	tlg0031.tlg004.perseus-grc2	καὶ ὑμεῖς δὲ μαρτυρεῖτε, ὅτι ἀπʼ ἀρχῆς μετʼ ἐμοῦ ἐστέ.	καί  δέ  , ὅτι2 ἀπό ἀρχή μετά  εἰμί .
183723	tlg0031.tlg004.perseus-grc2	Ταῦτα λελάληκα ὑμῖν ἵνα μὴ σκανδαλισθῆτε.	ἵνα μή σκανδαλίζω .
183724	tlg0031.tlg004.perseus-grc2	ἀποσυναγώγους ποιήσουσιν ὑμᾶς·	ἀποσυνάγωγος  σύ ·
183725	tlg0031.tlg004.perseus-grc2	ἀλλʼ ἔρχεται ὥρα ἵνα πᾶς ὁ ἀποκτείνας ὑμᾶς δόξῃ λατρείαν προσφέρειν τῷ θεῷ.	ἔρχομαι ὥρα2 ἵνα πᾶς ὁ ἀποκτείνω  δόξα λατρεία προσφέρω ὁ θεός .
183726	tlg0031.tlg004.perseus-grc2	καὶ ταῦτα ποιήσουσιν ὅτι οὐκ ἔγνωσαν τὸν πατέρα οὐδὲ ἐμέ.	καί οὗτος  ὅτι2 οὐ γιγνώσκω ὁ πατήρ οὐδέ  .
183727	tlg0031.tlg004.perseus-grc2	ἀλλὰ ταῦτα λελάληκα ὑμῖν ἵνα ὅταν ἔλθῃ ἡ ὥρα αὐτῶν μνημονεύητε αὐτῶν ὅτι ἐγὼ εἶπον ὑμῖν·	ἀλλά οὗτος λαλέω  ἵνα ὅταν ἔρχομαι ὁ ὥρα2 αὐτός  αὐτός ὅτι2  λέγω  ·
183728	tlg0031.tlg004.perseus-grc2	ταῦτα δὲ ὑμῖν ἐξ ἀρχῆς οὐκ εἶπον, ὅτι μεθʼ ὑμῶν ἤμην.	οὗτος δέ σύ ἐκ ἀρχή οὐ λέγω , ὅτι2 μετά   .
183729	tlg0031.tlg004.perseus-grc2	νῦν δὲ ὑπάγω πρὸς τὸν πέμψαντά με καὶ οὐδεὶς ἐξ ὑμῶν ἐρωτᾷ με Ποῦ ὑπάγεις;	νῦν δέ ὑπάγω πρός ὁ   καί οὐδείς ἐκ ὑμός ἐρωτάω   ὑπάγω ;
183730	tlg0031.tlg004.perseus-grc2	ἀλλʼ ὅτι ταῦτα λελάληκα ὑμῖν ἡ λύπη πεπλήρωκεν ὑμῶν τὴν καρδίαν.	ὅτι2 οὗτος λαλέω σύ ὁ λύπη πληρόω ὑμός ὁ καρδία .
183731	tlg0031.tlg004.perseus-grc2	ἀλλʼ ἐγὼ τὴν ἀλήθειαν λέγω ὑμῖν, συμφέρει ὑμῖν ἵνα ἐγὼ ἀπέλθω.	ὁ ἀλήθεια λέγω  , συμφέρω  ἵνα  ἀπέρχομαι .
183732	tlg0031.tlg004.perseus-grc2	ἐὰν γὰρ μὴ ἀπέλθω, ὁ παράκλητος οὐ μὴ ἔλθῃ πρὸς ὑμᾶς·	ἐάν γάρ μή ἀπέρχομαι , ὁ παράκλητος οὐ μή ἔρχομαι πρός σύ ·
183733	tlg0031.tlg004.perseus-grc2	ἐὰν δὲ πορευθῶ, πέμψω αὐτὸν πρὸς ὑμᾶς.	ἐάν δέ  , πέμπω αὐτός πρός  .
183734	tlg0031.tlg004.perseus-grc2	Καὶ ἐλθὼν ἐκεῖνος ἐλέγξει τὸν κόσμον περὶ ἁμαρτίας καὶ περὶ δικαιοσύνης καὶ περὶ κρίσεως·	καί ἔρχομαι ἐκεῖνος ἐλέγχω ὁ κόσμος περί ἁμαρτία καί περί δικαιοσύνη καί περί κρίσις ·
183735	tlg0031.tlg004.perseus-grc2	περὶ ἁμαρτίας μέν, ὅτι οὐ πιστεύουσιν εἰς ἐμέ·	περί ἁμαρτία μέν , ὅτι2 οὐ πιστεύω εἰς  ·
183736	tlg0031.tlg004.perseus-grc2	περὶ δικαιοσύνης δέ, ὅτι πρὸς τὸν πατέρα ὑπάγω καὶ οὐκέτι θεωρεῖτέ με·	περί δικαιοσύνη δέ , ὅτι2 πρός ὁ πατήρ ὑπάγω καί οὐκέτι   ·
183737	tlg0031.tlg004.perseus-grc2	περὶ δὲ κρίσεως, ὅτι ὁ ἄρχων τοῦ κόσμου τούτου κέκριται.	περί δέ κρίσις , ὅτι2 ὁ ἄρχω ὁ  οὗτος κρίνω .
183738	tlg0031.tlg004.perseus-grc2	Ἔτι πολλὰ ἔχω ὑμῖν λέγειν, ἀλλʼ οὐ δύνασθε βαστάζειν ἄρτι·	ἔτι πολύς ἔχω  λέγω , ἀλλά οὐ δύναμαι βαστάζω ἄρτι ·
183739	tlg0031.tlg004.perseus-grc2	ὅταν δὲ ἔλθῃ ἐκεῖνος, τὸ πνεῦμα τῆς ἀληθείας, ὁδηγήσει ὑμᾶς εἰς τὴν ἀλήθειαν πᾶσαν, οὐ γὰρ λαλήσει ἀφʼ ἑαυτοῦ, ἀλλʼ ὅσα ἀκούει λαλήσει, καὶ τὰ ἐρχόμενα ἀναγγελεῖ ὑμῖν.	ὅταν δέ ἔρχομαι ἐκεῖνος , ὁ πνεῦμα ὁ ἀλήθεια , ὁδηγέω  εἰς ὁ ἀλήθεια πᾶς , οὐ γάρ λαλέω  ἑαυτοῦ ,  ὅσος ἀκούω λαλέω , καί ὁ    .
183740	tlg0031.tlg004.perseus-grc2	ἐκεῖνος ἐμὲ δοξάσει, ὅτι ἐκ τοῦ ἐμοῦ λήμψεται καὶ ἀναγγελεῖ ὑμῖν.	ἐκεῖνος  δοξάζω , ὅτι2 ἐκ ὁ  λαμβάνω καί   .
183741	tlg0031.tlg004.perseus-grc2	πάντα ὅσα ἔχει ὁ πατὴρ ἐμά ἐστιν·	πᾶς ὅσος ἔχω ὁ πατήρ  εἰμί ·
183742	tlg0031.tlg004.perseus-grc2	διὰ τοῦτο εἶπον ὅτι ἐκ τοῦ ἐμοῦ λαμβάνει καὶ ἀναγγελεῖ ὑμῖν.	διά οὗτος λέγω ὅτι2 ἐκ ὁ  λαμβάνω καί   .
183743	tlg0031.tlg004.perseus-grc2	Μικρὸν καὶ οὐκέτι θεωρεῖτέ με, καὶ πάλιν μικρὸν καὶ ὄψεσθέ με.	καί οὐκέτι  ἐγώ , καί πάλιν μικρός καί   .
183744	tlg0031.tlg004.perseus-grc2	Εἶπαν οὖν ἐκ τῶν μαθητῶν αὐτοῦ πρὸς ἀλλήλους Τί ἐστιν τοῦτο ὃ λέγει ἡμῖν Μικρὸν καὶ οὐ θεωρεῖτέ με, καὶ πάλιν μικρὸν καὶ ὄψεσθέ με;	οὖν ἐκ ὁ μαθητός αὐτός πρός ἀλλήλων  εἰμί οὗτος ὅς λέγω   καί οὐ   , καί πάλιν μικρός καί   ;
183745	tlg0031.tlg004.perseus-grc2	καί Ὅτι ὑπάγω πρὸς τὸν πατέρα;	καί ὅτι2 ὑπάγω πρός ὁ πατήρ ;
183746	tlg0031.tlg004.perseus-grc2	ἔλεγον οὖν Τί ἐστιν τοῦτο ὃ λέγει μικρόν;	λέγω οὖν  εἰμί οὗτος ὅς λέγω μικρός ;
183747	tlg0031.tlg004.perseus-grc2	οὐκ οἴδαμεν τί λαλεῖ.	οὐ οἶδα τι λαλέω .
183748	tlg0031.tlg004.perseus-grc2	ἔγνω Ἰησοῦς ὅτι ἤθελον αὐτὸν ἐρωτᾷν, καὶ εἶπεν αὐτοῖς Περὶ τούτου ζητεῖτε μετʼ ἀλλήλων ὅτι εἶπον Μικρὸν καὶ οὐ θεωρεῖτέ με, καὶ πάλιν μικρὸν καὶ ὄψεσθέ με;	γιγνώσκω  ὅτι2 ἐθέλω αὐτός  , καί λέγω αὐτός περί οὗτος ζητέω μετά ἀλλήλων ὅτι2 λέγω  καί οὐ   , καί πάλιν μικρός καί   ;
183749	tlg0031.tlg004.perseus-grc2	ἀμὴν ἀμὴν λέγω ὑμῖν ὅτι κλαύσετε καὶ θρηνήσετε ὑμεῖς, ὁ δὲ κόσμος χαρήσεται·	λέγω  ὅτι2  καί θρηνέω  , ὁ δέ κόσμος χαίρω ·
183750	tlg0031.tlg004.perseus-grc2	ὑμεῖς λυπηθήσεσθε, ἀλλʼ ἡ λύπη ὑμῶν εἰς χαρὰν γενήσεται.	σύ  ,  ὁ λύπη ὑμός εἰς χαρά γίγνομαι .
183751	tlg0031.tlg004.perseus-grc2	ἡ γυνὴ ὅταν τίκτῃ λύπην ἔχει, ὅτι ἦλθεν ἡ ὥρα αὐτῆς·	ὁ γυνή ὅταν τίκτω λύπη ἔχω , ὅτι2 ἔρχομαι ὁ ὥρα2 αὐτός ·
183752	tlg0031.tlg004.perseus-grc2	ὅταν δὲ γεννήσῃ τὸ παιδίον, οὐκέτι μνημονεύει τῆς θλίψεως διὰ τὴν χαρὰν ὅτι ἐγεννήθη ἄνθρωπος εἰς τὸν κόσμον.	ὅταν δέ γεννάω ὁ παιδίον , οὐκέτι μνημονεύω ὁ θλῖψις διά ὁ χαρά ὅτι2 γεννάω ἄνθρωπος εἰς ὁ κόσμος .
183753	tlg0031.tlg004.perseus-grc2	καὶ ὑμεῖς οὖν νῦν μὲν λύπην ἔχετε·	καί  οὖν νῦν μέν λύπη ἔχω ·
183754	tlg0031.tlg004.perseus-grc2	πάλιν δὲ ὄψομαι ὑμᾶς, καὶ χαρήσεται ὑμῶν ἡ καρδία, καὶ τὴν χαρὰν ὑμῶν οὐδεὶς ἀρεῖ ἀφʼ ὑμῶν.	πάλιν δέ   , καί χαίρω ὑμός ὁ καρδία , καί ὁ χαρά ὑμός οὐδείς αἴρω ἀπό ὑμός .
183755	tlg0031.tlg004.perseus-grc2	καὶ ἐν ἐκείνῃ τῇ ἡμέρᾳ ἐμὲ οὐκ ἐρωτήσετε οὐδέν·	καί ἐν ἐκεῖνος ὁ ἡμέρα  οὐ ἐρωτάω οὐδείς ·
183756	tlg0031.tlg004.perseus-grc2	ἀμὴν ἀμὴν λέγω ὑμῖν, ἄν τι αἰτήσητε τὸν πατέρα δώσει ὑμῖν ἐν τῷ ὀνόματί μου.	λέγω  , ἐάν τι αἰτέω ὁ πατήρ δίδωμι  ἐν ὁ ὄνομα  .
183757	tlg0031.tlg004.perseus-grc2	ἕως ἄρτι οὐκ ᾐτήσατε οὐδὲν ἐν τῷ ὀνόματί μου·	ἕως ἄρτι οὐ αἰτέω οὐδείς ἐν ὁ ὄνομα  ·
183758	tlg0031.tlg004.perseus-grc2	αἰτεῖτε καὶ λήμψεσθε, ἵνα ἡ χαρὰ ὑμῶν ᾖ πεπληρωμένη.	αἰτέω καί λαμβάνω , ἵνα ὁ χαρά ὑμός εἰμί  .
183759	tlg0031.tlg004.perseus-grc2	Ταῦτα ἐν παροιμίαις λελάληκα ὑμῖν·	οὗτος ἐν παροιμία   ·
183760	tlg0031.tlg004.perseus-grc2	ἔρχεται ὥρα ὅτε οὐκέτι ἐν παροιμίαις λαλήσω ὑμῖν ἀλλὰ παρρησίᾳ περὶ τοῦ πατρὸς ἀπαγγελῶ ὑμῖν.	ἔρχομαι ὥρα2 ὅτε οὐκέτι ἐν παροιμία λαλέω  ἀλλά παρρησία περί ὁ πατήρ ἀπαγγέλλω  .
183761	tlg0031.tlg004.perseus-grc2	ἐν ἐκείνῃ τῇ ἡμέρᾳ ἐν τῷ ὀνόματί μου αἰτήσεσθε, καὶ οὐ λέγω ὑμῖν ὅτι ἐγὼ ἐρωτήσω τὸν πατέρα περὶ ὑμῶν·	ἐν ἐκεῖνος ὁ ἡμέρα ἐν τῷ ὄνομα  αἰτέω , καί οὐ λέγω  ὅτι2  ἐρωτάω ὁ πατήρ περί ὑμός ·
183762	tlg0031.tlg004.perseus-grc2	αὐτὸς γὰρ ὁ πατὴρ φιλεῖ ὑμᾶς, ὅτι ὑμεῖς ἐμὲ πεφιλήκατε καὶ πεπιστεύκατε ὅτι ἐγὼ παρὰ·	αὐτός γάρ ὁ πατήρ φιλέω  , ὅτι2    καί  ὅτι2  παρά ·
183763	tlg0031.tlg004.perseus-grc2	τοῦ πατρὸς ἐξῆλθον.	ὁ πατήρ ἐξέρχομαι .
183764	tlg0031.tlg004.perseus-grc2	ἐξῆλθον ἐκ τοῦ πατρὸς καὶ ἐλήλυθα εἰς τὸν κόσμον·	ἐξέρχομαι ἐκ ὁ πατήρ καί ἔρχομαι εἰς ὁ κόσμος ·
183765	tlg0031.tlg004.perseus-grc2	πάλιν ἀφίημι τὸν κόσμον καὶ πορεύομαι πρὸς τὸν πατέρα.	πάλιν ἀφίημι ὁ κόσμος καί πορεύω πρός ὁ πατήρ .
183766	tlg0031.tlg004.perseus-grc2	Λέγουσιν οἱ μαθηταὶ αὐτοῦ Ἴδε νῦν ἐν παρρησίᾳ λαλεῖς, καὶ παροιμίαν οὐδεμίαν λέγεις.	λέγω ὁ μαθητής αὐτός  νῦν ἐν παρρησία λαλέω , καί παροιμία οὐδείς λέγω .
183767	tlg0031.tlg004.perseus-grc2	νῦν οἴδαμεν ὅτι οἶδας πάντα καὶ οὐ χρείαν ἔχεις ἵνα τίς σε ἐρωτᾷ·	νῦν οἶδα ὅτι2 οἶδα πᾶς καί οὐ χρεία ἔχω ἵνα τις  ἐρωτάω ·
183768	tlg0031.tlg004.perseus-grc2	ἐν τούτῳ πιστεύομεν ὅτι ἀπὸ θεοῦ ἐξῆλθες.	ἐν οὗτος πιστεύω ὅτι2 ἀπό θεός ἐξέρχομαι .
183769	tlg0031.tlg004.perseus-grc2	ἀπεκρίθη αὐτοῖς Ἰησοῦς Ἄρτι πιστεύετε;	ἀποκρίνω αὐτός  ἄρτι πιστεύω ;
183770	tlg0031.tlg004.perseus-grc2	ἰδοὺ ἔρχεται ὥρα καὶ ἐλήλυθεν ἵνα σκορπισθῆτε ἕκαστος εἰς τὰ ἴδια κἀμὲ μόνον ἀφῆτε·	ἔρχομαι ὥρα2 καί  ἵνα σκορπίζω ἕκαστος εἰς ὁ ἴδιος  μόνος  ·
183771	tlg0031.tlg004.perseus-grc2	καὶ οὐκ εἰμὶ μόνος, ὅτι ὁ πατὴρ μετʼ ἐμοῦ ἐστίν.	καί οὐ εἰμί μόνος , ὅτι2 ὁ πατήρ μετά ἐμός εἰμί .
183772	tlg0031.tlg004.perseus-grc2	ταῦτα λελάληκα ὑμῖν ἵνα ἐν ἐμοὶ εἰρήνην ἔχητε·	οὗτος   ἵνα ἐν  εἰρήνη  ·
183773	tlg0031.tlg004.perseus-grc2	ἐν τῷ κόσμῳ θλίψιν ἔχετε, ἀλλὰ θαρσεῖτε, ἐγὼ νενίκηκα τὸν κόσμον.	ἐν τῷ κόσμος θλῖψις ἔχω , ἀλλά θαρσέω ,   ὁ κόσμος .
183774	tlg0031.tlg004.perseus-grc2	Ταῦτα ἐλάλησεν Ἰησοῦς, καὶ ἐπάρας τοὺς ὀφθαλμοὺς αὐτοῦ εἰς τὸν οὐρανὸν εἶπεν Πάτερ, ἐλήλυθεν ἡ ὥρα·	οὗτος λαλέω  , καί ἐπαίρω ὁ ὀφθαλμός αὐτός εἰς ὁ οὐρανός λέγω πατήρ ,  ὁ ὥρα2 ·
183775	tlg0031.tlg004.perseus-grc2	δόξασόν σου τὸν υἱόν, ἵνα ὁ υἱὸς δοξάσῃ σέ, καθὼς ἔδωκας αὐτῷ ἐξουσίαν πάσης σαρκός, ἵνα πᾶν ὃ δέδωκας αὐτῷ δώσει αὐτοῖς ζωὴν αἰώνιον.	δοξάζω  ὁ υἱός , ἵνα ὁ υἱός δοξάζω  ,  δίδωμι αὐτός ἐξουσία πᾶς σάρξ , ἵνα πᾶς ὅς δίδωμι αὐτός δίδωμι αὐτός ζωή αἰώνιος .
183776	tlg0031.tlg004.perseus-grc2	αὕτη δέ ἐστιν ἡ αἰώνιος ζωὴ ἵνα γινώσκωσι σὲ τὸν μόνον ἀληθινὸν θεὸν καὶ ὃν ἀπέστειλας Ἰησοῦν Χριστόν.	οὗτος δέ εἰμί ὁ αἰώνιος ζωή ἵνα γιγνώσκω  ὁ μόνος ἀληθινός  καί ὅς ἀποστέλλω  Χριστός .
183777	tlg0031.tlg004.perseus-grc2	ἐγώ σε ἐδόξασα ἐπὶ τῆς γῆς, τὸ ἔργον τελειώσας ὃ δέδωκάς μοι ἵνα ποιήσω·	ἐπί ὁ γῆ , ὁ ἔργον τελειόω ὅς  ἐγώ ἵνα ποιέω ·
183778	tlg0031.tlg004.perseus-grc2	καὶ νῦν δόξασόν με σύ, πάτερ, παρὰ σεαυτῷ τῇ δόξῃ ᾗ εἶχον πρὸ τοῦ τὸν κόσμον εἶναι παρὰ σοί.	καί νῦν δοξάζω  σύ , πατήρ , παρά  ὁ δόξα ὅς ἔχω πρό ὁ ὁ κόσμος εἰμί παρά  .
183779	tlg0031.tlg004.perseus-grc2	Ἐφανέρωσά σου τὸ ὄνομα τοῖς ἀνθρώποις.	ὁ ὄνομα ὁ ἄνθρωπος .
183780	tlg0031.tlg004.perseus-grc2	οὓς ἔδωκάς μοι ἐκ τοῦ κόσμου.	ὅς δίδωμι  ἐκ ὁ  .
183781	tlg0031.tlg004.perseus-grc2	σοὶ ἦσαν κἀμοὶ αὐτοὺς ἔδωκας, καὶ τὸν λόγον σου τετήρηκαν.	εἰμί  αὐτός δίδωμι , καί ὁ λόγος   .
183782	tlg0031.tlg004.perseus-grc2	νῦν ἔγνωκαν ὅτι πάντα ὅσα ἔδωκάς μοι παρὰ σοῦ εἰσίν·	νῦν  ὅτι2 πᾶς ὅσος δίδωμι  παρά  εἰμί ·
183783	tlg0031.tlg004.perseus-grc2	ὅτι τὰ ῥήματα ἃ ἔδωκάς μοι δέδωκα αὐτοῖς, καὶ αὐτοὶ ἔλαβον καὶ ἔγνωσαν ἀληθῶς ὅτι παρὰ σοῦ ἐξῆλθον, καὶ ἐπίστευσαν ὅτι σύ με ἀπέστειλας.	ὅτι2 ὁ ῥῆμα  δίδωμι  δίδωμι αὐτός , καί αὐτός λαμβάνω καί γιγνώσκω ἀληθής ὅτι2 παρά σός ἐξέρχομαι , καί πιστεύω ὅτι2   ἀποστέλλω .
183784	tlg0031.tlg004.perseus-grc2	Ἐγὼ περὶ αὐτῶν ἐρωτῶ·	περί αὐτός ἐρωτάω ·
183785	tlg0031.tlg004.perseus-grc2	οὐ περὶ τοῦ κόσμου ἐρωτῶ ἀλλὰ περὶ ὧν δέδωκάς μοι, ὅτι σοί εἰσιν, καὶ τὰ ἐμὰ πάντα σά ἐστιν καὶ τὰ σὰ ἐμά, καὶ δεδόξασμαι ἐν αὐτοῖς.	οὐ περί ὁ κόσμος ἐρωτάω ἀλλά περί ὅς  ἐγώ , ὅτι2  εἰμί , καί ὁ  πᾶς σός εἰμί καί ὁ  ἐμός , καί δοξάζω ἐν αὐτός .
183786	tlg0031.tlg004.perseus-grc2	καὶ οὐκέτι εἰμὶ ἐν τῷ κόσμῳ, καὶ αὐτοὶ ἐν τῷ κόσμῳ εἰσίν, κἀγὼ πρὸς σὲ ἔρχομαι.	καί οὐκέτι εἰμί ἐν ὁ κόσμος , καί αὐτός ἐν ὁ κόσμος εἰμί ,  πρός  ἔρχομαι .
183787	tlg0031.tlg004.perseus-grc2	πάτερ ἅγιε, τήρησον αὐτοὺς ἐν τῷ ὀνόματί σου ᾧ δέδωκάς μοι, ἵνα ὦσιν ἓν καθὼς ἡμεῖς.	πατήρ ἅγιος , τηρέω αὐτός ἐν ὁ ὄνομα  ὅς  ἐγώ , ἵνα εἰμί    .
183788	tlg0031.tlg004.perseus-grc2	Ὅτε ἤμην μετʼ αὐτῶν ἐγὼ ἐτήρουν αὐτοὺς ἐν τῷ ὀνόματί σου ᾧ δέδωκάς μοι, καὶ ἐφύλαξα, καὶ οὐδεὶς ἐξ αὐτῶν ἀπώλετο εἰ μὴ ὁ υἱὸς τῆς ἀπωλείας, ἵνα ἡ γραφὴ πληρωθῇ.	μετά αὐτός  τηρέω αὐτός ἐν τῷ ὄνομα  ὅς   , καί φυλάσσω , καί οὐδείς ἐκ αὐτός  εἰ μή ὁ υἱός ὁ ἀπώλεια , ἵνα ὁ γραφή πληρόω .
183789	tlg0031.tlg004.perseus-grc2	νῦν δὲ πρὸς σὲ ἔρχομαι, καὶ ταῦτα λαλῶ ἐν τῷ κόσμῳ ἵνα ἔχωσιν τὴν χαρὰν τὴν ἐμὴν πεπληρωμένην ἐν ἑαυτοῖς.	νῦν δέ πρός  ἔρχομαι , καί οὗτος λαλάζω ἐν ὁ κόσμος ἵνα ἔχω ὁ χαρά ὁ   ἐν ἑαυτοῦ .
183790	tlg0031.tlg004.perseus-grc2	Ἐγὼ δέδωκα αὐτοῖς τὸν λόγον σου, καὶ ὁ κόσμος ἐμίσησεν αὐτούς, ὅτι οὐκ εἰσὶν ἐκ τοῦ κόσμου καθὼς ἐγὼ οὐκ εἰμὶ ἐκ τοῦ κόσμου.	αὐτός ὁ λόγος  , καί ὁ κόσμος μισέω αὐτός , ὅτι2 οὐ εἰμί ἐκ ὁ κόσμος    εἰμί ἐκ ὁ  .
183791	tlg0031.tlg004.perseus-grc2	οὐκ ἐρωτῶ ἵνα ἄρῃς αὐτοὺς ἐκ τοῦ κόσμου ἀλλʼ ἵνα τηρήσῃς αὐτοὺς ἐκ τοῦ πονηροῦ.	οὐ ἐρωτάω ἵνα  αὐτός ἐκ ὁ   ἵνα τηρέω αὐτός ἐκ ὁ πονηρός .
183792	tlg0031.tlg004.perseus-grc2	ἐκ τοῦ κόσμου οὐκ εἰσὶν καθὼς ἐγὼ οὐκ εἰμὶ ἐκ τοῦ κόσμου.	ἐκ ὁ κόσμος οὐ εἰμί   οὐ εἰμί ἐκ ὁ  .
183793	tlg0031.tlg004.perseus-grc2	ἁγίασον αὐτοὺς ἐν τῇ ἀληθείᾳ·	ἁγιάζω αὐτός ἐν ὁ ἀλήθεια ·
183794	tlg0031.tlg004.perseus-grc2	ὁ λόγος ὁ σὸς ἀλήθειά ἐστιν.	ὁ λόγος ὁ   εἰμί .
183795	tlg0031.tlg004.perseus-grc2	καθὼς ἐμὲ ἀπέστειλας εἰς τὸν κόσμον, κἀγὼ ἀπέστειλα αὐτοὺς εἰς τὸν κόσμον·	καθώς  ἀποστέλλω εἰς ὁ κόσμος ,  ἀποστέλλω αὐτός εἰς ὁ κόσμος ·
