id	filename	tokens	lemmas
387707	tlg0555.tlg001.opp-grc1	ταύτας ἐδιδάξατο ᾄδειν καὶ κιθαρίζειν τὰς πράξεις τὰς παλαιὰς ἐμμελῶς.	οὗτος διδάσκω ἀείδω καί κιθαρίζω ὁ πρᾶξις ὁ παλαιός ἐμμελής .
387708	tlg0555.tlg001.opp-grc1	αἳ δὲ συνεχῶς κιθαρίζουσαι καὶ καλῶς κατεπᾴδουσαι τὸν Μάκαρα ἔθελγον καὶ κατέπαυον τῆς ὀργῆς.	ὁ δέ συνεχής  καί καλός  ὁ   καί καταπαύω ὁ ὀργή .
387709	tlg0555.tlg001.opp-grc1	οὗ δὴ χάριν ἡ Μεγακλὼ χαριστήριον αὐτὰς ὑπὲρ τῆς μητρὸς ἀνέθηκε χαλκᾶς καὶ ἀνὰ πάντα ἐκέλευσε τιμᾶσθαι τὰ ἱερά.	οὗ δή χάρις ὁ  χαριστήριος αὐτός ὑπέρ ὁ μήτηρ ἀνατίθημι  καί ἀνά πᾶς κελεύω τιμάω ὁ ἱερός .
387710	tlg0555.tlg001.opp-grc1	καὶ αἱ μὲν Μοῦσαι τοιαίδε·	καί ὁ μέν Μοῦσα τοιόσδε ·
387711	tlg0555.tlg001.opp-grc1	ἡ δὲ ἱστορία παρὰ Μυρσίλῳ τῷ Λεσβίῳ.	ὁ δέ ἱστορία παρά Μυρσίλος ὁ  .
387712	tlg0555.tlg001.opp-grc1	Ἀκούετε δὴ οὖν τῶν παρ’ ὑμῖν θεῶν τοὺς ἔρωτας καὶ τὰς παραδόξους τῆς ἀκρασίας μυθολογίας καὶ τραύματα αὐτῶν καὶ δεσμὰ καὶ γέλωτας καὶ μάχας δουλείας τε ἔτι καὶ συμπόσια συμπλοκάς τ᾿ αὖ καὶ δάκρυα καὶ πάθη καὶ μαχλώσας ἡδονάς.	δή οὖν ὁ παρά  θεός ὁ ἔρως καί ὁ παράδοξος ὁ ἀκρασία μυθολογία καί τραῦμα αὐτός καί δεσμός καί γέλως καί μάχη δούλειος τε ἔτι καί συμπόσιον συμπλοκή  αὖ καί δάκρυον καί πάθος καί  ἡδονή .
387713	tlg0555.tlg001.opp-grc1	κάλει μοι τὸν Ποσειδῶ καὶ τὸν χορὸν τῶν διεφθαρμένων ὑπ’ αὐτοῦ, τὴν Ἀμφιτρίτην, τὴν Ἀμυμώνην, τὴν Ἀλόπην, τὴν Μελανίππην, τὴν Ἀλκυόνην, τὴν Ἱπποθόην, τὴν Χιόνην, τὰς ἄλλας τὰς μυρίας·	καλέω  ὁ Ποσειδῶν καί ὁ χορός ὁ διαφθείρω ὑπό αὐτός , ὁ Ἀμφιτρίτη , ὁ Ἀμυμώνη , ὁ Ἀλόπη , ὁ Μελανίππη , ὁ Ἀλκυόνη , ὁ Ἱπποθόη , ὁ Χιόνη , ὁ ἄλλος ὁ  ·
387714	tlg0555.tlg001.opp-grc1	ἐν αἷς δὴ καὶ τοσαύταις οὔσαις ἔτι τοῦ Ποσειδῶνος ὑμῶν ἐστενοχωρεῖτο τὰ πάθη.	ἐν ὅς δή καί τοσοῦτος εἰμί ἔτι ὁ Ποσειδῶν ὑμός  ὁ πάθος .
387715	tlg0555.tlg001.opp-grc1	κάλει μοι καὶ τὸν Ἀπόλλω·	καλέω ἐγώ καί ὁ Ἀπόλλων ·
387716	tlg0555.tlg001.opp-grc1	Φοῖβός ἐστιν οὗτος καὶ μάντις ἁγνὸς καὶ σύμβουλος ἀγαθός·	Φοῖβος εἰμί οὗτος καί μάντις ἁγνός καί  ἀγαθός ·
387717	tlg0555.tlg001.opp-grc1	ἀλλ᾿ οὐ ταῦτα ἡ Στερόπη λέγει οὐδὲ ἡ Αἴθουσα οὐδὲ ἡ Ἀρσινόη οὐδὲ ἡ Ζευξίππη οὐδὲ ἡ Προθόη οὐδὲ ἡ Μάρπησσα οὐδὲ ἡ Ὑψιπύλη·	οὐ οὗτος ὁ Στερόπη λέγω οὐδέ ὁ  οὐδέ ὁ Ἀρσινόη οὐδέ ὁ  οὐδέ ὁ  οὐδέ ὁ  οὐδέ ὁ Ὑψιπύλη ·
387718	tlg0555.tlg001.opp-grc1	Δάφνη γὰρ ἐξέφυγε μόνη καὶ τὸν μάντιν καὶ τὴν φθοράν.	Δάφνη γάρ ἐκφεύγω μόνος καί ὁ μάντις καί ὁ φθορά .
387719	tlg0555.tlg001.opp-grc1	αὐτός τε ὁ Ζεὺς ἐπὶ πᾶσιν ἡκέτω, ὁ » πατὴρ« καθ’ ὑμᾶς» ἀνδρῶν τε θεῶν τε«·	αὐτός τε ὁ Ζεύς ἐπί πᾶς ἥκω , ὁ  πατήρ « κατά  » ἀνήρ τε θεός τε « ·
387720	tlg0555.tlg001.opp-grc1	τοσοῦτος περὶ τὰ ἀφροδίσια ἐξεχύθη, ὡς ἐπιθυμεῖν μὲν πασῶν, ἐκπληροῦν δὲ εἰς πάσας τὴν ἐπιθυμίαν.	τοσοῦτος περί ὁ Ἀφροδίσιος ἐκχέω , ὡς ἐπιθυμέω μέν πᾶς , ἐκπληρόω δέ εἰς πᾶς ὁ ἐπιθυμία .
387721	tlg0555.tlg001.opp-grc1	ἐνεπίμπλατο γοῦν γυναικῶν οὐχ ἧττον ἢ αἰγῶν ὁ Θμουιτῶν τράγος.	γοῦν γυνή οὐ ἥσσων τίη αἴξ ὁ  τράγος .
387722	tlg0555.tlg001.opp-grc1	καὶ σοῦ, ὦ Ὅμηρε, τεθαύμακα τὰ ποιήματα·	καί σός , ὦ Ὅμηρος ,  ὁ ποίημα ·
387723	tlg0555.tlg001.opp-grc1	ἦ, καὶ κυανέῃσιν ἐπ’ ὀφρύσι νεῦσε Κρονίων·	ἦ , καί κυάνεος ἐπί ὀφρῦς νέω Κρονίων ·
387724	tlg0555.tlg001.opp-grc1	ἀμβρόσιαι δ᾿ ἄρα χαῖται ἐπερρώσαντο ἄνακτος κρατὸς ἀπ’ ἀθανάτοιο·	ἀμβρόσιος  ἄρα χαίτη ἐπιρρώννυμι ἄναξ κράς ἀπό ἀθάνατος ·
387725	tlg0555.tlg001.opp-grc1	μέγαν δ᾿ ἐλέλιξεν Ὄλυμπον.	μέγας  ἐλελίζω Ὄλυμπος .
387726	tlg0555.tlg001.opp-grc1	σεμνὸν ἀναπλάττεις, Ὅμηρε, τὸν Δία καὶ νεῦμα περιάπτεις αὐτῷ τετιμημένον.	σεμνός  , Ὅμηρος , ὁ Ζεύς καί νεῦμα  αὐτός τιμάω .
387727	tlg0555.tlg001.opp-grc1	ἀλλ᾿ ἐὰν ἐπιδείξῃς μόνον, ἄνθρωπε, τὸν κεστόν ἐξελέγχεται καὶ ὁ Ζεὺς καὶ ἡ κόμη καταισχύνεται.	ἐάν ἐπιδείκνυμι μόνος , ἄνθρωπος , ὁ κεστός ἐξελέγχω καί ὁ Ζεύς καί ὁ κόμη  .
387728	tlg0555.tlg001.opp-grc1	εἰς ὅσον δ᾿’ ἐλήλακεν ἀσελγείας ὁ Ζεὺς ἐκεῖνος ὁ μετ’ Ἀλκμήνης τοσαύτας ἡδυπαθήσας νύκτας·	εἰς ὅσος   ἀσέλγεια ὁ Ζεύς ἐκεῖνος ὁ μετά Ἀλκμήνη τοσοῦτος  νύξ ·
387729	tlg0555.tlg001.opp-grc1	οὐδὲ γὰρ αἱ νύκτες αἱ ἐννέα τῷ ἀκολάστῳ μακραί( ἅπας δὲ ἔμπαλιν ὁ βίος ἀκρασίᾳ βραχὺς ἦν), ἵνα δὴ ἡμῖν τὸν ἀλεξίκακον σπείρῃ θεόν.	οὐδέ γάρ ὁ νύξ ὁ ἐννέα ὁ ἀκόλαστος  ( ἅπας δέ ἔμπαλιν ὁ βίος ἀκρασία βραχύς εἰμί ) , ἵνα δή ἐγώ ὁ ἀλεξίκακος σπεῖρα θεός .
387730	tlg0555.tlg001.opp-grc1	Διὸς υἱὸς Ἡρακλῆς, Διὸς ὡς ἀληθῶς, ὁ ἐκ μακρᾶς γεννώμενος νυκτός, τοὺς μὲν ἄθλους τοὺς δώδεκα πολλῷ ταλαιπωρησάμενος χρόνῳ, τὰς δὲ πεντήκοντα Θεστίου θυγατέρας νυκτὶ διαφθείρας μιᾷ, μοιχὸς ὁμοῦ καὶ νυμφίος τοσούτων γενόμενος παρθένων.	Ζεύς υἱός Ἡρακλέης , Ζεύς ὡς ἀληθής , ὁ ἐκ μακρός  νύξ , ὁ μέν ἆθλος ὁ δώδεκα πολύς  χρόνος , ὁ δέ πεντήκοντα Θέστιος θυγάτηρ νύξ διαφθείρω  , μοιχός ὁμοῦ καί νυμφίος τοσοῦτος γίγνομαι παρθένος .
387731	tlg0555.tlg001.opp-grc1	οὔκουν ἀπεικότως οἱ ποιηταὶ » σχέτλιον« τοῦτον» καὶ αἰσυλοεργὸν« ἀποκαλοῦσιν.	οὐκοῦν ἀπεικότως ὁ ποιητής   « οὗτος » καί  « ἀποκαλέω .
387732	tlg0555.tlg001.opp-grc1	μακρὸν δ᾿ ἂν εἴη μοιχείας αὐτοῦ παντοδαπὰς καὶ παίδων διηγεῖσθαι φθοράς.	μακρός  ἄν εἰμί μοιχεία αὐτός παντοδαπός καί παῖς διηγέομαι φθορά .
387733	tlg0555.tlg001.opp-grc1	οὐδὲ γὰρ οὐδὲ παίδων ἀπέσχοντο οἱ παρ’ ὑμῖν θεοί, ὃ μέν τις Ὕλα, ὃ δὲ Ὑακίνθου, ὃ δὲ Πέλοπος, ὃ δὲ Χρυσίππου, ὃ δὲ Γανυμήδους ἐρῶντες.	οὐδέ γάρ οὐδέ παῖς  ὁ παρά  θεός , ὅς μέν τις  ,  δέ Ὑάκινθος ,  δέ Πέλοψ ,  δέ Χρύσιππος ,  δέ Γανυμήδης ἐράω .
387734	tlg0555.tlg001.opp-grc1	τούτους ὑμῶν αἱ γυναῖκες προσκυνούντων τοὺς θεούς, τοιούτους δὲ εὐχέσθων εἶναι τοὺς ἄνδρας τοὺς ἑαυτῶν, οὕτω σώφρονας, ἵν᾿ ὦσιν ὅμοιοι τοῖς θεοῖς τὰ ἴσα ἐζηλωκότες·	οὗτος ὑμός ὁ γυνή προσκυνέω ὁ θεός , τοιοῦτος δέ  εἰμί ὁ ἀνήρ ὁ ἑαυτοῦ , οὕτως σώφρων ,  εἰμί ὅμοιος ὁ θεός ὁ ἴσος ζηλόω ·
387735	tlg0555.tlg001.opp-grc1	τούτους ἐθιζόντων οἱ παῖδες ὑμῶν σέβειν, ἵνα καὶ ἄνδρες γένωνται εἰκόνα πορνείας ἐναργῆ τοὺς θεοὺς παρα λαμβάνοντες.	οὗτος  ὁ παῖς ὑμός σέβομαι , ἵνα καί ἀνήρ γίγνομαι εἰκών πορνεία ἐναργής ὁ   λαμβάνω .
387736	tlg0555.tlg001.opp-grc1	ἀλλ᾿ οἱ μὲν ἄρρενες αὐτοῖς τῶν θεῶν ἴσως μόνοι ᾄττουσι περὶ τὰ ἀφροδίσια·	ὁ μέν ἄρσην αὐτός ὁ θεός ἴσος μόνος  περί ὁ Ἀφροδίσιος ·
387737	tlg0555.tlg001.opp-grc1	θηλύτεραι δὲ θεαὶ μένον αἰδοῖ οἴκοι ἑκάστη, φησὶν Ὅμηρος, αἰδούμεναι αἱ θεαὶ διὰ σεμνότητα Ἀφροδίτην ἰδεῖν μεμοιχευμένην.	θῆλυς δέ θεά μένω αἰδώς οἶκος ἕκαστος , φημί Ὅμηρος ,  ὁ θεά διά σεμνότης Ἀφροδίτη ὁράω μοιχεύω .
387738	tlg0555.tlg001.opp-grc1	αἳ δὲ ἀκολασταίνουσιν ἐμπαθέστερον ἐν τῇ μοιχείᾳ δεδεμέναι,Ἠὼς ἐπὶ Τιθωνῷ, Σελήνη δ᾿ ἐπὶ Ἐνδυμίωνι, Νηρηῒς ἐπὶ Αἰακῷ καὶ ἐπὶ Πηλεῖ Θέτις, ἐπὶ δὲ Ἰασίωνι Δημήτηρ καὶ ἐπὶ Ἀδώνιδι Φερέφαττα.	ὁ δέ  ἐμπαθής ἐν ὁ μοιχεία δέω , Ἠὼς ἐπί Τιθωνός , σελήνη  ἐπί Ἐνδυμίων ,  ἐπί Αἰακός καί ἐπί Πηλεύς Θέτις , ἐπί δέ Ἰασίων Δημήτηρ καί ἐπί   .
387739	tlg0555.tlg001.opp-grc1	Ἀφροδίτη δὲ ἐπ’ Ἄρει κατῃσχυμμένη μετῆλθεν ἐπὶ Κινύραν καὶ Ἀγχίσην ἔγημεν καὶ Φαέθοντα ἐλόχα καὶ ἤρα Ἀδώνιδος, ἐφιλονείκει δὲ τῇ βοώπιδι καὶ ἀποδυσάμεναι διὰ μῆλον αἱ θεαὶ γυμναὶ προσεῖχον τῷ ποιμένι, εἴ τις αὐτῷ δόξει καλή.	Ἀφροδίτη δέ ἐπί Ἄρης  μετέρχομαι ἐπί  καί Ἀγχίσης γαμέω καί Φαέθων  καί ἐράω Ἄδωνις , φιλονικέω δέ ὁ  καί  διά μῆλον ὁ θεά γυμνός προσέχω τῷ ποιμήν , εἰ τις αὐτός δοκέω καλός .
387740	tlg0555.tlg001.opp-grc1	Ἴθι δὴ καὶ τοὺς ἀγῶνας ἐν βραχεῖ περιοδεύσωμεν καὶ τὰς ἐπιτυμβίους ταυτασὶ πανηγύρεις καταλύσωμεν, Ἰσθμιά τε καὶ Νέμεα καὶ Πύθια καὶ τὰ ἐπὶ τούτοις Ὀλύμπια.	δή καί ὁ ἀγών ἐν βραχύς περιοδεύω καί ὁ   πανήγυρις καταλύω ,  τε καί Νέμεα καί Πύθια καί ὁ ἐπί οὗτος Ὀλύμπια .
387741	tlg0555.tlg001.opp-grc1	Πυθοῖ μὲν οὖν ὁ δράκων ὁ Πύθιος θρῃσκεύεται καὶ τοῦ ὄφεως ἡ πανήγυρις καταγγέλλεται Πύθια·	Πυθώ μέν οὖν ὁ δράκων ὁ   καί ὁ ὄφις ὁ πανήγυρις καταγγέλλω  ·
387742	tlg0555.tlg001.opp-grc1	Ἰσθμοῖ δὲ σκύβαλον προσέπτυσεν ἐλεεινὸν ἡ θάλαττα καὶ Μελικέρτην ὀδύρεται τὰ Ἴσθμια·	δέ   ἐλεεινός ὁ θάλασσα καί Μελικέρτης ὀδύρομαι ὁ Ἴσθμια ·
387743	tlg0555.tlg001.opp-grc1	Νεμέασι δὲ ἄλλο παιδίον Ἀρχέμορος κεκήδευται καὶ τοῦ παιδίου ὁ ἐπιτάφιος προσαγορεύεται Νέμεα·	δέ ἄλλος παιδίον   καί ὁ  ὁ ἐπιτάφιος προσαγορεύω Νέμεα ·
387744	tlg0555.tlg001.opp-grc1	Πῖσα δὲ ὑμῖν τάφος ἐστίν, ὦ Πανέλληνες, ἡνιόχου Φρυγός, καὶ τοῦ Πέλοπος τὰς χοάς, τὰ Ὀλύμπια, ὁ Φειδίου σφετερίζεται Ζεύς.	δέ σύ τάφος2 εἰμί , ὦ  , ἡνίοχος  , καί ὁ Πέλοψ ὁ χοή , ὁ Ὀλύμπιος , ὁ Φειδίας σφετερίζω Ζεύς .
387745	tlg0555.tlg001.opp-grc1	μυστήρια ἦσαν ἄρα, ὡς ἔοικεν, οἱ ἀγῶνες ἐπὶ νεκροῖς διαθλούμενοι, ὥσπερ καὶ τὰ λόγια, καὶ δεδήμευνται ἄμφω.	μυστήριον εἰμί ἄρα , ὡς ἔοικα , ὁ ἀγών ἐπί νεκρός  , ὥσπερ καί ὁ λόγιον , καί  ἄμφω .
387746	tlg0555.tlg001.opp-grc1	ἀλλὰ τὰ μὲν ἐπὶ Ἄγρᾳ μυστήρια καὶ τὰ ἐν Ἁλιμοῦντι τῆς Ἀττικῆς Ἀθήνησι περιώρισται·	ἀλλά ὁ μέν ἐπί  μυστήριον καί ὁ ἐν  ὁ  Ἀθῆναι  ·
387747	tlg0555.tlg001.opp-grc1	αἶσχος δὲ ἤδη κοσμικὸν οἵ τε ἀγῶνες καὶ οἱ φαλλοὶ οἱ Διονύσῳ ἐπιτελούμενοι, κακῶς ἐπινενεμημένοι τὸν βίον.	δέ ἤδη  ὁ τε ἀγών καί ὁ  ἕ Διόνυσος  , κακός  ὁ βίος .
387748	tlg0555.tlg001.opp-grc1	Διόνυσος γὰρ κατελθεῖν εἰς Ἅιδου γλιχόμενος ἠγνόει τὴν ὁδόν, ὑπισχνεῖται δ᾿ αὐτῷ φράσειν τις, Πρόσυμνος τοὔνομα, οὐκ ἀμισθί·	Διόνυσος γάρ κατέρχομαι εἰς ᾍδης  ἀγνοέω ὁ ὁδός , ὑπισχνέομαι  αὐτός φράζω τις ,  ὄνομα , οὐ  ·
387749	tlg0555.tlg001.opp-grc1	ὁ δὲ μισθὸς οὐ καλός, ἀλλὰ Διονύσῳ καλός·	ὁ δέ μισθός οὐ καλός , ἀλλά Διόνυσος καλός ·
387750	tlg0555.tlg001.opp-grc1	καὶ ἀφροδίσιος ἦν ἡ χάρις, ὁ μισθός, ὃν ᾐτεῖτο, Διόνυσος·	καί Ἀφροδίσιος εἰμί ὁ χάρις , ὁ μισθός , ὅς αἰτέω , Διόνυσος ·
387751	tlg0555.tlg001.opp-grc1	βουλομένῳ δὲ τῷ θεῷ γέγονεν ἡ αἴτησις, καὶ δὴ ὑπισχνεῖται παρέξειν αὐτῷ, εἰ ἀναζεύξοι, ὅρκῳ πιστωσάμενος τὴν ὑπόσχεσιν.	δέ τῷ θεός γίγνομαι ὁ αἴτησις , καί δή ὑπισχνέομαι παρέχω αὐτός , εἰ  , ὅρκος  ὁ ὑπόσχεσις .
387752	tlg0555.tlg001.opp-grc1	μαθὼν ἀπῆρεν·	μανθάνω ἀπαίρω ·
387753	tlg0555.tlg001.opp-grc1	ἐπανῆλθεν αὖθις·	ἐπανέρχομαι αὖθις ·
387754	tlg0555.tlg001.opp-grc1	οὐ καταλαμβάνει τὸν Πρόσυμνον( ἐτεθνήκει γάρ)·	οὐ καταλαμβάνω ὁ  (  γάρ ) ·
387755	tlg0555.tlg001.opp-grc1	ἀφοσιούμενος τῷ ἐραστῇ ὁ Διόνυσος ἐπὶ τὸ μνημεῖον ὁρμᾷ καὶ πασχητιᾷ.	τῷ  ὁ Διόνυσος ἐπί ὁ μνημεῖον ὁρμή καί  .
387756	tlg0555.tlg001.opp-grc1	κλάδον οὖν συκῆς, ὡς ἔτυχεν, ἐκτεμὼν ἀνδρείου μορίου σκευάζεται τρόπον ἐφέζεταί τε τῷ κλάδῳ, τὴν ὑπόσχεσιν ἐκτελῶν τῷ νεκρῷ.	οὖν συκῆ , ὡς τυγχάνω , ἐκτέμνω ἀνδρεῖος μόριον σκευάζω τρόπος  τε τῷ κλάδος , ὁ ὑπόσχεσις ἐκτελέω ὁ νεκρός .
387757	tlg0555.tlg001.opp-grc1	ὑπόμνημα τοῦ πάθους τούτου μυστικὸν φαλλοὶ κατὰ πόλεις ἀνίστανται Διονύσῳ·	ὑπόμνημα ὁ πάθος οὗτος μυστικός  κατά πόλις ἀνίστημι Διόνυσος ·
387758	tlg0555.tlg001.opp-grc1	» εἰ μὴ γὰρ Διονύσῳ πομπὴν ἐποιοῦντο καὶ ὕμνεον ᾄσματα αἰδοίοισιν ἀναιδέστατα, εἴργασται«, φησὶν Ἡράκλειτος, » ωὐτὸς δὲ Ἅιδης καὶ Διόνυσος, ὅτεῳ μαίνονται καὶ ληναΐζουσιν«, οὐ διὰ τὴν μέθην τοῦ σώματος, ὡς ἐγὼ οἶμαι, τοσοῦτον ὅσον διὰ τὴν ἐπονείδιστον τὴς ἀσελγείας ἱεροφαντίαν.	» εἰ μή γάρ Διόνυσος πομπή ποιέω καί ὑμνέω ᾆσμα αἰδοῖος ἀναιδής , ἐργάζομαι « , φημί Ἡράκλειτος ,   δέ ᾍδης καί Διόνυσος , ὅστις μαίνομαι καί  « , οὐ διά ὁ μέθη ὁ σῶμα , ὡς  οἴομαι ,  ὅσος διά ὁ ἐπονειδίζω  ἀσέλγεια ἱεροφαντία .
387759	tlg0555.tlg001.opp-grc1	Εἰκότως ἄρα οἱ τοιοίδε ὑμῶν θεοὶ δοῦλοι, δοῦλοι παθῶν γεγονότες, ἀλλὰ καὶ πρὸ τῶν Εἱλώτων καλουμένων τῶν παρὰ Λακεδαιμονίοις δούλειον ὑπεισῆλθεν ζυγὸν Ἀπόλλων Ἀδμήτῳ ἐν Φεραῖς, Ἡρακλῆς ἐν Σάρδεσιν Ὀμφάλῃ, Λαομέδοντι δ᾿ ἐθήτευε Ποσειδῶν καὶ Ἀπόλλων, καθάπερ ἀχρεῖος οἰκέτης, μηδὲ ἐλευθερίας δήπουθεν δυνηθεὶς τυχεῖν παρὰ τοῦ προτέρου δεσπότου·	εἰκός ἄρα ἕ τοιόσδε ὑμός  δοῦλος , δοῦλος  γίγνομαι , ἀλλά καί πρό ὁ Εἵλως καλέω ὁ παρά  δούλειος ὑπεισέρχομαι ζυγόν Ἀπόλλων Ἄδμητος ἐν Φεραί , Ἡρακλέης ἐν Σάρδεις Ὀμφάλη , Λαομέδων   Ποσειδῶν καί Ἀπόλλων , καθά ἀχρεῖος οἰκέτης , μηδέ ἐλευθερία  δύναμαι τυγχάνω παρά ὁ πρότερος δεσπότης ·
387760	tlg0555.tlg001.opp-grc1	τότε καὶ τὰ Ἰλίου τείχη ἀνῳκοδομησάτην τῷ Φρυγί.	τότε καί ὁ Ἴλιον τεῖχος  τῷ  .
387761	tlg0555.tlg001.opp-grc1	Ὅμηρος δὲ τὴν Ἀθηνᾶν οὐκ αἰσχύνεται παραφαίνειν λέγων τῷ Ὀδυσσεῖ» χρύσεον λύχνον ἔχουσαν« ἐν χεροῖν·	Ὅμηρος δέ ὁ Ἀθήνη οὐ αἰσχύνω  λέγω τῷ Ὀδυσσεύς » χρύσεος λύχνος ἔχω « ἐν χείρ ·
387762	tlg0555.tlg001.opp-grc1	τὴν δὲ Ἀφροδίτην ἀνέγνωμεν, οἷον ἀκόλαστόν τι θεραπαινίδιον, παραθεῖναι φέρουσαν τῇ Ἑλένῃ τὸν δίφρον τοῦ μοιχοῦ κατὰ πρόσωπον, ὅπως αὐτὸν εἰς συνουσίαν ὑπαγάγηται.	ὁ δέ Ἀφροδίτη  , οἷος   θεραπαινίς , παρατίθημι φέρω ὁ Ἑλένη ὁ δίφρος ὁ μοιχός κατά πρόσωπον , ὅπως αὐτός εἰς συνουσία  .
387763	tlg0555.tlg001.opp-grc1	Πανύασσις γὰρ πρὸς τούτοις καὶ ἄλλους παμπόλλους ἀνθρώποις λατρεῦσαι θεοὺς ἱστορεῖ ὧδέ πως γράφων·	γάρ πρός οὗτος καί ἄλλος πάμπολυς ἄνθρωπος λατρεύω  ἱστορέω ὧδε πως γράφω ·
387764	tlg0555.tlg001.opp-grc1	τλῆ μὲν Δημήτηρ, τλῆ δὲ κλυτὸς Ἀμφιγυήεις, τλῆ δὲ Ποσειδάων, τλῆ δ᾿ ἀργυρότοξος Ἀπόλλων ἀνδρὶ παρὰ θνητῷ θητευέμεν εἰς ἐνιαυτόν·	τλάω μέν Δημήτηρ , τλάω δέ κλυτός ἀμφιγυήεις , τλάω δέ Ποσειδῶν , τλάω  ἀργυρότοξος Ἀπόλλων ἀνήρ παρά θνητός θητεύω εἰς ἐνιαυτός ·
387765	tlg0555.tlg001.opp-grc1	τλῆ δὲ καὶ ὀβριμόθυμος Ἄρης ὑπὸ πατρὸς ἀνάγκης, καὶ τὰ ἐπὶ τούτοις.	τλάω δέ καί ὀβριμόθυμος Ἄρης ὑπό πατήρ ἀνάγκη , καί ὁ ἐπί οὗτος .
387766	tlg0555.tlg001.opp-grc1	Τούτοις οὖν εἰκότως ἕπεται τοὺς ἐρωτικοὺς ὑμῶν καὶ παθητικοὺς τούτους θεοὺς ἀνθρω ποπαθεῖς ἐκ παντὸς εἰσάγειν τρόπου.	οὖν εἰκός  ὁ ἐρωτικός ὑμός καί  οὗτος    ἐκ πᾶς εἰσάγω τρόπος .
387767	tlg0555.tlg001.opp-grc1	» καὶ γάρ θην κείνοις θνητὸς χρώς.	» καί γάρ θην ἐκεῖνος θνητός χρώς .
387768	tlg0555.tlg001.opp-grc1	« τεκμηριοῖ δὲ Ὅμηρος, μάλα ἀκριβῶς Ἀφροδίτην ἐπὶ τῷ τραύματι παρεισάγων ὀξὺ καὶ μέγα ἰάχουσαν αὐτόν τε τὸν πολεμικώτατον Ἄρη ὑπὸ τοῦ Διομήδους κατὰ τοῦ κενεῶνος οὐτασμένον διηγούμενος.	τεκμηριόω δέ Ὅμηρος , μάλα ἀκριβής Ἀφροδίτη ἐπί ὁ τραῦμα  ὀξύς2 καί μέγας ἰάχω αὐτός τε ὁ  Ἄρης ὑπό ὁ Διομήδης κατά ὁ    .
387769	tlg0555.tlg001.opp-grc1	Πολέμων δὲ καὶ τὴν Ἀθηνᾶν ὑπὸ Ὀρνύτου τρωθῆναι λέγει·	Πολέμων δέ καί ὁ Ἀθήνη ὑπό  τιτρώσκω λέγω ·
387770	tlg0555.tlg001.opp-grc1	ναὶ μὴν καὶ τὸν Ἀιδωνέα ὑπὸ Ἡρακλέους τοξευθῆναι Ὅμηρος λέγει καὶ τὸν Ἥλιον Αὐγέαν Πανύασσις ἱστορεῖ.	μήν καί ὁ  ὑπό Ἡρακλέης τοξεύω Ὅμηρος λέγω καί ὁ ἥλιος   ἱστορέω .
387771	tlg0555.tlg001.opp-grc1	ἤδη δὲ καὶ τὴν Ἥραν τὴν ζυγίαν ἱστορεῖ ὑπὸ τοῦ αὐτοῦ Ἡρακλέους ὁ αὐτὸς οὗτος Πανύασσις» ἐν Πύλῳ ἠμαθόεντι«.	ἤδη δέ καί ὁ Ἥρα ὁ  ἱστορέω ὑπό ὁ αὐτός Ἡρακλέης ὁ αὐτός οὗτος Πανύασις » ἐν  ἠμαθόεις « .
387772	tlg0555.tlg001.opp-grc1	Σωσίβιος δὲ καὶ τὸν Ἡρακλέα πρὸς τῶν Ἱπποκοωντιδῶν κατὰ τῆς χειρὸς οὐτασθῆναι λέγει.	Σωσίβιος δέ καί ὁ Ἡρακλέης πρός ὁ  κατά ὁ χείρ  λέγω .
387773	tlg0555.tlg001.opp-grc1	εἰ δὲ τραύματα, καὶ αἵματα·	εἰ δέ τραῦμα , καί αἷμα ·
387774	tlg0555.tlg001.opp-grc1	οἱ γὰρ ἰχῶρες οἱ ποιητικοὶ εἰδεχθέστεροι καὶ τῶν αἱμάτων, σῆψις γὰρ αἵματος ἰχὼρ νοεῖται.	ὁ γάρ ἰχώρ ὁ   καί ὁ αἷμα , σῆψις γάρ αἷμα  νοέω .
387775	tlg0555.tlg001.opp-grc1	ἀνάγκη τοίνυν θεραπείας καὶ τροφὰς παρεισάγειν αὐτοῖς, ὧν εἰσιν ἐνδεεῖς.	ἀνάγκη τοίνυν θεραπεία καί τροφή παρεισάγω αὐτός , ὅς εἰμί ἐνδεής .
