id	filename	tokens	lemmas
680976	tlg0059.tlg007.perseus-grc2	ΘΕΑΙ. πῶς δʼ οὔ;	πῶς δέ οὐ ;
680977	tlg0059.tlg007.perseus-grc2	ΞΕ. τρία δὴ γίγνεται ταῦτα.	δή γίγνομαι οὗτος .
680978	tlg0059.tlg007.perseus-grc2	ΘΕΑΙ. τί μήν;	τίς μήν ;
680979	tlg0059.tlg007.perseus-grc2	ΞΕ. οὐκοῦν αὐτῶν ἕκαστον τοῖν μὲν δυοῖν ἕτερόν ἐστιν, αὐτὸ δʼ ἑαυτῷ ταὐτόν.	οὐκοῦν αὐτός ἕκαστος ὁ μέν  ἕτερος εἰμί , αὐτός δέ ἑαυτοῦ  .
680980	tlg0059.tlg007.perseus-grc2	ΘΕΑΙ. οὕτως.	οὕτως .
680981	tlg0059.tlg007.perseus-grc2	ΞΕ. τί ποτʼ αὖ νῦν οὕτως εἰρήκαμεν τό τε ταὐτὸν καὶ θάτερον;	τι  αὖ νῦν οὕτως λέγω ὁ τε αὐτός καί ἕτερος ;
680982	tlg0059.tlg007.perseus-grc2	πότερα δύο γένη τινὲ αὐτώ, τῶν μὲν τριῶν ἄλλω, συμμειγνυμένω μὴν ἐκείνοις ἐξ ἀνάγκης ἀεί, καὶ περὶ πέντε ἀλλʼ οὐ περὶ τριῶν ὡς ὄντων αὐτῶν σκεπτέον, ἢ τό τε ταὐτὸν τοῦτο καὶ θάτερον ὡς ἐκείνων τι προσαγορεύοντες λανθάνομεν ἡμᾶς αὐτούς;	πότερος γε γένος  αὐτός , ὁ μέν   ,  μήν ἐκεῖνος ἐκ ἀνάγκη ἀεί , καί περί πέντε  οὐ περί  ὡς εἰμί αὐτός σκοπέω , ἤ ὁ τε αὐτός οὗτος καί ἕτερος ὡς ἐκεῖνος τι προσαγορεύω λανθάνω ἐγώ αὐτός ;
680983	tlg0059.tlg007.perseus-grc2	ΘΕΑΙ. ἴσως.	ἴσος .
680984	tlg0059.tlg007.perseus-grc2	ΞΕ. ἀλλʼ οὔ τι μὴν κίνησίς γε καὶ στάσις οὔθʼ ἕτερον οὔτε ταὐτόν ἐστι.	οὐ τι μήν  γε καί στάσις  ἕτερος οὔτε αὐτός εἰμί .
680985	tlg0059.tlg007.perseus-grc2	ΘΕΑΙ. πῶς;	πῶς ;
680986	tlg0059.tlg007.perseus-grc2	ΞΕ. ὅτιπερ ἂν κοινῇ προσείπωμεν κίνησιν καὶ στάσιν, τοῦτο οὐδέτερον αὐτοῖν οἷόν τε εἶναι.	ὅστις ἄν κοινῇ  κίνησις καί στάσις , οὗτος οὐδέτερος   τε εἰμί .
680987	tlg0059.tlg007.perseus-grc2	ΘΕΑΙ. τί δή;	τίς δή ;
680988	tlg0059.tlg007.perseus-grc2	ΞΕ. κίνησίς τε στήσεται καὶ στάσις αὖ κινηθήσεται·	κίνησις τε ἵστημι καί στάσις αὖ  ·
680989	tlg0059.tlg007.perseus-grc2	περὶ γὰρ ἀμφότερα θάτερον ὁποτερονοῦν γιγνόμενον αὐτοῖν ἀναγκάσει μεταβάλλειν αὖ θάτερον ἐπὶ τοὐναντίον τῆς αὑτοῦ φύσεως, ἅτε μετασχὸν τοῦ ἐναντίου.	περί γάρ ἀμφότερος ἕτερος ὁπότερος   ἀναγκάζω μεταβάλλω αὖ  ἐπί ἐναντίος ὁ ἑαυτοῦ φύσις ,  μετέχω ὁ ἐναντίος .
680990	tlg0059.tlg007.perseus-grc2	ΘΕΑΙ. κομιδῇ γε.	γε .
680991	tlg0059.tlg007.perseus-grc2	ΞΕ. μετέχετον μὴν ἄμφω ταὐτοῦ καὶ θατέρου.	μήν ἄμφω αὐτός καί  .
680992	tlg0059.tlg007.perseus-grc2	ΘΕΑΙ. ναί.	ναί .
680993	tlg0059.tlg007.perseus-grc2	ΞΕ. μὴ τοίνυν λέγωμεν κίνησίν γʼ εἶναι ταὐτὸν ἢ θάτερον, μηδʼ αὖ στάσιν.	μή τοίνυν λέγω   εἰμί αὐτός ἤ ἕτερος ,  αὖ στάσις .
680994	tlg0059.tlg007.perseus-grc2	ΘΕΑΙ. μὴ γάρ.	μή γάρ .
680995	tlg0059.tlg007.perseus-grc2	ΞΕ. ἀλλʼ ἆρα τὸ ὂν καὶ τὸ ταὐτὸν ὡς ἕν τι διανοητέον ἡμῖν;	ἆρα ὁ εἰμί καί ὁ αὐτός ὡς  τι διανοέομαι  ;
680996	tlg0059.tlg007.perseus-grc2	ΘΕΑΙ. ἴσως.	ἴσος .
680997	tlg0059.tlg007.perseus-grc2	ΞΕ. ἀλλʼ εἰ τὸ ὂν καὶ τὸ ταὐτὸν μηδὲν διάφορον σημαίνετον, κίνησιν αὖ πάλιν καὶ στάσιν ἀμφότερα εἶναι λέγοντες ἀμφότερα οὕτως αὐτὰ ταὐτὸν ὡς ὄντα προσεροῦμεν.	εἰ ὁ εἰμί καί ὁ αὐτός  διάφορος  , κίνησις αὖ πάλιν καί στάσις ἀμφότερος εἰμί λέγω ἀμφότερος οὕτως αὐτός αὐτός ὡς εἰμί προσερέω .
680998	tlg0059.tlg007.perseus-grc2	ΘΕΑΙ. ἀλλὰ μὴν τοῦτό γε ἀδύνατον.	ἀλλά μήν  γε ἀδύνατος .
680999	tlg0059.tlg007.perseus-grc2	ΞΕ. ἀδύνατον ἄρα ταὐτὸν καὶ τὸ ὂν ἓν εἶναι.	ἀδύνατος ἄρα αὐτός καί ὁ εἰμί  εἰμί .
681000	tlg0059.tlg007.perseus-grc2	ΘΕΑΙ. σχεδόν.	σχεδόν .
681001	tlg0059.tlg007.perseus-grc2	ΞΕ. τέταρτον δὴ πρὸς τοῖς τρισὶν εἴδεσιν τὸ ταὐτὸν τιθῶμεν;	τέταρτος δή πρός ὁ  εἶδος ὁ αὐτός  ;
681002	tlg0059.tlg007.perseus-grc2	ΘΕΑΙ. πάνυ μὲν οὖν.	πάνυ μέν οὖν .
681003	tlg0059.tlg007.perseus-grc2	ΞΕ. τί δέ;	τίς δέ ;
681004	tlg0059.tlg007.perseus-grc2	τὸ θάτερον ἆρα ἡμῖν λεκτέον πέμπτον;	ὁ ἕτερος ἆρα ἐγώ λέγω πέμπτος ;
681005	tlg0059.tlg007.perseus-grc2	ἢ τοῦτο καὶ τὸ ὂν ὡς δύʼ ἄττα ὀνόματα ἐφʼ ἑνὶ γένει διανοεῖσθαι δεῖ;	τίη οὗτος καί ὁ εἰμί ὡς   ὄνομα   γένος διανοέομαι δέω ;
681006	tlg0059.tlg007.perseus-grc2	ΘΕΑΙ. τάχʼ ἄν.	ἄν .
681007	tlg0059.tlg007.perseus-grc2	ΞΕ. ἀλλʼ οἶμαί σε συγχωρεῖν τῶν ὄντων τὰ μὲν αὐτὰ καθʼ αὑτά, τὰ δὲ πρὸς ἄλλα ἀεὶ λέγεσθαι.	συγχωρέω ὁ εἰμί ὁ μέν αὐτός καθά ἑαυτοῦ , ὁ δέ πρός ἄλλος ἀεί λέγω .
681008	tlg0059.tlg007.perseus-grc2	ΘΕΑΙ. τί δʼ οὔ;	τίς δέ οὐ ;
681009	tlg0059.tlg007.perseus-grc2	ΞΕ. τὸ δέ γʼ ἕτερον ἀεὶ πρὸς ἕτερον·	ὁ δέ γε ἕτερος ἀεί πρός ἕτερος ·
681010	tlg0059.tlg007.perseus-grc2	ἦ γάρ;	ἦ γάρ ;
681011	tlg0059.tlg007.perseus-grc2	ΘΕΑΙ. οὕτως.	οὕτως .
681012	tlg0059.tlg007.perseus-grc2	ΞΕ. οὐκ ἄν, εἴ γε τὸ ὂν καὶ τὸ θάτερον μὴ πάμπολυ διεφερέτην·	ΞΕ. οὐ ἄν , εἰ γε ὁ εἰμί καί ὁ ἕτερος μή πάμπολυς  ·
681013	tlg0059.tlg007.perseus-grc2	ἀλλʼ εἴπερ θάτερον ἀμφοῖν μετεῖχε τοῖν εἰδοῖν ὥσπερ τὸ ὄν, ἦν ἄν ποτέ τι καὶ τῶν ἑτέρων ἕτερον οὐ πρὸς ἕτερον·	εἴπερ  ἄμφω μετέχω ὁ  ὥσπερ ὁ εἰμί , εἰμί ἄν ποτε τις καί ὁ  ἕτερος οὐ πρός ἕτερος ·
681014	tlg0059.tlg007.perseus-grc2	νῦν δὲ ἀτεχνῶς ἡμῖν ὅτιπερ ἂν ἕτερον ᾖ, συμβέβηκεν ἐξ ἀνάγκης ἑτέρου τοῦτο ὅπερ ἐστὶν εἶναι.	νῦν δέ ἀτεχνής ἐγώ ὅστις ἐάν ἕτερος εἰμί , συμβαίνω ἐκ ἀνάγκη ἕτερος οὗτος ὅς εἰμί εἰμί .
681015	tlg0059.tlg007.perseus-grc2	ΘΕΑΙ. λέγεις καθάπερ ἔχει.	λέγω καθά ἔχω .
681016	tlg0059.tlg007.perseus-grc2	ΞΕ. πέμπτον δὴ τὴν θατέρου φύσιν λεκτέον ἐν τοῖς εἴδεσιν οὖσαν, ἐν οἷς προαιρούμεθα.	πέμπτος δή ὁ  φύσις λέγω ἐν ὁ εἶδος εἰμί , ἐν ὅς προαιρέω .
681017	tlg0059.tlg007.perseus-grc2	ΘΕΑΙ. ναί.	ναί .
681018	tlg0059.tlg007.perseus-grc2	ΞΕ. καὶ διὰ πάντων γε αὐτὴν αὐτῶν φήσομεν εἶναι διεληλυθυῖαν·	καί διά πᾶς γε αὐτός αὐτός φημί εἰμί  ·
681019	tlg0059.tlg007.perseus-grc2	ἓν ἕκαστον γὰρ ἕτερον εἶναι τῶν ἄλλων οὐ διὰ τὴν αὑτοῦ φύσιν, ἀλλὰ διὰ τὸ μετέχειν τῆς ἰδέας τῆς θατέρου.	ἕκαστος γάρ ἕτερος εἰμί ὁ  οὐ διά ὁ ἑαυτοῦ φύσις , ἀλλά διά ὁ μετέχω ὁ  ὁ  .
681020	tlg0059.tlg007.perseus-grc2	ΘΕΑΙ. κομιδῇ μὲν οὖν.	κομιδῇ μέν οὖν .
681021	tlg0059.tlg007.perseus-grc2	ΞΕ. ὧδε δὴ λέγωμεν ἐπὶ τῶν πέντε καθʼ ἓν ἀναλαμβάνοντες.	ὧδε δή λέγω ἐπί ὁ πέντε κατά  ἀναλαμβάνω .
681022	tlg0059.tlg007.perseus-grc2	ΘΕΑΙ. πῶς;	πῶς ;
681023	tlg0059.tlg007.perseus-grc2	ΞΕ. πρῶτον μὲν κίνησιν, ὡς ἔστι παντάπασιν ἕτερον στάσεως.	πρῶτος μέν κίνησις , ὡς εἰμί παντάπασι ἕτερος στάσις .
681024	tlg0059.tlg007.perseus-grc2	ἢ πῶς λέγομεν;	ἤ πῶς λέγω ;
681025	tlg0059.tlg007.perseus-grc2	ΘΕΑΙ. οὕτως.	οὕτως .
681026	tlg0059.tlg007.perseus-grc2	ΞΕ. οὐ στάσις ἄρʼ ἐστίν.	οὐ στάσις  εἰμί .
681027	tlg0059.tlg007.perseus-grc2	ΘΕΑΙ. οὐδαμῶς.	οὐδαμῶς .
681028	tlg0059.tlg007.perseus-grc2	ΞΕ. ἔστι δέ γε διὰ τὸ μετέχειν τοῦ ὄντος.	εἰμί δέ γε διά ὁ μετέχω ὁ εἰμί .
681029	tlg0059.tlg007.perseus-grc2	ΘΕΑΙ. ἔστιν.	εἰμί .
681030	tlg0059.tlg007.perseus-grc2	ΞΕ. αὖθις δὴ πάλιν ἡ κίνησις ἕτερον ταὐτοῦ ἐστιν.	αὖθις δή πάλιν ὁ κίνησις ἕτερος αὐτός εἰμί .
681031	tlg0059.tlg007.perseus-grc2	ΘΕΑΙ. σχεδόν.	σχεδόν .
681032	tlg0059.tlg007.perseus-grc2	ΞΕ. οὐ ταὐτὸν ἄρα ἐστίν.	ΞΕ. οὐ αὐτός ἄρα εἰμί .
681033	tlg0059.tlg007.perseus-grc2	ΘΕΑΙ. οὐ γὰρ οὖν.	ΘΕΑΙ. οὐ γάρ οὖν .
681034	tlg0059.tlg007.perseus-grc2	ΞΕ. ἀλλὰ μὴν αὕτη γʼ ἦν ταὐτὸν διὰ τὸ μετέχειν αὖ πάντʼ αὐτοῦ.	ἀλλά μήν οὗτος  εἰμί αὐτός διά ὁ μετέχω αὖ πᾶς αὐτός .
681035	tlg0059.tlg007.perseus-grc2	ΘΕΑΙ. καὶ μάλα.	καί μάλα .
681036	tlg0059.tlg007.perseus-grc2	ΞΕ. τὴν κίνησιν δὴ ταὐτόν τʼ εἶναι καὶ μὴ ταὐτὸν ὁμολογητέον καὶ οὐ δυσχεραντέον.	ὁ κίνησις δή αὐτός  εἰμί καί μή αὐτός ὁμολογέω καί οὐ δυσχεραίνω .
681037	tlg0059.tlg007.perseus-grc2	οὐ γὰρ ὅταν εἴπωμεν αὐτὴν ταὐτὸν καὶ μὴ ταὐτόν, ὁμοίως εἰρήκαμεν, ἀλλʼ ὁπόταν μὲν ταὐτόν, διὰ τὴν μέθεξιν ταὐτοῦ πρὸς ἑαυτὴν οὕτω λέγομεν, ὅταν δὲ μὴ ταὐτόν, διὰ τὴν κοινωνίαν αὖ θατέρου, διʼ ἣν ἀποχωριζομένη ταὐτοῦ γέγονεν οὐκ ἐκεῖνο ἀλλʼ ἕτερον, ὥστε ὀρθῶς αὖ λέγεται πάλιν οὐ ταὐτόν.	οὐ γάρ ὅταν λέγω αὐτός αὐτός καί μή αὐτός , ὅμοιος λέγω , ἀλλά ὁπότε μέν αὐτός , διά ὁ μέθεξις αὐτός πρός ἑαυτοῦ οὕτως λέγω , ὅταν δέ μή αὐτός , διά ὁ κοινωνία αὖ ἕτερος , διά ὅς  αὐτός γίγνομαι  ἐκεῖνος  ἕτερος , ὥστε ὀρθός αὖ λέγω πάλιν οὐ αὐτός .
681038	tlg0059.tlg007.perseus-grc2	ΘΕΑΙ. πάνυ μὲν οὖν.	πάνυ μέν οὖν .
681039	tlg0059.tlg007.perseus-grc2	ΞΕ. οὐκοῦν κἂν εἴ πῃ μετελάμβανεν αὐτὴ κίνησις στάσεως, οὐδὲν ἂν ἄτοπον ἦν στάσιμον αὐτὴν προσαγορεύειν;	οὐκοῦν  εἰ πη μεταλαμβάνω αὐτός κίνησις στάσις ,  ἀνά ἄτοπος εἰμί  αὐτός προσαγορεύω ;
681040	tlg0059.tlg007.perseus-grc2	ΘΕΑΙ. ὀρθότατά γε, εἴπερ τῶν γενῶν συγχωρησόμεθα τὰ μὲν ἀλλήλοις ἐθέλειν μείγνυσθαι, τὰ δὲ μή.	γε , εἴπερ ὁ γένος συγχωρέω ὁ μέν ἀλλήλων ἐθέλω μείγνυμι , ὁ δέ μή .
681041	tlg0059.tlg007.perseus-grc2	ΞΕ. καὶ μὴν ἐπί γε τὴν τούτου πρότερον ἀπόδειξιν ἢ τῶν νῦν ἀφικόμεθα, ἐλέγχοντες ὡς ἔστι κατὰ φύσιν ταύτῃ.	καί μήν ἐπί γε ὁ οὗτος πρότερος ἀπόδειξις ἤ ὁ νῦν  , ἐλέγχω ὡς εἰμί κατά φύσις οὗτος .
681042	tlg0059.tlg007.perseus-grc2	ΘΕΑΙ. πῶς γὰρ οὔ;	πῶς γάρ οὐ ;
681043	tlg0059.tlg007.perseus-grc2	ΞΕ. λέγωμεν δὴ πάλιν·	λέγω δή πάλιν ·
681044	tlg0059.tlg007.perseus-grc2	ἡ κίνησίς ἐστιν ἕτερον τοῦ ἑτέρου, καθάπερ ταὐτοῦ τε ἦν ἄλλο καὶ τῆς στάσεως;	ὁ  εἰμί ἕτερος ὁ ἕτερος , καθά αὐτός τε εἰμί ἄλλος καί ὁ στάσις ;
681045	tlg0059.tlg007.perseus-grc2	ΘΕΑΙ. ἀναγκαῖον.	ἀναγκαῖον .
681046	tlg0059.tlg007.perseus-grc2	ΞΕ. οὐχ ἕτερον ἄρʼ ἐστί πῃ καὶ ἕτερον κατὰ τὸν νυνδὴ λόγον.	οὐ ἕτερος  εἰμί πη καί ἕτερος κατά ὁ νῦν δή λόγος .
681047	tlg0059.tlg007.perseus-grc2	ΘΕΑΙ. ἀληθῆ.	ἀληθής .
681048	tlg0059.tlg007.perseus-grc2	ΞΕ. τί οὖν δὴ τὸ μετὰ τοῦτο;	τι οὖν δή ὁ μετά οὗτος ;
681049	tlg0059.tlg007.perseus-grc2	ἆρʼ αὖ τῶν μὲν τριῶν ἕτερον αὐτὴν φήσομεν εἶναι, τοῦ δὲ τετάρτου μὴ φῶμεν, ὁμολογήσαντες αὐτὰ εἶναι πέντε, περὶ ὧν καὶ ἐν οἷς προυθέμεθα σκοπεῖν;	αὖ ὁ μέν  ἕτερος αὐτός φημί εἰμί , ὁ δέ τέταρτος μή φημί , ὁμολογέω αὐτός εἰμί πέντε , περί ὅς καί ἐν ὅς  σκοπέω ;
681050	tlg0059.tlg007.perseus-grc2	ΘΕΑΙ. καὶ πῶς;	καί πῶς ;
681051	tlg0059.tlg007.perseus-grc2	ἀδύνατον γὰρ συγχωρεῖν ἐλάττω τὸν ἀριθμὸν τοῦ νυνδὴ φανέντος.	ἀδύνατος γάρ συγχωρέω ἐλάσσων ὁ ἀριθμός ὁ νῦν δή φαίνω .
681052	tlg0059.tlg007.perseus-grc2	ΞΕ. ἀδεῶς ἄρα τὴν κίνησιν ἕτερον εἶναι τοῦ ὄντος διαμαχόμενοι λέγωμεν;	ἀδεής ἄρα ὁ κίνησις ἕτερος εἰμί ὁ εἰμί  λέγω ;
681053	tlg0059.tlg007.perseus-grc2	ΘΕΑΙ. ἀδεέστατα μὲν οὖν.	μέν οὖν .
681054	tlg0059.tlg007.perseus-grc2	ΞΕ. οὐκοῦν δὴ σαφῶς ἡ κίνησις ὄντως οὐκ ὄν ἐστι καὶ ὄν, ἐπείπερ τοῦ ὄντος μετέχει;	οὐκοῦν δή σαφής ὁ κίνησις ὄντως οὐ εἰμί εἰμί καί εἰμί , ἐπεί ὁ εἰμί μετέχω ;
681055	tlg0059.tlg007.perseus-grc2	ΘΕΑΙ. σαφέστατά γε.	σαφής γε .
681056	tlg0059.tlg007.perseus-grc2	ΞΕ. ἔστιν ἄρα ἐξ ἀνάγκης τὸ μὴ ὂν ἐπί τε κινήσεως εἶναι καὶ κατὰ πάντα τὰ γένη·	εἰμί ἄρα ἐκ ἀνάγκη ὁ μή εἰμί ἐπί τε κίνησις εἰμί καί κατά πᾶς ὁ γένος ·
681057	tlg0059.tlg007.perseus-grc2	κατὰ πάντα γὰρ ἡ θατέρου φύσις ἕτερον ἀπεργαζομένη τοῦ ὄντος ἕκαστον οὐκ ὂν ποιεῖ, καὶ σύμπαντα δὴ κατὰ ταὐτὰ οὕτως οὐκ ὄντα ὀρθῶς ἐροῦμεν, καὶ πάλιν, ὅτι μετέχει τοῦ ὄντος, εἶναί τε καὶ ὄντα.	κατά πᾶς γάρ ὁ ἕτερος φύσις ἕτερος  ὁ εἰμί ἕκαστος οὐ εἰμί ποιέω , καί σύμπας δή κατά  οὕτως οὐ εἰμί ὀρθός ἐρέω , καί πάλιν , ὅτι2 μετέχω ὁ εἰμί , εἰμί τε καί εἰμί .
681058	tlg0059.tlg007.perseus-grc2	ΘΕΑΙ. κινδυνεύει.	κινδυνεύω .
681059	tlg0059.tlg007.perseus-grc2	ΞΕ. περὶ ἕκαστον ἄρα τῶν εἰδῶν πολὺ μέν ἐστι τὸ ὄν, ἄπειρον δὲ πλήθει τὸ μὴ ὄν.	περί ἕκαστος ἄρα ὁ  πολύς μέν εἰμί ὁ εἰμί , ἤπειρος δέ πλῆθος ὁ μή εἰμί .
681060	tlg0059.tlg007.perseus-grc2	ΘΕΑΙ. ἔοικεν.	ἔοικα .
681061	tlg0059.tlg007.perseus-grc2	ΞΕ. οὐκοῦν καὶ τὸ ὂν αὐτὸ τῶν ἄλλων ἕτερον εἶναι λεκτέον.	οὐκοῦν καί ὁ εἰμί αὐτός ὁ ἄλλος ἕτερος εἰμί λέγω .
681062	tlg0059.tlg007.perseus-grc2	ΘΕΑΙ. ἀνάγκη.	ἀνάγκη .
681063	tlg0059.tlg007.perseus-grc2	ΞΕ. καὶ τὸ ὂν ἄρʼ ἡμῖν, ὅσαπέρ ἐστι τὰ ἄλλα, κατὰ τοσαῦτα οὐκ ἔστιν·	καί ὁ εἰμί  ἐγώ ,  εἰμί ὁ ἄλλος , κατά τοσοῦτος οὐ εἰμί ·
681064	tlg0059.tlg007.perseus-grc2	ἐκεῖνα γὰρ οὐκ ὂν ἓν μὲν αὐτό ἐστιν, ἀπέραντα δὲ τὸν ἀριθμὸν τἆλλα οὐκ ἔστιν αὖ.	ἐκεῖνος γάρ οὐ εἰμί  μέν  εἰμί ,  δέ ὁ ἀριθμός  οὐ εἰμί αὖ .
681065	tlg0059.tlg007.perseus-grc2	ΘΕΑΙ. σχεδὸν οὕτως.	σχεδόν οὕτως .
681066	tlg0059.tlg007.perseus-grc2	ΞΕ. οὐκοῦν δὴ καὶ ταῦτα οὐ δυσχεραντέον, ἐπείπερ ἔχει κοινωνίαν ἀλλήλοις ἡ τῶν γενῶν φύσις.	οὐκοῦν δή καί οὗτος οὐ δυσχεραίνω , ἐπεί ἔχω κοινωνία ἀλλήλων ὁ ὁ  φύσις .
681067	tlg0059.tlg007.perseus-grc2	εἰ δέ τις ταῦτα μὴ συγχωρεῖ, πείσας ἡμῶν τοὺς ἔμπροσθεν λόγους οὕτω πειθέτω τὰ μετὰ ταῦτα.	εἰ δέ τις οὗτος μή συγχωρέω , πείθω ἐγώ ὁ ἔμπροσθεν λόγος οὕτως  ὁ μετά οὗτος .
681068	tlg0059.tlg007.perseus-grc2	ΘΕΑΙ. δικαιότατα εἴρηκας.	δίκαιος λέγω .
681069	tlg0059.tlg007.perseus-grc2	ΞΕ. ἴδωμεν δὴ καὶ τόδε.	ὁράω δή καί ὅδε .
681070	tlg0059.tlg007.perseus-grc2	ΘΕΑΙ. τὸ ποῖον;	ὁ ποιός ;
681071	tlg0059.tlg007.perseus-grc2	ΞΕ. ὁπόταν τὸ μὴ ὂν λέγωμεν, ὡς ἔοικεν, οὐκ ἐναντίον τι λέγομεν τοῦ ὄντος ἀλλʼ ἕτερον μόνον.	ὁπότε ὁ μή εἰμί λέγω , ὡς ἔοικα , οὐ ἐναντίος τις λέγω ὁ εἰμί ἀλλά ἕτερος μόνος .
681072	tlg0059.tlg007.perseus-grc2	ΘΕΑΙ. πῶς;	πῶς ;
681073	tlg0059.tlg007.perseus-grc2	ΞΕ. οἷον ὅταν εἴπωμέν τι μὴ μέγα, τότε μᾶλλόν τί σοι φαινόμεθα τὸ σμικρὸν ἢ τὸ ἴσον δηλοῦν τῷ ῥήματι;	οἷος ὅταν  τι μή μέγας , τότε  τι  φαίνω ὁ μικρός ἤ ὁ ἴσος δηλόω τῷ ῥῆμα ;
681074	tlg0059.tlg007.perseus-grc2	ΘΕΑΙ. καὶ πῶς;	καί πῶς ;
681075	tlg0059.tlg007.perseus-grc2	ΞΕ. οὐκ ἄρʼ, ἐναντίον ὅταν ἀπόφασις λέγηται σημαίνειν, συγχωρησόμεθα, τοσοῦτον δὲ μόνον, ὅτι τῶν ἄλλων τὶ μηνύει τὸ μὴ καὶ τὸ οὒ προτιθέμενα τῶν ἐπιόντων ὀνομάτων, μᾶλλον δὲ τῶν πραγμάτων περὶ ἅττʼ ἂν κέηται τὰ ἐπιφθεγγόμενα ὕστερον τῆς ἀποφάσεως ὀνόματα.	ΞΕ. οὐ  , ἐναντίος ὅταν ἀπόφασις λέγω σημαίνω ,  ,  δέ μόνος , ὅτι2 ὁ ἄλλος  μηνύω ὁ μή καί ὁ οὐ προτίθημι ὁ  ὄνομα , μᾶλλον δέ ὁ πρᾶγμα περί  ἄν κεῖμαι ὁ  ὕστερον ὁ ἀπόφασις ὄνομα .
681076	tlg0059.tlg007.perseus-grc2	ΘΕΑΙ. παντάπασι μὲν οὖν.	παντάπασι μέν οὖν .
681077	tlg0059.tlg007.perseus-grc2	ΞΕ. τόδε δὲ διανοηθῶμεν, εἰ καὶ σοὶ συνδοκεῖ.	ὅδε δέ  , εἰ καί  συνδοκέω .
681078	tlg0059.tlg007.perseus-grc2	ΘΕΑΙ. τὸ ποῖον;	ὁ ποιός ;
681079	tlg0059.tlg007.perseus-grc2	ΞΕ. ἡ θατέρου μοι φύσις φαίνεται κατακεκερματίσθαι καθάπερ ἐπιστήμη.	ὁ   φύσις φαίνω  καθά ἐπιστήμη .
681080	tlg0059.tlg007.perseus-grc2	ΘΕΑΙ. πῶς;	πῶς ;
681081	tlg0059.tlg007.perseus-grc2	ΞΕ. μία μέν ἐστί που καὶ ἐκείνη, τὸ δʼ ἐπί τῳ γιγνόμενον μέρος αὐτῆς ἕκαστον ἀφορισθὲν ἐπωνυμίαν ἴσχει τινὰ ἑαυτῆς ἰδίαν·	μέν εἰμί που καί ἐκεῖνος , ὁ δέ ἐπί τις  μέρος αὐτός ἕκαστος ἀφορίζω ἐπωνυμία ἴσχω  ἑαυτοῦ ἴδιος ·
681082	tlg0059.tlg007.perseus-grc2	διὸ πολλαὶ τέχναι τʼ εἰσὶ λεγόμεναι καὶ ἐπιστῆμαι.	διό πολύς τέχνη  εἰμί λέγω καί  .
681083	tlg0059.tlg007.perseus-grc2	ΘΕΑΙ. πάνυ μὲν οὖν.	πάνυ μέν οὖν .
681084	tlg0059.tlg007.perseus-grc2	ΞΕ. οὐκοῦν καὶ τὰ τῆς θατέρου φύσεως μόρια μιᾶς οὔσης ταὐτὸν πέπονθε τοῦτο.	οὐκοῦν καί ὁ ὁ  φύσις μόριον  εἰμί αὐτός πάσχω οὗτος .
681085	tlg0059.tlg007.perseus-grc2	ΘΕΑΙ. τάχʼ ἄν·	ἄν ·
681086	tlg0059.tlg007.perseus-grc2	ἀλλʼ ὅπῃ δὴ λέγωμεν;	ὅπῃ δή λέγω ;
681087	tlg0059.tlg007.perseus-grc2	ΞΕ. ἔστι τῷ καλῷ τι θατέρου μόριον ἀντιτιθέμενον;	εἰμί τῷ καλός τι ἕτερος μόριον ἀντιτίθημι ;
681088	tlg0059.tlg007.perseus-grc2	ΘΕΑΙ. ἔστιν.	εἰμί .
681089	tlg0059.tlg007.perseus-grc2	ΞΕ. τοῦτʼ οὖν ἀνώνυμον ἐροῦμεν ἤ τινʼ ἔχον ἐπωνυμίαν;	οὖν ἀνώνυμος ἐρέω ἤ  ἔχω ἐπωνυμία ;
681090	tlg0059.tlg007.perseus-grc2	ΘΕΑΙ. ἔχον·	ἔχω ·
681091	tlg0059.tlg007.perseus-grc2	ὃ γὰρ μὴ καλὸν ἑκάστοτε φθεγγόμεθα, τοῦτο οὐκ ἄλλου τινὸς ἕτερόν ἐστιν ἢ τῆς τοῦ καλοῦ φύσεως.	ὁ γάρ μή καλός ἑκάστοτε φθέγγομαι , οὗτος οὐ ἄλλος  ἕτερος εἰμί ἤ ὁ ὁ καλέω φύσις .
681092	tlg0059.tlg007.perseus-grc2	ΞΕ. ἴθι νυν τόδε μοι λέγε.	εἶμι νῦν ὅδε  λέγω .
681093	tlg0059.tlg007.perseus-grc2	ΘΕΑΙ. τὸ ποῖον;	ὁ ποιός ;
681094	tlg0059.tlg007.perseus-grc2	ΞΕ. ἄλλο τι τῶν ὄντων τινὸς ἑνὸς γένους ἀφορισθὲν καὶ πρός τι τῶν ὄντων αὖ πάλιν ἀντιτεθὲν οὕτω συμβέβηκεν εἶναι τὸ μὴ καλόν;	ἄλλος τις ὁ εἰμί   γένος ἀφορίζω καί πρός τις ὁ εἰμί αὖ πάλιν  οὕτως συμβαίνω εἰμί ὁ μή καλός ;
681095	tlg0059.tlg007.perseus-grc2	ΘΕΑΙ. οὕτως.	οὕτως .
681096	tlg0059.tlg007.perseus-grc2	ΞΕ. ὄντος δὴ πρὸς ὂν ἀντίθεσις, ὡς ἔοικʼ, εἶναί τις συμβαίνει τὸ μὴ καλόν.	εἰμί δή πρός  ἀντίθεσις , ὡς  , εἰμί τις συμβαίνω ὁ μή καλός .
681097	tlg0059.tlg007.perseus-grc2	ΘΕΑΙ. ὀρθότατα.	ὀρθός .
681098	tlg0059.tlg007.perseus-grc2	ΞΕ. τί οὖν;	τίς οὖν ;
