id	filename	tokens	lemmas
800359	tlg0082.tlg004.1st1K-grc1	καὶ ἐν γένεϲι, καθὸ οὔτε τοῦ ἐκτροῦϲα τὸ ἀρρενικόν τιϲ ζητήϲει, οὔτε τοῦ ἄρϲην τὸ θηλυκόν.	καί ἐν  , καθό οὔτε ὁ  ὁ ἀρρενικός   , οὔτε ὁ  ὁ  .
800360	tlg0082.tlg004.1st1K-grc1	καὶ ἦν εἰϲ τὸ τοιοῦτο παράθεϲιϲ δυϲπερίληπτοϲ.	καί εἰμί  ὁ τοιοῦτος   .
800361	tlg0082.tlg004.1st1K-grc1	καὶ δὴ οὖν ἐπὶ τοῦ προκειμένου ἐκεῖνό φαϲιν·	καί δή οὖν ἐπί ὁ  ἐκεῖνος  ·
800362	tlg0082.tlg004.1st1K-grc1	« εἰ ἐν τοῖϲ οὐκ οὖϲιν αἱ εὐχαὶ γίνονται εἰϲ τὸ ἐγγενέϲθαι, πῶϲ τὰ γενόμενα εὐχῆϲ ἔτι δέεται;	« εἰ ἐν  οὐ  ὁ εὐχή γίγνομαι  ὁ  ,  ὁ γίγνομαι  ἔτι δέω2 ;
800363	tlg0082.tlg004.1st1K-grc1	» Πρὸϲ ὃ ἔϲτιν φάναι ὡϲ πᾶϲα ἀνάγκη ὑπάρξαι καὶ τὴν ἐκ παρῳχημένου εὐχήν.	»  ὁ  φαίνω   ἀνάγκη ὑπάρχω καί ὁ ἐκ  εὐχή .
800364	tlg0082.tlg004.1st1K-grc1	φέρε γὰρ τὸν ἐπιβάλλοντα χρόνον τοῦ γινομένου ἀγῶνοϲ Ὀλυμπίαϲι παρῳχῆϲθαι, καὶ πατέρα εὔχεϲθαι ὑπὲρ παιδὸϲ ἀγωνιϲαμένου περὶ τῆϲ τούτου νίκηϲ·	φέρω γάρ ὁ ἐπιβάλλω χρόνος ὁ     , καί πατήρ  ὑπέρ   περί  οὗτος  ·
800365	tlg0082.tlg004.1st1K-grc1	καὶ δῆλον ὡϲ οὔτε ποιήϲεται εὐχὴν διὰ τῆϲ τοῦ ἐϲομένου χρόνου οὔτε μὴν τοῦ κατὰ τὸν ἐνεϲτῶτα παρατεινομένου( τὰ γὰρ τοῦ παρῳχημένου ἀντίκειται), ἐξ οὗ ἂν ἀκολούθωϲ γένοιτο ἡ εὐχὴ εἴθε νενικήκοι μου ὁ παῖϲ, εἴθε δεδοξαϲμένοϲ εἶη.	καί δῆλος  οὔτε  εὐχή διά  ὁ  χρόνος οὔτε μήν ὁ κατά ὁ   ( ὁ γάρ ὁ  ἀντίκειμαι ) , ἐκ οὗ ἄν  γίγνομαι ὁ εὐχή    ὁ  , εἴθε   .
800366	tlg0082.tlg004.1st1K-grc1	Ἕϲτι καὶ οὕτωϲ φάναι, ὡϲ ἀληθεύει ὅτι ἐπὶ τοῖϲ μὴ ϲυνοῦϲιν αἱ εὐχαὶ γίνονται·	καί  φημί ,  ἀληθεύω ὅτι2 ἐπί  μή  ὁ εὐχή γίγνομαι ·
800367	tlg0082.tlg004.1st1K-grc1	οὐ ϲυνόντοϲ γὰρ τοῦ φιλολογεῖν φαίημεν ἂν φιλoλογῖμι, λογοῖμι, οὐ ϲυνόντοϲ τοῦ πλουτεῖν τὸ πλουτοῖμι·	οὐ  γάρ ὁ   ἐάν  ,  , οὐ  ὁ πλουτέω ὁ  ·
800368	tlg0082.tlg004.1st1K-grc1	χρὴ μέντοι νοεῖν ὡϲ τὸ ἐξαιτούμενον ἐκ τοῦ εὐκτικοῦ ἢ εἰϲ παράταϲιν τοῦ ἐνεϲτῶτοϲ παραλαμβάνεται, ἵνα ἐν αὐτῷ διαγίνηται, ὡϲ εἴ τιϲ φαίη ζώοιμι ὦ θεοί, ἢ εἰϲ τελείωϲιν τῶν μὴ ὄντων πραγμάτων, ὡϲ ὁ Ἀγαμέμνων εὔχεται, εἴθε ὦ θεοὶ πορθήϲαιμι τὴν Ἴλιον·	χρή  νοέω  ὁ ἐξαιτέω ἐκ ὁ  τίη   ὁ  παραλαμβάνω , ἵνα ἐν αὐτός  ,  εἰ  φημί  ὦ θεός , τίη   ὁ μή εἰμί πρᾶγμα ,  ὁ Ἀγαμέμνων εὔχομαι , εἴθε ὦ   ὁ Ἴλιος ·
800369	tlg0082.tlg004.1st1K-grc1	εὐχὴ γὰρ νῦν γίνεται εἰϲ τὸ παρῳχημένον καὶ ϲυντελὲϲ τοῦ χρόνου.	εὐχή γάρ νῦν γίγνομαι  ὁ  καί  ὁ χρόνος .
800370	tlg0082.tlg004.1st1K-grc1	τὴν γὰρ παράταϲιν ἀπευκταίαν ἕξει·	ὁ γάρ   ἔχω ·
800371	tlg0082.tlg004.1st1K-grc1	πορθοῦντι γὰρ αὐτῷ τὴν Ἴλιον ἐννέα δὴ βεβάαϲι Διὸϲ μεγάλου ἐνιαυτοί, καὶ δὴ δοῦρα ϲέϲηπε νεῶν καὶ ϲπάρτα λέλυνται{B 134 seq.	γάρ αὐτός ὁ Ἴλιος ἐννέα δή   μέγας ἐνιαυτός , καί δή δόρυ  ναῦς καί  λύω { B   .
800372	tlg0082.tlg004.1st1K-grc1	}.	.
800373	tlg0082.tlg004.1st1K-grc1	καθότι πάλιν κατὰ τὸ ἐναντίον ἔϲτιν ἐπινοῆϲαι ἐπὶ τοῦ ζώοιμι.	καθότι πάλιν κατά ὁ ἐναντίος   ἐπί ὁ  .
800374	tlg0082.tlg004.1st1K-grc1	οὐ γὰρ δή γέ τιϲ παραλήψεται εἰϲ εὐχὴν τὴν τοῦ ζῆν ϲυντέλειαν ἐν τῷ ζήϲαιμι.	οὐ γάρ δή γε    εὐχή ὁ ὁ ζήω  ἐν ὁ  .
800375	tlg0082.tlg004.1st1K-grc1	ἡ γὰρ τοιαύτη ϲυντέλεια τῆϲ εὐχῆϲ δυνάμει περιγράφει τὴν τοῦ βίου διατριβήν.	ὁ γάρ τοιοῦτος    δύναμις περιγράφω ὁ ὁ βίος διατριβή .
800376	tlg0082.tlg004.1st1K-grc1	Τὸ αὐτὸ ἄπορον μέτειϲι καὶ ἐπὶ τὰ προϲτακτικά.	αὐτός   καί ἐπί ὁ  .
800377	tlg0082.tlg004.1st1K-grc1	πάλιν γὰρ τὰ οὐ γενόμενα προϲτάϲϲεται, καὶ ἀληθὲϲ ὅτι τὰ παρῳχημένα γέγον.	πάλιν γάρ ὁ οὐ γίγνομαι  , καί  ὅτι2 ὁ   .
800378	tlg0082.tlg004.1st1K-grc1	καὶ κατὰ τὸ αὐτὸ οὐ χρὴ παρῳχημένου χρόνου προϲτακτικὸν παραλαμβάνειν.	καί κατά ὁ αὐτός οὐ χρή  χρόνος  παραλαμβάνω .
800379	tlg0082.tlg004.1st1K-grc1	Καὶ ἔϲτιν γε πάλιν ἐπὶ τῶν τοιούτων ταὐτὸν φάναι, ὡϲ τὸ πρῶτον διαφέρει τὸ κλειέϲθω ἡ θύρα τοῦ κεκλείϲθω, καθὸ ἡ μὲν κατὰ τὸν ἐνεϲτῶτα ἐκφορὰ ὑπαγορεύει τὴν ὑπόγυον πρόϲταξιν, ὅπερ ἐνεϲτῶτοϲ τοῦ παρατεινομένου ἦν ἴδιον, τό γε μὴν κεκλείϲθω τὴν ἔκπαλαι ὀφείλουϲαν διάθεϲιν γενέϲθαι.	καί  γε πάλιν ἐπί ὁ τοιοῦτος αὐτός φημί ,  ὁ πρῶτος διαφέρω ὁ  ὁ θύρα ὁ  , καθό ὁ μέν κατά ὁ  ἐκφορά ὑπαγορεύω ὁ   , ὅς  ὁ  εἰμί ἴδιος , ὁ γε μήν  ὁ     .
800380	tlg0082.tlg004.1st1K-grc1	Ἀλλὰ καὶ εἴπομεν ὡϲ ἃ μὲν προϲτάϲϲεται αὐτῶν εἰϲ παράταϲιν.	ἀλλά καί λέγω  ὅς μέν  αὐτός   .
800381	tlg0082.tlg004.1st1K-grc1	ὁ γὰρ ἀποφαινόμενοϲ οὕτωϲ, γράφε, ϲάρου, ϲκάπτε, ἐν παρατάϲει τῆϲ διαθέϲεωϲ τὴν πρόϲταξιν ποιεῖται, ὡϲ ἔχει καὶ τὸ βάλλ᾿ οὕτωϲ, αἴ κέν τι φόωϲ Δαναοῖϲι γένηαι{Θ 282}·	ὁ γάρ   ,  ,  ,  , ἐν    ὁ  ποιέω ,  ἔχω καί ὁ   , εἰ ἄν τις   γίγνομαι { Θ  } ·
800382	tlg0082.tlg004.1st1K-grc1	φηϲὶ γὰρ ἐν τῷ πολέμῳ καταγίνου εἰϲ τὸ βάλλειν.	γάρ ἐν ὁ πόλεμος   ὁ βάλλω .
800383	tlg0082.tlg004.1st1K-grc1	ὅ γε μὴν λέγων κατὰ τὴν τοῦ παρῳχημένου προφορὰν γράψον, ϲκάψον, οὐ μόνον τὸ μὴ γινόμενον προϲτάϲϲει, ἀλλὰ καὶ τὸ γινόμενον ἐν παρατάϲει ἄπαγορεύει εἴγε καὶ τοῖϲ γράφουϲιν ἐν πλείονι χρόνῳ προϲφωνοῦμεν τὸ γράψον, τοιοῦτόν τι φάϲκοντεϲ, μὴ ἐμμένειν τῇ παρατάϲει, ἀνύϲαι δὲ τὸ γράφειν.	ὁ γε μήν λέγω κατά ὁ ὁ  προφορά γράφω ,  , οὐ μόνος ὁ μή   , ἀλλά καί ὁ  ἐν    καί   ἐν πολύς χρόνος  ὁ  , τοιοῦτος τις  , μή ἐμμένω ὁ  ,  δέ ὁ γράφω .
800384	tlg0082.tlg004.1st1K-grc1	Τὰ δεύτερα πρόϲωπα τῶν προϲτακτικῶν πρόδηλον ἔχει τὴν ϲύνταξιν, κἂν ὁμόφωνα καθεϲτήκῃ τῇ ὁριϲτικῇ ἐγκλίϲει·	δεύτερος  ὁ  πρόδηλος ἔχω ὁ  , ἐάν   ὁ   ·
800385	tlg0082.tlg004.1st1K-grc1	ἡ γὰρ ϲυνοῦϲα αὐτοῖϲ κλητικὴ ἀφίϲτηϲι τὴν ἀμφιβολίαν τὴν πρὸϲ τὸ ὁριϲτικόν, καὶ τὸ ϲυνταϲϲόμενον ἐπίρρημα, λέγω δὴ τὸ ἄγε, ὥϲ γε ἐν τοῖϲ ἑξῆϲ παραϲτήϲομεν.	ὁ γάρ     ὁ ἀμφιβολία ὁ  ὁ  , καί ὁ   , λέγω δή ὁ ἄγε ,  γε ἐν    .
800386	tlg0082.tlg004.1st1K-grc1	τὰ γὰρ τρίτα καὶ τῇ φωνῇ ἰδιάϲαντα οὐδὲ κατ’ ὀλίγον ἀμφιβάλλεται.	ὁ γάρ τρίτος καί ὁ φωνή  οὐδέ κατά ὀλίγος ἀμφιβάλλω .
800387	tlg0082.tlg004.1st1K-grc1	Τά γε μὴν τοῦ πρώτου προϲώπου πρόϲ τινων οὐδὲ παραλαμβάνεται, λαμβάνεται, λόγοιϲ τοιούτοιϲ.	γε μήν ὁ πρῶτος   τις οὐδέ παραλαμβάνω , λαμβάνω ,   .
800388	tlg0082.tlg004.1st1K-grc1	κεχωρίϲθαι φαϲὶ δεῖν τὸν προϲτάϲϲοντα τοῦ προϲταϲϲομένου,« ὅπερ οὐκ ἔϲτιν ἐπινοῆϲαι ἐν πρώτῳ προϲώπῳ·	δέω ὁ  ὁ  , « ὅς οὐ   ἐν πρῶτος  ·
800389	tlg0082.tlg004.1st1K-grc1	ἐϲτιν γὰρ πρῶτον τὸ ὑπὲρ ἑαυτοῦ ἀποφαινόμενον, δεύτερον δὲ τὸ πρὸϲ ὃ ἡ ἀπόταϲιϲ ὑπὲρ αὐτοῦ τοῦ προϲφωνουμένου, εἰϲ ὃ καὶ ἐγχωρεῖ ἡ ἔγκλιϲιϲ ἐν τῷ φεῦγε, λέγε, γράφε.	γάρ πρῶτος ὁ ὑπέρ ἑαυτοῦ ἀποφαίνω , δεύτερος δέ ὁ  ὅς ὁ  ὑπέρ αὐτός ὁ  ,  ὅς καί ἐγχωρέω ὁ  ἐν τῷ φεύγω , λέγω ,  .
800390	tlg0082.tlg004.1st1K-grc1	» ἀλλὰ κἀκεῖνο δῆλόν ἐϲτιν, ὡϲ αἱ κλητικαὶ ἐν δυϲὶ προϲώποιϲ καταγίνονται, τῷ τε προϲκαλοῦντι καὶ τῷ προϲκαλουμένῳ·	» ἀλλά  δῆλος  ,  ὁ  ἐν    , τῷ τε  καί τῷ  ·
800391	tlg0082.tlg004.1st1K-grc1	καὶ διὰ τοῦτο τῶν κατὰ τὸ πρῶτον πρόϲωπον ἀντωνυμιῶν κλητικαὶ οὐκ ἦϲαν, τῶν γε μὴν πάλιν κατὰ τὸ δεύτερον.	καί διά οὗτος ὁ κατά ὁ πρῶτος    οὐ  , ὁ γε μήν πάλιν κατά ὁ δεύτερος .
800392	tlg0082.tlg004.1st1K-grc1	ϲαφὲϲ οὖν ὅτι καὶ ἐκ τῆϲ τοιαύτηϲ ϲυντάξεωϲ δείκνυται ὡϲ πρώτου προϲώπου οὐκ ἔϲτι προϲτακτικά·	οὖν ὅτι2 καί ἐκ    δείκνυμι  πρῶτος     ·
800393	tlg0082.tlg004.1st1K-grc1	τὴν γὰρ ἐκ τῶν κλητικῶν ϲύνταξιν ἀναδέχονται, τιϲ ἐδέδεικτο ἀϲύϲτατοϲ κατὰ τὸ πρῶτον πρόϲωπον.	ὁ γάρ ἐκ ὁ   ἀναδέχομαι ,  δείκνυμι  κατά ὁ πρῶτος  .
800394	tlg0082.tlg004.1st1K-grc1	καὶ ὡϲ οὐκ ἔϲτιν ἐπινοῆϲαι ἑαυτόν τινα προϲκαλούμενον διὰ τὸ ἀχώριϲτον τοῦ προϲώπου, οὕτωϲ οὐδὲ ἑαυτῷ προϲτάϲϲοντα διὰ τὸ ἀχώριϲτον τοῦ προϲώπου·	καί  οὐ   ἑαυτοῦ τις  διά ὁ  ὁ  ,  οὐδέ ἑαυτοῦ  διά ὁ  ὁ  ·
800395	tlg0082.tlg004.1st1K-grc1	πᾶν γὰρ προϲτακτικὸν ἐκ προϲώπου ἐπικρατοῦντοϲ ϲυνέϲτηκεν ὡϲ πρὸϲ ἐπικρατούμενον.	πᾶς γάρ  ἐκ       .
800396	tlg0082.tlg004.1st1K-grc1	Οἵ γε μὴν παραδεχόμενοι τὴν ἐν πρώτοιϲ προϲώποιϲ ἐπιγινομένην πρόϲταξιν, οὐκ ἀναϲκευάϲαντεϲτοὺϲ προκειμένουϲ λόγουϲ, παρατίθενται ὡϲ προϲτακτικὰ ἐν τῇ χρήϲει, φεύγωμεν ϲὺν νηυϲὶ φίλην ἐϲ πατρίδα γαῖαν(B 140 etl 27}, ἀλλ᾿ ἄγε δὴ χαζώμεθ᾿ ἐφ’ ἵππῶν{Ε 249}, καὶ ἅπαντα κατὰ τὴν κοινὴν χρῆϲιν οὕτω λεγόμενα.	γε μήν  ὁ ἐν     , οὐ  τοὺϲ   , παρατίθημι   ἐν ὁ  , φεύγω   φίλος   γῆ ( B   l  } ,  ἄγε δή  ἐπί  { Ε  } , καί ἅπας κατά ὁ κοινός  οὕτως λέγω .
800397	tlg0082.tlg004.1st1K-grc1	ἐξ ὧν πειρῶνται καὶ τὰ ἑνικὰ παραλαμβάνειν.	ἐκ  πειράω καί ὁ  παραλαμβάνω .
800398	tlg0082.tlg004.1st1K-grc1	« ὃν γὰρ τρόπον τῶν δευτέρων πληθυντικῶν ἡ παραλήγουϲα ἀποβάλλουϲα τὴν τε λήγουϲα γίνεται τῶν ἑνικῶν, λέγετε λέγε, νοεῖτε νόει, τὸν αὐτὸν τρόπον καὶ τῶν πρώτων ἡ παραλήυουϲα ἀποβαλοῦϲα τὸ μεν καταϲτήϲει τὸ ἑνικὸν προϲτακτικόν, φέρω μεν φέρω, ἀριθμήϲωμεν ἀριθμήϲω.	«  γάρ τρόπος ὁ δεύτερος πληθυντικός ὁ   ὁ τε  γίγνομαι ὁ ἑνικός , λέγω λέγω , νοέω νοέω , ὁ αὐτός τρόπος καί ὁ  ὁ   ὁ   ὁ   , φέρω  φέρω ,   .
800399	tlg0082.tlg004.1st1K-grc1	καὶ οὐ ξένον εἰ ὁμοφωνεῖ ταῖϲ ὁριϲτικαῖϲ φωναῖϲ, ὅπου γε καὶ ἡ ἐν δευτέροιϲ προϲώποιϲ ὁμοφωνία ἐγγίνεται.	καί οὐ ξένος εἰ ὁμοφωνέω    , ὅπου γε καί ὁ ἐν    ἐγγίγνομαι .
800400	tlg0082.tlg004.1st1K-grc1	» « πρόδηλον κἀκ τῆϲ ϲυντάξεωϲ τῆϲ ἄγε λέγωμεν, ἄγε φέρωμεν, ἧϲ τὸ ἑνικὸν γενήϲεται φέρε λέγω, φέρε ἀριθμήϲω.	πρόδηλος ἐκ    ἄγε λέγω , ἄγε φέρω ,  ὁ   φέρω λέγω , φέρω  .
800401	tlg0082.tlg004.1st1K-grc1	( τὸ γοῦν δεύτερον πρόϲωποντῆϲ ὁριϲτικῆϲ ἐγκλίϲεωϲ, οὐ ϲυνεμπῖπτον τῇ προϲτακτικῇ ἐγκλίϲει, οὐδὲ τὴν τούτων ϲύνταξιν ἀναδέχετάι·	( ὁ γοῦν δεύτερος  τῆϲ   , οὐ  ὁ   , οὐδέ ὁ οὗτος   ·
800402	tlg0082.tlg004.1st1K-grc1	τίϲ γὰρ ἂν φαίη φέρε λέγειϲ ἢ φέρε ἀριθμήϲειϲ;	γάρ ἄν φημί φέρω  ἤ φέρω  ;
800403	tlg0082.tlg004.1st1K-grc1	) οὕτωϲ δ᾿ ἔχει κἀκεῖνο ἀλλ᾿ ἄγε δὴ τὰ χρήματ᾿ ἀριθμήϲω καὶ ἴδωμαι{ ν 215}·	)   ἔχω   ἄγε δή ὁ   καί εἶδον {   } ·
800404	tlg0082.tlg004.1st1K-grc1	ἀλλ᾿ ἄγ᾿ ἐγών, ὃϲ ϲεῖο γεραίτεροϲ εὔχομαι εἶναι, ἐξείπω{l 60 seq.	,    εὔχομαι εἰμί , ἐξαγορεύω { l   .
800405	tlg0082.tlg004.1st1K-grc1	}» Ἐμοί γε μὴν δοκεῖ τὰ τῆϲ ἐγκλίϲεωϲ ἐπιτεταράχθαι, ἐπεὶ ϲχεδὸν ἐγκλίϲειϲ δύο ϲυνωθοῦϲιν εἰϲ μίαν ἔγκλιϲιν.	»  γε μήν δοκέω ὁ    , ἐπεί   γε     .
800406	tlg0082.tlg004.1st1K-grc1	ἔχει δὲ τὰ τῆϲ ἀπο δείξεωϲ τῇδε.	ἔχω δέ ὁ    ὅδε .
800407	tlg0082.tlg004.1st1K-grc1	Δέδοται ὅτι οὐ προϲκαλούμεθα ἑαυτούϲ, οὐδὲ μὴν προϲτάϲϲομεν ϲτάϲϲομεν ἑαυτοῖϲ, καθ’ ἣν εἴπομεν ἔννοιαν τῶν προϲτακτικῶν.	ὅτι2 οὐ   , οὐδέ μήν    , κατά ὅς λέγω ἔννοια ὁ  .
800408	tlg0082.tlg004.1st1K-grc1	ὑποτιθέμεθα μέντοι ἑαυτοῖϲ, ὥϲ γε ἔχει ἐπὶ τοῦ Διόϲ.	ὑποτίθημι μέντοι  ,  γε ἔχω ἐπί ὁ  .
800409	tlg0082.tlg004.1st1K-grc1	ἐν γὰρ πολλαῖϲ ὑποθήκαιϲ ἐγγενόμενοϲ καὶ μίαν ἀρίϲτην ὑπονοήϲαϲ τοιοῦτό τι εἶπε, πέμψω ἐπ’ Ἀτρείδῃ Ἀγαμέμνονι οὖλον ὄνειρον·	ἐν γάρ    καί     τις λέγω , πέμπω ἐπί Ἀτρείδης Ἀγαμέμνων οὖλος2 ὄνειρος ·
800410	tlg0082.tlg004.1st1K-grc1	οὗ πάλιν ἡ μετάληψιϲ γενήϲεται εἰϲ ἀπαρέμφατον κατὰ τὸ διηγηματικόν, πέμψαι ἐπ’ Ἀτρείδῃ Ἀγαμέμνονι οὖλον ὄνειρον{B 6}.	οὗ πάλιν ὁ     κατά ὁ  , πέμπω ἐπί Ἀτρείδης Ἀγαμέμνων οὖλος2 ὄνειρος { B  } .
800411	tlg0082.tlg004.1st1K-grc1	— Ἀπὸ δὴ τοῦ τοιούτου ἑνικοῦ μετῄει καὶ πληθυντικὸϲ ἀριθμόϲ, ἐπιϲπώμενοϲ τὴν ἐκ δευτέρων καὶ τρίτων προϲώπων ϲύλληψιν, πέμψωμεν, ἀριθμήϲωμεν·	— ἀπό δή ὁ τοιοῦτος  μέτειμι2 καί   ,  ὁ ἐκ δεύτερος καί τρίτος   , πέμπω ,  ·
800412	tlg0082.tlg004.1st1K-grc1	ἣν μάλιϲτα καὶ εὔχρηϲτον ὑπολαμβάνω καθίϲταϲθαι ὡϲ πρὸϲ τὰ ἐπικρατοῦντα πρόϲωπα, εἴγε ϲύνταξιν ἐπικρατουμένων προϲώπων ἄντικρυϲ οὐκ ἀναδέχεται.	ὅς  καί  ὑπολαμβάνω    ὁ ἐπικρατέω  , εἰ     οὐ ἀναδέχομαι .
800413	tlg0082.tlg004.1st1K-grc1	εἴπομεν γὰρ ὡϲ τὰ προϲτακτικὰ ἐξ ἐπικρατούντων ἐϲτὶν προϲώπων καὶ ἐξ ἐπικρατουμένων, ἃ καὶ τὴν πρόϲταξιν ἀναδέχεται τοῦ πράγματοϲ.	λέγω γάρ  ὁ  ἐκ ἐπικρατέω   καί ἐκ  , ὅς καί ὁ  ἀναδέχομαι ὁ  .
800414	tlg0082.tlg004.1st1K-grc1	ἱν᾿ οὖν ἐκκλίνῃ τὴν ἐν δευτέροιϲ προϲώποιϲ γινομένην πρόϲταξιν, ϲύλληψιν ἀναδέχεται τὴν εἰϲ τὸ πρῶτον, ἥτιϲ κατὰ τὸ ἑνικὸν ἐδείχθη ὑποθετική.	οὖν ἐκκλίνω ὁ ἐν     ,  ἀναδέχομαι ὁ  ὁ πρῶτος ,  κατά ὁ  δείκνυμι  .
800415	tlg0082.tlg004.1st1K-grc1	καὶ δῆλον ὅτι τῇ ἐπικρατείᾳ τῇ κατὰ τὸ πρῶτον καὶ τὰ ϲυγγενόμενα πρόϲωπα τῆϲ αὐτῆϲ ἐγκλίϲεωϲ ἐτύγχανεν.	καί δῆλος ὅτι2 ὁ ἐπικράτεια ὁ κατά ὁ πρῶτος καί ὁ      τυγχάνω .
800416	tlg0082.tlg004.1st1K-grc1	τοιοῦτο γάρ ἐϲτι καὶ τὸ πρὸϲ Ϲθενέλου εἰρημένον ἀλλ᾿ ἄγε δὴ χαζώμεθ᾿ ἐφ’ ἵππων{ ε 249}, ἵνα μὴ ἐν τῷ ὑπερέχοντι προϲώπῳ προϲτάξῃ ἐν τῷ χάζου.	γάρ  καί ὁ   λέγω  ἄγε δή  ἐπί ἵππος {   } , ἵνα μή ἐν τῷ ὑπερέχω   ἐν ὁ  .
800417	tlg0082.tlg004.1st1K-grc1	τοιοῦτό ἐϲτιν καὶ τὸ πρὸϲ Νέϲτοροϲ εἰρημένον ἀλλ᾿ ἄνδραϲ κτείνωμεν{Ζ 70}·	τοιοῦτος  καί ὁ   λέγω   κτείνω { Ζ  } ·
800418	tlg0082.tlg004.1st1K-grc1	ἑαυτὸν γὰρ ϲυλλαβὼν προθυμοτέρουϲ καθίϲτηϲι τοὺϲ Ἕλληναϲ εἰϲ τὸν κατεπείγοντα πόλεμον.	ἑαυτοῦ γάρ       ὁ κατεπείγω πόλεμος .
800419	tlg0082.tlg004.1st1K-grc1	Οὐ δὲ οὖν δεύτερα καὶ τρίτα ὑπολαμβάνω πρόϲωπα εἶναι τῶν τοιούτων ὑποθετικῶν·	οὐ δέ οὖν δεύτερος καί τρίτος ὑπολαμβάνω  εἰμί ὁ   ·
800420	tlg0082.tlg004.1st1K-grc1	ἴνα γὰρ μὴ γένηται δεύτερον, πρῶτον ἐγένετο καθ’ ἣν εἴπομεν ϲύλληψιν τῶν ἑνικῶν.	γάρ μή γίγνομαι δεύτερος , πρῶτος γίγνομαι κατά ὅς λέγω  ὁ  .
800421	tlg0082.tlg004.1st1K-grc1	ἔϲτι καὶ διὰ τῆϲ φωνῆϲ τὸ τοιοῦτον παραϲτῆϲαι.	καί διά   ὁ   .
800422	tlg0082.tlg004.1st1K-grc1	πάϲηϲ ἐγκλίϲεωϲ τὰ δεύτερα πρόϲωπα πληθυντικὰ εἰϲ τε λήγοντα ἰϲοχρονεῖ κατὰ τὴν παρεδρεύουϲαν τοῖϲ πρώτοιϲ, λέγοιμεν λέγοιτε, λέγομεν λέγετε.	ὁ δεύτερος    τε λήγω  κατά ὁ    ,  λέγω , λέγω λέγω .
800423	tlg0082.tlg004.1st1K-grc1	διὰ τοῦτό φαμεν τῷ ῥιπτοῦμεν παρακεῖϲθαι τὸ ῥιπτεῖτε, τῷ δὲ ῥίπτομεν τὸ ῥίπτετε.	διά οὗτος φημί τῷ ῥίπτω  ὁ ῥίπτω , τῷ δέ  ὁ  .
800424	tlg0082.tlg004.1st1K-grc1	περιϲϲὸν ὑποδείγμαϲιν χρῆϲθαι καθολικοῦ ὄντοϲ τοῦ λόγου.	καθολικός  ὁ λόγος .
800425	tlg0082.tlg004.1st1K-grc1	πῶϲ οὖν καὶ κατὰ τὸν λόγον τῆϲ φωνῆϲ παρακείϲεται τῷ φεύγετε τὸ φεύγωμεν;	οὖν καί κατά ὁ λόγος    τῷ φεύγω ὁ φεύγω ;
800426	tlg0082.tlg004.1st1K-grc1	τὰ εἰϲ θε λήγοντα μιᾷ ἐνδεῖ ϲυλλαβῇ τῶν εἰϲ θα ληγόντων κατὰ πᾶϲαν ἔγκλιϲιν·	ὁ   λήγω  ἐνδέω  ὁ   λήγω κατά   ·
800427	tlg0082.tlg004.1st1K-grc1	οὐκ ἄρα καὶ κατὰ τὸ τοιοῦτον τῷ πεποιηκώμεθα παρακείϲεται δεύτερον τὸ πεποίηϲθε.	οὐ ἄρα καί κατά ὁ  τῷ   δεύτερος ὁ  .
800428	tlg0082.tlg004.1st1K-grc1	Φαίνεται οὖν ὅτι τὸ λεῖπον τῶν προϲτακτικῶν προϲώπων, λέγω τὸ πρῶτον, καὶ τὰ λείποντα τῶν ὑποθετικῶν δεύτερα καὶ τρίτα εἰϲ ἕνωϲιν ἄγει τὸ τὰϲ δύο ἐγκλίϲειϲ παραλαμβάνεϲθαι, ἵν᾿ ἑκατέρα ἀνταναπληρωθῇ τοῦ λείποντοϲ, τῶν ἐγκλίϲεων καὶ κατὰ τὸ ϲημαινόμενον ϲυντρεχουϲῶν.	φαίνω οὖν ὅτι2 ὁ λείπω ὁ   , λέγω ὁ πρῶτος , καί ὁ λείπω ὁ ὑποθετικός δεύτερος καί τρίτος   ἄγω ὁ  γε   ,    ὁ  , ὁ  καί κατά ὁ   .
800429	tlg0082.tlg004.1st1K-grc1	Εἰ δέ τινεϲ προϲβιάϲονται καὶ ἐν δευτέροιϲ προϲώποιϲ καταγίνεϲθαι τὰ ὑποθετικὰ καθ’ ὁμοφωνίαν τὴν πρὸϲ τὰ προϲτακτικά, ἐκεῖνο ἂν φαίημεν, ὡϲ ϲυνοῦϲα ἡ διὰ τοῦ ἄγε ϲύντοξιϲ ἐξαίρετον καταϲτήϲει τὴν προϲτακτικὴν ἔγκλιϲιν·	δέ   καί ἐν    ὁ  κατά ὁμοφωνία ὁ  ὁ  , ἐκεῖνος ἄν  ,   ὁ διά ὁ ἄγε  ἐξαιρετός  ὁ   ·
800430	tlg0082.tlg004.1st1K-grc1	προφανῶϲ γὰρ τὸ ἐγκελευϲτικὸν ἐπίρρημα ἐπέτεινε τὴν πρόϲταξιν.	γάρ ὁ   ἐπιτείνω ὁ  .
800431	tlg0082.tlg004.1st1K-grc1	Ἐχομένωϲ ῥητέον καὶ περὶ τῶν κατὰ τρίτον πρόϲωπον προϲτακτικῶν, δὴ καὶ αὐτὰ δευτέρου προϲώπου φαϲὶν εἶναι, διαφέρειν δὲ τῶν προκειμένων, καθὸ ἐκεῖνα μὲν αὐτόθεν τὴν πρόϲτοξιν τοῦ πράγματοϲ παραδέχεται, ταῦτα δὲ ἐγκελεύεται εἰϲ ἑτέρων προϲώπων πρόϲταξιν.	λέγω καί περί ὁ κατά    , δή καί αὐτός δεύτερος   εἰμί , διαφέρω δέ ὁ  , καθό ἐκεῖνος μέν αὐτός ὁ  ὁ  παραδέχομαι , οὗτος δέ   ἕτερος   .
