id	filename	tokens	lemmas
680678	tlg0059.tlg007.perseus-grc2	ΞΕ. καὶ τὸ ἕν γε, ἑνὸς ὄνομα ὂν καὶ τοῦ ὀνόματος αὖ τὸ ἓν ὄν.	καί ὁ  γε ,  ὄνομα εἰμί καί ὁ ὄνομα αὖ ὁ  εἰμί .
680679	tlg0059.tlg007.perseus-grc2	ΘΕΑΙ. ἀνάγκη.	ἀνάγκη .
680680	tlg0059.tlg007.perseus-grc2	ΞΕ. τί δέ;	τίς δέ ;
680681	tlg0059.tlg007.perseus-grc2	τὸ ὅλον ἕτερον τοῦ ὄντος ἑνὸς ἢ ταὐτὸν φήσουσι τούτῳ;	ὁ ὅλος ἕτερος ὁ   τίη αὐτός φημί οὗτος ;
680682	tlg0059.tlg007.perseus-grc2	ΘΕΑΙ. πῶς γὰρ οὐ φήσουσί τε καὶ φασίν;	πῶς γάρ οὐ  τε καί φημί ;
680683	tlg0059.tlg007.perseus-grc2	ΞΕ. εἰ τοίνυν ὅλον ἐστίν, ὥσπερ καὶ Παρμενίδης λέγει, πάντοθεν εὐκύκλου σφαίρης ἐναλίγκιον ὄγκῳ, μεσσόθεν ἰσοπαλὲς πάντῃ·	εἰ τοίνυν ὅλος εἰμί , ὥσπερ καί Παρμενίδης λέγω , πᾶς εὔκυκλος σφαῖρα ἐναλίγκιος ὄγκος , μέσος ἰσοπαλής πᾶς ·
680684	tlg0059.tlg007.perseus-grc2	τὸ γὰρ οὔτε τι μεῖζον οὔτε τι βαιότερον πελέναι χρεόν ἐστι τῇ ἢ τῇ, τοιοῦτόν γε ὂν τὸ ὂν μέσον τε καὶ ἔσχατα ἔχει, ταῦτα δὲ ἔχον πᾶσα ἀνάγκη μέρη ἔχειν·	ὁ γάρ οὔτε τι μέγας οὔτε τι βαιός  χρεών εἰμί ὁ ἤ ὁ , τοιοῦτος γε εἰμί ὁ εἰμί μέσος τε καί ἔσχατος ἔχω , οὗτος δέ ἔχω πᾶς ἀνάγκη μέρος ἔχω ·
680685	tlg0059.tlg007.perseus-grc2	ἢ πῶς;	τίη πῶς ;
680686	tlg0059.tlg007.perseus-grc2	ΘΕΑΙ. οὕτως.	οὕτως .
680687	tlg0059.tlg007.perseus-grc2	ΞΕ. ἀλλὰ μὴν τό γε μεμερισμένον πάθος μὲν τοῦ ἑνὸς ἔχειν ἐπὶ τοῖς μέρεσι πᾶσιν οὐδὲν ἀποκωλύει, καὶ ταύτῃ δὴ πᾶν τε ὂν καὶ ὅλον ἓν εἶναι.	ἀλλά μήν ὁ γε μερίζω πάθος μέν ὁ  ἔχω ἐπί ὁ μέρος πᾶς  ἀποκωλύω , καί οὗτος δή πᾶς τε εἰμί καί ὅλος  εἰμί .
680688	tlg0059.tlg007.perseus-grc2	ΘΕΑΙ. τί δʼ οὔ;	τίς δέ οὐ ;
680689	tlg0059.tlg007.perseus-grc2	ΞΕ. τὸ δὲ πεπονθὸς ταῦτα ἆρʼ οὐκ ἀδύνατον αὐτό γε τὸ ἓν αὐτὸ εἶναι;	ὁ δέ  οὗτος  οὐ ἀδύνατος αὐτός γε ὁ  αὐτός εἰμί ;
680690	tlg0059.tlg007.perseus-grc2	ΘΕΑΙ. πῶς;	πῶς ;
680691	tlg0059.tlg007.perseus-grc2	ΞΕ. ἀμερὲς δήπου δεῖ παντελῶς τό γε ἀληθῶς ἓν κατὰ τὸν ὀρθὸν λόγον εἰρῆσθαι.	ἀμερής δήπου δέω παντελής ὁ γε ἀληθής  κατά ὁ ὀρθός λόγος λέγω .
680692	tlg0059.tlg007.perseus-grc2	ΘΕΑΙ. δεῖ γὰρ οὖν.	δέω γάρ οὖν .
680693	tlg0059.tlg007.perseus-grc2	ΞΕ. τὸ δέ γε τοιοῦτον ἐκ πολλῶν μερῶν ὂν οὐ συμφωνήσει τῷ ὅλῳ λόγῳ.	ὁ δέ γε  ἐκ πολύς μέρος εἰμί οὐ συμφωνέω ὁ ὅλος λόγος .
680694	tlg0059.tlg007.perseus-grc2	ΘΕΑΙ. μανθάνω.	μανθάνω .
680695	tlg0059.tlg007.perseus-grc2	ΞΕ. πότερον δὴ πάθος ἔχον τὸ ὂν τοῦ ἑνὸς οὕτως ἕν τε ἔσται καὶ ὅλον, ἢ παντάπασι μὴ λέγωμεν ὅλον εἶναι τὸ ὄν;	πότερος δή πάθος ἔχω ὁ εἰμί ὁ  οὕτως  τε εἰμί καί ὅλος , ἤ παντάπασι μή λέγω ὅλος εἰμί ὁ  ;
680696	tlg0059.tlg007.perseus-grc2	ΘΕΑΙ. χαλεπὴν προβέβληκας αἵρεσιν.	χαλεπός προβάλλω αἵρεσις .
680697	tlg0059.tlg007.perseus-grc2	ΞΕ. ἀληθέστατα μέντοι λέγεις.	μέντοι λέγω .
680698	tlg0059.tlg007.perseus-grc2	πεπονθός τε γὰρ τὸ ὂν ἓν εἶναί πως οὐ ταὐτὸν ὂν τῷ ἑνὶ φανεῖται, καὶ πλέονα δὴ τὰ πάντα ἑνὸς ἔσται.	τε γάρ ὁ εἰμί  εἰμί πως οὐ αὐτός εἰμί τῷ  φαίνω , καί πολύς δή ὁ πᾶς   .
680699	tlg0059.tlg007.perseus-grc2	ΘΕΑΙ. ναί.	ναί .
680700	tlg0059.tlg007.perseus-grc2	ΞΕ. καὶ μὴν ἐάν γε τὸ ὂν ᾖ μὴ ὅλον διὰ τὸ πεπονθέναι τὸ ὑπʼ ἐκείνου πάθος, ᾖ δὲ αὐτὸ τὸ ὅλον, ἐνδεὲς τὸ ὂν ἑαυτοῦ συμβαίνει.	καί μήν ἐάω γε ὁ εἰμί εἰμί μή ὅλος διά ὁ πάσχω ὁ  ἐκεῖνος πάθος , εἰμί δέ αὐτός ὁ ὅλος , ἐνδεής ὁ εἰμί ἑαυτοῦ συμβαίνω .
680701	tlg0059.tlg007.perseus-grc2	ΘΕΑΙ. πάνυ γε.	πάνυ γε .
680702	tlg0059.tlg007.perseus-grc2	ΞΕ. καὶ κατὰ τοῦτον δὴ τὸν λόγον ἑαυτοῦ στερόμενον οὐκ ὂν ἔσται τὸ ὄν.	καί κατά οὗτος δή ὁ λόγος ἑαυτοῦ  οὐ εἰμί εἰμί ὁ εἰμί .
680703	tlg0059.tlg007.perseus-grc2	ΘΕΑΙ. οὕτως.	οὕτως .
680704	tlg0059.tlg007.perseus-grc2	ΞΕ. καὶ ἑνός γε αὖ πλείω τὰ πάντα γίγνεται, τοῦ τε ὄντος καὶ τοῦ ὅλου χωρὶς ἰδίαν ἑκατέρου φύσιν εἰληφότος.	καί  γε αὖ πολύς ὁ πᾶς γίγνομαι , ὁ τε εἰμί καί ὁ  χωρίς ἴδιος ἑκάτερος φύσις λαμβάνω .
680705	tlg0059.tlg007.perseus-grc2	ΘΕΑΙ. ναί.	ναί .
680706	tlg0059.tlg007.perseus-grc2	ΞΕ. μὴ ὄντος δέ γε τὸ παράπαν τοῦ ὅλου, ταὐτά τε ταῦτα ὑπάρχει τῷ ὄντι, καὶ πρὸς τῷ μὴ εἶναι μηδʼ ἂν γενέσθαι ποτὲ ὄν.	μή  δέ γε ὁ παράπαν ὁ  , αὐτός τε οὗτος ὑπάρχω τῷ εἰμί , καί πρός τῷ μή εἰμί  ἐάν γίγνομαι ποτε εἰμί .
680707	tlg0059.tlg007.perseus-grc2	ΘΕΑΙ. τί δή;	τίς δή ;
680708	tlg0059.tlg007.perseus-grc2	ΞΕ. τὸ γενόμενον ἀεὶ γέγονεν ὅλον·	ὁ γίγνομαι ἀεί γίγνομαι ὅλος ·
680709	tlg0059.tlg007.perseus-grc2	ὥστε οὔτε οὐσίαν οὔτε γένεσιν ὡς οὖσαν δεῖ προσαγορεύειν τὸ ἓν ἢ τὸ ὅλον ἐν τοῖς οὖσι μὴ τιθέντα.	ὡς οὔτε οὐσία οὔτε γένεσις ὡς εἰμί δέω προσαγορεύω ὁ  τίη ὁ ὅλος ἐν ὁ εἰμί μή  .
680710	tlg0059.tlg007.perseus-grc2	ΘΕΑΙ. παντάπασιν ἔοικε ταῦθʼ οὕτως ἔχειν.	παντάπασι ἔοικα  οὕτως ἔχω .
680711	tlg0059.tlg007.perseus-grc2	ΞΕ. καὶ μὴν οὐδʼ ὁποσονοῦν τι δεῖ τὸ μὴ ὅλον εἶναι·	καί μήν οὐδέ  τις δέω ὁ μή ὅλος εἰμί ·
680712	tlg0059.tlg007.perseus-grc2	ποσόν τι γὰρ ὄν, ὁπόσον ἂν ᾖ, τοσοῦτον ὅλον ἀναγκαῖον αὐτὸ εἶναι.	ποσός τι γάρ εἰμί , ὁπόσος ἐάν εἰμί ,  ὅλος ἀναγκαῖον αὐτός εἰμί .
680713	tlg0059.tlg007.perseus-grc2	ΘΕΑΙ. κομιδῇ γε.	γε .
680714	tlg0059.tlg007.perseus-grc2	ΞΕ. καὶ τοίνυν ἄλλα μυρία ἀπεράντους ἀπορίας ἕκαστον εἰληφὸς φανεῖται τῷ τὸ ὂν εἴτε δύο τινὲ εἴτε ἓν μόνον εἶναι λέγοντι.	καί τοίνυν ἄλλος μυρίος ἀπέραντος ἀπορία ἕκαστος  φαίνω τῷ ὁ εἰμί εἴτε γε  εἴτε  μόνος εἰμί λέγω .
680715	tlg0059.tlg007.perseus-grc2	ΘΕΑΙ. δηλοῖ σχεδὸν καὶ τὰ νῦν ὑποφαίνοντα·	δηλόω σχεδόν καί ὁ νῦν ὑποφαίνω ·
680716	tlg0059.tlg007.perseus-grc2	συνάπτεται γὰρ ἕτερον ἐξ ἄλλου, μείζω καὶ χαλεπωτέραν φέρον περὶ τῶν ἔμπροσθεν ἀεὶ ῥηθέντων πλάνην.	συνάπτω γάρ ἕτερος ἐκ ἄλλος , μέγας καί χαλεπός φέρω περί ὁ ἔμπροσθεν ἀεί λέγω πλάνη .
680717	tlg0059.tlg007.perseus-grc2	ΞΕ. τοὺς μὲν τοίνυν διακριβολογουμένους ὄντος τε πέρι καὶ μή, πάντας μὲν οὐ διεληλύθαμεν, ὅμως δὲ ἱκανῶς ἐχέτω·	ὁ μέν τοίνυν  εἰμί τε περί καί μή , πᾶς μέν οὐ  , ὅμως δέ ἱκανός ἔχω ·
680718	tlg0059.tlg007.perseus-grc2	τοὺς δὲ ἄλλως λέγοντας αὖ θεατέον, ἵνʼ ἐκ πάντων ἴδωμεν ὅτι τὸ ὂν τοῦ μὴ ὄντος οὐδὲν εὐπορώτερον εἰπεῖν ὅτι ποτʼ ἔστιν.	ὁ δέ ἄλλος λέγω αὖ θεάομαι , ἵνα ἐκ πᾶς ὁράω ὅτι2 ὁ εἰμί ὁ μή εἰμί  εὔπορος λέγω ὅτι2 ποτε εἰμί .
680719	tlg0059.tlg007.perseus-grc2	ΘΕΑΙ. οὐκοῦν πορεύεσθαι χρὴ καὶ ἐπὶ τούτους.	οὐκοῦν πορεύω χρή καί ἐπί οὗτος .
680720	tlg0059.tlg007.perseus-grc2	ΞΕ. καὶ μὴν ἔοικέ γε ἐν αὐτοῖς οἷον γιγαντομαχία τις εἶναι διὰ τὴν ἀμφισβήτησιν περὶ τῆς οὐσίας πρὸς ἀλλήλους.	καί μήν ἔοικα γε ἐν αὐτός οἷος γιγαντομαχία τις εἰμί διά ὁ ἀμφισβήτησις περί ὁ οὐσία πρός ἀλλήλων .
680721	tlg0059.tlg007.perseus-grc2	ΘΕΑΙ. πῶς;	πῶς ;
680722	tlg0059.tlg007.perseus-grc2	ΞΕ. οἱ μὲν εἰς γῆν ἐξ οὐρανοῦ καὶ τοῦ ἀοράτου πάντα ἕλκουσι, ταῖς χερσὶν ἀτεχνῶς πέτρας καὶ δρῦς περιλαμβάνοντες.	ὁ μέν εἰς γῆ ἐκ οὐρανός καί ὁ  πᾶς ἕλκω , ὁ χείρ ἀτεχνής πέτρα καί δρῦς περιλαμβάνω .
680723	tlg0059.tlg007.perseus-grc2	τῶν γὰρ τοιούτων ἐφαπτόμενοι πάντων διισχυρίζονται τοῦτο εἶναι μόνον ὃ παρέχει προσβολὴν καὶ ἐπαφήν τινα, ταὐτὸν σῶμα καὶ οὐσίαν ὁριζόμενοι, τῶν δὲ ἄλλων εἴ τίς τι φήσει μὴ σῶμα ἔχον εἶναι, καταφρονοῦντες τὸ παράπαν καὶ οὐδὲν ἐθέλοντες ἄλλο ἀκούειν.	ὁ γάρ τοιοῦτος ἐφάπτω πᾶς διισχυρίζομαι οὗτος εἰμί μόνος ὁ παρέχω προσβολή καί ἐπαφή  , αὐτός σῶμα καί οὐσία ὁρίζω , ὁ δέ  εἰ τις τις φημί μή σῶμα ἔχω εἰμί , καταφρονέω ὁ παράπαν καί οὐδείς ἐθέλω ἄλλος ἀκούω .
680724	tlg0059.tlg007.perseus-grc2	ΘΕΑΙ. ἦ δεινοὺς εἴρηκας ἄνδρας·	ἦ δεινός λέγω ἀνήρ ·
680725	tlg0059.tlg007.perseus-grc2	ἤδη γὰρ καὶ ἐγὼ τούτων συχνοῖς προσέτυχον.	ἤδη γάρ καί  οὗτος συχνός  .
680726	tlg0059.tlg007.perseus-grc2	ΞΕ. τοιγαροῦν οἱ πρὸς αὐτοὺς ἀμφισβητοῦντες μάλα εὐλαβῶς ἄνωθεν ἐξ ἀοράτου ποθὲν ἀμύνονται, νοητὰ ἄττα καὶ ἀσώματα εἴδη βιαζόμενοι τὴν ἀληθινὴν οὐσίαν εἶναι·	ὁ πρός αὐτός ἀμφισβητέω μάλα εὐλαβής ἄνωθεν ἐκ  ποθεν ἀμύνω , νοητός  καί  εἶδος βιάζω ὁ ἀληθινός οὐσία εἰμί ·
680727	tlg0059.tlg007.perseus-grc2	τὰ δὲ ἐκείνων σώματα καὶ τὴν λεγομένην ὑπʼ αὐτῶν ἀλήθειαν κατὰ σμικρὰ διαθραύοντες ἐν τοῖς λόγοις γένεσιν ἀντʼ οὐσίας φερομένην τινὰ προσαγορεύουσιν.	ὁ δέ ἐκεῖνος σῶμα καί ὁ λέγω ὑπό αὐτός ἀλήθεια κατά  διαθραύω ἐν ὁ λόγος γένεσις ἀντί οὐσία φέρω  προσαγορεύω .
680728	tlg0059.tlg007.perseus-grc2	ἐν μέσῳ δὲ περὶ ταῦτα ἄπλετος ἀμφοτέρων μάχη τις, ὦ Θεαίτητε, ἀεὶ συνέστηκεν.	ἐν μέσος δέ περί οὗτος ἄπλετος ἀμφότερος μάχη τις , ὦ Θεαίτητος , ἀεί συνίστημι .
680729	tlg0059.tlg007.perseus-grc2	ΘΕΑΙ. ἀληθῆ.	ἀληθής .
680730	tlg0059.tlg007.perseus-grc2	ΞΕ. παρʼ ἀμφοῖν τοίνυν τοῖν γενοῖν κατὰ μέρος λάβωμεν λόγον ὑπὲρ ἧς τίθενται τῆς οὐσίας.	ἄμφω τοίνυν ὁ  κατά μέρος λαμβάνω λόγος ὑπέρ ὅς τίθημι ὁ οὐσία .
680731	tlg0059.tlg007.perseus-grc2	ΘΕΑΙ. πῶς οὖν δὴ ληψόμεθα;	πῶς οὖν δή λαμβάνω ;
680732	tlg0059.tlg007.perseus-grc2	ΞΕ. παρὰ μὲν τῶν ἐν εἴδεσιν αὐτὴν τιθεμένων ῥᾷον, ἡμερώτεροι γάρ·	παρά μέν ὁ ἐν εἶδος αὐτός τίθημι ῥᾴδιος , ἥμερος γάρ ·
680733	tlg0059.tlg007.perseus-grc2	παρὰ δὲ τῶν εἰς σῶμα πάντα ἑλκόντων βίᾳ χαλεπώτερον, ἴσως δὲ καὶ σχεδὸν ἀδύνατον.	παρά δέ ὁ εἰς σῶμα  ἕλκω βία χαλεπός , ἴσος δέ καί σχεδόν ἀδύνατος .
680734	tlg0059.tlg007.perseus-grc2	ἀλλʼ ὧδέ μοι δεῖν δοκεῖ περὶ αὐτῶν δρᾶν.	ὧδε  δέω δοκέω περί αὐτός δράω .
680735	tlg0059.tlg007.perseus-grc2	ΘΕΑΙ. πῶς;	πῶς ;
680736	tlg0059.tlg007.perseus-grc2	ΞΕ. μάλιστα μέν, εἴ πῃ δυνατὸν ἦν, ἔργῳ βελτίους αὐτοὺς ποιεῖν·	ΞΕ. μάλιστα μέν , εἰ  δυνατός εἰμί , ἔργον βελτίων αὐτός ποιέω ·
680737	tlg0059.tlg007.perseus-grc2	εἰ δὲ τοῦτο μὴ ἐγχωρεῖ, λόγῳ ποιῶμεν, ὑποτιθέμενοι νομιμώτερον αὐτοὺς ἢ νῦν ἐθέλοντας ἂν ἀποκρίνασθαι.	εἰ δέ οὗτος μή  , λόγος ποιέω , ὑποτίθημι νόμιμος αὐτός ἤ νῦν ἐθέλω ἄν ἀποκρίνω .
680738	tlg0059.tlg007.perseus-grc2	τὸ γὰρ ὁμολογηθὲν παρὰ βελτιόνων που κυριώτερον ἢ τὸ παρὰ χειρόνων·	ὁ γάρ ὁμολογέω παρά  που κύριος ἤ ὁ παρά  ·
680739	tlg0059.tlg007.perseus-grc2	ἡμεῖς δὲ οὐ τούτων φροντίζομεν, ἀλλὰ τἀληθὲς ζητοῦμεν.	δέ οὐ οὗτος φροντίζω , ἀλλά ἀληθής ζητέω .
680740	tlg0059.tlg007.perseus-grc2	ΘΕΑΙ. ὀρθότατα.	ὀρθός .
680741	tlg0059.tlg007.perseus-grc2	ΞΕ. κέλευε δὴ τοὺς βελτίους γεγονότας ἀποκρίνασθαί σοι, καὶ τὸ λεχθὲν παρʼ αὐτῶν ἀφερμήνευε.	κελεύω δή ὁ βελτίων γίγνομαι ἀποκρίνω  , καί ὁ λέγω παρά αὐτός  .
680742	tlg0059.tlg007.perseus-grc2	ΘΕΑΙ. ταῦτʼ ἔσται.	.
680743	tlg0059.tlg007.perseus-grc2	ΞΕ. λεγόντων δὴ θνητὸν ζῷον εἴ φασιν εἶναί τι.	λέγω δή θνητός ζῷον εἰ φημί εἰμί τις .
680744	tlg0059.tlg007.perseus-grc2	ΘΕΑΙ. πῶς δʼ οὔ;	πῶς δέ οὐ ;
680745	tlg0059.tlg007.perseus-grc2	ΞΕ. τοῦτο δὲ οὐ σῶμα ἔμψυχον ὁμολογοῦσιν;	οὗτος δέ οὐ σῶμα ἔμψυχος ὁμολογέω ;
680746	tlg0059.tlg007.perseus-grc2	ΘΕΑΙ. πάνυ γε.	πάνυ γε .
680747	tlg0059.tlg007.perseus-grc2	ΞΕ. τιθέντες τι τῶν ὄντων ψυχήν;	τίθημι τι ὁ εἰμί ψυχή ;
680748	tlg0059.tlg007.perseus-grc2	ΘΕΑΙ. ναί.	ναί .
680749	tlg0059.tlg007.perseus-grc2	ΞΕ. τί δέ;	τίς δέ ;
680750	tlg0059.tlg007.perseus-grc2	ψυχὴν οὐ τὴν μὲν δικαίαν, τὴν δὲ ἄδικόν φασιν εἶναι, καὶ τὴν μὲν φρόνιμον, τὴν δὲ ἄφρονα;	ψυχή οὐ ὁ μέν δικαία , ὁ δέ ἄδικος φημί εἰμί , καί ὁ μέν φρόνιμος , ὁ δέ  ;
680751	tlg0059.tlg007.perseus-grc2	ΘΕΑΙ. τί μήν;	τίς μήν ;
680752	tlg0059.tlg007.perseus-grc2	ΞΕ. ἀλλʼ οὐ δικαιοσύνης ἕξει καὶ παρουσίᾳ τοιαύτην αὐτῶν ἑκάστην γίγνεσθαι, καὶ τῶν ἐναντίων τὴν ἐναντίαν;	οὐ δικαιοσύνη ἔχω καί παρουσία τοιοῦτος αὐτός ἕκαστος γίγνομαι , καί ὁ ἐναντίος ὁ ἐναντίος ;
680753	tlg0059.tlg007.perseus-grc2	ΘΕΑΙ. ναί, καὶ ταῦτα σύμφασιν.	ναί , καί οὗτος σύμφασις .
680754	tlg0059.tlg007.perseus-grc2	ΞΕ. ἀλλὰ μὴν τό γε δυνατόν τῳ παραγίγνεσθαι καὶ ἀπογίγνεσθαι πάντως εἶναί τι φήσουσιν.	ἀλλά μήν ὁ γε δυνατός  παραγίγνομαι καί  πᾶς εἰμί τις  .
680755	tlg0059.tlg007.perseus-grc2	ΘΕΑΙ. φασὶ μὲν οὖν.	φημί μέν οὖν .
680756	tlg0059.tlg007.perseus-grc2	ΞΕ. οὔσης οὖν δικαιοσύνης καὶ φρονήσεως καὶ τῆς ἄλλης ἀρετῆς καὶ τῶν ἐναντίων, καὶ δὴ καὶ ψυχῆς ἐν ᾗ ταῦτα ἐγγίγνεται, πότερον ὁρατὸν καὶ ἁπτὸν εἶναί φασί τι αὐτῶν ἢ πάντα ἀόρατα;	εἰμί οὖν δικαιοσύνη καί φρόνησις καί ὁ ἄλλος ἀρετή καί ὁ ἐναντίος , καί δή καί ψυχή ἐν ὅς οὗτος ἐγγίγνομαι , πότερος ὁρατός καί ἁπτός εἰμί φημί τι αὐτός τίη πᾶς  ;
680757	tlg0059.tlg007.perseus-grc2	ΘΕΑΙ. σχεδὸν οὐδὲν τούτων γε ὁρατόν.	σχεδόν  οὗτος γε ὁρατός .
680758	tlg0059.tlg007.perseus-grc2	ΞΕ. τί δὲ τῶν τοιούτων;	τίς δέ ὁ τοιοῦτος ;
680759	tlg0059.tlg007.perseus-grc2	μῶν σῶμά τι λέγουσιν ἴσχειν;	μῶν σῶμα τι λέγω ἴσχω ;
680760	tlg0059.tlg007.perseus-grc2	ΘΕΑΙ. τοῦτο οὐκέτι κατὰ ταὐτὰ ἀποκρίνονται πᾶν, ἀλλὰ τὴν μὲν ψυχὴν αὐτὴν δοκεῖν σφίσι σῶμά τι κεκτῆσθαι, φρόνησιν δὲ καὶ τῶν ἄλλων ἕκαστον ὧν ἠρώτηκας, αἰσχύνονται τὸ τολμᾶν ἢ μηδὲν τῶν ὄντων αὐτὰ ὁμολογεῖν ἢ πάντʼ εἶναι σώματα διισχυρίζεσθαι.	οὗτος οὐκέτι κατά  ἀποκρίνω πᾶς , ἀλλά ὁ μέν ψυχή αὐτός δοκέω σφεῖς σῶμα  κτάομαι , φρόνις δέ καί ὁ ἄλλος ἕκαστος ὅς  , αἰσχύνω ὁ  τίη  ὁ εἰμί αὐτός ὁμολογέω τίη πᾶς εἰμί σῶμα διισχυρίζομαι .
680761	tlg0059.tlg007.perseus-grc2	ΞΕ. σαφῶς γὰρ ἡμῖν, ὦ Θεαίτητε, βελτίους γεγόνασιν ἇνδρες·	σαφής γάρ  , ὦ Θεαίτητος , βελτίων γίγνομαι ἀνήρ ·
680762	tlg0059.tlg007.perseus-grc2	ἐπεὶ τούτων οὐδʼ ἂν ἓν ἐπαισχυνθεῖεν οἵ γε αὐτῶν σπαρτοί τε καὶ αὐτόχθονες, ἀλλὰ διατείνοιντʼ ἂν πᾶν ὃ μὴ δυνατοὶ ταῖς χερσὶ συμπιέζειν εἰσίν, ὡς ἄρα τοῦτο οὐδὲν τὸ παράπαν ἐστίν.	ἐπεί οὗτος  ἀνά   ὁ γε αὐτός  τε καί αὐτόχθων , ἀλλά  ἄν πᾶς ὅς μή δυνατός ὁ χείρ  εἰμί , ὡς ἄρα οὗτος οὐδείς ὁ παράπαν εἰμί .
680763	tlg0059.tlg007.perseus-grc2	ΘΕΑΙ. σχεδὸν οἷα διανοοῦνται λέγεις.	σχεδόν οἷος διανοέομαι λέγω .
680764	tlg0059.tlg007.perseus-grc2	ΞΕ. πάλιν τοίνυν ἀνερωτῶμεν αὐτούς·	πάλιν τοίνυν  αὐτός ·
680765	tlg0059.tlg007.perseus-grc2	εἰ γάρ τι καὶ σμικρὸν ἐθέλουσι τῶν ὄντων συγχωρεῖν ἀσώματον, ἐξαρκεῖ.	εἰ γάρ τις καί μικρός ἐθέλω ὁ εἰμί συγχωρέω ἀσώματος , ἐξαρκέω .
680766	tlg0059.tlg007.perseus-grc2	τὸ γὰρ ἐπί τε τούτοις ἅμα καὶ ἐπʼ ἐκείνοις ὅσα ἔχει σῶμα συμφυὲς γεγονός, εἰς ὃ βλέποντες ἀμφότερα εἶναι λέγουσι, τοῦτο αὐτοῖς ῥητέον.	ὁ γάρ ἐπί τε οὗτος ἅμα καί  ἐκεῖνος ὅσος ἔχω σῶμα συμφυής γίγνομαι , εἰς ὅς βλέπω ἀμφότερος εἰμί λέγω , οὗτος αὐτός λέγω .
680767	tlg0059.tlg007.perseus-grc2	τάχʼ οὖν ἴσως ἂν ἀποροῖεν·	οὖν ἴσος ἄν ἀπορέω2 ·
680768	tlg0059.tlg007.perseus-grc2	εἰ δή τι τοιοῦτον πεπόνθασι, σκόπει, προτεινομένων ἡμῶν, ἆρʼ ἐθέλοιεν ἂν δέχεσθαι καὶ ὁμολογεῖν τοιόνδʼ εἶναι τὸ ὄν.	εἰ δή τις  πάσχω , σκοπέω , προτείνω  ,  ἐθέλω ἄν δέχομαι καί ὁμολογέω τοιόσδε εἰμί ὁ  .
680769	tlg0059.tlg007.perseus-grc2	ΘΕΑΙ. τὸ ποῖον δή;	ὁ ποιός δή ;
680770	tlg0059.tlg007.perseus-grc2	λέγε, καὶ τάχα εἰσόμεθα.	λέγω , καί τάχα εἶμι .
680771	tlg0059.tlg007.perseus-grc2	ΞΕ. λέγω δὴ τὸ καὶ ὁποιανοῦν τινα κεκτημένον δύναμιν εἴτʼ εἰς τὸ ποιεῖν ἕτερον ὁτιοῦν πεφυκὸς εἴτʼ εἰς τὸ παθεῖν καὶ σμικρότατον ὑπὸ τοῦ φαυλοτάτου, κἂν εἰ μόνον εἰς ἅπαξ, πᾶν τοῦτο ὄντως εἶναι·	λέγω δή ὁ καί  τις  δύναμις εἴτε εἰς ὁ ποιέω ἕτερος ὁτιοῦν φύω εἴτε εἰς ὁ πάσχω καί μικρός ὑπό ὁ  , ἐάν εἰ μόνος εἰς ἅπαξ , πᾶς οὗτος ὄντως εἰμί ·
680772	tlg0059.tlg007.perseus-grc2	τίθεμαι γὰρ ὅρον ὁρίζειν τὰ ὄντα ὡς ἔστιν οὐκ ἄλλο τι πλὴν δύναμις.	τίθημι γάρ ὅρος ὁρίζω ὁ εἰμί ὡς εἰμί οὐ ἄλλος τις πλήν δύναμις .
680773	tlg0059.tlg007.perseus-grc2	ΘΕΑΙ. ἀλλʼ ἐπείπερ αὐτοί γε οὐκ ἔχουσιν ἐν τῷ παρόντι τούτου βέλτιον λέγειν, δέχονται τοῦτο.	ἐπεί αὐτός γε οὐ ἔχω ἐν τῷ πάρειμι οὗτος βελτίων λέγω , δέχομαι οὗτος .
680774	tlg0059.tlg007.perseus-grc2	ΞΕ. καλῶς·	καλός ·
680775	tlg0059.tlg007.perseus-grc2	ἴσως γὰρ ἂν εἰς ὕστερον ἡμῖν τε καὶ τούτοις ἕτερον ἂν φανείη.	ἴσος γάρ ἄν εἰς ὕστερον  τε καί οὗτος ἕτερος ἐάν φαίνω .
680776	tlg0059.tlg007.perseus-grc2	πρὸς μὲν οὖν τούτους τοῦτο ἡμῖν ἐνταῦθα μενέτω συνομολογηθέν.	πρός μέν οὖν οὗτος οὗτος  ἐνταῦθα μένω  .
680777	tlg0059.tlg007.perseus-grc2	ΘΕΑΙ. μένει.	μένω .
680778	tlg0059.tlg007.perseus-grc2	ΞΕ. πρὸς δὴ τοὺς ἑτέρους ἴωμεν, τοὺς τῶν εἰδῶν φίλους·	πρός δή ὁ ἕτερος εἶμι , ὁ ὁ εἰδοί φίλος ·
680779	tlg0059.tlg007.perseus-grc2	σὺ δʼ ἡμῖν καὶ τὰ παρὰ τούτων ἀφερμήνευε.	δέ ἐγώ καί ὁ παρά οὗτος  .
680780	tlg0059.tlg007.perseus-grc2	ΘΕΑΙ. ταῦτʼ ἔσται.	.
