id	filename	tokens	lemmas
670628	tlg0527.tlg011.opp-grc2	καὶ ἀπεκρίθη αὐτῷ Κύριος καὶ εἶπεν πρὸς αὐτόν᾿ Ανάστηθι καὶ κατάβηθι εἰς Κεειλά, ὅτι ἐγὼ παραδίδωμι τοὺς ἀλλοφύλους εἰς χεφάς σου.	καί ἀποκρίνω αὐτός κύριος2 καί λέγω πρός αὐτός ᾿  καί καταβαίνω εἰς  , ὅτι2  παραδίδωμι ὁ ἀλλόφυλος εἰς   .
670629	tlg0527.tlg011.opp-grc2	καὶ ἐπορεύθη Δαυεὶδ καὶ οἱ ἄνδρες οἱ μετ’ αὐτοῦ εἰς Κεειλὰ καὶ ἐπολέμησεν ἐν τοῖς ἀλλοφύλοις·	καί ἐφορεύω  καί ὁ ἀνήρ ὁ μετά αὐτός εἰς  καί πολεμέω ἐν ὁ ἀλλόφυλος ·
670630	tlg0527.tlg011.opp-grc2	καὶ ἔφυγον ἐκ προσώπου αὐτοῦ, καὶ ἀπήγαγεν τὰ κτήνη αὐτῶν, καὶ ἐπάταξεν ἐν αὐτοῖς πληγὴν μεγάλην·	καί φεύγω ἐκ πρόσωπον αὐτός , καί ἀπάγω ὁ κτῆνος αὐτός , καί πατάσσω ἐν αὐτός πληγή μέγας ·
670631	tlg0527.tlg011.opp-grc2	καὶ ἔσωσεν Δαυεὶδ τοὺς κατοικοῦντας Κεειλά.	καί εἰσωθέω  ὁ κατοικέω  .
670632	tlg0527.tlg011.opp-grc2	Καὶ ἐγένετο ἐν τῷ φυγεῖν Ἀβιαθὰρ υἱὸν Ἀβειμέλεχ πρὸς Δαυείδ, καὶ αὐτὸς μετὰ Δαυεὶδ εἰς Κεειλὰ κατέβη, ἄων ἐντ’ χειρὶ αὐτοῦ.	καί γίγνομαι ἐν ὁ φεύγω  υἱός  πρός  , καί αὐτός μετά  εἰς  καταβαίνω ,   χείρ αὐτός .
670633	tlg0527.tlg011.opp-grc2	καὶ ἀπηγγέλη τῷ Σαοὺλ ὅτι ἥκει Δαυεὶδ Κεειλά, καὶ εἶπεν Σαούλ Πέπρακεν αὐτὸν ὁ θεὸς εἰς χεῖράς μου, ὅτι ἀποκέκλεισται εἰσελθὼν εἰς πόλιν θυρῶν καὶ μοχλῶν.	καί  τῷ  ὅτι2 ἥκω   , καί λέγω   αὐτός ὁ  εἰς χείρ  , ὅτι2 ἀποκλείω εἰσέρχομαι εἰς πόλις θύρα καί  .
670634	tlg0527.tlg011.opp-grc2	καὶ παρήγγειλεν Σαοὺλ παντὶ τῷ λαῷ εἰς πόλεμον καταβαίνειν εἰς Κεειλά, συνέχειν τὸν Δαυεὶδ καὶ τοὺς ἄνδρας αὐτοῦ.	καί παραγγέλλω  πᾶς ὁ λαός εἰς πόλεμος καταβαίνω εἰς  , συνέχω ὁ  καί ὁ ἀνήρ αὐτός .
670635	tlg0527.tlg011.opp-grc2	καὶ ἔγνω Δαυεὶδ ὅτι οὐ παρασιωπᾷ Σαοὺλ περὶ αὐτοῦ τὴν κακίαν, καὶ εἶπεν Δαυεὶδ πρὸς᾿ Αβιαθὰρ τὸν ἱερέα Προσάγαγε τὸ ἐφοὺδ Κυρίου.	καί γιγνώσκω  ὅτι2 οὐ   περί αὐτός ὁ κακία , καί λέγω  πρός ᾿  ὁ   ὁ   .
670636	tlg0527.tlg011.opp-grc2	καὶ εἶπεν Δαυείδ Κύριε ὁ θεὸς Ἰσραήλ, ἀκούων ἀκήκοεν ὁ δοῦλός σου ὅτι ζητεῖ Σαοὺλ ἐλθεῖν ἐπὶ Κεειλὰ διαφθεῖραι τὴν πόλιν δι’ ἐμέ.	καί λέγω   ὁ   , ἀκούω ἀκούω ὁ δοῦλος  ὅτι2 ζητέω  ἔρχομαι ἐπί  διαφθείρω ὁ πόλις διά  .
670637	tlg0527.tlg011.opp-grc2	εἰ ἀποκλεισθήσεται;	εἰ  ;
670638	tlg0527.tlg011.opp-grc2	καὶ νῦν εἰ καταβήσεται Σαοὺλ καθὼς ἤκουσεν ὁ δοῦλός σου;	καί νῦν εἰ καταβαίνω   ἀκούω ὁ δοῦλος  ;
670639	tlg0527.tlg011.opp-grc2	κύριε ὁ θεὸς Ἰσραήλ, ἀπάγγειλον τῷ δούλῳ σου.	ὁ   , ἀπαγγέλλω τῷ δοῦλος  .
670640	tlg0527.tlg011.opp-grc2	καὶ εἶπεν κύριος Ἀποκλεισθήσεται.	καί λέγω κύριος2  .
670641	tlg0527.tlg011.opp-grc2	καὶ ἀνέστη Δαυεὶδ καὶ οἱ ἄνδρες οἱ μετ’ αὐτοῦ ὡς τετρακόσιοι καὶ ἐξῆλθον ἐκ Κεειλά, καὶ ἐπορεύοντο οὗ ἐὰν ἐπορεύθησαν·	καί ἀνίστημι  καί ὁ ἀνήρ ὁ μετά αὐτός ὡς τετρακόσιοι καί ἐξέρχομαι ἐκ  , καί ἐφορεύω οὗ ἐάν ἐφορεύω ·
670642	tlg0527.tlg011.opp-grc2	καὶ τῷ Σαοὺλ ἀπηγγέλη ὅτι διασέσωται Δαυεὶδ ἐκ Κεειλά, καὶ ἀνῆκεν τοῦ ἐξελθεῖν.	καί τῷ  ἀπαγγέλλω ὅτι2 διασῴζω  ἐκ  , καί ἀνίημι ὁ ἐξέρχομαι .
670643	tlg0527.tlg011.opp-grc2	Καὶ ἐκάθισεν ἐν τῆ ἐρήμῳ ἐν Μασερὲμ ἐν τοῖς στενοῖς, καὶ ἐκάθητο ἐν τῇ ἐρήμῳ ἐν τῷ ὄρει Ζείφ, ἐν τῇ γῇ τῇ αὐχμώδει·	καί καθίζω ἐν  ἐρῆμος ἐν  ἐν ὁ στενός , καί  ἐν ὁ ἐρῆμος ἐν ὁ ὄρος  , ἐν ὁ γῆ ὁ  ·
670644	tlg0527.tlg011.opp-grc2	καὶ ἐζήτει αὐτὸν Σαοὺλ πάσας τὰς ἡμέρας, καὶ οὐ παρέδωκεν αὐτὸν κύριος εἰς τὰς χεῖρας αὐτοῦ.	καί ζητέω αὐτός  πᾶς ὁ ἡμέρα , καί οὐ παραδίδωμι αὐτός κύριος2 εἰς ὁ χείρ αὐτός .
670645	tlg0527.tlg011.opp-grc2	καὶ εἶδεν Δαυεὶδ ὅτι Σαοὺλ τοῦ ζητεῖν τὸν Δαυείδ·	καί ὁράω  ὅτι2  ὁ ζητέω ὁ  ·
670646	tlg0527.tlg011.opp-grc2	καὶ Δαυεὶδ ἐν τῷ ὄρει τῷ αὐχμώδει ἐν τῇ καινῇ Ζείφ.	καί  ἐν ὁ ὄρος τῷ  ἐν ὁ καινός  .
670647	tlg0527.tlg011.opp-grc2	καὶ ἀνέστη Ἰωναθὰν υἱὸς Σαοὺλ καὶ ἐπορεύθη πρὸς Δαυεὶδ εἰς Καινήν, καὶ ἐκραταίωσεν τὰς χεῖρας αὐτοῦ ἐν Τυρίῳ.	καί ἀνίστημι  υἱός  καί ἐφορεύω πρός  εἰς  , καί  ὁ χείρ αὐτός ἐν  .
670648	tlg0527.tlg011.opp-grc2	καὶ εἶπεν πρὸς αὐτόν Μὴ φοβοῦ·	καί λέγω πρός αὐτός  φοβέω ·
670649	tlg0527.tlg011.opp-grc2	ὅτι οὐ μὴ εὕρῃ σε ἡ χεὶρ Σαοὺλ τοῦ πατρός μου, καὶ σὺ βασιλεύσεις ἐπὶ Ἰσραὴλ καὶ ἐγὼ ἔσομαί σοι εἰς δεύτερον·	ὅτι2 οὐ μή εὑρίσκω  ὁ χείρ  ὁ πατήρ  , καί   ἐπί  καί    εἰς δεύτερος ·
670650	tlg0527.tlg011.opp-grc2	καὶ Σαοὺλ ὁ πατήρ μου οἶδεν οὕτως.	καί  ὁ πατήρ  οἶδα οὕτως .
670651	tlg0527.tlg011.opp-grc2	καὶ διέθεντο ἀμφότεροι διαθήκην ἐνώπιον κυρίου·	καί διατίθημι ἀμφότερος διαθήκη ἐνώπιος  ·
670652	tlg0527.tlg011.opp-grc2	καὶ ἐκάθητο Δαυεὶδ ἐν Καινῆ, καὶ Ἰωναθὰν ἀπῆλθεν εἰς οἶκον αὐτοῦ.	καί   ἐν  , καί  ἀπέρχομαι εἰς οἶκος αὐτός .
670653	tlg0527.tlg011.opp-grc2	Καὶ ἀνέβησαν οἱ Ζειφαῖοι ἐκ τῆς αὐχμώδους πρὸς Σαοὺλ ἐπὶ τὸν βουνὸν λέγοντες Οὐκ ἰδοὺ Δαυεὶδ κέκρυπται παρ’ ἡμῖν ἐν Νεσσαρὰ ἐν τοῖς στενοῖς ἐν τῆ καινῇ ἐν τῷ βουνῷ τοῦ Ἐχέλα τοῦ ἐκ δεξιῶν τοῦ Ἰεσσαιμού;	καί ἀναβαίνω ὁ  ἐκ ὁ  πρός  ἐπί ὁ βουνός λέγω    κρύπτω παρά ἐγώ ἐν  ἐν ὁ στενός ἐν  καινός ἐν τῷ  ὁ Ἐχέλης ὁ ἐκ δεξιός ὁ  ;
670654	tlg0527.tlg011.opp-grc2	καὶ νῦν πᾶν τὸ πρὸς ψυχὴν τοῦ βασιλέως εἰς κατάβασιν καταβαινέτω πρὸς ἡμᾶς·	καί νῦν πᾶς ὁ πρός ψυχή ὁ βασιλεύς εἰς κατάβασις  πρός ἐγώ ·
670655	tlg0527.tlg011.opp-grc2	κεκλείκασιν αὐτὸν εἰς τὰς χεῖρας τοῦ βασιλέως.	αὐτός εἰς ὁ χείρ ὁ βασιλεύς .
670656	tlg0527.tlg011.opp-grc2	καὶ εἶπεν αὐτοῖς Σαούλ Εὐλογημένοι ὑμεῖς τῷ κυρίῳ, ὅτι ἐπονέσατε περὶ ἐμοῦ·	καί λέγω αὐτός    τῷ κύριος2 , ὅτι2  περί ἐγώ ·
670657	tlg0527.tlg011.opp-grc2	πορεύθητε δὴ καὶ ἑτοιμάσατε ἔτι, καὶ γνῶτε τὸν τόπον αὐτοῦ οὗ ἔσται ὁ ποὺς αὐτοῦ ἐν τάχει ἐκεῖ οὗ εἴπετε, μή ποτε πανουργεύσεται.	δή καί ἑτοιμάζω ἔτι , καί γιγνώσκω ὁ τόπος αὐτός οὗ εἰμί ὁ  αὐτός ἐν τάχος ἐκεῖ οὗ  , μή ποτε  .
670658	tlg0527.tlg011.opp-grc2	καὶ ἴδετε καὶ γνῶτε, καὶ πορευσόμεθα μεθ' ὑμῶν·	καί ὁράω καί γιγνώσκω , καί   ' ὑμός ·
670659	tlg0527.tlg011.opp-grc2	καὶ ἔσται εἰ ἐστιν ἔπι τῆς γης, καὶ ἐξερευνήσω αὐτὸν ἐν πάσαις Ἰούδα.	καί εἰμί εἰ εἰμί ἐπί ὁ  , καί  αὐτός ἐν πᾶς  .
670660	tlg0527.tlg011.opp-grc2	καὶ ἀνέστησαν οἱ Ζειφαῖοι κοὶ ἐπορεύθησαν ἔμπροσθεν Σαούλ·	καί ἀνίστημι ὁ   ἐφορεύω ἔμπροσθεν  ·
670661	tlg0527.tlg011.opp-grc2	καὶ Δαυεὶδ καὶ οἱ ἄνδρες αὐτοῦ ἐν τῇ ἐρήμῳ τῇ Μαὰν κα σπέραν ἐκ δεξιῶν τοῦ Ἰεσσαιμού.	καί  καί ὁ ἀνήρ αὐτός ἐν ὁ ἐρῆμος ὁ    ἐκ δεξιός ὁ  .
670662	tlg0527.tlg011.opp-grc2	καὶ ἐπορεύθη Σαοὺλ καὶ οἱ ἄν αὐτοῦ ζητεῖν ἁλόν·	καί ἐφορεύω  καί ὁ ἄν αὐτός ζητέω  ·
670663	tlg0527.tlg011.opp-grc2	καὶ ἀπήγγειλαν τῷ Δαυείδ, καὶ κατέβη εἰς πέτραν τὴν ἐν τῇ ἐρήμῳ Μαάν·	καί ἀπαγγέλλω τῷ  , καί καταβαίνω εἰς πέτρα ὁ ἐν ὁ ἐρῆμος  ·
670664	tlg0527.tlg011.opp-grc2	καὶ ἤκουσεν Σαούλ, καὶ ὀπίσω Δαυεὶδ εἰς τὴν ἔρημον Μαάν.	καί ἀκούω  , καί ὀπίσω  εἰς ὁ ἐρῆμος  .
670665	tlg0527.tlg011.opp-grc2	καὶ πορεύονται Σαοὺλ καὶ οἱ ἄνδρες αὐτοῦ ἐκ μέρους τοῦ ὄρους τούτου, καὶ ἦν Δαυεὶδ καὶ οἱ ἄνδρες αὐτοῦ ἐκ μέρους τοῦ ὄρους τούτου·	καί πορεύω  καί ὁ ἀνήρ αὐτός ἐκ μέρος ὁ ὀρός οὗτος , καί εἰμί  καί ὁ ἀνήρ αὐτός ἐκ μέρος ὁ ὀρός οὗτος ·
670666	tlg0527.tlg011.opp-grc2	καὶ ἦν Δαυεὶδ σκεπαζόμενος πορεύεσθαι ἀπὸ προσώπου Σαούλ, καὶ Σαοὺλ καὶ οἱ ἄνδρες αὐτοῦ παρενέβαλον ἐπὶ Δαυεὶδ καὶ τοὺς ἄνδρας αὐτοῦ συλλαβεῖν αὐτούς.	καί εἰμί  σκεπάζω πορεύω ἀπό πρόσωπον  , καί  καί ὁ ἀνήρ αὐτός παρεμβάλλω ἐπί  καί ὁ ἀνήρ αὐτός συλλαμβάνω αὐτός .
670667	tlg0527.tlg011.opp-grc2	καὶ ἄγγελος πρὸς Σαοὺλ ἦλθεν λέγων Σπεῦδε καὶ δεῦρο, ὅτι ἐπέθεντο οἱ ἀλλόφυλοι ἐπὶ τὴν γῆν.	καί ἄγγελος πρός  ἔρχομαι λέγω  καί δεῦρο , ὅτι2 ἐπιτίθημι ὁ  ἐπί ὁ γῆ .
670668	tlg0527.tlg011.opp-grc2	καὶ ἀνέστρεψεν Σαοὺλ μὴ καταδιώκειν ὀπίσω Δαυείδ, καὶ ἐπορεύθη εἰς συνάντησιν τῶν ἀλλοφύλων·	καί ἀναστρέφω  μή καταδιώκω ὀπίσω  , καί ἐφορεύω εἰς συνάντησις ὁ ἀλλόφυλος ·
670669	tlg0527.tlg011.opp-grc2	διὰ τοῦτο ἐπεκλήθη ὁ τόπος ἐκεῖνος Πέτρα ἡ μερισθεῖσα.	διά οὗτος ἐπικαλέω ὁ τόπος ἐκεῖνος Πέτρα ὁ μερίζω .
670670	tlg0527.tlg011.opp-grc2	καὶ ἀνέστη Δαυεὶδ ἐκεῖθεν καὶ ἐκάθισεν ἐν τοῖς στενοῖς Ἐνγάδδει.	καί ἀνίστημι  ἐκεῖθεν καί καθίζω ἐν ὁ στενός  .
670671	tlg0527.tlg011.opp-grc2	Καὶ ἐγενήθη ὡς ἀνέστρεψεν Σαοὺλ ἀπὸ ὄπισθεν τῶν ἀλλοφύλων,B καὶ ἀπηγγέλη αὐτῷ λεγόντων ὅτι Δαυεὶδ ἐν τῇ ἐρήμῳ’ Eνγάδδει.	καί γίγνομαι ὡς ἀναστρέφω  ἀπό ὄπισθεν ὁ ἀλλόφυλος , B καί  αὐτός λέγω ὅτι2  ἐν ὁ ἐρῆμος ’  .
670672	tlg0527.tlg011.opp-grc2	καὶ ἔλαβεν μεθ’ ἑαυτοῦ τρεῖς χιλιάδας ἀνδρῶν ἐκλεκτοὺς ἐκ παντὸς’ lσραήλ, καὶ ἐπορεύθη ζητεῖν τὸν Δαυεὶδ καὶ τοὺς ἄνδρας αὐτοῦ ἐπὶ πρόσωπον Ἐδδαιέμ.	καί λαμβάνω μετά ἑαυτοῦ  χιλιάς ἀνήρ ἐκλεκτός ἐκ πᾶς ’  , καί ἐφορεύω ζητέω ὁ  καί ὁ ἀνήρ αὐτός ἐπί πρόσωπον  .
670673	tlg0527.tlg011.opp-grc2	καὶ ἦλθεν εἰς τὰς ἀγέλας τὰς ἐπὶ τῆς ὁδοῦ, καὶ ἦν ἐκεῖ σπήλαιον·	καί ἔρχομαι εἰς ὁ ἀγέλη ὁ ἐπί ὁ ὁδός , καί εἰμί ἐκεῖ  ·
670674	tlg0527.tlg011.opp-grc2	καὶ Σαοὺλ παρασκευάσασθαι, καὶ Δαυεὶδ καὶ οἱ ἄνδρες αὐτοῦ ἐσώτερον τοῦ σπηλαίου ἐκάθηντο.	καί  παρασκευάζω , καί  καί ὁ ἀνήρ αὐτός ἐσώτερος ὁ   .
670675	tlg0527.tlg011.opp-grc2	καὶ εἶπον οἱ ἄνδρες Δαυεὶδ πρὸς ἰδοὺ ἡ ἡμέρα αὕτη ἢν εἶπεν κύριος πρὸς σέ, παραδοῦναι τὸν σου εἰς τὰς χεῖράς σου·	καί λέγω ὁ ἀνήρ  πρός  ὁ ἡμέρα οὗτος ἐάν λέγω κύριος2 πρός  , παραδίδωμι ὁ  εἰς ὁ χείρ  ·
670676	tlg0527.tlg011.opp-grc2	καὶ ποιήσεις αὐτῷ ὡς ἀγαθὸν ἐν ὀφθαλμοῖς σου.	καί ποιέω αὐτός ὡς ἀγαθός ἐν ὀφθαλμός  .
670677	tlg0527.tlg011.opp-grc2	καὶ ἀνέστη Δαυεὶδ καὶ ἀφεῖλεν τὸ πτερύγιον τῆς διπλοίδος τῆς Σαοὺλ λαθραίως.	καί ἀνίστημι  καί ἀφαιρέω ὁ  ὁ  ὁ  λαθραῖος .
670678	tlg0527.tlg011.opp-grc2	καὶ ἐγενήθη μετὰ ταῦτα καὶ ἐπάταξεν καρδία Δαυεὶδ αὐτόν, ὅτι ἀφεῖλεν τὸ πτερύγιον τῆς διπλοίδος αὐτοῦ.	καί γίγνομαι μετά οὗτος καί πατάσσω καρδία  αὐτός , ὅτι2 ἀφαιρέω ὁ  ὁ  αὐτός .
670679	tlg0527.tlg011.opp-grc2	καὶ εἶπεν Δαυεὶδ πρὸς τοὺς ἄνδρας αὐτοῦ Μηδαμῶς μοι παρὰ κυρίου, εἰ ποιήσω τὸ ῥῆμα τοῦτο τῷ χριστῷ κυρίου, ἐπενέγκαι χεῖρά μου ἐπ’ αὐτόν·	καί λέγω  πρός ὁ ἀνήρ αὐτός μηδαμῶς  παρά  , εἰ ποιέω ὁ ῥῆμα οὗτος ὁ χριστός  ,  χείρ  ἐπί αὐτός ·
670680	tlg0527.tlg011.opp-grc2	ὅτι χριστὸς κυρίου ἐστὶν οὗτος.	ὅτι2 χριστός  εἰμί οὗτος .
670681	tlg0527.tlg011.opp-grc2	καὶ ἔπεισεν Δαυεὶδ τοὺς ἄνδρας αὐτοῦ ἐν λόγοις, καὶ οὐκ ἔδωκεν αὐτοῖς ἀναστάντας θῦσαι τὸν Σαούλ·	καί πείθω  ὁ ἀνήρ αὐτός ἐν λόγος , καί οὐ δίδωμι αὐτός ἀνίστημι θύω ὁ  ·
670682	tlg0527.tlg011.opp-grc2	καὶ ἀνέστη Σαοὺλ καὶ κατέβη τὴν ὁδόν.	καί ἀνίστημι  καί καταβαίνω ὁ ὁδός .
670683	tlg0527.tlg011.opp-grc2	καὶ ἀνέστη Δαυεὶδ ὀπίσω αὐτοῦ ἐκ τοῦ σπηλαίου·	καί ἀνίστημι  ὀπίσω αὐτός ἐκ ὁ  ·
670684	tlg0527.tlg011.opp-grc2	καὶ ἐβόησεν Δαυεὶδ ὀπίσω Σαοὺλ λέγων κύριε βασιλεῦ·	καί βοάω  ὀπίσω  λέγω κύριος βασιλεύς ·
670685	tlg0527.tlg011.opp-grc2	καὶ ἐπέβλεψεν Σαοὺλ εἰς τὰ ὀπίσω αὐτοῦ, καὶ ἔκυψεν Δαυεὶδ ἐπὶ πρόσωπον αὐτοῦ ἐπὶ τὴν γῆν καὶ προσεκύνησεν αἠτῷ.	καί ἐπιβλέπω  εἰς ὁ ὀπίσω αὐτός , καί   ἐπί πρόσωπον αὐτός ἐπί ὁ γῆ καί προσκυνέω  .
670686	tlg0527.tlg011.opp-grc2	καὶ εἶπεν Δαυεὶδ πρὸς Σαούλ Ἵνα τί ἀκούεις τῶν λόγων τοῦ λαοῦ λεγόντων Ἴδου Δαυεὶδ ζητεῖ τὴν ψυχήν σου;	καί λέγω  πρός  ἵνα τίς ἀκούω ὁ λόγος ὁ λαός λέγω   ζητέω ὁ ψυχή  ;
670687	tlg0527.tlg011.opp-grc2	ἰδοὺ ἐν τῇ ἡμέρᾳ ταύτῃ ἑοράκασιν οἱ ὀφθαλμοί σου ὡς παρέδωκέν σε κύριος σήμερον εἰς χεῖρά μου ἐν τῷ σπηλαίῳ, καὶ οὐκ ἠβουλήθην ἀποκτεῖναί κτεῖναί σε, καὶ ἐφεισάμην σου καὶ εἶπα οὐκ ἐποίσω χεῖρά μου ἐπὶ κύριόν μου, ὅτι χριστὸς κυρίου οὗτός ἐστιν.	ἐν ὁ ἡμέρα οὗτος  ὁ ὀφθαλμός  ὡς παραδίδωμι  κύριος2 σήμερον εἰς χείρ ἐγώ ἐν ὁ σπήλαιον , καί οὐ βούλομαι ἀποκτείνω κτείνω  , καί φείδομαι  καί  οὐ ἐπιφέρω χείρ  ἐπί κύριος ἐγώ , ὅτι2 χριστός   εἰμί .
670688	tlg0527.tlg011.opp-grc2	καὶ ἰδοὺ τὸ πτερύγιον τῆς διπλοίδος σου ἐν τῇ χειρί μου·	καί  ὁ πτερύγιον ὁ  σύ ἐν ὁ χείρ ἐγώ ·
670689	tlg0527.tlg011.opp-grc2	ἐγὼ ἀφῄρηκα τὸ πτερύγιον καὶ οὐκ ἀπέκτανκά σε·	ἀφαιρέω ὁ  καί οὐ   ·
670690	tlg0527.tlg011.opp-grc2	καὶ γνῶθι καὶ ἴδε σήμερον ὅτι οὐκ ἔστιν κακία ἐν τῇ χειρί μου οὐδὲ ἀσέβεια καὶ ἀθέτησις, καὶ οὐχ ἡμάρτηκα εἰς σέ·	καί γιγνώσκω καί ὁράω σήμερον ὅτι2 οὐ εἰμί κακία ἐν ὁ χείρ  οὐδέ ἀσέβεια καί ἀθέτησις , καί οὐ ἁμαρτάνω εἰς  ·
670691	tlg0527.tlg011.opp-grc2	καὶ σὺ δεσμεύεις τὴν ψυχήν μου λαβεῖν αὐτήν.	καί   ὁ ψυχή  λαμβάνω αὐτός .
670692	tlg0527.tlg011.opp-grc2	δικάσαι κύριος ἀνὰ μέσον ἐμοῦ κα σοῦ, καὶ ἐκδικήσαι με κύριος ἐκ σοῦ, καὶ χείρ μου οὐκ ἔσται ἐπὶ σοί·	δικάζω κύριος2 ἀνά μέσος   σός , καί   κύριος2 ἐκ σός , καί χείρ ἐγώ οὐ εἰμί ἐπί  ·
670693	tlg0527.tlg011.opp-grc2	καθὼς λέγεται χείρ μου οὐκ ἔσται ἐπὶ σέ.	λέγω χείρ ἐγώ οὐ εἰμί ἐπί  .
670694	tlg0527.tlg011.opp-grc2	καὶ νῦν ὀπίσω τίνος σὺ ἐκπορεύῃ, βοσιλεῦ Ἰσραήλ;	καί νῦν ὀπίσω    ,   ;
670695	tlg0527.tlg011.opp-grc2	ὀπίσω τίνος καταδιώκεις σύ;	ὀπίσω    ;
670696	tlg0527.tlg011.opp-grc2	ὀπίσω κυνὸς τεθνηκότος καὶ ὀπίσω ψύλλου ἑνός.	ὀπίσω  ἀποθνῄσκω καί ὀπίσω   .
670697	tlg0527.tlg011.opp-grc2	γένοιτο κύριος εἰς κριτὴν καὶ δικαστὴν ἀνὰ μέσον ἐμοῦ καὶ ἀνὰ μέσον σοῦ·	γίγνομαι κύριος2 εἰς  καί δικαστής ἀνά μέσος ἐμός καί ἀνά μέσος σός ·
670698	tlg0527.tlg011.opp-grc2	ἴδοι κύριος καὶ κρίναι τὴν κρίσιν μου καὶ δικάσαι μοι ἐκ χειρός σου·	ὁράω κύριος2 καί κρίνω ὁ κρίσις  καί δικάζω  ἐκ χείρ  ·
670699	tlg0527.tlg011.opp-grc2	καὶ ἐγένετο ὡς συνετέλεσεν Δαυεὶδ τὰ ῥήματα ταῦτα λαλῶν πρὸς Σαούλ, καὶ εἶπεν Σαούλ Ἡ φωνή σου αὕτη, τέκνον Δαυείδ;	καί γίγνομαι ὡς συντελέω  ὁ ῥῆμα οὗτος λαλέω πρός  , καί λέγω  ὁ φωνή  οὗτος , τέκνον  ;
670700	tlg0527.tlg011.opp-grc2	καὶ ἦρεν τὴν φωνὴν αὐτοῦ Σαοὺλ καὶ ἔκλαυσεν.	καί αἴρω ὁ φωνή αὐτός  καί κλαίω .
670701	tlg0527.tlg011.opp-grc2	καὶ εἶπεν Σαοὺλ πρὸς Δουείδ Δίκαιος σὺ ὑπὲρ ἐμέ, ὅτι σὺ ἀνταπέδωκάς μοι ἀγαθά, ἐγὼ δὲ ἀνταπέδωκά σοι κακά.	καί λέγω  πρός  Δίκαιος  ὑπέρ ἐγώ , ὅτι2    ἀγαθός ,  δέ   κακός .
670702	tlg0527.tlg011.opp-grc2	καὶ σὺ ἀπήγγειλάς μοι σήμερον ἁ ἐποίησάς μοι ἀγαθά, ὡς ἀπέκλεισέν με Κύριος σήμερον εἰς χεῖράς σου κοὶ οὐκ ἀπέκτεινάς με·	καί σύ   σήμερον ὁ   ἀγαθός , ὡς  ἐγώ κύριος2 σήμερον εἰς χείρ   οὐ   ·
670703	tlg0527.tlg011.opp-grc2	καὶ ὅτι εἰ εὕροιτό τις τὸν ἐχθρὸν αὐτοῦ ἐν θλίψει καὶ ἐκπέμψαι αὐτὸν ἐν ὁδῷ ἀγαθῇ, καὶ κύριος ἀνταποτίσει αὐτῷ ἀγαθά, καθὼς πεποίηκας σήμερον.	καί ὅτι2 εἰ  τις ὁ ἐχθρός αὐτός ἐν  καί ἐκπέμπω αὐτός ἐν ὁδός ἀγαθός , καί κύριος2  αὐτός ἀγαθός ,  ποιέω σήμερον .
670704	tlg0527.tlg011.opp-grc2	καὶ νῦν ἰδοὺ ἐγὼ γινώσκω ὅτι βασιλεύων βασιλεύσεις, καὶ στήσεται ἐν χερσίν σου βασιλεία Ἰσραήλ.	καί νῦν   γιγνώσκω ὅτι2 βασιλεύω  , καί ἵστημι ἐν χείρ  βασιλεία  .
670705	tlg0527.tlg011.opp-grc2	καὶ νῦν ὄμοσόν μοι ἐν Κύρῳ ὅτι οὐκ ἐξολεθρεύσεις τὸ σπέρμα μου ὀπίσω μου, καὶ οὐκ ἀφανιεῖς τὸ ὄνομά μου ἐκ του οἴκου τοῦ πατρός μου.	καί νῦν   ἐν Κῦρος ὅτι2 οὐ  ὁ σπέρμα  ὀπίσω  , καί οὐ  ὁ ὄνομα ἐγώ ἐκ ὁ οἶκος ὁ πατήρ  .
670706	tlg0527.tlg011.opp-grc2	καὶ ὤμοσεν Δαυεὶδ τῷ Σαούλ.	καί ὄμνυμι  ὁ  .
670707	tlg0527.tlg011.opp-grc2	καὶ ἀπῆλθεν Σαοὺλ εἰς τὸν τόπον αὐτοῦ, καὶ Δαυεὶδ καὶ οἱ ἄνδρες αὐτοῦ ἀνέβησαν εἰς τὴν Μεσσαρὰ στενήν.	καί ἀπέρχομαι  εἰς ὁ τόπος αὐτός , καί  καί ὁ ἀνήρ αὐτός ἀναβαίνω εἰς ὁ   .
670708	tlg0527.tlg011.opp-grc2	Καὶ ἀπέθανεν Σαμουήλ, καὶ συναθροίζονται πᾶς Ἰσραὴλ καὶ κόπτονται αὐτόν, καὶ θάπτουσιν αὐτὸν ἐν οἴκῳ αὐτοῦ ἐν Ἁρμαθάιμ.	καί ἀποθνῄσκω  , καί συναθροίζω πᾶς  καί  αὐτός , καί θάπτω αὐτός ἐν οἶκος αὐτός ἐν  .
670709	tlg0527.tlg011.opp-grc2	καὶ ἀνέστη Δαυεὶδ καὶ κατέβη εἰς τὴν ἔρημον Μαάν.	καί ἀνίστημι  καί καταβαίνω εἰς ὁ ἐρῆμος  .
670710	tlg0527.tlg011.opp-grc2	Καὶ ἢν ἄνθρωπος ἐν τῇ Μαάν, καὶ τὰ ποίμνια αὐτοῦ ἐν τῷ Καρμήλῳ·	καί  ἄνθρωπος ἐν ὁ  , καί ὁ ποίμνιον αὐτός ἐν ὁ  ·
