id	filename	tokens	lemmas
1244736	tlg0057.tlg057.1st1K-grc1	οὗτος μὲν οὖν ἐν πολλῷ χρόνῳ μόγις ἐσώθη, συμβαλλούσης αὐτῷ καὶ τῆς ἡλικίας·	οὗτος μέν οὖν ἐν πολύς χρόνος μόγις σῴζω ,  αὐτός καί ὁ ἡλικία ·
1244737	tlg0057.tlg057.1st1K-grc1	ὅσοι δὲ πρεσβύτεροι αὐτοῦ, διεφθάρησαν.	ὅσος δέ πρέσβυς αὐτός , διαφθείρω .
1244738	tlg0057.tlg057.1st1K-grc1	ἥ γε μὴν ὀδύνη πᾶσι τοῖς ἐν στομάχῳ τι πάθος ἀλγεινὸν ἔχουσι κατὰ τὸ μετάφρενον διασημαίνει·	ὁ γε μήν ὀδύνη πᾶς ὁ ἐν  τις πάθος ἀλγεινός ἔχω κατά ὁ μετάφρενον διασημαίνω ·
1244739	tlg0057.tlg057.1st1K-grc1	καὶ ἡ αἰτία πρόδηλος ἑωρακόσιν ὑμῖν ἐπιτεταμένον τῆ ῥάχει τὸν στόμαχον.	καί ὁ αἰτία πρόδηλος ὁράω  ἐπιτείνω τῆ  ὁ στόμαχος .
1244740	tlg0057.tlg057.1st1K-grc1	ὅτι δὲ κατὰ τοὺς αὐτοὺς τρόπους κᾀκ τῶν κατὰ τὸν στόμαχον ἀγγείων ἐμοῦσιν αἷμα, καθ’ ὃν κᾀκ τῶν ἄλλων ἁπάντων, εὔδηλόν ἐστιν.	ὅτι2 δέ κατά ὁ αὐτός τρόπος  ὁ κατά ὁ στόμαχος   αἷμα , κατά ὅς  ὁ ἄλλος ἅπας , εὔδηλος εἰμί .
1244741	tlg0057.tlg057.1st1K-grc1	ἀλλ’ αἱ μὲν κατὰ ῥῆξιν αἵματος ἀναφοραὶ σὺν ἀλγήμασι γίγνονται διασημαίνουσαι τὸν τόπον ἐν ᾧ γέγονεν ἡ ῥῆξις·	ἀλλά ὁ μέν κατά ῥῆξις αἷμα ἀναφορά σύν ἄλγημα γίγνομαι  ὁ τόπος ἐν ὅς γίγνομαι ὁ ῥῆξις ·
1244742	tlg0057.tlg057.1st1K-grc1	ὁμοίως δ’ αὐταῖς καὶ αἱ κατὰ διάβρωσιν, ἢ ἀνάβρωσιν, ἢ ὅπως ἄν τις ὀνομάζειν ἐθέλῃ·	ὅμοιος  αὐτός καί ὁ κατά διαβιβρώσκω , τίη  , ἤ ὅπως ἄν τις ὀνομάζω ἐθέλω ·
1244743	tlg0057.tlg057.1st1K-grc1	αἱ δὲ κατ’ ἀναστόμωσιν ἀνώδυνοι τελέως εἰσὶν, αὐτῷ τε οὖν τούτῳ διορίζονται τῶν ἑτέρων καὶ τῷ μήτ’ ἐπὶ πληγῇ σφοδρᾷ μήτ’ ἐπὶ καταπτώσεσι γεγονέναι, καθάπερ αἱ ῥήξεις εἰώθασι γίγνεσθαι.	ὁ δέ κατά  ἀνώδυνος τέλειος εἰμί , αὐτός τε οὖν οὗτος  ὁ ἕτερος καί τῷ  ἐπί πληγή σφοδρός  ἐπί  γίγνομαι , καθά ὁ ῥῆξις εἴωθα γίγνομαι .
1244744	tlg0057.tlg057.1st1K-grc1	συμβαίνουσι δὲ καὶ χωρὶς προφάσεως τῆς ἔξωθεν ἐνίοτε ῥήξεις ἀγγείων ὑπὸ πλήθους αἵματος·	συμβαίνω δέ καί χωρίς πρόφασις ὁ ἔξωθεν ἐνίοτε ῥήγνυμι  ὑπό πλῆθος αἷμα ·
1244745	tlg0057.tlg057.1st1K-grc1	αἱ δὲ κατὰ διάβρωσιν ἑλκώσεως προηγησαμένης γίγνονται·	ὁ δέ κατά διάβρωσις ἕλκωσις  γίγνομαι ·
1244746	tlg0057.tlg057.1st1K-grc1	τὴν δ’ ἕλκωσιν αἵ τε ῥήξεις τῶν ἀγγείων ποιοῦσιν καὶ αἱ τῶν κακοηθῶν χυμῶν ἐπιῤῥοαί·	ὁ  ἕλκω ὁ τε ῥήγνυμι ὁ  ποιέω καί ὁ ὁ κακοήθης   ·
1244747	tlg0057.tlg057.1st1K-grc1	καθάπερ ὁρῶνται κᾀπὶ τοῦ δέρματος συμβαίνουσαι πολλάκις.	καθά ὁράω  ὁ δέρμα  πολλάκις .
1244748	tlg0057.tlg057.1st1K-grc1	Τὸ στόμα τῆς κοιλίας οἱ παλαιοὶ καρδίαν ὠνόμαζον, ἀφ’ ὧν ἐπιφέρει συμπτωμάτων, ὥς φασιν, οὕτω προσαγορεύσαντες·	στόμα ὁ κοιλία ὁ παλαιός καρδία ὀνομάζω , ἀπό ὅς ἐπιφέρω σύμπτωμα , ὡς φημί , οὕτως προσαγορεύω ·
1244749	tlg0057.tlg057.1st1K-grc1	οὐ γὰρ μόνον ὡς καρδιακαῖς συγκοπαῖς, οὕτω καὶ στομαχικαῖς ἁλίσκονταί τινες, ἀλλὰ καὶ σπασμοῖς καὶ κάροις ἐπιληψίαις τε καὶ μελαγχολίαις, ἤδη δὲ καὶ τοῖς τῶν ὑποχεομένων συμπτώμασιν, ὡς ἐν τῷ περὶ τῶν ὀφθαλμῶν λόγῳ πρόσθεν εἴρηται.	οὐ γάρ μόνος ὡς   , οὕτως καί   τις , ἀλλά καί  καί   τε καί  , ἤδη δέ καί ὁ ὁ  σύμπτωμα , ὡς ἐν ὁ περί ὁ ὀφθαλμός λόγος πρόσθεν λέγω .
1244750	tlg0057.tlg057.1st1K-grc1	καὶ ταῦτα πάντα συμπασχόντων αὐτῷ γίγνεται μορίων ἑτέρων·	καί οὗτος πᾶς  αὐτός γίγνομαι μόριος ἕτερος ·
1244751	tlg0057.tlg057.1st1K-grc1	ἐπεί τοι κατὰ τὸν ἴδιον λόγον ἀνορεξίας τε καὶ διαφθορὰς τῶν ἐπιπολαζόντων ἐργάζεται σιτίων, ὡς τά γ’ ἐν τῷ πυθμένι τῆς κοιλίας στηρίζεσθαι πεφυκότα, καὶ μάλιστα ὅτ’ ἂν ᾖ δυσδιάφθαρτα, τοιούτων οὐδὲν πάσχει.	ἐπεί τοι κατά ὁ ἴδιος λόγος  τε καί διαφθορά ὁ ἐπιπολάζω ἐργάζομαι σιτίον , ὡς ὁ  ἐν ὁ πυθμήν ὁ κοιλία  φύω , καί μάλιστα  ἐάν εἰμί  , τοιοῦτος οὐδείς πάσχω .
1244752	tlg0057.tlg057.1st1K-grc1	προσέχειν οὖν ἀκριβῶς χρὴ τοῖς κατὰ συμπάθειαν ἐπ’ αὐτῷ γινομένοις παθήμασι, καὶ χωρίζειν αὐτὰ τῶν κατὰ πρωτοπάθειαν ἐκείνοις τοῖς μορίοις γιγνομένων, ὧν ταῖς ἐνεργείαις λυμαίνεται τὸ τῆς γαστρὸς στόμα πάσχον, ὅπερ ὡς οἱ παλαιοὶ πάντες ὠνόμαζον καρδίαν, οὕτως οἱ νῦν ὀνομάζουσι στόμαχον.	προσέχω οὖν ἀκριβής χρή ὁ κατά συμπάθεια ἐπί αὐτός  πάθημα , καί χωρίζω αὐτός ὁ κατά  ἐκεῖνος ὁ μόριος  , ὅς ὁ ἐνέργεια λυμαίνομαι ὁ ὁ γαστήρ στόμα  , ὅς ὡς ὁ παλαιός πᾶς ὀνομάζω καρδία , οὕτως ὁ νῦν ὀνομάζω στόμαχος .
1244753	tlg0057.tlg057.1st1K-grc1	ὁ διορισμὸς δὲ ἐκ τῶν προηγησαμένων μάλιστα γίγνεται κατάδηλος ἀνδρὶ τετριμμένῳ περὶ τὰς διαγνώσεις.	ὁ διόρισις δέ ἐκ ὁ  μάλιστα γίγνομαι κατάδηλος ἀνήρ τρίβω περί ὁ διάγνωσις .
1244754	tlg0057.tlg057.1st1K-grc1	ἰδιότητες γάρ τινες ἄῤῥητοι προσέρχονται τοῖς ῥητοῖς συμπτώμασιν, αἱ βεβαιοῦσαι τὰς διαγνώσεις τῶν πεπονθότων μορίων·	γάρ τις  προσέρχομαι ὁ ῥητός σύμπτωμα , ὁ  ὁ διάγνωσις ὁ  μόριον ·
1244755	tlg0057.tlg057.1st1K-grc1	ἐκείνας μὲν οὖν ἕκαστος ἑαυτῷ προσεξευρήσει, τὰδ’ οἷον θεμέλια τῆς ὅλης διαγνώσεως, ἐξ ὧν οἱ φιλόπονοι καὶ τὰς ἀδυνάτους ῥηθῆναι τῶν συμπτωμάτων ἰδιότητας αὑτοὺς διδάξουσιν, ἐγὼ διηγήσομαι.	ἐκεῖνος μέν οὖν ἕκαστος ἑαυτοῦ  , ὁ δ’ οἷος  ὁ ὅλος διάγνωσις , ἐκ ὅς ὁ  καί ὁ  λέγω ὁ σύμπτωμα  ἑαυτοῦ  ,  διηγέομαι .
1244756	tlg0057.tlg057.1st1K-grc1	νεανίσκος τις ἡλίσκετο τῷ τῆς ἐπιληψίας πάθει γραμματικὸς, ἡνίκα μάλιστα σφοδρότερον ἐδίδασκεν, ἢ ἐφρόντισεν, ἢ ἐπιπλέον ἠσίτησεν, ἢ ἐθυμώθη.	νεανίσκος τις ἁλίσκομαι τῷ ὁ  πάθος γραμματικός , ἡνίκα μάλιστα σφοδρός διδάσκω , ἤ φροντίζω , ἤ   , ἤ θυμόω .
1244757	tlg0057.tlg057.1st1K-grc1	τούτῳ τὸ στόμα τῆς κοιλίας ὑπενόησα πάσχειν, εὐαίσθητον ὑπάρχον, ἐφ’ ᾧ κατὰ συμπάθειαν τὸν ἐγκέφαλον ὅλον τὸ σῶμα κραδαίνειν σπασμωδῶς.	οὗτος ὁ στόμα ὁ κοιλία  πάσχω , εὐαίσθητος ὑπάρχω , ἐπί ὅς κατά συμπάθεια ὁ ἐγκέφαλος ὅλος ὁ σῶμα κραδαίνω  .
1244758	tlg0057.tlg057.1st1K-grc1	ἐκέλευσα τοιγαροῦν εὐπεψίας μόνης αὐτὸν ἀκριβοῦς προνοεῖσθαι, τρίτηςδ’ ὥρας ἢ τετάρτης ἄρτον ἐπιμελῶς ἐσκευασμένον προσφέρεσθαι, μόνον μὲν, εἰ ἄδιψος εἴη, δίψηςδ’ αἰσθανόμενον, ἐξ οἴνου κεκραμένου τῶν ἠρέμα στυφόντων καὶ λευκῶν·	κελεύω   μόνος αὐτός  προνοέω , τρίτος δ’ ὥρα2 ἤ τέταρτος ἄρτος ἐπιμελής σκευάζω προσφέρω , μόνος μέν , εἰ ἄδιψος εἰμί , δίψα δ’  , ἐκ οἶνος  ὁ  στύφω καί λεύκη ·
1244759	tlg0057.tlg057.1st1K-grc1	οὗτοι γὰρ καὶ τονοῦσι τὴν γαστέρα καὶ τὴν κεφαλὴν οὐ πλήττουσιν, ὥσπερ οἱ σφοδροί.	οὗτος γάρ καί  ὁ γαστήρ καί ὁ κεφαλή οὐ  , ὥσπερ ὁ  .
1244760	tlg0057.tlg057.1st1K-grc1	ὡς δὲ τοῦτ’ αὐτῷ πράττοντι συνέβαινε μηδὲν πάσχειν, ἀκριβῆ τε γνῶσιν εἶχον ὧν ἐστοχαζόμην ἔμπροσθεν, ἐδίδουντ’ αὐτῷ τοῦ διὰ τῆς ἀλόης πικροῦ φαρμάκου δίς που καὶ τρὶς ἑκάστου ἔτους, ἐπειδὴ καθαίρει τε τῶν περιττωμάτων ὅλην τὴν γαστέρα καὶ ῥώννυσι πρὸς τὰς οἰκείας ἐνεργείας, ἔτεσιν οὗτος ὁ ἀνὴρ οἷς ἐπεβίω πλέοσι τῶν εἴκοσι, ὑγιαίνων ἀμέμπτως διετέλεσεν·	ὡς δέ  αὐτός πράσσω συμβαίνω  πάσχω , ἀκριβής τε γιγνώσκω ἔχω ὅς στοχάζομαι ἔμπροσθεν , δίδωμι τ’ αὐτός ὁ διά ὁ ἀλόη πικρός  δίς που καί τρίς ἕκαστος  , ἐπεί καθαίρω τε ὁ περίσσωμα ὅλος ὁ γαστήρ καί ῥώννυμι πρός ὁ  ἐνέργεια , ἔτος οὗτος ὁ ἀνήρ ὅς   ὁ  , ὑγιαίνω ἄμεμπτος διατελέω ·
1244761	tlg0057.tlg057.1st1K-grc1	εἰ δέ που σπανίως ὑπὸ περιστάσεως πραγμάτων ἄσιτος ἠναγκάσθη διατεθῆναι, συνέβαινεν ἁλίσκεσθαι βραχυτάτοις αὐτὸν σπασμοῖς.	εἰ δέ που σπάνιος ὑπό περίστασις πρᾶγμα ἄσιτος ἀναγκάζω διατίθημι , συμβαίνω ἁλίσκομαι βραχύς αὐτός  .
1244762	tlg0057.tlg057.1st1K-grc1	ἐθεασάμην δὲ καὶ ἄλλους ἀπὸ τοῦ στόματος κοιλίας ἐπιληπτικῶς σπωμένους, ὁπότε σφοδρῶς ἠπέπτησαν, ἢ οἴνου πλέονος ἀκρατεστέρου πίνοιεν, ἢ ἀφροδισίοις ἀκαιρότερον χρήσοιντο·	θεάομαι δέ καί ἄλλος ἀπό ὁ στόμα κοιλία   ,  σφοδρός  , ἤ οἶνος   πίνω , ἤ Ἀφροδίσιος ἄκαιρος  ·
1244763	tlg0057.tlg057.1st1K-grc1	τινὰς δ’ ὲν πυρετοῖς ἐθεασάμην σπασθέντας ἐξαίφνης οὐδενὶ προηγησαμένῳ σημείῳ τῶν προδηλούντων σπασμὸν, οἷς ἐπιγενομένου χολώδους ἐμέτου παραχρῆμα συνέβη πάντων ἀπαλλαγῆναι τῶν ὀχληρῶν.	θεάομαι  ἐξαίφνης   σημεῖον ὁ  σπασμός , ὅς ἐπιγίγνομαι  ἔμετος παραχρῆμα συμβαίνω πᾶς ἀπαλλάσσω ὁ  .
1244764	tlg0057.tlg057.1st1K-grc1	ἔνιοι δὲ τῶν οὕτω παθόντων ἤμεσαν φαιὰ, καί τινες ὅμοια πράσου χυλῷ, τινὲς δ’ ὑπὸ πλήθους ἐδεσμάτων μοχθηρῶν βαρυνόμενοι καρώδεις ἐγίνοντο, μέχρι τοῦ τὰ θλίβοντα τὸ στόμα τῆς κοιλίας ἐξεμέσαι πάντα.	ἔνιοι δέ ὁ οὕτως    , καί τις ὅμοιος  χυλός ,   ὑπό πλῆθος ἔδεσμα μοχθηρός βαρύνω  γίγνομαι , μέχρι ὁ ὁ θλίβω ὁ στόμα ὁ κοιλία ἐξεμέω πᾶς .
1244765	tlg0057.tlg057.1st1K-grc1	τούτων οὐδὲν ἤλπισεν ἄν τις ἐπὶ στόματι κοιλίας γενέσθαι, καθάπερ οὐδὲ τὰς συγκοπὰς, εἰ μὴ πολλάκις ἑωρᾶτο γιγνόμενα·	οὗτος  ἐλπίζω ἄν τις ἐπί στόμα κοιλία γίγνομαι , καθά οὐδέ ὁ  , εἰ μή πολλάκις ὁράω  ·
1244766	tlg0057.tlg057.1st1K-grc1	νεύρων γὰρ ἔχει πλῆθος ἐξ ἐγκεφάλου καθηκόντων, οὐ μὴν ὥστε προσδοκῆσαι δι’ αὐτῶν εἰς τοσοῦτον συμπαθείας ἀφικέσθαι﻿ τὴν ἀρχὴν, ὡς σπασμοὺς ἐπιφέρειν·	γάρ ἔχω πλῆθος ἐκ  καθήκω , οὐ μήν ὥστε προσδοκάω διά αὐτός εἰς τοσοῦτος συμπάθεια ἀφικνέομαι ﻿ ὁ ἀρχή , ὡς σπασμός ἐπιφέρω ·
1244767	tlg0057.tlg057.1st1K-grc1	ἔτι δὲ μᾶλλον οὐδὲ τὴν καρδίαν εἰς τηλικαύτην ἔρχεσθαι συμπάθειαν πάσχοντι τῷ στόματι τῆς κοιλίας, ὡς ὀξεῖαν ἀκολουθῆσαι συγκοπήν.	ἔτι δέ μᾶλλον οὐδέ ὁ καρδία εἰς τηλικοῦτος ἔρχομαι συμπάθεια πάσχω τῷ στόμα ὁ κοιλία , ὡς ὀξύς2 ἀκολουθέω συγκοπή .
1244768	tlg0057.tlg057.1st1K-grc1	ἐγένοντο δὲ πολλοῖς οὐ μόνως ὀνείρατα καὶ ὕπνοι θορυβώδεις, ἀλλὰ καὶ παράνοιαι, διὰ χυμὸν μοχθηρὸν ἐν τῷ στόματι τῆς κοιλίας ἀθροισθέντα.	γίγνομαι δέ πολύς οὐ μόνος ὄνειρος καί ὕπνος θορυβώδης , ἀλλά καί  , διά χυμός μοχθηρός ἐν τῷ στόμα ὁ κοιλία ἀθροίζω .
1244769	tlg0057.tlg057.1st1K-grc1	περὶ δὲ τοῦ φυσώδους τε καὶ ὑποχονδριακοῦ καλουμένου νοσήματος οὐδείς ἐστιν ὃς οὐκ εἴρηκεν, ὅπως δυσθύμους καὶ δυσέλπιδας καὶ σκυθρωποὺς ἀπεργάζεται, καὶ τὸ σύμπαν φάναι μηδὲν ἀπολειπομένους τῶν μελαγχολικῶν.	περί δέ ὁ  τε καί  καλέω νόσημα  εἰμί ὅς οὐ λέγω , ὅπως  καί  καί  ἀπεργάζομαι , καί ὁ σύμπας φημί  ἀπολείπω ὁ μελαγχολικός .
1244770	tlg0057.tlg057.1st1K-grc1	φαίνονται δὲ καὶ οὗτοι μετὰ τὰς ἀπεψίας σφοδρότερον ἁλισκόμενοι τοῖς εἰρημένοις συμπτώμασιν·	φαίνω δέ καί οὗτος μετά ὁ  σφοδρός  ὁ λέγω σύμπτωμα ·
1244771	tlg0057.tlg057.1st1K-grc1	οἱ πλείουςδ’ αὐτῶν καὶ σπληνώδεις εἰσὶν, ὡς λογίσασθαί τινα, κᾀκ τούτου τοῦ σπλάγχνου συῤῥεῖν εἰς τὴν γαστέραμοχθηρὸν ἰχῶρα.	ὁ πολύς δ’ αὐτός καί  εἰμί , ὡς λογίζομαι τις ,  οὗτος ὁ   εἰς ὁ γαστήρ μοχθηρὸν  .
1244772	tlg0057.tlg057.1st1K-grc1	ὅσα μὲν οὖν κατὰ τὸν ἐγκέφαλον ἢ τοὺς ὀφθαλμοὺς γίγνεται συμπτώματα, μοχθηρῶν ἀναθυμιάσεσιν ἕπεται χυμῶν·	ὅσος μέν οὖν κατά ὁ ἐγκέφαλος ἤ ὁ ὀφθαλμός γίγνομαι σύμπτωμα , μοχθηρός   χυμός ·
1244773	tlg0057.tlg057.1st1K-grc1	αἱ στομαχικαὶ δὲ συγκοπαὶ διὰ τὴν ἰδιότητα τῶν κατ’ αὐτὸν ἀλγημάτων ἔκλυσιν ἐπιφέρουσιν, ἴσως δὲ καὶ τῆς δυσκρασίας αὐτοῦ διϊκνουμένης εἰς τὴν καρδίαν, ὡς κᾀκείνης ἐν δυσκρασίᾳ μεγάλῃ γινομένης ἀθρόαν κατάπτωσιν ἀκολουθῆσαι τῆς δυνάμεως.	ὁ  δέ  διά ὁ ἰδιότης ὁ κατά αὐτός ἄλγημα  ἐπιφέρω , ἴσος δέ καί ὁ  αὐτός  εἰς ὁ καρδία , ὡς  ἐν δυσκρασία μέγας   κατάπτωσις ἀκολουθέω ὁ δύναμις .
1244774	tlg0057.tlg057.1st1K-grc1	εὔδηλον δ’ ὅτι καὶ ταῖς γυναιξὶν αἱ καλούμεναι κίτται γίγνονται τοῦ μορίου τούτου πάσχοντος·	εὔδηλος  ὅτι2 καί ὁ γυνή ὁ καλέω  γίγνομαι ὁ μόριος οὗτος πάσχω ·
1244775	tlg0057.tlg057.1st1K-grc1	ὅσα γὰρ ὀρεγομέναις κυνωδῶς ἢ μηδ’ ὅλως ὀρεγομέναις ἢ μοχθηρῶν ἐδεσμάτων ὀρεγομέναις γίγνεται, ταῦτα πάντα τοῦ τῆς ὀρέξεως ὀργάνου παθήματά ἐστι, ὃ ἐδείχθη τὸ στόμα τῆς γαστρός.	ὅσος γάρ   ἤ  ὅλος  τίη μοχθηρός ἔδεσμα  γίγνομαι , οὗτος πᾶς ὁ ὁ ὄρεξις  πάθημα εἰμί , ὅς δείκνυμι ὁ στόμα ὁ γαστήρ .
1244776	tlg0057.tlg057.1st1K-grc1	ὡσαύτως δὲ καὶ αἱ καλούμεναι ναυτίαι τούτου τοῦ μέρους εἰσὶ παθήματα, καθάπερ γε καὶ καρδιαλγίαι καὶ λύγγες.	ὡσαύτως δέ καί ὁ καλέω ναυτία οὗτος ὁ μέρος εἰμί πάθημα , καθά γε καί  καί  .
1244777	tlg0057.tlg057.1st1K-grc1	τὰς δ’ αἰτίας ἁπάντων τῶν τοιούτων παθημάτων ἐν τοῖς τῶν συμπτωμάτων αἰτίοις εἴπομεν, ὥστ’ οὐδὲν ἔτι δεῖ διατρίβειν ἐν τῷδε.	ὁ  αἰτία ἅπας ὁ τοιοῦτος πάθημα ἐν ὁ ὁ σύμπτωμα αἴτιος λέγω ,   ἔτι δέω διατρίβω ἐν ὅδε .
1244778	tlg0057.tlg057.1st1K-grc1	καὶ γὰρ ὅσαι κατὰ δυσκρασίαν αὐτῷ γίγνονται διαφοραὶ νοσημάτων, ὡς ὁμοιομερεῖ σώματι συμβαίνουσαι, διήλθομεν ἐν ἐκείνοις·	καί γάρ ὅσος κατά δυσκρασία αὐτός γίγνομαι διαφορά νόσημα , ὡς  σῶμα  , διέρχομαι ἐν ἐκεῖνος ·
1244779	tlg0057.tlg057.1st1K-grc1	ὅσα δ’ αὐτῷ συμπίπτειν εἴωθεν ὀργανικὰ νοσήματα, σαφῆ τὴν διάγνωσιν ἔχει, καὶ λαθεῖν ὑμᾶς οὐκ ἂν οὐδὲν αὐτῶν δύναται μεμνημένους τῶν κοινῶν ἐπ’ αὐτοῖς σημείων, ἔμπροσθέν τε λελεγμένων ἐν τοῖσδε τοῖς ὑπομνήμασιν ἐν ἑτέροις τέ τισιν εἰρησομένων.	ὅσος  αὐτός συμπίπτω  ὀργανικός νόσημα , σαφής ὁ διάγνωσις ἔχω , καί λανθάνω  οὐ ἄν  αὐτός δύναμαι  ὁ κοινός ἐπί αὐτός σημεῖον ,  τε λέγω ἐν ὅδε ὁ ὑπόμνημα ἐν ἕτερος    .
1244780	tlg0057.tlg057.1st1K-grc1	οὔτε γὰρ ἀποστήματα γιγνόμενα κατὰ τὸν τόπον τοῦτον οὔτε φλεγμονώδεις ἢ ἐρυσιπελατώδεις ὄγκοι λάθοιεν ἂν ἡμᾶς, ὥστ’ οὐδ’ ἕλκη·	οὔτε γάρ ἀπόστημα  κατά ὁ τόπος οὗτος οὔτε  ἤ  ὄγκος λανθάνω ἄν  ,  οὐδέ  ·
1244781	tlg0057.tlg057.1st1K-grc1	διάγνωσις μὲν γὰρ αὐτῶν κοινὴ τοῖς ἐπὶ τοῦ στομάχου προειρημένοις, ἐναργεστέρα δὲ τοσοῦτον, ὅσον αἰσθητηκώτερόν ἐστι τὸ μόριον τοῦτο καὶ πρόχειρον καὶ σαφῆ τὴν διάγνωσιν ἔχον.	διάγνωσις μέν γάρ αὐτός κοινός ὁ ἐπί ὁ στόμαχος προαγορεύω ,  δέ  , ὅσος  εἰμί ὁ μόριον οὗτος καί πρόχειρος καί σαφής ὁ διάγνωσις ἔχω .
1244782	tlg0057.tlg057.1st1K-grc1	ὡσαύτως δὲ καὶ περὶ τῆς τοῦ αἵματος ἐξ αὐτοῦ πτύσεως ἡ μὲν τῶν σημείων ἰδέα κοινὴ τοῖς ἐπὶ στομάχου προειρημένοις, ἡ διάγνωσιςδ’ ἐναργεστέρα.	ὡσαύτως δέ καί περί ὁ ὁ αἷμα ἐκ αὐτός  ὁ μέν ὁ   κοινός ὁ ἐπί  προαγορεύω , ὁ διάγνωσις δ’  .
1244783	tlg0057.tlg057.1st1K-grc1	εἰκὸς μὲν δήπου καὶ τὸ κύτος ὅλον τῆς κοιλίας ἐν ὁμοίᾳ διαθέσει ταῖς ἐπὶ τοῦ στόματος αὐτῆς εἰρημέναις γίγνεσθαι, καὶ τὰ συμπτώματα φέρειν ὅμοια, τῷδ’ εἶναι πολὺ βιαιότερα τὰ κατὰ στόμα, παρορᾶσθαί τε καὶ καταφρονεῖσθαι πρὸς τῶν ἰατρῶν, ὡς οὐδ’ ὅλως γιγνόμενα, τὰ κατὰ τὸ κάτω μέρος τῆς γαστρός.	ἔοικα μέν  καί ὁ κύτος ὅλος ὁ κοιλία ἐν ὅμοιος διάθεσις ὁ ἐπί ὁ στόμα αὐτός  γίγνομαι , καί ὁ σύμπτωμα φέρω ὅμοιος , τῷ δ’ εἰμί πολύς  ὁ κατά στόμα ,  τε καί καταφρονέω πρός ὁ ἰατρός , ὡς οὐδέ ὅλος  , ὁ κατά ὁ κάτω μέρος ὁ γαστήρ .
1244784	tlg0057.tlg057.1st1K-grc1	ἀλλὰ τό γε τῆς πέψεως ἔργον ἐν τοῖς μετὰ τὸ στόμα μέρεσι γίγνεσθαι πάντες ὡμολογήκασιν, ὥστε καὶ τῶν ἀπεψιῶν αἴτιον γίγνεται τοῦτο μὴ καλῶς διακείμενον, ὅτ’ ἄν δηλονότι μὴ διὰ τῶν ἐδεσμάτων ἀταξίαν ἢ τὸ πλῆθος ἢ τὴν ποιότητα συμβῇ τὸν ἄνθρωπον ἀπεπτῆσαι.	ἀλλά ὁ γε ὁ πέψις ἔργον ἐν ὁ μετά ὁ στόμα μέρος γίγνομαι πᾶς ὁμολογέω , ὥστε καί ὁ ἀπεψία αἴτιος γίγνομαι οὗτος μή καλός  ,  ἄν  μή διά ὁ ἔδεσμα ἀταξία ἤ ὁ πλῆθος τίη ὁ ποιότης  ὁ ἄνθρωπος  .
1244785	tlg0057.tlg057.1st1K-grc1	ὅσα δ’ ἄλλα νοσήματα κοινὰ πάντων ἐστὶ τῶν μορίων, ὀργανικά τε καὶ κατὰ μόνην δυσκρασίαν, εὔδηλον ἔχοντα τὸν πεπονθότα τόπον, οὐκ ἔστιν ἴδια τῆς ἐνεστώσης πραγματείας·	ὅσος  ἄλλος νόσημα κοινός πᾶς εἰμί ὁ μόριον ,  τε καί κατά μονή  , εὔδηλος ἔχω ὁ  τόπος ,  εἰμί  ὁ  πραγματεία ·
