id	filename	tokens	lemmas
476518	tlg0627.tlg038.1st1K-grc1	Ἢν τὰ ἐπιμήνια πολλὰ γένηται, γλυκυσίδης κόκκους τοὺς μέλανας δὶς ἑπτὰ πίνειν ἐν οἴνῳ δυσὶ κυάθοις.	ὁ  πολύς γίγνομαι ,   ὁ μέλας δίς  πίνω ἐν οἶνος   .
476519	tlg0627.tlg038.1st1K-grc1	41.	.
476520	tlg0627.tlg038.1st1K-grc1	Ἢν δὲ ἐξέρχωνται αἱ μῆτραι πυκνὰ, βρέξας ὕδατι χλιερῷ τὰς μήτρας, ὑπτίην ἀνακλίνας, μίξας σίδιον, κηκίδα, ῥοῦν τὴν ἐρυθρὴν, ἐν οἴνῳ λευκῷ διατρίψας, τούτῳ χρίσας, ἐντιθέναι·	δέ  ὁ μήτρα πυκνός , βρέχω ὕδωρ  ὁ μήτρα ,  ἀνακλίνω , μείγνυμι σίδιον ,  ,  ὁ  , ἐν οἶνος λευκός διατρίβω , οὗτος χρίω ,  ·
476521	tlg0627.tlg038.1st1K-grc1	ἔπειτα πῖσαι δάφνης φύλλα ἐν οἴνῳ αὐστηρῷ.	ἔπειτα πιπίσκω δάφνη φύλλον ἐν οἶνος αὐστηρός .
476522	tlg0627.tlg038.1st1K-grc1	42.	.
476523	tlg0627.tlg038.1st1K-grc1	Ὅταν γυνὴ κύουσα προσρέηται, ὀνίδα ξηρὴν καὶ μίλτον καὶ ὄστρακον σηπίης τρίψασα λεῖα, ἐν ῥάκει ἀποδήσασα, προστιθέναι.	γυνή κύω προσρέω , ὀνίς ξηρός καί  καί  σηπία τρίβω  , ἐν ῥάκος  , προστίθημι .
476524	tlg0627.tlg038.1st1K-grc1	43.	.
476525	tlg0627.tlg038.1st1K-grc1	Ἢν δὲ μὴ καθαρθῇ, ἐλατήριον ἐν οἴνῳ λευκῷ ὅσον κυάθῳ τρίψας ὀβολὸν ἀττικὸν, διδόναι πίνειν, καὶ καθαριεῖται.	δέ μή καθαίρω ,  ἐν οἶνος λευκός ὅσος κύαθος τρίβω ὀβολός  , δίδωμι πίνω , καί  .
