id	filename	tokens	lemmas
798778	tlg0082.tlg004.1st1K-grc1	Πότε μέντοι τὰ τοιαῦτα τῶν ἄρθρων οὔτε ὑποτακτικὰ εἶναι δύναται ἄρθρα οὔτε προτακτικά, ἀλλ᾿ ἀντωνυμικὰ ἢ ἀοριϲτούμενα μόρια, ἐπὰν τὰϲ ϲυντάξειϲ ἐπίωμεν τῶν ἀντωνυμιῶν, παραϲτήϲομεν.	πότε  ὁ τοιοῦτος ὁ ἄρθρον οὔτε  εἰμί δύναμαι ἄρθρον οὔτε  ,   τίη  μόριος , ἐπεί   ἐφίημι ὁ  ,  .
798779	tlg0082.tlg004.1st1K-grc1	, Τούτων τῇδε ἐχόντων ἐπιϲτατέον τὸ καὶ θώρηχ᾿·	, οὗτος ὅδε ἔχω  ὁ καί  ·
798780	tlg0082.tlg004.1st1K-grc1	ὃ γὰρ ἦν οἱ, ἀπώλεϲε πιϲτὸϲ ἑταῖροϲ{Σ 460}, πότερον τὸ ὁ προτακτικόν ἐϲτιν πρὸϲ τὸ πιϲτὸϲ ἑταῖροϲ, ἢ ἀνθ᾿ ὑποτακτικοῦ ἐϲτιν τοῦ ὅϲ, ἀναφερόμενον πρὸϲ τὸ θώρηκα, ἢ πρὸϲ τὸ ἑταῖροϲ καθ’ ὑποτακτικὴν ϲύνταξιν εἴρηται.	ὁ γάρ εἰμί ἕ ,    { Σ  } , πότερος ὁ ὁ    ὁ   , ἤ    ὁ  , ἀναφέρω  ὁ θώραξ , ἤ  ὁ  κατά   λέγω .
798781	tlg0082.tlg004.1st1K-grc1	ἀνέφικτον οὖν προτακτικὸν αὐτὸ παραδέξαϲθαι·	ἀνέφικτος οὖν  αὐτός  ·
798782	tlg0082.tlg004.1st1K-grc1	οὐ γὰρ μετὰ προτακτικὸν ἄρθρον ῥῆμά ποτε ἐπιφέρεται, ἐπιφέρεται δὲ τὸ ἦν.	οὐ γάρ μετά  ἄρθρον ῥῆμα ποτε ἐπιφέρω , ἐπιφέρω δέ ὁ εἰμί .
798783	tlg0082.tlg004.1st1K-grc1	ὃ οὐκ ἄλλο τι ἀπαιτήϲει ἢ ὑποτακτικὸν ἄρθρον, ὅπερ οὐ πιθανὸν ἐπὶ τὸν θώρακα ἀναφέρεϲθαι·	οὐ ἄλλος τις  ἤ  ἄρθρον , ὅς οὐ  ἐπί ὁ θώραξ  ·
798784	tlg0082.tlg004.1st1K-grc1	οὐ γὰρ τοῦτον μόνον ἀπώλεϲεν ὁ Πάτροκλοϲ·	οὐ γάρ οὗτος μόνος  ὁ  ·
798785	tlg0082.tlg004.1st1K-grc1	ἅμα γὰρ ἀϲπίδα καὶ τρυφάλειαν καὶ καλὰϲ κνημῖδαϲ ἐπὶ ϲφυρίοιϲ ἀραρυίαϲ κω θώρηκα{Σ 458—460}.	ἅμα γάρ  καί τρυφάλεια καί   ἐπί    θώραξ { Σ  — 460 } .
798786	tlg0082.tlg004.1st1K-grc1	καὶ ἐάν τιϲ τὸ τοιοῦτο παρῇ, ἔτι μάχεται τὸ ἀκατάλληλον τοῦ λόγου.	καί ἐάν  ὁ  πάρειμι , ἔτι μάχομαι ὁ  ὁ λόγος .
798787	tlg0082.tlg004.1st1K-grc1	δοθήϲεται γὰρ ὅτι ἡ ὕπαρξιϲ τοῦ θώρακοϲ διὰ τῆϲ τοῦ ἄρθρου ϲυντάξεωϲ νοεῖται, καθὼϲ προὐπεδείξαμεν·	γάρ ὅτι2 ὁ  ὁ  διά  ὁ   νοέω ,   ·
798788	tlg0082.tlg004.1st1K-grc1	καὶ εἰ τοῦτο, πῶϲ τὸ πιϲτὸϲ ἑταῖροϲ ϲυναρτηθήϲεται μετὰ ῥήματοϲ ἑτέραϲ εὐθείαϲ νοουμένηϲ ϲὺν ἑτέρῳ ῥήματι τῷ ἦν;	καί εἰ οὗτος ,  ὁ    μετά      ἕτερος ῥῆμα τῷ εἰμί ;
798789	tlg0082.tlg004.1st1K-grc1	πότε δύο εὐθεῖαι κατάλληλον λόγον ἐποίηϲαν;	πότε γε εὐθύς  λόγος  ;
798790	tlg0082.tlg004.1st1K-grc1	ἄμεινον οὖν ἐκεῖνο φάναι, ὡϲ πλαγία καὶ εὐθεῖα κατάλληλον λόγον ποιεῖ.	ἀμείνων οὖν ἐκεῖνος φαίνω ,   καί εὐθύς  λόγος ποιέω .
798791	tlg0082.tlg004.1st1K-grc1	ἡ οὖν εὐθεῖα ἡ διὰ τοῦ ὅ εἰϲ τὴν αὐτὴν εὐεῖαν παραλαμβανέϲθω τοῦ ἑταῖροϲ, ὃϲ ἦν αὐτῷ πιϲτὸϲ ἑταῖροϲ, ἀπώλεϲε τὰ προκατειλεγμένα, λέγω ἀϲπίδα καὶ τρυφάλειαν καὶ κολὰϲ κνημῖδαϲ καὶ θώρηκα·	ὁ οὖν εὐθύς ὁ διά ὁ ὅς  ὁ αὐτός   ὁ  ,  εἰμί αὐτός   ,  ὁ  , λέγω  καί τρυφάλεια καί   καί θώραξ ·
798792	tlg0082.tlg004.1st1K-grc1	ἕτερα γὰρ ἀντὶ τούτων ἁπάντων ἐξαιτεῖται.	ἕτερος γάρ ἀντί οὗτος ἅπας  .
798793	tlg0082.tlg004.1st1K-grc1	χωρὶϲ εἰ μὲ θέλοι τιϲ αἰτιατικὴν ἔξωθεν προϲνεῖμαι, ἐφ’ ἣν πάντωϲ ἐνεχθήϲεται τὸ ἀπώλεϲεν καὶ ἡ πρόθεϲιϲ τοῦ ἄρθρου γένοιτο τοῦ ὅϲ, καὶ θώρηχ᾿·	εἰ  ἐθέλω   ἔξωθεν  , ἐπί ὅς   ὁ  καί ὁ  ὁ  γίγνομαι ὁ  , καί  ·
798794	tlg0082.tlg004.1st1K-grc1	ὃϲ γὰρ ὑπῆρχεν αὐτῷ, τοῦτον ἀπώλεϲεν ὁ πιϲτὸϲ ἑταῖροϲ.	γάρ ὑπάρχω αὐτός , οὗτος  ὁ   .
798795	tlg0082.tlg004.1st1K-grc1	Καὶ παρὰ Ἀλκαίῳ οἱ περὶ Ἀπίωνα τὸν Μόχθον τὸ Κυλλάναϲ ο μέδειϲ{ fr.	καί παρά Ἀλκαῖος ὁ περί Ἀπίων ὁ  ὁ    {  .
798796	tlg0082.tlg004.1st1K-grc1	5 Bergk4} ἐν ῥήματοϲ ϲυντόξει ἤκουον, οὐ παραδεχόμενοι μετοχὴν τοιαύτην ἐκ βαρυτόνου ῥήματοϲ, εἴγε τῆϲ τοιαύτηϲ λήξεωϲ οὐκ ἔχονται κατὰ τὸ κοινὸν ἐκ βαρυτόνων οὖϲαι ῥημάτων.	} ἐν   ἀκούω , οὐ  μετοχή τοιοῦτος ἐκ   , εἰ    οὐ ἔχω κατά ὁ κοινός ἐκ   ῥῆμα .
798797	tlg0082.tlg004.1st1K-grc1	ἀλλὰ καὶ πρὸϲ τὸ τοιοῦτον ἐδείκνυτο ὡϲ καὶ περιϲπώμενον εἴη ῥῆμα τὸ μεδῶ, ἔνθεν καὶ τὸ Δωδώνηϲ μεδέων{Π 234}, ἀφ’ οὗ τὸ μέδημι, ὡϲ οἴκημι, καὶ ἔτι ἡ μέδειϲ ϲυνοῦϲα μετοχὴ κατὰ τὸ ἀκόλουθον.	ἀλλά καί  ὁ  δείκνυμι  καί  ἐάω ῥῆμα ὁ  , ἔνθεν καί ὁ  μεδέων { Π  } , ἀπό οὗ ὁ  ,   , καί ἔτι ὁ   μετοχή κατά ὁ ἀκόλουθος .
798798	tlg0082.tlg004.1st1K-grc1	κἀκ τῆϲ γραφῆϲ δὲ ϲυνηλέγχοντο, οὐκ οὔϲηϲ ποτὲ διὰ τοῦ ει κατὰ πᾶν δεύτερον πρόϲωπον παῤ Αἰολεῦϲιν.	ἐκ   δέ  , οὐ  ποτε διά ὁ  κατά πᾶς δεύτερος    .
798799	tlg0082.tlg004.1st1K-grc1	Τὰ ὑποτακτικὰ ἄρθρα τότε μὲν ἐν κοινότητι ἔχει τὸ ῥῆμα, ὅταν καὶ ἐπιμερίζῃ τὰ πρόϲωπα τὰ προϋποκείμενα.	ἄρθρον τότε μέν ἐν κοινότης ἔχω ὁ ῥῆμα , ὅταν καί  ὁ  ὁ  .
798800	tlg0082.tlg004.1st1K-grc1	φέρε γὰρ οὕτω φάναι, διέπτηϲαν ἀετοὶ ὃϲ μὲν ἀπὸ ἀνατολῆϲ, ὃϲ δὲ ἀπὸ δύϲεωϲ, ἢ καὶ ἔτι ἐπὶ τῆϲ τοιαύτηϲ ϲυντάξεωϲ, Αἰθίοπαϲ τοὶ διχθὰ δεδαίαται ἔϲχατοι ἀνδρῶν, οἳ μὲν δυϲομένου Ὑπερίονοϲ, οἳ δ᾿  ἀνιόντοϲ{ α 23.	φέρω γάρ οὕτως φαίνω ,    μέν ἀπό  ,  δέ ἀπό  , ἤ καί ἔτι ἐπί    ,  ὁ διχθά δαίω2  ἀνήρ , ὁ μέν   , ὁ   {   .
798801	tlg0082.tlg004.1st1K-grc1	24 }.	.
798802	tlg0082.tlg004.1st1K-grc1	μετὰ τὸ Αἰθίοπαϲ ἐπιφέρει ὑποτακτικὸν ἄρθρον τὸ οἵ, ὅπερ ϲυνηθέϲτερον διὰ τοῦτ Ὅμηρόϲ φηϲιν, τοὶ διχθὰ δεδαίαται, ἔϲχατοι ἀνδρῶν.	μετά ὁ  ἐπιφέρω  ἄρθρον ὁ ὁ , ὅς  διά ὁ τ   , ὁ διχθά δαίω2 ,  ἀνήρ .
798803	tlg0082.tlg004.1st1K-grc1	καὶ ϲαφέϲ ἐϲτιν ὅτι ἡ τοῦ δεδαίαται ϲύνταξιϲ φέρεται πρὸϲ τὴν πληθυντικὴν εὐθεῖαν, ἥτιϲ κατὰ τὸ ἑξῆϲ ἐπιμεριζομένη πρὸϲ τὴν τῶν Αἱθιόπων διάϲταϲιν κοινὸν παραλαμβάνει τὸ ῥῆμα μετὰ τῶν ὑποτακτικῶν ἄρθρων.	καί   ὅτι2 ὁ ὁ δαίω2  φέρω  ὁ  εὐθύς ,  κατά ὁ    ὁ ὁ   κοινός παραλαμβάνω ὁ ῥῆμα μετά ὁ  ἄρθρον .
798804	tlg0082.tlg004.1st1K-grc1	Αἰθίοπεϲ, τοὶ διχθὰ δεδαίαται, ἔϲχατοι ἀνδρῶν, οἳ μὲν δυϲομένου Ὑπερίονοϲ, οἳ δ᾿ ἀνιόντοϲ.	, ὁ διχθά δαίω2 ,  ἀνήρ , ὁ μέν   , ὁ   .
798805	tlg0082.tlg004.1st1K-grc1	156.	.
798806	tlg0082.tlg004.1st1K-grc1	ὡϲ εἰ καὶ ἐπ’ ἐκείνου τοῦ ϲχήματοϲ προϲτεθείη ῥῆμα, πάλιν τὸ ἐξ αὐτοῦ ἐπιμεριζόμενον ἀνενδοίαϲτον ἔϲται, οἱ δὲ δύο ϲκόπελοι ἱκάνουϲιν ὃϲ μὲν ἄχρι τοῦ οὐρανοῦ, ὃϲ δὲ ἄχρι τοῦ Ὀλύμπου{ exμ 73}.	εἰ καί ἐπί ἐκεῖνος ὁ   ῥῆμα , πάλιν ὁ ἐκ αὐτός    , ὁ δέ γε    μέν ἄχρι ὁ οὐρανός ,  δέ ἄχρι ὁ Ὄλυμπος {  μ  } .
798807	tlg0082.tlg004.1st1K-grc1	οὐ προϋπόντοϲ γὰρ τοῦ τοιούτου ἀνάγκη πᾶϲα τῷ ὑποτακτικῷ ἄρθρῳ προϲγίνεϲθαι τὸ ῥῆμα τήν τε προϋποῦϲαν εὐθεῖαν, καθὼϲ ἐπεδείξαμεν, εἰϲ γενικὴν μετελθεῖν.	οὐ  γάρ ὁ τοιοῦτος ἀνάγκη  τῷ    ὁ ῥῆμα ὁ τε  εὐθύς ,  ἐπιδείκνυμι ,   μετέρχομαι .
798808	tlg0082.tlg004.1st1K-grc1	αὕτη γὰρ μόνη μὴ προϲλαβοῦϲα ῥῆμα ἐπιμερίζεται εἰϲ τὰ ἐξ αὐτῆϲ πρόϲωπα νοούμενα, αἵ γε μὴν ἄλλαι πτώϲειϲ οὐκέτι, εἰ μὴ προϲλάβοιεν ῥῆμα·	οὗτος γάρ μόνος   ῥῆμα   ὁ ἐκ   νοέω , ὁ γε μήν ἄλλος  οὐκέτι , εἰ μή  ῥῆμα ·
798809	tlg0082.tlg004.1st1K-grc1	Νεϲτορίδαι δ’ ὁ μὲν οὔταϲ᾿  Ἀτύμνιον{Π 317}.	ὁ μέν  Ἀτύμνιος { Π  } .
798810	tlg0082.tlg004.1st1K-grc1	προφανῶϲ γὰρ πάλιν τὸ ὁ ἀντὶ τοῦ ὅϲ ἐϲτιν, χωρὶϲ εἰ μὴ πτωτικὸν λείπει, οὗ προηγήϲεται πάντωϲ τὸ ὁ προτακτικὸν ἄρθρον, ἔχοντοϲ τοῦ λόγου τῇδε, τῶν Νεϲτοριδῳν ὁ μὲν ἕτεροϲ οὔταϲ᾿  Ἀτύμνιον, τῶν δύο ϲκοπέλων ὁ μὲν ἕτεροϲ οὐρανὸν ἵκει.	γάρ πάλιν ὁ ὁ ἀντί ὁ   ,  εἰ μή  λείπω , οὗ   ὁ ὁ  ἄρθρον ,  ὁ λόγος ὅδε , ὁ  ὁ μέν   Ἀτύμνιος , ὁ γε  ὁ μέν  οὐρανός ἵκω .
798811	tlg0082.tlg004.1st1K-grc1	157, καθὸ ἄντιϲ κἀκεῖνο ἐπιϲτήϲειε, καί μιν πειραίνουϲι δύω πόλοι ἀμφοτέρωθεν, ἀλλ᾿ ὁ μὲν οὐκ ἐπίοπτοϲ{ Arat.	,  ἄν τιϲ ἐκεῖνος  , καί   δύο πόλος ἀμφότερος ,  ὁ μέν οὐ  {  .
798812	tlg0082.tlg004.1st1K-grc1	Phaen.	.
798813	tlg0082.tlg004.1st1K-grc1	24— 25 }, πάλιν τοῦ ἐντελοῦϲ ὄντοϲ ἀλλ᾿ ὃϲ μὲν οὐκ ἐπίοπτοϲ·	—   , πάλιν ὁ     μέν   ·
798814	tlg0082.tlg004.1st1K-grc1	ἀπὸ γὰρ κοινοῦ τοῦ πειραίνουϲι δυνάμει ἔχει ἐγκείμενον ῥῆμα τὸ πειραίνει, ἐφ’ ὃ  καὶ φέρεται.	ἀπό γάρ κοινός ὁ  δύναμις ἔχω  ῥῆμα ὁ  , ἐπί  καί φέρω .
798815	tlg0082.tlg004.1st1K-grc1	ὁ αὐτὸϲ λόγοϲ καὶ ἐπὶ τοῦ ἐπιφερομένου λόγου, ϲδ δ’ ἀντίοϲ·	ὁ   καί ἐπί ὁ  λόγος ,    ·
798816	tlg0082.tlg004.1st1K-grc1	πάλιν πειραίνει τὸν ἄξονα.	πάλιν  ὁ ἄξων .
798817	tlg0082.tlg004.1st1K-grc1	τοῦτο γὰρ ϲυμφράζεται·	οὗτος γάρ  ·
798818	tlg0082.tlg004.1st1K-grc1	ὃϲ δ’ ἐπίοπτοϲ ὤν·	εἰμί ·
798819	tlg0082.tlg004.1st1K-grc1	ἐκ γὰρ τοῦ βορεινοῦ ὕψουϲ ἀντίοϲ ἐϲτὶ τῷ τοῦ Ὠκεανοῦ.	ἐκ γάρ ὁ     ὁ ὁ Ὠκεανός .
798820	tlg0082.tlg004.1st1K-grc1	ΠΕΡΙ ΣΥΝΤΑΞΕΩΣ ΒΙΒΛΙΟΝ Β Τῇ προεκδοθείϲῃ ϲυντάξει τῶν ἄρθρων ἀκόλουθον ὑπολαμβάνω καὶ περὶ τῆϲ τῶν ἀντωνυμιῶν ϲυντάξεωϲ διαλαβεῖν·	ὁ   ὑπολαμβάνω καί περί  ὁ   διαλαμβάνω ·
798821	tlg0082.tlg004.1st1K-grc1	ἐκεῖνα μὲν γὰρ μετ’ ὀνομάτων ἐν τοῖϲ λόγοιϲ παρελαμβάνετο, αὗται δὲ ἀντ’ ὀνομάτων, οὐ παραδεχόμεναι τὴν τούτων προτακτικὴν ϲύνταξιν καθ’ ἃϲ προεκτεθείμεθα αἰτίαϲ.	ἐκεῖνος μέν γάρ μετά ὄνομα ἐν   παραλαμβάνω , οὗτος δέ  ὄνομα , οὐ  ὁ οὗτος   κατά    .
798822	tlg0082.tlg004.1st1K-grc1	Καὶ ϲαφέϲ ἐϲτιν ὅτι ἕνεκα τοῦ τοιούτου καὶ πτώϲεων ἐγένοντο δεκτικαί, ἵνα κατὰ παντὸϲ τοῦ ὀνόματοϲ ἀνθυπέλθωϲιν, καὶ προϲώπων ἁπάντων διακριτικαί, ἵνα τὸ ἐλλειπὲϲ τοῦ ὀνόματοϲ.	καί   ὅτι2 ἕνεκα ὁ τοιοῦτος καί  γίγνομαι  , ἵνα κατά  ὁ   , καί  ἅπας  , ἵνα ὁ  ὁ  .
798823	tlg0082.tlg004.1st1K-grc1	λέγω τὴν τῶν προϲώπων διάκριϲιν, αὗται ἀνθυπενεχθεῖϲαι ἀναπληρώϲωϲιν, καὶ τοῦ μὲν ὀνόματοϲ ἔχωϲι τὴν πτῶϲιν, τοῦ δὲ ῥήματοϲ τὸ πρόϲωπον.	λέγω ὁ ὁ   , οὗτος   , καί ὁ μέν   ὁ  , ὁ δέ  ὁ  .
798824	tlg0082.tlg004.1st1K-grc1	Ἕνθεν δι’ ὅλου κλίνονται, δύο τὰϲγενικωτάταϲ κλίϲειϲ ἀποϲπάϲαϲαι, καὶ οὐ κατὰ ϲύγχυϲιν, ἀλλὰ κατὰ μεριϲμὸν τὸν δέοντα·	διά   , γε  γενικωτάταϲ   , καί οὐ κατά  , ἀλλά κατά  ὁ δέω ·
798825	tlg0082.tlg004.1st1K-grc1	τῷ μὲν γὰρ τέλει ἐνῆκε τὴν πτωτικὴν κλίϲιν, τῷ δὲ ἄρχοντι τὸν τῶν προϲώπων ἐπιμεριϲμόν·	τῷ μέν γάρ τέλος ἐνίημι ὁ   , τῷ δέ ἄρχω ὁ ὁ   ·
798826	tlg0082.tlg004.1st1K-grc1	ϲαφὲϲ γὰρ ὅτι, εἰ κατὰ τὸ αὐτὸ μέροϲ αἱ δύο κλίϲειϲ ἐνεγένοντο, ϲυνέβη ἂν τῆϲ μὲν πτώϲεωϲ τὸ ἑτεροιούμενον ἀποτρίβεϲθαι τὸ τοῦ προϲώπου διακριτικόν, καὶ ἔμπαλιν τοῦ προϲώπου μεταβαίνοντοϲ παραφθείρεϲθαι τὸ τῆϲ πτώϲεωϲ ἰδίωμα.	γάρ ὅτι2 , εἰ κατά ὁ αὐτός  ὁ γε   ,  ἄν  μέν  ὁ   ὁ ὁ   , καί ἔμπαλιν ὁ    ὁ   ἰδίωμα .
798827	tlg0082.tlg004.1st1K-grc1	δι’ ὃ πτῶϲιν μὲν διακρίνουϲα ἀποτελεῖ τὸ ἐμοῦ καὶ ἐμοί καὶ ἐμέ, πρόϲωπον δὲ τὸ ἐμοῦ- ϲοῦ, πρόϲωπον δὲ καὶ πτῶϲιν τὸ ἐμοῦ- ϲοί·	διά ὁ  μέν  ἀποτελέω ὁ ἐμός καί  καί ἐγώ ,  δέ ὁ ἐμός -  ,  δέ καί  ὁ ἐμός -  ·
798828	tlg0082.tlg004.1st1K-grc1	καὶ ἐν ἅπαϲιν ὥριϲται τοῖϲ προκατειλεγμένοιϲ διὰ τὸ ἐν ἑκατέρῳ μέρει ἐγχωρῆϲαν ἰδίωμα.	καί ἐν     διά ὁ ἐν ἑκάτερος μέρος  ἰδίωμα .
798829	tlg0082.tlg004.1st1K-grc1	( ἑκάτεραι.	( ἑκάτερος .
798830	tlg0082.tlg004.1st1K-grc1	γοῦν αἱ κλίϲειϲ ἀποϲτᾶϲαι ἐπὶ τὰ ἴδια μόρια, λέγω τὸ ὄνομα καὶ τὸ ῥῆμα, τῷ τέλει ϲυνεχρῶντο κατὰ τὴν κλίϲιν, καλόϲ καλοῦ, γράφω γράφειϲ γράφει, οὐκ ἀπιθάνωϲ καὶ τῆϲ ἀντωνυμίαϲ χρηϲαμένηϲ τῇ ὑποϲτολῇ τοῦϲ, οὔϲῃ διακριτικῇ τρίτου προϲώπου, ϲοί- οἷ, ὡϲ εἰ καὶ λέγειϲ λέγει).	γοῦν ὁ   ἐπί ὁ ἴδιος μόριον , λέγω ὁ ὄνομα καί ὁ ῥῆμα , τῷ τέλος  κατά ὁ  ,  καλός ,   γράφω , οὐ  καί    ὁ  ὁ ϲ ,   τρίτος  ,  - οἷ2 ,  εἰ καί  λέγω ) .
798831	tlg0082.tlg004.1st1K-grc1	Εὔηθεϲ μέντοι ὑπολαμβάνω, εἰ ἐξεργάϲεταί τιϲ διὰ τί μὴ μᾶλλον τὸ τέλοϲ οὐ προϲεχώρει τῷ προϲώπῳ, καθάπερ ἐπὶ τῶν ῥημάτων, ἤπερ τὸ ἄρχον.	μέντοι ὑπολαμβάνω , εἰ   διά τι μή μᾶλλον ὁ  οὐ  τῷ  , καθά ἐπί ὁ ῥῆμα ,  ὁ ἄρχω .
798832	tlg0082.tlg004.1st1K-grc1	ἔδει γὰρ ἅπαξ ἐν ἑνὶ μέρει προϲχωρῆϲαι τὸ τέλοϲ, καὶ εἰ ἔϲτιν εἰπεῖν, εὐλόγωϲ τῷ πτωτικῷ, εἴγε καὶ πρότερον τοῦ ῥήματοϲ τὸ ὄνομα, καθὼϲ ἐπεδείξαμεν, καὶ δῆλον ὅτι τὸ τούτου ἰδίωμα ἐπικρατήϲει τοῦ τέλουϲ, λέγω τὴν πτῶϲιν.	δέω γάρ ἅπαξ ἐν  μέρος  ὁ  , καί εἰ  λέγω ,  τῷ  , εἰ καί πρότερος ὁ  ὁ ὄνομα ,  ἐπιδείκνυμι , καί δῆλος ὅτι2 ὁ οὗτος ἰδίωμα  ὁ  , λέγω ὁ  .
798833	tlg0082.tlg004.1st1K-grc1	πρὸϲ οἷϲ καὶ ἀντωνυμία ἐϲτὶν τὸ ἀντ’ ὀνόματοϲ παραλαμβανόμενον καὶ ὄνομα μιμούμενον, καὶ ϲαφὲϲ ὅτι ἐπακολούθημά ἐϲτιν τὸ ἐγγινόμενον πρόϲωπον).	καί   ὁ   παραλαμβάνω καί ὄνομα  , καί  ὅτι2   ὁ   ) .
798834	tlg0082.tlg004.1st1K-grc1	καὶ εἰ τὰ τέλη ἐπικρατεῖ τῶν μερῶν τοῦ λόγου, τὸ δὲ τέλοϲ τῆϲ ἀντωνυμίαϲ πτῶϲίϲ ἐϲτιν, ἐπικρατήϲει ἄρα διὰ τοῦ τέλουϲ τὸ καλεῖϲθαι ἀντωνυμία, κἂν ῥήματοϲ ἰδίωμα παρειϲδύηται, λέγω τὸ πρόϲωπον.	καί εἰ ὁ τέλος ἐπικρατέω ὁ μέρος ὁ λόγος , ὁ δέ      ,  ἄρα διά ὁ  ὁ   , ἐάν  ἰδίωμα  , λέγω ὁ  .
798835	tlg0082.tlg004.1st1K-grc1	Εὔλογον ἡγοῦμαι πρὸ τῆϲ κατὰ μέροϲ ϲυντάξεωϲ προδιαϲαφῆϲαι τὰ ἐπακολουθοῦντα ἰδιώματα τοῖϲ μορίοιϲ ὑπὲρ τοῦ τὴν εἰρηϲομένην διδαϲκαλίαν τῆϲ ϲυντάξεωϲ εὐϲυνοπτοτέραν γενέϲθαι.	πρό  κατά    ὁ ἐπακολουθέω ἰδίωμα   ὑπέρ ὁ ὁ       .
798836	tlg0082.tlg004.1st1K-grc1	Πρόκειται μὲν οὖν ἡ ἐξαίρετοϲ κλίϲιϲ κατ’ ἀμφότερα μέρη, ϲύνεϲτιν δὲ δεῖξιϲ διττή, ἡ κατὰ ἀπόλυτον ἐκφοράν, ἔπαιϲέ με( φανερὸν γὰρ ὅτι δεῖξιϲ, ἀλλ’ οὐκ ἐπιτεταμένη οὐδὲ πρόϲ τι ἀνατεινομένη), καὶ.	μέν οὖν ὁ   κατά ἀμφότερος μέρος ,  δέ  δισσός , ὁ κατά ἀπόλυτος ἐκφορά ,   ( φανερός γάρ ὅτι2  , ἀλλά οὐ  οὐδέ  τι  ) , καί .
798837	tlg0082.tlg004.1st1K-grc1	ἀντιδιαϲταλτική, ἐμὲ αὐτὸν ἔπαιϲε·	,  αὐτός  ·
798838	tlg0082.tlg004.1st1K-grc1	πρόδηλον γὰρ ὅτι ἐπιτέταται τὰ τῆϲ δείξεωϲ, καθάπερ τὰ ἐν τῇ ποιότητι ἐπινοεῖται.	πρόδηλος γάρ ὅτι2  ὁ   , καθά ὁ ἐν ὁ ποιότης ἐπινοέω .
798839	tlg0082.tlg004.1st1K-grc1	λευκόϲ ἀπολελυμένην ἔχει τὴν ποιότητα, ἐπιτεταμένην δὲ ἐν τῷ λευκότεροϲ πρὸϲ ἕτερον πρόϲωπον ὃ πάντωϲ ἐπιζητοῦμεν.	ἀπολύω ἔχω ὁ ποιότης ,  δέ ἐν τῷ   ἕτερος  ὁ  ἐπιζητέω .
798840	tlg0082.tlg004.1st1K-grc1	ᾦ λόγῳ καὶ τὸ ἐμέ ἐπιτεῖναν τὴν δεῖξιν ἀπῄτηϲε πρὸϲ ὃ ἐπετάθη.	λόγος καί ὁ   ὁ    ὁ ἐπιτείνω .
798841	tlg0082.tlg004.1st1K-grc1	δ’ ὅ τι μέντοι ἐν ἁπάϲαιϲ τὸ τοιοῦτον οὐκ ἐγχωρεῖ, ἐν τοῖϲ κατὰ μέροϲ εἰρήϲεται.	ὅς   ἐν  ὁ  οὐ  , ἐν  κατά   .
798842	tlg0082.tlg004.1st1K-grc1	Καλοῦνται αἱ ἐντελεῖϲ κατὰ τὴν φωνὴν καὶ τὸν διεγηγερμένον τόνον ὀρθοτονούμεναι, τάχα ϲυνωνυμοῦντοϲ τοῦ ὀρθοῦ καὶ τοῦ ὑγιοῦϲ·	ὁ  κατά ὁ φωνή καί ὁ  τόνος  , τάχα  ὁ  καί ὁ  ·
798843	tlg0082.tlg004.1st1K-grc1	αἱ δὲ τὸν τόνον μετατιθεῖϲαι ὡϲπερεὶ βάροϲ ἀπὸ τῶν ἐγκλινόντων τὰ βάρη ἐφ’ ἕτερον ϲῶμα ἐγκλιτικαί·	ὁ δέ ὁ     ἀπό ὁ  ὁ βάρος ἐπί ἕτερος   ·
798844	tlg0082.tlg004.1st1K-grc1	εἴγε τὸ ϲοὶ μὲν ἐγώ, ϲὺ δ’ ἐμοί{Δ 63} μετὰ τῆϲ ἐντελοῦϲ γραφῆϲ καὶ τὸν ἴδιον τόνον ἔχει, τὸ δὲ καί μοι ταῦτ’ ἀγόρευϲον{ ν 232} παρῆκεν μὲν τὴν γραφήν, μετέθηκεν δὲ καὶ τὸν τόνον.	ὁ  μέν  ,    { Δ  } μετά    καί ὁ ἴδιος τόνος ἔχω , ὁ δέ καί    {   } παρίημι μέν ὁ γραφή , μετατίθημι δέ καί ὁ  .
798845	tlg0082.tlg004.1st1K-grc1	Παρέπεται καὶ ἀναφορὰ κατὰ τὸ τρίτον πρόϲωπον, δι’ ἧϲ τὰ προκατειλεγμένα ὀνόματα ἀναπολούμενα ἀντονομάζεται, Ζεὺϲδ’ ἐπεὶ οὖν Τρῶάϲ τε καὶ Ἕκτορα νηυϲὶ πέλαϲϲεν, αὐτὸϲ δὲ πάλιν τρέπεν ὄϲϲε φαεινώ{Ν 1.	καί  κατά ὁ τρίτος  , διά  ὁ  ὄνομα   ,  δ’  οὖν  τε καί Ἕκτωρ   ,  δέ πάλιν τρέπω  φαεινός { Ν  .
798846	tlg0082.tlg004.1st1K-grc1	3} Ἐπεδείξαμεν ἐν τοῖϲ προεκδοθεῖϲιν ὡϲ αἱ τοιαῦται τῶν ἀντωνυμιῶν οὐχ ὡϲ ἔτυχον ἀνθ’ ἁπλῶν ὀνομάτων παρειλημμέναι εἰϲίν, ἀλλὰ δυνάμει ἀντὶ τῶν μετὰ ἄρθρων παραλαμβανομένων.	}  ἐν    ὁ τοιοῦτος ὁ    τυγχάνω  ἁπλόος ὄνομα   , ἀλλά δύναμις ἀντί ὁ μετά ἄρθρον παραλαμβάνω .
798847	tlg0082.tlg004.1st1K-grc1	οὐ γὰρ μόνον ἀντωνόμαϲται, καθάπερ καὶ ἐπὶ τῶν ἄλλων ἔϲτιν ἀντωνυμιῶν ἐπινοῆϲαι, ἀλλὰ καὶ ἀναφέρεται, ὅπερ οὐκ ὀνομάτων ἴδιον, εἰ μὴ προϲλάβοιεν τὰ ἄρθρα.	οὐ γάρ μόνος  , καθά καί ἐπί ὁ ἄλλος    , ἀλλά καί ἀναφέρω , ὅς οὐ ὄνομα ἴδιος , εἰ μή  ὁ ἄρθρον .
798848	tlg0082.tlg004.1st1K-grc1	ἐϲτιν καὶ οὕτωϲ φάναι·	καί  φημί ·
798849	tlg0082.tlg004.1st1K-grc1	δι’ οὖ ἀντονομάζεται προκατειλεγμένου, διὰ τούτου ἐπιδέξεται τὴν ἀναφοράν, εἴγε ἰδίωμα ἀναφορᾶϲ προκατειλεγμένου προϲώπου δευτέρα γνῶϲιϲ, ἣν ἐπαγγέλλεται ἡ αὐτόϲ ἀντωνυμία.	διά οὐ   , διά οὗτος  ὁ ἀναφορά , εἰ ἰδίωμα    δεύτερος  , ὅς ἐπαγγέλλω ὁ   .
