id	filename	tokens	lemmas
1221713	tlg0615.tlg001.opp-grc1	Ὅταν δὲ λέγῃ τὸν μὲν ἀκρατῆ μὴ ἐμμένειν τῷ λόγῳ διὰ τὸ μᾶλλον, τὸν δὲ διά τὸ ἧττον, τοῦτο δηλοῖ, ὅτι ὁ μὲν ἀκρατὴς οὐκ ἐμμένει διὰ τὸ μᾶλλον ἢ δεῖ εἴκειν ταῖς ἡδοναῖς, ὁ δὲ διὰ τὸ ἧττον ἢ δεῖ·	δέ λέγω ὁ μέν ἀκρατής μή ἐμμένω τῷ λόγος διά ὁ μᾶλλον , ὁ δέ διά ὁ ἥσσων , οὗτος δηλόω , ὅτι2 ὁ μέν ἀκρατής οὐ ἐμμένω διά ὁ μᾶλλον ἤ δέω εἴκω ὁ ἡδονή , ὁ δέ διά ὁ ἥσσων τίη δέω ·
1221714	tlg0615.tlg001.opp-grc1	τοῦτο δέ ἐστι διὰ τὸ μὴ δέχεσθαι μηδὲ ἃς δεῖ ἡδονάς.	οὗτος δέ εἰμί διά ὁ μή δέχομαι μηδέ ὅς δέω ἡδονή .
1221715	tlg0615.tlg001.opp-grc1	διὰ τί δὲ λέγομεν πολλάκις τὸν σώφρονα ἐγκρατῆ καὶ τὸν ἀκόλαστον ἀκρατῆ, διδάσκει·	διά τίς δέ λέγω πολλάκις ὁ  ἐγκρατής καί ὁ ἀκόλαστος ἀκρατής , διδάσκω ·
1221716	tlg0615.tlg001.opp-grc1	πολλὰ γάρ, φησί, καθ’ ὁμοιότητα λέγεται·	πολύς γάρ , φημί , κατά ὁμοιότης λέγω ·
1221717	tlg0615.tlg001.opp-grc1	ὅμοιος δὲ δοκεῖ ὁ ἐγκρατὴς τῷ σώφρονι ἑκάτερος γὰρ αὐτῶν οἷος μηδὲν παρὰ τὸν λόγον διὰ τὰς σωματικὰς ἡδονὰς ποιεῖν), πλὴν διαφέρουσιν, ὡς πολλάκις εἴρηται, τῷ τὸν μὲν σώφρονα μὴ ἔχειν φαύλας ἡδονάς, τὸν δὲ ἐγκρατῆ ἔχειν·	ὅμοιος δέ δοκέω ὁ ἐγκρατής τῷ  ἑκάτερος γάρ αὐτός οἷος  παρά ὁ λόγος διά ὁ σωματικός ἡδονή ποιέω ) , πλήν διαφέρω , ὡς πολλάκις λέγω , τῷ ὁ μέν  μή ἔχω  ἡδονή , ὁ δέ ἐγκρατής ἔχω ·
1221718	tlg0615.tlg001.opp-grc1	καὶ ὁ μὲν σώφρων οἷος μήτε ἥδεσθαι μήτε χαίρειν ἄλλαις ἢ αἷς ὁ λόγος κελεύει ἡδοναῖς, ὁ δ’ ἐγκρατὴς τῷ μὲν νοσεῖν αὐτῷ τὸ ἐπιθυμητικὸν οἷος ἥδεσθαι ταῖς φαύλαις ἡδοναῖς, οὐ μέντοι ἄγεται ὑπ’ αὐτῶν, νικῶντος τοῦ ἐν αὐτῷ λόγου.	καί ὁ μέν σώφρων οἷος  ἥδομαι μήτε χαίρω  τίη ὅς ὁ λόγος κελεύω ἡδονή , ὁ  ἐγκρατής τῷ μέν νοσέω αὐτός ὁ ἐπιθυμητικός οἷος ἥδομαι ὁ φαῦλος ἡδονή , οὐ μέντοι ἄγω ὑπό αὐτός , νικάω ὁ ἐν αὐτός λόγος .
1221719	tlg0615.tlg001.opp-grc1	δῆλον δὲ καὶ ὄπ ὁ ἀκόλαστος ἀκρατὴς καθ’ ὁμοιότητα λέγεται·	δῆλος δέ καί  ὁ ἀκόλαστος ἀκρατής κατά ὁμοιότης λέγω ·
1221720	tlg0615.tlg001.opp-grc1	ἀμφότεροι γὰρ τὰς σωματικὰς ἡδονὰς διώκουσι, διαφέρει δὲ ὅτι ὁ μὲν ἀκόλαστος καὶ πέπεισται διωκτέον ἀυτὰς εἶναι, ὁ δὲ οὐ πέπεισται·	ἀμφότερος γάρ ὁ σωματικός ἡδονή διώκω , διαφέρω δέ ὅτι2 ὁ μέν ἀκόλαστος καί πείθω διώκω  εἰμί , ὁ δέ οὐ πείθω ·
1221721	tlg0615.tlg001.opp-grc1	λέγει δὲ ὅτι οὐχ οἷόντε ἅμα φρόνιμον εἶναι καὶ ἀκρατῆ.	λέγω δέ ὅτι2 οὐ οἷόντε ἅμα φρόνιμος εἰμί καί ἀκρατής .
1221722	tlg0615.tlg001.opp-grc1	δέδεικται γὰρ ἐν τοῖς ἔμπροσθεν λόγοις ὁ τῷ ὄντι φρόνιμος ὅτι σπουδαῖος τὸ ἦθος καὶ πάσας ἔχων τὰς ἠθικὰς ἀρετάς, ὥστε καὶ τὴν σωφροσύνην·	δείκνυμι γάρ ἐν ὁ ἔμπροσθεν λόγος ὁ τῷ εἰμί φρόνιμος ὅτι2 σπουδαῖος ὁ ἦθος καί πᾶς ἔχω ὁ ἠθικός ἀρετή , ὥστε καί ὁ σωφροσύνη ·
1221723	tlg0615.tlg001.opp-grc1	ἀδύνατον δὲ τὸν αὐτὸν σώφρονα καὶ ἀκρατῆ εἶναι·	ἀδύνατος δέ ὁ αὐτός  καί ἀκρατής εἰμί ·
1221724	tlg0615.tlg001.opp-grc1	ἔτι φρόνιμον κυρίως καὶ κατ’ ἀλήθειαν οὐ τὸν εἰδότα μόνον τὰ δίκαια, ἀλλὰ καὶ τὸν πρακτικὸν ὧν δεῖ, καθάπερ δίκαιον οὐ τὸν εἰδότα μόνον.	ἔτι φρόνιμος κύριος καί κατά ἀλήθεια οὐ ὁ οἶδα μόνος ὁ δίκαιος , ἀλλά καί ὁ πρακτικός ὅς δέω , καθά δίκαιος οὐ ὁ οἶδα μόνος .
1221725	tlg0615.tlg001.opp-grc1	ὁ δ’ ἀκρατὴς οὐ πρακτικὸς τῶν δικαίων, ὥστε οὐ φρόνιμος.	ὁ  ἀκρατής οὐ πρακτικός ὁ δίκαιος , ὥστε οὐ φρόνιμος .
1221726	tlg0615.tlg001.opp-grc1	τὸν δὲ δεινὸν ἐνδέχεται ἀκρατῆ εἶναι·	ὁ δέ δεινός ἐνδέχομαι ἀκρατής εἰμί ·
1221727	tlg0615.tlg001.opp-grc1	διὸ καὶ δοκεῖ φρόνιμος ἀκρατὴς εἶναι.	διό καί δοκέω φρόνιμος ἀκρατής εἰμί .
1221728	tlg0615.tlg001.opp-grc1	τὸν γὰρ δεινὸν ἔνιοι φρόνιμον ὑπολαμβάνουσιν, ἔχουσι γάρ τινα ὁμοιότητα κατὰ τὸν λόγον·	ὁ γάρ δεινός ἔνιοι  ὑπολαμβάνω , ἔχω γάρ  ὁμοιότης κατά ὁ λόγος ·
1221729	tlg0615.tlg001.opp-grc1	ἀμφότεροι γὰρ συνορατικοὶ τῶν εἰς τὸ προτεθὲν τέλος φερόντων·	ἀμφότερος γάρ  ὁ εἰς ὁ προτίθημι τέλος φέρω ·
1221730	tlg0615.tlg001.opp-grc1	ἣν δὲ ἔχουσι διαφορὰν πρότερον εἴρηκεν·	ὅς δέ ἔχω διαφορά πρότερος λέγω ·
1221731	tlg0615.tlg001.opp-grc1	ἔτι δὲ οὐχ ὡς ὁ εἰδὼς τὰ πρακτὰ θεωρήματα παραβήσεται καὶ ἀκρατεύσεται, ἀλλὰ πάσχων παραπλήσιόν τι πάθος τῷ οἰνωμένῳ·	ἔτι δέ οὐ ὡς ὁ οἶδα ὁ πρακτός θεώρημα  καί  , ἀλλά πάσχω παραπλήσιος τις πάθος τῷ  ·
1221732	tlg0615.tlg001.opp-grc1	ἐξίσταται γάρ πὼς καὶ σκοτοδινιᾶ ὑπὸ τοῦ πάθους ὁ ἀκρατὴς, μὴ ἀκριβῶς καθορῶν τὸν ἐν αὑτῷ λόγον καὶ ἑκὼν μὲν ποιεῖ ὁ ἀκρατὴς τρόπον τινὰ εἰδὼς ὅτι οὐ πρακτέον ποιεῖ·	ἐξίστημι γάρ  καί  ὑπό ὁ πάθος ὁ ἀκρατής , μή ἀκριβής καθοράω ὁ ἐν ἑαυτοῦ λόγος καί ἑκών μέν ποιέω ὁ ἀκρατής τρόπος  οἶδα ὅτι2 οὐ πράσσω ποιέω ·
1221733	tlg0615.tlg001.opp-grc1	ἔχει γὰρ τὸν λόγον τὸν ἀπαγορεύοντα, ταραττόμενον δὲ ὑπὸ τοῦ πάθους.	ἔχω γάρ ὁ λόγος ὁ ἀπαγορεύω , ταράσσω δέ ὑπό ὁ πάθος .
1221734	tlg0615.tlg001.opp-grc1	οὐκ ἔστι δὲ πονηρὸς παντελῶς ἀλλ’ ἡμιμόχθηρος·	οὐ εἰμί δέ πονηρός παντελής ἀλλά ἡμιμόχθηρος ·
1221735	tlg0615.tlg001.opp-grc1	κακὸς μὲν γὰρ παντελῶς, ᾧ ὅλη διέφθαρται ἡ ψυχή·	κακός μέν γάρ παντελής , ὅς ὅλος  ὁ ψυχή ·
1221736	tlg0615.tlg001.opp-grc1	καὶ τὸ ἄλογον φαῦλόν ἐστιν·	καί ὁ ἄλογος  εἰμί ·
1221737	tlg0615.tlg001.opp-grc1	τοὐ δὲ ἀκρατοῦς ἡ προαίρεσις ἐπιεικής·	οὐ δέ  ὁ προαίρεσις ἐπιεικής ·
1221738	tlg0615.tlg001.opp-grc1	προαίρεσιν δὲ πάλιν ἢ τὸν λόγον εἴρηκεν ἢ σὺν αὐτῷ καὶ τὴν βούλευσιν.	δέ πάλιν τίη ὁ λόγος λέγω ἤ σύν αὐτός καί ὁ βούλευσις .
1221739	tlg0615.tlg001.opp-grc1	οὔ φησι δὲ τὸν ἀκρατῆ ἄδικον εἶναι διὰ τὸ μὴ εἶναι ἐπίβουλον.	οὐ φημί δέ ὁ ἀκρατής  εἰμί διά ὁ μή εἰμί ἐπίβουλος .
1221740	tlg0615.tlg001.opp-grc1	ὁ μὲν γὰρ ἐπίβουλος, βουλευσάμενος δηλονότι κακά, ἐνεδρεύει καὶ κακουργεῖ·	ὁ μέν γάρ ἐπίβουλος ,   κακός ,  καί κακουργέω ·
1221741	tlg0615.tlg001.opp-grc1	τῶν δὲ ἀκρατῶν ὁ μὲν βουλευόμενος καὶ μὴ ἐμμένων<***> χρῆσθαι βούλεται, ὥστε οὐδέτερος ἐπίβουλος.	ὁ δέ  ὁ μέν  καί μή  < * * * > χράω2 βούλομαι , ὥστε οὐδέτερος  .
1221742	tlg0615.tlg001.opp-grc1	Δῆλα δὲ ἃ καὶ μεῖά ταῦτα προσέθηκεν, ὅτι ἡ ἀκρασία καὶ ἡ έγκρατεια περὶ ὑπερβολήν ἐστι τῆς τῶν πολλῶν ἕξεως·	δέ ὅς καί  οὗτος προστίθημι , ὅτι2 ὁ ἀκρασία καί ὁ  περί ὑπερβολή εἰμί ὁ ὁ πολύς ἕξις ·
1221743	tlg0615.tlg001.opp-grc1	ὁ μὲν γὰρ ἐγκρατὴς ὑπερβάλλει αὐτοὺς ἐν τῷ ἐμμένειν μᾶλλον τῷ λόγῳ καὶ μὴ χρῆσθαι αἷς ἐκεῖνοι χρῶνται ἡδοναῖς, ὁ δὲ ἀκρατὴς ὑπερβάλλει τῷ χείρων αὐτῶν εἶναι καὶμ·	ὁ μέν γάρ ἐγκρατής ὑπερβάλλω αὐτός ἐν ὁ ἐμμένω μᾶλλον τῷ λόγος καί μή χράω2 ὅς ἐκεῖνος χράω2 ἡδονή , ὁ δέ ἀκρατής ὑπερβάλλω τῷ  αὐτός εἰμί καί μ ·
1221744	tlg0615.tlg001.opp-grc1	ηδὲ ὧν ἀπέχονται, δυνατὸς εἶναι τούτων ἀφίστασθαι καὶ ταῦτα κελεύοντος τοῦ ἐν αὐτῷ λόγου.	ὅς ἀπέχω , δυνατός εἰμί οὗτος ἀφίστημι καί οὗτος κελεύω ὁ ἐν αὐτός λόγος .
1221745	tlg0615.tlg001.opp-grc1	εὐιατοτέραν δὲ λέγει τὴν τῶν μελαγχολικῶν καὶ ὅλως τὴν προπετεστέραν λεγομένην ἀκρασίαν τῆς τῶν βουλευομένων μέν, μὴ ἐμμενοντων δέ δῆλον γὰρ ὡς ἂν ἐθισθῶσι βουλεύεσθαι οἱ προπετεῖς, ταχὺ μεταβάλλονται)·	δέ λέγω ὁ ὁ μελαγχολικός καί ὅλος ὁ  λέγω ἀκρασία2 ὁ ὁ βουλεύω μέν , μή  δέ δῆλος γάρ ὡς ἄν  βουλεύω ὁ  , ταχύς μεταβάλλω ) ·
1221746	tlg0615.tlg001.opp-grc1	ἔτι τοὺς δι’ ἔθους ἀκρατεῖς εὐιατοτέρους τῶν διὰ φύσεως·	ἔτι ὁ διά ἔθος ἀκρατής  ὁ διά φύσις ·
1221747	tlg0615.tlg001.opp-grc1	δυσμετακινητον γὰρ ἡ φύσις·	γάρ ὁ φύσις ·
1221748	tlg0615.tlg001.opp-grc1	καὶ τὸ ἔθος γὰρ διὰ τοῦτο δυσμετάθετον, ὅτι φύσει τι ὅμοιον ποιεῖ.	καί ὁ ἔθος γάρ διά οὗτος  , ὅτι2 φύσις τι ὅμοιος ποιέω .
1221749	tlg0615.tlg001.opp-grc1	Περὶ δὲ ἡδονῆς καὶ λύπης οἰκείαν φησὶν εἶναι τὴν θεωρίαν τῷ πολιτικῷ φιλοσόφῳ.	δέ ἡδονή καί λύπη οἰκεῖος φημί εἰμί ὁ θεωρία ὁ πολιτικός φιλόσοφος .
1221750	tlg0615.tlg001.opp-grc1	ἔστι γὰρ τοὐ τέλους ἀρχιτέκτων.	εἰμί γάρ  τέλος  .
1221751	tlg0615.tlg001.opp-grc1	διὰ τί δὲ λέγει αὐτὸν ἀρχιτέκτονα τοῦ τέλους;	διά τίς δέ λέγω αὐτός ἀρχιτέκτων ὁ τέλος ;
1221752	tlg0615.tlg001.opp-grc1	ἡ ὅτι πᾶς λέγεται ἀρχιτέκτων ἐκείνου, οὗ υφηγητής ἐστι τῆς κατασκευῆς;	ὅτι2 πᾶς λέγω  ἐκεῖνος , οὗ  εἰμί ὁ κατασκευή ;
1221753	tlg0615.tlg001.opp-grc1	ὁ δὲ πολιτικὸς ὑφηγεῖται, ὅπως ἂν γένοιτο εὐδαιμονία.	ὁ δέ πολιτικός ὑφηγέομαι , ὅπως ἄν γίγνομαι εὐδαιμονία .
1221754	tlg0615.tlg001.opp-grc1	ἔτι φρόνησις ἀρχιτεκτονικὴ λέγεται, διότι τὸν λόγον παρέχει ταῖς ἠθικαῖς ἀρεταῖς.	ἔτι φρόνησις ἀρχιτεκτονικός λέγω , διότι ὁ λόγος παρέχω ὁ  ἀρετή .
1221755	tlg0615.tlg001.opp-grc1	ἔστι δὲ ἡ πολιτικὴ φρόνησις περὶ πόλιν καὶ πόλεως εὐδαιμονίαν.	εἰμί δέ ὁ πολιτικός φρόνησις περί πόλις καί πόλις εὐδαιμονία .
1221756	tlg0615.tlg001.opp-grc1	εἰκότως οὖν καὶ αὐτὴ ἀρχιτεκτονικὴ λέγεται τοῦ τέλους καὶ ὁ ἔχων αὐτὴν ὁ πολιτικός.	εἰκός οὖν καί αὐτός ἀρχιτεκτονικός λέγω ὁ τέλος καί ὁ ἔχω αὐτός ὁ πολιτικός .
1221757	tlg0615.tlg001.opp-grc1	ἐπεὶ οὖν πρὸς̣ τὸ τέλος βλέποντες τὸ μὲν ἀγαθὸν ἁπλῶς λέγομεν τὸ δὲ κακόν, ἀγαθὸν μὲν τὸ φέρον εἰς τὸ τέλος καὶ τὴν εὐδαιμονίαν, κακὸν δὲ τὸ ἐμποδιστικὸν ταύτης, δῆλον ὡς τοῦ ἀρχιτεκτονοῦντος τέλος καὶ ἡ περὶ ἡδονῆς ἢ λύπης θεωρία, εἴτε φέρει εἰς τὴν εὐδαιμονίαν εἴτε ἔμπαλιν ἐμποδίζει.	ἐπεί οὖν  ὁ τέλος βλέπω ὁ μέν ἀγαθός ἁπλόος λέγω ὁ δέ κακός , ἀγαθός μέν ὁ φέρω εἰς ὁ τέλος καί ὁ εὐδαιμονία , κακός δέ ὁ  οὗτος , δῆλος ὡς ὁ ἀρχιτεκτονέω τέλος καί ὁ περί ἡδονή ἤ λύπη θεωρία , εἴτε φέρω εἰς ὁ εὐδαιμονία εἴτε ἔμπαλιν ἐμποδίζω .
1221758	tlg0615.tlg001.opp-grc1	ἔτι δέ, ἐπεί ἐστιν ἡ ἠθικὴ ἀρετὴ περὶ ἡδονὰς καὶ λύπας, ὡς δέδεικται, ἡ δὲ πολιτικὴ περὶ ἐπιμέλειαν τῆς ἠθικῆς ἀρετῆς ἐστιν, ἀναγκαῖον τῷ πολιτικῷ ἐπισκοπεῖν περὶ αὐτῶν.	ἔτι δέ , ἐπεί εἰμί ὁ ἠθικός ἀρετή περί ἡδονή καί  , ὡς δείκνυμι , ὁ δέ πολιτικός περί ἐπιμέλεια ὁ ἠθικός ἀρετή εἰμί , ἀναγκαῖος τῷ πολιτικός ἐπισκοπέω περί αὐτός .
1221759	tlg0615.tlg001.opp-grc1	ἔτι τὴν εὔδαιμον ίαν οἱ πλεῖστοι μεθ’ ἡδονῆς εἶναί φασι καὶ τὸν εὐδαίμονα μακάριον ὠνομάσθαι, οἷον ὡς ἂν εἴποις μάλα χαίροντα.	ἔτι ὁ  κερατέα ὁ πλεῖστος μετά ἡδονή εἰμί φημί καί ὁ  μακάριος ὀνομάζω , οἷος ὡς ἄν λέγω μάλα χαίρω .
1221760	tlg0615.tlg001.opp-grc1	καὶ διὰ τοῦτο οὖν οἰκεία τῷ πολιτικῷ ἡ περὶ ἡδονῆς καὶ λύπης θεωρία.	καί διά οὗτος οὖν οἰκεῖος τῷ  ὁ περί ἡδονή καί λύπη θεωρία .
1221761	tlg0615.tlg001.opp-grc1	ἐνίοις μὲν οὖν δοκεῖ μηδεμία ἡδονὴ εἶναι ἀγαθόν, ἧς δόξης φασὶ καὶ Ἀντισθένη γεγονέναι·	ἔνιοι μέν οὖν δοκέω μηδείς ἡδονή εἰμί ἀγαθός , ὅς δόξα φημί καί Ἀντισθένης γίγνομαι ·
1221762	tlg0615.tlg001.opp-grc1	λέγουσι γοῦν τὴν ἡδονὴν μήτε καθ’ αὑτὸ μήτε κατὰ συμβεβηκὸς εἶναι ἀγαθόν.	λέγω γοῦν ὁ ἡδονή μήτε κατά ἑαυτοῦ  κατά συμβαίνω εἰμί ἀγαθός .
1221763	tlg0615.tlg001.opp-grc1	ἔστι γὰρ τῶν ἀγαθῶν τὰ μὲν καθ’ αὐτά, οἷον αἱ ἀρεταὶ καὶ αἱ κατ’ αὐτὰς ἐνέργειαι, τὰ δὲ κατὰ συμβεβηκός, οἷον ἰατρεῖαι τομαὶ καύσεις καὶ οἱ πόνοι·	εἰμί γάρ ὁ ἀγαθός ὁ μέν κατά αὐτός , οἷος ὁ ἀρετή καί ὁ κατά αὐτός  , ὁ δέ κατά  , οἷος  τομή καῦσις καί ὁ πόνος ·
1221764	tlg0615.tlg001.opp-grc1	οὐδὲν γὰρ τούτων αἱρούμεθα δι’ αὑτό, ἀλλὰ δι’ ἕτερον καὶ κατὰ συμβεβηκός·	οὐδείς γάρ οὗτος αἱρέω διά  , ἀλλά διά ἕτερος καί κατά συμβαίνω ·
1221765	tlg0615.tlg001.opp-grc1	τὴν δὲ ἡδονὴν οὐδετέρως εἶναι ἀγαθὸν οὔτε ὡς καθ’ αὑτὸ οὔτε ὡς κατὰ συμβεβηκός.	ὁ δέ ἡδονή οὐδέτερος εἰμί ἀγαθός οὔτε ὡς κατά ἑαυτοῦ οὔτε ὡς κατά  .
1221766	tlg0615.tlg001.opp-grc1	οὐ γὰρ εἶναι ταὐτὸν ἀγαθὸν καὶ τὴν ἡδονήν·	οὐ γάρ εἰμί  ἀγαθός καί ὁ ἡδονή ·
1221767	tlg0615.tlg001.opp-grc1	οὕτως μὲν οὖν ἐχούσης τῆς γραφῆς, ῥᾳδία ἡ ἐξήγησις·	οὕτως μέν οὖν ἔχω ὁ γραφή , ῥᾴδιος ὁ ἐξήγησις ·
1221768	tlg0615.tlg001.opp-grc1	οὐ γάρ φασιν οὔτε καθ’ αὑτὸ οὔτε κατά συμβεβηκὸς ἀγαθὸν εἶναι τὴν ἡδονήν, ἐπεὶ μὴ ἔστι† τινὶ ταὐτὸν τινὶ ἀγαθῷ.	οὐ γάρ φημί οὔτε κατά ἑαυτοῦ οὔτε κατά συμβαίνω ἀγαθός εἰμί ὁ ἡδονή , ἐπεί μή εἰμί †  αὐτός  ἀγαθός .
1221769	tlg0615.tlg001.opp-grc1	ἐὰν δὲ ᾖ σὺν τῷ ἄρθρῳ γεγραμμένον, οὐ γὰρ εἶναι ταὐτὸν τῷ ἀγαθῷ καὶ τὴν ἡδονήν, ἀλόγως φανεῖται τοῦτ’ ἐπενηνέχθαι·	ἐάν δέ εἰμί σύν ὁ  γράφω , οὐ γάρ εἰμί  τῷ ἀγαθός καί ὁ ἡδονή , ἄλογος φαίνω   ·
1221770	tlg0615.tlg001.opp-grc1	εἴτε γὰρ τὸ ἀγαθὸν ὡς γένος λαμβάνεται τῶν ἀγαθῶν, εἶτε ὡς εὐδαιμονία πῶς τοῦτο ἐνδείκνυται, ὅτι οὔτε τῶν καθ’ αὑτό τι ἀγαθῶν ἐστιν ἡ ἡδονὴ οὔτε τῶν κατὰ συμβεβηκός;	εἴτε γάρ ὁ ἀγαθός ὡς γένος λαμβάνω ὁ ἀγαθός ,  ὡς  πῶς οὗτος ἐνδείκνυμι , ὅτι2 οὔτε ὁ κατά  τις ἀγαθός εἰμί ὁ ἡδονή οὔτε ὁ κατά  ;
1221771	tlg0615.tlg001.opp-grc1	ὥσπερ γὰρ αἰτίαν ταῦτα ἐπιφέρει, οὐκ ἔστι δὲ αἰτία τοῦ μὴ εἶναι ἀγαθὸν τὴν ἡδονὴν τῷ μήτε γένη εἶναι τῶν ἀγαθῶν μήτε ταὐτὸν τῇ εὐδαιμονίᾳ.	ὥσπερ γάρ αἰτία οὗτος ἐπιφέρω , οὐ εἰμί δέ αἰτία ὁ μή εἰμί ἀγαθός ὁ ἡδονή τῷ μήτε γένος εἰμί ὁ ἀγαθός μήτε αὐτός ὁ εὐδαιμονία .
1221772	tlg0615.tlg001.opp-grc1	καὶ γὰρ ἄλλα ἀγαθὰ μέν ἐστιν, οὐ ταὐτὰ δὲ τῷ κοινῷ ἀγαθῷ ἢ τῆ εὐδαιμονίᾳ.	καί γάρ ἄλλος ἀγαθός μέν εἰμί , οὐ αὐτός δέ τῷ κοινός ἀγαθός ἤ τῆ εὐδαιμονία .
1221773	tlg0615.tlg001.opp-grc1	ἀλλὰ μήποτε ἐπειδὴ ὁμωνύμως ἐδόκει λέγεσθαι τὸ ἀγαθόν, δοκεῖ λέγειν ὅτι οὐδενὶ τῶν δηλουμένων ὑπὸ τοὐ ἀγαθοῦ ταὐτόν ἐστιν.	ἀλλά μήποτε ἐπεί ὁμώνυμος δοκέω λέγω ὁ ἀγαθός , δοκέω λέγω ὅτι2  ὁ δηλόω ὑπό   αὐτός εἰμί .
1221774	tlg0615.tlg001.opp-grc1	ἢ οὕτως εἴρηκεν, ἐπειδὴ προελθὼν μέλλει δείξειν τὴν ἡδονὴν μὴ οὖσαν ἀγαθὸν ἐκ τοῦ μὴ εἶναι τῆ εὐδαιμονίᾳ ταὐτὸν τῷ γένει·	τίη οὕτως λέγω , ἐπεί προέρχομαι μέλλω δείκνυμι ὁ ἡδονή μή εἰμί ἀγαθός ἐκ ὁ μή εἰμί τῆ εὐδαιμονία αὐτός ὁ γένος ·
1221775	tlg0615.tlg001.opp-grc1	δῆλος δὲ ἔσται ὁ λόγος οὗτος ὀλίγον ὕστερον.	δῆλος δέ εἰμί ὁ λόγος οὗτος ὀλίγος ὕστερον .
1221776	tlg0615.tlg001.opp-grc1	ἀλλ’ οὖν τοῖς μὲν δοκεῖ μηδεμία ἡδονὴ εἶναι ἀγαθόν, τοῖς δὲ μία μὲν ἀγαθή, αἱ δὲ πολλαὶ φαῦλαι, τοῖς δὲ εἰ καὶ πᾶσαι ἀγαθὸν ὅμως μὴ εἶναι τὴν ἡδονὴν τὸ ἄριστον, τουτέστιν μὴ εἶναι εὐδαιμονίαν, οἷς ἐναντιοῦνται οἱ λέγοντες τὴν εὐδαιμονίαν ἡδονὴν εἶναι.	ἀλλά οὖν ὁ μέν δοκέω μηδείς ἡδονή εἰμί ἀγαθός , ὁ δέ  μέν ἀγαθός , ὁ δέ πολύς  , ὁ δέ εἰ καί πᾶς ἀγαθός ὅμως μή εἰμί ὁ ἡδονή ὁ ἄριστον ,  μή εἰμί εὐδαιμονία , ὅς ἐναντιόομαι ὁ λέγω ὁ εὐδαιμονία  εἰμί .
1221777	tlg0615.tlg001.opp-grc1	ὅλως μὲν οὖν οὐκ ἀγαθόν, τοῦτό ἐστι καθόλου μὲν οὖν οὐδεμία ἡδονὴ ἀγαθόν, ὅτι πᾶσα ἡδονὴ γένεσις εἰς φύσιν αἰσθητή·	ὅλος μέν οὖν οὐ ἀγαθός , οὗτος εἰμί καθόλου μέν οὖν  ἡδονή ἀγαθός , ὅτι2 πᾶς ἡδονή γένεσις εἰς φύσις αἰσθητός ·
1221778	tlg0615.tlg001.opp-grc1	γένεσις μὲν οὖν εἰς φύσιν λέγεται, διότι ἀναπλήρωσίς τις δοκεῖ τῆς ἐνδείας εἶναι καὶ ἄγειν εἰς τὸ ἀγαθὸν κατὰ φύσιν.	γένεσις μέν οὖν εἰς φύσις λέγω , διότι  τις δοκέω ὁ ἔνδεια εἰμί καί ἄγω εἰς ὁ ἀγαθός κατά φύσις .
1221779	tlg0615.tlg001.opp-grc1	ἡ μὲν γὰρ πεῖνα ἔνδεια δείας καὶ ἀγωγὴ εἰς τὸ κατὰ φύσιν, ἡ δὲ ἐν τῷ πίνειν ἡδονὴ ἀναπλήρωσις καὶ γένεσις ἄγουσα εἰς τὸ κατὰ φύσιν.	ὁ μέν γάρ    καί ἀγωγή εἰς ὁ κατά φύσις , ὁ δέ ἐν ὁ πίνω ἡδονή ἀναπλήρωσις καί γένεσις ἄγω εἰς ὁ κατά φύσις .
1221780	tlg0615.tlg001.opp-grc1	διὰ μὲν ταῦτα γένεσις εἰς φύσιν·	διά μέν οὗτος γένεσις εἰς φύσις ·
1221781	tlg0615.tlg001.opp-grc1	δἰσθητὴ δὲ ὅτι εἰσὶ καὶ ἄλλαι γενέσεις ἐν ἡμῖν, οἷον αἱ αἱματώσεις καὶ ἀναδόσεις τῆς τροφῆς, αἳ οὐκ εἰσὶν ἡδοναὶ διὰ τὸ λεληθέναι·	δέ ὅτι2 εἰμί καί ἄλλος γένεσις ἐν ἐγώ , οἷος ὁ  καί ἀνάδοσις ὁ τροφή , ὁ οὐ εἰμί  διά ὁ λανθάνω ·
