id	filename	tokens	lemmas
670001	tlg0527.tlg011.opp-grc2	καὶ εἶπεν Σαοὺλ πρὸς τὸ παιδάριον αὐτοῦ Ἀγαθὸν τὸ ῥῆμα, δεῦρο καὶ πορευθῶμεν·	καί λέγω  πρός ὁ παιδάριον αὐτός ἀγαθός ὁ ῥῆμα , δεῦρο καί  ·
670002	tlg0527.tlg011.opp-grc2	καὶ ἐπορεύθησαν εἰς τὴν πόλιν οὗ ἦν ἐκεῖ ὁ ἄνθρωπος ὁ τοῦ θεοῦ.	καί ἐφορεύω εἰς ὁ πόλις οὗ εἰμί ἐκεῖ ὁ ἄνθρωπος ὁ ὁ θεός .
670003	tlg0527.tlg011.opp-grc2	αὐτῶν ἀναβαινόντων τὴν ἀνάβασιν τῆς πόλεως, καὶ αὐτοὶ εὑρίσκουσιν τὰ κοράσια ἐξεληλυθότα ὑδρεύεσθαι ὕδωρ, καὶ λέγουσιν αὐταῖς Εἰ ἔστιν ἐνταῦθα ὁ βλέπων;	αὐτός ἀναβαίνω ὁ ἀνάβασις ὁ πόλις , καί αὐτός εὑρίσκω ὁ   ὑδρεύω ὕδωρ , καί λέγω αὐτός εἰ εἰμί ἐνταῦθα ὁ βλέπω ;
670004	tlg0527.tlg011.opp-grc2	καὶ ἀπεκρίθη τὰ κοράσια αὐτοῖς καὶ λέγουσιν αὐτοῖς Ἔστιν, ἰδοὺ κατὰ πρόσωπον ὑμῶν·	καί ἀποκρίνω ὁ  αὐτός καί λέγω αὐτός  ,  κατά πρόσωπον ὑμός ·
670005	tlg0527.tlg011.opp-grc2	νῦν διὰ τὴν ἡμέραν ἤκει εἰς τὴν πόλιν, ὅτι θυσία σήμερον τῷ λαῷ ἐν Βαμά.	νῦν διά ὁ ἡμέρα  εἰς ὁ πόλις , ὅτι2 θυσία σήμερον ὁ λαός ἐν  .
670006	tlg0527.tlg011.opp-grc2	ὡς ἂν εἰσέλθητε τὴν πόλιν, οὕτως εὑρήσετε αὐτὸν ἐν τῇ πόλει πρὶν ἀναβῆναι αὐτὸν εἰς βᾶμά τοῦ φαγεῖν·	ὡς ἄν εἰσέρχομαι ὁ πόλις , οὕτως εὑρίσκω αὐτός ἐν ὁ πόλις πρίν ἀναβαίνω αὐτός εἰς  ὁ ἐσθίω ·
670007	tlg0527.tlg011.opp-grc2	ὅτι οὐ μὴ φάγῃ ὁ λαός ἕως τοῦ εἰσελθόν αὐτόν, ὅτι οὗτος εὐλογεῖ τὴν θυσίαν, καὶ μετὰ ταῦτα ἐσθίουσιν οἱ ξένοι·	ὅτι2 οὐ μή  ὁ λαός ἕως ὁ  αὐτός , ὅτι2 οὗτος  ὁ θυσία , καί μετά οὗτος ἐσθίω ὁ ξένος ·
670008	tlg0527.tlg011.opp-grc2	καὶ νῦν ἀνάβητε, ὅτι διὰ τὴν ἡμέραν εὑρήσετε αὐτόν.	καί νῦν ἀναβαίνω , ὅτι2 διά ὁ ἡμέρα εὑρίσκω αὐτός .
670009	tlg0527.tlg011.opp-grc2	καὶ ἀναβαίνουσιν τὴν πόλιν·	καί ἀναβαίνω ὁ πόλις ·
670010	tlg0527.tlg011.opp-grc2	αὐτῶν εἰς μέσον τῆς πόλεως, καὶ ἰδοὺ Σαμουὴλ ἐξῆλθεν εἰς ἐπάντησιν αὐτῶν, τοῦ ἀναβῆναι εἰς βᾶμά.	αὐτός εἰς μέσος ὁ πόλις , καί   ἐξέρχομαι εἰς  αὐτός , ὁ ἀναβαίνω εἰς  .
670011	tlg0527.tlg011.opp-grc2	Καὶ κύριος ἀπεκάλυψεν τὸ ὠτίον Σαμουὴλ ἡμέρᾳ μιᾷ ἔμπροσθεν τοῦ ἐλθεῖν πρὸς αὐτὸν Σαοὺλ λέγων Ὡς ὁ καιρὸς αὔριον ἀποστελῶ πρὸς σὲ ἄνδρα ἐκ Βενιαμείν, καὶ χρίσεις αὐτὸν εἰς ἄρχοντα ἐπὶ τὸν λαόν μου Ἰσραήλ, καὶ σώσει τὸν λαόν μου ἐκ χειρὸς ἀλλοφύλων·	καί κύριος2 ἀποκαλύπτω ὁ ὠτίον  ἡμέρα  ἔμπροσθεν ὁ ἔρχομαι πρός αὐτός  λέγω ὡς ὁ καιρός αὔριον  πρός  ἀνήρ ἐκ  , καί  αὐτός εἰς ἄρχω ἐπί ὁ λαός   , καί  ὁ λαός ἐγώ ἐκ χείρ ἀλλόφυλος ·
670012	tlg0527.tlg011.opp-grc2	ὅτι ἐπέβλεψα ἐπὶ τὴν ταπείνωσιν τοῦ λαοῦ μου, ὅτι ἦλθεν βοὴ αὐτῶν πρὸς μέ.	ὅτι2  ἐπί ὁ ταπείνωσις ὁ λαός  , ὅτι2 ἔρχομαι βοή αὐτός πρός  .
670013	tlg0527.tlg011.opp-grc2	καὶ Σαμουὴλ εἶδεν τὸν Σαούλ, καὶ Κύριος ἀπεκρίθη αὐτῷ ἰδοὺ ὁ ἄνθρωπος ὃν εἶπά σοι οὗτος ἄρξει ἐν τῷ λαῷ μου.	καί  ὁράω ὁ  , καί κύριος2 ἀποκρίνω αὐτός  ὁ ἄνθρωπος ὅς   οὗτος ἄρχω ἐν ὁ λαός  .
670014	tlg0527.tlg011.opp-grc2	καὶ προσήγαγεν πρὸς Σαμουὴλ εἰς μέσον τῆς πόλεως κοὶ εἶπεν Ἀπάγγειλον δή ποῖος ὁ οἶκος τοῦ βλέποντος.	καί προσάγω πρός  εἰς μέσος ὁ πόλις  λέγω  δή ποιός ὁ οἶκος ὁ βλέπω .
670015	tlg0527.tlg011.opp-grc2	καὶ ἀπεκρίθη Σαμουὴλ τῷ Σαοὺλ εἶπεν Ἐγώ εἰμι αὐτός·	καί ἀποκρίνω  ὁ  λέγω  εἰμί αὐτός ·
670016	tlg0527.tlg011.opp-grc2	ἀνάβηθι ἔμπροσθέν μου εἰς βᾶμά καὶ φάγε μετ’ ἐμοῦ σήμερον, καὶ ἐξαποστελῶ σε πρωὶ καὶ πάντα τὰ ἐν τῆ καρδίᾳ σου ἀπαγγελῶ σοι.	ἀναβαίνω ἔμπροσθεν ἐγώ εἰς  καί  μετά ἐμός σήμερον , καί   πρωΐ καί πᾶς ὁ ἐν  καρδία    .
670017	tlg0527.tlg011.opp-grc2	καὶ περὶ τῶν ὄνων σου τῶν ἀπολωλυιῶν σήμερον τριταίων, μὴ θῇς τὴν καρδίαν σου αὐταῖς, ὅτι εὕρηνται·	καί περί ὁ   ὁ  σήμερον τριταῖος , μή τίθημι ὁ καρδία  αὐτός , ὅτι2 εὑρίσκω ·
670018	tlg0527.tlg011.opp-grc2	καὶ τίνι τὰ ὡραῖα τοῦ Ἰσραήλ, οὐ σοὶ καὶ τῷ οἴκῳ τοῦ πατρός σου;	καί  ὁ ὡραῖος ὁ  , οὐ  καί ὁ οἶκος ὁ πατήρ  ;
670019	tlg0527.tlg011.opp-grc2	καὶ ἀπεκρίθη Σαοὺλ καὶ εἶπεν οὐχὶ ἀνδρὸς υἱὸς Ἰεμειναίου ἐγώ εἰμι τοῦ μικροῦ σκήπτρου φυλῆς Ἰσραήλ;	καί ἀποκρίνω  καί λέγω  ἀνήρ υἱός   εἰμί ὁ μικρός σκῆπτρον φυλή  ;
670020	tlg0527.tlg011.opp-grc2	καὶ τῆς φυλῆς τῆς ἐλαχίστης ἐξ ὅλου σκήπτρου Βενιαμείν;	καί ὁ φυλή ὁ ἐλάχιστος ἐκ ὅλος   ;
670021	tlg0527.tlg011.opp-grc2	καὶ ἵνα τί ἐλάλησας πρὸς ἐμὲ κατὰ τὸ ῥῆμα τοῦτο;	καί ἵνα τι  πρός  κατά ὁ ῥῆμα οὗτος ;
670022	tlg0527.tlg011.opp-grc2	καὶ ἔλαβεν Σαμουὴλ τόν Σαοὺλ καὶ τὸ παιδάριον αὐτοῦ καὶ εἰσήγαγεν αὐτοὺς εἰς τὸ κατάλυμα, καὶ ἔθετο αὐτοῖς ἐκεῖ τόπον ἐν πρώτοις τῶν κεκλημένων ὡσεὶ ἑβδομήκοντα ἀνδρῶν.	καί λαμβάνω  ὁ  καί ὁ παιδάριον αὐτός καί εἰσάγω αὐτός εἰς ὁ κατάλυμα , καί τίθημι αὐτός ἐκεῖ τόπος ἐν πρῶτος ὁ  ὡσεί  ἀνήρ .
670023	tlg0527.tlg011.opp-grc2	καὶ εἶπεν Σαμουὴλ τῷ μαγείρῳ Δός μοι τὴν μερίδα ἢν ἔδωκά σοι, ἣν εἶπά σοι θεῖναι αὐτὴν οαρὰ σοί.	καί λέγω  ὁ μάγειρος   ὁ μερίς ἐάν   , ὅς   θείνω αὐτός   .
670024	tlg0527.tlg011.opp-grc2	καὶ ἥψησεν ὁ μάγειρος τὴν κωλέαν καὶ παρέθηκεν αὐτὴν ἐνώπιον Σαούλ·	καί ἕψω ὁ μάγειρος ὁ  καί παρατίθημι αὐτός   ·
670025	tlg0527.tlg011.opp-grc2	καὶ εἶπεν Σαμουὴλ τῷ Σαούλ Ἴδου ὑπὁλιμμα, παράθες αὐτὸ ἐνώπιόν σου καὶ φάγε, ὅτι εἰς μαρτύριονἴ’ σοι παρὰ τοὺς ἅλλους·	καί λέγω  ὁ    , παρατίθημι αὐτός ἐνώπιος  καί  , ὅτι2 εἰς μαρτύριον ἴ’  παρά ὁ ἄλλος ·
670026	tlg0527.tlg011.opp-grc2	ἀπόκνιζε.	.
670027	tlg0527.tlg011.opp-grc2	καὶ ἔφαγεν Σαοὺλ μετὰ ἐν τῆ ἡμέρᾳ ἐκείνῃ.	καί   μετά ἐν  ἡμέρα ἐκεῖνος .
670028	tlg0527.tlg011.opp-grc2	καὶ κατέβη ἐκ τῆς βᾶμά ἐν τῇ πόλει·	καί καταβαίνω ἐκ ὁ  ἐν ὁ πόλις ·
670029	tlg0527.tlg011.opp-grc2	καὶ διέστρωσαν τῷ Σαοὺλ ἐπὶ τῷ δώματι, καὶ ἐκοιμήθη.	καί  τῷ  ἐπί ὁ δῶμα , καί κοιμάω .
670030	tlg0527.tlg011.opp-grc2	ὡς ἀνέβαινεν ὁ ὄρθρος, καὶ ἐκάλεσεν Σαμουὴλ τὸν Σαοὺλ ἐπὶ τῷ δώματι λέγων Ἀνάστα, καὶ ἐξαποστελῶ σε·	ὡς ἀναβαίνω ὁ ὄρθρος , καί καλέω  ὁ  ἐπί ὁ δῶμα λέγω  , καί ἐξαποστέλλω  ·
670031	tlg0527.tlg011.opp-grc2	καὶ ἀνέστη Σαούλ, καὶ ἐξῆλθεν αὐτὸς καὶ Σαμουὴλ ἕως ἔξω.	καί ἀνίστημι  , καί ἐξέρχομαι αὐτός καί  ἕως ἔξω .
670032	tlg0527.tlg011.opp-grc2	αὐτῶν καταβαινόντων εἰς μέρος τῆς πόλεως, καὶ Σαμουὴλ εἶπεν τῷ Σαούλ Εἰπὸν τῷ νεανίσκῳ κοὶ διελθέτω ἔμπροσθεν ἡμῶν, καὶ σὺ στῆθι ὡς σήμερον καὶ ἄκουσον ῥῆμα θεοῦ.	αὐτός καταβαίνω εἰς μέρος ὁ πόλις , καί  λέγω τῷ   ὁ νεανίσκος  διέρχομαι ἔμπροσθεν  , καί  ἵστημι ὡς σήμερον καί ἀκούω ῥῆμα θεός .
670033	tlg0527.tlg011.opp-grc2	καὶ ἔλαβεν Σαμουὴλ τὸν φακὸν τοῦ ἐλαίου καὶ ἐπέχεενX Xἐπὶ τὴν κεφαλὴν αὐτοῦ, καὶ ἐφίλησεν αὐτὸν καὶ εἶπεν αὐτῶ κέχρικέν σε κύριος εἰς ἄρχοντα ἐπὶ τὸν λαὸν αὐτοῦ, ἐπὶ Ἰσραήλ;	καί λαμβάνω  ὁ  ὁ  καί ἐπιχέω X  ὁ κεφαλή αὐτός , καί φιλέω αὐτός καί λέγω   σύ κύριος2 εἰς ἄρχω ἐπί ὁ λαός αὐτός , ἐπί  ;
670034	tlg0527.tlg011.opp-grc2	καὶ σὺ ἄρξεις ἐν λῆ κυρίου, καὶ σὺ σώσεις αὐτὸν ἐκ χειρὸς ἐχθρῶν αὐτοῦ κυκλόθεν.	καί  ἄρχω ἐν   , καί   αὐτός ἐκ χείρ ἐχθρός αὐτός κύκλος .
670035	tlg0527.tlg011.opp-grc2	καὶ τοῦτό σοι τὸ σημεῖον ὅτι ἔχρισέν σε κύριος ἐπὶ κληρονομίαν αὐτοῦ εἰς ἄρχοντα·	καί   ὁ σημεῖον ὅτι2 χρίω  κύριος2 ἐπί κληρονομία αὐτός εἰς ἄρχω ·
670036	tlg0527.tlg011.opp-grc2	ὡς ἂν ἀπέλθῃς σήμερον ἀπ’ ἐμοῦ, καὶ εὑρήσεις δύο ἄνδρας πρὸς τοῖς τάφοις Ῥαχὴλ ἐν τῷ ὄρει Βενιαμεὶν ἀλλομένους μεγάλα, καὶ ἐροῦσίν σοι Εὕρηνται αἱ ὄνοι ἃς ζητεῖν·	ὡς ἄν ἀπέρχομαι σήμερον ἀπό ἐμός , καί εὑρίσκω γε ἀνήρ πρός ὁ τάφος  ἐν ὁ ὄρος   μέγας , καί    ὁ  ὅς ζητέω ·
670037	tlg0527.tlg011.opp-grc2	καὶ ἰδοὺ ὁ πατήρ σου ἀποτετίνακται τὸ ῥῆμα τῶν ὄνων, καὶ ἐδαψιλεύσατο δι’ ὑμᾶς λέγων Τί ποιήσω ὑπὲρ τοῦ υἱοῦ μου;	καί  ὁ πατήρ   ὁ ῥῆμα ὁ  , καί  διά  λέγω  ποιέω ὑπέρ ὁ   ;
670038	tlg0527.tlg011.opp-grc2	καὶ ἀπελεύσει ἐκεῖθεν καὶ ἐπέκεινα ἥξεις ἕως τῆς δρυὸς Θαβώρ, καὶ εὑρήσεις ἐκεῖ τρεῖς ἄνδρας ἀναβαίνοντας πρὸς τὸν θεὸν εἰς Βαιθήλ, ἕνα αἴροντα τρία αἰγίδια καὶ ἕνα αἴροντα τρία ἀγγεῖα ἄρτων καὶ ἕνα αἴροντα ἀσκὸν οἴνου·	καί  ἐκεῖθεν καί  ἥκω ἕως ὁ δρῦς  , καί εὑρίσκω ἐκεῖ  ἀνήρ ἀναβαίνω πρός ὁ  εἰς  ,     καί      καί  αἴρω ἀσκός οἶνος ·
670039	tlg0527.tlg011.opp-grc2	καὶ ἐρωτήσουσίν σε τὰ εἰς εἰρήνην καὶ δῶ σοι δύο ἀπαρχὰς ἄρτων, καὶ λήμψῃ ἐκ τῆς χειρὸς αὐτῶν.	καί   ὁ εἰς εἰρήνη καί δῶμα  γε ἀπαρχή  , καί  ἐκ ὁ χείρ αὐτός .
670040	tlg0527.tlg011.opp-grc2	κ ταῦτα εἰσελεύσῃ εἰς τὸν βουνὸν τοῦ θεοῦ, οὗ ἐστιν ἐκεῖ τὸ ἀνά τῶν ἀλλοφύλων, ἐκεῖ Νασεὶβ ὁ ἀλλόφυλος·	οὗτος  εἰς ὁ βουνός ὁ θεός , οὗ εἰμί ἐκεῖ ὁ ἀνά ὁ ἀλλόφυλος , ἐκεῖ  ὁ ἀλλόφυλος ·
670041	tlg0527.tlg011.opp-grc2	καὶ ἔσται ὡς ἂν εἰσέλθητε ἐκεῖ εἰς τὴν πόλιν, καὶ ἀπαντήσεις χορῷ προφητῶν καταβαινόντων ἐκ τῆς βᾶμά, καὶ ἔμπροσθεν αὐτῶν νάβαλ καὶ τύμπανον καὶ αὐλὸς καὶ κινύρα, καὶ αὐτοὶ προφητεύοντες·	καί εἰμί ὡς ἐάν  ἐκεῖ εἰς ὁ πόλις , καί ἀπαντάω χορός προφήτης καταβαίνω ἐκ ὁ  , καί ἔμπροσθεν αὐτός  καί  καί αὐλός καί  , καί αὐτός προφητεύω ·
670042	tlg0527.tlg011.opp-grc2	καὶ ἐφαλεῖται ἐπὶ σὲ πνεῦμα Κυρίου καὶ προφητεύσεις μετ’ αὐτῶν, καὶ στραφήσῃ εἰς ἄνδρα ἄλλον.	καί  ἐπί  πνεῦμα κύριος2 καί προφητεύω μετά αὐτός , καί  εἰς ἀνήρ ἄλλος .
670043	tlg0527.tlg011.opp-grc2	καὶ ἔσται ὅταν ἥξει τὰ σημεῖα ταῦτα ἐπὶ σέ, ποίει πάντα ὅσα εὕρῃ ἡ χείρ σου, ὅτι θεὸς μετὰ σοῦ.	καί εἰμί ὅταν ἥκω ὁ σημεῖον οὗτος ἐπί  , ποιέω πᾶς ὅσος εὑρίσκω ὁ χείρ  , ὅτι2  μετά σός .
670044	tlg0527.tlg011.opp-grc2	καὶ καταβήσῃ ἔμπροσθεν τῆς Γαλαάδ, καὶ ἰδοὺ καταβαίνω πρὸς σὲ ἀνενεγκεῖν ὁλοκαύτωσιν καὶ θυσίας εἰρηνικάς·	καί καταβαίνω ἔμπροσθεν ὁ  , καί  καταβαίνω πρός  ἀναφέρω  καί θυσία εἰρηνικός ·
670045	tlg0527.tlg011.opp-grc2	ἑπτὰ ἡμέρας διαλείψεις ἕως τοῦ ἐλθεῖν με πρὸς σέ, καὶ γνωρίσω σοι ἃ ποιήσεις.	ἑπτάς ἥμερος  ἕως ὁ ἔρχομαι  πρός  , καί γνωρίζω σύ ὅς ποιέω .
670046	tlg0527.tlg011.opp-grc2	Καὶ ἐγενήθη ὥστε στραφῆναι τῷ ὤμῳ αὐτοῦ ἀπελθεῖν ἀπὸ Σαμουήλ, μετέστρεψεν αὐτῷ ὁ θεὸς καρδίαν ἄλλην·	καί γίγνομαι ὥστε στράπτω τῷ ὦμος αὐτός ἀπέρχομαι ἀπό  ,  αὐτός ὁ  καρδία ἄλλος ·
670047	tlg0527.tlg011.opp-grc2	καὶ ἦλθεν πάντα τὰ σημεῖα ἐν τῇ ἡμέρα ἐκείνῃ.	καί ἔρχομαι πᾶς ὁ σημεῖον ἐν ὁ ἡμέρα ἐκεῖνος .
670048	tlg0527.tlg011.opp-grc2	καὶ ἔρχεται ἐκεῖθεν εἰς τὸν βουνόν, καὶ ἰδοὺ χορὸς προφητῶν ἐξ αὐτοῦ·	καί ἔρχομαι ἐκεῖθεν εἰς ὁ βουνός , καί  χορός προφήτης ἐκ αὐτός ·
670049	tlg0527.tlg011.opp-grc2	καὶ ἥλατο ἐπ’ αὐτὸν πνεῦμα θεοῦ καὶ ἐπροφήτευσεν ἐν μέσῳ αὐτῶν.	καί ἅλλομαι ἐπί αὐτός πνεῦμα θεός καί προφητεύω ἐν μέσος αὐτός .
670050	tlg0527.tlg011.opp-grc2	καὶ ἐγενήθησαν πάντες οἱ εἰδότες αὐτὸν ἐχθὲς τρίτην καὶ εἶδον, καὶ ἰδοὺ αὐτὸς ἐν μέσῳ τῶν προφητῶν·	καί γίγνομαι πᾶς ὁ οἶδα αὐτός  τρίτος καί ὁράω , καί  αὐτός ἐν μέσος ὁ  ·
670051	tlg0527.tlg011.opp-grc2	καὶ εἶπεν ὁ λαὸς ἕκαστος πρὸς τὸν πλησίον αὐτοῦ Τί τοῦτο τὸ γεγονὸς τῷ υἱῷ Κείς;	καί λέγω ὁ λαός ἕκαστος πρός ὁ πλησίος αὐτός  οὗτος ὁ γίγνομαι τῷ υἱός Κείς ;
670052	tlg0527.tlg011.opp-grc2	ἢ καὶ Σαοὺλ ἐν προφήταις;	τίη καί  ἐν προφήτης ;
670053	tlg0527.tlg011.opp-grc2	καὶ ἀπεκρίθη τις αὐτῶν εἶπεν καὶ τίς πατὴρ αὐτοῦ;	καί ἀποκρίνω τις αὐτός λέγω καί τις πατήρ αὐτός ;
670054	tlg0527.tlg011.opp-grc2	διὰ τοῦτο ἐγενήθη εἰς παραβολήνἪ καὶ Σαοὺλ ἐν προφήταις;	διά οὗτος γίγνομαι εἰς παραβολή Ἢ καί  ἐν προφήτης ;
670055	tlg0527.tlg011.opp-grc2	καὶ συνετέλεσεν προφητεύων, καὶ εἰς τὸν βουνόν.	καί συντελέω προφητεύω , καί εἰς ὁ βουνός .
670056	tlg0527.tlg011.opp-grc2	Καὶ εἶπεν ὁ εἶπεν αὐτοῦ πρὸς αὐτὸν πρὸς τὸ παιδάριον αὐτοῦ Ποῦ ἐπορεύθητε;	καί λέγω ὁ λέγω αὐτός πρός αὐτός πρός ὁ  αὐτός   ;
670057	tlg0527.tlg011.opp-grc2	καὶ εἶπαν Ζητεῖν τὰς ὄνους·	καί λέγω  ὁ ὄνος ·
670058	tlg0527.tlg011.opp-grc2	καὶ εἴδαμεν ὅτι οὐκ εἰσίν, καὶ εἰσήλθομεν πρὸς Σαμουήλ.	καί  ὅτι2 οὐ εἰμί , καί εἰσέρχομαι πρός  .
670059	tlg0527.tlg011.opp-grc2	καὶ εἶπεν ὁ οἰκεῖος πρὸς Σαούλ Ἀπάγγειλον δή μοι τί εἰπέν σοι Σαμουήλ.	καί λέγω ὁ οἰκεῖος πρός   δή  τίς    .
670060	tlg0527.tlg011.opp-grc2	καὶ εἶπεν Σαοὺλ πρὸς τόν οἰκεῖον αὐτοῦ Ἀπήγγειλεν ἀπαγγέλλων μοι ὅτι εὕρηνται οἱ ὄνοι·	καί λέγω  πρός ὁ οἰκεῖος αὐτός  ἀπαγγέλλω  ὅτι2 εὑρίσκω ὁ ὄνος ·
670061	tlg0527.tlg011.opp-grc2	τὸ δὲ ῥῆμα τῆς βασιλείας οὐκ ἀπήγγειλεν αὐτῷ.	ὁ δέ ῥῆμα ὁ βασίλεια οὐ ἀπαγγέλλω αὐτός .
670062	tlg0527.tlg011.opp-grc2	Καὶ παρήγγειλεν Σαμουὴλ παντὶ τῷ λαῷ πρὸς κύριον εἰς Μασσηφά, καὶ εἶπεν πρὸς υἱούς Ἰσραήλ τάδε εἶπεν κύριος ὁ θεὸς λέγων Ἐγὼ ἀνήγαγον τοὺς υἱοὺς Ἰσραὴλ ἐξ Αἰγύπτου, καὶ τῶν βασιλείων τῶν θλιβουσων ὑμὰς.	καί παραγγέλλω  πᾶς ὁ λαός πρός  εἰς  , καί λέγω πρός υἱός  ὅδε λέγω κύριος2 ὁ  λέγω  ἀνάγω ὁ υἱός  ἐκ Αἴγυπτος , καί ὁ βασίλειος ὁ   .
670063	tlg0527.tlg011.opp-grc2	καὶ ὑμεῖς σήμερον εξουθενηκατε κοτε τὸν θεόν, ὃς αὐτός ἐστιν ὑμῶν σωτὴρ ἐκ πάντων τῶν κακῶν ὑμῶν καὶ θλίψεων ὑμῶν, καὶ εἴπατε οὐχί, ἀλλ’ ἢ ὅτι βασιλέα στήσεις ἐφ’ ἡμῶν.	καί  σήμερον  ποτε ὁ θεός , ὅς αὐτός εἰμί ὑμός σωτήρ ἐκ πᾶς ὁ κακός  καί θλῖψις ὑμός , καί λέγω οὐ , ἀλλά τίη ὅτι2 βασιλεύς ἵστημι ἐπί ἐγώ .
670064	tlg0527.tlg011.opp-grc2	καὶ νῦν κατάστητε ἐνώπιον κυρίου κατὰ τὰ σκῆπτρα ὑμῶν καὶ κατὰ τὰς φυλὰς ὑμῶν.	καί νῦν  ἐνώπιος  κατά ὁ σκῆπτρον  καί κατά ὁ φυλή ὑμός .
670065	tlg0527.tlg011.opp-grc2	καὶ προσήγαγεν Σαμουὴλ πάντα τὰ σκῆπτρα Ἰσραήλ, καὶ κατακληροῦται σκῆπτρον Βενιαμείν·	καί προσάγω  πᾶς ὁ σκῆπτρον  , καί  σκῆπτρον  ·
670066	tlg0527.tlg011.opp-grc2	καὶ προσάγει σκῆπτρον Βενιαμεὶν εἰς φυλάς, καὶ κατακληροῦται φυλὴ Ματταρεί·	καί προσάγω σκῆπτρον  εἰς φυλή , καί  φυλή  ·
670067	tlg0527.tlg011.opp-grc2	καὶ προσάγουσιν τήν φυλὴν Ματταρεὶ εἰς ἄνδρας, καὶ κατακληροῦται Σαοὺλ υἱὸς Κείς.	καί προσάγω ὁ φυλή  εἰς ἀνήρ , καί   υἱός  .
670068	tlg0527.tlg011.opp-grc2	καὶ ἐζήτει αὐτόν, καὶ οὐχ εὑρίσκετο.	καί ζητέω αὐτός , καί οὐ εὑρίσκω .
670069	tlg0527.tlg011.opp-grc2	καὶ ἐπηρώτησεν Σαμουὴλ ἔτι ἐν κυρίῳ Εἰ ἔρχεται ὁ ἀνὴρ ἐνταῦθα;	καί ἐπερωτάω  ἔτι ἐν κύριος2 εἰ ἔρχομαι ὁ ἀνήρ ἐνταῦθα ;
670070	tlg0527.tlg011.opp-grc2	καὶ εἶπεν κύριος Ἴδου αὐτὸς κέκρυπται ἐν τοῖς σκεύεσιν.	καί λέγω κύριος2  αὐτός κρύπτω ἐν ὁ σκεῦος .
670071	tlg0527.tlg011.opp-grc2	καὶ ἔδραμεν καὶ λαμβάνει αὐτὸν ἐκεῖθεν, καὶ κατέστησεν ἐν μέσῳ τοῦ λαοῦ·	καί τρέχω καί λαμβάνω αὐτός ἐκεῖθεν , καί καθίστημι ἐν μέσος ὁ λαός ·
670072	tlg0527.tlg011.opp-grc2	καὶ ὑψώθη ὑπὲρ πάντα τὸν λαὸν ὑπερωμίαν καὶ ἐπάνω.	καί ὑψόω ὑπέρ πᾶς ὁ λαός  καί ἐπάνω .
670073	tlg0527.tlg011.opp-grc2	καὶ εἶπεν Σαμουὴλ πρὸς πάντα τόν λαόν Εἰ ἑοράκατε ὃν ἐκλέλεκται ἑαυτῷ κύριος, ὅτι οὐκ ἔστιν αὐτῷ ὅμοιος ἐν πᾶσιν ὑμῖν;	καί λέγω  πρός πᾶς ὁ λαός   ὅς  ἑαυτοῦ κύριος2 , ὅτι2 οὐ εἰμί αὐτός ὅμοιος ἐν πᾶς  ;
670074	tlg0527.tlg011.opp-grc2	καὶ ἔγνωσαν πᾶς ὁ λαὸς καὶ εἶπαν Σήτω ὁ βασιλεύς.	καί γιγνώσκω πᾶς ὁ λαός καί λέγω  ὁ βασιλεύς .
670075	tlg0527.tlg011.opp-grc2	Καὶ εἶπεν Σαμουὴλ πρὸς τὸν λαὸν τὸ δικαίωμα τοῦ βασιλέως, καὶ ἔγραψεν ἐν βιβλίῳ καὶ ἔθηκεν ἐνώπιον κυρίου·	καί λέγω  πρός ὁ λαός ὁ δικαίωμα ὁ βασιλεύς , καί γράφω ἐν βιβλίον καί τίθημι   ·
670076	tlg0527.tlg011.opp-grc2	καὶ ἐξαπέστειλεν Σαμουὴλ πάντα τὸν λαόν, καὶ ἀπῆλθεν ἕκαστος εἰς τὸν τόπον αὐτοῦ.	καί ἐξαποστέλλω  πᾶς ὁ λαός , καί ἀπέρχομαι ἕκαστος εἰς ὁ τόπος αὐτός .
670077	tlg0527.tlg011.opp-grc2	καὶ Σαοὺλ ἀπῆλθεν εἰς τὸν οἶκον αὐτοῦ εἰς Γαβαά·	καί  ἀπέρχομαι εἰς ὁ οἶκος αὐτός εἰς  ·
670078	tlg0527.tlg011.opp-grc2	καὶ ἐπορεύθησαν υἱοὶ δυνάμεων ὧν ἥψατο κύριος καρδίας αὐτῶν μετὰ Σαούλ.	καί ἐφορεύω υἱός δύναμις ὅς ἅπτω κύριος2 καρδία αὐτός μετά  .
670079	tlg0527.tlg011.opp-grc2	καὶ υἱοὶ λοιμοὶ εἶπαν Τίς σώσει ἡμᾶς οὗτος;	καί υἱός  λέγω  σῴζω ἐγώ οὗτος ;
