id	filename	tokens	lemmas
35270	tlg0074.tlg002.perseus-grc1	τοὺς δὲ σὴ ἀνθρώπους οὕστινας ἰχθύας ἐξ ἀνθρώπων ἐπεποιήκει κατελεήσαντα ἀνθρώπους αὖθις ἐξ ἰχθύων ποιῆσαι, καὶ ἀπὸ τούτων τῶν Ἰχθυοφάγων τὸ γένος καὶ ἐς Ἁλέξανδρον κατελθεῖν.	ὁ δέ  ἄνθρωπος ὅστις ἰχθύς ἐκ ἄνθρωπος ποιέω  ἄνθρωπος αὖθις ἐκ ἰχθύς ποιέω , καί ἀπό οὗτος ὁ Ἰχθυοφάγοι ὁ γένος καί εἰς  κατέρχομαι .
35271	tlg0074.tlg002.perseus-grc1	καὶ ταῦτα ὅτι ψεύδεα ἐξελέγχει Νέαρχος, οὐκ ἐπαινέω αὐτὸν ἔγωγε τῆς σχολῆς τε καὶ σοφίης, οὔτε κάρτα χαλεπὰ ἐξελεγχθῆναι ἐόντα, ταλαίπωρόν τε ἐὸν γινώσκων τοὺς παλαιοὺς λόγους ἐπιλεγόμενον ἐξελέγχειν ἐόντας ψευδέας.	καί οὗτος ὅτι2 ψεῦδος ἐξελέγχω Νέαρχος , οὐ ἐπαινέω αὐτός  ὁ σχολή τε καί σοφία , οὔτε κάρτα χαλεπός ἐξελέγχω εἰμί , ταλαίπωρος τε εἰμί γιγνώσκω ὁ παλαιός λόγος  ἐξελέγχω εἰμί ψευδής .
35272	tlg0074.tlg002.perseus-grc1	ὑπὲρ δὲ τοὺς Ἰχθυοφάγους Ραδρώσιοι ἐς τὸ ἄνω οἰκέουσι γῆν πονηρὴν καὶ ψαμμώδεα, ἔνθα καὶ τὰ πολλὰ κακὰ ἡ στρατιή τε Ἀλεξάνδρῳ ἔπαθε καὶ αὐτὸς Ἀλέξανδρος, ὥς μοι ἤδη ἐν τῷ ἄλλῳ λόγῳ ἀπήγηται.	ὑπέρ δέ ὁ   εἰς ὁ ἄνω2 οἰκέω γῆ πονηρός καί ψαμμώδης , ἔνθα καί ὁ πολύς κακός ὁ στρατιά τε Ἀλέξανδρος πάσχω καί αὐτός Ἀλέξανδρος , ὡς  ἤδη ἐν ὁ ἄλλος λόγος  .
35273	tlg0074.tlg002.perseus-grc1	ὡς δὲ ἐς τὴν Καρμανίην ἀπὸ τῶν Ἰχθυοφάγων κατῆρεν ὁ στρατός, ἐνθαῦτα ἵνα πρῶτον τῆς Καρμανίης ὡρμίσαντο, ἐπʼ ἀγκυρέων ἐσάλευσαν, ὅτι ῥηχίη παρετέτατο ἐς τὸ πέλαγος τρηχέα.	ὡς δέ εἰς ὁ  ἀπό ὁ  καταίρω ὁ στρατός , ἐνταῦθα ἵνα πρῶτος ὁ  ὁρμίζω ,    , ὅτι2 ῥαχία παρατείνω εἰς ὁ πέλαγος  .
35274	tlg0074.tlg002.perseus-grc1	ἐνθένδε οὐκέτι ὡσαύτως πρὸς ἡλίου δυομένου ἔπλωον, ἀλλὰ τὸ μεταξὺ δύσιός τε ἡλίου καὶ τῆς ἄρκτου μᾶλλόν τι αἱ πρῷραι αὐτοῖσιν ἐπεῖχον.	ἐνθένδε οὐκέτι ὡσαύτως πρός ἥλιος δύω  , ἀλλά ὁ μεταξύ  τε ἥλιος καί ὁ ἄρκτος  τις ὁ πρῷρα αὐτός ἐπέχω .
35275	tlg0074.tlg002.perseus-grc1	καὶ ἡ Καρμανίη τῶν Ἰχθυοφάγων τῆς γῆς καὶ τῶν Ὠρειτέων εὐδενδροτέρη τε καὶ εὐκαρποτέρη ἐστί, καὶ ποιώδης μᾶλλόν τι καὶ εὔυδρος.	καί ὁ  ὁ Ἰχθυοφάγοι ὁ γῆ καί ὁ   τε καί  εἰμί , καί   τις καί εὔυδρος .
35276	tlg0074.tlg002.perseus-grc1	ὁρμίζονται δὲ ἐν Βάδει χώρῳ τῆς Καρμανίης οἰκεομένῳ, δένδρεά τε πολλὰ ἥμερα ἔχοντι πλὴν ἐλαίης, καὶ ἀμπέλους ἀγαθάς, καὶ σιτοφόρῳ.	ὁρμίζω δέ ἐν  χῶρος ὁ   , δένδρον τε πολύς ἥμερος ἔχω πλήν ἐλαία , καί   , καί  .
35277	tlg0074.tlg002.perseus-grc1	ἐνθένδε ὁρμηθέντες καὶ διεκπλώσαντες σταδίους ὀκτακοσίους, πρὸς αἰγιαλῷ ὁρμίζονται ἐρήμῳ, καὶ κατορέουσιν ἄκρην μακρὴν ἀνέχουσαν ἐπὶ πολλὸν ἐς τὸ πέλαγος·	ἐνθένδε ὁρμάω καί  στάδιον ὀκτακόσιοι , πρός αἰγιαλός ὁρμίζω  , καί  ἄκρος μακρός ἀνέχω ἐπί πολύς εἰς ὁ πέλαγος ·
35278	tlg0074.tlg002.perseus-grc1	ἀπέχειν δὲ ἐφαίνετο ἡ ἄκρη πλόον ὡς ἡμέρης.	ἀπέχω δέ φαίνω ὁ ἄκρα πλόος ὡς ἡμέρα .
35279	tlg0074.tlg002.perseus-grc1	καὶ οἱ τῶν χώρων ἐκείνων δαήμονες Ἀραβίης ἔλεγον τὴν ἀνέχουσαν ταύτην ἄκρην, καλέεσθαι δὲ Μάκετα·	καί ὁ ὁ χώρα ἐκεῖνος  Ἀραβία λέγω ὁ ἀνέχω οὗτος ἄκρα , καλέω δέ  ·
35280	tlg0074.tlg002.perseus-grc1	ἔνθεν τὰ κιννάμωμά τε καὶ ἄλλα τοιουτότροπα ἐς Ἀσσυρίους ἀγινέεσθαι.	ἔνθεν ὁ  τε καί ἄλλος τοιουτότροπος εἰς   .
35281	tlg0074.tlg002.perseus-grc1	καὶ ἀπὸ τοῦ αἰγιαλοῦ τούτου, ἵναπερ ὁ στόλος ἐσάλευε, καὶ τῆς ἄκρης, ἥντινα καταντικρὺ ἀπεώρων ανέχουσαν ἐς τὸ πέλαγος, ὁ κόλπος— ἐμοί τε δοκέει καὶ Νεάρχῳ ὡσαύτως ἐδόκεεν— ἐς τὸ ἔσω ἀναχέεται, ὅπερ οἰκὸς ἡ Ἐρυθρὴ θάλασσα.	καί ἀπό ὁ  οὗτος , ἵνα ὁ στόλος σαλεύω , καί ὁ ἄκρα , ὅστις καταντικρύ   εἰς ὁ πέλαγος , ὁ κόλπος —  τε δοκέω καί Νέαρχος ὡσαύτως δοκέω — εἰς ὁ εἴσω  , ὅς ἔοικα ὁ ἐρυθρός θάλασσα .
35282	tlg0074.tlg002.perseus-grc1	ταύτην τὴν ἄκρην ὡς κατεῖδον, Ὀνησίκριτος μὲν ἐπέχοντας ἐπʼ αὐτὴν πλώειν ἐκέλευεν, ὡς μὴ κατὰ τὸν κόλπον ἐλαστρεῦντας ταλαιπωρέεσθαι.	οὗτος ὁ ἄκρα ὡς καθοράω , Ὀνησίκριτος μέν ἐπέχω ἐπί αὐτός πλέω κελεύω , ὡς μή κατά ὁ κόλπος   .
35283	tlg0074.tlg002.perseus-grc1	Νέαρχος δὲ ὑποκρίνεται νήπιον εἶναι Ὀνησίκριτον, εἰ ἀγνοέει ἐπʼ ὅτῳ ἐστάλη πρὸς Ἀλεξάνδρου ὁ στόλος.	Νέαρχος δέ ὑποκρίνω νήπιος εἰμί Ὀνησίκριτος , εἰ  ἐπί ὅστις στέλλω πρός Ἀλέξανδρος ὁ στόλος .
35284	tlg0074.tlg002.perseus-grc1	οὐ γὰρ ὅτι ἀπορίη ἦν πεζῇ διασωθῆναι πάντα αὐτῷ τὸν στρατόν, ἐπὶ τῷδε ἄρα ἐκπέμψαι τὰς νέας, ἀλλὰ ἐθέλοντα αἰγιαλούς τε τοὺς κατὰ τὸν παράπλοον κατασκέψασθαι καὶ ὅρμους καὶ νησῖδας, καὶ ὅστις κόλπος ἐσέχοι, ἐκπεριπλῶσαι τοῦτον, καὶ πόλιας ὅσαι ἐπιθαλάσσιαι, καὶ εἴ τις ἔγκαρπος γῆ καὶ εἴ τις ἐρήμη.	οὐ γάρ ὅτι2 ἀπορία εἰμί πεζός διασῴζω πᾶς αὐτός ὁ στρατός , ἐπί ὅδε ἄρα ἐκπέμπω ὁ ναῦς , ἀλλά ἐθέλω  τε ὁ κατά ὁ  κατασκοπέω καί ὅρμος καί  , καί ὅστις   ,  οὗτος , καί πόλις ὅσος  , καί εἰ τις ἔγκαρπος γῆ καί εἰ   .
35285	tlg0074.tlg002.perseus-grc1	σφᾶς ὦν οὐ χρῆναι ἀφανίσαι τὸ ἔργον, πρὸς τέρματι ἤδη ἐόντας τῶν πόνων, ἄλλως τε οὐδὲ ἀπόρως ἔτι τῶν ἀναγκαίων ἐν τῷ παραπλόῳ ἔχοντας.	σφεῖς  οὐ χρή ἀφανίζω ὁ ἔργον , πρός τέρμα ἤδη εἰμί ὁ πόνος , ἄλλος τε οὐδέ ἄπορος ἔτι ὁ ἀναγκαῖος ἐν ὁ  ἔχω .
35286	tlg0074.tlg002.perseus-grc1	δεδιέναι τε, ἐπεὶ ἡ ἄκρη ἐς μεσαμβρίην ἀνέχοι, μὴ ἐρήμῃ τε τῇ ταύτῃ γῇ καὶ ἀνύδρῳ καὶ φλογώδεϊ ἐγκύρσειαν.	δείδω τε , ἐπεί ὁ ἄκρα εἰς μεσημβρία ἀνέχω , μή  τε ὁ οὗτος γῆ καί  καί   .
35287	tlg0074.tlg002.perseus-grc1	ταῦτα ἐνίκα, καί μοι δοκέει περιφανέως σῶσαι τὴν στρατιὴν τῇδε τῇ βουλῇ Νέαρχος·	οὗτος νικάω , καί ἐγώ δοκέω  σῴζω ὁ στρατιά ὅδε ὁ βουλή Νέαρχος ·
35288	tlg0074.tlg002.perseus-grc1	τὴν γὰρ δὴ ἄκρην ἐκείνην καὶ τὴν πρὸς αὐτῇ χώρην πᾶσαν ἐρήμην τε εἶναι λόγος κατέχει καὶ ὕδατος ἀπορίῃ ἔχεσθαι.	ὁ γάρ δή ἄκρα ἐκεῖνος καί ὁ πρός αὐτός χώρα πᾶς ἐρῆμος τε εἰμί λόγος κατέχω καί ὕδωρ ἀπορία ἔχω .
35289	tlg0074.tlg002.perseus-grc1	ἀλλὰ ἔπλωον γὰρ ἀπὸ τοῦ αἰγιαλοῦ ἄραντες τῇ γῇ προσεχέες, καὶ πλώσαντες σταδίους ὡς ἑπτακοσίους ἐν ἄλλῳ αἰγιαλῷ ὡρμίσαντο·	ἀλλά πλέω γάρ ἀπό ὁ  αἴρω ὁ γῆ προσεχής , καί πλέω στάδιον ὡς ἑπτακόσιοι ἐν ἄλλος αἰγιαλός ὁρμίζω ·
35290	tlg0074.tlg002.perseus-grc1	Νεόπτανα οὔνομα τῷ αἰγιαλῷ.	ὄνομα τῷ αἰγιαλός .
35291	tlg0074.tlg002.perseus-grc1	καὶ αὖθις ὑπὸ τὴνἕω ἀνήγοντο, καὶ πλώσαντες σταδίους ἑκατὸν ὁρμίζονται κατὰ ποταμὸν Ἄναμιν·	καί αὖθις ὑπό ὁ ἕω ἀνάγω , καί πλέω στάδιος  ὁρμίζω κατά ποταμός  ·
35292	tlg0074.tlg002.perseus-grc1	ὁ δὲ χῶρος Ἁρμόζεια ἐκαλέετο.	ὁ δέ χῶρος  καλέω .
35293	tlg0074.tlg002.perseus-grc1	δαψιλέα δὲ ἤδη καὶ πάμφορα τὰ ταύτῃ ἦν, πλὴν ἐλαῖαι οὐκ ἐπεφύκεσαν.	δέ ἤδη καί  ὁ οὗτος εἰμί , πλήν ἐλαία οὐ φύω .
35294	tlg0074.tlg002.perseus-grc1	ἐνθαῦτα ἐκβαίνουσί τε ἐκ τῶν νεῶν καὶ ἀπὸ τῶν πολλῶν πόνων ἄσμενοι ἀνεπαύοντο, μεμνημένοι ὅσα κακὰ κατὰ τὴν θάλασσαν πεπονθότες ἦσαν καὶ πρὸς τῇ γῇ τῇ Ἰχθυοφάγων, τήν τε ἐρημίην τῆς χώρης, καὶ τοὺς ἀνθρώπους ὅκως θηριώδεες, καὶ τὰς σφῶν ἀπορίας ἐπιλεγόμενοι.	ἐνταῦθα ἐκβαίνω τε ἐκ ὁ ναῦς καί ἀπό ὁ πολύς πόνος ἄσμενος ἀναπαύω , μιμνήσκω ὅσος κακός κατά ὁ θάλασσα πάσχω εἰμί καί πρός ὁ γῆ ὁ Ἰχθυοφάγοι , ὁ τε ἐρημία ὁ χώρα , καί ὁ ἄνθρωπος ὅπως  , καί ὁ σφεῖς ἀπορία ἐπιλέγω .
35295	tlg0074.tlg002.perseus-grc1	καί τινες αὐτῶν ἀπὸ θαλάσσης ἐς τὸ πρόσω ἀνῆλθον, ἀποσκεδασθέντες τῆς στρατιῆς κατὰ ζήτησιν ἄλλος ἄλλου.	καί τις αὐτός ἀπό θάλασσα εἰς ὁ πρόσω ἀνέρχομαι ,  ὁ στρατιά κατά ζήτησις ἄλλος ἄλλος .
35296	tlg0074.tlg002.perseus-grc1	ἐνθαῦτα ἄνθρωπός σφισιν ὤφθη χλαμύδα τε φορέων Ἑλληνικὴν καὶ τὰ ἄλλα ὡς Ἕλλην ἐσκευασμένος, καὶ φωνὴν Ἑλλάδα ἐφώνεε.	ἐνταῦθα ἄνθρωπος σφεῖς ὁράω χλαμύς τε φορά Ἑλληνικός καί ὁ ἄλλος ὡς Ἕλλη σκευάζω , καί φωνή Ἑλλάς φωνέω .
35297	tlg0074.tlg002.perseus-grc1	τοῦτον οἱ πρῶτοι ἰδόντες δακρῦσαι ἔλεγον·	οὗτος ὁ πρῶτος ὁράω δακρύω λέγω ·
35298	tlg0074.tlg002.perseus-grc1	οὕτω τι παράλογόν σφισι φανῆναι ἐκ τῶν τοσῶνδε κακῶν Ἕλληνα μὲν ἄνθρωπον ἰδεῖν, Ἑλλάδος δὲ φωνῆς ἀκοῦσαι.	οὕτως τι παράλογος σφεῖς φαίνω ἐκ ὁ τοσόσδε κακός  μέν ἄνθρωπος ὁράω , Ἑλλάς δέ φωνή ἀκούω .
35299	tlg0074.tlg002.perseus-grc1	ἐπηρώτων τε ὁκόθεν ἥκοι καὶ ὅστις ἐών·	ἐπερωτάω τε ὁπόθεν ἥκω καί ὅστις εἰμί ·
35300	tlg0074.tlg002.perseus-grc1	ὃ δὲ ἀπὸ τοῦ στρατοπέδου τοῦ Ἀλεξάνδρου ἀποσκεδασθῆναι ἔλεγε, καὶ εἶναι οὐ πόρρω τὸ στρατόπεδον καὶ αὐτὸν Ἀλέξανδρον.	ὁ δέ ἀπό ὁ στρατόπεδον ὁ Ἀλέξανδρος  λέγω , καί εἰμί οὐ πρόσω ὁ στρατόπεδον καί αὐτός Ἀλέξανδρος .
35301	tlg0074.tlg002.perseus-grc1	τοῦτον τὸν ἄνθρωπον βοῶντές τε καὶ κροτέοντες ἀνάγουσι παρὰ τὸν Νέαρχον·	οὗτος ὁ ἄνθρωπος  τε καί κροτέω ἀνάγω παρά ὁ Νέαρχος ·
35302	tlg0074.tlg002.perseus-grc1	καὶ Νεάρχῳ πάντα ἔφρασε, καὶ ὅτι πέντε ἡμερέων ὁδὸν ἀπέχει τὸ στρατόπεδον καὶ ὁ βασιλεὺς ἀπὸ τῆς θαλάσσης.	καί Νέαρχος πᾶς φράζω , καί ὅτι2  ἡμέρα ὁδός ἀποχέω ὁ στρατόπεδον καί ὁ βασιλεύς ἀπό ὁ θάλασσα .
35303	tlg0074.tlg002.perseus-grc1	τόν τε ὕπαρχον τῆς χώρης ταύτης δείξειν ἔφη Νεάρχῳ, καὶ ἔδειξε·	ὁ τε ὕπαρχος ὁ χώρα οὗτος δείκνυμι φημί Νέαρχος , καί δείκνυμι ·
35304	tlg0074.tlg002.perseus-grc1	καὶ μετὰ τούτου Νέαρχος γνώμην ποιέεται, ὅκως ἀναβήσεται πρὸς τὸν βασιλέα.	καί μετά οὗτος Νέαρχος γνώμη ποιέω , ὅπως ἀναβαίνω πρός ὁ βασιλεύς .
35305	tlg0074.tlg002.perseus-grc1	τότε μὲν δὴ ἐπὶ τὰς νέας ἀπῆλθεν·	τότε μέν δή ἐπί ὁ ναῦς ἀπέρχομαι ·
35306	tlg0074.tlg002.perseus-grc1	ὑπὸ δὲ τὴν ἕω τὰς νέας ἐνεώλκεεν, ἐπισκευῆς τε εἵνεκα, ὅσαι αὐτέων κατὰ τὸν πλόον ἐπεπονήκεσαν, καὶ ἅμα ὅτι ἐν τῷ χώρῳ τούτῳ ὑπολείπεσθαί οἱ ἐδόκεε τὸν πολλὸν στρατόν.	ὑπό δέ ὁ  ὁ ναῦς  , ἐπισκευή τε ἕνεκα , ὅσος αὐτός κατά ὁ πλόος  , καί ἅμα ὅτι2 ἐν ὁ χῶρος οὗτος ὑπολείπω ἕ δοκέω ὁ πολύς στρατός .
35307	tlg0074.tlg002.perseus-grc1	χάρακά τε ὦν περιβάλλεται διπλόον τῷ ναυστάθμῳ, καὶ τεῖχος γήινον καὶ τάφρον βαθέαν, ἀπὸ τοῦ ποταμοῦ τῆς ὄχθης ἀρξάμενος ἔστε ἐπὶ τὸν αἰγιαλόν, ἵνα αἱ νέες αὐτῷ ἀνειρυσμέναι ἦσαν.	τε  περιβάλλω  ὁ ναύσταθμον , καί τεῖχος  καί τάφρος βαθύς , ἀπό ὁ ποταμός ὁ ὄχθη ἄρχω ἔστε ἐπί ὁ αἰγιαλός , ἵνα ὁ ναῦς αὐτός  εἰμί .
35308	tlg0074.tlg002.perseus-grc1	ἐν ᾧ δὲ Νέαρχος ταῦτα ἐκόσμεε, τῆς χώρης ὁ ὕπαρχος πεπυσμένος ὅκως ἐν μεγάλῃ φροντίδι ἔχοι Ἀλέξανδρος τὰ ἀμφὶ τὸν στόλον τοῦτον, μέγα δή τι ἐξ Ἀλεξάνδρου ἀγαθὸν ἔγνω πείσεσθαι, εἰ πρῶτός οἱ ἀπαγγείλειε τοῦ στρατοῦ τὴν σωτηρίην καὶ τὸν Νέαρχον ὅτι οὐ πολλῷ ὕστερον ἀπίξεται ἐς ὄψιν τὴν τοῦ βασιλέος.	ἐν ὅς δέ Νέαρχος οὗτος  , ὁ χώρα ὁ ὕπαρχος  ὅπως ἐν μέγας φροντίς ἔχω Ἀλέξανδρος ὁ ἀμφί ὁ στόλος οὗτος , μέγας δή τις ἐκ Ἀλέξανδρος ἀγαθός γιγνώσκω πάσχω , εἰ πρῶτος ἕ ἀπαγγέλλω ὁ στρατός ὁ σωτηρία καί ὁ Νέαρχος ὅτι2 οὐ πολύς ὕστερον ἀφικνέομαι εἰς ὄψις ὁ ὁ βασιλεύς .
35309	tlg0074.tlg002.perseus-grc1	οὕτω δὴ τὴν βραχυτάτην ἐλάσας ἀπαγγέλλει Ἀλεξάνδρῳ ὅτι Νέαρχος οὗτος προσάγει ἀπὸ τῶν νεῶν.	οὕτως δή ὁ βραχύς ἐλαύνω ἀπαγγέλλω Ἀλέξανδρος ὅτι2 Νέαρχος οὗτος προσάγω ἀπό ὁ ναῦς .
35310	tlg0074.tlg002.perseus-grc1	τότε μὲν δὴ καίπερ ἀπιστέων τῷ λόγῳ Ἀλέξανδρος, ἀλλὰ ἐχάρη γε κατὰ τὸ οἰκὸς τῇ ἀγγελίῃ·	τότε μέν δή καίπερ ἀπιστέω τῷ λόγος Ἀλέξανδρος , ἀλλά χαίρω γε κατά ὁ ἔοικα ὁ ἀγγελία ·
35311	tlg0074.tlg002.perseus-grc1	ὡς δὲ ἡμέρη τε ἄλλη ἐξ ἄλλης ἐγίνετο, καὶ συντιθέντι αὐτῷ τῆς ἀγγελίης τὸν χρόνον οὐκέτι πιστὰ τὰ ἀπηγγελμένα ἐφαίνετο, πεμπόμενοί τε ἄλλοι ἐπʼ ἄλλοισιν ὡς ἐπὶ κομιδῇ τοῦ Νεάρχου οἳ μέν τινες ὀλίγον τῆς ὁδοῦ προελθόντες καὶ οὐδενὶ ἐγκύρσαντες κενοὶ ἐπανῄεσαν, οἳ δὲ καὶ πορρωτέρω ἐλθόντες καὶ διαμαρτόντες τῶν ἀμφὶ Νέαρχον, οὐδὲ αὐτοὶ ἐπανῄεσαν, ἐνθαῦτα δὴ τὸν μὲν ἄνθρωπον ἐκεῖνον, ὡς κενά τε ἀγγείλαντα καὶ λυπηρότερά οἱ τὰ πρήγματα ποιήσαντα τῇ ματαίῃ εὐφροσύνῃ, συλλαβεῖν κελεύει Ἀλέξανδρος, αὐτὸς δὲ τῇ τε ὄψι καὶ τῇ γνώμῃ δῆλος ἦν μεγάλῳ ἄχεϊ βεβλημένος.	ὡς δέ ἡμέρα τε ἄλλος ἐκ ἄλλος γίγνομαι , καί  αὐτός ὁ ἀγγελία ὁ χρόνος οὐκέτι πιστός2 ὁ ἀπαγγέλλω φαίνω ,  τε ἄλλος  ἄλλος ὡς ἐπί κομιδῇ ὁ Νέαρχος ὁ μέν τις ὀλίγος ὁ ὁδός προέρχομαι καί   κενός ἐπάνειμι ,  δέ καί πρόσω ἔρχομαι καί διαμαρτάνω ὁ ἀμφί Νέαρχος , οὐδέ αὐτός ἐπάνειμι , ἐνταῦθα δή ὁ μέν ἄνθρωπος ἐκεῖνος , ὡς  τε  καί  ὁ ὁ πρᾶγμα ποιέω ὁ  εὐφροσύνη , συλλαμβάνω κελεύω Ἀλέξανδρος , αὐτός δέ ὁ τε  καί ὁ γνώμη δῆλος εἰμί μέγας ἄχος βάλλω .
35312	tlg0074.tlg002.perseus-grc1	ἐν τούτῳ δὲ τῶν τινες κατὰ ζήτησιν τοῦ Νεάρχου ἐσταλμένων ἵππους τε ἐπὶ κομιδῇ αὐτοῦ καὶ ἀπήνας δὲ ἄγοντες ἐντυγχάνουσι κατὰ τὴν ὁδὸν αὐτῷ τε Νεάρχῳ καὶ Ἀρχίῃ, καὶ κέντε ἢ ἓξ ἅμα αὐτοῖσι.	ἐν οὗτος δέ ὁ τις κατά ζήτησις ὁ Νέαρχος  ἵππος τε ἐπί κομιδῇ αὐτός καί  δέ ἄγω ἐντυγχάνω κατά ὁ ὁδός αὐτός τε Νέαρχος καί  , καί  ἤ  ἅμα αὐτός .
35313	tlg0074.tlg002.perseus-grc1	καὶ ἐντυχόντες οὔτε αὐτὸν ἐγνώρισαν οὔτε Ἀρχίην— οὕτω τι κάρτα ἀλλοῖοι ἐφάνησαν, κομόωντές τε καὶ ῥυπόωντες καὶ μεστοὶ ἅλμης καὶ ῥικνοὶ τὰ σώματα καὶ ὠχροὶ ὑπὸ ἀγρυπνίης τε καὶ τῆς ἄλλης ταλαιπωρίης— ἀλλὰ ἐρομένοισι γὰρ αὐτοῖσιν ἵναπερ εἴη Ἀλέξανδρος, ὑποκρινάμενοι τὸν χῶρον οἳ δὲ παρήλαυνον.	καί ἐντυγχάνω οὔτε αὐτός γνωρίζω οὔτε  — οὕτως τι κάρτα ἀλλοῖος  ,  τε καί  καί μεστός ἅλμη καί  ὁ σῶμα καί  ὑπό ἀγρυπνία τε καί ὁ ἄλλος ταλαιπωρία — ἀλλά  γάρ  ἵνα εἰμί Ἀλέξανδρος ,  ὁ χῶρος ὁ δέ παρελαύνω .
35314	tlg0074.tlg002.perseus-grc1	Ἀρχίης δὲ ἐπιφρασθεὶς λέγει πρὸς Νέαρχον“ ὦ Νέαρχε, τούτους τοὺς ἀνθρώπους δἰ ἐρημίης ἐλαύνειν τὴν αὐτὴν ἡμῖν ὁδὸν οὐκ ἐπʼ ἄλλῳ τινὶ συντίθημι ὅτι μὴ κατὰ ζήτησιν τὴν ἡμετέρην ἀπεσταλμένους.	δέ ἐπιφράζω λέγω πρός Νέαρχος “ ὦ  , οὗτος ὁ ἄνθρωπος  ἐρημία ἐλαύνω ὁ αὐτός  ὁδός οὐ  ἄλλος  συντίθημι ὅτι2 μή κατά ζήτησις ὁ ἡμέτερος  .
35315	tlg0074.tlg002.perseus-grc1	ὅτι δὲ οὐ γινώσκουσιν ἡμέας, οὐκ ἐν θώματι ποιέομαι·	ὅτι2 δέ οὐ γιγνώσκω  , οὐ ἐν θαῦμα ποιέω ·
35316	tlg0074.tlg002.perseus-grc1	οὕτω γάρ τι ἔχομεν κακῶς, ὥστε ἄγνωστοι εἶναι.	οὕτως γάρ τις ἔχω κακός , ὥστε ἄγνωστος εἰμί .
35317	tlg0074.tlg002.perseus-grc1	φράσωμεν αὐτοῖσιν οἵτινές εἰμεν, καὶ αὐτοὺς ἐρώμεθα κατʼ ὅτι ταύτην ἐλαύνουσιν.	φράζω αὐτός ὅστις εἰμί , καί αὐτός ἐράω κατά ὅτι2 οὗτος ἐλαύνω .
35318	tlg0074.tlg002.perseus-grc1	” ἔδοξε Νεάρχῳ ἐναίσιμα λέγειν·	δοκέω Νέαρχος ἐναίσιμος λέγω ·
35319	tlg0074.tlg002.perseus-grc1	καὶ ἤροντο ὅκοι ἐλαύνουσιν·	καί ἀρόω ὅποι ἐλαύνω ·
35320	tlg0074.tlg002.perseus-grc1	οἳ δὲ ὑποκρίνονται ὅτι κατὰ ζήτησιν Νεάρχου τε καὶ τοῦ στρατοῦ τοῦ ναυτικοῦ.	ὁ δέ ὑποκρίνω ὅτι2 κατά ζήτησις Νέαρχος τε καί ὁ στρατός ὁ ναυτικός .
35321	tlg0074.tlg002.perseus-grc1	δ δέ“ οὗτοσ” ἔφη“ ἐγώ εἰμι Νέαρχος, καὶ Ἀρχίης οὗτος.	δέ “  ” φημί “  εἰμί Νέαρχος , καί Ἀρχίας οὗτος .
35322	tlg0074.tlg002.perseus-grc1	ἀλλὰ ἄγετε ἡμέας·	ἀλλά ἄγε  ·
35323	tlg0074.tlg002.perseus-grc1	ἡμεῖς δὲ τὰ ὑπὲρ τῆς στρατιῆς Ἀλεξάνδρῳ ἀπηγησόμεθα.	δέ ὁ ὑπέρ ὁ στρατιά Ἀλέξανδρος  .
35324	tlg0074.tlg002.perseus-grc1	” ἀναλαβόντες δὲ αὐτοὺς ἐπὶ τὰς ἀπήνας ὀπίσω ἤλαυνον.	ἀναλαμβάνω δέ αὐτός ἐπί ὁ ἀπήνη ὀπίσω ἐλαύνω .
35325	tlg0074.tlg002.perseus-grc1	καί τινες αὐτῶν τούτων ὑποφθάσαι ἐθελήσαντες τὴν ἀγγελίην, προδραμόντες λέγουσιν Ἀλεξάνδρῳ ὅτι“ οὗτός τοι Νέαρχος, καὶ σὺν αὐτῷ Ἀρχίης καὶ πέντε ἄλλοι κομίζονται παρὰ σέ,” ὑπὲρ δὲ τοῦ στρατοῦ παντὸς οὐδὲν εἶχον ὑποκρίνασθαι.	καί τις αὐτός οὗτος  ἐθέλω ὁ ἀγγελία , προτρέχω λέγω Ἀλέξανδρος ὅτι2 “  τοι Νέαρχος , καί σύν αὐτός  καί  ἄλλος κομίζω παρά  , ” ὑπέρ δέ ὁ στρατός πᾶς οὐδείς ἔχω ὑποκρίνω .
