id	filename	tokens	lemmas
407422	tlg0007.tlg021.perseus-grc2	Κάτων ὁ πρεσβύτερος πρός τινας ἐπαινοῦντας ἄνθρωπον ἀλογίστως παράβολον καὶ τολμηρὸν ἐν τοῖς πολεμικοῖς διαφέρειν ἔφη τὸ πολλοῦ τινα τὴν ἀρετὴν ἀξίαν καὶ τὸ μὴ πολλοῦ ἄξιον τὸ ζῆν νομίζειν ὀρθῶς ἀποφαινόμενος.	Κάτων ὁ πρέσβυς πρός τις ἐπαινέω ἄνθρωπος ἀλόγιστος παράβολος καί τολμηρός ἐν ὁ πολεμικός διαφέρω φημί ὁ πολύς  ὁ ἀρετή ἄξιος καί ὁ μή πολύς ἄξιος ὁ ζήω νομίζω ὀρθός ἀποφαίνω .
407423	tlg0007.tlg021.perseus-grc2	ὁ γοῦν παρʼ Ἀντιγόνῳ στρατευόμενος ἰταμός, φαῦλος δὲ τὴν ἕξιν καὶ τὸ σῶμα διεφθορώς, ἐρομένου τοῦ βασιλέως τὴν αἰτίαν τῆς ὠχρότητος ὡμολόγησέ τινα νόσον τῶν ἀπορρήτων ἐπεὶ δὲ φιλοτιμηθεὶς ὁ βασιλεὺς προσέταξε τοῖς ἰατροῖς, ἐάν τις ᾖ βοήθεια, μηδὲν ἐλλιπεῖν τῆς ἄκρας ἐπιμελείας, οὕτω θεραπευθεὶς ὁ γενναῖος ἐκεῖνος οὐκέτʼ ἦν φιλοκίνδυνος οὐδὲ ῥαγδαῖος ἐν τοῖς ἀγῶσιν, ὥστε καὶ τὸν Ἀντίγονον ἐγκαλεῖν καὶ θαυμάζειν τὴν μεταβολήν.	ὁ γοῦν παρά Ἀντίγονος στρατεύω  , φαῦλος δέ ὁ ἕξις καί ὁ σῶμα  ,  ὁ βασιλεύς ὁ αἰτία ὁ  ὁμολογέω τις νόσος ὁ ἀπόρρητος ἐπεί δέ φιλοτιμέομαι ὁ βασιλεύς προστάσσω ὁ ἰατρός , ἐάν τις εἰμί βοήθεια ,  ἐλλείπω ὁ ἄκρος ἐπιμέλεια , οὕτως θεραπεύω ὁ γενναῖος ἐκεῖνος οὐκέτι εἰμί φιλοκίνδυνος οὐδέ ῥαγδαῖος ἐν ὁ ἀγών , ὥστε καί ὁ Ἀντίγονος ἐγκαλέω καί θαυμάζω ὁ μεταβολή .
407424	tlg0007.tlg021.perseus-grc2	οὐ μὴν ὁ ἄνθρωπος ἀπεκρύψατο τὸ αἴτιον, ἀλλʼ εἶπεν ὦ βασιλεῦ, σύ με πεποίηκας ἀτολμότερον, ἀπαλλάξας ἐκείνων τῶν κακῶν διʼ ἃ τοῦ ζῆν ὠλιγώρουν.	οὐ μήν ὁ ἄνθρωπος ἀποκρύπτω ὁ  ,  λέγω ὦ βασιλεύς , σύ  ποιέω ἄτολμος , ἀπαλλάσσω ἐκεῖνος ὁ κακός διά ὅς ὁ ζήω ὀλιγωρέω .
407425	tlg0007.tlg021.perseus-grc2	πρὸς τοῦτο δὲ φαίνεται καὶ Συβαρίτης ἀνὴρ εἰπεῖν περὶ τῶν Σπαρτιατῶν ὡς οὐ μέγα ποιοῦσι θανατῶντες ἐν τοῖς πολέμοις ὑπὲρ τοῦ τοσούτους πόνους καὶ τοιαύτην ἀποφυγεῖν δίαιταν.	πρός οὗτος δέ φαίνω καί Συβαρίτης ἀνήρ λέγω περί ὁ Σπαρτιάτης ὡς οὐ μέγας ποιέω θανατάω ἐν ὁ πόλεμος ὑπέρ ὁ  πόνος καί τοιοῦτος ἀποφεύγω δίαιτα .
407426	tlg0007.tlg021.perseus-grc2	ἀλλὰ Συβαρίταις μέν ἐκτετηκόσιν ὑπὸ τρυφῆς καὶ μαλακίας διὰ τὴν πρός τὸ καλὸν ὁρμὴν καὶ φιλοτιμίαν εἰκότως ἐφαίνοντο μισεῖν τὸν βίον οἱ μὴ φοβούμενοι τὸν θάνατον, Λακεδαιμονίοις δὲ καὶ ζῆν ἡδέως καὶ θνῄσκειν ἀμφότερα ἀρετὴ παρεῖχεν, ὡς δηλοῖ τὸ ἐπικήδειον·	ἀλλά Συβαρίτης μέν  ὑπό τρυφή καί μαλακία διά ὁ πρός ὁ καλός ὁρμή καί φιλοτιμία εἰκός φαίνω μισέω ὁ βίος ὁ μή φοβέω ὁ θάνατος ,  δέ καί ζήω ἡδύς καί ἀποθνῄσκω ἀμφότερος ἀρετή παρέχω , ὡς δηλόω ὁ ἐπικήδειος ·
407427	tlg0007.tlg021.perseus-grc2	οἵδε γάρ φησιν ἔθανον οὐ τὸ ζῇν θέμενοι καλὸν οὐδὲ τὸ θνῄσκειν, αλλὰ τὸ ταῦτα καλῶς ἀμφότερʼ ἐκτελέσαι.	ὅδε γάρ φημί  οὐ ὁ  τίθημι καλός οὐδέ ὁ ἀποθνῄσκω ,  ὁ οὗτος καλός  ἐκτελέω .
407428	tlg0007.tlg021.perseus-grc2	οὔτε γὰρ φυγὴ θανάτου μεμπτόν, ἂν ὀρέγηταί τις τοῦ βίου μὴ αἰσχρῶς, οὔτε ὑπομονὴ καλόν, εἰ μετʼ ὀλιγωρίας γίνοιτο τοῦ ζῆν.	οὔτε γάρ φυγή θάνατος μεμπτός , ἐάν  τις ὁ βίος μή αἰσχρός , οὔτε  καλός , εἰ μετά ὀλιγωρία γίγνομαι ὁ ζήω .
407429	tlg0007.tlg021.perseus-grc2	ὅθεν Ὅμηρος μέν ἀεὶ τοὺς θαρραλεωτάτους καὶ μαχιμωτάτους ἄνδρας εὖ καὶ καλῶς ὡπλισμένους ἐξάγει πρός τοὺς ἀγῶνας, οἱ δὲ τῶν Ἑλλήνων νομοθέται τὸν ῥίψασπιν κολάζουσιν, οὐ τὸν ξίφος οὐδὲ λόγχην προέμενον, διδάσκοντες ὅτι τοῦ μὴ παθεῖν κακῶς πρότερον ἢ τοῦ ποιῆσαι τοὺς πολεμίους ἑκάστῳ μέλειν προσήκει, μάλιστα δὲ ἄρχοντι πόλεως ἢ στρατεύματος.	ὅθεν Ὅμηρος μέν ἀεί ὁ  καί μάχιμος ἀνήρ εὖ καί καλός  ἐξάγω πρός ὁ ἀγών , ὁ δέ ὁ Ἕλλην νομοθέτης ὁ ῥίψασπις κολάζω , οὐ ὁ ξίφος οὐδέ λόγχη προΐημι , διδάσκω ὅτι2 ὁ μή πάσχω κακός πρότερος τίη ὁ ποιέω ὁ πολέμιος ἕκαστος μέλω προσήκω , μάλιστα δέ ἄρχω πόλις τίη στράτευμα .
407430	tlg0007.tlg021.perseus-grc2	εἰ γὰρ, ὡς Ἰφικράτης διῄρει, χερσὶ μὲν ἐοίκασιν οἱ ψιλοί, ποσὶ δὲ τὸ ἱππικόν, αὐτὴ δὲ ἡ φάλαγξ στέρνῳ καὶ θώρακι, κεφαλῇ δὲ ὁ στρατηγός, οὐχ αὐτοῦ δόξειεν ἂν ἀποκινδυνεύων παραμελεῖν καὶ θρασυνόμενος, ἀλλʼ ἁπάντων, οἷς ἡ σωτηρία γίνεται διʼ αὐτοῦ καὶ τοὐναντίον, ὅθεν ὁ Καλλικρατίδας, καίπερ ὢν τἆλλα μέγας, οὐκ εὖ πρὸς τὸν μάντιν εἶπε·	εἰ γάρ , ὡς  διαιρέω , χείρ μέν ἔοικα ὁ  , πούς δέ ὁ ἱππικός , αὐτός δέ ὁ φάλαγξ  καί θώραξ , κεφαλή δέ ὁ στρατηγός , οὐ αὐτός δοκέω ἄν ἀποκινδυνεύω παραμελέω καί θρασύνω ,  ἅπας , ὅς ὁ σωτηρία γίγνομαι  αὐτός καί ἐναντίον , ὅθεν ὁ Καλλικρατίδας , καίπερ εἰμί  μέγας , οὐ εὖ πρός ὁ μάντις λέγω ·
407431	tlg0007.tlg021.perseus-grc2	δεομένου γὰρ αὐτοῦ φυλάττεσθαι θάνατον, ὡς τῶν ἱερῶν προδηλούντων, ἔφη μὴ παρʼ·	γάρ αὐτός φυλάσσω θάνατος , ὡς ὁ ἱερόν  , φημί μή  ·
407432	tlg0007.tlg021.perseus-grc2	ἕνα εἶναι τὰν Σπάρταν.	εἰμί  Σπάρτη .
407433	tlg0007.tlg021.perseus-grc2	μαχόμενος γὰρ εἷς ἦν καὶ πλέων καὶ στρατευόμενος ὁ Καλλικρατίδας, στρατηγῶν δὲ τὴν ἁπάντων εἶχε συλλαβὼν ἐν αὑτῷ δύναμιν, ὥστε οὐκ ἦν εἷς ᾧ τοσαῦτα συναπώλλυτο.	γάρ  εἰμί καί πλέω καί στρατεύω ὁ Καλλικρατίδας , στρατηγέω δέ ὁ ἅπας ἔχω συλλαμβάνω ἐν ἑαυτοῦ δύναμις , ὥστε οὐ εἰμί  ὅς τοσοῦτος συναπόλλυμι .
407434	tlg0007.tlg021.perseus-grc2	βέλτιον δὲ Ἀντίγονος ὁ γέρων, ὅτε ναυμαχεῖν περὶ Ἄνδρον ἔμελλεν, εἰπόντος τινὸς ὡς πολὺ πλείους αἱ τῶν πολεμίων νῆες εἶεν, ἐμὲ δὲ αὐτὸν, ἔφη, πρὸς πόσας ἀντιστήσεις;	βελτίων δέ Ἀντίγονος ὁ γέρων , ὅτε ναυμαχέω περί  μέλλω , λέγω  ὡς πολύς πολύς ὁ ὁ πολέμιος ναῦς εἰμί ,  δέ αὐτός , φημί , πρός   ;
407435	tlg0007.tlg021.perseus-grc2	μέγα τὸ τῆς ἀρχῆς, ὥσπερ ἐστίν, ἀξίωμα ποιῶν μετὰ ἐμπειρίας καὶ ἀρετῆς ταττόμενον, ἧς πρῶτον ἔργον ἐστὶ σῴζειν τὸν ἅπαντα τἆλλα σῴζοντα, διὸ καλῶς ὁ Τιμόθεος, ἐπιδεικνυμένου ποτὲ τοῖς Ἀθηναίοις τοῦ Χάρητος ὠτειλάς τινας ἐν τῷ σώματι καὶ τὴν ἀσπίδα λόγχῃ διακεκομμένην, ἐγὼ δέ, εἶπεν, ὡς λίαν ᾐσχύνθην ὅτι μου πολιορκοῦντος Σάμον ἐγγὺς ἔπεσε βέλος, ὡς μειρακιωδέστερον ἐμαυτῷ χρώμενος ἢ κατὰ στρατηγοῦ καὶ ἡγεμόνα δυνάμεως τοσαύτης.	μέγας ὁ ὁ ἀρχή , ὥσπερ εἰμί , ἀξίωμα ποιέω μετά ἐμπειρία καί ἀρετή τάσσω , ὅς πρῶτος ἔργον εἰμί σῴζω ὁ ἅπας  σῴζω , διό καλός ὁ Τιμόθεος , ἐπιδείκνυμι ποτε ὁ Ἀθήναιος ὁ Χάρης ὠτειλή τις ἐν ὁ σῶμα καί ὁ ἀσπίς λόγχη  ,  δέ , λέγω , ὡς λίαν αἰσχύνω ὅτι2  πολιορκέω Σάμος ἐγγύς ἐφέζομαι βέλος , ὡς  ἐμαυτοῦ χράω2 τίη κατά στρατηγός καί ἡγεμών δύναμις τοσοῦτος .
407436	tlg0007.tlg021.perseus-grc2	ὅπου μὲν γὰρ εἷς τὰ ὅλα μεγάλην φέρει ῥοπὴν ὁ τοῦ στρατηγοῦ κίνδυνος, ἐνταῦθα καὶ χειρὶ καὶ σώματι χρηστέον ἀφειδῶς, χαίρειν φράσαντα τοῖς λέγουσιν ὡς χρὴ τὸν ἀγαθὸν στρατηγὸν μάλιστα μὲν ὑπὸ γήρως, εἰ δὲ μή, γέροντα θνῄσκειν ὅπου δὲ μικρὸν τὸ περιγινόμενον ἐκ τοῦ κατορθώματος, τὸ δὲ πᾶν συναπόλλυται σφαλέντος, οὐδεὶς ἀπαιτεῖ στρατιώτου πρᾶξιν κινδύνῳ πραττομένην στρατηγοῦ.	ὅπου μέν γάρ  ὁ ὅλος μέγας φέρω ῥοπή ὁ ὁ στρατηγός κίνδυνος , ἐνταῦθα καί χείρ καί σῶμα χράομαι ἀφειδής , χαίρω  ὁ λέγω ὡς χρή ὁ ἀγαθός στρατηγός μάλιστα μέν ὑπό γῆρας , εἰ δέ μή , γέρων ἀποθνῄσκω ὅπου δέ μικρός ὁ  ἐκ ὁ κατόρθωμα , ὁ δέ πᾶς συναπόλλυμι σφάλλω ,  ἀπαιτέω στρατιώτης πρᾶξις κίνδυνος  στρατηγός .
407437	tlg0007.tlg021.perseus-grc2	ταῦτα δέ μοι παρέστη προαναφωνῆσαι γράφοντι τὸν Πελοπίδου βίον καὶ τὸν Μαρκέλλου, μεγάλων ἀνδρῶν παραλόγως πεσόντων, καὶ γὰρ χειρὶ χρῆσθαι μαχιμώτατοι γενόμενοι, καὶ στρατηγίαις ἐπιφανεστάταις κοσμήσαντες ἀμφότεροι τὰς πατρίδας, ἔτι δὲ τῶν βαρυτάτων ἀνταγωνιστῶν ὁ μὲν Ἀννίβαν ἀήττητον ὄντα πρῶτος, ὡς λέγεται, τρεψάμενος, ὁ δὲ γῆς καὶ θαλάττης ἄρχοντας Λακεδαιμονίους ἐκ παρατάξεως νικήσας, ἠφείδησαν ἑαυτῶν, σὺν οὐδενὶ λογισμῷ προέμενοι τὸν βίον ὁπηνίκα μάλιστα τοιούτων καιρὸς ἦν ἀνδρῶν σῳζομένων καὶ ἀρχόντων·	οὗτος δέ  παρίστημι προαναφωνέω γράφω ὁ Πελοπίδης βίος καί ὁ Μάρκελλος , μέγας ἀνήρ παράλογος  , καί γάρ χείρ χράω2 μάχιμος γίγνομαι , καί   κοσμέω ἀμφότερος ὁ πατρίς , ἔτι δέ ὁ βαρύς ἀνταγωνιστής ὁ μέν Ἀννίβας ἀήσσητος εἰμί πρῶτος , ὡς λέγω ,  , ὁ δέ γῆ καί θάλασσα ἄρχων  ἐκ παράταξις νικάω ,  ἑαυτοῦ , σύν οὐδείς λογισμός προΐημι ὁ βίος ὁπηνίκα μάλιστα τοιοῦτος καιρός εἰμί ἀνήρ σῴζω καί ἄρχων ·
407438	tlg0007.tlg021.perseus-grc2	διόπερ ἡμεῖς ἑπόμενοι ταῖς ὁμοιότησι παραλλήλους ἀνεγράψαμεν αὐτῶν τοὺς βίους.	ὁ  παράλληλος ἀναγράφω αὐτός ὁ βίος .
407439	tlg0007.tlg021.perseus-grc2	Πελοπίδᾳ τῷ Ἱππόκλου γένος μὲν ἦν εὐδόκιμον ἐν Θήβαις ὥσπερ Ἐπαμεινώνδᾳ, τραφεὶς δὲ ἐν οὐσίᾳ μεγάλῃ καὶ παραλαβὼν ἔτι νέος λαμπρὸν οἶκον ὥρμησε τῶν δεομένων τοῖς ἀξίοις βοηθεῖν, ἵνα κύριος ἀληθῶς φαίνοιτο χρημάτων γεγονώς, ἀλλὰ μὴ δοῦλος.	Πελοπίδης τῷ Ἵπποκλος γένος μέν εἰμί εὐδόκιμος ἐν Θῆβαι ὥσπερ  , τρέφω δέ ἐν οὐσία μέγας καί παραλαμβάνω ἔτι νέος λαμπρός οἶκος ὁρμάω ὁ δέω ὁ ἄξιος βοηθέω , ἵνα κύριος2 ἀληθής φαίνω χρῆμα γίγνομαι , ἀλλά μή δοῦλος .
407440	tlg0007.tlg021.perseus-grc2	τῶν γὰρ πολλῶν, ὡς Ἀριστοτέλης φησίν, οἱ μὲν οὐ χρῶνται τῷ πλούτῳ διὰ μικρολογίαν, οἱ δὲ παραχρῶνταιδιʼ ἀσωτίαν, καὶ δουλεύοντες οὗτοι μὲν ἀεὶ ταῖς ἡδοναῖς, ἐκεῖνοι δὲ ταῖς ἀσχολίαις, διατελοῦσιν.	ὁ γάρ πολύς , ὡς Ἀριστοτέλης φημί , ὁ μέν οὐ χράω2 τῷ πλοῦτος διά μικρολογία , ὁ δέ παραχράομαι διʼ ἀσωτία , καί δουλεύω οὗτος μέν ἀεί ὁ ἡδονή , ἐκεῖνος δέ ὁ ἀσχολία , διατελέω .
407441	tlg0007.tlg021.perseus-grc2	οἱ μὲν οὖν ἄλλοι τῷ Πελοπίδᾳ χάριν ἔχοντες ἐχρῶντο τῇ πρὸς αὐτοὺς ἐλευθεριότητι καὶ φιλανθρωπίᾳ, μόνον δὲ τῶν φίλων τὸν Ἐπαμεινώνδαν οὐκ ἔπειθε τοῦ πλούτου μεταλαμβάνειν αὐτὸς μέντοι μετεῖχε τῆς ἐκείνου πενίας, ἐσθῆτος ἀφελείᾳ καὶ τραπέζης λιτότητι καὶ τῷ πρὸς τοὺς πόνους ἀόκνῳ καὶ κατὰ στρατείας ἀδόλῳ καλλωπιζόμενος, ὥσπερ ὁ Εὐριπίδου Καπανεύς, ᾧ βίος μὲν ἦν πολύς, ἥκιστα δὲ διʼ ὄλβον γαῦρος ἦν, αἰσχυνόμενος εἰ φανεῖται πλείοσι χρώμενος εἰς τὸ σῶμα τοῦ τὰ ἐλάχιστα κεκτημένου Θηβαίων.	ὁ μέν οὖν  τῷ Πελοπίδης χάρις ἔχω χράω2 ὁ πρός αὐτός ἐλευθεριότης καί φιλανθρωπία , μόνος δέ ὁ φίλος ὁ Ἐπαμεινώνδας οὐ πείθω ὁ πλοῦτος μεταλαμβάνω αὐτός  μετέχω ὁ ἐκεῖνος πενία , ἐσθής  καί τράπεζα λιτότης καί τῷ πρός ὁ πόνος  καί κατά στρατεία  καλλωπίζω , ὥσπερ ὁ Εὐριπίδης Καπανεύς , ὅς βίος μέν εἰμί πολύς , ἥκιστος δέ διά ὄλβος  εἰμί , αἰσχύνω εἰ φαίνω πολύς χράω2 εἰς ὁ σῶμα ὁ ὁ ἐλάχιστος   .
407442	tlg0007.tlg021.perseus-grc2	Ἐπαμεινώνδας μὲν οὖν συνήθη καὶ πατρῴαν οὖσαν αὐτῷ τὴν πενίαν ἔτι μᾶλλον εὔζωνον καὶ κοῦφον ἐποίησε φιλοσοφῶν καὶ μονότροπον βίον ἀπʼ ἀρχῆς ἑλόμενος·	Ἐπαμεινώνδας μέν οὖν  καί πατρῷος εἰμί αὐτός ὁ πενία ἔτι μᾶλλον  καί κοῦφος ποιέω φιλοσοφέω καί μονότροπος βίος ἀπό ἀρχή  ·
407443	tlg0007.tlg021.perseus-grc2	Πελοπίδᾳ δὲ ἦν μὲν γάμος λαμπρός, ἐγένοντο δὲ καὶ παῖδες, ἀλλʼ οὐδὲν ἧττον ἀμελῶν τοῦ χρηματίζεσθαι καὶ σχολάζων τῇ πόλει τὸν ἅπαντα χρόνον ἠλάττωσε τὴν οὐσίαν.	δέ εἰμί μέν γάμος λαμπρός , γίγνομαι δέ καί παῖς , ἀλλά  ἥσσων ἀμελέω ὁ χρηματίζω καί σχολάζω ὁ πόλις ὁ ἅπας χρόνος ἐλασσόω ὁ οὐσία .
407444	tlg0007.tlg021.perseus-grc2	τῶν δὲ φίλων νουθετούντων καὶ λεγόντων ὡς ἀναγκαίου πράγματος ὀλιγωρεῖ, τοῦ χρήματα ἔχειν, ἀναγκαίου, νὴ Δίὰ, Νικοδήμῳ τούτῳ, ἔφη, δείξας τινὰ χωλὸν καὶ τυφλόν.	ὁ δέ φίλος νουθετέω καί λέγω ὡς ἀναγκαῖος πρᾶγμα  , ὁ χρῆμα ἔχω , ἀναγκαῖος ,   , Νικόδημος οὗτος , φημί , δείκνυμι  χωλός καί  .
407445	tlg0007.tlg021.perseus-grc2	ἦσαν δὲ καὶ πρὸς πᾶσαν ἀρετὴν πεφυκότες ὁμοίως, πλὴν ὅτι τῷ γυμνάζεσθαι μᾶλλον ἔχαιρε Πελοπίδας, τῷ δὲ μανθάνειν Ἐπαμεινώνδας, καὶ τὰς διατριβὰς ἐν τῷ σχολάζειν ὁ μὲν περὶ παλαίστρας καὶ κυνηγέσια, ὁ δὲ ἀκούων τι καὶ φιλοσοφῶν ἐποιεῖτο.	εἰμί δέ καί πρός πᾶς ἀρετή φύω ὅμοιος ,  ὅτι2 τῷ γυμνάζω μᾶλλον  Πελοπίδης , τῷ δέ μανθάνω Ἐπαμεινώνδας , καί ὁ διατριβή ἐν τῷ σχολάζω ὁ μέν περί παλαίστρα καί  , ὁ δέ ἀκούω τι καί φιλοσοφέω ποιέω .
407446	tlg0007.tlg021.perseus-grc2	πολλῶν δὲ καὶ καλῶν ὑπαρχόντων ἀμφοτέροις πρὸς δόξαν, οὐδὲν οἱ νοῦν ἔχοντες ἡγοῦνται τηλικοῦτον ἡλίκον τὴν διὰ τοσούτων ἀγώνων καὶ στρατηγιῶν καὶ πολιτειῶν ἀνεξέλεγκτον εὔνοιαν καὶ φιλίαν ἀπʼ ἀρχῆς μέχρι τέλους ἐμμείνασαν.	πολύς δέ καί καλός ὑπάρχω ἀμφότερος πρός δόξα , οὐδείς ἕ νόος ἔχω  τηλικοῦτος  ὁ διά τοσοῦτος ἀγών καί στρατηγία καί πολιτεία ἀνεξέλεγκτος εὔνοια καί φιλία  ἀρχή μέχρι τέλος  .
407447	tlg0007.tlg021.perseus-grc2	εἰ γὰρ τις ἀποβλέψας τὴν Ἀριστείδου καὶ Θεμιστοκλέους καὶ Κίμωνος καὶ Περικλέους καὶ Νικίου καὶ Ἀλκιβιάδου πολιτείαν, ὅσων γέγονε μεστὴ διαφορῶν καὶ φθόνων καὶ ζηλοτυπιῶν πρὸς ἀλλήλους, σκέψαιτο πάλιν τὴν Πελοπίδου πρὸς Ἐπαμεινώνδαν εὐμένειαν καὶ τιμήν, τούτους ἂν ὀρθῶς καὶ δικαίως προσαγορεύσειε συνάρχοντας καὶ συστρατήγους ἢ ἐκείνους, οἳ μᾶλλον ἀλλήλων ἢ τῶν πολεμίων ἀγωνιζόμενοι περιεῖναι διετέλεσαν, αἰτία δὲ ἀληθινὴ μὲν ἦν ἡ ἀρετή, διʼ ἣν οὐ δόξαν, οὐ πλοῦτον ἀπὸ τῶν πράξεων μετιόντες, οἷς ὁ χαλεπὸς καὶ δύσερις ἐμφύεται φθόνος, ἀλλʼ ἔρωτα θεῖον ἀπʼ ἀρχῆς ἐρασθέντες ἀμφότεροι τοῦ τὴν πατρίδα λαμπροτάτην καὶ μεγίστην ἐφʼ ἑαυτῶν ἰδεῖν γενομένην, ὥσπερ ἰδίοις ἐπὶ τοῦτο τοῖς αὑτῶν ἐχρῶντο κατορθώμασιν.	εἰ γάρ τις ἀποβλέπω ὁ Ἀριστείδης καί Θεμιστοκλέης καί Κίμων καί Περικλῆς καί Νικίας καί Ἀλκιβιάδης πολιτεία , ὅσος γίγνομαι μεστός διαφορέω καί φθόνος καί  πρός ἀλλήλων , σκοπέω πάλιν ὁ Πελοπίδης πρός Ἐπαμεινώνδας εὐμένεια καί τιμή , οὗτος ἐάν ὀρθός καί δίκαιος  συνάρχω καί  ἤ ἐκεῖνος , ὁ μᾶλλον ἀλλήλων ἤ ὁ πολέμιος   διατελέω , αἰτία δέ  μέν εἰμί ὁ ἀρετή , διό ὅς οὐ δόξα , οὐ πλοῦτος ἀπό ὁ πρᾶξις  , ὅς ὁ χαλεπός καί  ἐμφύω φθόνος ,  ἔρως θεῖος ἀπό ἀρχή ἐράω ἀμφότερος ὁ ὁ πατρίς λαμπρός καί μέγας  ἑαυτοῦ ὁράω γίγνομαι , ὥσπερ ἴδιος ἐπί οὗτος ὁ ἑαυτοῦ χράω2 κατόρθωμα .
407448	tlg0007.tlg021.perseus-grc2	οὐ μὴν ἀλλʼ οἵ γε πολλοὶ νομίζουσιν αὐτοῖς τὴν σφοδρὰν φιλίαν ἀπὸ τῆς ἐν Μαντινείᾳ γενέσθαι στρατείας, ἣν συνεστρατεύσαντο Λακεδαιμονίοις, ἔτι φίλοις καὶ συμμάχοις οὖσι, πεμφθείσης ἐκ Θηβῶν βοηθείας, τεταγμένοι γὰρ ἐν τοῖς ὁπλίταις μετʼ ἀλλήλων καὶ μαχόμενοι πρὸς τοὺς Ἀρκάδας, ὡς ἐνέδωκε τὸ κατʼ αὐτοὺς κέρας τῶν Λακεδαιμονίων καὶ τροπὴ τῶν πολλῶν ἐγεγόνει, συνασπίσαντες ἠμύναντο τοὺς ἐπιφερομένους·	οὐ μήν  ὁ γε πολύς νομίζω αὐτός ὁ σφοδρός φιλία ἀπό ὁ ἐν Μαντίνεια γίγνομαι στρατεία , ὅς συστρατεύω  , ἔτι φίλος καί σύμμαχος εἰμί , πέμπω ἐκ Θῆβαι βοήθεια , τάσσω γάρ ἐν ὁ ὁπλίτης μετά ἀλλήλων καί  πρός ὁ Ἀρκάς , ὡς ἐνδίδωμι ὁ κατά αὐτός κέρας ὁ  καί τροπή ὁ πολύς γίγνομαι , συνασπίζω ἀμύνω ὁ ἐπιφέρω ·
