id	filename	tokens	lemmas
1229871	tlg0551.tlg011.perseus-grc2	ὅτι Ῥωμαῖοι τοῦ Φιλίππου τοῦ Μακεδόνος τοῦ πολεμήσαντος αὐτοῖς πέρι πάμπαν ἐπολυπραγμόνουν οὐδέν, οὐδὲ σφίσιν ἐνθύμιος ἦν ὅλως πονουμένης ἔτι τῆς Ἰταλίας ὑπὸ Ἀννίβου τοῦ Καρχηδονίων στρατηγοῦ, καὶ αὐτοὶ μεγάλοις στρατοῖς Λιβύην καὶ Καρχηδόνα καὶ Ἰβηρίαν περικαθήμενοι, καὶ καθιστάμενοι Σικελίαν.	ὅτι2  ὁ Φίλιππος ὁ  ὁ πολεμέω αὐτός περί πάμπαν πολυπραγμονέω  , οὐδέ σφεῖς ἐνθύμιος εἰμί ὅλος πονέω ἔτι ὁ Ἰταλία ὑπό Ἀννίβας ὁ  στρατηγός , καί αὐτός μέγας  Λιβύη καί Καρχηδών καί Ἰβηρία  , καί καθίστημι Σικελία .
1229872	tlg0551.tlg011.perseus-grc2	αὐτὸς δὲ Φίλιππος ἀρχῆς ἐπιθυμίᾳ μείζονος, οὐδέν τι προπαθών, ἔπεμπε πρὸς Ἀννίβαν ἐς τὴν Ἰταλίαν πρέσβεις, ὧν ἡγεῖτο Ξενοφάνης, ὑπισχνούμενος αὐτῷ συμμαχήσειν ἐπὶ τὴν Ἰταλίαν, εἰ κἀκεῖνος αὐτῷ σύνθοιτο κατεργάσασθαι τὴν Ἑλλάδα.	αὐτός δέ Φίλιππος ἀρχή ἐπιθυμία μέγας ,  τι προπάσχω , πέμπω πρός Ἀννίβας εἰς ὁ Ἰταλία πρέσβυς , ὅς  Ξενοφάνης ,  αὐτός συμμαχέω ἐπί ὁ Ἰταλία , εἰ ἐκεῖνος αὐτός συντίθημι κατεργάζομαι ὁ Ἑλλάς .
1229873	tlg0551.tlg011.perseus-grc2	συμβάντος δʼ ἐς ταῦτα τοῦ Ἀννίβου καὶ ἐπὶ τῇ συνθήκῃ ὀμόσαντος, πρέσβεις τε ἀντιπέμψαντος ἐπὶ τοὺς ὅρκους τοῦ Φιλίππου, Ῥωμαίων τριήρης ἔλαβε τοὺς ἑκατέρων πρέσβεις ἀναπλέοντας, καὶ ἐς Ῥώμην ἐκόμισεν.	συμβαίνω δέ εἰς οὗτος ὁ Ἀννίβας καί ἐπί ὁ συνθήκη ὄμνυμι , πρέσβυς τε ἀντιπέμπω ἐπί ὁ ὅρκος ὁ Φίλιππος ,   λαμβάνω ὁ ἑκάτερος πρέσβυς ἀναπλέω , καί εἰς Ῥώμη κομίζω .
1229874	tlg0551.tlg011.perseus-grc2	ἐφʼ ᾧ Φίλιππος ἀγανακτῶν Κερκύρᾳ προσέβαλεν, ἣ Ῥωμαίοις συνεμάχει.	ὅς Φίλιππος  Κέρκυρα προσβάλλω , ὁ  συμμαχέω .
1229875	tlg0551.tlg011.perseus-grc2	ότι ἐνῆγε τοὺς Ῥωμαίους τὰ Σιβύλλεια εἰς τὸν Φιλίππου πόλεμον.	ἐνάγω ὁ  ὁ  εἰς ὁ Φίλιππος πόλεμος .
1229876	tlg0551.tlg011.perseus-grc2	ἔστι δὲ ταῦτα·	εἰμί δέ οὗτος ·
1229877	tlg0551.tlg011.perseus-grc2	αὐχοῦντες βασιλεῦσι Μακηδόνες Ἀργεάδῃσιν, ὑμῖν κοιρανέων ἀγαθὸν καὶ πῆμα Φίλιππος.	αὐχέω βασιλεύς  Ἀργεάδης ,  κοιρανέω ἀγαθός καί πῆμα Φίλιππος .
1229878	tlg0551.tlg011.perseus-grc2	ἤτοι ὁ μὲν πρότερος πόλεσιν λαοῖσί τʼ ἄνακτας θήσει, ὁ δʼ ὁπλότερος τιμὴν ἀπὸ πᾶσαν ὀλέσσει, δμηθεὶς δʼ ἑσπερίοισιν ὑπʼ ἀνδράσιν ἐνθάδʼ ὀλεῖται.	ἤτοι ὁ μέν πρότερος πόλις λαός  ἄναξ τίθημι , ὁ δέ ὁπλότερος τιμή ἀπό πᾶς ὄλλυμι , δαμάζω δέ ἑσπέριος ὑπό ἀνήρ  ὄλλυμι .
1229879	tlg0551.tlg011.perseus-grc2	ὅτι Πτολεμαίου τοῦ βασιλεύοντος Αἰγύπτου πρέσβεις, καὶ σὺν αὐτοῖς ἕτεροι παρά τε Χίων καὶ Μιτυληναίων καὶ Ἀμυνάνδρου τοῦ Ἀθαμάνων βασιλέως, δίς, ἔνθα περ οἱ Αἰτωλοὶ τὰς πόλεις ἐπισκεψομένας ἐκάλουν, συνῆλθον ἐπὶ διαλλαγῇ Ῥωμαίων καὶ Αἰτωλῶν καὶ Φιλίππου.	ὅτι2 Πτολεμαῖος ὁ βασιλεύω Αἴγυπτος πρέσβυς , καί σύν αὐτός ἕτερος παρά τε  καί  καί Ἀμύνανδρος ὁ Ἀθαμάν βασιλεύς , δίς , ἔνθα περ ἕ  ὁ πόλις  καλέω , συνέρχομαι ἐπί διαλλαγή  καί Αἰτωλός καί Φίλιππος .
1229880	tlg0551.tlg011.perseus-grc2	Σουλπικίου δʼ εἰπόντος οὐκ εἶναι κυρίου περὶ τῆς εἰρήνης τι κρῖναι, καὶ ἐς τὴν βουλὴν κρύφα ἐπιστέλλοντος ὅτι Ῥωμαίοις συμφέρει πολεμεῖν Αἰτωλοὺς Φιλίππῳ, ἡ μὲν βουλὴ τὰς συνθήκας ἐκώλυσε, καὶ τοῖς Αἰτωλοῖς ἔπεμπε συμμαχίαν πεζοὺς μυρίους καὶ ἱππέας χιλίους, μεθʼ ὧν οἱ Αἰτωλοὶ κατέλαβον Ἀμβρακίαν, ἣν οὐ πολὺ ὕστερον αὐτῶν Φίλιππος ἀποπλευσάντων ἀνέλαβεν.	Σουλπίκιος δέ λέγω οὐ εἰμί  περί ὁ εἰρήνη τις κρίνω , καί εἰς ὁ βουλή κρύφα ἐπιστέλλω ὅτι2  συμφέρω πολεμέω  Φίλιππος , ὁ μέν βουλή ὁ συνθήκη κωλύω , καί ὁ Αἰτωλός πέμπω συμμαχία πεζός μυρίος καί ἱππεύς χίλιοι , μετά ὅς ὁ  καταλαμβάνω Ἀμβρακία , ὅς οὐ πολύς ὕστερον αὐτός Φίλιππος ἀποπλέω ἀναλαμβάνω .
1229881	tlg0551.tlg011.perseus-grc2	οἱ δὲ πρέσβεις αὖθις συνῆλθον, καὶ πολλὰ φανερῶς ἔλεγον, ὅτι Φίλιππος καὶ Αἰτωλοὶ διαφερόμενοι τοὺς Ἕλληνας ἐς δουλείαν Ῥωμαίοις ὑποβάλλουσιν, ἐθίζοντες αὐτοὺς τῆς Ἑλλάδος θαμινὰ πειρᾶσθαι.	ὁ δέ πρέσβυς αὖθις συνέρχομαι , καί πολύς φανερός λέγω , ὅτι2 Φίλιππος καί   ὁ Ἕλλην εἰς δουλεία  ὑποβάλλω , ἐθίζω αὐτός ὁ Ἑλλάς θαμινός πειράω .
1229882	tlg0551.tlg011.perseus-grc2	ἐφʼ οἷς ὁ μὲν Σουλπίκιος ἀντιλέξων ἀνίστατο, τὸ δὲ πλῆθος οὐκ ἤκουσεν, ἀλλʼ ἐκεκράγεσαν τοὺς πρέσβεις εὖ λέγειν.	ὅς ὁ μέν Σουλπίκιος  ἀνίστημι , ὁ δέ πλῆθος οὐ ἀκούω ,   ὁ πρέσβυς εὖ λέγω .
1229883	tlg0551.tlg011.perseus-grc2	καὶ τέλος Αἰτωλοί τε πρῶτοι κατὰ σφᾶς, ἄνευ Ῥωμαίων, Φιλίππῳ συνέβησαν, καὶ πρέσβεις αὐτοῦ Φιλίππου καὶ Ῥωμαίων ἐπὶ διαλλαγαῖς ἀφίκοντο ἐς Ῥώμην.	καί τέλος  τε πρῶτος κατά σφεῖς , ἄνευ  , Φίλιππος συμβαίνω , καί πρέσβυς αὐτός Φίλιππος καί  ἐπί διαλλαγή ἀφικνέομαι εἰς Ῥώμη .
1229884	tlg0551.tlg011.perseus-grc2	καὶ ἐγένοντο συνθῆκαι Ῥωμαίοις καὶ Φιλίππῳ, μηδετέρους ἀδικεῖν τοὺς ἑκατέρωθεν φίλους.	καί γίγνομαι συνθήκη  καί Φίλιππος , μηδέτερος ἀδικέω ὁ ἑκατέρωθεν φίλος .
1229885	tlg0551.tlg011.perseus-grc2	ἐς μὲν δὴ τοῦτʼ ἔληξεν ἡ Φιλίππου καὶ Ῥωμαίων ἐς ἀλλήλους πεῖρα πρώτη, καὶ τὰς συνθήκας οὐδέτεροι βεβαίους, οὐδʼ ἀπʼ εὐνοίας, ἐδόκουν πεποιῆσθαι.	εἰς μέν δή  λήγω ὁ Φίλιππος καί  εἰς ἀλλήλων πεῖρα πρῶτος , καί ὁ συνθήκη οὐδέτερος βέβαιος ,  ἀπό εὔνοια , δοκέω ποιέω .
1229886	tlg0551.tlg011.perseus-grc2	ὅτι μετʼ οὐ πολὺ Φίλιππος μὲν τῶν ὑπηκόων τοῖς ἐπὶ θαλάσσης στόλον ἐπαγγείλας, Σάμον καὶ Χίον εἷλε, καὶ μέρος τῆς Ἀττάλου γῆς ἐπόρθησε, καὶ αὐτῆς ἀπεπείρασε Περγάμου, μὴ φειδόυενος ἱερῶν ἢ τάφων, τήν τε Ῥοδίων περαίαν ἐδῄου διαλλακτήρων οἱ γεγονότων, καὶ ἑτέρῳ μέρει στρατοῦ τὴν Ἀττικὴν ἐλυμαίνετο καὶ τὰς Ἀθήνας ἐπολιόρκει, ὡς οὐδὲν τῶνδε Ῥωμαίοις προσηκόντων.	ὅτι2 μετά οὐ πολύς Φίλιππος μέν ὁ ὑπήκοος ὁ ἐπί θάλασσα στόλος ἐπαγγέλλω , Σάμος καί Χίος αἱρέω , καί μέρος ὁ Ἄτταλος γῆ πορθέω , καί αὐτός ἀποπειράομαι Πέργαμον , μή  ἱερόν ἤ τάφος , ὁ τε  περαῖος δηϊόω διαλλακτήρ ὁ γίγνομαι , καί ἕτερος μέρος στρατός ὁ Ἀττική λυμαίνομαι καί ὁ Ἀθήνη πολιορκέω , ὡς  ὅδε  προσήκω .
1229887	tlg0551.tlg011.perseus-grc2	λόγος τε ἦν ὅτι Φίλιππος καὶ Ἀντίοχος ὁ Σύρων βασιλεὺς ὑπόσχοιντο ἀλλήλοις, Ἀντιόχῳ μὲν ὁ Φίλιππος συστρατεύσειν ἐπί τε Αἴγυπτον καὶ ἐπὶ Κύπρον, ὧν τότε ἦρχεν ἔτι παῖς ὢν Πτολεμαῖος ὁ τέταρτος, ᾧ φιλοπάτωρ ἐπώνυμον ἦν, Φιλίππῳ δʼ Ἀντίοχος ἐπὶ Κυρήνην καὶ τὰς Κυκλάδας νήσους καὶ Ἰωνίαν.	λόγος τε εἰμί ὅτι2 Φίλιππος καί Ἀντίοχος ὁ  βασιλεύς  ἀλλήλων , Ἀντίοχος μέν ὁ Φίλιππος συστρατεύω ἐπί τε Αἴγυπτος καί ἐπί Κύπρος , ὅς τότε ἄρχω ἔτι παῖς εἰμί Πτολεμαῖος ὁ τέταρτος , ὅς φιλοπάτωρ ἐπώνυμος εἰμί , Φίλιππος δέ Ἀντίοχος ἐπί Κυρήνη καί ὁ Κυκλάδες νῆσος καί Ἰωνία .
1229888	tlg0551.tlg011.perseus-grc2	καὶ τήνδε τὴν δόξαν, ἐκταράσσουσαν ἅπαντας Ῥόδιοι μὲν Ῥωμαίοις ἐμήνυσαν, ἐπὶ δὲ τοῖς Ῥοδίων Ἀθηναίων πρέσβεις ᾐτιῶντο Φίλιππον τῆς πολιορκίας.	καί ὅδε ὁ δόξα , ἐκταράσσω ἅπας  μέν  μηνύω , ἐπί δέ ὁ Ῥόδιος Ἀθήναιος πρέσβυς αἰτιάομαι Φίλιππος ὁ πολιορκία .
1229889	tlg0551.tlg011.perseus-grc2	καὶ Αἰτωλοὶ μεταγιγνώσκοντες κατηγόρουν ὡς καὶ περὶ σφᾶς ἀπίστου γεγονότος, ἠξίουν τε αὖθις ἐς τοὺς Ῥωμαίων συμμάχους ἐγγραφῆναι.	καί  μεταγιγνώσκω κατηγορέω ὡς καί περί σφεῖς ἄπιστος γίγνομαι , ἀξιόω τε αὖθις εἰς ὁ  σύμμαχος ἐγγράφω .
1229890	tlg0551.tlg011.perseus-grc2	Ῥωμαῖοι δʼ Αἰτωλοῖς ἐμέμψαντο τῆς οὐ πρὸ πολλοῦ μεταβολῆς, πρέσβεις δʼ ἐς τοὺς βασιλέας ἔπεμπον, οἳ προηγόρευον αὐτοῖς Ἀντίοχον μὲν Αἰγύπτῳ μὴ ἐπιχειρεῖν, Φίλιππον δὲ μηδὲν ἐς Ῥοδίους ἢ Ἀθηναίους ἢ Ἄτταλον ἢ ἐς ἄλλον τινὰ Ῥωμαίων φίλον ἁμαρτάνειν.	δέ Αἰτωλός μέμφομαι ὁ οὐ πρό πολύς μεταβολή , πρέσβυς δέ εἰς ὁ βασιλεύς πέμπω , ὁ προαγορεύω αὐτός Ἀντίοχος μέν Αἴγυπτος μή ἐπιχειρέω , Φίλιππος δέ  εἰς  τίη Ἀθήναιος τίη Ἄτταλος ἤ εἰς ἄλλος   φίλος ἁμαρτάνω .
1229891	tlg0551.tlg011.perseus-grc2	τούτοις ὁ Φίλιππος ἀπεκρίνατο Ῥωμαίοις ἕξειν καλῶς, ἂν ἐμμένωσιν ᾗ συνέθεντο πρὸς αὐτὸν εἰρήνῃ.	οὗτος ὁ Φίλιππος ἀποκρίνω  ἔχω καλός , ἐάν ἐμμένω ὅς συντίθημι πρός αὐτός εἰρήνη .
1229892	tlg0551.tlg011.perseus-grc2	οὕτω μὲν αἱ γενόμεναι σπονδαὶ ἐλέλυντο, καὶ στρατιὰ Ῥωμαίων ἐς τὴν Ἑλλάδα ἠπείγετο, στρατηγοῦντος Ποπλίου καὶ ναυαρχοῦντος Λευκίου.	οὕτως μέν ὁ γίγνομαι σπονδή  , καί στρατιά  εἰς ὁ Ἑλλάς ἐπείγω , στρατηγέω Πόπλιος καί ναυαρχέω Λεύκιος .
1229893	tlg0551.tlg011.perseus-grc2	ὅτι ὁ Φίλιππος ὁ Μακεδόνων βασιλεὺς τῷ Φλαμινίνῳ σητει, συναγόντων αὐτοὺς Ἠπειρωτῶν πρέσβεων.	ὅτι2 ὁ Φίλιππος ὁ  βασιλεύς τῷ   , συνάγω αὐτός Ἠπειρώτης πρέσβυς .
1229894	tlg0551.tlg011.perseus-grc2	ὡς δὲ ὁ Φλαμινῖνος Φίλιππον ἐκέλευσεν ἐκστῆναι τῆς Ἑλλάδος οὐ Ῥωμαίοις ἀλλὰ ταῖς πόλεσιν αὐταῖς, καὶ τὰς βλάβας ταῖς προειρημέναις ἀποδοθῆναι, ὁ μὲν Φίλιππος τὰ μὲν ποιμὴν ὑπέσχετο στρατὸν εὔζωνον ἄξειν ὁδὸν ἀτριβῆ τρισὶν ἡμέραις.	ὡς δέ ὁ Φλαμινῖνος Φίλιππος κελεύω ἐξίστημι ὁ Ἑλλάς οὐ  ἀλλά ὁ πόλις αὐτός , καί ὁ βλάβη ὁ προαγορεύω ἀποδίδωμι , ὁ μέν Φίλιππος ὁ μέν ποιμήν ὑπισχνέομαι στρατός εὔζωνος ἄγω ὁδός ἀτριβής  ἡμέρα .
1229895	tlg0551.tlg011.perseus-grc2	ὅτι Λεύκιος Κοΐντιος ἐς τὸν τῶν Ἀχαιῶν σύλλογον ἀπέστειλε πρέσβεις, οἳ μετὰ Ἀθηναίων καὶ Ῥοδίων ἔπειθον αὐτοὺς μεταθέσθαι πρὸς σφᾶς ἀπὸ τοῦ Φιλίππου, διεπρεσβεύετο δὲ καὶ Φίλιππος αἰτῶν βοήθειαν ὡς συμμάχους.	ὅτι2 Λεύκιος  εἰς ὁ ὁ Ἀχαιός σύλλογος ἀποστέλλω πρέσβυς , ὁ μετά Ἀθήναιος καί  πείθω αὐτός μετατίθημι πρός σφεῖς ἀπό ὁ Φίλιππος , διαπρεσβεύομαι δέ καί Φίλιππος  βοήθεια ὡς  .
1229896	tlg0551.tlg011.perseus-grc2	οἱ δὲ ἐνοχλούμενοι μὲν οἰκείῳ καὶ γείτονι πολέμῳ Νάβιδος τοῦ Λακεδαιμονίων τυράννου, διεστῶτες δὲ ταῖς γνώμαις ἠπόρουν, καὶ οἱ πλείονες ᾑροῦντο τὰ Φιλίππου καὶ ἀπεστρέφοντο Ῥωμαίους διά τινα ἐς τὴν Ἑλλάδα Σουλπικίου τοῦ στρατηγοῦ παρανομήματα.	ὁ δέ ἐνοχλέω μέν  καί  πόλεμος  ὁ  τύραννος , διΐστημι δέ ὁ γνώμη ἀπορέω2 , καί ὁ  αἱρέω ὁ Φίλιππος καί ἀποστρέφω  διά  εἰς ὁ Ἑλλάς Σουλπίκιος ὁ στρατηγός παρανόμημα .
1229897	tlg0551.tlg011.perseus-grc2	ἐγκειμένων δὲ βιαίως τῶν ῥωμαϊζόντων, οἱ πολλοὶ τῆς ἐκκλησίας ἀπεχώρουν δυσχεραίνοντες, καὶ οἱ λοιποὶ διὰ τὴν ὀλιγότητα ἐκβιασθέντες συνέθεντο τῷ Λευκίῳ, καὶ εὐθὺς ἠκολούθουν ἐπὶ Κόρινθον μηχανήματα φέροντες.	δέ βίαιος ὁ  , ὁ πολύς ὁ ἐκκλησία ἀποχωρέω δυσχεραίνω , καί ὁ λοιπός διά ὁ ὀλιγότης ἐκβιάζω συντίθημι τῷ  , καί εὐθύς ἀκολουθέω ἐπί Κόρινθος μηχάνημα φέρω .
1229898	tlg0551.tlg011.perseus-grc2	ὅτι Φλαμινῖνος αὖθις συνῆλθεν ἐς λόγους Φιλίππῳ κατὰ τὸν Μηλιέα κόλπον, ἔνθα κατηγορούντων τοῦ Φιλίππου Ῥοδίων καὶ Αἰτωλῶν καὶ Ἀμυνάνδρου τοῦ Ἀθαμᾶνος ἐκέλευσε Φίλιππον ἐξάγειν τὰς φρουρὰς ἐκ Φωκίδος, καὶ πρέσβεις ἐς Ῥώμην ἀμφοτέρους ἀποστεῖλαι.	ὅτι2 Φλαμινῖνος αὖθις συνέρχομαι εἰς λόγος Φίλιππος κατά ὁ Μηλιεύς κόλπος , ἔνθα κατηγορέω ὁ Φίλιππος  καί Αἰτωλός καί Ἀμύνανδρος ὁ Ἀθαμάν κελεύω Φίλιππος ἐξάγω ὁ φρουρά ἐκ Φωκίς , καί πρέσβυς εἰς Ῥώμη ἀμφότερος ἀποστέλλω .
1229899	tlg0551.tlg011.perseus-grc2	γενομένων δὲ τούτων, οἱ μὲν Ἕλληνες ἐν τῇ βουλῇ τῇ Ῥωμαίων ἠξίουν τὸν Φίλιππον ἐξαγαγεῖν ἐκ τῆς Ἑλλάδος τὰς τρεῖς φρουρὰς ἃς αὐτὸς πέδας ἐκάλει τῆς Ἑλλάδος, τὴν μὲν ἐν Χαλκίδι·	γίγνομαι δέ οὗτος , ὁ μέν Ἕλλην ἐν ὁ βουλή ὁ  ἀξιόω ὁ Φίλιππος ἐξάγω ἐκ ὁ Ἑλλάς ὁ  φρουρά ὅς αὐτός πέδη καλέω ὁ Ἑλλάς , ὁ μέν ἐν Χαλκίς ·
1229900	tlg0551.tlg011.perseus-grc2	Βοιωτοῖς καὶ Εὐβοεῦσι καὶ Λοκροῖς ἐπικειμένην, τὴν δὲ ἐν Κορίνθῳ καθάπερ πύλαις τὴν Πελοπόννησον ἀποκλείουσαν, καὶ τρίτην ἐν Δημητριάδι τὴν Αἰτωλοῖς καὶ Μάγνησιν ἐφεδρεύουσαν·	Βοιωτός καί Εὐβοεύς καί   , ὁ δέ ἐν Κόρινθος καθά πύλη ὁ Πελοπόννησος ἀποκλείω , καί τρίτος ἐν Δημητριάς ὁ  καί Μάγνης ἐφεδρεύω ·
1229901	tlg0551.tlg011.perseus-grc2	ἡ δὲ βουλὴ τοὺς Φιλίππου πρέσβεις ἤρετο τί φρονοίη περὶ τῶνδε τῶν φρουρῶν ὁ βασιλεύς, ἀποκριναμένων δὲ ἀγνοεῖν, Φλαμινῖνον ἔφη κρινεῖν, καὶ πράξειν ὅ τι ἂν δίκαιον ἡγῆται.	ὁ δέ βουλή ὁ Φίλιππος πρέσβυς αἴρω τίς φρονέω περί ὅδε ὁ  ὁ βασιλεύς ,  δέ ἀγνοέω , Φλαμινῖνος φημί κρίνω , καί πράσσω  τι ἀνά δίκαιος  .
1229902	tlg0551.tlg011.perseus-grc2	οὕτω μὲν οἱ πρέσβεις ἐκ Ῥώμης ἐπανῄεσαν, Φλαμινῖνος δὲ καὶ Φίλιππος ἐς οὐδὲν συμβαίνοντες ἀλλήλοις αὖθις ἐς πόλεμον καθίσταντο.	οὕτως μέν ὁ πρέσβυς ἐκ Ῥώμη ἐπάνειμι , Φλαμινῖνος δέ καί Φίλιππος εἰς  συμβαίνω ἀλλήλων αὖθις εἰς πόλεμος καθίστημι .
1229903	tlg0551.tlg011.perseus-grc2	ὅτι ἡττηθεὶς πάλιν ὁ Φίλιππος περὶ συμβάσεων ἐπεκηρυκεύετο πρὸς Φλαμινῖνον, ὁ δʼ αὖθις αὐτῷ συνελθεῖν ἐς λόγους συνεχώρει, πολλὰ μὲν τῶν Αἰτωλῶν δυσχεραινόντων, καὶ διαβαλλόντων αὐτὸν ἐς δωροδοκίαν, καὶ καταγιγνωσκόντων τῆς ἐς ἅπαντα εὐχεροῦς μεταβολῆς, ἡγούμενος δʼ οὔτε Ῥωμαίοις συμφέρειν οὔτε τοῖς Ἕλλησι Φιλίππου καθαιρεθέντος ἐπιπολάσαι τὴν Αἰτωλῶν βίαν.	ὅτι2  πάλιν ὁ Φίλιππος περί σύμβασις ἐπικηρυκεύομαι πρός Φλαμινῖνος , ὁ δέ αὖθις αὐτός συνέρχομαι εἰς λόγος συγχωρέω , πολύς μέν ὁ Αἰτωλός δυσχεραίνω , καί διαβάλλω αὐτός εἰς δωροδοκία , καί καταγιγνώσκω ὁ εἰς ἅπας  μεταβολή ,  δέ οὔτε  συμφέρω οὔτε ὁ Ἕλλην Φίλιππος καθαιρέω ἐπιπολάζω ὁ Αἰτωλός βία .
1229904	tlg0551.tlg011.perseus-grc2	τάχα δʼ αὐτὸν καὶ τὸ παράδοξον τῆς νίκης ἀγαπᾶν ἐποίει.	τάχα δέ αὐτός καί ὁ παράδοξος ὁ νίκη ἀγαπάω ποιέω .
1229905	tlg0551.tlg011.perseus-grc2	συνθέμενος δὲ χωρίον οἷ τὸν Φίλιππον ἐπελθεῖν ἔδει τοὺς συμμάχους ἐκέλευσε γνώμην προαποφήνασθαι κατὰ πόλεις.	συντίθημι δέ χωρίον  ὁ Φίλιππος ἐπέρχομαι δέω ὁ σύμμαχος κελεύω γνώμη προαποφαίνω κατά πόλις .
1229906	tlg0551.tlg011.perseus-grc2	τὰ μὲν δὴ παρὰ τῶν ἄλλων φιλάνθρωπα ἦν, τό τε τῆς τύχης ἄδηλον ἐξ ὧν ἔπαθεν ὁ Φίλιππος ὑφορωμένων, καὶ τὸ πταῖσμα τοῦτο οὐ κατʼ ἀσθένειαν ἀλλὰ πλέον ἐκ συντυχίας αὐτὸν παθεῖν ἡγουμένων·	ὁ μέν δή παρά ὁ ἄλλος  εἰμί , ὁ τε ὁ τύχη ἄδηλος ἐκ ὅς πάσχω ὁ Φίλιππος ὑφοράω , καί ὁ πταῖσμα οὗτος οὐ  ἀσθένεια ἀλλά πλέω ἐκ συντυχία αὐτός πάσχω  ·
1229907	tlg0551.tlg011.perseus-grc2	Ἀλέξανδρος δὲ ὁ τῶν Αἰτωλῶν πρόεδρος ἀγνοεῖν ἔφη τὸν Φλαμινῖνον ὅτι μηδὲν ἄλλο μήτε Ῥωμαίοις μήθʼ Ἕλλησι συνοίσει πλὴν ἐξαιρεθῆναι τὴν ἀρχὴν τὴν Φιλίππου.	Ἀλέξανδρος δέ ὁ ὁ   ἀγνοέω φημί ὁ Φλαμινῖνος ὅτι2  ἄλλος μήτε  μήτε Ἕλλην συμφέρω πλήν ἐξαιρέω ὁ ἀρχή ὁ Φίλιππος .
1229908	tlg0551.tlg011.perseus-grc2	ὁ δὲ Ἀλέξανδρον ἀγνοεῖν ἔφη τὴν Ῥωμαιων φύσιν, οἳ οὐδένα πω τῶν ἐχθρῶν εὐθὺς ἀπʼ ἀρχῆς ἀνέτρεψαν, ἀλλὰ πολλῶν ἐς αὐτοὺς ἁμαρτόντων, καὶ Καρχηδονίων ἔναγχος, ἐφείσαντο, τὰ σφέτερα αὐτοῖς ἀποδόντες καὶ φίλους ποιησάμενοι τους ἠδικηκότας.	ὁ δέ Ἀλέξανδρος ἀγνοέω φημί ὁ  φύσις , ὁ  πω ὁ ἐχθρός εὐθύς ἀπό ἀρχή ἀνατρέπω , ἀλλά πολύς εἰς αὐτός  , καί   , φείδομαι , ὁ σφέτερος αὐτός ἀποδίδωμι καί φίλος ποιέω  ἀδικέω .
1229909	tlg0551.tlg011.perseus-grc2	ἀγνοεῖς δʼ, ἔφη, καὶ τοῦθʼ, ὅτι τοῖς Ἕλλησιν ἔθνη πολλά, ὅσα βάρβαρα τὴν Μακεδονίαν περικάθηται, εἴ τις ἐξέλοι τοὺς Μακεδόνων βασιλέας, ἐπιδραμεῖται ῥᾳδίως.	ἀγνοέω δέ , φημί , καί  , ὅτι2 ὁ Ἕλλην ἔθνος πολύς , ὅσος βάρβαρος ὁ Μακεδονία  , εἰ τις  ὁ  βασιλεύς ,  ῥᾴδιος .
