id	filename	tokens	lemmas
670318	tlg0527.tlg011.opp-grc2	ὅτι παρέβην τὸν λόγον Κυρίου καὶ τὸ ῥῆμά σου, ὅτι ἐφοβήθην τὸν λαὸν καὶ ἤκουσα τῆς φωνῆς αὐτῶν.	ὅτι2 παραβαίνω ὁ λόγος  καί ὁ ῥῆμα  , ὅτι2 φοβέω ὁ λαός καί ἀκούω ὁ φωνή αὐτός .
670319	tlg0527.tlg011.opp-grc2	καὶ νῦν ἄρον δὴ τὸ ἁμάρτημά μου καὶ ἀνάστρεψον μετ’ ἐμοῦ, καὶ προσκυνήσω κυρίῳ τῷ θεῷ σου.	καί νῦν  δή ὁ ἁμάρτημα ἐγώ καί  μετά ἐμός , καί προσκυνέω κύριος2 ὁ θεός  .
670320	tlg0527.tlg011.opp-grc2	καὶ εἶπεν Σαμουὴλ πρὸς Σαούλ οὐκ ἀναστρέφω μετὰ σοῦ, ὅτι ἐξουδένωσας τὸῥ’ κυρίου, καὶ ἐξουδενώσει σε κύριος τοῦ μὴ εἶναι βασιλέα ἐπὶ τὸν Ἰσραήλ.	καί λέγω  πρός  οὐ ἀναστρέφω μετά σός , ὅτι2  ὁ ῥ’  , καί  σύ κύριος2 ὁ μή εἰμί βασιλεύς ἐπί ὁ  .
670321	tlg0527.tlg011.opp-grc2	καὶ ἐπέστρεψεν Σαμουὴλ τὸ πρόσωπον αὐτοῦ τοῦ ἀπελθεῖν, καὶ ἐκράτησεν Σαοὺλ τοῦ πτερυγίου τῆς διπλοίδος αὐτοῦ καὶ διέρρηξεν αὐτό.	καί ἐπιστρέφω  ὁ πρόσωπον αὐτός ὁ ἀπέρχομαι , καί κρατέω  ὁ  ὁ  αὐτός καί διαρρήγνυμι αὐτός .
670322	tlg0527.tlg011.opp-grc2	καὶ εἶπεν πρὸς αὐτὸν Σαμουήλ Διέρρηξεν κύριος τὴν βασιλείαν σου ἀπὸ Ἰσραὴλ ἐκ χειρός σου σήμερον, καὶ δώσει αὐτὴν τῷ πλησίον σου τῷ ἀγαθῷ ὑπὲρ σέ·	καί λέγω πρός αὐτός   κύριος2 ὁ βασιλεία  ἀπό  ἐκ χείρ  σήμερον , καί δίδωμι αὐτός τῷ πλησίος  ὁ ἀγαθός ὑπέρ  ·
670323	tlg0527.tlg011.opp-grc2	καὶ διαιρεθήσεται Ἰσραὴλ εἰς δύο, καὶ οὐκ ἀποστρέψει οὐδὲ μετανοήσει, ὅτι οὐχ ὡς ἄνθρωπός ἐστιν τοῦ μετανοῆσαι αὐτός.	καί   εἰς γε , καί οὐ ἀποστρέφω οὐδέ μετανοέω , ὅτι2 οὐ ὡς ἄνθρωπος εἰμί ὁ μετανοέω αὐτός .
670324	tlg0527.tlg011.opp-grc2	καὶ εἶπεν Σαούλ Ἡμάρτηκα, ἀλλὰ δόξασόν με δὴ ἐνώπιον πρεσβυτέρων Ἰσραὴλ καὶ ἐνώπιον λαοῦ μου, καὶ ἀνάστρεψον’ ἐμοῦ καὶ προσκυνήσω τῷ κυρίῳ θεῷ σου.	καί λέγω   , ἀλλά δοξάζω  δή ἐνώπιος πρέσβυς  καί    , καί   καί προσκυνέω τῷ κύριος2 θεός  .
670325	tlg0527.tlg011.opp-grc2	καὶ ἀνέστρεωεν πίσω Σαούλ, καὶ προσεκύνησεν τῷ κυρίῳ.	καί    , καί προσκυνέω τῷ κύριος2 .
670326	tlg0527.tlg011.opp-grc2	Καὶ ροσαγάγετέ μοι τὸν Ἀγὰγ βασιλέα Ἀμαλήκ·	καί   ὁ  βασιλεύς  ·
670327	tlg0527.tlg011.opp-grc2	καὶ προσῆλθεν πρὸς αὐτὸν Ἀγὰγ τρέμων.	καί προσέρχομαι πρός αὐτός  τρέμω .
670328	tlg0527.tlg011.opp-grc2	καὶ εἶπεν Ἀγάγ Εἰ οὕτως πικρὸς ὁ θάνατος;	καί λέγω  εἰ οὕτως πικρός ὁ θάνατος ;
670329	tlg0527.tlg011.opp-grc2	καὶ εἶπεν Σαμουὴλ πρὸς Ἀγάγ Καθότι ἠτέκνωσεν γυναῖκας ἡ ῥομφαία σου, οὕτως ἀτεκνωθήσεται ἐκ γυναικῶν ἡ μήτηρ σου·	καί λέγω  πρός    γυνή ὁ   , οὕτως  ἐκ γυνή ὁ μήτηρ  ·
670330	tlg0527.tlg011.opp-grc2	κοὶ ἔσφαξεν Σαμουὴλ τὸν Ἀγὰγ ἐνώπιον κυρίου ἐν Γαλγάλ.	σφάζω  ὁ  ἐνώπιος  ἐν  .
670331	tlg0527.tlg011.opp-grc2	καὶ Σαμουὴλ εἰς Ἁρμαθάιμ·	καί  εἰς  ·
670332	tlg0527.tlg011.opp-grc2	καὶ Σαοὺλ ἀνέβη εἰς τὸν οἶκον αὐτοῦ καὶ οὐ προσέθετο Σαμουὴλ ἔτι ἰδεῖν τὸν Σαοὺλ ἕως θανάτου αὐτοῦ, ὅτι ἐπένθειΣαμουὴλ ἐπὶ Σαούλ, καὶ Κύριος ὅτι ἐβασίλευσεν τὸν Σαοὺλ ἐπὶ Ἰσραήλ.	καί  ἀναβαίνω εἰς ὁ οἶκος αὐτός καί οὐ   ἔτι ὁράω ὁ  ἕως θάνατος αὐτός , ὅτι2  Σαμουὴλ ἐπί  , καί κύριος2 ὅτι2 βασιλεύω ὁ  ἐπί  .
670333	tlg0527.tlg011.opp-grc2	Καὶ εἶπεν κύριος πρὸς Σαμουήλ Ἕως πότε σὺ πενθεῖς ἐπὶ Σαούλ, κἀγὼ ἐξουδένωκα αὐτὸν μὴ βασιλεύειν ἐπὶ Ἰσραήλ;	καί λέγω κύριος2 πρός   πότε   ἐπί  ,   αὐτός μή βασιλεύω ἐπί  ;
670334	tlg0527.tlg011.opp-grc2	πλῆσον τὸ κέρας σου ἐλαίου, καὶ δεῦρο ἀποστείλω σε πρὸς Ἰεσσαὶ ἕως εἰς, ὅτι ἑόρακα ἐν τοῖς υἱοῖς αὐτοῦ ἐμοὶ βασιλεύειν.	πίμπλημι ὁ κέρας   , καί δεῦρο   πρός  ἕως εἰς , ὅτι2  ἐν ὁ υἱός αὐτός  βασιλεύω .
670335	tlg0527.tlg011.opp-grc2	καὶ εἶπεν Ἠὼς πορευθῶ;	καί λέγω ἠώς  ;
670336	tlg0527.tlg011.opp-grc2	καὶ ἀκούσεται Σαοὺλ καὶ ἀποκτενεῖ με.	καί ἀκούω  καί ἀποκτείνω  .
670337	tlg0527.tlg011.opp-grc2	καὶ εἶπεν Κύριος Δάμαλιν βοῶν λάβε ἐν τῇ χειρί σου καὶ ἐρεῖς Θῦσαι ἥκω τῷ κυρίῳ·	καί λέγω κύριος2   λαμβάνω ἐν ὁ χείρ  καί λέγω  ἥκω ὁ κύριος2 ·
670338	tlg0527.tlg011.opp-grc2	καὶ καλέσεις τὸν Ἰεσσαὶ εἰς τὴν θυσίαν, καὶ γνωριῶ σοι ἃ ποιήσεις, καὶ χρίσεις ὃν ἐὰν εἴπω πρὸς σέ.	καί  ὁ  εἰς ὁ θυσία , καί   ὅς ποιέω , καί  ὅς ἐάν λέγω πρός  .
670339	tlg0527.tlg011.opp-grc2	καὶ ἐποίησεν Σαμουὴλ πάντα ἃ ἐλάλησεν αὐτῷ Κύριος, καὶ ἦλθεν εἰς Βηθλέεμ.	καί ποιέω  πᾶς ὅς λαλέω αὐτός κύριος2 , καί ἔρχομαι εἰς  .
670340	tlg0527.tlg011.opp-grc2	καὶ ἐξέστησαν οἱ πρεσβύτεροι τῆς πόλεως τῆ ἀπαντήσει αὐτοῦ καὶ εἶπανἪ εἰρήνη ἡ εἴσοδός σου, ὁ βλέπων;	καί ἐξίστημι ὁ πρέσβυς ὁ πόλις  ἀπάντησις αὐτός καί λέγω Ἢ εἰρήνη ὁ εἴσοδος  , ὁ βλέπω ;
670341	tlg0527.tlg011.opp-grc2	καὶ εἶπεν Εἰρήνη·	καί λέγω εἰρήνη ·
670342	tlg0527.tlg011.opp-grc2	θῦσαι τῷ κυρίῳ ἥκω, ἁγιάσθητε καὶ εὐφράνθητε μετ’ ἐμοῦ σήμερον.	θύω τῷ κύριος2 ἥκω ,  καί εὐφραίνω μετά  σήμερον .
670343	tlg0527.tlg011.opp-grc2	καὶ ἡγίασεν τὸν Ἰεσσαὶ καὶ τοὺς υἱοὺς αὐτοῦ, καὶ ἐκάλεσεν αὐτοὺς εἰςB τὴν θυσίαν.	καί ἁγιάζω ὁ  καί ὁ υἱός αὐτός , καί καλέω αὐτός εἰς B ὁ θυσία .
670344	tlg0527.tlg011.opp-grc2	καὶ ἐγενήθη ἐν τῷ αὐτοὺς εἰσιέναι καὶ εἶδεν τὸν Ἐλιάβ, καὶ εἶπεν Ἀλλὰ καὶ ἐνώπιον Κυρίου χριστὸς αὐτοῦ.	καί γίγνομαι ἐν τῷ αὐτός εἴσειμι καί ὁράω ὁ  , καί λέγω ἀλλά καί ἐνώπιος   αὐτός .
670345	tlg0527.tlg011.opp-grc2	καὶ εἶπεν κύριος πρὸς Σαμουήλ Μὴ ἐπιβλέψῃς ἐπὶ τὴν ὄψιν αὐτοῦ μηδὲ εἰς τὴν ἕξιν μεγέθους αὐτοῦ, ὅτι ἐξουδένωκα αὐτόν·	καί λέγω κύριος2 πρός  μή  ἐπί ὁ ὄψις αὐτός μηδέ εἰς ὁ ἕξις μέγεθος αὐτός , ὅτι2  αὐτός ·
670346	tlg0527.tlg011.opp-grc2	ὅτι οὐχ ὡς ἐμβλέψεται ἄνθρωπος, ὄψεται ὁ θεός·	ὅτι2 οὐ ὡς  ἄνθρωπος , ὁράω ὁ θεός ·
670347	tlg0527.tlg011.opp-grc2	ὅτι ἄνθρωπος ὄψεται εἰς πρόσωπον, ὁ δὲ θεὸς ὄψεται εἰς καρδίαν.	ὅτι2 ἄνθρωπος ὁράω εἰς πρόσωπον , ὁ δέ  ὁράω εἰς καρδία .
670348	tlg0527.tlg011.opp-grc2	καὶ ἐκάλεσεν Ἰεσσαὶ τὸν Ἀμειναδάβ, καὶ παρῆλθεν κατὰ πρόσωπον Σαμουήλ, καὶ εἶπεν Οὐδὲ τοῦτον ἐξελέξατο ὁ θεός.	καί καλέω  ὁ  , καί παρέρχομαι κατά πρόσωπον  , καί λέγω οὐδέ οὗτος ἐκλέγω ὁ θεός .
670349	tlg0527.tlg011.opp-grc2	καὶ παρήγαγεν Ἰεσσαὶ τὸν Σαμά·	καί παράγω  ὁ  ·
670350	tlg0527.tlg011.opp-grc2	καὶ εἶπεν καὶ ἐν τούτῳ οὐκ ἐξελέξατο κύριος.	καί λέγω καί ἐν οὗτος οὐ ἐκλέγω κύριος2 .
670351	tlg0527.tlg011.opp-grc2	καὶ παρῆγ’ ἂγ ἐν Ἰεσσαὶ τοὺς ἑπτὰ υἱοὺς αὐτοῦ ἐνώπιον Σαμουήλ·	καί   ἐν  ὁ  υἱός αὐτός   ·
670352	tlg0527.tlg011.opp-grc2	καὶ εἶπεν Σαμουήλ·	καί λέγω  ·
670353	tlg0527.tlg011.opp-grc2	οὐκ ἐξελέξατο κύριος ἐν τούτοις.	οὐ ἐκλέγω κύριος2 ἐν οὗτος .
670354	tlg0527.tlg011.opp-grc2	καὶ εἶπεν Σαμουὴλ πρὸς Ἰεσσαί Ἐκλελοίπασιν τὰ παιδάρια;	καί λέγω  πρός   ὁ παιδάριον ;
670355	tlg0527.tlg011.opp-grc2	καὶ εἶπεν Ἔτι ὁ μικρός·	καί λέγω ἔτι ὁ μικρός ·
670356	tlg0527.tlg011.opp-grc2	ἰδοὺ ποιμαίνει ἐν τῷ ποιμνίῳ·	ποιμαίνω ἐν ὁ ποίμνιος ·
670357	tlg0527.tlg011.opp-grc2	καὶ εἶπεν Σαμουὴλ πρὸς Ἰεσσαί Ἀπόστειλον καὶ λάβε αὐτόν, ὅτι οὐ μὴ κατακλιθῶμεν ἕως τοῦ ἐλθεῖν αὐτόν καὶ ἀπέστειλεν καὶ είσήγαγεν αὐτόν·	καί λέγω  πρός   καί λαμβάνω αὐτός , ὅτι2 οὐ μή  ἕως ὁ ἔρχομαι αὐτός καί ἀποστέλλω καί  αὐτός ·
670358	tlg0527.tlg011.opp-grc2	καὶ οὗτος πυρράκης μετὰ κάλλους ὀφθαλμῶν, καὶ ἀγαθὸς ὁράσει κυρίῳ·	καί οὗτος  μετά κάλλος ὀφθαλμός , καί ἀγαθός  κύριος2 ·
670359	tlg0527.tlg011.opp-grc2	καὶ εἶπεν Κύριος πρὸς Σαμουήλ Ἀνάστα καὶ χρῖσον τὸν Δαυείδ, ὅτι οὗτος ἀγαθός ἐστιν.	καί λέγω κύριος2 πρός   καί  ὁ  , ὅτι2 οὗτος ἀγαθός εἰμί .
670360	tlg0527.tlg011.opp-grc2	καὶ ἔλαβεν Σαμουὴλ τὸ κέρας τοῦ ἐλαίου καὶ ἔχριδεν αὐτὸν ἐν μέσῳ τῶν ἀδελφῶν αὐτοῦ·	καί λαμβάνω  ὁ κέρας ὁ  καί  αὐτός ἐν  ὁ ἀδελφός αὐτός ·
670361	tlg0527.tlg011.opp-grc2	καὶ ἐφήλατο πνεῦμα κυρίου ἐπὶ Δαυεὶδ ἀπὸ τῆς ἡμέρας ἐκείνης καὶ ἐπάνω·	καί  πνεῦμα  ἐπί  ἀπό ὁ ἡμέρα ἐκεῖνος καί ἐπάνω ·
670362	tlg0527.tlg011.opp-grc2	καὶ ἀνέστη Σαμουὴλ καὶ ἀπῆλθεν εἰς Ἁρμαθάιμ.	καί ἀνίστημι  καί ἀπέρχομαι εἰς  .
670363	tlg0527.tlg011.opp-grc2	καὶ πνεῦμα κυρίου ἀπέστη ἀπὸ Σαούλ, καὶ ἔπνιγεν αὐτόν πνεῦμα πονηρὸν παρὰ Τυρίου.	καί πνεῦμα   ἀπό  , καί πνίγω αὐτός πνεῦμα πονηρός παρά  .
670364	tlg0527.tlg011.opp-grc2	καὶ εἶπαν οἱ παῖδες Σαοὺλ πρὸς αὐτόν ἰδοὺ δὴ πνεῦμα Τυρίου πονηρὸν πνίγει σε·	καί λέγω ὁ παῖς  πρός αὐτός  δή πνεῦμα  πονηρός πνίγω  ·
670365	tlg0527.tlg011.opp-grc2	εἰπάτωσαν δὴ οἱ δοῦλοί σου ἐνώπιόν σου καὶ ζητησάτωσαν τῷ κυρίῳ ἡμῶν ἄνδρα εἰδότα ψάλλειν ἐν κινύρᾳ·	δή ὁ δοῦλος    καί  τῷ κύριος2 ἐγώ ἀνήρ οἶδα ψάλλω ἐν κινύρα ·
670366	tlg0527.tlg011.opp-grc2	καὶ ἔσται ἐν τῷ εἶναι πνεῦμα πονηρὸν ἐπὶ σοὶ καὶ ψαλεῖ ἐν τῇ κινύρᾳ αὐτοῦ, καὶ ἀγαθόν σοι ἱστᾶι καὶ ἀναπαύσει σε.	καί εἰμί ἐν τῷ εἰμί πνεῦμα πονηρός ἐπί  καί  ἐν ὁ κινύρα αὐτός , καί ἀγαθός   καί ἀναπαύω  .
670367	tlg0527.tlg011.opp-grc2	καὶ εἶπεν Σαοὺλ πρὸς τοὺς παῖδος αὐτοῦ Ἴδετε δή μοι ἄνδρα ὀρθῶς ψάλλοντα, καὶ εἰσαγάγετε αὐτὸν πρὸς ἐμέ.	καί λέγω  πρός ὁ  αὐτός  δή  ἀνήρ ὀρθός  , καί  αὐτός πρός  .
670368	tlg0527.tlg011.opp-grc2	καὶ ἀπεκρίθη εἷς τῶν παιδαρίων αὐτοῦ καὶ εἶπεν ἰδοὺ ἑόρακα υἱὸν τῷ Ἰεσσαὶ Βηθλεεμείτην καὶ αὐτὸν εἰδότα ψαλμόν, καὶ ὁ ἀνὴρ συνετὸς καὶ ὁ ἀνὴρ πολεμιστὴς καὶ σοφὸς λόγῳ, καὶ ἀνὴρ ἀγαθὸς τῷ εἴδει, καὶ κύριος μετ’ αὐτοῦ.	καί ἀποκρίνω  ὁ  αὐτός καί λέγω   υἱός τῷ   καί αὐτός οἶδα ψαλμός , καί ὁ ἀνήρ συνετός καί ὁ ἀνήρ πολεμιστής καί σοφός λόγος , καί ἀνήρ ἀγαθός τῷ εἶδος , καί κύριος2 μετά αὐτός .
670369	tlg0527.tlg011.opp-grc2	καὶ ἀπέστειλεν Σαοὺλ ἀγγέλους πρὸς Ἰεσσαὶ λέγων Ἀπόστειλον πρὸς μὲ τὸν υἱόν σου Δαυεὶδ τὸν ἐν τῷ ποι σου.	καί ἀποστέλλω  ἄγγελος πρός  λέγω  πρός  ὁ υἱός   ὁ ἐν τῷ ποι  .
670370	tlg0527.tlg011.opp-grc2	καὶ ἔλαβεν Ἰεσσαὶ γόμορ ἄρτων καὶ ἀσκὸν οἴνου κα ἔριφον αἰγῶν ἕνα, καὶ ἐξαπέστειλεν ἐν χειρὶ Δαυεὶδ τοῦ υἱοῦ αὐτοῦ πρὸς Σαούλ.	καί λαμβάνω    καί ἀσκός οἶνος  ἔριφος αἴξ  , καί ἐξαποστέλλω ἐν χείρ  ὁ  αὐτός πρός  .
670371	tlg0527.tlg011.opp-grc2	καὶ εἰσῆλθεν Δαυεὶδ πρὸς Σαούλ, καὶ παριστήκει ἐνώπιον αὐτοῦ.	καί εἰσέρχομαι  πρός  , καί   αὐτός .
670372	tlg0527.tlg011.opp-grc2	καὶ ἠγάπησεν αὐτὸν σφόδρα, καὶ ἐγενήθη αὐτῷ αἴρων τὰ αὐτοῦ.	καί ἀγαπάω αὐτός σφόδρα , καί γίγνομαι αὐτός  ὁ αὐτός .
670373	tlg0527.tlg011.opp-grc2	καὶ ἀπέστειλεν Σαοὺλ πρὸς Ἰεσσαὶ λέγων Ηαριστόσθω Δαυεὶδ ἐνώπιον ἐμοῦ, ὅτι εὗρεν χάριν ἐν ὀφθαλμοῖς μου.	καί ἀποστέλλω  πρός  λέγω   ἐνώπιος ἐμός , ὅτι2 εὑρίσκω χάρις ἐν ὀφθαλμός  .
670374	tlg0527.tlg011.opp-grc2	καὶ ἐν τῶ εἶναι πνεῦμα πονηρὸν ἐπὶ Σαοὺλ καὶ ἐλάμβανεν Δαυεὶδ κινύραν καὶ ἔψαλλεν ἐν τῇ χειρὶ αὐτοῦ, καὶ ἀνέψυχεν Σαοὺλ καὶ ἀγαθὸν αὐτῷ, καὶ ἀφίστατο ἀπ’ αὐτοῦ τὸ πνεῦμα τὸ πονηρόν·	καί ἐν τῷ εἰμί πνεῦμα πονηρός ἐπί  καί λαμβάνω   καί  ἐν ὁ χείρ αὐτός , καί   καί ἀγαθός αὐτός , καί ἀφίστημι ἀπό αὐτός ὁ πνεῦμα ὁ πονηρός ·
670375	tlg0527.tlg011.opp-grc2	Καὶ συνάγουσιν ἀλλόφυλοι τὰς παρεμβολὰς αὐτῶν εἰς πόλεμον, καὶ συνάγονται εἰς Σοκχὼθ τῆς Ἰδουμαίας, καὶ παρεμβάλλουσιν ἀνὰ οκχὼθ καὶ ἀνὰ μέσον Ἀζηκὰ Ἐφερμέμ.	καί συνάγω ἀλλόφυλος ὁ παρεμβολή αὐτός εἰς πόλεμος , καί συνάγω εἰς  ὁ Ἰδουμαία , καί  ἀνά  καί ἀνά μέσος   .
670376	tlg0527.tlg011.opp-grc2	καὶ Σαοὺλ κα ὁ Ἰσραὴλ συνάγονται καὶ παρεμβάλλουσιν ἐν τῇ κοιλάδι·	καί   ὁ  συνάγω καί  ἐν ὁ κοιλάς ·
670377	tlg0527.tlg011.opp-grc2	αὐτοὶ παρατάσσονται εἰς πόλεμον ἐξ ἐναντίας ἀλλοφύλων.	αὐτός  εἰς πόλεμος ἐκ ἐναντίος ἀλλόφυλος .
670378	tlg0527.tlg011.opp-grc2	καὶ ἀλλόφυλοι ἐπὶ τοῦ ὄρους ἐνταῦθα, καὶ Ἰσραὴλ ἵσταται ἐπὶ τοῦ ὄρους ἀνὰ μέσον αὐτῶν.	καί  ἐπί ὁ ὀρός ἐνταῦθα , καί  ἵστημι ἐπί ὁ ὄρος ἀνά μέσος αὐτός .
670379	tlg0527.tlg011.opp-grc2	καὶ ἐξῆλθεν ἀνὴρ δυνατὸς ἐκ τῶν ἀλλοφύλων, Γολιὰθ ὄνομα αὐτῷ, ἐκ Γέθ·	καί ἐξέρχομαι ἀνήρ δυνατός ἐκ ὁ ἀλλόφυλος ,  ὄνομα αὐτός , ἐκ  ·
670380	tlg0527.tlg011.opp-grc2	ὕψος αὐτοῦ τεσσάρων πήχεων καὶ σπιθαμῆς.	ὕψος αὐτός   καί σπιθαμή .
670381	tlg0527.tlg011.opp-grc2	καὶ περικεφαλαία ἐπὶ τῆς κεφαλῆς αὐτοῦ, καὶ θώρακα ἁλυσιδωτὸν αὐτὸς ἐνδεδυκώς, καὶ ὁ σταθμὸς τοῦ θώρακος αὐτοῦ πέντε χιλιάδες σίκλων χαλκοῦ καὶ ἀσπὶς ἀσπὶς χαλκὴ ἀνὰ τῶν ὤμων αὐτοῦ.	καί περικεφαλαία ἐπί ὁ κεφαλή αὐτός , καί θώραξ ἁλυσιδωτός αὐτός ἐνδύω , καί ὁ σταθμός ὁ θώραξ αὐτός πέντε χιλιάς σίγλος χαλκός καί ἀσπίς ἀσπίς  ἀνά ὁ ὦμος αὐτός .
670382	tlg0527.tlg011.opp-grc2	καὶ ὁ κοντὸς τοῦ δόρατος αὐτοῦ ὡσεὶ μέσα.	καί ὁ κοντός ὁ δόρυ αὐτός ὡσεί  .
670383	tlg0527.tlg011.opp-grc2	ὑφαινόντων, καὶἡ λόγχη αὐτοῦ ἑξακοσίων σίκλων σιδήρου·	,  λόγχη αὐτός ἑξακόσιοι  σίδηρος ·
670384	tlg0527.tlg011.opp-grc2	καὶ ὁ αἴρων τὰ ὅπλα αὐτοῦ προεπορεύετο αὐτοῦ.	καί ὁ  ὁ ὅπλον αὐτός  αὐτός .
670385	tlg0527.tlg011.opp-grc2	καὶ ἀνέστη καὶ ἀνεβόησεν εἰς τὴν παράταξιν Ἰσραὴλ καὶ εἶπεν αὐτοῖς τί ἐκπορεύεσθε παρατάξασθαι πολέμῳ ἐξ ἐναντίας ἡμῶν;	καί ἀνίστημι καί ἀναβοάω εἰς ὁ παράταξις  καί λέγω αὐτός τι  παρατάσσω πόλεμος ἐκ  ἐγώ ;
670386	tlg0527.tlg011.opp-grc2	οὐκ ἐγώ εἰμι ἀλλόφυλος, καὶ ὑμαῖς Ἑβραῖοι καὶ Σαούλ;	οὐ  εἰμί ἀλλόφυλος , καί   καί  ;
670387	tlg0527.tlg011.opp-grc2	ἐκλέξασθε ἑαυτοῖς ἄνδρα καὶ καταβήτω πρὸς μέ.	ἐκλέγω ἑαυτοῦ ἀνήρ καί  πρός  .
670388	tlg0527.tlg011.opp-grc2	καὶ ἐὰν δυνηθῇ πρὸς ἐμὲ πολεμῆσαι καὶ ἐὰν πατάξῃ με, καὶ ἐσόμεθα ὑμῖν εἰς δούλους·	καί ἐάν δύναμαι πρός  πολεμέω καί ἐάν πατάσσω ἐγώ , καί εἰμί  εἰς δοῦλος ·
670389	tlg0527.tlg011.opp-grc2	ἐὰν δὲ ἐγὼ δυνηθῶ καὶ πατάξω αὐτὸν, ἔσεσθε ἡμῖν εἰς δούλους καὶ δουλεύσετε ἡμῖν.	ἐάν δέ   καί πατάσσω αὐτός , εἰμί  εἰς δοῦλος καί δουλεύω  .
670390	tlg0527.tlg011.opp-grc2	καὶ εἶπεν ὁ ἀλλόφυλος ἰδοὺ ἐγὼ ὠνείδισα τὴν παράταξιν Ἰσραὴλ σήμερον ἐν τῇ ἡμέρᾳ ταύτῃ·	καί λέγω ὁ     ὁ παράταξις  σήμερον ἐν ὁ ἡμέρα οὗτος ·
670391	tlg0527.tlg011.opp-grc2	δότε μοι ἄνδρα καὶ μονομαχήσομεν ἀμφότεροι.	δίδωμι  ἀνήρ καί  ἀμφότερος .
670392	tlg0527.tlg011.opp-grc2	καὶ ἤκουσεν Σαοὺλ καὶ πᾶς Ἰσραὴλ τὰ ῥήματα τοῦ ἀλλοφύλου ταῦτα, καὶ ἐξέστησαν καὶ ἐφοβήθησαν σφόδρα.	καί ἀκούω  καί πᾶς  ὁ ῥῆμα ὁ  οὗτος , καί ἐξίστημι καί φοβέω σφόδρα .
670393	tlg0527.tlg011.opp-grc2	Καὶ εἶπεν Δαυεὶδ πρὸς Σαούλ Μὴ δὴ συνπεσέτω καρδία τοῦ κυρίου μου ἐπ’ αὐτόν·	καί λέγω  πρός  μή δή  καρδία ὁ κύριος  ἐπί αὐτός ·
670394	tlg0527.tlg011.opp-grc2	ὁ δοῦλός σου πορεύσεται καὶ πολεμήσει μετὰ τοῦ ἀλλοφύλου τούτου.	ὁ δοῦλος  πορεύω καί πολεμέω μετά ὁ ἀλλόφυλος οὗτος .
670395	tlg0527.tlg011.opp-grc2	καὶ εἶπεν Σαοὺλ πρὸς Δαυείδ Οὐ μὴ δύνῃ πορευθῆναι πρὸς τὸν ἀλλόφυλον τοῦ πολεμεῖν μετ’ αὐτοῦ, ὅτι παιδάριον εἶ σύ, καὶ αὐτὸς ἀνὴρ πολεμιστὴς ἐκ νεότητος αὐτοῦ.	καί λέγω  πρός   μή  πορεύω πρός ὁ  ὁ πολεμέω μετά αὐτός , ὅτι2 παιδάριον εἶμι  , καί αὐτός ἀνήρ πολεμιστής ἐκ νεότης αὐτός .
670396	tlg0527.tlg011.opp-grc2	καὶ εἶπεν Δαυεὶδ πρὸς Σαούλ Ποιμαίνων ἦν ὁ δοῦλός σου τῷ πατρὶ αὐτοῦ ἐν τῷ ποιμνίῳ·	καί λέγω  πρός   εἰμί ὁ δοῦλος  ὁ πατήρ αὐτός ἐν ὁ ποίμνιος ·
670397	tlg0527.tlg011.opp-grc2	καὶ ὅταν ἤρχετο ὁ λέων καὶ ἡ ἄρκος καὶ ἐλάμβανεν πρόβατον ἐκ τῆς ἀγέλης, καὶ ἐξεπορευόμην ὀπίσω αὐτοῦ καὶ ἐπάταξα αὐτόν, καὶ ἐξέσπασα ἐκ τοῦ στόματος αὐτοῦ·	καί ὅταν ἄρχω ὁ λέων καί ὁ  καί λαμβάνω  ἐκ ὁ ἀγέλη , καί  ὀπίσω αὐτός καί πατάσσω αὐτός , καί  ἐκ ὁ στόμα αὐτός ·
670398	tlg0527.tlg011.opp-grc2	καὶ εἰ ἐπανίστατο ἐπ’ ἐμέ, καὶ ἐκράτησα τοῦ φάρυγγος αὐτοῦ καὶ ἐπάταξα καὶ ἐθανάτωσα αὐτόν.	καί εἰ ἐπανίστημι ἐπί  , καί κρατέω ὁ φάρυγξ αὐτός καί πατάσσω καί  αὐτός .
670399	tlg0527.tlg011.opp-grc2	καὶ τὴν ἄρκον ἔτυπτεν ὁ δοῦλός σου καὶ τὸν λέοντα, καὶ ὦσται ὁ ἀλλόφυλος ὁ ἀπερίτμητος ὡς ἱν τούτων·	καί ὁ  τύπτω ὁ δοῦλος  καί ὁ λέων , καί  ὁ ἀλλόφυλος ὁ ἀπερίτμητος ὡς  οὗτος ·
670400	tlg0527.tlg011.opp-grc2	οὐχὶ πορεύσομαι καὶ πατάξω αὐτόν, καὶ ἀφελῶ σήμερον ὄνειδος ἐξ Ἰσραήλ;	οὐ πορεύω καί πατάσσω αὐτός , καί ἀφαιρέω σήμερον ὄνειδος ἐκ  ;
