id	filename	tokens	lemmas
407596	tlg0007.tlg021.perseus-grc2	ἐπεὶ δὲ Ἀλεξάνδρου τοῦ Φερῶν τυράννου πολεμοῦντος μὲν ἐκ προδήλου πολλοῖς Θετταλῶν, ἐπιβουλεύοντος δὲ πᾶσιν, ἐπρέσβευσαν εἰς Θήβας αἱ πόλεις στρατηγὸν αἰτούμεναι καὶ δύναμιν, ὁρῶν ὁ Πελοπίδας τὸν Ἐπαμεινώνδαν τὰς ἐν Πελοποννήσῳ πράξεις διοικεῖν, αὐτὸς ἑαυτὸν ἐπέδωκε καὶ προσένειμε τοῖς Θεσσαλοῖς, μήτε τήν ἰδίαν ἐπιστήμην καὶ δύναμιν ἀργοῦσαν περιορᾶν ὑπομένων, μήτε ὅπου πάρεστιν Ἐπαμεινώνδας ἑτέρου δεῖσθαι στρατηγοῦ νομίζων.	ἐπεί δέ Ἀλέξανδρος ὁ  τύραννος πολεμέω μέν ἐκ πρόδηλος πολύς Θεσσαλός , ἐπιβουλεύω δέ πᾶς , πρεσβεύω εἰς Θῆβαι ὁ πόλις στρατηγός  καί δύναμις , ὁράω ὁ Πελοπίδης ὁ Ἐπαμεινώνδας ὁ ἐν Πελοπόννησος πρᾶξις διοικέω , αὐτός ἑαυτοῦ ἐπιδίδωμι καί προσνέμω ὁ  , μήτε ὁ ἴδιος ἐπιστήμη καί δύναμις ἀργέω περιοράω  , μήτε ὅπου πάρειμι Ἐπαμεινώνδας ἕτερος δέω στρατηγός νομίζω .
407597	tlg0007.tlg021.perseus-grc2	ὡς οὖν ἐστράτευσεν ἐπὶ Θεσσαλίαν μετὰ δυνάμεως, τήν τε Λάρισσαν εὐθὺς παρέλαβε, καὶ τὸν Ἀλέξανδρον ἐλθόντα καὶ δεόμενον διαλλάττειν ἐπειρᾶτο καὶ ποιεῖν ἐκ τυράννου πρᾷον ἄρχοντα τοῖς Θεσσαλοῖς καὶ νόμιμον.	ὡς οὖν στρατεύω ἐπί Θεσσαλία μετά δύναμις , ὁ τε Λάρισα εὐθύς παραλαμβάνω , καί ὁ Ἀλέξανδρος ἔρχομαι καί δέω διαλλάσσω πειράω καί ποιέω ἐκ τύραννος  ἄρχω ὁ  καί νόμιμος .
407598	tlg0007.tlg021.perseus-grc2	ὡς δὲ ἦν ἀνήκεστος καὶ θηριώδης καὶ πολλὴ μὲν ὠμότης αὐτοῦ, πολλὴ δὲ ἀσέλγεια καὶ πλεονεξία κατηγορεῖτο, τραχυνομένου τοῦ Πελοπίδου πρὸς αὐτὸν καὶ χαλεπαίνοντος ἀποδρὰς ᾤχετο μετὰ τῶν δορυφόρων.	ὡς δέ εἰμί ἀνήκεστος καί  καί πολύς μέν ὠμότης αὐτός , πολύς δέ ἀσέλγεια καί πλεονεξία κατηγορέω , τραχύνω ὁ Πελοπίδης πρός αὐτός καί χαλεπαίνω ἀποδιδράσκω οἴχομαι μετά ὁ δορυφόρος .
407599	tlg0007.tlg021.perseus-grc2	ὁ δὲ Πελοπίδας ἄδειάν τε πολλὴν ἀπὸ τοῦ τυράννου τοῖς Θεσσαλοῖς ἀπολιπὼν καὶ πρὸς ἀλλήλους ὁμόνοιαν, αὐτὸς εἰς Μακεδονίαν ἀπῆρε, Πτολεμαίου μὲν Ἀλεξάνδρῳ τῷ βασιλεύοντι τῶν Μακεδόνων πολεμοῦντος, ἀμφοτέρων δὲ μεταπεμπομένων ἐκεῖνον ὡς διαλλακτὴν καὶ δικαστὴν καὶ σύμμαχον καὶ βοηθὸν τοῦ δοκοῦντος ἀδικεῖσθαι γενησόμενον.	ὁ δέ Πελοπίδης ἄδεια τε πολύς ἀπό ὁ  ὁ  ἀπολείπω καί πρός ἀλλήλων ὁμόνοια , αὐτός εἰς Μακεδονία ἀπαίρω , Πτολεμαῖος μέν Ἀλέξανδρος τῷ βασιλεύω ὁ  πολεμέω , ἀμφότερος δέ  ἐκεῖνος ὡς διαλλακτής καί δικαστής καί σύμμαχος καί  ὁ δοκέω ἀδικέω  .
407600	tlg0007.tlg021.perseus-grc2	ἐλθὼν δὲ καὶ διαλύσας τὰς διαφορὰς καὶ καταγαγὼν τοὺς φεύγοντας, ὅμηρον ἔλαβε τὸν ἀδελφὸν τοῦ βασιλέως Φίλιππον καὶ τριάκοντα παῖδας ἄλλους τῶν ἐπιφανεστάτων, καὶ κατέστησεν εἰς Θήβας, ἐπιδειξάμενος τοῖς Ἕλλησιν ὡς πόρρω διήκει τὰ Θηβαίων πράγματα τῇ δόξῃ τῆς δυνάμεως καὶ τῇ πίστει τῆς δικαιοσύνης.	ἔρχομαι δέ καί διαλύω ὁ διαφορά καί κατάγω ὁ φεύγω , ὅμηρος λαμβάνω ὁ ἀδελφός ὁ βασιλεύς Φίλιππος καί  παῖς ἄλλος ὁ ἐπιφανής , καί καθίστημι εἰς Θῆβαι ,  ὁ Ἕλλην ὡς πρόσω διήκω ὁ   ὁ δόξα ὁ δύναμις καί ὁ πίστις ὁ δικαιοσύνη .
407601	tlg0007.tlg021.perseus-grc2	οὗτος ἦν Φίλιππος ὁ τοῖς Ἕλλησιν ὕστερον πολεμήσας ὑπὲρ τῆς ἐλευθερίας, τότε δὲ παῖς ὢν ἐν Θήβαις παρὰ Παμμένει δίαιταν εἶχεν.	οὗτος εἰμί Φίλιππος ὁ ὁ Ἕλλην ὕστερον πολεμέω ὑπέρ ὁ ἐλευθερία , τότε δέ παῖς εἰμί ἐν Θῆβαι παρά Παμμένης δίαιτα ἔχω .
407602	tlg0007.tlg021.perseus-grc2	ἐκ δὲ τούτου καὶ ζηλωτὴς γεγονέναι ἔδοξεν Ἐπαμεινώνδου, τὸ περὶ τοὺς πολέμους καὶ τὰς στρατηγίας δραστήριον ἴσως κατανοήσας, ὃ μικρὸν ἦν τῆς τοῦ ἀνδρὸς ἀρετῆς μόριον, ἐγκρατείας δὲ καὶ δικαιοσύνης καὶ μεγαλοψυχίας καὶ πρᾳότητος, οἷς ἦν ἀληθῶς μέγας ἐκεῖνος, οὐδὲν οὔτε φύσει Φίλιππος οὔτε μιμήσει μετέσχε.	ἐκ δέ οὗτος καί ζηλωτής γίγνομαι δοκέω Ἐπαμεινώνδας , ὁ περί ὁ πόλεμος καί ὁ στρατηγία  ἴσος κατανοέω , ὁ μικρός εἰμί ὁ ὁ ἀνήρ ἀρετή μόριον , ἐγκράτεια δέ καί δικαιοσύνη καί μεγαλοψυχία καί πραότης , ὅς εἰμί ἀληθής μέγας ἐκεῖνος , οὐδείς οὔτε φύσις Φίλιππος οὔτε  μετέχω .
407603	tlg0007.tlg021.perseus-grc2	μετὰ δὲ ταῦτα πάλιν τῶν Θετταλῶν αἰτιωμένων τὸν Φεραῖον Ἀλέξανδρον ὡς διαταράττοντα τὰς πόλεις, ἀπεστάλη Μετὰ Ἰσμηνίου πρεσβεύων ὁ Πελοπίδας·	μετά δέ οὗτος πάλιν ὁ Θεσσαλός  ὁ  Ἀλέξανδρος ὡς  ὁ πόλις , ἀποστέλλω μετά  πρεσβεύω ὁ Πελοπίδης ·
407604	tlg0007.tlg021.perseus-grc2	καὶ παρῆν οὔτε οἴκοθεν ἄγων δύναμιν οὔτε πόλεμον προσδοκήσας, αὐτοῖς δὲ τοῖς Θετταλοῖς χρῆσθαι πρὸς τὸ κατεπεῖγον τῶν πραγμάτων ἀναγκαζόμενος.	καί πάρειμι οὔτε οἶκος ἄγω δύναμις οὔτε πόλεμος προσδοκάω , αὐτός δέ ὁ Θεσσαλός χράω2 πρός ὁ κατεπείγω ὁ πρᾶγμα ἀναγκάζω .
407605	tlg0007.tlg021.perseus-grc2	ἐν τούτῳ δὲ πάλιν τῶν κατὰ Μακεδονίαν ταραττομένων ὁ γὰρ Πτολεμαῖος ἀνῃρήκει τὸν βασιλέα καὶ τὴν ἀρχὴν κατέσχεν, οἱ δὲ φίλοι τοῦ τεθνηκότος ἐκάλουν τὸν Πελοπίδαν, βουλόμενος μὲν ἐπιφανῆναι τοῖς πράγμασιν, ἰδίους δὲ στρατιώτας οὐκ ἔχων, μισθοφόρους τινὰς αὐτόθεν προσλαβόμενος Μετὰ τούτων εὐθὺς ἐβάδιζεν ἐπὶ τὸν Πτολεμαῖον, ὡς δʼ ἐγγὺς ἀλλήλων ἐγένοντο, τοὺς μὲν μισθοφόρους Πτολεμαῖος χρήμασι διαφθείρας ἔπεισεν ὡς αὐτὸν μεταστῆναι, τοῦ δὲ Πελοπίδου τὴν δόξαν αὐτὴν καὶ τοὔνομα δεδοικώς ἀπήντησεν ὡς κρείσσονι, καὶ δεξιωσάμενος καὶ δεηθεὶς ὡμολόγησε τὴν μὲν ἀρχὴν τοῖς τοῦ τεθνηκότος ἀδελφοῖς διαφυλάξειν, Θηβαίοις δὲ τὸν αὐτὸν ἐχθρὸν ἕξειν καὶ φίλον ὁμήρους δʼ ἐπὶ τούτοις τὸν υἱὸν Φιλόξενον ἔδωκε καὶ πεντήκοντα τῶν ἑταίρων, τούτους μὲν οὖν ἀπέστειλεν εἰς Θήβας ὁ Πελοπίδας, αὐτὸς δὲ βαρέως φέρων τὴν τῶν μισθοφόρων προδοσίαν, καὶ πυνθανόμενος τὰ πλεῖστα τῶν χρημάτων αὐτοῖς καὶ παῖδας καὶ γυναῖκας ἀποκεῖσθαι περὶ Φάρσαλον, ὥστε τούτων κρατήσας ἱκανὴν δίκην ὧν καθύβρισται λήψεσθαι, συναγαγὼν τῶν Θεσσαλῶν τινας ἧκεν εἰς Φάρσαλον.	ἐν οὗτος δέ πάλιν ὁ κατά Μακεδονία ταράσσω ὁ γάρ Πτολεμαῖος  ὁ βασιλεύς καί ὁ ἀρχή κατέχω , ὁ δέ φίλος ὁ ἀποθνῄσκω καλέω ὁ Πελοπίδης ,  μέν ἐπιφαίνω ὁ πρᾶγμα , ἴδιος δέ στρατιώτης οὐ ἔχω , μισθοφόρος  αὐτός προσλαμβάνω μετά οὗτος εὐθύς βαδίζω ἐπί ὁ Πτολεμαῖος , ὡς δέ ἐγγύς ἀλλήλων γίγνομαι , ὁ μέν μισθοφόρος Πτολεμαῖος χρῆμα διαφθείρω πείθω ὡς αὐτός μεθίστημι , ὁ δέ Πελοπίδης ὁ δόξα αὐτός καί ὄνομα δείδω ἀπαντάω ὡς  , καί  καί δέω2 ὁμολογέω ὁ μέν ἀρχή ὁ ὁ ἀποθνῄσκω ἀδελφός διαφυλάσσω ,  δέ ὁ αὐτός ἐχθρός ἔχω καί φίλος ὅμηρος δέ ἐπί οὗτος ὁ υἱός Φιλόξενος δίδωμι καί  ὁ ἑταῖρος , οὗτος μέν οὖν ἀποστέλλω εἰς Θῆβαι ὁ Πελοπίδης , αὐτός δέ βαρύς φέρω ὁ ὁ μισθοφόρος προδοσία , καί  ὁ πλεῖστος ὁ χρῆμα αὐτός καί παῖς καί γυνή ἀπόκειμαι περί  , ὥστε οὗτος κρατέω ἱκανός δίκη ὅς  λαμβάνω , συνάγω ὁ  τις ἵημι εἰς  .
407606	tlg0007.tlg021.perseus-grc2	ἀρτίως δʼ αὐτοῦ παρεληλυθότος Ἀλέξανδρος ὁ τύραννος ἐπεφαίνετο Μετὰ τῆς δυνάμεως.	ἄρτιος δέ αὐτός παρέρχομαι Ἀλέξανδρος ὁ τύραννος ἐπιφαίνω μετά ὁ δύναμις .
407607	tlg0007.tlg021.perseus-grc2	καὶ νομίσαντες οἱ περὶ τὸν Πελοπίδαν ἀπολογησόμενον ἥκειν ἐβάδιζον αὐτοὶ πρὸς αὐτόν, ἐξώλη μὲν ὄντα καὶ μιαιφόνον εἰδότες, διὰ δὲ τὰς Θήβας καὶ τὸ περὶ αὐτοὺς ἀξίωμα καὶ δόξαν οὐδὲν ἂν παθεῖν προσδοκήσαντες.	καί νομίζω ὁ περί ὁ Πελοπίδης  ἥκω βαδίζω  πρός αὐτός ,  μέν εἰμί καί  οἶδα , διά δέ ὁ Θῆβαι καί ὁ περί αὐτός ἀξίωμα καί δόξα  ἐάν πάσχω προσδοκάω .
407608	tlg0007.tlg021.perseus-grc2	ὁ δέ, ὡς εἶδεν ἀνόπλους καὶ μόνους προσιόντας, ἐκείνους μὲν εὐθὺς συνέλαβε, τὴν δὲ Φάρσαλον κατέσχε, φρίκην δὲ καὶ φόβον ἐνειργάσατο τοῖς ὑπηκόοις πᾶσιν ὥς γε μετά τὴν τηλικαύτην ἀδικίαν καὶ τόλμαν ἀφειδήσων ἁπάντων, καὶ χρησόμενος οὕτω τοῖς παραπίπτουσιν ἀνθρώποις καὶ πράγμασιν ὡς τότε γε κομιδῇ τὸν ἑαυτοῦ βίον ἀπεγνωκώς.	ὁ δέ , ὡς ὁράω  καί μόνος  , ἐκεῖνος μέν εὐθύς συλλαμβάνω , ὁ δέ  κατέχω , φρίκη δέ καί φόβος ἐνεργάζομαι ὁ ὑπήκοος πᾶς ὡς γε μετά ὁ τηλικοῦτος ἀδικία καί τόλμα  ἅπας , καί χράομαι οὕτως ὁ παραπίπτω ἄνθρωπος καί πρᾶγμα ὡς τότε γε κομιδῇ ὁ ἑαυτοῦ βίος ἀπογιγνώσκω .
407609	tlg0007.tlg021.perseus-grc2	οἱ μὲν οὖν Θηβαῖοι ταῦτα ἀκούσαντες ἔφερόν βαρέως καὶ στρατιὰν ἐξέπεμπον εὐθύς, διʼ ὀργήν τινα πρὸς τὸν Ἐπαμεινώνδαν ἑτέρους ἀποδείξαντες ἄρχοντας, τὸν δὲ Πελοπίδαν εἰς τὰς Φερὰς ἀπαγαγὼν ὁ τύραννος τὸ μὲν πρῶτον εἴα τοὺς βουλομένους αὐτῷ διαλέγεσθαι, νομίζων ἐλεεινὸν γεγονέναι καὶ ταπεινὸν ὑπὸ τῆς συμφορᾶς·	ὁ μέν οὖν  οὗτος ἀκούω  βαρύς καί στρατιά  εὐθύς , διό ὀργή  πρός ὁ Ἐπαμεινώνδας ἕτερος ἀποδείκνυμι ἄρχων , ὁ δέ Πελοπίδης εἰς ὁ Φεραί ἀπάγω ὁ τύραννος ὁ μέν πρῶτος ἐάω ὁ  αὐτός διαλέγω , νομίζω ἐλεεινός γίγνομαι καί ταπεινός ὑπό ὁ συμφορά ·
407610	tlg0007.tlg021.perseus-grc2	ἐπεὶ δὲ τοὺς μὲν Φεραίους ὁ Πελοπίδας ὀδυρομένους παρεκάλει θαρρεῖν, ὡς νῦν μάλιστα δώσοντος τοῦ τυράννου δίκην, πρὸς δὲ αὐτὸν ἐκεῖνον ἀποστείλας ἔλεγεν ὡς ἄτοπός ἐστι τοὺς μὲν ἀθλίους πολίτας καὶ μηδὲν ἀδικοῦντας ὁσημέραι στρεβλῶν καὶ φονεύων, αὐτοῦ δὲ φειδόμενος, ὃν μάλιστα γινώσκει τιμωρησόμενον αὐτὸν ἄνπερ διαφύγῃ, θαυμάσας τὸ φρόνημα καὶ τὴν ἄδειαν αὐτοῦ, τί δέ, φησὶ, σπεύδει Πελοπίδας ἀποθανεῖν;	ἐπεί δέ ὁ μέν  ὁ Πελοπίδης  παρακαλέω θαρσέω , ὡς νῦν μάλιστα  ὁ τύραννος δίκη , πρός δέ αὐτός ἐκεῖνος ἀποστέλλω λέγω ὡς  εἰμί ὁ μέν ἄθλιος πολίτης καί  ἀδικέω  στρεβλόω καί φονεύω , αὐτός δέ  , ὅς μάλιστα γιγνώσκω  αὐτός  διαφεύγω , θαυμάζω ὁ φρόνημα καί ὁ ἄδεια αὐτός , τίς δέ , φημί , σπεύδω Πελοπίδης ἀποθνῄσκω ;
407611	tlg0007.tlg021.perseus-grc2	κἀκεῖνος ἀκούσας, ὅπως, εἶπε, σὺ τάχιον ἀπολῇ, μᾶλλον ἢ νῦν θεομισὴς γενόμενος.	ἐκεῖνος ἀκούω , ὅπως , λέγω , σύ  ἄπολις , μᾶλλον ἤ νῦν θεομισής γίγνομαι .
407612	tlg0007.tlg021.perseus-grc2	ἐκ τούτου διεκώλυσεν ἐντυγχάνειν αὐτῷ τοὺς ἐκτός.	ἐκ οὗτος διακωλύω ἐντυγχάνω αὐτός ὁ ἐκτός .
407613	tlg0007.tlg021.perseus-grc2	ἡ δὲ Θήβη, θυγάτηρ μὲν Ἰάσονος οὖσα, γυνὴ δὲ Ἀλεξάνδρου, πυνθανομένη παρὰ τῶν φυλαττόντων Πελοπίδαν τὸ θαρραλέον αὐτοῦ καὶ γενναῖον, ἐπεθύμησεν ἰδεῖν τὸν ἄνδρα καὶ προσειπεῖν.	ὁ δέ Θῆβαι , θυγάτηρ μέν Ἰάσων εἰμί , γυνή δέ Ἀλέξανδρος ,  παρά ὁ φυλάσσω Πελοπίδης ὁ θαρσαλέος αὐτός καί γενναῖος , ἐπιθυμέω ὁράω ὁ ἀνήρ καί προσαγορεύω .
407614	tlg0007.tlg021.perseus-grc2	ὡς δὲ ἦλθε πρὸς αὐτόν καὶ ἅτε δὴ γυνὴ τὸ μὲν μέγεθος τοῦ ἤθους οὐκ εὐθὺς ἐν τοσαύτῃ συμφορᾷ κατεῖδε, κουρᾷ δὲ καὶ στολῇ καὶ διαίτῃ τεκμαιρομένη λυπρὰ καὶ μὴ πρέποντα τῇ δόξῃ πάσχειν αὐτόν ἀπεδάκρυσε, τὸ μὲν πρῶτον ἀγνοῶν ὁ Πελοπίδας τίς εἴη γυναικῶν, ἐθαύμαζεν, ὡς δὲ ἔγνω, προσηγόρευσεν αὐτὴν πατρόθεν ἦν γὰρ τῷ Ἰάσονι συνήθης καὶ φίλος, εἰπούσης δὲ ἐκείνης, ἐλεῶ σου τὴν γυναῖκα, καὶ γὰρ ἐγώ σε, εἶπεν, ὅτι ἄδετος οὖσα ὑπομένεις Ἀλέξανδρον.	ὡς δέ ἔρχομαι πρός αὐτός καί  δή γυνή ὁ μέν μέγεθος ὁ ἦθος οὐ εὐθύς ἐν τοσοῦτος συμφορά καθοράω ,  δέ καί στολή καί δίαιτα  λυπρός καί μή πρέπω ὁ δόξα πάσχω αὐτός  , ὁ μέν πρῶτος ἀγνοέω ὁ Πελοπίδης τις εἰμί γυνή , θαυμάζω , ὡς δέ γιγνώσκω , προσαγορεύω αὐτός πατήρ εἰμί γάρ τῷ Ἰάσων συνήθης καί φίλος , λέγω δέ ἐκεῖνος , ἐλεέω  ὁ γυνή , καί γάρ   , λέγω , ὅτι2 ἄδετος εἰμί ὑπομένω Ἀλέξανδρος .
407615	tlg0007.tlg021.perseus-grc2	οὗτος ἔθιγέ πως ὁ λόγος τῆς γυναικός·	οὗτος  πως ὁ λόγος ὁ γυνή ·
407616	tlg0007.tlg021.perseus-grc2	ἐβαρύνετο γὰρ τὴν ὠμότητα καὶ τὴν ὕβριν τοῦ τυράννου, μετὰ τῆς ἄλλης ἀσελγείας καὶ τὸν νεώτατον αὐτῆς τῶν ἀδελφῶν παιδικὰ πεποιημένου.	βαρύνω γάρ ὁ ὠμότης καί ὁ ὕβρις ὁ τύραννος , μετά ὁ ἄλλος ἀσέλγεια καί ὁ νέος αὐτός ὁ ἀδελφός παιδικά  .
407617	tlg0007.tlg021.perseus-grc2	διὸ καὶ συνεχῶς φοιτῶσα πρὸς τὸν Πελοπίδαν καὶ παρρησιαζομένη περὶ ὧν ἔπασχεν ὑπεπίμπλατο θυμοῦ καὶ φρονήματος καὶ δυσμενείας πρὸς τὸν Ἀλέξανδρον.	διό καί συνεχής φοιτάω πρός ὁ Πελοπίδης καί  περί ὅς πάσχω  θυμός καί φρόνημα καί δυσμένεια πρός ὁ Ἀλέξανδρος .
407618	tlg0007.tlg021.perseus-grc2	ἐπεὶ δὲ οἱ στρατηγοὶ τῶν Θηβαίων εἰς τὴν Θετταλίαν ἐμβαλόντες ἔπραξαν οὐδέν, ἀλλὰ διʼ ἀπειρίαν ἢ δυστυχίαν αἰσχρῶς ἀνεχώρησαν, ἐκείνων μὲν ἕκαστον ἡ πόλις μυρίαις δραχμαῖς ἐζημίωσεν, Ἐπαμεινώνδαν δὲ μετὰ δυνάμεως ἀπέστειλεν.	ἐπεί δέ ὁ στρατηγός ὁ  εἰς ὁ Θεσσαλία ἐμβάλλω πράσσω οὐδείς , ἀλλά διά ἀπειρία τίη δυστυχία αἰσχρός ἀναχωρέω , ἐκεῖνος μέν ἕκαστος ὁ πόλις μυρίος δραχμή ζημιόω , Ἐπαμεινώνδας δέ μετά δύναμις ἀποστέλλω .
407619	tlg0007.tlg021.perseus-grc2	εὐθὺς οὖν κίνησίς τις μεγάλη Θετταλῶν ἦν ἐπαιρομένων πρὸς τὴν δόξαν τοῦ στρατηγοῦ, καὶ τὰ πράγματα τοῦ τυράννου ῥοπῆς ἐδεῖτο μικρᾶς ἀπολωλέναι·	εὐθύς οὖν κίνησις τις μέγας Θεσσαλός εἰμί ἐπαίρω πρός ὁ δόξα ὁ στρατηγός , καί ὁ πρᾶγμα ὁ τύραννος ῥοπή δέω μικρός ἀπόλλυμι ·
407620	tlg0007.tlg021.perseus-grc2	τοσοῦτος ἐνεπεπτώκει φόβος τοῖς περὶ αὐτὸν ἡγεμόσι καὶ φίλοις, τοσαύτη δὲ τοὺς ὑπηκόους ὁρμὴ πρὸς ἀπόστασιν εἶχε καὶ χαρὰ τοῦ μέλλοντος, ὡς νῦν ἐποψομένους δίκην διδόντα τὸν τύραννον, οὐ μὴν ἀλλʼ Ἐπαμεινώνδας τὴν αὐτοῦ δόξαν ἐν ὑστέρῳ τῆς Πελοπίδου σωτηρίας τιθέμενος, καὶ δεδοικὼς μὴ τῶν πραγμάτων ταραχθέντων ἀπογνοὺς ἑαυτὸν Ἀλέξανδρος ὥσπερ θηρίον τράπηται πρὸς ἐκεῖνον, ἐπῃωρεῖτο τῷ πολέμῳ, καὶ κύκλῳ περιϊὼν, τῇ παρασκευῇ καὶ τῇ μελλήσει κατεσκεύαζε καὶ συνέστελλε τὸν τύραννον, ὡς μήτε ἀντεῖναι τὸ αὔθαδες αὐτοῦ καὶ θρασυνόμενον μήτε τὸ πικρὸν καὶ θυμοειδὲς ἐξερεθίσαι, πυνθανόμενος τὴν ὠμότητα καὶ τὴν ὀλιγωρίαν τῶν καλῶν καὶ δικαίων, ὡς ζῶντας μὲν ἀνθρώπους κατώρυττεν, ἑτέροις δὲ δέρματα συῶν ἀγρίων καὶ ἄρκτων περιτιθεὶς καὶ τοὺς θηρατικοὺς ἐπάγων κύνας καὶ διέσπα καὶ κατηκόντιζε, παιδιᾷ ταύτῃ χρώμενος, Μελιβοίᾳ δὲ καὶ Σκοτούσῃ, πόλεσιν ἐνσπόνδοις καὶ φίλαις, ἐκκλησιαζούσαις περιστήσας ἅμα τοὺς δορυφόρους ἡβηδὸν ἀπέσφαξε, τὴν δὲ λόγχην ᾗ Πολύφρονα τὸν θεῖον ἀπέκτεινε καθιερώσας καὶ καταστέψας, ἔθυεν ὥσπερ θεῷ καὶ Τύχωνα προσηγόρευε.	τοσοῦτος ἐμπίπτω φόβος ὁ περί αὐτός ἡγεμών καί φίλος , τοσοῦτος δέ ὁ ὑπήκοος  πρός ἀπόστασις ἔχω καί χαρά ὁ μέλλω , ὡς νῦν ἐφοράω δίκη δίδωμι ὁ τύραννος , οὐ μήν  Ἐπαμεινώνδας ὁ αὐτός δόξα ἐν ὕστερος ὁ Πελοπίδης σωτηρία τίθημι , καί δείδω μή ὁ πρᾶγμα ταράσσω ἀπογιγνώσκω ἑαυτοῦ Ἀλέξανδρος ὥσπερ θηρίον τραπέω πρός ἐκεῖνος , ἐπαιωρέω ὁ πόλεμος , καί κύκλος  , ὁ παρασκευή καί ὁ μέλλω κατασκευάζω καί συστέλλω ὁ τύραννος , ὡς  ἀνατείνω ὁ  αὐτός καί θρασύνω  ὁ πικρός καί θυμοειδής  ,  ὁ ὠμότης καί ὁ ὀλιγωρία ὁ καλός καί δίκαιος , ὡς ζήω μέν ἄνθρωπος  , ἕτερος δέ δέρμα ὗς ἄγριος καί   καί ὁ  ἐπάγω κύων καί  καί  ,  οὗτος χράω2 ,  δέ καί  , πόλις  καί φίλος ,  περιίστημι ἅμα ὁ δορυφόρος ἡβηδόν ἀποσφάζω , ὁ δέ λόγχη ὅς  ὁ θεῖος ἀποκτείνω καθιερόω καί  , θύω ὥσπερ θεός καί Τύχων  .
