id	filename	tokens	lemmas
707109	tlg0086.tlg034.1st1K-grc1	Ἡ δὲ ὄψις ψυχαγωγικὸν μέν, ἀτεχνότατον δὲ καὶ ἥκιστα οἰκεῖον τῆς ποιητικῆς·	ὁ δέ ὄψις ψυχαγωγικός μέν , ἄτεχνος δέ καί ἥκιστος οἰκεῖος ὁ ποιητικός ·
707110	tlg0086.tlg034.1st1K-grc1	ἡ γὰρ τῆς τραγῳδίας δύναμις καὶ ἄνευ ἀγῶνος καὶ ὑποκριτῶν ἐστίν.	ὁ γάρ ὁ τραγῳδία δύναμις καί ἄνευ ἀγών καί  εἰμί .
707111	tlg0086.tlg034.1st1K-grc1	Ἔτι δὲ κυριωτέρα περὶ τὴν ἀπεργασίαν τῶν ὄψεων ἡ τοῦ σκευοποιοῦ τέχνη τῆς τῶν ποιητῶν ἐστίν.	ἔτι δέ κύριος περί ὁ ἀπεργασία ὁ  ὁ ὁ σκευοποιός τέχνη ὁ ὁ ποιητής εἰμί .
707112	tlg0086.tlg034.1st1K-grc1	Διωρισμένων δὲ τούτων, λέγωμεν μετὰ ταῦτα ποίαν τινὰ δεῖ τὴν σύστασιν εἶναι τῶν πραγμάτων, ἐπειδὴ τοῦτο καὶ πρῶτον καὶ μέγιστον τῆς τραγῳδίας ἐστίν.	δέ οὗτος , λέγω μετά οὗτος πόα  δέω ὁ σύστασις εἰμί ὁ πρᾶγμα , ἐπεί οὗτος καί πρῶτος καί μέγας ὁ τραγῳδία εἰμί .
707113	tlg0086.tlg034.1st1K-grc1	Κεῖται δ᾿ ἡμῖν τὴν τραγῳδίαν τελείας καὶ ὅλης πράξεως εἶναι μίμησιν, ἐχούσης τι μέγεθος·	ἐγώ ὁ τραγῳδία  καί ὅλος πρᾶξις εἰμί μίμησις , ἔχω τις μέγεθος ·
707114	tlg0086.tlg034.1st1K-grc1	ἔστι γὰρ ὅλον καὶ μηδὲν ἔχον μέγεθος.	εἰμί γάρ ὅλος καί  ἔχω μέγεθος .
707115	tlg0086.tlg034.1st1K-grc1	Ὅλον δ᾿ ἐστὶ τὸ ἔχον ἀρχὴν καὶ μέσον καὶ τελευτήν.	εἰμί ὁ ἔχω ἀρχή καί μέσος καί τελευτή .
707116	tlg0086.tlg034.1st1K-grc1	Ἀρχὴ δ᾿ ἐστὶν ὃ αὐτὸ μὲν μὴ ἐξ ἀνάγκης μετ’ ἄλλο ἐστί, μετ’ ἐκεῖνο δ᾿ ἕτερον πέφυκεν εἶναι ἢ γίνεσθαι·	ἀρχή  εἰμί ὁ αὐτός μέν μή ἐκ ἀνάγκη μετά ἄλλος εἰμί , μετά ἐκεῖνος  ἕτερος φύω εἰμί ἤ γίγνομαι ·
707117	tlg0086.tlg034.1st1K-grc1	τελευτὴ δὲ τοὐναντίον ὃ αὐτὸ μετ’ ἄλλο πέφυκεν εἶναι, ἢ ἐξ ἀνάγκης ἢ ὡς ἐπὶ τὸ πολύ, μετὰ δὲ τοῦτο ἄλλο οὐδέν·	τελευτή δέ ἐναντίος ὁ αὐτός μετά ἄλλος φύω εἰμί , ἤ ἐκ ἀνάγκη ἤ ὡς ἐπί ὁ πολύς , μετά δέ οὗτος ἄλλος οὐδείς ·
707118	tlg0086.tlg034.1st1K-grc1	μέσον δὲ ὃ καὶ αὐτὸ μετ’ ἄλλο καὶ μετ’ ἐκεῖνο ἕτερον.	μέσος δέ ὅς καί αὐτός μετά ἄλλος καί μετά ἐκεῖνος ἕτερος .
707119	tlg0086.tlg034.1st1K-grc1	Δεῖ ἄρα τοὺς συνεστῶτας εὖ μύθους μήθ᾿ ὁπόθεν ἔτυχεν ἄρχεσθαι μήθ᾿ ὅπου ἔτυχε τελευτᾶν, ἀλλὰ κεχρῆσθαι ταῖς εἰρημέναις ἰδέαις.	ἄρα ὁ συνίστημι εὖ μῦθος  ὁπόθεν τυγχάνω ἄρχω  ὅπου τυγχάνω τελευτάω , ἀλλά χράω ὁ  ἰδέα .
707120	tlg0086.tlg034.1st1K-grc1	Ἔτι δ᾿ ἐπεὶ τὸ καλὸν καὶ ζῷον καὶ ἅπαν πρᾶγμα ὃ συνέστηκεν ἔκ τινων, οὐ μόνον ταῦτα τεταγμένα δεῖ ἔχειν, ἀλλὰ καὶ μέγεθος ὑπάρχειν μὴ τὸ τυχόν·	ἔτι  ἐπεί ὁ καλός καί ζῷον καί ἅπας πρᾶγμα ὅς συνίστημι ἐκ  , οὐ μόνος οὗτος τάσσω δέω ἔχω , ἀλλά καί μέγεθος ὑπάρχω μή ὁ  ·
707121	tlg0086.tlg034.1st1K-grc1	τὸ γὰρ καλὸν ἐν μεγέθει καὶ τάξει ἐστί, διὸ οὔτε πάμμικρον ἄν τι γένοιτο καλὸν ζῷον( συγχεῖται γὰρ ἡ θεωρία ἐγγὺς τοῦ ἀναισθήτου χρόνου γινομένη) οὔτε παμμέγεθες·	ὁ γάρ καλός ἐν μέγεθος καί τάξις εἰμί , διό οὔτε πάμμικρος ἐάν τι γίγνομαι καλός ζῷον ( συγχέω γάρ ὁ θεωρία  ὁ ἀναίσθητος χρόνος  ) οὔτε  ·
707122	tlg0086.tlg034.1st1K-grc1	οὐ γὰρ ἅμα ἡ θεωρία γίνεται, ἀλλ᾿ οἴχεται τοῖς θεωροῦσι τὸ ἓν καὶ τὸ ὅλον ἐκ τῆς θεωρίας, οἷον εἰ μυρίων σταδίων εἴη ζῷον.	οὐ γάρ ἅμα ὁ θεωρία γίγνομαι ,  οἴχομαι ὁ θεωρέω ὁ  καί ὁ ὅλος ἐκ ὁ θεωρία , οἷος εἰ μυρίος στάδιον ἐάω ζῷον .
707123	tlg0086.tlg034.1st1K-grc1	Ὥστε δεῖ καθάπερ ἐπὶ τῶν σωμάτων καὶ ἐπὶ τῶν ζῴων ἔχειν μὲν μέγεθος, τοῦτο δὲ εὐσύνοπτον εἶναι, οὕτω καὶ ἐπὶ τῶν μύθων ἔχειν μὲν μῆκος, τοῦτο δ᾿ εὐμνημόνευτον εἶναι.	δέω καθά ἐπί ὁ σῶμα καί ἐπί ὁ ζῷον ἔχω μέν μέγεθος , οὗτος δέ  εἰμί , οὕτως καί ἐπί ὁ μῦθος ἔχω μέν μῆκος , οὗτος  εὐμνημόνευτος εἰμί .
707124	tlg0086.tlg034.1st1K-grc1	Τοῦ δὲ μήκους ὅρος πρὸς μὲν τοὺς ἀγῶνας καὶ τὴν αἴσθησιν οὐ τῆς τέχνης ἐστίν·	ὁ δέ  ὅρος πρός μέν ὁ ἀγών καί ὁ αἴσθησις οὐ ὁ τέχνη εἰμί ·
707125	tlg0086.tlg034.1st1K-grc1	εἰ γὰρ ἔδει ἑκατὸν τραγῳδίας ἀγωνίζεσθαι, πρὸς κλεψύδραν ἂν ἠγωνίζοντο, ὥσπερ ποτὲ καὶ ἄλλοτε φασίν.	εἰ γάρ δέω  τραγῳδία ἀγωνίζομαι , πρός κλεψύδρα ἐάν ἀγωνίζομαι , ὥσπερ ποτε καί ἄλλος φημί .
707126	tlg0086.tlg034.1st1K-grc1	Ὁ δὲ κατ’ αὐτὴν τὴν φύσιν τοῦ πράγματος ὅρος, ἀεὶ μὲν ὁ μείζων μέχρι τοῦ σύνδηλος εἶναι καλλίων ἐστὶ κατὰ τὸ μέγεθος, ὡς δὲ ἁπλῶς διορίσαντας εἰπεῖν, ἐν ὅσῳ μεγέθει κατὰ τὸ εἰκὸς ἢ τὸ ἀναγκαῖον ἐφεξῆς γιγνομένων συμβαίνει εἰς εὐτυχίαν ἐκ δυστυχίας ἢ ἐξ εὐτυχίας εἰς δυστυχίαν μεταβάλλειν, ἱκανὸς ὅρος ἐστὶ τοῦ μεγέθους.	ὁ δέ κατά αὐτός ὁ φύσις ὁ πρᾶγμα ὅρος , ἀεί μέν ὁ μέγας μέχρι ὁ σύνδηλος εἰμί  εἰμί κατά ὁ μέγεθος , ὡς δέ ἁπλόος διορίζω λέγω , ἐν ὅσος μέγεθος κατά ὁ ἔοικα τίη ὁ ἀναγκαῖον ἐφεξῆς  συμβαίνω εἰς εὐτυχία ἐκ δυστυχία τίη ἐκ εὐτυχία εἰς δυστυχία μεταβάλλω , ἱκανός ὅρος εἰμί ὁ μέγεθος .
707127	tlg0086.tlg034.1st1K-grc1	Μῦθος δ᾿ ἐστὶν εἷς, οὐχ ὥσπερ τινὲς οἴονται, ἐὰν περὶ ἕνα ᾖ·	μῦθος  εἰμί  , οὐ ὥσπερ  οἴομαι , ἐάν περί  εἰμί ·
707128	tlg0086.tlg034.1st1K-grc1	πολλὰ γὰρ καὶ ἄπειρα τῷ γένει συμβαίνει, ἐξ ὧν ἐνίων οὐδέν ἐστιν ἕν.	πολύς γάρ καί  τῷ γένος συμβαίνω , ἐκ ὅς  οὐδείς εἰμί  .
707129	tlg0086.tlg034.1st1K-grc1	Οὕτω δὲ καὶ πράξεις ἑνὸς πολλαί εἰσιν, ἐξ ὧν μία οὐδεμία γίνεται πρᾶξις.	οὕτως δέ καί πρᾶξις  πολύς εἰμί , ἐκ ὅς  οὐδείς γίγνομαι πρᾶξις .
707130	tlg0086.tlg034.1st1K-grc1	Διὸ πάντες ἐοίκασιν ἁμαρτάνειν, ὅσοι τῶν ποιητῶν Ἡρακληΐδα καὶ θησηΐδα καὶ τὰ τοιαῦτα ποιήματα πεποιήκασιν·	πᾶς ἔοικα ἁμαρτάνω , ὅσος ὁ ποιητής  καί  καί ὁ τοιοῦτος ποίημα ποιέω ·
707131	tlg0086.tlg034.1st1K-grc1	οἴονται γὰρ ἐπεὶ εἷς ἦν ὁ Ἡρακλῆς, ἕνα καὶ τὸν μῦθον εἶναι προσήκειν.	οἴομαι γάρ   εἰμί ὁ Ἡρακλέης ,  καί ὁ μῦθος εἰμί προσήκω .
707132	tlg0086.tlg034.1st1K-grc1	Ὁ δ᾿ Ὅμηρος, ὥσπερ καὶ τὰ ἄλλα διαφέρει, καὶ τοῦτ᾿ ἔοικε καλῶς ἰδεῖν, ἤτοι διὰ τέχνην ἢ διὰ φύσιν·	Ὅμηρος , ὥσπερ καί ὁ ἄλλος διαφέρω , καί  ἔοικα καλός ὁράω , ἤτοι διά τέχνη τίη διά φύσις ·
707133	tlg0086.tlg034.1st1K-grc1	Ὀδύσσειαν γὰρ ποιῶν οὐκ ἐποίησεν ἅπαντα ὅσα αὐτῷ συνέβη, οἶον πληγῆναι μὲν ἐν τῷ Παρνασσῷ, μανῆναι δὲ προσποιήσασθαι ἐν τῷ ἀγερμῷ, ὧν οὐδὲν θατέρου γενομένου ἀναγκαῖον ἦν ἢ εἰκὸς θάτερον γενέσθαι, ἀλλὰ περὶ μίαν πρᾶξιν, οἵαν λέγομεν, τὴν Ὀδύσσειαν συνέστησεν, ὁμοίως δὲ καὶ τὴν Ἰλιάδα.	Ὀδύσσεια γάρ ποιέω οὐ ποιέω ἅπας ὅσος αὐτός συμβαίνω , οἶος πλήσσω μέν ἐν ὁ Παρνασός , μαίνομαι δέ προσποιέω ἐν ὁ ἀγερμός , ὅς οὐδείς ἕτερος γίγνομαι ἀναγκαῖον εἰμί τίη ἔοικα  γίγνομαι , ἀλλά περί  πρᾶξις , οἷος λέγω , ὁ Ὀδύσσεια συνίστημι , ὅμοιος δέ καί ὁ Ἰλιάς .
707134	tlg0086.tlg034.1st1K-grc1	Χρὴ οὖν, καθάπερ καὶ ἐν ταῖς ἄλλαις μιμητικαῖς ἡ μία μίμησις ἑνός ἐστιν, οὕτω καὶ τὸν μῦθον, ἐπεὶ πράξεως μίμησίς ἐστι, μιᾶς τε εἶναι καὶ ταύτης ὅλης, καὶ τὰ μέρη συνεστάναι τῶν πραγμάτων οὕτως ὥστε μετατιθεμένου τινὸς μέρους ἢ ἀφαιρουμένου διαφέρεσθαι καὶ κινεῖσθαι τὸ ὅλον·	οὖν , καθά καί ἐν ὁ ἄλλος  ὁ  μίμησις  εἰμί , οὕτως καί ὁ μῦθος , ἐπεί πρᾶξις  εἰμί ,  τε εἰμί καί οὗτος ὅλος , καί ὁ μέρος συνίστημι ὁ πρᾶγμα οὕτως ὥστε μετατίθημι τις μέρος τίη  διαφέρω καί κινέω ὁ ὅλος ·
707135	tlg0086.tlg034.1st1K-grc1	ὃ γὰρ προσὸν ἢ μὴ προσὸν μηδὲν ποιεῖ ἐπίδηλον, οὐδὲ μόριον τοῦ ὅλου ἐστίν.	ὁ γάρ  τίη μή   ποιέω ἐπίδηλος , οὐδέ μόριον ὁ  εἰμί .
707136	tlg0086.tlg034.1st1K-grc1	Φανερὸν δὲ ἐκ τῶν εἰρημένων καὶ ὅτι οὐ τὸ τὰ γενόμενα λέγειν, τοῦτο ποιητοῦ ἔργον ἐστίν, ἀλλ᾿ οἷα ἂν γένοιτο, καὶ τὰ δυνατὰ κατὰ τὸ εἰκὸς ἢ τὸ ἀναγκαῖον.	δέ ἐκ ὁ λέγω καί ὅτι2 οὐ ὁ ὁ γίγνομαι λέγω , οὗτος ποιητής ἔργον εἰμί ,  οἷος ἀνά γίγνομαι , καί ὁ δυνατός κατά ὁ ἔοικα τίη ὁ ἀναγκαῖον .
707137	tlg0086.tlg034.1st1K-grc1	Ὁ γὰρ ἱστορικὸς καὶ ὁ ποιητὴς οὐ τῷ ἢ ἔμμετρα λέγειν ἢ ἄμετρα διαφέρουσιν·	γάρ ἱστορικός καί ὁ ποιητής οὐ τῷ τίη  λέγω ἤ  διαφέρω ·
707138	tlg0086.tlg034.1st1K-grc1	εἴη γὰρ ἂν τὰ Ἡροδότου εἰς μέτρα τεθῆναι, καὶ οὐδὲν ἧττον ἂν εἴη ἱστορία τις μετὰ μέτρου ἢ ἄνευ μέτρων·	εἰμί γάρ ἄν ὁ Ἡρόδοτος εἰς μέτρον τίθημι , καί  ἥσσων ἄν εἰμί ἱστορία  μετά μέτρον ἤ ἄνευ μέτρον ·
707139	tlg0086.tlg034.1st1K-grc1	ἀλλὰ τούτῳ διαφέρει, τῷ τὸν μὲν τὰ γενόμενα λέγειν, τὸν δὲ οἷα ἂν γένοιτο.	ἀλλά οὗτος διαφέρω , τῷ ὁ μέν ὁ  λέγω , ὁ δέ οἷος ἐάν γίγνομαι .
707140	tlg0086.tlg034.1st1K-grc1	Διὸ καὶ φιλοσοφώτερον καὶ σπουδαιότερον ποίησις ἱστορίας ἐστίν·	καί φιλόσοφος καί σπουδαῖος ποίησις ἱστορία εἰμί ·
707141	tlg0086.tlg034.1st1K-grc1	ἡ μὲν γὰρ ποίησις μᾶλλον τὰ καθόλου, ἡ δ᾿ ἱστορία τὰ καθ’ ἕκαστον λέγει.	ὁ μέν γάρ ποίησις μᾶλλον ὁ καθόλου , ὁ  ἱστορία ὁ κατά ἕκαστος λέγω .
707142	tlg0086.tlg034.1st1K-grc1	Ἔστι δὲ καθόλου μέν, τῷ ποίῳ τὰ ποῖ᾿ ἄττα συμβαίνει λέγειν ἢ πράττειν κατὰ τὸ εἰκὸς ἢ τὸ ἀναγκαῖον, οὗ στοχάζεται ἡ ποίησις ὀνόματα ἐπιτιθεμένη·	εἰμί δέ καθόλου μέν , τῷ ποιός ὁ   συμβαίνω λέγω ἤ πράσσω κατά ὁ ἔοικα τίη ὁ ἀναγκαῖον , οὗ στοχάζομαι ὁ ποίησις ὄνομα  ·
707143	tlg0086.tlg034.1st1K-grc1	τὰ δὲ καθ’ ἕκαστον, τί Ἀλκιβιάδης ἔπραξεν ἢ τί ἔπαθεν.	ὁ δέ κατά ἕκαστος , τίς Ἀλκιβιάδης πράσσω ἤ τίς πάσχω .
707144	tlg0086.tlg034.1st1K-grc1	Ἐπὶ μὲν οὖν τῆς κωμῳδίας ἤδη τοῦτο δῆλον γέγονεν·	ἐπί μέν οὖν ὁ κωμῳδία ἤδη οὗτος δῆλος γίγνομαι ·
707145	tlg0086.tlg034.1st1K-grc1	συστήσαντες γὰρ τὸν μῦθον διὰ τῶν εἰκότων οὕτω τὰ τυχόντα ὀνόματα ἐπιτιθέασι, καὶ οὐχ ὥσπερ οἱ ἰαμβοποιοὶ περὶ τῶν καθ’ ἕκαστον ποιοῦσιν.	συνίστημι γάρ ὁ μῦθος διά ὁ εἰκός οὕτως ὁ τυγχάνω ὄνομα ἐπιτίθημι , καί οὐ ὥσπερ ὁ ἰαμβοποιός περί ὁ κατά ἕκαστος ποιέω .
707146	tlg0086.tlg034.1st1K-grc1	Ἐπὶ δὲ τῆς τραγῳδίας τῶν γενομένων ὀνομάτων ἀντέχονται.	δέ ὁ τραγῳδία ὁ γίγνομαι ὄνομα ἀντέχω .
707147	tlg0086.tlg034.1st1K-grc1	Αἴτιον δ᾿ ὅτι πιθανόν ἐστι τὸ δυνατόν·	αἴτιος  ὅτι2 πιθανός εἰμί ὁ δυνατός ·
707148	tlg0086.tlg034.1st1K-grc1	τὰ μὲν οὖν μὴ γενόμενα οὔπω πιστεύομεν εἶναι δυνατά, τὰ δὲ γενόμενα φανερὸν ὅτι δυνατά·	ὁ μέν οὖν μή γίγνομαι οὔπω πιστεύω εἰμί δυνατός , ὁ δέ γίγνομαι φανερός ὅτι2 δυνατός ·
707149	tlg0086.tlg034.1st1K-grc1	οὐ γὰρ ἂν ἐγένετο, εἰ ἦν ἀδύνατα.	οὐ γάρ ἄν γίγνομαι , εἰ εἰμί ἀδύνατος .
707150	tlg0086.tlg034.1st1K-grc1	Οὐ μὴν ἀλλὰ καὶ ἐν ταῖς τραγῳδίαις ἐνίαις μὲν ἓν ἢ δύο τῶν γνωρίμων ἐστὶν ὀνομάτων, τὰ δὲ ἄλλα πεποιημένα, ἐν ἐνίαις δὲ οὐθέν, οἷον ἐν τῷ Ἀγάθωνος ἄνθει·	οὐ μήν ἀλλά καί ἐν ὁ   μέν  τίη γε ὁ γνώριμος εἰμί ὄνομα , ὁ δέ  ποιέω , ἐν  δέ  , οἷος ἐν τῷ Ἀγάθων ἄνθος ·
707151	tlg0086.tlg034.1st1K-grc1	ὁμοίως γὰρ ἐν τούτῳ τά τε πράγματα καὶ τὰ ὀνόματα πεποίηται, καὶ οὐδὲν ἧττον εὐφραίνει.	ὅμοιος γάρ ἐν οὗτος ὁ τε πρᾶγμα καί ὁ ὄνομα ποιέω , καί οὐδείς ἥσσων εὐφραίνω .
707152	tlg0086.tlg034.1st1K-grc1	Ὥστ᾿ οὐ πάντως εἶναι ζητητέον τῶν παραδεδομένων μύθων, περὶ οὓς αἱ τραγῳδίαι εἰσίν, ἀντέχεσθαι.	οὐ πᾶς εἰμί ζητέω ὁ  μῦθος , περί ὅς ὁ τραγῳδία εἰμί , ἀντέχω .
707153	tlg0086.tlg034.1st1K-grc1	Καὶ γὰρ γελοῖον τοῦτο ζητεῖν, ἐπεὶ καὶ τὰ γνώριμα ὀλίγοις γνώριμά ἐστιν, ἀλλ᾿ ὅμως εὐφραίνει πάντας.	καί γάρ γέλοιος οὗτος ζητέω , ἐπεί καί ὁ γνώριμος ὀλίγος  εἰμί ,  ὅμως εὐφραίνω πᾶς .
707154	tlg0086.tlg034.1st1K-grc1	Δῆλον οὖν ἐκ τούτων ὅτι τὸν ποιητὴν μᾶλλον τῶν μύθων εἶναι δεῖ ποιητὴν ἢ τῶν μέτρων, ὅσῳ ποιητὴς κατὰ τὴν μίμησίν ἐστι, μιμεῖται δὲ τὰς πράξεις.	Δῆλος οὖν ἐκ οὗτος ὅτι2 ὁ ποιητής μᾶλλον ὁ μῦθος εἰμί δέω ποιητής ἤ ὁ  , ὅσος ποιητής κατά ὁ μίμησις εἰμί , μιμέομαι δέ ὁ πρᾶξις .
707155	tlg0086.tlg034.1st1K-grc1	Κἂν ἄρα συμβῇ γενόμενα ποιεῖν, οὐθὲν ἧττον ποιητής ἐστιν·	ἄρα  γίγνομαι ποιέω ,  ἥσσων ποιητής εἰμί ·
707156	tlg0086.tlg034.1st1K-grc1	τῶν γὰρ γενομένων ἔνια οὐδὲν κωλύει τοιαῦτα εἶναι οἷα ἂν εἰκὸς γενέσθαι καὶ δυνατὰ γενέσθαι, καθ’ ὃ ἐκεῖνος αὐτῶν ποιητής ἐστιν.	ὁ γάρ γίγνομαι   κωλύω τοιοῦτος εἰμί οἷος ἐάν ἔοικα γίγνομαι καί δυνατός γίγνομαι , κατά ὅς ἐκεῖνος αὐτός ποιητής εἰμί .
707157	tlg0086.tlg034.1st1K-grc1	Τῶν δὲ ἁπλῶν μύθων καὶ πράξεων αἱ ἐπεισοδιώδεις εἰσὶ χείρισται.	δέ ἁπλόος μῦθος καί πρᾶξις ὁ  εἰμί  .
707158	tlg0086.tlg034.1st1K-grc1	Λέγωδ᾿ ἐπεισοδιώδη μῦθον, ἐν ᾧ τὰ ἐπεισόδια μετ’ ἄλληλα οὔτ᾿ εἰκὸς οὔτ᾿ ἀνάγκη εἶναι.	λέγω δ᾿ ἐπεισοδιώδης μῦθος , ἐν ὅς ὁ ἐπεισόδιος μετά ἀλλήλων  ἔοικα  ἀνάγκη εἰμί .
707159	tlg0086.tlg034.1st1K-grc1	Τοιαῦται δὲ ποιοῦνται ὑπὸ μὲν τῶν φαύλων ποιητῶν δι’ αὐτούς, ὑπὸ δὲ τῶν ἀγαθῶν διὰ τοὺς ὑποκριτάς·	δέ ποιέω ὑπό μέν ὁ φαῦλος ποιητής διά αὐτός , ὑπό δέ ὁ ἀγαθός διά ὁ ὑποκριτής ·
707160	tlg0086.tlg034.1st1K-grc1	ἀγωνίσματα γὰρ ποιοῦντες, καὶ παρὰ τὴν δύναμιν παρατείναντες μῦθον, πολλάκις διαστρέφειν ἀναγκάζονται τὸ ἐφεξῆς.	ἀγώνισμα γάρ ποιέω , καί παρά ὁ δύναμις  μῦθος , πολλάκις διαστρέφω ἀναγκάζω ὁ ἐφεξῆς .
707161	tlg0086.tlg034.1st1K-grc1	Ἐπεὶ δὲ οὐ μόνον τελείας ἐστὶ πράξεως ἡ μίμησις ἀλλὰ καὶ φοβερῶν καὶ ἐλεεινῶν, ταῦτα δὲ γίνεται καὶ μάλιστα, καὶ μᾶλλον ὅταν γένηται παρὰ τὴν δόξαν, δι’ ἄλληλα·	ἐπεί δέ οὐ μόνος  εἰμί πρᾶξις ὁ μίμησις ἀλλά καί  καί  , οὗτος δέ γίγνομαι καί μάλιστα , καί μᾶλλον ὅταν γίγνομαι παρά ὁ δόξα , διά ἀλλήλων ·
707162	tlg0086.tlg034.1st1K-grc1	τὸ γὰρ θαυμαστὸν οὕτως ἕξει μᾶλλον ἢ εἰ ἀπὸ τοῦ αὐτομάτου καὶ τῆς τύχης, ἐπεὶ καὶ τῶν ἀπὸ τύχης ταῦτα θαυμασιώτατα δοκεῖ, ὅσα ὥσπερ ἐπίτηδες φαίνεται γεγονέναι, οἷον ὡς ὁ ἀνδριὰς ὁ τοῦ Μίτυος ἐν Ἄργει ἀπέκτεινε τὸν αἴτιον τοῦ θανάτου τῷ Μίτυϊ, θεωροῦντι ἐμπεσών·	ὁ γάρ θαυμαστός οὕτως ἔχω μᾶλλον ἤ εἰ ἀπό ὁ  καί ὁ τύχη , ἐπεί καί ὁ ἀπό τύχη οὗτος θαυμάσιος δοκέω ,  ὥσπερ ἐπίτηδες φαίνω γίγνομαι , οἷος ὡς ὁ ἀνδριάς ὁ ὁ  ἐν Ἄργος ἀποκτείνω ὁ αἴτιος ὁ θάνατος ὁ  , θεωρέω  ·
707163	tlg0086.tlg034.1st1K-grc1	ἔοικε γὰρ τὰ τοιαῦτα οὐκ εἰκῇ γενέσθαι, ὥστε ἀνάγκη τοὺς τοιούτους εἶναι καλλίους μύθους.	ἔοικα γάρ ὁ τοιοῦτος  εἰκῇ γίγνομαι , ὥστε ἀνάγκη ὁ τοιοῦτος εἰμί καλλίων μῦθος .
707164	tlg0086.tlg034.1st1K-grc1	Εἰσὶ δὲ τῶν μύθων οἱ μὲν ἁπλοῖ οἱ δὲ πεπλεγμένοι·	εἰμί δέ ὁ μῦθος ὁ μέν ἁπλόω ὁ δέ πλέκω ·
707165	tlg0086.tlg034.1st1K-grc1	καὶ γὰρ αἱ πράξεις, ὧν μιμήσεις οἱ μῦθοί εἰσιν, ὑπάρχουσιν εὐθὺς οὖσαι τοιαῦται.	καί γάρ ὁ πρᾶξις , ὅς  ὁ μῦθος εἰμί , ὑπάρχω εὐθύς εἰμί  .
707166	tlg0086.tlg034.1st1K-grc1	Λέγω δὲ ἁπλῆν μὲν πρᾶξιν, ἧς γινομένης, ὥσπερ ὥρισται, συνεχοῦς καὶ μιᾶς ἄνευ περιπετείας ἢ ἀναγνωρισμοῦ ἡ μετάβασις γίνεται, πεπλεγμένην δέ, ἐξ ἧς μετ’ ἀναγνωρισμοῦ ἢ περιπετείας ἢ ἀμφοῖν ἡ μετάβασίς ἐστιν.	λέγω δέ ἁπλόος μέν πρᾶξις , ὅς  , ὥσπερ ὁρίζω ,  καί  ἄνευ περιπέτεια ἤ ἀναγνώρισις ὁ μετάβασις γίγνομαι ,  δέ , ἐκ ὅς μετά ἀναγνώρισις τίη περιπέτεια ἤ ἄμφω ὁ μετάβασις εἰμί .
707167	tlg0086.tlg034.1st1K-grc1	Ταῦτα δὲ δεῖ γίνεσθαι ἐξ αὐτῆς τῆς συστάσεως τοῦ μύθου, ὥστε ἐκ τῶν προγεγενημένων συμβαίνειν ἢ ἐξ ἀνάγκης ἢ κατὰ τὸ εἰκὸς γίνεσθαι ταῦτα·	δέ δέω γίγνομαι ἐκ αὐτός ὁ σύστασις ὁ μῦθος , ὥστε ἐκ ὁ  συμβαίνω ἤ ἐκ ἀνάγκη τίη κατά ὁ ἔοικα γίγνομαι οὗτος ·
707168	tlg0086.tlg034.1st1K-grc1	διαφέρει γὰρ πολὺ τὸ γίνεσθαι τάδε διὰ τάδε ἢ μετὰ τάδε.	διαφέρω γάρ πολύς ὁ γίγνομαι ὅδε διά ὅδε τίη μετά ὅδε .
707169	tlg0086.tlg034.1st1K-grc1	Ἔστι δὲ περιπέτεια μὲν ἡ εἰς τὸ ἐναντίον τῶν πραττομένων μεταβολή, καθάπερ εἴρηται·	εἰμί δέ περιπέτεια μέν ὁ εἰς ὁ ἐναντίος ὁ πράσσω μεταβολή , καθά λέγω ·
