id	filename	tokens	lemmas
183362	tlg0031.tlg004.perseus-grc2	ταῦτα εἰπὼν ἔπτυσεν χαμαὶ καὶ ἐποίησεν πηλὸν ἐκ τοῦ πτύσματος, καὶ ἐπέθηκεν αὐτοῦ τὸν πηλὸν ἐπὶ τοὺς ὀφθαλμούς, καὶ εἶπεν αὐτῷ Ὕπαγε νίψαι εἰς τὴν κολυμβήθραν τοῦ Σιλωάμ? ̔ὃ ἑρμηνεύεται Ἀπεσταλμένος̓.	οὗτος λέγω πτύω χαμαί καί ποιέω πηλός ἐκ ὁ πτύσμα , καί ἐπιτίθημι αὐτός ὁ  ἐπί ὁ ὀφθαλμός , καί λέγω αὐτός  νίζω εἰς ὁ κολυμβήθρα ὁ  ?  ἑρμηνεύω  .
183363	tlg0031.tlg004.perseus-grc2	ἀπῆλθεν οὖν καὶ ἐνίψατο, καὶ ἦλθεν βλέπων.	ἀπέρχομαι οὖν καί ἐνίπτω , καί ἔρχομαι βλέπω .
183364	tlg0031.tlg004.perseus-grc2	Οἱ οὖν γείτονες καὶ οἱ θεωροῦντες αὐτὸν τὸ πρότερον ὅτι προσαίτης ἦν ἔλεγον Οὐχ οὗτός ἐστιν ὁ καθήμενος καὶ προσαιτῶν;	οὖν γείτων καί ὁ θεωρέω αὐτός ὁ πρότερος ὅτι2 προσαίτης εἰμί λέγω οὐ οὗτος εἰμί ὁ  καί προσαιτέω ;
183365	tlg0031.tlg004.perseus-grc2	ἄλλοι ἔλεγον ὅτι Οὗτός ἐστιν·	ἄλλος λέγω ὅτι2  εἰμί ·
183366	tlg0031.tlg004.perseus-grc2	ἄλλοι ἔλεγον Οὐχί, ἀλλὰ ὅμοιος αὐτῷ ἐστίν.	ἄλλος λέγω  , ἀλλά ὅμοιος αὐτός εἰμί .
183367	tlg0031.tlg004.perseus-grc2	ἐκεῖνος ἔλεγεν ὅτι Ἐγώ εἰμι.	ἐκεῖνος λέγω ὅτι2  εἰμί .
183368	tlg0031.tlg004.perseus-grc2	ἔλεγον οὖν αὐτῷ Πῶς οὖν ἠνεῴχθησάν σου οἱ ὀφθαλμοί;	λέγω οὖν αὐτός πῶς οὖν ἀνοίγνυμι  ὁ ὀφθαλμός ;
183369	tlg0031.tlg004.perseus-grc2	ἀπεκρίθη ἐκεῖνος Ὁ ἄνθρωπος ὁ λεγόμενος Ἰησοῦς πηλὸν ἐποίησεν καὶ ἐπέχρισέν μου τοὺς ὀφθαλμοὺς καὶ εἶπέν μοι ὅτι Ὕπαγε εἰς τὸν Σιλωὰμ καὶ νίψαι·	ἀποκρίνω ἐκεῖνος ὁ ἄνθρωπος ὁ λέγω  πηλός ποιέω καί ἐπιχρίω  ὁ ὀφθαλμός καί λέγω  ὅτι2  εἰς ὁ  καί νίζω ·
183370	tlg0031.tlg004.perseus-grc2	ἀπελθὼν οὖν καὶ νιψάμενος ἀνέβλεψα.	ἀπέρχομαι οὖν καί  ἀναβλέπω .
183371	tlg0031.tlg004.perseus-grc2	καὶ εἶπαν αὐτῷ Ποῦ ἐστὶν ἐκεῖνος;	καί λέγω αὐτός  εἰμί ἐκεῖνος ;
183372	tlg0031.tlg004.perseus-grc2	λέγει Οὐκ οἶδα.	λέγω οὐ οἶδα .
183373	tlg0031.tlg004.perseus-grc2	Ἄγουσιν αὐτὸν πρὸς τοὺς Φαρισαίους τόν ποτε τυφλόν.	ἄγω αὐτός πρός ὁ Φαρισαῖος ὁ ποτε  .
183374	tlg0031.tlg004.perseus-grc2	ἦν δὲ σάββατον ἐν ᾗ ἡμέρᾳ τὸν πηλὸν ἐποίησεν ὁ Ἰησοῦς καὶ ἀνέῳξεν αὐτοῦ τοὺς ὀφθαλμούς.	εἰμί δέ  ἐν ὅς ἡμέρα ὁ  ποιέω ὁ Ἰησοῦς καί ἀνοίγνυμι αὐτός ὁ ὀφθαλμός .
183375	tlg0031.tlg004.perseus-grc2	πάλιν οὖν ἠρώτων αὐτὸν καὶ οἱ Φαρισαῖοι πῶς ἀνέβλεψεν.	πάλιν οὖν ἐρωτάω αὐτός καί ὁ Φαρισαῖος πῶς ἀναβλέπω .
183376	tlg0031.tlg004.perseus-grc2	ὁ δὲ εἶπεν αὐτοῖς Πηλὸν ἐπέθηκέν μου ἐπὶ τοὺς ὀφθαλμούς, καὶ ἐνιψάμην, καὶ βλέπω.	ὁ δέ λέγω αὐτός πηλός ἐπιτίθημι ἐγώ ἐπί ὁ ὀφθαλμός , καί ἐνίπτω , καί βλέπω .
183377	tlg0031.tlg004.perseus-grc2	ἔλεγον οὖν ἐκ τῶν Φαρισαίων τινές Οὐκ ἔστιν οὗτος παρὰ θεοῦ ὁ ἄνθρωπος, ὅτι τὸ σάββατον οὐ τηρεῖ.	λέγω οὖν ἐκ ὁ  τις  εἰμί οὗτος παρά θεός ὁ ἄνθρωπος , ὅτι2 ὁ  οὐ τηρέω .
183378	tlg0031.tlg004.perseus-grc2	ἄλλοι δὲ ἔλεγον Πῶς δύναται ἄνθρωπος ἁμαρτωλὸς τοιαῦτα σημεῖα ποιεῖν;	ἄλλος δέ λέγω πῶς δύναμαι ἄνθρωπος ἁμαρτωλός τοιοῦτος σημεῖον ποιέω ;
183379	tlg0031.tlg004.perseus-grc2	καὶ σχίσμα ἦν ἐν αὐτοῖς.	καί σχίσμα εἰμί ἐν αὐτός .
183380	tlg0031.tlg004.perseus-grc2	λέγουσιν οὖν τῷ τυφλῷ πάλιν Τί σὺ λέγεις περὶ αὐτοῦ, ὅτι ἠνέῳξέν σου τοὺς ὀφθαλμούς;	λέγω οὖν τῷ  πάλιν   λέγω περί αὐτός , ὅτι2 ἀνοίγνυμι  ὁ ὀφθαλμός ;
183381	tlg0031.tlg004.perseus-grc2	ὁ δὲ εἶπεν ὅτι Προφήτης ἐστίν.	ὁ δέ λέγω ὅτι2 προφήτης εἰμί .
183382	tlg0031.tlg004.perseus-grc2	Οὐκ ἐπίστευσαν οὖν οἱ Ἰουδαῖοι περὶ αὐτοῦ ὅτι ἦν τυφλὸς καὶ ἀνέβλεψεν, ἕως ὅτου ἐφώνησαν τοὺς γονεῖς αὐτοῦ τοῦ ἀναβλέψαντος καὶ ἠρώτησαν αὐτοὺς λέγοντες Οὗτός ἐστιν ὁ υἱὸς ὑμῶν, ὃν ὑμεῖς λέγετε ὅτι τυφλὸς ἐγεννήθη;	οὐ πιστεύω οὖν ὁ  περί αὐτός ὅτι2 εἰμί τυφλός καί ἀναβλέπω , ἕως ὅστις φωνέω ὁ  αὐτός ὁ ἀναβλέπω καί ἐρωτάω αὐτός λέγω οὗτος εἰμί ὁ υἱός ὑμός , ὅς σύ λέγω ὅτι2 τυφλός γεννάω ;
183383	tlg0031.tlg004.perseus-grc2	πῶς οὖν βλέπει ἄρτι;	πῶς οὖν βλέπω ἄρτι ;
183384	tlg0031.tlg004.perseus-grc2	ἀπεκρίθησαν οὖν οἱ γονεῖς αὐτοῦ καὶ εἶπαν Οἴδαμεν ὅτι οὗτός ἐστιν ὁ υἱὸς ἡμῶν καὶ ὅτι τυφλὸς ἐγεννήθη·	ἀποκρίνω οὖν ὁ  αὐτός καί λέγω οἶδα ὅτι2 οὗτος εἰμί ὁ υἱός ἐγώ καί ὅτι2 τυφλός γεννάω ·
183385	tlg0031.tlg004.perseus-grc2	πῶς δὲ νῦν βλέπει οὐκ οἴδαμεν, ἢ τίς ἤνοιξεν αὐτοῦ τοὺς ὀφθαλμοὺς ἡμεῖς οὐκ οἴδαμεν·	πῶς δέ νῦν βλέπω οὐ  , ἤ τις ἀνοίγνυμι αὐτός ὁ ὀφθαλμός  οὐ  ·
183386	tlg0031.tlg004.perseus-grc2	αὐτὸν ἐρωτήσατε, ἡλικίαν ἔχει, αὐτὸς περὶ ἑαυτοῦ λαλήσει.	αὐτός ἐρωτάω , ἡλικία ἔχω , αὐτός περί ἑαυτοῦ λαλέω .
183387	tlg0031.tlg004.perseus-grc2	ταῦτα εἶπαν οἱ γονεῖς αὐτοῦ ὅτι ἐφοβοῦντο τοὺς Ἰουδαίους, ἤδη γὰρ συνετέθειντο οἱ Ἰουδαῖοι ἵνα ἐάν τις αὐτὸν ὁμολογήσῃ Χριστόν, ἀποσυνάγωγος γένηται.	οὗτος λέγω ὁ  αὐτός ὅτι2 φοβέω ὁ  , ἤδη γάρ  ὁ  ἵνα ἐάν τις αὐτός ὁμολογέω Χριστός , ἀποσυνάγωγος γίγνομαι .
183388	tlg0031.tlg004.perseus-grc2	διὰ τοῦτο οἱ γονεῖς αὐτοῦ εἶπαν ὅτι Ἡλικίαν ἔχει, αὐτὸν ἐπερωτήσατε.	διά οὗτος ὁ  αὐτός λέγω ὅτι2 ἡλικία ἔχω , αὐτός ἐπερωτάω .
183389	tlg0031.tlg004.perseus-grc2	Ἐφώνησαν οὖν τὸν ἄνθρωπον ἐκ δευτέρου ὃς ἦν τυφλὸς καὶ εἶπαν αὐτῷ Δὸς δόξαν τῷ θεῷ·	οὖν ὁ ἄνθρωπος ἐκ  ὅς εἰμί τυφλός καί λέγω αὐτός  δόξα ὁ θεός ·
183390	tlg0031.tlg004.perseus-grc2	ἡμεῖς οἴδαμεν ὅτι οὗτος ὁ ἄνθρωπος ἁμαρτωλός ἐστιν.	οἶδα ὅτι2 οὗτος ὁ ἄνθρωπος ἁμαρτωλός εἰμί .
183391	tlg0031.tlg004.perseus-grc2	ἀπεκρίθη οὖν ἐκεῖνος Εἰ ἁμαρτωλός ἐστιν οὐκ οἶδα·	ἀποκρίνω οὖν ἐκεῖνος  ἁμαρτωλός εἰμί  οἶδα ·
183392	tlg0031.tlg004.perseus-grc2	ἓν οἶδα ὅτι τυφλὸς ὢν ἄρτι βλέπω.	οἶδα ὅτι2 τυφλός εἰμί ἄρτι βλέπω .
183393	tlg0031.tlg004.perseus-grc2	εἶπαν οὖν αὐτῷ Τί ἐποίησέν σοι;	λέγω οὖν αὐτός  ποιέω σύ ;
183394	tlg0031.tlg004.perseus-grc2	πῶς ἤνοιξέν σου τοὺς ὀφθαλμούς;	πῶς   ὁ ὀφθαλμός ;
183395	tlg0031.tlg004.perseus-grc2	ἀπεκρίθη αὐτοῖς Εἶπον ὑμῖν ἤδη καὶ οὐκ ἠκούσατε·	ἀποκρίνω αὐτός   ἤδη καί οὐ ἀκούω ·
183396	tlg0031.tlg004.perseus-grc2	τί πάλιν θέλετε ἀκούειν;	τι πάλιν ἐθέλω ἀκούω ;
183397	tlg0031.tlg004.perseus-grc2	μὴ καὶ ὑμεῖς θέλετε αὐτοῦ μαθηταὶ γενέσθαι;	μή καί  ἐθέλω αὐτός μαθητής γίγνομαι ;
183398	tlg0031.tlg004.perseus-grc2	καὶ ἐλοιδόρησαν αὐτὸν καὶ εἶπαν Σὺ μαθητὴς εἶ ἐκείνου, ἡμεῖς δὲ τοῦ Μωυσέως ἐσμὲν μαθηταί·	καί λοιδορέω αὐτός καί λέγω  μαθητής εἶμι ἐκεῖνος ,  δέ ὁ Μωυσῆς εἰμί  ·
183399	tlg0031.tlg004.perseus-grc2	ἡμεῖς οἴδαμεν ὅτι Μωυσεῖ λελάληκεν ὁ θεός, τοῦτον δὲ οὐκ οἴδαμεν πόθεν ἐστίν.	οἶδα ὅτι2 Μωυσῆς λαλέω ὁ θεός , οὗτος δέ οὐ  πόθεν εἰμί .
183400	tlg0031.tlg004.perseus-grc2	ἀπεκρίθη ὁ ἄνθρωπος καὶ εἶπεν αὐτοῖς Ἐν τούτῳ γὰρ τὸ θαυμαστόν ἐστιν ὅτι ὑμεῖς οὐκ οἴδατε πόθεν ἐστίν, καὶ ἤνοιξέν μου τοὺς ὀφθαλμούς.	ἀποκρίνω ὁ ἄνθρωπος καί λέγω αὐτός ἐν οὗτος γάρ ὁ θαυμαστός εἰμί ὅτι2  οὐ  πόθεν εἰμί , καί ἀνοίγνυμι  ὁ ὀφθαλμός .
183401	tlg0031.tlg004.perseus-grc2	οἴδαμεν ὅτι ὁ θεὸς ἁμαρτωλῶν οὐκ ἀκούει, ἀλλʼ ἐάν τις θεοσεβὴς ᾖ καὶ τὸ θέλημα αὐτοῦ ποιῇ τούτου ἀκούει.	ὅτι2 ὁ  ἁμαρτωλός οὐ ἀκούω ,  ἐάν τις θεοσεβής εἰμί καί ὁ θέλημα αὐτός πόα οὗτος ἀκούω .
183402	tlg0031.tlg004.perseus-grc2	ἐκ τοῦ αἰῶνος οὐκ ἠκούσθη ὅτι ἠνέῳξέν τις ὀφθαλμοὺς τυφλοῦ γεγεννημένου·	ἐκ ὁ αἰών οὐ ἀκούω ὅτι2 ἀνοίγνυμι τις ὀφθαλμός τυφλός γεννάω ·
183403	tlg0031.tlg004.perseus-grc2	εἰ μὴ ἦν οὗτος παρὰ θεοῦ, οὐκ ἠδύνατο ποιεῖν οὐδέν.	εἰ μή εἰμί οὗτος παρά θεός , οὐ δύναμαι ποιέω  .
183404	tlg0031.tlg004.perseus-grc2	ἀπεκρίθησαν καὶ εἶπαν αὐτῷ Ἐν ἁμαρτίαις σὺ ἐγεννήθης ὅλος, καὶ σὺ διδάσκεις ἡμᾶς;	ἀποκρίνω καί λέγω αὐτός ἐν    ὅλος , καί  διδάσκω ἐγώ ;
183405	tlg0031.tlg004.perseus-grc2	καὶ ἐξέβαλον αὐτὸν ἔξω.	καί ἐκβάλλω αὐτός ἔξω .
183406	tlg0031.tlg004.perseus-grc2	Ἤκουσεν Ἰησοῦς ὅτι ἐξέβαλον αὐτὸν ἔξω, καὶ εὑρὼν αὐτὸν εἶπεν.	ἀκούω  ὅτι2 ἐκβάλλω αὐτός ἔξω , καί εὑρίσκω αὐτός λέγω .
183407	tlg0031.tlg004.perseus-grc2	Σὺ πιστεύεις εἰς τὸν υἱὸν τοῦ ἀνθρώ που;	πιστεύω εἰς ὁ υἱός ὁ  που ;
183408	tlg0031.tlg004.perseus-grc2	ἀπεκρίθη ἐκεῖνος καὶ εἶπεν Καὶ τίς ἐστιν, κύριε, ἵνα πιστεύσω εἰς αὐτόν;	ἀποκρίνω ἐκεῖνος καί λέγω καί τις εἰμί , κύριος , ἵνα πιστεύω εἰς αὐτός ;
183409	tlg0031.tlg004.perseus-grc2	εἶπεν αὐτῷ ὁ Ἰησοῦς Καὶ ἑώρακας αὐτὸν καὶ ὁ λαλῶν μετὰ σοῦ ἐκεῖνός ἐστιν.	λέγω αὐτός ὁ  καί  αὐτός καί ὁ λαλέω μετά σός  εἰμί .
183410	tlg0031.tlg004.perseus-grc2	ὁ δὲ ἔφη Πιστεύω, κύριε·	ὁ δέ φημί πιστεύω , κύριος ·
183411	tlg0031.tlg004.perseus-grc2	καὶ προσεκύνησεν αὐτῷ.	καί προσκυνέω αὐτός .
183412	tlg0031.tlg004.perseus-grc2	καὶ εἶπεν ὁ Ἰησοῦς Εἰς κρίμα ἐγὼ εἰς τὸν κόσμον τοῦτον ἦλθον, ἵνα οἱ μὴ βλέποντες βλέπωσιν καὶ οἱ βλέποντες τυφλοὶ γένωνται.	καί λέγω ὁ Ἰησοῦς    εἰς ὁ κόσμος οὗτος ἔρχομαι , ἵνα ὁ μή βλέπω βλέπω καί ὁ βλέπω τυφλός γίγνομαι .
183413	tlg0031.tlg004.perseus-grc2	Ἤκουσαν ἐκ τῶν Φαρισαίων ταῦτα οἱ μετʼ αὐτοῦ ὄντες, καὶ εἶπαν αὐτῷ Μὴ καὶ ἡμεῖς τυφλοί ἐσμεν;	ἐκ ὁ Φαρισαῖος οὗτος ὁ μετά αὐτός εἰμί , καί λέγω αὐτός μή καί  τυφλός εἰμί ;
183414	tlg0031.tlg004.perseus-grc2	εἶπεν αὐτοῖς ὁ Ἰησοῦς Εἰ τυφλοὶ ἦτε, οὐκ ἂν εἴχετε ἁμαρτίαν·	λέγω αὐτός ὁ  εἰ τυφλός εἰμί , οὐ ἄν  ἁμαρτία ·
183415	tlg0031.tlg004.perseus-grc2	νῦν δὲ λέγετε ὅτι Βλέπομεν·	νῦν δέ λέγω ὅτι2  ·
183416	tlg0031.tlg004.perseus-grc2	ἡ ἁμαρτία ὑμῶν μένει.	ὁ  ὑμός μένω .
183417	tlg0031.tlg004.perseus-grc2	Ἀμὴν ἀμὴν λέγω ὑμῖν, ὁ μὴ εἰσερχόμενος διὰ τῆς θύρας εἰς τὴν αὐλὴν τῶν προβάτων ἀλλὰ ἀναβαίνων ἀλλαχόθεν ἐκεῖνος κλέπτης ἐστὶν καὶ λῃστής·	λέγω  , ὁ μή  διά ὁ θύρα εἰς ὁ αὐλή ὁ  ἀλλά ἀναβαίνω ἀλλαχόθεν ἐκεῖνος κλέπτης εἰμί καί λῃστής ·
183418	tlg0031.tlg004.perseus-grc2	ὁ δὲ εἰσερχόμενος διὰ τῆς θύρας ποιμήν ἐστιν τῶν προβάτων.	ὁ δέ  διά ὁ θύρα ποιμήν εἰμί ὁ πρόβατον .
183419	tlg0031.tlg004.perseus-grc2	τούτῳ ὁ θυρωρὸς ἀνοίγει, καὶ τὰ πρόβατα τῆς φωνῆς αὐτοῦ ἀκούει, καὶ τὰ ἴδια πρόβατα φωνεῖ κατʼ ὄνομα καὶ ἐξάγει αὐτά.	οὗτος ὁ  ἀνοίγνυμι , καί ὁ πρόβατον ὁ φωνή αὐτός ἀκούω , καί ὁ ἴδιος πρόβατον φωνέω  ὄνομα καί ἐξάγω αὐτός .
183420	tlg0031.tlg004.perseus-grc2	ὅταν τὰ ἴδια πάντα ἐκβάλῃ, ἔμπροσθεν αὐτῶν πορεύεται, καὶ τὰ πρόβατα αὐτῷ ἀκολουθεῖ, ὅτι οἴδασιν τὴν φωνὴν αὐτοῦ·	ὅταν ὁ ἴδιος πᾶς ἐκβάλλω , ἔμπροσθεν αὐτός πορεύω , καί ὁ πρόβατον αὐτός ἀκολουθέω , ὅτι2  ὁ φωνή αὐτός ·
183421	tlg0031.tlg004.perseus-grc2	ἀλλοτρίῳ δὲ οὐ μὴ ἀκολουθήσουσιν ἀλλὰ φεύξονται ἀπʼ αὐτοῦ, ὅτι οὐκ οἴδασι τῶν ἀλλοτρίων τὴν φωνήν.	ἀλλότριος δέ οὐ μή  ἀλλά φεύγω ἀπό αὐτός , ὅτι2 οὐ οἶδα ὁ ἀλλότριος ὁ φωνή .
183422	tlg0031.tlg004.perseus-grc2	Ταύτην τὴν παροιμίαν εἶπεν αὐτοῖς ὁ Ἰησοῦς·	ὁ παροιμία λέγω αὐτός ὁ  ·
183423	tlg0031.tlg004.perseus-grc2	ἐκεῖνοι δὲ οὐκ ἔγνωσαν τίνα ἦν ἃ ἐλάλει αὐτοῖς.	ἐκεῖνος δέ οὐ γιγνώσκω τις εἰμί ὅς λαλέω αὐτός .
183424	tlg0031.tlg004.perseus-grc2	Εἶπεν οὖν πάλιν ὁ Ἰησοῦς Ἀμὴν ἀμὴν λέγω ὑμῖν, ἐγώ εἰμι ἡ θύρα τῶν προβάτων.	οὖν πάλιν ὁ    λέγω  ,  εἰμί ὁ θύρα ὁ πρόβατον .
183425	tlg0031.tlg004.perseus-grc2	πάντες ὅσοι ἦλθον πρὸ ἐμοῦ κλέπται εἰσὶν καὶ λῃσταί·	πᾶς ὅσος ἔρχομαι πρό ἐμός  εἰμί καί λῃστής ·
183426	tlg0031.tlg004.perseus-grc2	ἀλλʼ οὐκ ἤκουσαν αὐτῶν τὰ πρόβατα.	οὐ ἀκούω αὐτός ὁ πρόβατον .
183427	tlg0031.tlg004.perseus-grc2	ἐγώ εἰμι ἡ θύρα·	εἰμί ὁ  ·
183428	tlg0031.tlg004.perseus-grc2	διʼ ἐμοῦ ἐάν τις εἰσέλθῃ σωθήσεται καὶ εἰσελεύσεται καὶ ἐξελεύσεται καὶ νομὴν εὑρήσει.	διά ἐμός ἐάν τις εἰσέρχομαι  καί εἰσέρχομαι καί ἐξέρχομαι καί νομή εὑρίσκω .
183429	tlg0031.tlg004.perseus-grc2	ὁ κλέπτης οὐκ ἔρχεται εἰ μὴ ἵνα κλέψῃ καὶ θύσῃ καὶ ἀπολέσῃ·	ὁ κλέπτης οὐ ἔρχομαι εἰ μή ἵνα  καί  καί ἀπόλλυμι ·
183430	tlg0031.tlg004.perseus-grc2	ἐγὼ ἦλθον ἵνα ζωὴν ἔχωσιν καὶ περισσὸν ἔχωσιν.	ἔρχομαι ἵνα ζωή ἔχω καί περισσός ἔχω .
183431	tlg0031.tlg004.perseus-grc2	Ἐγώ εἰμι ὁ ποιμὴν ὁ καλός·	εἰμί ὁ ποιμήν ὁ καλός ·
183432	tlg0031.tlg004.perseus-grc2	ὁ ποιμὴν ὁ καλὸς τὴν ψυχὴν αὐτοῦ τίθησιν ὑπὲρ τῶν προβάτων·	ὁ ποιμήν ὁ καλός ὁ ψυχή αὐτός τίθημι ὑπέρ ὁ πρόβατον ·
183433	tlg0031.tlg004.perseus-grc2	ὁ μισθωτὸς καὶ οὐκ ὢν ποιμήν, οὗ οὐκ ἔστιν τὰ πρόβατα ἴδια, θεωρεῖ τὸν λύκον ἐρχόμενον καὶ ἀφίησιν τὰ πρόβατα καὶ φεύγει,— καὶ ὁ λύκος ἁρπάζει αὐτὰ καὶ σκορπίζει,— ὅτι μισθωτός ἐστιν καὶ οὐ μέλει αὐτῷ περὶ τῶν προβάτων.	ὁ μισθωτός καί οὐ εἰμί ποιμήν , οὗ οὐ εἰμί ὁ πρόβατον ἴδιος , θεωρέω ὁ λύκος  καί  ὁ πρόβατον καί φεύγω , — καί ὁ λύκος ἁρπάζω αὐτός καί σκορπίζω , — ὅτι2 μισθωτός εἰμί καί οὐ μέλω αὐτός περί ὁ πρόβατον .
183434	tlg0031.tlg004.perseus-grc2	ἐγώ εἰμι ὁ ποιμὴν ὁ καλός, καὶ γινώσκω τὰ ἐμὰ καὶ γινώσκουσί με τὰ ἐμά, καθὼς γινώσκει με ὁ πατὴρ κἀγὼ γινώσκω τὸν πατέρα, καὶ τὴν ψυχήν μου τίθημι ὑπὲρ τῶν προβάτων.	εἰμί ὁ ποιμήν ὁ καλός , καί γιγνώσκω ὁ  καί γιγνώσκω  ὁ ἐμός ,  γιγνώσκω ἐγώ ὁ πατήρ  γιγνώσκω ὁ πατήρ , καί ὁ ψυχή  τίθημι ὑπέρ ὁ πρόβατον .
183435	tlg0031.tlg004.perseus-grc2	καὶ ἄλλα πρόβατα ἔχω ἃ οὐκ ἔστιν ἐκ τῆς αὐλῆς ταύτης·	καί ἄλλος πρόβατον ἔχω ὅς οὐ εἰμί ἐκ ὁ αὐλή οὗτος ·
183436	tlg0031.tlg004.perseus-grc2	κἀκεῖνα δεῖ με ἀγαγεῖν, καὶ τῆς φωνῆς μου ἀκούσουσιν, καὶ γενήσονται μία ποίμνη, εἷς ποιμήν.	ἐκεῖνος δέω ἐγώ ἄγω , καί ὁ φωνή ἐγώ  , καί   ποίμνη ,  ποιμήν .
183437	tlg0031.tlg004.perseus-grc2	διὰ τοῦτό με ὁ πατὴρ ἀγαπᾷ ὅτι ἐγὼ τίθημι τὴν ψυχήν μου, ἵνα πάλιν λάβω αὐτήν.	διά οὗτος ἐγώ ὁ πατήρ ἀγαπάω ὅτι2  τίθημι ὁ ψυχή  , ἵνα πάλιν λαμβάνω αὐτός .
183438	tlg0031.tlg004.perseus-grc2	οὐδεὶς ἦρεν αὐτὴν ἀπʼ ἐμοῦ, ἀλλʼ ἐγὼ τίθημι αὐτὴν ἀπʼ ἐμαυτοῦ.	οὐδείς αἴρω αὐτός ἀπό ἐμός ,   τίθημι αὐτός ἀπό ἐμαυτοῦ .
183439	tlg0031.tlg004.perseus-grc2	ἐξουσίαν ἔχω θεῖναι αὐτήν, καὶ ἐξουσίαν ἔχω πάλιν λαβεῖν αὐτήν·	ἐξουσία ἔχω θείνω αὐτός , καί ἐξουσία ἔχω πάλιν λαμβάνω αὐτός ·
183440	tlg0031.tlg004.perseus-grc2	ταύτην τὴν ἐντολὴν ἔλαβον παρὰ τοῦ πατρός μου.	οὗτος ὁ ἐντολή λαμβάνω παρά ὁ πατήρ  .
183441	tlg0031.tlg004.perseus-grc2	Σχίσμα πάλιν ἐγένετο ἐν τοῖς Ἰουδαίοις διὰ τοὺς λόγους τούτους.	πάλιν γίγνομαι ἐν ὁ  διά ὁ λόγος οὗτος .
183442	tlg0031.tlg004.perseus-grc2	ἔλεγον δὲ πολλοὶ ἐξ αὐτῶν Δαιμόνιον ἔχει καὶ μαίνεται·	λέγω δέ πολύς ἐκ αὐτός  ἔχω καί μαίνομαι ·
183443	tlg0031.tlg004.perseus-grc2	τί αὐτοῦ ἀκούετε;	τι αὐτός ἀκούω ;
183444	tlg0031.tlg004.perseus-grc2	ἄλλοι ἔλεγον Ταῦτα τὰ ῥήματα οὐκ ἔστιν δαιμονιζομένου·	ἄλλος λέγω  ὁ ῥῆμα οὐ εἰμί  ·
183445	tlg0031.tlg004.perseus-grc2	μὴ δαιμόνιον δύναται τυφλῶν ὀφθαλμοὺς ἀνοῖξαι;	μή δαιμόνιος δύναμαι τυφλόω ὀφθαλμός ἀνοίγνυμι ;
183446	tlg0031.tlg004.perseus-grc2	Ἐγένετο τότε τὰ ἐνκαίνια ἐν τοῖς Ἰεροσολύμοις·	γίγνομαι τότε ὁ  ἐν ὁ  ·
183447	tlg0031.tlg004.perseus-grc2	χειμὼν ἦν, καὶ περιεπάτει ὁ Ἰησοῦς ἐν τῷ ἱερῷ ἐν τῇ στοᾷ τοῦ Σολομῶνος.	χειμών εἰμί , καί περιπατέω ὁ  ἐν ὁ ἱερόν ἐν ὁ στοά ὁ Σολομών .
183448	tlg0031.tlg004.perseus-grc2	ἐκύκλωσαν οὖν αὐτὸν οἱ Ἰουδαῖοι καὶ ἔλεγον αὐτῷ Ἕως πότε τὴν ψυχὴν ἡμῶν αἴρεις;	κυκλόω οὖν αὐτός ὁ  καί λέγω αὐτός  πότε ὁ ψυχή ἐγώ αἴρω ;
183449	tlg0031.tlg004.perseus-grc2	εἰ σὺ εἶ ὁ χριστός, εἰπὸν ἡμῖν παρρησίᾳ.	εἰ σύ εἶμι ὁ χριστός , λέγω  παρρησία .
183450	tlg0031.tlg004.perseus-grc2	ἀπεκρίθη αὐτοῖς ὁ Ἰησοῦς Εἶπον ὑμῖν καὶ οὐ πιστεύετε·	ἀποκρίνω αὐτός ὁ    καί οὐ πιστεύω ·
183451	tlg0031.tlg004.perseus-grc2	τὰ ἔργα ἃ ἐγὼ ποιῶ ἐν τῷ ὀνόματι τοῦ πατρός μου ταῦτα μαρτυρεῖ περὶ ἐμοῦ·	ὁ ἔργον   ποιέω ἐν ὁ ὄνομα ὁ πατήρ  οὗτος μαρτυρέω περί  ·
183452	tlg0031.tlg004.perseus-grc2	ἀλλὰ ὑμεῖς οὐ πιστεύετε, ὅτι οὐκ ἐστὲ ἐκ τῶν προβάτων τῶν ἐμῶν.	ἀλλά  οὐ πιστεύω , ὅτι2 οὐ εἰμί ἐκ ὁ  ὁ ἐμός .
183453	tlg0031.tlg004.perseus-grc2	τὰ πρόβατα τὰ ἐμὰ τῆς φωνῆς μου ἀκούουσιν, κἀγὼ γινώσκω αὐτά, καὶ ἀκολουθοῦσίν μοι, κἀγὼ δίδωμι αὐτοῖς ζωὴν αἰώνιον, καὶ οὐ μὴ ἀπόλωνται εἰς τὸν αἰῶνα, καὶ οὐχ ἁρπάσει τις αὐτὰ ἐκ τῆς χειρός μου.	ὁ  ὁ  ὁ φωνή  ἀκούω ,  γιγνώσκω αὐτός , καί   ,  δίδωμι αὐτός ζωή αἰώνιος , καί οὐ μή ἀπόλλυμι εἰς ὁ αἰών , καί οὐ ἁρπάζω τις αὐτός ἐκ ὁ χείρ  .
