id	filename	tokens	lemmas
388043	tlg0555.tlg001.opp-grc1	τὴν ἀκήρατον οὐσίαν, τὸ ὅσον ἐφ’ ὑμῖν, κατορύττετε καὶ τὸ ἄχραντον ἐκεῖνο καὶ τὸ ἅγιον τοῖς τάφοις ἐπικεχώκατε, τῆς ἀληθῶς ὄντως οὐσίας συλήσαντες τὸ θεῖον.	ὁ ἀκήρατος οὐσία , ὁ ὅσος ἐπί  ,  καί ὁ ἄχραντος ἐκεῖνος καί ὁ  ὁ τάφος  , ὁ ἀληθής ὄντως οὐσία συλάω ὁ θεῖον .
388044	tlg0555.tlg001.opp-grc1	τί δὴ οὖν τὰ τοῦ θεοῦ τοῖς οὐ θεοῖς προσενείματε γέρα;	τι δή οὖν ὁ ὁ θεός ὁ οὐ θεός  γέρας ;
388045	tlg0555.tlg001.opp-grc1	τί δὲ καταλιπόντες τὸν οὐρανὸν τὴν γῆν τετιμήκατε;	τίς δέ καταλείπω ὁ οὐρανός ὁ γῆ  ;
388046	tlg0555.tlg001.opp-grc1	τί δ᾿ ἄλλο χρυσὸς ἢ ἄργυρος ἢ ἀδάμας ἢ σίδηρος ἢ χαλκὸς ἢ ἐλέφας ἢ λίθοι τίμιοι;	τι  ἄλλος χρυσός τίη ἄργυρος ἤ  τίη σίδηρος ἤ χαλκός τίη ἐλέφας ἤ λίθος τίμιος ;
388047	tlg0555.tlg001.opp-grc1	οὐχὶ γῆ τε καὶ ἐκ γῆς;	οὐ γῆ τε καί ἐκ γῆ ;
388048	tlg0555.tlg001.opp-grc1	οὐχὶ δὲ μιᾶς μητρὸς ἔκγονα, τῆς γῆς, τὰ πάντα ταῦτα ὅσα ὁρᾷς;	οὐ δέ  μήτηρ ἔκγονος , ὁ γῆ , ὁ πᾶς οὗτος ὅσος ὁράω ;
388049	tlg0555.tlg001.opp-grc1	τί δὴ οὖν, ὦ μάταιοι καὶ κενόφρονες( πάλιν γὰρ δὴ ἐπαναλήψομαι), τὸν ὑπερουράνιον βλασφημήσαντες τόπον εἰς τοὔδαφος κατεσύρατε τὴν εὐσέβειαν, χθονίους ὑμῖν ἀναπλάττοντες θεοὺς καὶ τὰ γενητὰ ταῦτα πρὸ τοῦ ἀγενήτου μετιόντες θεοῦ βαθυτέρῳ περιπεπτώκατε ζόφῳ;	τίς δή οὖν , ὦ μάταιος καί  ( πάλιν γάρ δή ἐπαναλαμβάνω ) , ὁ ὑπερουράνιος  τόπος εἰς ἔδαφος  ὁ εὐσέβεια , χθόνιος  ἀναπλάσσω  καί ὁ γενητός οὗτος πρό ὁ   θεός   ζόφος ;
388050	tlg0555.tlg001.opp-grc1	καλὸς ὁ Πάριος λίθος, ἀλλ᾿ οὐδέπω Ποσειδῶν·	καλός ὁ Πάρις λίθος ,  οὐδέπω Ποσειδῶν ·
388051	tlg0555.tlg001.opp-grc1	καλὸς ὁ ἐλέφας, ἀλλ᾿ οὐδέπω Ὀλύμπιος·	καλός ὁ ἐλέφας ,  οὐδέπω Ὀλύμπιος ·
388052	tlg0555.tlg001.opp-grc1	ἐνδεὴς ἀεί ποτε ἡ ὕλη τῆς τέχνης, ὁ θεὸς δὲ ἀνενδεής.	ἀεί ποτε ὁ ὕλη ὁ τέχνη , ὁ  δέ ἀνενδεής .
388053	tlg0555.tlg001.opp-grc1	προῆλθεν ἡ τέχνη, περιβέβληται τὸ σχῆμα ἡ ὕλη, καὶ τὸ πλούσιον τῆς οὐσίας πρὸς μὲν τὸ κέρδος ἀγώγιμον, μόνῳ δὲ τῷ σχήματι γίνεται σεβάσμιον.	προέρχομαι ὁ τέχνη ,  ὁ σχῆμα ὁ ὕλη , καί ὁ πλούσιος ὁ οὐσία πρός μέν ὁ κέρδος ἀγώγιμος , μόνος δέ τῷ σχῆμα γίγνομαι  .
388054	tlg0555.tlg001.opp-grc1	χρυσός ἐστι τὸ ἄγαλμά σου, ξύλον ἐστίν, λίθος ἐστίν, γῆ ἐστιν, ἐὰν ἄνωθεν νοήσῃς, μορφὴν παρὰ τοῦ τεχνίτου προσλαβοῦσα.	χρυσός εἰμί ὁ ἄγαλμα  , ξύλον εἰμί , λίθος εἰμί , γῆ εἰμί , ἐάν ἄνωθεν νοέω , μορφή παρά ὁ τεχνίτης προσλαμβάνω .
388055	tlg0555.tlg001.opp-grc1	γῆν δὲ ἐγὼ πατεῖν, οὐ προσκυνεῖν μεμελέτηκα·	γῆ δέ  πατέω , οὐ προσκυνέω  ·
388056	tlg0555.tlg001.opp-grc1	οὐ γάρ μοι θέμις ἐμπιστεῦσαί ποτε τοῖς ἀψύχοις τὰς τῆς ψυχῆς ἐλπίδας.	οὐ γάρ  θέμις  ποτε ὁ  ὁ ὁ ψυχή ἐλπίς .
388057	tlg0555.tlg001.opp-grc1	Ἰτέον οὖν ὡς ἔνι μάλιστα ἐγγυτάτω τῶν ἀγαλμάτων, ὡς οἰκεία ἡ πλάνη κἀκ τῆς προσόψεως ἐλέγχηται·	οὖν ὡς ἐν μάλιστα ἐγγύς ὁ ἄγαλμα , ὡς οἰκεῖος ὁ πλάνη ἐκ ὁ πρόσοψις  ·
388058	tlg0555.tlg001.opp-grc1	ἐναπομέμακται γὰρ πάνυ δὴ σαφῶς τὰ εἴδη τῶν ἀγαλμάτων τὴν διάθεσιν τῶν δαιμόνων.	γάρ πάνυ δή σαφής ὁ εἶδος ὁ ἄγαλμα ὁ διάθεσις ὁ δαίμων .
388059	tlg0555.tlg001.opp-grc1	εἰ γοῦν τις τὰς γραφὰς καὶ τὰ ἀγάλματα περινοστῶν θεῷτο, γνωριεῖ ὑμῶν παραυτίκα τοὺς θεοὺς ἐκ τῶν ἐπονειδίστων σχημάτων, τὸν Διόνυσον ἀπὸ τῆς στολῆς, τὸν Ἥφαιστον ἀπὸ τῆς τέχνης, τὴν Δηὼ ἀπὸ τῆς συμφορᾶς, ἀπὸ τοῦ κρηδέμνου τὴν Ἰνώ, ἀπὸ τῆς τριαίνης τὸν Ποσειδῶ, ἀπὸ τοῦ κύκνου τὸν Δία·	εἰ γοῦν τις ὁ γραφή καί ὁ ἄγαλμα   ,  ὑμός παραυτίκα ὁ  ἐκ ὁ ἐπονειδίζω σχῆμα , ὁ Διόνυσος ἀπό ὁ στολή , ὁ Ἥφαιστος ἀπό ὁ τέχνη , ὁ Δηώ ἀπό ὁ συμφορά , ἀπό ὁ  ὁ Ἰνώ , ἀπό ὁ τρίαινα ὁ  , ἀπό ὁ κύκνος ὁ Ζεύς ·
388060	tlg0555.tlg001.opp-grc1	τὸν δὲ Ἡρακλέα δείκνυσιν ἡ πυρά, κἂν γυμνὴν ἴδῃ τις ἀνάγραπτον γυναῖκα, τὴν » χρυσῆν « Ἀφροδίτην νοεῖ.	ὁ δέ Ἡρακλέης δείκνυμι ὁ πυρά2 , ἐάν γυμνός εἶδον τις ἀνάγραπτος γυνή , ὁ  χρύσεος  Ἀφροδίτη νοέω .
388061	tlg0555.tlg001.opp-grc1	οὕτως ὁ Κύπριος ὁ Πυγμαλίων ἐκεῖνος ἐλεφαντίνου ἠράσθη ἀγάλματος·	οὕτως ὁ Κύπριος ὁ Πυγμαλίων ἐκεῖνος ἐλεφάντινος ἐράω ἄγαλμα ·
388062	tlg0555.tlg001.opp-grc1	τὸ ἄγαλμα Ἀφροδίτης ἦν καὶ γυμνὴ ἦν·	ὁ ἄγαλμα Ἀφροδίτη εἰμί καί γυμνός εἰμί ·
388063	tlg0555.tlg001.opp-grc1	νικᾶται ὁ Κύπριος τῷ σχήματι καὶ συνέρχεται τῷ ἀγάλματι, καὶ τοῦτο Φιλοστέφανος ἱστορεῖ·	νικάω ὁ Κύπριος τῷ σχῆμα καί συνέρχομαι τῷ ἄγαλμα , καί οὗτος  ἱστορέω ·
388064	tlg0555.tlg001.opp-grc1	Ἀφροδίτη δὲ ἄλλη ἐν Κνίδῳ λίθος ἦν καὶ καλὴ ἦν, ἕτερος ἠράσθη ταύτης καὶ μίγνυται τῇ λίθῳ·	Ἀφροδίτη δέ ἄλλος ἐν Κνίδος λίθος εἰμί καί καλός εἰμί , ἕτερος ἐράω οὗτος καί μείγνυμι ὁ  ·
388065	tlg0555.tlg001.opp-grc1	Ποσείδιππος ἱστορεῖ, ὁ μὲν πρότερος ἐν τῷ περὶ Κύπρου, ὁ δὲ ἕτερος ἐν τῷ περὶ Κνίδου.	Ποσείδιππος ἱστορέω , ὁ μέν πρότερος ἐν ὁ περί Κύπρος , ὁ δέ ἕτερος ἐν ὁ περί  .
388066	tlg0555.tlg001.opp-grc1	τοσοῦτον ἴσχυσεν ἀπατῆσαι τέχνη προαγωγὸς ἀνθρώποις ἐρωτικοῖς εἰς βάραθρον γενομένη.	ἰσχύω ἀπατάω τέχνη  ἄνθρωπος ἐρωτικός εἰς βάραθρον γίγνομαι .
388067	tlg0555.tlg001.opp-grc1	δραστήριος μὲν ἡ δημιουργική, ἀλλ᾿ οὐχ οἵα τε ἀπατῆσαι λογικὸν οὐδὲ μὴν τοὺς κατὰ λόγον βεβιωκότας·	δραστήριος μέν ὁ δημιουργικός ,  οὐ οἷος τε ἀπατάω λογικός οὐδέ μήν ὁ κατά λόγος βιόω ·
388068	tlg0555.tlg001.opp-grc1	ζωγραφίας μὲν γὰρ δι’ ὁμοιότητα σκιαγραφήταις περιστεραῖς προσέπτησαν πελειάδες καὶ ἵπποις καλῶς γεγραμμέναις προσεχρεμέτισαν ἵπποι.	ζωγραφία μέν γάρ διά ὁμοιότης  περιστερά προσπέτομαι πελειάς καί ἵππος καλός   ἵππος .
388069	tlg0555.tlg001.opp-grc1	ἐρασθῆναι κόρην εἰκόνος λέγουσιν καὶ νέον καλὸν Κνιδίου ἀγάλματος, ἀλλ᾿ ἦσαν τῶν θεατῶν αἱ ὄψεις ἠπατημέναι ὑπὸ τῆς τέχνης.	ἐράω κόρη εἰκών λέγω καί νέος καλός  ἄγαλμα ,  εἰμί ὁ θεατής ὁ ὄψις  ὑπό ὁ τέχνη .
388070	tlg0555.tlg001.opp-grc1	οὐδὲ γὰρ ἂν θεᾷ τις συνεπλάκη, οὐδ᾿ ἂν νεκρᾷ τις συνετάφη, οὐδ᾿ ἂν ἠράσθη δαίμονος καὶ λίθου ἄνθρωπος σωφρονῶν.	οὐδέ γάρ ἀνά θεά τις  ,  ἐάν  τις συνθάπτω ,  ἄν ἐράω δαίμων καί λίθος ἄνθρωπος σωφρονέω .
388071	tlg0555.tlg001.opp-grc1	ὑμᾶς δὲ ἄλλῃ γοητείᾳ ἀπατᾷ ἡ τέχνη, εἰ καὶ μὴ ἐπὶ τὸ ἐρᾶν προσάγουσα, ἀλλ᾿ ἐπὶ τὸ τιμᾶν καὶ προσκυνεῖν τά τε ἀγάλματα καὶ τὰς γραφάς.	σύ δέ ἄλλος γοητεία  ὁ τέχνη , εἰ καί μή ἐπί ὁ ἐράω προσάγω ,  ἐπί ὁ τιμάω καί προσκυνέω ὁ τε ἄγαλμα καί ὁ γραφή .
388072	tlg0555.tlg001.opp-grc1	ὁμοία γε ἡ γραφή·	ὅμοιος γε ὁ γραφή ·
388073	tlg0555.tlg001.opp-grc1	ἐπαινείσθω μὲν ἡ τέχνη.	ἐπαινέω μέν ὁ τέχνη .
388074	tlg0555.tlg001.opp-grc1	μὴ ἀπατάτω δὲ τὸν ἄνθρωπον ὡς ἀλήθεια.	μή  δέ ὁ ἄνθρωπος ὡς ἀλήθεια .
388075	tlg0555.tlg001.opp-grc1	ἕστηκεν ὁ ἵππος ἡσυχῇ, ἡ πελειὰς ἀτρεμής, ἀργὸν τὸ πτερόν, ἡ δὲ βοῦς ἡ Δαιδάλου ἡ ἐκ τοῦ ξύλου πεποιημένη ταῦρον εἷλεν ἄγριον καὶ κατηνάγκασεν τὸ θηρίον ἡ τέχνη πλανήσασα ἐρώσης ἐπιβῆναι γυναικός.	ἵστημι ὁ ἵππος ἡσυχῇ , ὁ  ἀτρεμής , ἀργός ὁ πτερόν , ὁ δέ βοῦς ὁ Δαίδαλος ὁ ἐκ ὁ ξύλον ποιέω ταῦρος αἱρέω ἄγριος καί καταναγκάζω ὁ θηρίον ὁ τέχνη   ἐπιβαίνω γυνή .
388076	tlg0555.tlg001.opp-grc1	τοσοῦτον οἶστρον αἱ τέχναι κακοτεχνοῦσαι τοῖς ἀνοήτοις ἐνεποίησαν.	τοσοῦτος οἶστρος ὁ τέχνη  ὁ  ἐμποιέω .
388077	tlg0555.tlg001.opp-grc1	ἀλλὰ τοὺς μὲν πιθήκους οἱ τούτων τροφεῖς καὶ μελεδωνοὶ τεθαυμάκασιν, ὅτι τῶν κηρίνων ἢ πηλίνων ὁμοιωμάτων καὶ κοροκοσμίων ἀπατᾷ τούτους οὐδέν·	ἀλλά ὁ μέν πίθηκος ὁ οὗτος τροφεύς καί   , ὅτι2 ὁ  τίη  ὁμοίωμα καί  ἀπατάω οὗτος οὐδείς ·
388078	tlg0555.tlg001.opp-grc1	ὑμεῖς δὲ ἄρα καὶ πιθήκων χείρους γενήσεσθε λιθίνοις καὶ ξυλίνοις καὶ χρυσέοις καὶ ἐλεφαντίνοις ἀγαλματίοις καὶ γραφαῖς προσανέχοντες.	δέ ἄρα καί πίθηκος χείρων γίγνομαι  καί  καί χρύσεος καί   καί  προσανέχω .
388079	tlg0555.tlg001.opp-grc1	τοιούτων ὑμῖν οἱ δημιουργοὶ ἀθυρμάτων ὀλεθρίων οἱ λιθοξόοι καὶ οἱ ἀνδριαντοποιοὶ γραφεῖς τε αὐ καὶ τέκτο νες καὶ ποιηταί, πολύν τινα καὶ τοιοῦτον ὄχλον παρεισάγοντες.	τοιοῦτος  ὁ δημιουργός ἄθυρμα  ὁ λιθοξόος καί ὁ ἀνδριαντοποιός γραφεύς τε  καί   καί ποιητής , πολύς τις καί τοιοῦτος ὄχλος παρεισάγω .
388080	tlg0555.tlg001.opp-grc1	κατ’ ἀγροὺς μὲν Σατύρους καὶ Πᾶνας, ἀνὰ δὲ τὰς ὕλας Νύμφας τὰς ὀρειάδας καὶ τὰς ἁμαδρυάδας, ναὶ μὴν ἀλλὰ καὶ περὶ τὰ ὕδατα καὶ περὶ τοὺς ποταμοὺς καὶ τὰς πηγὰς τὰς Ναΐδας καὶ περὶ τὴν θάλατταν τὰς Νηρεΐδας.	κατά ἀγρός μέν Σάτυρος καί Πάν , ἀνά δέ ὁ  νύμφη ὁ  καί ὁ  ,  μήν ἀλλά καί περί ὁ ὕδωρ καί περί ὁ ποταμός καί ὁ πηγή ὁ Ναΐς καί περί ὁ θάλασσα ὁ  .
388081	tlg0555.tlg001.opp-grc1	μάγοι δὲ ἤδη ἀσεβείας τῆς σφῶν αὐτῶν ὑπηρέτας δαίμονας αὐχοῦσιν, οἰκέτας αὐτοὺς ἑαυτοῖς καταγρά ψαντες, τοὺς κατηναγκασμένους δούλους ταῖς ἐπαοιδαῖς πεποιηκότες.	Μάγος δέ ἤδη ἀσέβεια ὁ σφεῖς αὐτός ὑπηρέτης δαίμων αὐχέω , οἰκέτης αὐτός ἑαυτοῦ   , ὁ  δοῦλος ὁ ἐπῳδή ποιέω .
388082	tlg0555.tlg001.opp-grc1	γάμοι τε οὖν ἔτι καὶ παιδοποιίαι καὶ λοχεῖαι θεῶν μνημονευόμεναι καὶ μοιχεῖαι ᾀδόμεναι καὶ εὐωχίαι κωμῳδούμεναι καὶ γέλωτες παρὰ πότον εἰσαγόμενοι προτρέπουσι δή με ἀνακραγεῖν, κἂν σιωπῆσαι θέλω.	γάμος τε οὖν ἔτι καί  καί λοχεῖος θεός  καί   καί εὐωχία  καί γέλως παρά πότος εἰσάγω προτρέπω δή ἐγώ  , ἐάν σιωπάω ἐθέλω .
388083	tlg0555.tlg001.opp-grc1	οἴμοι τῆς ἀθεότητος·	οἴμοι ὁ ἀθεότης ·
388084	tlg0555.tlg001.opp-grc1	σκηνὴν πεποιήκατε τὸν οὐρανὸν καὶ τὸ θεῖον ὑμῖν δρᾶμα γεγένηται καὶ τὸ ἅγιον προσωπείοις δαιμονίων κεκωμῳδήκατε, τὴν ἀληθῆ θεοσέβειαν δεισιδαιμονίᾳ σατυρίσαντες.	σκηνή ποιέω ὁ οὐρανός καί ὁ θεῖον  δρᾶμα γίγνομαι καί ὁ ἅγιος  δαιμόνιον  , ὁ ἀληθής θεοσέβεια   .
388085	tlg0555.tlg001.opp-grc1	Αὐτὰρ ὃ φορμίζων ἀνεβάλλετο καλὸν ἀείδειν, ᾆσον ἡμῖν, Ὅμηρε, τὴν φωνὴν τὴν καλήν, ἀμφ᾿ Ἄρεως φιλότητος ἐυστεφάνου τ᾿ Ἀφροδίτης·	ὁ φορμίζω ἀναβάλλω καλός ἀείδω , ἀείδω  , Ὅμηρος , ὁ φωνή ὁ καλός ,  Ἄρης φιλότης εὐστέφανος  Ἀφροδίτη ·
388086	tlg0555.tlg001.opp-grc1	ὡς τὰ πρῶτα μίγησαν ἐν Ἡφαίστοιο δόμοισι λάθρῃ·	ὡς ὁ πρῶτος μείγνυμι ἐν Ἥφαιστος δόμος λάθρῃ ·
388087	tlg0555.tlg001.opp-grc1	πολλὰ δ᾿ ἔδωκε, λέχος δ᾿ ᾔσχυνε καὶ εὐνὴν Ἡφαίστοιο ἄνακτος.	πολύς  δίδωμι , λέχος  αἰσχύνω καί εὐνή Ἥφαιστος ἄναξ .
388088	tlg0555.tlg001.opp-grc1	κατάπαυσον, Ὅμηρε, τὴν ᾠδήν·	καταπαύω ,  , ὁ ᾠδή ·
388089	tlg0555.tlg001.opp-grc1	οὐκ ἔστι καλή, μοιχείαν διδάσκει·	οὐ εἰμί καλός , μοιχεία διδάσκω ·
388090	tlg0555.tlg001.opp-grc1	πορνεύειν δὲ ἡμεῖς καὶ τὰ ὦτα παρῃτήμεθα·	πορνεύω δέ  καί ὁ οὖς  ·
388091	tlg0555.tlg001.opp-grc1	ἡμεῖς γάρ, ἡμεῖς ἐσμὲν οἱ τὴν εἰκόνα τοῦ θεοῦ περιφέροντες ἐν τῷ ζῶντι καὶ κινουμένῳ τούτῳ ἀγάλματι, τῷ ἀνθρώπῳ, σύνοικον εἰκόνα, σύμβουλον, συνόμιλον, συνέστιον, συμπαθῆ, ὑπερπαθῆ·	γάρ ,  εἰμί ὁ ὁ εἰκών ὁ θεός περιφέρω ἐν ὁ ζήω καί κινέω οὗτος ἄγαλμα , τῷ ἄνθρωπος , σύνοικος εἰκών ,  ,  , συνέστιος , συμπαθής ,  ·
388092	tlg0555.tlg001.opp-grc1	ἀνάθημα γεγόναμεν τῷ θεῷ ὑπὲρ Χριστοῦ·	ἀνάθημα  ὁ θεός ὑπέρ Χριστός ·
388093	tlg0555.tlg001.opp-grc1	» ἡμεῖς τὸ γένος τὸ ἐκλεκτόν, τὸ βασίλειον ἱεράτευμα, ἔθνος ἅγιον, λαὸς περιούσιος, οἱ ποτὲ οὐ λαός, νῦν δὲ λαὸς τοῦ θεοῦ·	ὁ γένος ὁ ἐκλεκτός , ὁ βασίλειος ἱεράτευμα , ἔθνος ἅγιος , λαός περιούσιος , ὁ ποτε οὐ λαός , νῦν δέ λαός ὁ θεός ·
388094	tlg0555.tlg001.opp-grc1	« οἱ κατὰ τὸν Ἰωάννην οὐκ ὄντες» ἐκ τῶν κάτω«, παρὰ δὲ τοῦ ἄνωθεν ἐλθόντος τὸ πᾶν μεμαθηκότες, οἱ τὴν οἰκονομίαν τοῦ θεοῦ κατανενοηκότες, οἱ » ἐν καινότητι ζωῆς περιπατεῖν « μεμελετηκότες.	ὁ κατά ὁ  οὐ εἰμί » ἐκ ὁ κάτω « , παρά δέ ὁ ἄνωθεν ἔρχομαι ὁ πᾶς μανθάνω , ὁ ὁ οἰκονομία ὁ θεός κατανοέω , ὁ  ἐν καινότης ζωή περιπατέω  μελετάω .
388095	tlg0555.tlg001.opp-grc1	Ἀλλ᾿ οὐ ταῦτα φρονοῦσιν οἱ πολλοί·	οὐ οὗτος φρονέω ὁ πολύς ·
388096	tlg0555.tlg001.opp-grc1	ἀπορρίψαντες δὲ τὴν αἰδῶ καὶ τὸν φόβον οἴκοι τοὺς τῶν δαιμόνων ἐγγράφονται πασχητιασμούς.	ἀπορρίπτω δέ ὁ αἰδώς καί ὁ φόβος οἶκος ὁ ὁ δαίμων ἐγγράφω  .
388097	tlg0555.tlg001.opp-grc1	πινακίοις γοῦν τισὶ καταγράφοις μετεωρότερον ἀνακειμένοις προσεσχηκότες ἀσελγείᾳ τοὺς θαλάμους κεκοσμήκασι, τὴν ἀκολασίαν εὐσέβειαν νομίζοντες·	γοῦν   μετέωρος   ἀσέλγεια ὁ θάλαμος κοσμέω , ὁ ἀκολασία εὐσέβεια νομίζω ·
388098	tlg0555.tlg001.opp-grc1	κἀπὶ τοῦ σκίμποδος κατακείμενοι παρ’ αὐτὰς ἔτι τὰς περιπλοκὰς ἀφορῶσιν εἰς τὴν Ἀφροδίτην ἐκείνην τὴν γυμνήν, τὴν ἐπὶ τῇ συμπλοκῇ δεδεμένην, καὶ τῇ Λήδᾳ περιποτώμενον τὸν ὄρνιν τὸν ἐρωτικόν, τῆς θηλύτητος ἀποδεχόμενοι τὴν γραφήν, ἀποτυποῦσι ταῖς σφενδόναις, σφραγῖδι χρώμενοι καταλλήλῳ τῇ Διὸς ἀκολασίᾳ.	ἐπί ὁ σκίμπους  παρά αὐτός ἔτι ὁ περιπλοκή  εἰς ὁ Ἀφροδίτη ἐκεῖνος ὁ γυμνός , ὁ ἐπί ὁ συμπλοκή  , καί ὁ Λήδα  ὁ ὄρνις ὁ ἐρωτικός , ὁ   ὁ γραφή ,  ὁ σφενδόνη , σφραγίς χράω2  ὁ Ζεύς ἀκολασία .
388099	tlg0555.tlg001.opp-grc1	ταῦτα ὑμῶν τῆς ἡδυπαθείας τὰ ἀρχέτυπα, αὗται τῆς ὕβρεως αἱ θεολογίαι, αὗται τῶν συμπορνευόντων ὑμῖν θεῶν αἱ διδασκαλίαι·	οὗτος ὑμός ὁ ἡδυπάθεια ὁ  , οὗτος ὁ ὕβρις ὁ  , οὗτος ὁ   θεός ὁ διδασκαλία ·
388100	tlg0555.tlg001.opp-grc1	» ὃ γὰρ βούλεται, τοῦθ᾿ ἕκαστος καὶ οἴεται« κατὰ τὸν Ἀθηναῖον ῥήτορα.	» ὁ γάρ βούλομαι ,  ἕκαστος καί οἴομαι « κατά ὁ Ἀθηναῖος ῥήτωρ .
388101	tlg0555.tlg001.opp-grc1	οἷαι δὲ αὖ καὶ ἄλλαι ὑμῶν εἰκόνες, πανίσκοι τινὲς καὶ γυμναὶ κόραι καὶ σάτυροι μεθύοντες καὶ μορίων ἐντάσεις, ταῖς γραφαῖς ἀπογυμνούμεναι, ἀπὸ τῆς ἀκρασίας ἐλεγχόμεναι.	οἷος δέ αὖ καί ἄλλος ὑμός εἰκών ,   καί γυμνός κόρη καί  μεθύω καί μόριον ἔντασις , ὁ γραφή  , ἀπό ὁ ἀκρασία  .
388102	tlg0555.tlg001.opp-grc1	ἤδη δὲ ἀναφανδὸν τῆς ἀκολασίας ὅλης τὰ σχήματα ἀνάγραπτα πανδημεὶ θεώμενοι οὐκ αἰσχύνεσθε, φυλάττετε δὲ ἔτι μᾶλλον ἀνακείμενα, ὥσπερ ἀμέλει τῶν θεῶν ὑμῶν τὰς εἰκόνας, στήλας ἀναισχυντίας καθιερώσαντες οἴκοι, ἐπ’ ἴσης ἐγγραφόμενοι τὰ Φιλαινίδος σχήματα ὡς τὰ Ἡρακλέους ἀθλήματα.	ἤδη δέ ἀναφανδά ὁ ἀκολασία ὅλος ὁ σχῆμα  πανδημεί  οὐ αἰσχύνω , φυλάσσω δέ ἔτι μᾶλλον  , ὥσπερ ἀμέλει ὁ θεός ὑμός ὁ εἰκών ,  ἀναισχυντία καθιερόω οἶκος , ἐπί ἴσος  ὁ Φιλαινίς σχῆμα ὡς ὁ Ἡρακλέης ἄθλημα .
388103	tlg0555.tlg001.opp-grc1	τούτων οὐ μόνον τῆς χρήσεως, πρὸς δὲ καὶ τῆς ὄψεως καὶ τῆς ἀκοῆς αὐτῆς ἀμνηστίαν καταγγέλλομεν.	οὗτος οὐ μόνος ὁ χρῆσις , πρός δέ καί ὁ ὄψις καί ὁ ἀκοή αὐτός ἀμνηστία καταγγέλλω .
388104	tlg0555.tlg001.opp-grc1	ἡταίρηκεν ὑμῖν τὰ ὦτα, πεπορνεύκασιν οἱ ὀφθαλμοὶ καὶ τὸ καινότατον πρὸ τῆς συμπλοκῆς αἱ ὄψεις ὑμῖν μεμοιχεύκασιν.	ἑταιρέω  ὁ οὖς ,  ὁ ὀφθαλμός καί ὁ  πρό ὁ συμπλοκή ὁ ὄψις   .
388105	tlg0555.tlg001.opp-grc1	ὦ βιασάμενοι τὸν ἄνθρωπον καὶ τὸ ἔνθεον τοῦ πλάσματος ἐλέγχει ἀπαράξαντες, πάντα ἀπιστεῖτε, ἵνα ἐκπαθαίνησθε·	ὦ βιάζω ὁ ἄνθρωπος καί ὁ  ὁ πλάσμα ἐλέγχω  , πᾶς ἀπιστέω , ἵνα  ·
388106	tlg0555.tlg001.opp-grc1	καὶ πιστεύετε μὲν τοῖς εἰδώλοις ζηλοῦντες αὐτῶν τὴν ἀκρασίαν, ἀπιστεῖτε δὲ τῷ θεῷ σωφροσύνην μὴ φέροντες·	καί πιστεύω μέν ὁ  ζηλόω αὐτός ὁ ἀκρασία2 , ἀπιστέω δέ ὁ θεός σωφροσύνη μή φέρω ·
388107	tlg0555.tlg001.opp-grc1	καὶ τὰ μὲν κρείττω μεμισήκατε, τὰ δὲ ἥττω τετιμήκατε, ἀρετῆς μὲν θεαταί, κακίας δὲ ἀγωνισταὶ γεγενημένοι.	καί ὁ μέν κρείσσων  , ὁ δέ   , ἀρετή μέν  , κακία δέ ἀγωνιστής  .
