id	filename	tokens	lemmas
744217	tlg0059.tlg018.perseus-grc2	μεγάλου δή τινος, ὦ φίλε, ἀνδρὸς δεῖ, ὅστις τοῦτο κατὰ πάντων ἱκανῶς διαιρήσεται, πότερον οὐδὲν τῶν ὄντων τὴν αὑτοῦ δύναμιν αὐτὸ πρὸς ἑαυτὸ πέφυκεν ἔχειν πλὴν ἐπιστήμης, ἀλλὰ πρὸς ἄλλο, ἢ τὰ μέν, τὰ δʼ οὔ·	μέγας δή τις , ὦ φίλος , ἀνήρ δέω , ὅστις οὗτος κατά πᾶς ἱκανός διαιρέω , πότερος οὐδείς ὁ εἰμί ὁ ἑαυτοῦ δύναμις αὐτός πρός ἑαυτοῦ φύω ἔχω πλήν ἐπιστήμη , ἀλλά πρός ἄλλος , ἤ ὁ μέν , ὁ δέ οὐ ·
744218	tlg0059.tlg018.perseus-grc2	καὶ εἰ ἔστιν αὖ ἅτινα αὐτὰ πρὸς αὑτὰ ἔχει, ἆρʼ ἐν τούτοις ἐστὶν ἐπιστήμη, ἣν δὴ ἡμεῖς σωφροσύνην φαμὲν εἶναι.	καί εἰ εἰμί αὖ  αὐτός πρός ἑαυτοῦ ἔχω ,  ἐν οὗτος εἰμί ἐπιστήμη , ὅς δή ἐγώ σωφροσύνη φημί εἰμί .
744219	tlg0059.tlg018.perseus-grc2	ἐγὼ μὲν οὐ πιστεύω ἐμαυτῷ ἱκανὸς εἶναι ταῦτα διελέσθαι·	μέν οὐ πιστεύω ἐμαυτοῦ ἱκανός εἰμί οὗτος διαιρέω ·
744220	tlg0059.tlg018.perseus-grc2	διὸ καὶ οὔτʼ εἰ δυνατόν ἐστι τοῦτο γενέσθαι, ἐπιστήμης ἐπιστήμην εἶναι, ἔχω διισχυρίσασθαι, οὔτʼ εἰ ὅτι μάλιστα ἔστι, σωφροσύνην ἀποδέχομαι αὐτὸ εἶναι, πρὶν ἂν ἐπισκέψωμαι εἴτε τι ἂν ἡμᾶς ὠφελοῖ τοιοῦτον ὂν εἴτε μή.	διό καί  εἰ δυνατός εἰμί οὗτος γίγνομαι , ἐπιστήμη ἐπιστήμη εἰμί , ἔχω διϊσχυρίζομαι ,  εἰ ὅτι μάλιστα εἰμί , σωφροσύνη ἀποδέχομαι αὐτός εἰμί , πρίν ἄν  εἴτε τι ἀνά ἐγώ   εἰμί εἴτε μή .
744221	tlg0059.tlg018.perseus-grc2	τὴν γὰρ οὖν δὴ σωφροσύνην ὠφέλιμόν τι καὶ ἀγαθὸν μαντεύομαι εἶναι·	ὁ γάρ οὖν δή σωφροσύνη ὠφέλιμος τις καί ἀγαθός μαντεύομαι εἰμί ·
744222	tlg0059.tlg018.perseus-grc2	σὺ οὖν, ὦ παῖ Καλλαίσχρου— τίθεσαι γὰρ σωφροσύνην τοῦτʼ εἶναι, ἐπιστήμην ἐπιστήμης καὶ δὴ καὶ ἀνεπιστημοσύνης— πρῶτον μὲν τοῦτο ἔνδειξαι, ὅτι δυνατὸν ἀποδεῖξαί σε ὃ νυνδὴ ἔλεγον, ἔπειτα πρὸς τῷ δυνατῷ ὅτι καὶ ὠφέλιμον·	οὖν , ὦ παῖς Κάλλαισχρος —  γάρ σωφροσύνη οὗτος εἰμί , ἐπιστήμη ἐπιστήμη καί δή καί ἀνεπιστημοσύνη — πρῶτος μέν οὗτος ἐνδείκνυμι , ὅτι2 δυνατός ἀποδείκνυμι  ὅς νῦν δή λέγω , ἔπειτα πρός τῷ  ὅτι2 καί ὠφέλιμος ·
744223	tlg0059.tlg018.perseus-grc2	κἀμὲ τάχʼ ἂν ἀποπληρώσαις ὡς ὀρθῶς λέγεις περὶ σωφροσύνης ὃ ἔστιν.	τάχα ἄν  ὡς ὀρθός λέγω περί σωφροσύνη  εἰμί .
744224	tlg0059.tlg018.perseus-grc2	καὶ ὁ Κριτίας ἀκούσας ταῦτα καὶ ἰδών με ἀποροῦντα, ὥσπερ οἱ τοὺς χασμωμένους καταντικρὺ ὁρῶντες ταὐτὸν τοῦτο συμπάσχουσιν, κἀκεῖνος ἔδοξέ μοι ὑπʼ ἐμοῦ ἀποροῦντος ἀναγκασθῆναι καὶ αὐτὸς ἁλῶναι ὑπὸ ἀπορίας.	καί ὁ Κριτίας ἀκούω οὗτος καί ὁράω  ἀπορέω2 , ὥσπερ ὁ ὁ  καταντικρύ ὁράω αὐτός οὗτος συμπάσχω , ἐκεῖνος δοκέω  ὑπό ἐμός ἀπορέω2 ἀναγκάζω καί αὐτός ἁλίσκομαι ὑπό ἀπορία .
744225	tlg0059.tlg018.perseus-grc2	ἅτε οὖν εὐδοκιμῶν ἑκάστοτε, ᾐσχύνετο τοὺς παρόντας, καὶ οὔτε συγχωρῆσαί μοι ἤθελεν ἀδύνατος εἶναι διελέσθαι ἃ προυκαλούμην αὐτόν, ἔλεγέν τε οὐδὲν σαφές, ἐπικαλύπτων τὴν ἀπορίαν.	ἅτε οὖν εὐδοκιμέω ἑκάστοτε , αἰσχύνω ὁ πάρειμι , καί οὔτε συγχωρέω  ἐθέλω ἀδύνατος εἰμί διαιρέω ὅς  αὐτός , λέγω τε οὐδείς σαφής , ἐπικαλύπτω ὁ ἀπορία .
744226	tlg0059.tlg018.perseus-grc2	κἀγὼ ἡμῖν ἵνα ὁ λόγος προΐοι, εἶπον·	ἵνα ὁ λόγος πρόειμι , λέγω ·
744227	tlg0059.tlg018.perseus-grc2	ἀλλʼ εἰ δοκεῖ, ὦ Κριτία, νῦν μὲν τοῦτο συγχωρήσωμεν, δυνατὸν εἶναι γενέσθαι ἐπιστήμην ἐπιστήμης·	εἰ δοκέω , ὦ Κριτίας , νῦν μέν οὗτος συγχωρέω , δυνατός εἰμί γίγνομαι ἐπιστήμη ἐπιστήμη ·
744228	tlg0059.tlg018.perseus-grc2	αὖθις δὲ ἐπισκεψόμεθα εἴτε οὕτως ἔχει εἴτε μή.	αὖθις δέ  εἴτε οὕτως ἔχω εἴτε μή .
744229	tlg0059.tlg018.perseus-grc2	ἴθι δὴ οὖν, εἰ ὅτι μάλιστα δυνατὸν τοῦτο, τί μᾶλλον οἷόν τέ ἐστιν εἰδέναι ἅ τέ τις οἶδε καὶ ἃ μή;	εἶμι δή οὖν , εἰ ὅτι2 μάλιστα δυνατός οὗτος , τίς μᾶλλον   εἰμί οἶδα ὅς τε τις οἶδα καί ὅς μή ;
744230	tlg0059.tlg018.perseus-grc2	τοῦτο γὰρ δήπου ἔφαμεν εἶναι τὸ γιγνώσκειν αὑτὸν καὶ σωφρονεῖν·	οὗτος γάρ   εἰμί ὁ γιγνώσκω ἑαυτοῦ καί σωφρονέω ·
744231	tlg0059.tlg018.perseus-grc2	ἦ γάρ;	ἦ γάρ ;
744232	tlg0059.tlg018.perseus-grc2	πάνυ γε, ἦ δʼ ὅς, καὶ συμβαίνει γέ που, ὦ Σώκρατες.	πάνυ γε , ἦ δέ ὅς , καί συμβαίνω γε που , ὦ Σωκράτης .
744233	tlg0059.tlg018.perseus-grc2	εἰ γάρ τις ἔχει ἐπιστήμην ἣ αὐτὴ αὑτὴν γιγνώσκει, τοιοῦτος ἂν αὐτὸς εἴη οἷόνπερ ἐστὶν ὃ ἔχει·	εἰ γάρ τις ἔχω ἐπιστήμη ὁ αὐτός  γιγνώσκω , τοιοῦτος ἐάν αὐτός εἰμί  εἰμί ὅς ἔχω ·
744234	tlg0059.tlg018.perseus-grc2	ὥσπερ ὅταν τάχος τις ἔχῃ, ταχύς, καὶ ὅταν κάλλος, καλός, καὶ ὅταν γνῶσιν, γιγνώσκων, ὅταν δὲ δὴ γνῶσιν αὐτὴν αὑτῆς τις ἔχῃ, γιγνώσκων που αὐτὸς ἑαυτὸν τότε ἔσται.	ὥσπερ ὅταν τάχος τις ἔχω , ταχύς , καί ὅταν κάλλος , καλός , καί ὅταν γιγνώσκω , γιγνώσκω , ὅταν δέ δή γιγνώσκω αὐτός ἑαυτοῦ τις ἔχω , γιγνώσκω που αὐτός ἑαυτοῦ τότε εἰμί .
744235	tlg0059.tlg018.perseus-grc2	οὐ τοῦτο, ἦν δʼ ἐγώ, ἀμφισβητῶ, ὡς οὐχ ὅταν τὸ αὑτὸ γιγνῶσκόν τις ἔχῃ, αὐτὸς αὑτὸν γνώσεται, ἀλλʼ ἔχοντι τοῦτο τίς ἀνάγκη εἰδέναι ἅ τε οἶδεν καὶ ἃ μὴ οἶδεν;	οὐ οὗτος , εἰμί δέ  , ἀμφισβητέω , ὡς οὐ ὅταν ὁ ἑαυτοῦ  τις ἔχω , αὐτός ἑαυτοῦ γιγνώσκω ,  ἔχω οὗτος τις ἀνάγκη οἶδα ὅς τε οἶδα καί ὅς μή οἶδα ;
744236	tlg0059.tlg018.perseus-grc2	ὅτι, ὦ Σώκρατες, ταὐτόν ἐστιν τοῦτο ἐκείνῳ.	ὅτι2 , ὦ Σωκράτης , αὐτός εἰμί οὗτος ἐκεῖνος .
744237	tlg0059.tlg018.perseus-grc2	ἴσως, ἔφην, ἀλλʼ ἐγὼ κινδυνεύω ἀεὶ ὅμοιος εἶναι·	ἴσος , φημί ,   κινδυνεύω ἀεί ὅμοιος εἰμί ·
744238	tlg0059.tlg018.perseus-grc2	οὐ γὰρ αὖ μανθάνω ὡς ἔστιν τὸ αὐτό, ἃ οἶδεν εἰδέναι καὶ ἅ τις μὴ οἶδεν εἰδέναι.	οὐ γάρ αὖ μανθάνω ὡς εἰμί ὁ αὐτός , ὅς οἶδα οἶδα καί ὅς τις μή οἶδα οἶδα .
744239	tlg0059.tlg018.perseus-grc2	πῶς λέγεις, ἔφη;	πῶς λέγω , φημί ;
744240	tlg0059.tlg018.perseus-grc2	ὧδε, ἦν δʼ ἐγώ.	ὧδε , εἰμί δέ  .
744241	tlg0059.tlg018.perseus-grc2	ἐπιστήμη που ἐπιστήμης οὖσα ἆρα πλέον τι οἵα τʼ ἔσται διαιρεῖν, ἢ ὅτι τούτων τόδε μὲν ἐπιστήμη, τόδε δʼ οὐκ ἐπιστήμη;	ἐπιστήμη που ἐπιστήμη εἰμί ἆρα πλέως τις οἷος   διαιρέω , ἤ ὅτι2 οὗτος ὅδε μέν ἐπιστήμη , ὅδε δέ οὐ ἐπιστήμη ;
744242	tlg0059.tlg018.perseus-grc2	οὔκ, ἀλλὰ τοσοῦτον.	οὐ , ἀλλά τοσοῦτος .
744243	tlg0059.tlg018.perseus-grc2	ταὐτὸν οὖν ἐστιν ἐπιστήμῃ τε καὶ ἀνεπιστημοσύνῃ ὑγιεινοῦ, καὶ ἐπιστήμῃ τε καὶ ἀνεπιστημοσύνῃ δικαίου;	αὐτός οὖν εἰμί ἐπιστήμη τε καί  ὑγιεινός , καί ἐπιστήμη τε καί  δίκαιος ;
744244	tlg0059.tlg018.perseus-grc2	οὐδαμῶς.	οὐδαμῶς .
744245	tlg0059.tlg018.perseus-grc2	ἀλλὰ τὸ μὲν οἶμαι ἰατρική, τὸ δὲ πολιτική, τὸ δὲ οὐδὲν ἄλλο ἢ ἐπιστήμη.	ἀλλά ὁ μέν οἴομαι ἰατρικός , ὁ δέ πολιτικός , ὁ δέ οὐδείς ἄλλος ἤ ἐπιστήμη .
744246	tlg0059.tlg018.perseus-grc2	πῶς γὰρ οὔ;	πῶς γάρ οὐ ;
744247	tlg0059.tlg018.perseus-grc2	οὐκοῦν ἐὰν μὴ προσεπίστηταί τις τὸ ὑγιεινὸν καὶ τὸ δίκαιον, ἀλλʼ ἐπιστήμην μόνον γιγνώσκῃ ἅτε τούτου μόνον ἔχων ἐπιστήμην, ὅτι μέν τι ἐπίσταται καὶ ὅτι ἐπιστήμην τινὰ ἔχει, εἰκότως ἂν γιγνώσκοι καὶ περὶ αὑτοῦ καὶ περὶ τῶν ἄλλων·	οὐκοῦν ἐάν μή  τις ὁ ὑγιεινός καί ὁ δίκαιος , ἀλλά ἐπιστήμη μόνος   οὗτος μόνος ἔχω ἐπιστήμη , ὅτι2 μέν τι ἐφίστημι καί ὅτι2 ἐπιστήμη  ἔχω , εἰκός ἄν γιγνώσκω καί περί ἑαυτοῦ καί περί ὁ  ·
744248	tlg0059.tlg018.perseus-grc2	ἦ γάρ;	ἦ γάρ ;
744249	tlg0059.tlg018.perseus-grc2	ναί.	ναί .
744250	tlg0059.tlg018.perseus-grc2	ὅτι δὲ γιγνώσκει, ταύτῃ τῇ ἐπιστήμῃ πῶς εἴσεται;	ὅτι2 δέ γιγνώσκω , οὗτος ὁ ἐπιστήμη πῶς εἶμι ;
744251	tlg0059.tlg018.perseus-grc2	γιγνώσκει γὰρ δὴ τὸ μὲν ὑγιεινὸν τῇ ἰατρικῇ ἀλλʼ οὐ σωφροσύνῃ, τὸ δʼ ἁρμονικὸν μουσικῇ ἀλλʼ οὐ σωφροσύνῃ, τὸ δʼ οἰκοδομικὸν οἰκοδομικῇ ἀλλʼ οὐ σωφροσύνῃ, καὶ οὕτω πάντα·	γιγνώσκω γάρ δή ὁ μέν ὑγιεινός ὁ ἰατρικός  οὐ σωφροσύνη , ὁ δέ  μουσικός ἀλλά οὐ σωφροσύνη , ὁ δέ οἰκοδομικός οἰκοδομικός ἀλλά οὐ σωφροσύνη , καί οὕτως πᾶς ·
744252	tlg0059.tlg018.perseus-grc2	ἢ οὔ;	τίη οὐ ;
744253	tlg0059.tlg018.perseus-grc2	φαίνεται.	φαίνω .
744254	tlg0059.tlg018.perseus-grc2	σωφροσύνῃ δέ, εἴπερ μόνον ἐστὶν ἐπιστημῶν ἐπιστήμη, πῶς εἴσεται ὅτι τὸ ὑγιεινὸν γιγνώσκει ἢ ὅτι τὸ οἰκοδομικόν;	σωφροσύνη δέ , εἴπερ μόνος εἰμί ἐπιστημόω ἐπιστήμη , πῶς εἶμι ὅτι2 ὁ ὑγιεινός γιγνώσκω ἤ ὅτι2 ὁ οἰκοδομικός ;
744255	tlg0059.tlg018.perseus-grc2	οὐδαμῶς.	οὐδαμῶς .
744256	tlg0059.tlg018.perseus-grc2	οὐκ ἄρα εἴσεται ὃ οἶδεν ὁ τοῦτο ἀγνοῶν, ἀλλʼ ὅτι οἶδεν μόνον.	οὐ ἄρα εἶμι ὅς οἶδα ὁ οὗτος ἀγνοέω , ἀλλά ὅτι2 οἶδα μόνος .
744257	tlg0059.tlg018.perseus-grc2	ἔοικεν.	ἔοικα .
744258	tlg0059.tlg018.perseus-grc2	οὐκ ἄρα σωφρονεῖν τοῦτʼ ἂν εἴη οὐδὲ σωφροσύνη, εἰδέναι ἅ τε οἶδεν καὶ ἃ μὴ οἶδεν, ἀλλʼ, ὡς ἔοικεν, ὅτι οἶδεν καὶ ὅτι οὐκ οἶδεν μόνον.	οὐ ἄρα σωφρονέω  ἄν εἰμί οὐδέ σωφροσύνη , οἶδα ὅς τε οἶδα καί ὅς μή οἶδα ,  , ὡς ἔοικα , ὅτι2 οἶδα καί ὅτι2 οὐ οἶδα μόνος .
744259	tlg0059.tlg018.perseus-grc2	κινδυνεύει.	κινδυνεύω .
744260	tlg0059.tlg018.perseus-grc2	οὐδὲ ἄλλον ἄρα οἷός τε ἔσται οὗτος ἐξετάσαι φάσκοντά τι ἐπίστασθαι, πότερον ἐπίσταται ὅ φησιν ἐπίστασθαι ἢ οὐκ ἐπίσταται·	οὐδέ ἄλλος ἄρα  τε  οὗτος ἐξετάζω  τις ἐφίστημι , πότερος  ὅς φημί ἐφίστημι ἤ οὐ ἐφίστημι ·
744261	tlg0059.tlg018.perseus-grc2	ἀλλὰ τοσοῦτον μόνον, ὡς ἔοικεν, γνώσεται, ὅτι ἔχει τινὰ ἐπιστήμην, ὅτου δέ γε, ἡ σωφροσύνη οὐ ποιήσει αὐτὸν γιγνώσκειν.	ἀλλά τοσοῦτος μόνος , ὡς ἔοικα , γιγνώσκω , ὅτι2 ἔχω  ἐπιστήμη , ὅστις δέ γε , ὁ σωφροσύνη οὐ ποιέω αὐτός γιγνώσκω .
744262	tlg0059.tlg018.perseus-grc2	οὐ φαίνεται.	οὐ φαίνω .
744263	tlg0059.tlg018.perseus-grc2	οὔτε ἄρα τὸν προσποιούμενον ἰατρὸν εἶναι, ὄντα δὲ μή, καὶ τὸν ὡς ἀληθῶς ὄντα οἷός τε ἔσται διακρίνειν, οὔτε ἄλλον οὐδένα τῶν ἐπιστημόνων καὶ μή.	οὔτε ἄρα ὁ προσποιέω ἰατρός εἰμί , εἰμί δέ μή , καί ὁ ὡς ἀληθής εἰμί  τε  διακρίνω , οὔτε ἄλλος  ὁ  καί μή .
744264	tlg0059.tlg018.perseus-grc2	σκεψώμεθα δὲ ἐκ τῶνδε·	σκοπέω δέ ἐκ ὅδε ·
744265	tlg0059.tlg018.perseus-grc2	εἰ μέλλει ὁ σώφρων ἢ ὁστισοῦν ἄλλος τὸν ὡς ἀληθῶς ἰατρὸν διαγνώσεσθαι καὶ τὸν μή, ἆρʼ οὐχ ὧδε ποιήσει·	εἰ μέλλω ὁ σώφρων ἤ ὁστισοῦν ἄλλος ὁ ὡς ἀληθής ἰατρός  καί ὁ μή ,  οὐ ὧδε ποιέω ·
744266	tlg0059.tlg018.perseus-grc2	περὶ μὲν ἰατρικῆς δήπου αὐτῷ οὐ διαλέξεται— οὐδὲν γὰρ ἐπαΐει, ὡς ἔφαμεν, ὁ ἰατρὸς ἀλλʼ ἢ τὸ ὑγιεινὸν καὶ τὸ νοσῶδες— ἢ οὔ;	περί μέν ἰατρικός  αὐτός οὐ διαλέγομαι —  γάρ  , ὡς  , ὁ ἰατρός  τίη ὁ ὑγιεινός καί ὁ νοσώδης — ἤ οὐ ;
744267	tlg0059.tlg018.perseus-grc2	ναί, οὕτως.	ναί , οὕτως .
744268	tlg0059.tlg018.perseus-grc2	περὶ δέ γε ἐπιστήμης οὐδὲν οἶδεν, ἀλλὰ τοῦτο δὴ τῇ σωφροσύνῃ μόνῃ ἀπέδομεν.	περί δέ γε ἐπιστήμη  οἶδα , ἀλλά οὗτος δή ὁ σωφροσύνη μόνος  .
744269	tlg0059.tlg018.perseus-grc2	ναί.	ναί .
744270	tlg0059.tlg018.perseus-grc2	οὐδὲ περὶ ἰατρικῆς ἄρα οἶδεν ὁ ἰατρικός, ἐπειδήπερ ἡ ἰατρικὴ ἐπιστήμη οὖσα τυγχάνει.	οὐδέ περί ἰατρικός ἄρα οἶδα ὁ  , ἐπεί ὁ ἰατρικός ἐπιστήμη εἰμί τυγχάνω .
744271	tlg0059.tlg018.perseus-grc2	ἀληθῆ.	ἀληθής .
744272	tlg0059.tlg018.perseus-grc2	ὅτι μὲν δὴ ἐπιστήμην τινὰ ἔχει, γνώσεται ὁ σώφρων τὸν ἰατρόν·	ὅτι2 μέν δή ἐπιστήμη  ἔχω , γιγνώσκω ὁ σώφρων ὁ  ·
744273	tlg0059.tlg018.perseus-grc2	δέον δὲ πεῖραν λαβεῖν ἥτις ἐστίν, ἄλλο τι σκέψεται ὧντινων;	δέω δέ πεῖρα λαμβάνω ὅστις εἰμί , ἄλλος τις   ;
744274	tlg0059.tlg018.perseus-grc2	ἢ οὐ τούτῳ ὥρισται ἑκάστη ἐπιστήμη μὴ μόνον ἐπιστήμη εἶναι ἀλλὰ καὶ τίς, τῷ τινῶν εἶναι;	τίη οὐ οὗτος ὁρίζω ἕκαστος ἐπιστήμη μή μόνος ἐπιστήμη εἰμί ἀλλά καί τις , τῷ  εἰμί ;
744275	tlg0059.tlg018.perseus-grc2	τούτῳ μὲν οὖν.	οὗτος μέν οὖν .
744276	tlg0059.tlg018.perseus-grc2	καὶ ἡ ἰατρικὴ δὴ ἑτέρα εἶναι τῶν ἄλλων ἐπιστημῶν ὡρίσθη τῷ τοῦ ὑγιεινοῦ εἶναι καὶ νοσώδους ἐπιστήμη.	καί ὁ ἰατρικός δή ἕτερος εἰμί ὁ ἄλλος  ὁρίζω τῷ ὁ ὑγιεινός εἰμί καί  ἐπιστήμη .
744277	tlg0059.tlg018.perseus-grc2	ναί.	ναί .
744278	tlg0059.tlg018.perseus-grc2	οὐκοῦν ἐν τούτοις ἀναγκαῖον σκοπεῖν τὸν βουλόμενον ἰατρικὴν σκοπεῖν, ἐν οἷς ποτʼ ἔστιν·	οὐκοῦν ἐν οὗτος ἀναγκαῖον σκοπέω ὁ  ἰατρικός σκοπέω , ἐν ὅς  εἰμί ·
744279	tlg0059.tlg018.perseus-grc2	οὐ γὰρ δήπου ἔν γε τοῖς ἔξω, ἐν οἷς οὐκ ἔστιν;	οὐ γάρ δήπου ἐν γε ὁ ἔξω , ἐν  οὐ εἰμί ;
744280	tlg0059.tlg018.perseus-grc2	οὐ δῆτα.	οὐ δῆτα .
744281	tlg0059.tlg018.perseus-grc2	ἐν τοῖς ὑγιεινοῖς ἄρα καὶ νοσώδεσιν ἐπισκέψεται τὸν ἰατρόν, ᾗ ἰατρικός ἐστιν, ὁ ὀρθῶς σκοπούμενος.	ἐν ὁ ὑγιεινός ἄρα καί   ὁ  , ὅς ἰατρικός εἰμί , ὁ ὀρθός σκοπέω .
744282	tlg0059.tlg018.perseus-grc2	ἔοικεν.	ἔοικα .
744283	tlg0059.tlg018.perseus-grc2	οὐκοῦν ἐν τοῖς οὕτως ἢ λεγομένοις ἢ πραττομένοις τὰ μὲν λεγόμενα, εἰ ἀληθῆ λέγεται, σκοπούμενος, τὰ δὲ πραττόμενα, εἰ ὀρθῶς πράττεται;	οὐκοῦν ἐν ὁ οὕτως τίη λέγω ἤ πράσσω ὁ μέν λέγω , εἰ ἀληθής λέγω , σκοπέω , ὁ δέ πράσσω , εἰ ὀρθός πράσσω ;
744284	tlg0059.tlg018.perseus-grc2	ἀνάγκη.	ἀνάγκη .
744285	tlg0059.tlg018.perseus-grc2	ἦ οὖν ἄνευ ἰατρικῆς δύναιτʼ ἄν τις τούτων ποτέροις ἐπακολουθῆσαι;	ἦ οὖν ἄνευ ἰατρικός  ἄν τις οὗτος πότερος ἐπακολουθέω ;
744286	tlg0059.tlg018.perseus-grc2	οὐ δῆτα.	οὐ δῆτα .
744287	tlg0059.tlg018.perseus-grc2	οὐδέ γε ἄλλος οὐδείς, ὡς ἔοικεν, πλὴν ἰατρός, οὔτε δὴ ὁ σώφρων·	οὐδέ γε ἄλλος οὐδείς , ὡς ἔοικα , πλήν  , οὔτε δή ὁ σώφρων ·
744288	tlg0059.tlg018.perseus-grc2	ἰατρὸς γὰρ ἂν εἴη πρὸς τῇ σωφροσύνῃ.	ἰατρός γάρ ἄν εἰμί πρός ὁ σωφροσύνη .
744289	tlg0059.tlg018.perseus-grc2	ἔστι ταῦτα.	εἰμί οὗτος .
744290	tlg0059.tlg018.perseus-grc2	παντὸς ἄρα μᾶλλον, εἰ ἡ σωφροσύνη ἐπιστήμης ἐπιστήμη μόνον ἐστὶν καὶ ἀνεπιστημοσύνης, οὔτε ἰατρὸν διακρῖναι οἵα τε ἔσται ἐπιστάμενον τὰ τῆς τέχνης ἢ μὴ ἐπιστάμενον, προσποιούμενον δὲ ἢ οἰόμενον, οὔτε ἄλλον οὐδένα τῶν ἐπισταμένων καὶ ὁτιοῦν, πλήν γε τὸν αὑτοῦ ὁμότεχνον, ὥσπερ οἱ ἄλλοι δημιουργοί.	πᾶς ἄρα μᾶλλον , εἰ ὁ σωφροσύνη ἐπιστήμη ἐπιστήμη μόνος εἰμί καί ἀνεπιστημοσύνη , οὔτε ἰατρός διακρίνω οἷος τε εἰμί  ὁ ὁ τέχνη τίη μή ἐφίστημι , προσποιέω δέ τίη  , οὔτε ἄλλος  ὁ ἐφίστημι καί ὁτιοῦν , πλήν γε ὁ ἑαυτοῦ ὁμότεχνος , ὥσπερ ὁ ἄλλος δημιουργός .
744291	tlg0059.tlg018.perseus-grc2	φαίνεται, ἔφη.	φαίνω , φημί .
744292	tlg0059.tlg018.perseus-grc2	τίς οὖν, ἦν δʼ ἐγώ, ὦ Κριτία, ὠφελία ἡμῖν ἔτι ἂν εἴη ἀπὸ τῆς σωφροσύνης τοιαύτης οὔσης;	τις οὖν , εἰμί δέ  , ὦ Κριτίας , ὠφέλεια  ἔτι ἄν εἰμί ἀπό ὁ σωφροσύνη τοιοῦτος εἰμί ;
744293	tlg0059.tlg018.perseus-grc2	εἰ μὲν γάρ, ὃ ἐξ ἀρχῆς ὑπετιθέμεθα, ᾔδει ὁ σώφρων ἅ τε ᾔδει καὶ ἃ μὴ ᾔδει, τὰ μὲν ὅτι οἶδεν, τὰ δʼ ὅτι οὐκ οἶδεν, καὶ ἄλλον ταὐτὸν τοῦτο πεπονθότα ἐπισκέψασθαι οἷός τʼ ἦν, μεγαλωστὶ ἂν ἡμῖν, φαμέν, ὠφέλιμον ἦν σώφροσιν εἶναι·	εἰ μέν γάρ , ὁ ἐκ ἀρχή  , οἶδα ὁ σώφρων ὅς τε οἶδα καί ὅς μή οἶδα , ὁ μέν ὅτι2 οἶδα , ὁ δέ ὅτι2 οὐ οἶδα , καί ἄλλος  οὗτος πάσχω ἐπισκοπέω   εἰμί , μέγας ἐάν  , φημί , ὠφέλιμος εἰμί σώφρων εἰμί ·
744294	tlg0059.tlg018.perseus-grc2	ἀναμάρτητοι γὰρ ἂν τὸν βίον διεζῶμεν αὐτοί τε καὶ οἱ τὴν σωφροσύνην ἔχοντες καὶ οἱ ἄλλοι πάντες ὅσοι ὑφʼ ἡμῶν ἤρχοντο.	ἀναμάρτητος γάρ ἄν ὁ βίος  αὐτός τε καί ὁ ὁ σωφροσύνη ἔχω καί ὁ ἄλλος πᾶς ὅσος ὑπό  ἄρχω .
744295	tlg0059.tlg018.perseus-grc2	οὔτε γὰρ ἂν αὐτοὶ ἐπεχειροῦμεν πράττειν ἃ μὴ ἠπιστάμεθα, ἀλλʼ ἐξευρίσκοντες τοὺς ἐπισταμένους ἐκείνοις ἂν παρεδίδομεν, οὔτε τοῖς ἄλλοις ἐπετρέπομεν, ὧν ἤρχομεν, ἄλλο τι πράττειν ἢ ὅτι πράττοντες ὀρθῶς ἔμελλον πράξειν— τοῦτο δʼ ἦν ἄν, οὗ ἐπιστήμην εἶχον — καὶ οὕτω δὴ ὑπὸ σωφροσύνης οἰκία τε οἰκουμένη ἔμελλεν καλῶς οἰκεῖσθαι, πόλις τε πολιτευομένη, καὶ ἄλλο πᾶν οὗ σωφροσύνη ἄρχοι·	οὔτε γάρ ἄν αὐτός  πράσσω ὅς μή  ,  ἐξευρίσκω ὁ ἐφίστημι ἐκεῖνος ἐάν  , οὔτε ὁ ἄλλος  , ὅς  , ἄλλος τις πράσσω ἤ ὅτι2 πράσσω ὀρθός μέλλω πράσσω — οὗτος δέ εἰμί ἄν , οὗ ἐπιστήμη ἔχω  καί οὕτως δή ὑπό σωφροσύνη  τε οἰκουμένη μέλλω καλός οἰκέω , πόλις τε πολιτεύω , καί ἄλλος πᾶς οὗ σωφροσύνη ἄρχω ·
