id	filename	tokens	lemmas
744424	tlg0013.tlg005.perseus-grc2	μοῦσά μοι ἔννεπε ἔργα πολυχρύσου Ἀφροδίτης, ἠμὲν ὅσʼ ἤπειρος πολλὰ τρέφει ἠδʼ ὅσα πόντος·	ἐνέπω ἔργον πολύχρυσος Ἀφροδίτη , ἠμέν  ἤπειρος πολύς τρέφω ἠδέ ὅσος πόντος ·
744425	tlg0013.tlg005.perseus-grc2	ἀλλʼ ἄρα οἱ πόλεμοί τε ἅδον καὶ ἔργον Ἄρηος ἀγλαὰ ἔργʼ ἐδίδαξεν ἐπὶ φρεσὶ θεῖσα ἑκάστῃ.	ἄρα ἕ πόλεμος τε ἁνδάνω καί ἔργον Ἄρης ἀγλαός ἔργον διδάσκω ἐπί   ἕκαστος .
744426	tlg0013.tlg005.perseus-grc2	ἄλσεά τε σκιόεντα δικαίων τε πτόλις ἀνδρῶν.	ἄλσος τε σκιόεις δίκαιος τε πόλις ἀνήρ .
744427	tlg0013.tlg005.perseus-grc2	ἣ δὲ μαλʼ οὐκ ἔθελεν, ἀλλὰ στερεῶς ἀπέειπεν·	ὁ δέ  οὐ ἐθέλω , ἀλλά στερεός ἀπαγορεύω ·
744428	tlg0013.tlg005.perseus-grc2	καὶ τε μέσῳ οἴκῳ κατʼ ἄρʼ ἕζετο πῖαρ ἑλοῦσα.	καί τε μέσος οἶκος   ἕζομαι πῖαρ αἱρέω .
744429	tlg0013.tlg005.perseus-grc2	οὔτε θεῶν μακάρων οὔτε θνητῶν ἀνθρώπων.	οὔτε θεός μάκαρ οὔτε θνητός ἄνθρωπος .
744430	tlg0013.tlg005.perseus-grc2	Ἥρης ἐκλελαθοῦσα, κασιγνήτης ἀλόχου τε, τῇ δὲ καὶ αὐτῇ Ζεὺς γλυκὺν ἵμερον ἔμβαλε θυμῷ ὤς ῥα θεοὺς συνέμιξε καταθνητῇσι γυναιξί, βουκολέεσκεν βοῦς δέμας ἀθανάτοισιν ἐοικώς.	Ἥρα ἐκλανθάνω , κασιγνήτη ἄλοχος τε , ὁ δέ καί αὐτός Ζεύς γλυκύς ἵμερος ἐμβάλλω θυμός  ἄρα  συμμείγνυμι καταθνητός γυνή , βουκολέω βοῦς δέμας ἀθάνατος ἔοικα .
744431	tlg0013.tlg005.perseus-grc2	ἐνθʼ ἥ γʼ εἰσελθοῦσα θύρας ἐπέθηκε φαεινάς·	ὁ  εἰσέρχομαι θύρα ἐπιτίθημι φαεινός ·
744432	tlg0013.tlg005.perseus-grc2	χρυσῷ κοσμηθεῖσα φιλομμειδὴς Ἀφροδίτη σαίνοντες πολιοί τε λύκοι χαροποί τε λέοντες, αὐτὴ δʼ ἐς κλισίας εὐποιήτους ἀφίκανε·	χρυσός κοσμέω φιλομμειδής Ἀφροδίτη σαίνω πολιός τε λύκος χαροπός τε λέων , αὐτός δέ εἰς κλισία εὐποίητος ἀφικάνω ·
744433	tlg0013.tlg005.perseus-grc2	πωλεῖτʼ ἔνθα καὶ ἔνθα διαπρύσιον κιθαρίζων.	ἔνθα καί ἔνθα διαπρύσιος κιθαρίζω .
744434	tlg0013.tlg005.perseus-grc2	εἶδός τε μέγεθός τε καὶ εἵματα σιγαλόεντα.	εἶδος τε μέγεθος τε καί εἷμα σιγαλόεις .
744435	tlg0013.tlg005.perseus-grc2	καλόν, χρύσειον, παμποίκιλον·	καλός , χρύσεος , παμποίκιλος ·
744436	tlg0013.tlg005.perseus-grc2	ὡς δὲ σελήνη στήθεσιν ἀμφʼ ἁπαλοῖσιν ἐλάμπετο, θαῦμα ἰδέσθαι·	ὡς δέ σελήνη στῆθος   λάμπω , θαῦμα ὁράω ·
744437	tlg0013.tlg005.perseus-grc2	εἶχε δʼ ἐπιγναμπτὰς ἕλικας κάλυκάς τε φαεινάς·	ἔχω δέ  ἕλιξ2 κάλυξ τε φαεινός ·
744438	tlg0013.tlg005.perseus-grc2	ὅρμοι δʼ ἀμφʼ ἁπαλῇ δειρῇ περικαλλέες ἦσαν.	ὅρμος δέ  ἁπαλός δειρή περικαλλής εἰμί .
744439	tlg0013.tlg005.perseus-grc2	Ἀγχίσην δʼ ἔρος εἷλεν, ἔπος δέ μιν ἀντίον ηὔδα·	Ἀγχίσης δέ ἔρος αἱρέω , ἔπος δέ  ἀντίον2 αὐδάω ·
744440	tlg0013.tlg005.perseus-grc2	ἤ πού τις Χαρίτων δεῦρʼ ἤλυθες, αἵτε θεοῖσι σοὶ δʼ ἐγὼ ἐν σκοπιῇ, περιφαινομένῳ ἐνὶ χώρῳ, δηρὸν ἐὺ ζώειν καὶ ὁρᾶν φάος ἠελίοιο, ἀλλὰ καταθνητή τε, γυνὴ δέ με γείνατο μήτηρ.	ἤ που τις Χάρις δεῦρο ἔρχομαι , ὅστε θεός  δέ  ἐν σκοπιά ,  ἐν χῶρος , δηρός εὖ ζήω καί ὁράω φάος ἥλιος , ἀλλά καταθνητός τε , γυνή δέ  γείνομαι μήτηρ .
744441	tlg0013.tlg005.perseus-grc2	σμικρὴν παῖδʼ ἀτίταλλε, φίλης παρὰ μητρὸς ἑλοῦσα.	μικρός  ἀτιτάλλω , φίλος παρά μήτηρ αἱρέω .
744442	tlg0013.tlg005.perseus-grc2	παίζομεν, ἀμφὶ δʼ ὅμιλος ἀπείριτος ἐστεφάνωτο.	, ἀμφί δέ ὅμιλος ἀπείριτος στεφανόω .
744443	tlg0013.tlg005.perseus-grc2	οὐδὲ ποσὶ ψαύσειν ἐδόκουν φυσιζόου αἴης·	οὐδέ πούς ψαύω δοκέω φυσίζοος αἶα ·
744444	tlg0013.tlg005.perseus-grc2	αὐτὰρ ἐγώ σʼ ἱκόμην, κρατερὴ δέ μοι ἔπλετʼ ἀνάγκη.	ἀτάρ   ἱκνέομαι , κρατερός δέ   ἀνάγκη .
744445	tlg0013.tlg005.perseus-grc2	σοῖς τε κασιγνήτοις, οἵ τοι ὁμόθεν γεγάασιν.	σός τε  , ὁ τοι ὁμόθεν γίγνομαι .
744446	tlg0013.tlg005.perseus-grc2	πέμψουσιν·	·
744447	tlg0013.tlg005.perseus-grc2	σὺ δὲ πολλὰ καὶ ἀγλαὰ δέχθαι ἄποινα.	δέ πολύς καί ἀγλαός δέχομαι ἄποινα .
744448	tlg0013.tlg005.perseus-grc2	εἰ μὲν θνητή τʼ ἐσσι, γυνὴ δέ σε γείνατο μήτηρ, ἐνθάδε με σχήσει, πρὶν σῇ φιλότητι μιγῆναι ὣς εἰπὼν λάβε χεῖρα·	εἰ μέν θνητός  εἰμί , γυνή δέ  γείνομαι μήτηρ , ἐνθάδε  ἔχω , πρίν σός φιλότης μείγνυμι  λέγω λαμβάνω χείρ ·
744449	tlg0013.tlg005.perseus-grc2	φιλομμειδὴς δʼ Ἀφροδίτη τοὺς αὐτὸς κατέπεφνεν ἐν οὔρεσιν ὑψηλοῖσιν.	φιλομμειδής δέ Ἀφροδίτη ὁ αὐτός κατέπεφνον ἐν ὄρος ὑψηλός .
744450	tlg0013.tlg005.perseus-grc2	ἔκδυε καὶ κατέθηκεν ἐπὶ θρόνου ἀργυροήλου τῆμος ἄρʼ Ἀγχίσῃ μὲν ἐπὶ γλυκὺν ὕπνον ἔχευε ἄμβροτον, οἷόν τʼ ἐστὶν ἐυστεφάνου Κυθερείης, ὣς φάθʼ·	ἐκδύω καί κατατίθημι ἐπί θρόνος ἀργυρόηλος τῆμος  Ἀγχίσης μέν ἐπί γλυκύς ὕπνος χέω ἄμβροτος ,  τε εἰμί εὐστέφανος Κυθέρεια ,   ·
744451	tlg0013.tlg005.perseus-grc2	ὃ δʼ ἐξ ὕπνοιο μάλʼ ἐμμαπέως ὑπάκουσεν.	ὅς δέ ἐκ ὕπνον  ἐμμαπέως ὑπακούω .
744452	tlg0013.tlg005.perseus-grc2	αὐτίκα σʼ ὡς τὰ πρῶτα, θεά, ἴδον ὀφθαλμοῖσιν, γίγνεται, ὅς τε θεαῖς εὐνάζεται ἀθανάτῃσι.	αὐτίκα  ὡς ὁ πρῶτος , θεά , ὁράω ὀφθαλμός , γίγνομαι , ὅς τε θεά εὐνάζω ἀθάνατος .
744453	tlg0013.tlg005.perseus-grc2	οὐδʼ ἄλλων μακάρων·	ἄλλος μάκαρ ·
744454	tlg0013.tlg005.perseus-grc2	ἐπεὶ ἦ φίλος ἐσσὶ θεοῖσι.	ἦ φίλος εἰμί θεός .
744455	tlg0013.tlg005.perseus-grc2	ἀγχίθεοι δὲ μάλιστα καταθνητῶν ἀνθρώπων θαῦμα ἰδεῖν, πάντεσσι τετιμένος ἀθανάτοισι, καί μιν Ζεὺς ἐλέησε, δίδου δέ οἱ υἷος ἄποινα, αὐτὰρ ἐπειδὴ Ζηνὸς ὅ γʼ ἔκλυεν ἀγγελιάων, Βῆ δʼ ἴμεν αἰτήσουσα κελαινεφέα Κρονίωνα, τὸν δʼ ἦ τοι εἵως μὲν ἔχεν πολυήρατος ἥβη, τοῦ δʼ ἦ τοι εὐνῆς μὲν ἀπείχετο πότνια Ἠώς, ἥδε δέ οἱ κατὰ θυμὸν ἀρίστη φαίνετο βουλή·	ἀγχίθεος δέ μάλιστα καταθνητός ἄνθρωπος θαῦμα ὁράω ,  τίω ἀθάνατος , καί  Ζεύς ἐλεέω , δίδωμι δέ ἕ υἱός ἄποινα ,  ἐπεί Ζεύς ὁ γε ἐκλύω ἀγγελία ,  δέ εἶμι αἰτέω κελαινεφής Κρονίων , ὁ δέ ἦ τοι  μέν ἔχω πολυήρατος ἥβη , ὁ δέ ἦ τοι εὐνή μέν ἀπέχω  ἠώς , ὅδε δέ ἕ κατά θυμός ἄριστος φαίνω βουλή ·
744456	tlg0013.tlg005.perseus-grc2	ἀθάνατόν τʼ εἶναι καὶ ζώειν ἤματα πάντα.	ἀθάνατος  εἰμί καί ζήω ἦμαρ πᾶς .
744457	tlg0013.tlg005.perseus-grc2	νηλειές, τό τʼ ἔπειτα παρίσταται ἀνθρώποισιν, ἀθανάτους συνέμιξα καταθνητῇσι γυναιξί, παῖδα δʼ ὑπὸ ζώνῃ ἐθέμην βροτῷ εὐνηθεῖσα.	νηλειής , ὁ  ἔπειτα παρίστημι ἄνθρωπος , ἀθάνατος συμμείγνυμι καταθνητός γυνή , παῖς δέ ὑπό ζώνη  βροτός εὐνάω .
744458	tlg0013.tlg005.perseus-grc2	δηρὸν μὲν ζώουσι καὶ ἄμβροτον εἶδαρ ἔδουσι γεινομένῃσιν ἔφυσαν ἐπὶ χθονὶ βωτιανείρῃ, ἀζάνεται μὲν πρῶτον ἐπὶ χθονὶ δένδρεα καλά, ἄξουσίν σοι δεῦρο θεαὶ δείξουσί τε παῖδα.	δηρός μέν ζήω καί ἄμβροτος εἶδαρ ἐσθίω  φύω ἐπί χθών  , ἀζάνω μέν πρῶτος ἐπί χθών δένδρον καλός ,   δεῦρο θεά  τε παῖς .
744459	tlg0013.tlg005.perseus-grc2	ἄξεις δʼ αὐτίκα νιν ποτὶ Ἴλιον ἠνεμόεσσαν.	ἄγω δέ αὐτίκα  πρός Ἴλιος ἠνεμόεις .
744460	tlg0013.tlg005.perseus-grc2	αἳ τόδε ναιετάουσιν ὄρος καταειμένον ὕλῃ.	ὁ ὅδε ναιετάω ὄρος  ὕλη .
744461	tlg0013.tlg005.perseus-grc2	ἴσχεο μηδʼ ὀνόμαινε, θεῶν δʼ ἐποπίζεο μῆνιν.	ἴσχω  ὀνομαίνω , θεός δέ ἐποπίζομαι μῆνις .
