id	filename	tokens	lemmas
388448	tlg0555.tlg001.opp-grc1	τίς γάρ, ὢ πρὸς τῆς ἀληθείας, σωφρονῶν γε τἀγαθὸν καταλείπων κακίᾳ σύνεστιν;	τις γάρ , ὦ πρός ὁ ἀλήθεια , σωφρονέω γε ἀγαθός καταλείπω κακία  ;
388449	tlg0555.tlg001.opp-grc1	τίς δὲ ὅστις τὸν θεὸν ἀποφεύγων δαιμονίοις συμβιοῖ;	τις δέ ὅστις ὁ  ἀποφεύγω δαιμόνιος  ;
388450	tlg0555.tlg001.opp-grc1	τίς δὲ υἱὸς εἶναι δυνάμενος τοῦ θεοῦ δουλεύειν ἥδεται;	τις δέ υἱός εἰμί  ὁ θεός δουλεύω ἥδομαι ;
388451	tlg0555.tlg001.opp-grc1	ἢ τίς οὐρανοῦ πολίτης εἶναι δυνάμενος ἔρεβος διώκει, ἐξὸν παράδεισον γεωργεῖν καὶ οὐρανὸν περιπολεῖν καὶ τῆς ζωτικῆς καὶ ἀκηράτου μεταλαμβάνειν πηγῆς, κατ’ ἴχνος ἐκείνης τῆς φωτεινῆς ἀεροβατοῦντα νεφέλης, ὥσπερ ὁ Ἡλίας, θεωροῦντα τὸν ὑετὸν τὸν σωτήριον;	τίη τις οὐρανός πολίτης εἰμί  ἔρεβος διώκω , ἔξεστι  γεωργέω καί οὐρανός περιπολέω καί ὁ ζωτικός καί ἀκήρατος μεταλαμβάνω πηγή , κατά ἴχνος ἐκεῖνος ὁ   νεφέλη , ὥσπερ ὁ  , θεωρέω ὁ ὑετός ὁ σωτήριος ;
388452	tlg0555.tlg001.opp-grc1	οἱ δὲ σκωλήκων δίκην περὶ τέλματα καὶ βορβόρους, τὰ ἡδονῆς ῥεύματα, καλινδούμενοι ἀνονήτους καὶ ἀνοήτους ἐκβόσκονται τρυφάς, ὑώδεις τινὲς ἄνθρωποι.	ὁ δέ σκώληξ δίκη περί τέλμα καί  , ὁ ἡδονή ῥεῦμα ,  ἀνόνητος καί ἀνόητος  τρυφή ,   ἄνθρωπος .
388453	tlg0555.tlg001.opp-grc1	ὕες γάρ, φησίν,» ἥδονται βορβόρῳ« μᾶλλον ἢ καθαρῷ ὕδατι καὶ» ἐπὶ φορυτῷ μαργαίνουσιν« κατὰ Δημόκριτον.	ὗς γάρ , φημί , » ἥδομαι βόρβορος « μᾶλλον ἤ καθαρός ὕδωρ καί » ἐπί φορυτός μαργαίνω « κατά Δημόκριτος .
388454	tlg0555.tlg001.opp-grc1	μὴ δῆτα οὖν, μὴ δῆτα ἐξανδραποδισθῶμεν μηδὲ ὑώδεις γενώμεθα, ἀλλ᾿ » ὡς τέκνα φωτὸς« γνήσια, ἀναθρήσωμεν καὶ ἀναβλέψωμεν εἰς τὸ φῶς, μὴ νόθους ἡμᾶς ἐξελέγξῃ ὁ κύριος ὥσπερ ὁ ἥλιος τοὺς ἀετούς.	δῆτα οὖν ,  δῆτα  μηδέ   ,   ὡς τέκνον φώς « γνήσιος ,  καί ἀναβλέπω εἰς ὁ φάος , μή   ἐξελέγχω ὁ κύριος2 ὥσπερ ὁ ἥλιος ὁ ἀετός .
388455	tlg0555.tlg001.opp-grc1	μετανοήσωμεν οὖν καὶ μεταστῶμεν ἐξ ἀμαθίας εἰς ἐπιστήμην, ἐξ ἀφροσύνης εἰς φρόνησιν, ἐξ ἀκρασίας εἰς ἐγκράτειαν, ἐξ ἀδικίας εἰς δικαιοσύνην, ἐξ ἀθεότητος εἰς θεόν.	οὖν καί  ἐκ ἀμαθία εἰς ἐπιστήμη , ἐκ ἀφροσύνη εἰς φρόνις , ἐκ ἀκρασία εἰς ἐγκράτεια , ἐκ ἀδικία εἰς δικαιοσύνη , ἐκ ἀθεότης εἰς θεός .
388456	tlg0555.tlg001.opp-grc1	καλὸς ὁ κίνδυνος αὐτομολεῖν πρὸς θεόν.	καλός ὁ κίνδυνος  πρός θεός .
388457	tlg0555.tlg001.opp-grc1	πολλῶν δὲ καὶ ἄλλων ἔστιν ἀπολαῦσαι ἀγαθῶν τοὺς δικαιοσύνης ἐραστάς, οἳ τὴν ἀίδιον διώκομεν σωτηρίαν, ἀτὰρ δὴ καὶ ὧν αὐτὸς αἰνίττεται ὁ θεὸς διὰ Ἡσαΐου λαλῶν» ἔστι κληρονομία τοῖς θεραπεύουσι κύριον«·	πολύς δέ καί  εἰμί ἀπολαύω ἀγαθός ὁ δικαιοσύνη ἐραστής , ὁ ὁ ἀΐδιος διώκω σωτηρία ,  δή καί ὅς αὐτός αἰνίσσομαι ὁ  διά  λαλέω » εἰμί κληρονομία ὁ θεραπεύω  « ·
388458	tlg0555.tlg001.opp-grc1	καλή γε καὶ ἐράσμιος ἡ κληρονομία, οὐ χρυσίον, οὐκ ἄργυρος, οὐκ ἐσθής, ἔνθα που σὴς καὶ τὰ τῆς γῆς λῃστής που καταδύεται περὶ τὸν χαμαίζηλον πλοῦτον ὀφθαλμιῶν, ἀλλ᾿ ἐκεῖνος ὁ θησαυρὸς τῆς σωτηρίας, πρὸς ὅν γε ἐπείγεσθαι χρὴ φιλολόγους γενομένους, συναπαίρει δὲ ἡμῖν ἐνθένδε τὰ ἔργα τὰ ἀστεῖα καὶ συνίπταται τῷ τῆς ἀληθείας πτερῷ.	καλός γε καί ἐράσμιος ὁ κληρονομία , οὐ χρυσίον ,  ἄργυρος , οὐ  , ἔνθα που  καί ὁ ὁ γῆ λῃστής που καταδύω περί ὁ χαμαίζηλος πλοῦτος ὀφθαλμίας ,  ἐκεῖνος ὁ θησαυρός ὁ σωτηρία , πρός ὅς γε ἐπείγω χρή φιλόλογος γίγνομαι ,  δέ ἐγώ ἐνθένδε ὁ ἔργον ὁ  καί  τῷ ὁ ἀλήθεια  .
388459	tlg0555.tlg001.opp-grc1	ταύτην ἡμῖν τὴν κληρονομίαν ἐγχειρίζει ἡ ἀίδιος διαθήκη τοῦ θεοῦ τὴν ἀίδιον δωρεὰν χορηγοῦσα·	οὗτος  ὁ κληρονομία ἐγχειρίζω ὁ ἀΐδιος διαθήκη ὁ θεός ὁ ἀΐδιος δωρεά  ·
388460	tlg0555.tlg001.opp-grc1	ὁ δὲ φιλόστοργος οὗτος ἡμῶν πατήρ, ὁ ὄντως πατήρ, οὐ παύεται προτρέπων, νουθετῶν, παιδεύων, φιλῶν·	ὁ δέ  οὗτος ἐγώ πατήρ , ὁ ὄντως πατήρ , οὐ παύω προτρέπω , νουθετέω , παιδεύω , φιλέω ·
388461	tlg0555.tlg001.opp-grc1	οὐδὲ γὰρ σῴζων παύεται, συμβουλεύει δὲ τὰ ἄριστα·	οὐδέ γάρ σῴζω παύω , συμβουλεύω δέ ὁ ἄριστος ·
388462	tlg0555.tlg001.opp-grc1	» δίκαιοι γένεσθε, λέγει κύριος·	» δίκαιος γίγνομαι , λέγω κύριος2 ·
388463	tlg0555.tlg001.opp-grc1	οἱ διψῶντες πορεύεσθε ἐφ’ ὕδωρ, καὶ ὅσοι μὴ ἔχετε ἀργύριον, βαδίσατε καὶ ἀγοράσατε καὶ πίετε ἄνευ ἀργυρίου.	ὁ διψάω πορεύω ἐπί ὕδωρ , καί ὅσος μή ἔχω ἀργύριον ,  καί ἀγοράζω καί  ἄνευ ἀργύριον .
388464	tlg0555.tlg001.opp-grc1	« ἐπὶ τὸ λουτρόν, ἐπὶ τὴν σωτηρίαν, ἐπὶ τὸν φωτισμὸν παρακαλεῖ μονονουχὶ βοῶν καὶ λέγων·	« ἐπί ὁ  , ἐπί ὁ σωτηρία , ἐπί ὁ φωτισμός    καί λέγω ·
388465	tlg0555.tlg001.opp-grc1	γῆν σοι δίδωμι καὶ θάλατταν, παιδίον, οὐρανόν τε καὶ τὰ ἐν αὐτοῖς πάντα ζῷά σοι χαρίζομαι·	γῆ  δίδωμι καί θάλασσα , παιδίον , οὐρανός τε καί ὁ ἐν αὐτός πᾶς   χαρίζω ·
388466	tlg0555.tlg001.opp-grc1	μόνον, ὦ παιδίον, δίψησον τοῦ πατρός, ἀμισθεί σοι δειχθήσεται ὁ θεός·	μόνος , ὦ παιδίον ,  ὁ πατήρ , ἀμισθί  δείκνυμι ὁ θεός ·
388467	tlg0555.tlg001.opp-grc1	οὐ καπηλεύεται ἡ ἀλήθεια, δίδωσί σοι καὶ τὰ πτηνὰ καὶ τὰ νηκτὰ καὶ τὰ ἐπὶ τῆς γῆς·	οὐ  ὁ ἀλήθεια , δίδωμι  καί ὁ πτηνός καί ὁ νηκτός καί ὁ ἐπί ὁ γῆ ·
388468	tlg0555.tlg001.opp-grc1	ταῦτά σου ταῖς εὐχαρίστοις τρυφαῖς δεδημιούργηκεν ὁ πατήρ.	ὁ  τρυφή  ὁ πατήρ .
388469	tlg0555.tlg001.opp-grc1	ἀργυρίῳ μὲν ὠνήσεται ὁ νόθος, ὃς ἀπωλείας ἐστὶ παιδίον, ὃς» μαμωνᾷ δουλεύειν« προῄρηται, σοὶ δὲ τὰ σὰ ἐπιτρέπει, τῷ γνησίῳ λέγω, τῷ φιλοῦντι τὸν πατέρα, δι’ ὃν ἔτι ἐργάζεται, ᾧ μόνῳ καὶ ὑπισχνεῖται λέγων·	μέν ὠνέομαι ὁ νόθος , ὅς ἀπώλεια εἰμί παιδίον , ὅς »  δουλεύω « προαιρέω ,  δέ ὁ  ἐπιτρέπω , τῷ γνήσιος λέγω , τῷ φιλέω ὁ πατήρ , διά ὅς ἔτι ἐργάζομαι , ὅς μόνος καί ὑπισχνέομαι λέγω ·
388470	tlg0555.tlg001.opp-grc1	» καὶ ἡ γῆ οὐ πραθήσεται εἰς βεβαίωσιν·	» καί ὁ γῆ οὐ  εἰς βεβαίωσις ·
388471	tlg0555.tlg001.opp-grc1	« οὐ γὰρ κυροῦται τῇ φθορᾷ·	« οὐ γάρ κυρόω ὁ φθορά ·
388472	tlg0555.tlg001.opp-grc1	» ἐμὴ γάρ ἐστιν πᾶσα ἡ γῆ,« ἔστι δὲ καὶ σή, ἐὰν ἀπολάβῃς τὸν θεόν.	γάρ εἰμί πᾶς ὁ γῆ , « εἰμί δέ καί σός , ἐάν ἀπολαμβάνω ὁ θεός .
388473	tlg0555.tlg001.opp-grc1	ὅθεν ἡ γραφὴ εἰκότως εὐαγγελίζεται τοῖς πεπιστευκόσιν·	ὅθεν ὁ γραφή εἰκός εὐαγγελίζομαι ὁ πιστεύω ·
388474	tlg0555.tlg001.opp-grc1	» οἱ δὲ ἅγιοι κυρίου κληρονομήσουσι τὴν δόξαν τοῦ θεοῦ καὶ τὴν δύναμιν αὐτοῦ.	ὁ δέ   κληρονομέω ὁ δόξα ὁ θεός καί ὁ δύναμις αὐτός .
388475	tlg0555.tlg001.opp-grc1	« ποίαν, ὦ μακάριε, δόξαν, εἰπέ μοι·	« πόα , ὦ μακάριος , δόξα , λέγω  ·
388476	tlg0555.tlg001.opp-grc1	» ἣν ὀφθαλμὸς οὐκ εἶδεν οὐδὲ οὖς ἤκουσεν, οὐδὲ ἐπὶ καρδίαν ἀνθρώπου ἀνέβη·	» ὅς ὀφθαλμός οὐ ὁράω οὐδέ οὖς ἀκούω , οὐδέ ἐπί καρδία ἄνθρωπος ἀναβαίνω ·
388477	tlg0555.tlg001.opp-grc1	καὶ χαρήσονται ἐπὶ τῇ βασιλείᾳ τοῦ κυρίου αὐτῶν εἰς τοὺς αἰῶνας, ἀμήν.	καί χαίρω ἐπί ὁ βασίλεια ὁ  αὐτός εἰς ὁ αἰών , ἄμη .
388478	tlg0555.tlg001.opp-grc1	« ἔχετε, ὦ ἄνθρωποι, τὴν θείαν τῆς χάριτος ἐπαγγελίαν, ἀκηκόατε καὶ τὴν ἄλλην τῆς κολάσεως ἀπειλήν, δι’ ὧν ὁ κύριος σῴζει, φόβῳ καὶ χάριτι παιδαγωγῶν τὸν ἄνθρωπον·	« ἔχω , ὦ ἄνθρωπος , ὁ θεία ὁ χάρις ἐπαγγελία ,  καί ὁ ἄλλος ὁ κόλασις ἀπειλή , διά ὅς ὁ κύριος2 σῴζω , φόβος καί χάρις παιδαγωγός ὁ ἄνθρωπος ·
388479	tlg0555.tlg001.opp-grc1	τί μέλλομεν;	τίς μέλλω ;
388480	tlg0555.tlg001.opp-grc1	τί οὐκ ἐκκλίνομεν τὴν κόλασιν;	τι οὐ ἐκκλίνω ὁ κόλασις ;
388481	tlg0555.tlg001.opp-grc1	τί οὐ καταδεχόμεθα τὴν δωρεάν;	τι οὐ  ὁ δωρεά ;
388482	tlg0555.tlg001.opp-grc1	τί δὲ οὐχ αἱρούμεθα τὰ βελτίονα, θεὸν ἀντὶ τοῦ πονηροῦ, καὶ σοφίαν εἰδωλολατρείας προκρίνομεν καὶ ζωὴν ἀντικαταλλασσόμεθα θανάτου;	τι δέ οὐ αἱρέω ὁ  ,  ἀντί ὁ πονηρός , καί σοφία   καί ζωή  θάνατος ;
388483	tlg0555.tlg001.opp-grc1	» ἰδοὺ τέθεικα πρὸ προσώπου ὑμῶν,« φησί, » τὸν θάνατον καὶ τὴν ζωήν.	»  τίθημι πρό πρόσωπον ὑμός , « φημί ,  ὁ θάνατος καί ὁ ζωή .
388484	tlg0555.tlg001.opp-grc1	« πειράζει σε ὁ κύριος ἐκλέξασθαι τὴν ζωήν, συμβουλεύει σοι ὡς πατὴρ πείθεσθαι τῷ θεῷ.	πειράζω σύ ὁ κύριος2 ἐκλέγω ὁ ζωή , συμβουλεύω  ὡς πατήρ πείθω ὁ θεός .
388485	tlg0555.tlg001.opp-grc1	» ἐὰν γὰρ ἀκούσητέ μου«, φησί,» καὶ θελήσητε, τὰ ἀγαθὰ τῆς γῆς φάγεσθε,« ὑπακοῆς ἡ χάρις·	» ἐάν γάρ  ἐγώ « , φημί , » καί ἐθέλω , ὁ ἀγαθός ὁ γῆ  , « ὑπακοή ὁ χάρις ·
388486	tlg0555.tlg001.opp-grc1	» ἐὰν δὲ μὴ ὑπακούσητέ μου μηδὲ θελήσητε, μάχαιρα ὑμᾶς καὶ πῦρ κατέδεται,« παρακοῆς ἡ κρίσις.	ἐάν δέ μή    ἐθέλω ,   καί πῦρ  , « παρακοή ὁ κρίσις .
388487	tlg0555.tlg001.opp-grc1	» τὸ γὰρ στόμα κυρίου ἐλάλησεν ταῦτα·	ὁ γάρ στόμα  λαλέω οὗτος ·
388488	tlg0555.tlg001.opp-grc1	« νόμος ἀληθείας λόγος κυρίου·	νόμος ἀλήθεια λόγος  ·
388489	tlg0555.tlg001.opp-grc1	βούλεσθε ὑμῖν ἀγαθὸς γένωμαι σύμβουλος;	βούλομαι  ἀγαθός γίγνομαι σύμβουλος ;
388490	tlg0555.tlg001.opp-grc1	ἀλλ᾿ ὑμεῖς μὲν ἀκούσατε·	μέν ἀκούω ·
388491	tlg0555.tlg001.opp-grc1	ἐγὼ δέ, εἰ δυνατόν, ἐνδείξομαι.	δέ , εἰ δυνατός , ἐνδείκνυμι .
388492	tlg0555.tlg001.opp-grc1	ἐχρῆν μὲν ὑμᾶς, ὦ ἄνθρωποι, αὐτοῦ πέρι ἐννοουμένους τοῦ ἀγαθοῦ ἔμφυτον ἐπάγεσθαι πίστιν, μάρτυρα ἀξιόχρεων αὐτόθεν οἴκοθεν, περιφανῶς αἱρουμένην τὸ βέλτιστον, μηδὲ ζητεῖν εἰ μεταδιωκτέον, τὸ δ᾿ ἀγαθὸν ἐκπονεῖν.	χρή μέν  , ὦ ἄνθρωπος , αὐτός περί ἐννοέω ὁ ἀγαθός ἔμφυτος ἐπάγω πίστις , μάρτυς ἀξιόχρεως αὐτός οἶκος , περιφανής αἱρέω ὁ βέλτιστος , μηδέ ζητέω εἰ μεταδιώκω , ὁ  ἀγαθός ἐκπονέω .
388493	tlg0555.tlg001.opp-grc1	καὶ γὰρ εἴ τῳ μεθυστέον, φέρε εἰπεῖν, ἀμφιβάλλειν χρή·	καί γάρ εἰ   , φέρω λέγω , ἀμφιβάλλω χρή ·
388494	tlg0555.tlg001.opp-grc1	ὑμεῖς δὲ πρὶν ἢ ἐπισκέψασθαι μεθύετε·	δέ πρίν τίη ἐπισκοπέω  ·
388495	tlg0555.tlg001.opp-grc1	καὶ εἰ ὑβριστέον, οὐ πολυπραγμονεῖτε, ἀλλ᾿ ᾗ τάχος ὑβρίζετε.	καί εἰ  , οὐ  ,  ὅς τάχος ὑβρίζω .
388496	tlg0555.tlg001.opp-grc1	μόνον δ᾿ ἄρα εἰ θεοσεβητέον, ζητεῖτε, καὶ εἰ τῷ σοφῷ τούτῳ δὴ τῷ θεῷ καὶ τῷ Χριστῷ κατακολουθητέον, τοῦτο δὴ βουλῆς καὶ σκέψεως ἀξιοῦτε, οὐδ᾿ ὃ πρέπει θεῷ, ὅ τι ποτέ ἐστι, νενοηκότες.	μόνος  ἄρα εἰ  , ζητέω , καί εἰ τῷ σοφός οὗτος δή τῷ θεός καί ὁ Χριστός  , οὗτος δή βουλή καί σκέψις ἀξιόω ,  ὅς πρέπω θεός , ὅς τις ποτε εἰμί ,  .
388497	tlg0555.tlg001.opp-grc1	πιστεύσατε ἡμῖν κἂν ὡς μέθῃ, ἵνα σωφρονήσητε·	πιστεύω  ἐάν ὡς  , ἵνα  ·
388498	tlg0555.tlg001.opp-grc1	πιστεύσατε κἂν ὡς ὕβρει, ἵνα ζήσητε.	πιστεύω ἐάν ὡς  , ἵνα  .
388499	tlg0555.tlg001.opp-grc1	εἰ δὲ καὶ πείθεσθαι βούλεσθε τὴν ἐναργῆ τῶν ἀρετῶν ἐποπτεύσαντες πίστιν, φέρε ὑμῖν ἐκ περιουσίας τὴν περὶ τοῦ λόγου παραθήσομαι πειθώ.	εἰ δέ καί πείθω βούλομαι ὁ ἐναργής ὁ  ἐποπτεύω πίστις , φέρω  ἐκ περιουσία ὁ περί ὁ λόγος παραθέω πειθώ .
388500	tlg0555.tlg001.opp-grc1	ὑμεῖς δέ, οὐ γὰρ τὰ πάτρια ὑμᾶς ἔτι τῆς ἀληθείας ἀπασχολεῖ ἔθη προκατηχημένους, ἀκούοιτ᾿ ἂν ἤδη τὸ μετὰ τοῦτο ὅπως ἔχει·	σύ δέ , οὐ γάρ ὁ πάτριος  ἔτι ὁ ἀλήθεια  ἔθος  ,  ἐάν ἤδη ὁ μετά οὗτος ὅπως ἔχω ·
388501	tlg0555.tlg001.opp-grc1	καὶ δὴ μή τις ὑμᾶς τοῦδε τοῦ ὀνόματος αἰσχύνη προκαταλαμβανέτω,» ἥτ᾿ ἄνδρας μέγα σίνεται, « παρατρέπουσα σωτηρίας.	καί δή μή τις  ὅδε ὁ ὄνομα αἰσχύνη  , »  ἀνήρ μέγας σίνομαι ,   σωτηρία .
388502	tlg0555.tlg001.opp-grc1	ἀποδυσάμενοι δ᾿ οὖν περιφανῶς ἐν τῷ τῆς ἀληθείας σταδίῳ γνησίως ἀγωνιζώμεθα, βραβεύοντος μὲν τοῦ λόγου τοῦ ἁγίου, ἀγωνοθετοῦντος δὲ τοῦ δεσπότου τῶν ὅλων.	οὖν περιφανής ἐν ὁ ὁ ἀλήθεια στάδιον γνήσιος ἀγωνίζομαι ,  μέν ὁ λόγος ὁ ἅγιος ,  δέ ὁ δεσπότης ὁ ὅλος .
388503	tlg0555.tlg001.opp-grc1	οὐ γὰρ σμικρὸν ἡμῖν τὸ ἆθλον ἀθανασία πρόκειται.	οὐ γάρ μικρός ἐγώ ὁ ἆθλον ἀθανασία πρόκειμαι .
388504	tlg0555.tlg001.opp-grc1	μὴ οὖν ἔτι φροντίζετε μηδὲ εἰ ὀλίγον, τί ὑμᾶς ἀγορεύουσι σύρφακές τινες ἀγοραῖοι, δεισιδαιμονίας ἄθεοι χορευταί, ἀνοίᾳ καὶ παρανοίᾳ ἐς αὐτὸ ὠθούμενοι τὸ βάραθρον, εἰδώλων ποιηταὶ καὶ λίθων προσκυνηταί·	μή οὖν ἔτι φροντίζω μηδέ εἰ ὀλίγος , τίς  ἀγορεύω  τις ἀγοραῖος , δεισιδαιμονία ἄθεος χορευτής , ἄνοια καί παράνοια εἰς αὐτός ὠθέω ὁ βάραθρον , εἴδωλον ποιητής καί λίθος  ·
388505	tlg0555.tlg001.opp-grc1	οἵδε γὰρ ἀνθρώπους ἀποθεοῦν τετολμήκασι, τρισκαιδέκατον Ἀλέξανδρον τὸν Μακεδόνα ἀναγράφοντες θεόν,» ὃν Βαβυλὼν ἤλεγξε νεκρόν.	ὅδε γάρ ἄνθρωπος  τολμάω , τρεισκαιδέκατος Ἀλέξανδρος ὁ  ἀναγράφω θεός , » ὅς Βαβυλών ἐλέγχω νεκρός .
388506	tlg0555.tlg001.opp-grc1	« ἄγαμαι τοίνυν τὸν Χῖον σοφιστήν, Θεόκριτος ὄνομα αὐτῷ·	ἄγαμαι τοίνυν ὁ Χῖος σοφιστής , Θεόκριτος ὄνομα αὐτός ·
388507	tlg0555.tlg001.opp-grc1	μετὰ τὴν Ἀλεξάνδρου τελευτὴν ἐπισκώπτων ὁ Θεόκριτος τὰς δόξας τὰς κενὰς τῶν ἀνθρώπων ἃς εἶχον περὶ θεῶν, πρὸς τοὺς πολίτας» ἄνδρες,« εἶπεν,» θαρρεῖτε ἄχρις ἂν ὁρᾶτε τοὺς θεοὺς πρότερον τῶν ἀνθρώπων ἀποθνῄσκοντας.	μετά ὁ Ἀλέξανδρος τελευτή ἐπισκώπτω ὁ Θεόκριτος ὁ δοκέω ὁ  ὁ ἄνθρωπος ὅς ἔχω περί θεός , πρός ὁ πολίτης » ἀνήρ , « λέγω , » θαρσέω ἄχρι ἄν ὁράω ὁ  πρότερος ὁ ἄνθρωπος ἀποθνῄσκω .
388508	tlg0555.tlg001.opp-grc1	« θεοὺς δὲ δὴ τοὺς ὁρατοὺς καὶ τὸν σύγκλυδα τῶν γενητῶν τούτων ὄχλον ὁ προσκυνῶν καὶ προσεταιριζόμενος, αὐτῶν ἐκείνων τῶν δαιμόνων ἀθλιώτερος μακρῷ.	δέ δή ὁ  καί ὁ σύγκλυς ὁ  οὗτος ὄχλος ὁ  καί  , αὐτός ἐκεῖνος ὁ δαίμων ἄθλιος μακρός .
388509	tlg0555.tlg001.opp-grc1	θεὸς γὰρ οὐδαμῇ οὐδαμῶς ἄδικος ὥσπερ οἱ δαίμονες, ἀλλ᾿ ὡς οἷόν τε δικαιότατος, καὶ οὐκ ἔστιν αὐτῷ ὁμοιότερον οὐδὲν ἢ ὃς ἂν ἡμῶν γένηται ὅτι δικαιότατος.	γάρ οὐδαμῇ οὐδαμῶς  ὥσπερ ὁ δαίμων ,  ὡς  τε δίκαιος , καί οὐ εἰμί αὐτός ὅμοιος  ἤ ὅς ἄν ἐγώ γίγνομαι ὅτι2 δίκαιος .
388510	tlg0555.tlg001.opp-grc1	βᾶτ᾿ εἰς ὁδὸν δὴ πᾶς ὁ χειρῶναξ λεώς, οἳ τὴν Διὸς γοργῶπιν Ἐργάνην θεὸν στατοῖσι λίκνοις προστρέπεσθε, ἠλίθιοι τῶν λίθων δημιουργοί τε καὶ προσκυνηταί.	εἰς ὁδός δή πᾶς ὁ χειρῶναξ λαός , ὁ ὁ Ζεύς γοργωπός Ἐργάνη    προστρέπω , ἠλίθιος ὁ λίθος δημιουργός τε καί προσκυνητής .
388511	tlg0555.tlg001.opp-grc1	ὁ Φειδίας ὑμῶν καὶ ὁ Πολύκλειτος ἡκόντων Πραξιτέλης τε αὖ καὶ Ἀπελλῆς καὶ ὅσοι τὰς βαναύσους μετέρχονται τέχνας, γήινοι γῆς ὄντες ἐργάται.	ὁ Φειδίας  καί ὁ Πολύκλειτος  Πραξιτέλης τε αὖ καί Ἀπελλῆς καί ὅσος ὁ   τέχνη ,  γῆ εἰμί ἐργάτης .
388512	tlg0555.tlg001.opp-grc1	τότε γὰρ φησί τις προφητεία δυστυχήσειν τὰ τῇδε πράγματα, ὅταν ἀνδριᾶσι πιστεύσωσιν.	τότε γάρ φημί τις προφητεία δυστυχέω ὁ ὅδε πρᾶγμα , ὅταν  πιστεύω .
388513	tlg0555.tlg001.opp-grc1	ἡκόντων οὖν αὖθις, οὐ γὰρ ἀνήσω καλῶν, οἱ μικροτέχναι.	ἥκω οὖν αὖθις , οὐ γάρ ἀνέω καλός , ὁ  .
388514	tlg0555.tlg001.opp-grc1	οὐδείς που τούτων ἔμπνουν εἰκόνα δεδημιούργηκεν, οὐδὲ μὴν ἐκ γῆς μαλθακὴν ἐμάλαξε σάρκα.	που οὗτος  εἰκών  , οὐδέ μήν ἐκ γῆ μαλθακός μαλάσσω σάρξ .
388515	tlg0555.tlg001.opp-grc1	τίς ἔτηξε μυελὸν ἢ τίς ἔπηξεν ὀστέα;	τις  μυελός τίη τις πήγνυμι ὀστέον ;
388516	tlg0555.tlg001.opp-grc1	τίς νεῦρα διέτεινεν ἢ τίς φλέβας ἐφύσησεν;	τις νευρά διατείνω τίη τις   ;
388517	tlg0555.tlg001.opp-grc1	τίς αἷμα ἐνέχεεν ἐν αὐταῖς ἢ τίς δέρμα περιέ τεινεν;	τις αἷμα  ἐν αὐτός τίη τις δέρμα   ;
388518	tlg0555.tlg001.opp-grc1	ποῦ δ᾿ ἄν τις αὐτῶν ὀφθαλμοὺς ποιήσαι βλέποντας;	ποῦ  ἄν τις αὐτός ὀφθαλμός ποιέω βλέπω ;
388519	tlg0555.tlg001.opp-grc1	τίς ἐνεφύσησε ψυχήν;	τις ἐμφυσάω ψυχή ;
388520	tlg0555.tlg001.opp-grc1	τίς δικαιοσύνην ἐδωρήσατο;	τις δικαιοσύνη δωρέω ;
388521	tlg0555.tlg001.opp-grc1	τίς ἀθανασίαν ὑπέσχηται;	τις ἀθανασία  ;
388522	tlg0555.tlg001.opp-grc1	μόνος ὁ τῶν ὅλων δημιουργός, ὁ» ἀριστοτέχνας πατήρ, « τοιοῦτον ἄγαλμα ἔμψυχον ἡμᾶς τὸν ἄνθρωπον ἔπλασεν·	μόνος ὁ ὁ ὅλος δημιουργός , ὁ »  πατήρ ,   ἄγαλμα ἔμψυχος ἐγώ ὁ ἄνθρωπος πλάσσω ·
388523	tlg0555.tlg001.opp-grc1	ὁ δὲ Ὀλύμπιος ὑμῶν, εἰκόνος εἰκών, πολύ τι τῆς ἀληθείας ἀπᾴδων, ἔργον ἐστὶ κωφὸν χειρῶν Ἀττικῶν.	ὁ δέ Ὀλύμπιος ὑμός ,   , πολύς τις ὁ ἀλήθεια  , ἔργον εἰμί κωφός χείρ Ἀττικός .
