id	filename	tokens	lemmas
947754	tlg0007.tlg018.perseus-grc2	τούτους ἐτεκμαίροντο Καρχηδονίους εἶναι τῇ λαμπρότητι τῆς σκευῆς καὶ τῇ βραδυτῆτι καὶ τάξει τῆς πορείας, μετὰ δὲ τούτους τῶν λοιπῶν ἐθνῶν ἐπιρρεόντων καὶ τὴν διάβασιν μετʼ ὠθισμοῦ καὶ ταραχῆς ποιουμένων, συνιδὼν ὁ Τιμολέων τὸν ποταμὸν αὐτοῖς ταμιεύοντα τοῦ πλήθους τῶν πολεμίων ἀπολαβεῖν ὅσοις ἐθέλοιεν αὐτοὶ μάχεσθαι, καὶ τοὺς στρατιώτας καθορᾶν κελεύσας τὴν φάλαγγα τῷ ῥείθρῳ διαλελυμένην καὶ τοὺς μὲν ἤδη διαβεβηκότας, τοὺς δὲ μέλλοντας, προσέταξε Δημαρέτῳ λαβόντι τοὺς ἱππεῖς ἐμβαλεῖν εἰς τοὺς Καρχηδονίους καὶ συνταράξαι τὸν διάκοσμον αὐτῶν τῆς παρατάξεως οὔπω καθεστώσης.	οὗτος τεκμαίρομαι  εἰμί ὁ λαμπρότης ὁ σκευή καί ὁ  καί τάξις ὁ πορεία , μετά δέ οὗτος ὁ λοιπός ἔθνος ἐπιρρέω καί ὁ διάβασις   καί ταραχή ποιέω , συνοράω ὁ  ὁ ποταμός αὐτός ταμιεύω ὁ πλῆθος ὁ πολέμιος ἀπολαμβάνω ὅσος ἐθέλω αὐτός μάχομαι , καί ὁ στρατιώτης καθοράω κελεύω ὁ φάλαγξ τῷ ῥεῖθρον διαλύω καί ὁ μέν ἤδη διαβαίνω , ὁ δέ μέλλω , προστάσσω  λαμβάνω ὁ ἱππεύς ἐμβάλλω εἰς ὁ  καί συνταράσσω ὁ διάκοσμος αὐτός ὁ παράταξις οὔπω καθίστημι .
947755	tlg0007.tlg018.perseus-grc2	αὐτὸς δὲ καταβὰς εἰς τὸ πεδίον τὰ μὲν κέρατα τοῖς ἄλλοις Σικελιώταις ἀπέδωκεν, ἀναμίξας ἑκατέρῳ τῶν ξένων οὐ πολλούς, ἐν μέσῳ δὲ περὶ αὑτὸν λαβὼν τοὺς Συρακουσίους καὶ τὸ μαχιμώτατον τῶν μισθοφόρων βραχὺν μὲν χρόνον ἐπέσχε τὸ τῶν ἱππέων ἀποθεωρῶν ἔργον, ὡς δὲ ἐκείνους εἶδεν ὑπὸ τῶν ἁρμάτων πρὸ τῆς τάξεως διαθεόντων εἰς χεῖρας ἐλθεῖν τοῖς Καρχηδονίοις οὐ δυναμένους, ἀλλʼ ὅπως μὴ συνταραχθεῖεν ἀναγκαζομένους ἐξελίττειν συνεχῶς καὶ πυκνὰς ἐξ ἐπιστροφῆς ποιεῖσθαι τὰς ἐπελάσεις, ἀναλαβὼν τὴν ἀσπίδα καὶ βοήσας ἕπεσθαι καὶ θαρρεῖν τοῖς πεζοῖς ἔδοξεν ὑπερφυεῖ φωνῇ καὶ μείζονι κεχρῆσθαι τῆς συνήθους, εἴτε τῷ πάθει παρὰ τὸν ἀγῶνα καὶ τὸν ἐνθουσιασμὸν οὕτω διατεινάμενος, εἴτε δαιμονίου τινός, ὡς τοῖς πολλοῖς τότε παρέστη, συνεπιφθεγξαμένου.	αὐτός δέ καταβαίνω εἰς ὁ πεδίον ὁ μέν κέρας ὁ ἄλλος Σικελιώτης ἀποδίδωμι , ἀναμείγνυμι ἑκάτερος ὁ ξένος οὐ πολύς , ἐν μέσος δέ περί ἑαυτοῦ λαμβάνω ὁ  καί ὁ μάχιμος ὁ μισθοφόρος βραχύς μέν χρόνος ἐπέχω ὁ ὁ ἱππεύς  ἔργον , ὡς δέ ἐκεῖνος ὁράω ὑπό ὁ ἅρμα πρό ὁ τάξις διαθέω εἰς χείρ ἔρχομαι ὁ  οὐ  , ἀλλά ὅπως μή  ἀναγκάζω  συνεχής καί πυκνός ἐκ ἐπιστροφή ποιέω ὁ ἐπέλασις , ἀναλαμβάνω ὁ ἀσπίς καί βοάω  καί θαρσέω ὁ πεζός δοκέω ὑπερφύομαι φωνή καί μέγας χράω ὁ  , εἴτε τῷ πάθος παρά ὁ ἀγών καί ὁ ἐνθουσιασμός οὕτως  , εἴτε δαιμόνιον  , ὡς ὁ πολύς τότε παρίστημι ,  .
947756	tlg0007.tlg018.perseus-grc2	ταχὺ δὲ τὴν κραυγὴν ἀνταποδόντων, καὶ παρεγγυώντων ἄγειν καὶ μὴ μέλλειν, τοῖς μὲν ἱππόταις ἐσήμανεν ἔξω παρὰ τὴν τάξιν τῶν ἁρμάτων παρελάσαι καὶ κατὰ κέρας προσφέρεσθαι τοῖς πολεμίοις, αὐτὸς δὲ τοὺς προμάχους πυκνώσας τῷ συνασπισμῷ, καὶ τὴν σάλπιγγα κελεύσας ἐπιφθέγξασθαι, προσέβαλε τοῖς Καρχηδονίοις.	ταχύς δέ ὁ κραυγή  , καί παρεγγυάω ἄγω καί μή μέλλω , ὁ μέν ἱππότης  ἔξω παρά ὁ τάξις ὁ ἅρμα  καί κατά κέρας προσφέρω ὁ πολέμιος , αὐτός δέ ὁ πρόμαχος πυκνόω ὁ  , καί ὁ σάλπιγξ κελεύω ἐπιφθέγγομαι , προσβάλλω ὁ  .
947757	tlg0007.tlg018.perseus-grc2	οἱ δὲ τὴν μὲν πρώτην ἐπιδρομὴν ὑπέστησαν ἐρρωμένως, καὶ τῷ καταπεφράχθαι τὰ σώματα σιδηροῖς θώραξι καὶ χαλκοῖς κράνεσιν ἀσπίδας τε μεγάλας προβεβλῆσθαι διεκρούοντο τὸν δορατισμόν.	ὁ δέ ὁ μέν πρῶτος ἐπιδρομή ὑφίστημι ἐρρωμένος , καί τῷ  ὁ σῶμα σιδήρεος θώραξ καί χάλκεος κράνος ἀσπίς τε μέγας προβάλλω  ὁ  .
947758	tlg0007.tlg018.perseus-grc2	ἐπεὶ δὲ εἰς ξίφη συνῆλθεν ὁ ἀγών καί τέχνης οὐχ ἧττον ἢ ῥώμης ἐγεγόνει τὸ ἔργον, ἐξαίφνης ἀπὸ τῶν ὀρῶν βρονταί τε φοβεραὶ κατερρήγνυντο καὶ πυρώδεις ἀστραπαὶ συνεξέπιπτον.	ἐπεί δέ εἰς  συνέρχομαι ὁ ἀγών καί τέχνη οὐ ἥσσων ἤ ῥώμη γίγνομαι ὁ ἔργον , ἐξαίφνης ἀπό ὁ ὄρος  τε φοβερός καταρρήγνυμι καί  ἀστραπή συνεκπίπτω .
947759	tlg0007.tlg018.perseus-grc2	εἶτα ὁ περὶ τοὺς λόφους καὶ τὰς ἀκρωρείας ζόφος ἐπὶ τὴν μάχην κατιών, ὄμβρῳ καὶ πνεύματι καὶ χαλάζῃ συμμεμιγμένος, τοῖς μὲν Ἕλλησιν ἐξόπισθεν καὶ κατὰ νώτου περιεχεῖτο, τῶν δὲ βαρβάρων ἔτυπτε τὰ πρόσωπα καὶ κατήστραπτε τὰς ὄψεις, ἅμα λαίλαπος ὑγρᾶς καὶ φλογὸς συνεχοῦς ἐκ τῶν νεφῶν φερομένης, ἐν οἷς πολλὰ μὲν ἦν τὰ λυποῦντα, καὶ μάλιστα τοὺς ἀπείρους, οὐχ ἥκιστα δὲ βλάψαι δοκοῦσιν αἱ βρονταί καὶ τῶν ὅπλων ὁ πάταγος κοπτομένων ὕδατι ῥαγδαίῳ καὶ χαλάζῃ, κωλύων ἀκούεσθαι τὰ προστάγματα τῶν ἡγεμόνων, τοῖς δὲ Καρχηδονίοις οὐκ οὖσιν εὐζώνοις τὸν ὁπλισμόν, ἀλλʼ, ὥσπερ εἴρηται, καταπεφραγμένοις, ὅ τε πηλὸς ἐμπόδιος ἦν οἵ τε κόλποι πληρούμενοι τῶν χιτώνων ὕδατος, ὥσθʼ αὑτοῖς μὲν εἰς τὸν ἀγῶνα χρῆσθαι βαρεῖς ἦσαν καὶ δύσεργοι, ῥᾴδιοι δὲ τοῖς Ἕλλησι περιτρέπεσθαι, καὶ πεσόντες ἀμήχανοι πάλιν ἐκ πηλοῦ μετὰ τῶν ὅπλων ἀναστῆναι.	εἶτα ὁ περί ὁ λόφος καί ὁ ἀκρώρεια  ἐπί ὁ μάχη κάτειμι , ὄμβρος καί πνεῦμα καί χάλαζα συμμείγνυμι , ὁ μέν Ἕλλην ἐξόπισθεν καί κατά νῶτος περιχέω , ὁ δέ  τύπτω ὁ πρόσωπον καί  ὁ ὄψις , ἅμα   καί φλόξ  ἐκ ὁ  φέρω , ἐν ὅς πολύς μέν εἰμί ὁ λυπέω , καί μάλιστα ὁ  , οὐ ἥκιστος δέ βλάπτω δοκέω ὁ  καί ὁ ὅπλον ὁ πάταγος  ὕδωρ  καί χάλαζα , κωλύω ἀκούω ὁ πρόσταγμα ὁ ἡγεμών , ὁ δέ  οὐ εἰμί  ὁ ὁπλισμός ,  , ὥσπερ λέγω ,  , ὁ τε πηλός ἐμπόδιος εἰμί ὁ τε κόλπος πληρόω ὁ χιτών ὕδωρ , ὥστε ἑαυτοῦ μέν εἰς ὁ ἀγών χράω2 βαρύς εἰμί καί  , ῥᾴδιος δέ ὁ Ἕλλην  , καί πίπτω ἀμήχανος πάλιν ἐκ  μετά ὁ ὅπλον ἀνίστημι .
947760	tlg0007.tlg018.perseus-grc2	καὶ γὰρ ὁ Κρίμησος ὑπὸ τῶν διαβαινόντων ἐκλύσθη μέγας ἤδη τοῖς ὄμβροις ηὐξημένος, καὶ τὸ πεδίον τὸ περὶ αὐτόν ὑπὸ πολλὰς συναγκείας καὶ φάραγγας ὑποκείμενον ἐπίμπλατο ῥευμάτων οὐ κατὰ πόρον φερομένων, οἷς οἱ Καρχηδόνιοι καλινδούμενοι χαλεπῶς ἀπήλλαττον.	καί γάρ ὁ  ὑπό ὁ διαβαίνω κλύζω μέγας ἤδη ὁ ὄμβρος αὐξάνω , καί ὁ πεδίον ὁ περί αὐτός ὑπό πολύς συνάγκεια καί φάραγξ  πίμπλημι ῥεῦμα οὐ κατά πόρος φέρω , ὅς ὁ   χαλεπός ἀπαλλάσσω .
947761	tlg0007.tlg018.perseus-grc2	τέλος δὲ τοῦ χειμῶνος ἐπικειμένου, καὶ τῶν Ἑλλήνων τὴν πρώτην τάξιν αὐτῶν, ἄνδρας τετρακοσίους, καταβαλόντων, ἐτράπη τὸ πλῆθος εἰς φυγήν.	τέλος δέ ὁ χειμών  , καί ὁ Ἕλλην ὁ πρῶτος τάξις αὐτός , ἀνήρ τετρακόσιοι ,  , τέρπω ὁ πλῆθος εἰς φυγή .
947762	tlg0007.tlg018.perseus-grc2	καὶ πολλοὶ μὲν ἐν τῷ πεδίῳ καταλαμβανόμενοι διεφθείροντο, πολλοὺς δὲ ὁ ποταμὸς τοῖς ἔτι περαιουμένοις συμπίπτοντας ἐμβάλλων καὶ παραφέρων ἀπώλλυε, πλείστους δὲ τῶν λόφων ἐφιεμένους ἐπιθέοντες οἱ ψιλοὶ κατειργάσαντο.	καί πολύς μέν ἐν ὁ πεδίον καταλαμβάνω διαφθείρω , πολύς δέ ὁ ποταμός ὁ ἔτι περαιόω συμπίπτω ἐμβάλλω καί παραφέρω ἀπόλλυμι , πλεῖστος δέ ὁ λόφος  ἐπιθέω ὁ ψιλός κατεργάζομαι .
947763	tlg0007.tlg018.perseus-grc2	λέγονται γοῦν ἐν μυρίοις νεκροῖς τρισχίλιοι Καρχηδονίων γενέσθαι, μέγα τῇ πόλει πένθος, οὔτε γὰρ γένεσιν οὔτε πλούτοις οὔτε δόξαις ἕτεροι βελτίονες ἦσαν ἐκείνων, οὔτε ἀποθανόντας ποτὲ μιᾷ μάχῃ πρότερον ἐξ αὐτῶν Καρχηδονίων τοσούτους μνημονεύουσιν, ἀλλὰ Λίβυσι τὰ πολλὰ καὶ Ἴβηρσι καὶ Νομάσι χρώμενοι πρὸς τὰς μάχας ἀλλοτρίαις βλάβαις ἀνεδέχοντο τὰς ἥττας.	λέγω γοῦν ἐν μυρίος νεκρός τρισχίλιοι  γίγνομαι , μέγας ὁ πόλις πένθος , οὔτε γάρ γένεσις οὔτε πλοῦτος οὔτε δόξα ἕτερος  εἰμί ἐκεῖνος , οὔτε ἀποθνῄσκω ποτε  μάχη πρότερος ἐκ αὐτός  τοσοῦτος μνημονεύω , ἀλλά Λίβυς ὁ πολύς καί Ἴβηρ καί  χράω2 πρός ὁ μάχη ἀλλότριος βλάβη ἀναδέχομαι ὁ ἧσσα .
947764	tlg0007.tlg018.perseus-grc2	ἐγνώσθη δὲ τοῖς Ἕλλησιν ἡ δόξα τῶν πεσόντων ἀπὸ τῶν λαφύρων, ἐλάχιστος γὰρ ἦν χαλκῶν καὶ σιδηρῶν τοῖς σκυλεύουσι λόγος·	γιγνώσκω δέ ὁ Ἕλλην ὁ δόξα ὁ πίπτω ἀπό ὁ λάφυρα , ἐλάχιστος γάρ εἰμί χαλκός καί σιδηρόω ὁ  λόγος ·
947765	tlg0007.tlg018.perseus-grc2	οὕτως ἄφθονος μὲν ἦν ἄργυρος, ἄφθονος δὲ χρυσός, καὶ γὰρ τὸ στρατόπεδον μετὰ τῶν ὑποζυγίων διαβάντες ἔλαβον.	οὕτως ἄφθονος μέν εἰμί ἄργυρος , ἄφθονος δέ χρυσός , καί γάρ ὁ στρατόπεδον μετά ὁ  διαβαίνω λαμβάνω .
947766	tlg0007.tlg018.perseus-grc2	τῶν δʼ αἰχμαλώτων οἱ μὲν πολλοὶ διεκλάπησαν ὑπὸ τῶν στρατιωτῶν, εἰς δὲ κοινὸν ἀπεδείχθησαν πεντακισχίλιοι τὸ πλῆθος·	ὁ δέ αἰχμάλωτος ὁ μέν πολύς διακλέπτω ὑπό ὁ στρατιώτης , εἰς δέ κοινός ἀποδείκνυμι πεντακισχίλιοι ὁ πλῆθος ·
947767	tlg0007.tlg018.perseus-grc2	ἥλω δὲ καὶ διακόσια τῶν τεθρίππων.	ἁλίσκομαι δέ καί διακόσιοι ὁ  .
947768	tlg0007.tlg018.perseus-grc2	καλλίστην δὲ καὶ μεγαλοπρεπεστάτην ὄψιν ἡ Τιμολέοντος ἐπεδείκνυτο σκηνή περισωρευθεῖσα παντοδαποῖς λαφύροις, ἐν οἷς χίλιοι μὲν θώρακες ἐργασίᾳ, καὶ κάλλει διαφέροντες, μύριαι δὲ ἀσπίδες προετέθησαν.	καλός δέ καί μεγαλοπρεπής ὄψις ὁ Τιμολέων ἐπιδείκνυμι σκηνή  παντοδαπός λάφυρα , ἐν ὅς χίλιοι μέν θώραξ ἐργασία , καί κάλλος διαφέρω , μυρίος δέ ἀσπίς  .
947769	tlg0007.tlg018.perseus-grc2	ὀλίγοι δὲ πολλοὺς σκυλεύοντες καὶ μεγάλαις ἐντυγχάνοντες ὠφελείαις τρίτῃ μόλις ἡμέρᾳ μετὰ τὴν μάχην ἔστησαν τρόπαιον.	ὀλίγος δέ πολύς σκυλεύω καί μέγας ἐντυγχάνω ὠφέλεια τρίτος μόλις ἡμέρα μετά ὁ μάχη ἵστημι τρόπαιον .
947770	tlg0007.tlg018.perseus-grc2	ἅμα δὲ τῇ φήμῃ τῆς νίκης ὁ Τιμολέων εἰς Κόρινθον ἔπεμψε τὰ κάλλιστα τῶν αἰχμαλώτων ὅπλων, βουλόμενος αὐτοῦ τὴν πατρίδα πᾶσιν ἀνθρώποις ζηλωτὴν εἶναι, θεωμένοις ἐν ἐκείνῃ μόνῃ τῶν Ἑλληνικῶν πόλεων τοὺς ἐπιφανεστάτους ναοὺς οὐχ Ἑλληνικοῖς κεκοσμημένους λαφύροις οὐδʼ ἀπὸ συγγενῶν φόνου καὶ ὁμοφύλων ἀναθημάτων μνήμας ἀτερπεῖς ἔχοντας, ἀλλὰ βαρβαρικὰ σκῦλα καλλίσταις ἐπιγραφαῖς δηλοῦντα μετὰ τῆς ἀνδρείας τῶν νενικηκότων τὴν δικαιοσύνην, ὅτι Κορίνθιοι καὶ Τιμολέων ὁ στρατηγός ἐλευθερώσαντες τοὺς Σικελίαν οἰκοῦντας Ἕλληνας ἀπὸ Καρχηδονίων χαριστήρια θεοῖς ἀνέθηκαν.	ἅμα δέ ὁ φήμη ὁ νίκη ὁ  εἰς Κόρινθος πέμπω ὁ καλός ὁ αἰχμάλωτος ὅπλον ,  αὐτός ὁ πατρίς πᾶς ἄνθρωπος ζηλωτός εἰμί ,  ἐν ἐκεῖνος μόνος ὁ Ἑλληνικός πόλις ὁ ἐπιφανής ναός οὐ   λάφυρα οὐδέ ἀπό συγγενής φόνος καί ὁμόφυλος ἀνάθημα μνήμη ἀτερπής ἔχω , ἀλλά βαρβαρικός σκῦλον καλός ἐπιγραφή δηλόω μετά ὁ ἀνδρεία ὁ νικάω ὁ δικαιοσύνη , ὅτι2  καί  ὁ στρατηγός ἐλευθερόω ὁ Σικελία οἰκέω Ἕλλην ἀπό  χαριστήριος θεός ἀνατίθημι .
947771	tlg0007.tlg018.perseus-grc2	ἐκ τούτου καταλιπὼν ἐν τῇ πολεμίᾳ τοὺς μισθοφόρους ἄγοντας καὶ φέροντας τὴν τῶν Καρχηδονίων ἐπικράτειαν, αὐτὸς ἧκεν εἰς Συρακούσας·	ἐκ οὗτος καταλείπω ἐν ὁ  ὁ μισθοφόρος ἄγω καί φέρω ὁ ὁ  ἐπικράτεια , αὐτός ἵημι εἰς Συράκουσαι ·
947772	tlg0007.tlg018.perseus-grc2	καὶ τοὺς χιλίους μισθοφόρους ἐκείνους, ὑφʼ ὧν ἐγκατελείφθη πρὸ τῆς μάχης, ἐξεκήρυξε τῆς Σικελίας, καὶ πρὶν ἢ δῦναι τὸν ἥλιον ἠνάγκασεν ἐκ Συρακουσῶν ἀπελθεῖν.	καί ὁ χίλιοι μισθοφόρος ἐκεῖνος , ὑπό ὅς ἐγκαταλείπω πρό ὁ μάχη ,  ὁ Σικελία , καί πρίν τίη δύω ὁ ἥλιος ἀναγκάζω ἐκ  ἀπέρχομαι .
947773	tlg0007.tlg018.perseus-grc2	οὗτοι μὲν οὖν διαπλεύσαντες εἰς Ἰταλίαν ἀπώλοντο παρασπονδηθέντες ὑπὸ Βρεττίων, καὶ δίκην ταύτην τὸ δαιμόνιον αὐτοῖς τῆς προδοσίας ἐπέθηκε.	οὗτος μέν οὖν διαπλέω εἰς Ἰταλία ἀπόλλυμι παρασπονδέω ὑπό  , καί δίκη οὗτος ὁ δαιμόνιον αὐτός ὁ προδοσία ἐπιτίθημι .
947774	tlg0007.tlg018.perseus-grc2	τῶν δὲ περὶ τὸν Μάμερκον, τὸν Κατάνης τύραννον, καὶ Ἱκέτην, εἴτε φθόνῳ τῶν κατορθουμένων ὑπὸ Τιμολέοντος, εἴτε φοβουμένων αὐτὸν ὡς ἄπιστον καὶ ἄσπονδον πρὸς τοὺς τυράννους, συμμαχίαν ποιησαμένων πρὸς τοὺς Καρχηδονίους καὶ κελευσάντων πέμπειν δύναμιν καὶ στρατηγόν, εἰ μὴ παντάπασι βούλονται Σικελίας ἐκπεσεῖν, ἔπλευσε Γέσκων ναῦς μὲν ἔχων ἑβδομήκοντα, μισθοφόρους δὲ προσλαβὼν Ἕλληνας, οὔπω πρότερονʼ Ἕλλησι χρησαμένων Καρχηδονίων, ἀλλὰ τότε θαυμασάντων ὡς ἀνυποστάτους καὶ μαχιμωτάτους ἀνθρώπων ἁπάντων, συστάντες δὲ κοινῇ μετʼ ἀλλήλων ἅπαντες ἐν τῇ Μεσσηνίᾳ τετρακοσίους τῶν παρὰ Τιμολέοντος ξένων ἐπικούρους πεμφθέντας ἀπέκτειναν, ἐν δὲ τῇ Καρχηδονίων ἐπικρατείᾳ περὶ τὰς καλουμένας Ἱερὰς ἐνεδρεύσαντες τοὺς μετʼ Εὐθύμου τοῦ Λευκαδίου μισθοφόρους διέφθειραν.	ὁ δέ περί ὁ Μάμερκος , ὁ Κατάνη τύραννος , καί  , εἴτε φθόνος ὁ κατορθόω ὑπό Τιμολέων , εἴτε φοβέω αὐτός ὡς ἄπιστος καί ἄσπονδος πρός ὁ τύραννος , συμμαχία ποιέω πρός ὁ  καί κελεύω πέμπω δύναμις καί στρατηγός , εἰ μή παντάπασι βούλομαι Σικελία ἐκπίπτω , πλέω Γέσκων ναῦς μέν ἔχω  , μισθοφόρος δέ προσλαμβάνω Ἕλλην , οὔπω πρότερος ʼ Ἕλλην χράομαι  , ἀλλά τότε θαυμάζω ὡς  καί μάχιμος ἄνθρωπος ἅπας , συνίστημι δέ κοινῇ μετά ἀλλήλων ἅπας ἐν ὁ  τετρακόσιοι ὁ παρά Τιμολέων ξένος ἐπίκουρος πέμπω ἀποκτείνω , ἐν δέ ὁ  ἐπικράτεια περί ὁ   ἐνεδρεύω ὁ μετά Εὔθυμος ὁ  μισθοφόρος διαφθείρω .
947775	tlg0007.tlg018.perseus-grc2	ἐξ ὧν καὶ μάλιστα τὴν Τιμολέοντος εὐτυχίαν συνέβη γενέσθαι διώνυμον.	ἐκ ὅς καί μάλιστα ὁ Τιμολέων εὐτυχία συμβαίνω γίγνομαι διώνυμος .
947776	tlg0007.tlg018.perseus-grc2	ἦσαν μὲν γὰρ οὗτοι τῶν μετὰ Φιλομήλου τοῦ Φωκέως καὶ Ὀνομάρχου Δελφοὺς καταλαβόντων καὶ μετασχόντων ἐκείνοις τῆς ἱεροσυλίας, μισούντων δὲ πάντων αὐτοὺς καὶ φυλαττομένων ἐπαράτους γεγονότας, πλανώμενοι περὶ τὴν Πελοπόννησον ὑπὸ Τιμολέοντος ἐλήφθησαν ἑτέρων στρατιωτῶν οὐκ εὐποροῦντος.	εἰμί μέν γάρ οὗτος ὁ μετά Φιλόμηλος ὁ Φωκεύς καί Ὀνόμαρχος Δελφοί  καί  ἐκεῖνος ὁ ἱεροσυλία , μισέω δέ πᾶς αὐτός καί φυλάσσω  γίγνομαι , πλανάω περί ὁ Πελοπόννησος ὑπό Τιμολέων λαμβάνω ἕτερος στρατιώτης οὐ  .
947777	tlg0007.tlg018.perseus-grc2	ἀφικόμενοι δὲ εἰς Σικελίαν ὅσας μὲν ἐκείνῳ συνηγωνίσαντο μάχας πάσας ἐνίκων, τῶν δὲ πλείστων καὶ μεγίστων ἀγώνων τέλος ἐχόντων ἐκπεμπόμενοι πρὸς ἑτέρας ὑπʼ αὐτοῦ βοηθείας ἀπώλοντο καὶ καταναλώθησαν, οὐχ ὁμοῦ πάντες, ἀλλὰ κατὰ μέρος, τῆς δίκης αὐτοῖς ἀπολογουμένης τῇ Τιμολέοντος εὐτυχίᾳ ἐπιτιθεμένης ὅπως μηδεμία τοῖς ἀγαθοῖς ἀπὸ τῆς τῶν κακῶν κολάσεως βλάβη γένηται.	ἀφικνέομαι δέ εἰς Σικελία ὅσος μέν ἐκεῖνος συναγωνίζομαι μάχη πᾶς νικάω , ὁ δέ πλεῖστος καί μέγας ἀγών τέλος ἔχω  πρός ἕτερος ὑπό αὐτός βοήθεια ἀπόλλυμι καί καταναλίσκω , οὐ ὁμοῦ πᾶς , ἀλλά κατά μέρος , ὁ δίκη αὐτός  ὁ Τιμολέων εὐτυχία  ὅπως μηδείς ὁ  ἀπό ὁ ὁ κακός κόλασις βλάβη γίγνομαι .
947778	tlg0007.tlg018.perseus-grc2	τὴν μὲν οὖν πρὸς Τιμολέοντα τῶν θεῶν εὐμένειαν οὐχ ἧττον ἐν αἷς προσέκρουσε πράξεσιν ἢ περὶ ἃς κατώρθου θαυμάζεσθαι συνέβαινεν.	ὁ μέν οὖν πρός Τιμολέων ὁ θεός εὐμένεια οὐ ἥσσων ἐν ὅς προσκρούω πρᾶξις ἤ περί ὅς  θαυμάζω συμβαίνω .
947779	tlg0007.tlg018.perseus-grc2	οἱ δὲ πολλοὶ τῶν Συρακουσίων ἐχαλέπαινον ὑπὸ τῶν τυράννων προπηλακιζόμενοι.	ὁ δέ πολύς ὁ  χαλεπαίνω ὑπό ὁ τύραννος προπηλακίζω .
947780	tlg0007.tlg018.perseus-grc2	καὶ γὰρ ὁ Μάμερκος ἐπὶ τῷ ποιήματα γράφειν καὶ τραγῳδίας μέγα φρονῶν ἐκόμπαζε νικήσας τοὺς μισθοφόρους, καὶ τὰς ἀσπίδας ἀναθεὶς τοῖς θεοῖς ἐλεγεῖον ὑβριστικὸν ἐπέγραψε·	καί γάρ ὁ Μάμερκος ἐπί τῷ ποίημα γράφω καί τραγῳδία μέγας φρονέω  νικάω ὁ μισθοφόρος , καί ὁ ἀσπίς  ὁ θεός ἐλεγεῖον ὑβριστικός ἐπιγράφω ·
