id	filename	tokens	lemmas
407472	tlg0007.tlg021.perseus-grc2	ἐξαίφνης δὲ κοπτομένης τῆς θύρας προσδραμών τις, καὶ πυθόμενος τοῦ ὑπηρέτου Χάρωνα μετιέναι παρὰ τῶν πολεμάρχων φάσκοντος, ἀπήγγειλεν εἴσω τεθορυβημένος, καὶ πᾶσιν εὐθὺς παρέστη τήν τε πρᾶξιν ἐκμεμηνῦσθαι καὶ σφᾶς ἅπαντας ἀπολωλέναι, μηδὲ δράσαντάς τι τῆς ἀρετῆς ἄξιον, οὐ μὴν ἀλλʼ ἔδοξεν ὑπακοῦσαι τὸν Χάρωνα καὶ παρασχεῖν ἑαυτὸν δεῖν ἀνυπόπτως τοῖς ἄρχουσιν, ἄλλως μέν ἀνδρώδη καὶ βαρὺν ὄντα τῷ θαρρεῖν παρὰ τὰ δεινά, τότε δὲ διʼ ἐκείνους ἐκπεπληγμένον καὶ περιπαθοῦντα, μή τις ὑποψία προδοσίας ἐπʼ αὐτὸν ἔλθῃ τοσούτων ἅμα καὶ τοιούτων πολιτῶν ἀπολομένων.	ἐξαίφνης δέ  ὁ θύρα προστρέχω τις , καί πυνθάνομαι ὁ ὑπηρέτης Χάρων μέτειμι2 παρά ὁ  φάσκω , ἀπαγγέλλω  θορυβέω , καί πᾶς εὐθύς παρίστημι ὁ τε πρᾶξις  καί σφεῖς ἅπας ἀπόλλυμι , μηδέ  τι ὁ ἀρετή ἄξιος , οὐ μήν  δοκέω ὑπακούω ὁ Χάρων καί παρέχω ἑαυτοῦ δέω ἀνύποπτος ὁ ἄρχω , ἄλλος μέν ἀνδρώδης καί βαρύς εἰμί τῷ θαρσέω παρά ὁ δεινός , τότε δέ διά ἐκεῖνος ἐκπλήσσω καί  , μή τις ὑποψία προδοσία ἐπί αὐτός ἔρχομαι τοσοῦτος ἅμα καί τοιοῦτος πολίτης ἀπόλλυμι .
407473	tlg0007.tlg021.perseus-grc2	ὡς οὖν ἔμελλεν ἀπιέναι, παραλαβὼν ἐκ τῆς γυναικωνίτιδος τὸν υἱόν, ἔτι μέν ὄντα παῖδα, κάλλει δὲ καὶ ῥώμῃ σώματος πρωτεύοντα τῶν καθʼ ἡλικίαν, ἐνεχείριζε τοῖς περὶ Πελοπίδαν, εἴ τινα δόλον καὶ προδοσίαν αὐτοῦ καταγνοῖεν, ὡς πολεμίῳ χρῆσθαι κελεύων ἐκείνῳ καὶ μὴ φείδεσθαι.	ὡς οὖν μέλλω ἄπειμι2 , παραλαμβάνω ἐκ ὁ γυναικωνῖτις ὁ υἱός , ἔτι μέν εἰμί παῖς , κάλλος δέ καί ῥώμη σῶμα πρωτεύω ὁ καθά ἡλικία , ἐγχειρίζω ὁ περί Πελοπίδης , εἰ  δόλος καί προδοσία αὐτός  , ὡς πολέμιος χράω2 κελεύω ἐκεῖνος καί μή φείδομαι .
407474	tlg0007.tlg021.perseus-grc2	πολλοῖς μέν οὖν αὐτῶν δάκρυα πρὸς τὸ πάθος καὶ τὸ φρόνημα τοῦ Χάρωνος ἐξέπεσε, πάντες δὲ ἠγανάκτουν εἰ δειλὸν οὕτως εἶναί τινα δοκεῖ καὶ διεφθαρμένον ὑπὸ τοῦ παρόντος, ὥστε ὑπονοεῖν ἐκεῖνον ἢ ὅλως αἰτιᾶσθαι καὶ τὸν υἱὸν ἐδέοντο μὴ καταμιγνύειν αὐτοῖς, ἀλλʼ ἐκποδὼν θέσθαι τοῦ μέλλοντος, ὅπως αὐτός γε τῇ πόλει καὶ τοῖς φίλοις τιμωρὸς ὑποτρέφοιτο περισωθεὶς καὶ διαφυγὼν τοὺς τυράννους.	πολύς μέν οὖν αὐτός δάκρυον πρός ὁ πάθος καί ὁ φρόνημα ὁ Χάρων ἐκπίπτω , πᾶς δέ ἀγανακτέω εἰ δειλός οὕτως εἰμί τις δοκέω καί διαφθείρω ὑπό ὁ πάρειμι , ὥστε ὑπονοέω ἐκεῖνος τίη ὅλος αἰτιάομαι καί ὁ υἱός δέω μή  αὐτός , ἀλλά ἐκποδών τίθημι ὁ μέλλω , ὅπως αὐτός γε ὁ πόλις καί ὁ φίλος τιμωρός  περισῴζω καί διαφεύγω ὁ τύραννος .
407475	tlg0007.tlg021.perseus-grc2	ὁ δὲ Χάρων τὸν μέν υἱὸν ἀπαλλάξειν οὐκ ἔφη·	ὁ δέ Χάρων ὁ μέν υἱός ἀπαλλάσσω οὐ φημί ·
407476	tlg0007.tlg021.perseus-grc2	ποῖον γὰρ αὐτῷ βίον ὁρᾶν ἢ τίνα σωτηρίαν καλλίονα τῆς ὁμοῦ μετὰ πατρὸς καὶ φίλων τοσούτων ἀνυβρίστου τελευτῆς;	ποιός γάρ αὐτός βίος ὁράω τίη τις σωτηρία καλός ὁ ὁμοῦ μετά πατήρ καί φίλος    ;
407477	tlg0007.tlg021.perseus-grc2	ἐπευξάμενος δὲ τοῖς θεοῖς καὶ πάντας ἀσπασάμενος καὶ παραθαρρύνας ἀπῄει, προσέχων ἑαυτῷ καὶ ῥυθμίζων σχήματι προσώπου καὶ τόνῳ φωνῆς ἀνομοιότατος οἷς ἔπραττε φανῆναι.	ἐπεύχομαι δέ ὁ θεός καί πᾶς ἀσπάζομαι καί παραθαρσύνω ἄπειμι2 , προσέχω ἑαυτοῦ καί  σχῆμα πρόσωπον καί τόνος φωνή  ὅς πράσσω φαίνω .
407478	tlg0007.tlg021.perseus-grc2	γενομένου δʼ ἐπὶ ταῖς θύραις αὐτοῦ, προῆλθεν ὁ Ἀρχίας, καὶ Φιλλίδας, καὶ εἶπεν·	γίγνομαι δέ ἐπί ὁ θύρα αὐτός , προέρχομαι ὁ Ἀρχίας , καί Φιλλίδας , καί λέγω ·
407479	tlg0007.tlg021.perseus-grc2	ὦ Χάρων, τινὰς ἀκήκοα παρεληλυθότας ἐν τῇ πόλει κρύπτεσθαι, καὶ συμπράττειν αὐτοῖς ἐνίους τῶν πολιτῶν.	ὦ Χάρων ,   παρέρχομαι ἐν ὁ πόλις κρύπτω , καί συμπράσσω αὐτός ἔνιοι ὁ πολίτης .
407480	tlg0007.tlg021.perseus-grc2	καὶ ὁ Χάρων διαταραχθεὶς τὸ πρῶτον, εἶτα ἐρωτήσας τίνες εἰσὶν οἱ παρεληλυθότες καὶ τίνες οἱ κρύπτοντες αὐτούς, ὡς οὐδὲν ἑώρα σαφὲς εἰπεῖν ἔχοντα τὸν Ἀρχίαν, ὑπονοήσας ἀπʼ οὐδενὸς τῶν ἐπισταμένων γεγονέναι τὴν μήνυσιν, ὁρᾶτε τοίνυν, ἔφη, μὴ κενός τις ὑμᾶς διαταράττῃ λόγος, οὐ μὴν ἀλλὰ σκέψομαι·	καί ὁ Χάρων διαταράσσω ὁ πρῶτος ,  ἐρωτάω τις εἰμί ὁ παρέρχομαι καί τις ὁ  αὐτός , ὡς οὐδείς ὁράω σαφής λέγω ἔχω ὁ Ἀρχίας , ὑπονοέω   ὁ ἐφίστημι γίγνομαι ὁ μήνυσις , ὁράω τοίνυν , φημί , μή κενός τις   λόγος , οὐ μήν ἀλλά σκοπέω ·
407481	tlg0007.tlg021.perseus-grc2	δεῖ γὰρ ἴσως μηδενὸς καταφρονεῖν.	δέω γάρ ἴσος  καταφρονέω .
407482	tlg0007.tlg021.perseus-grc2	ταῦτα καὶ Φιλλίδας παρὼν ἐπῄνει, καὶ τὸν Ἀρχίαν ἀπαγαγὼν αὖθις εἰς ἄκρατον πολὺν κατέβαλε, καὶ ταῖς περὶ τῶν γυναικῶν ἐλπίσι διεπαιδαγώγει τὸν πότον.	οὗτος καί Φιλλίδας πάρειμι ἐπαινέω , καί ὁ Ἀρχίας ἀπάγω αὖθις εἰς ἄκρατος πολύς καταβάλλω , καί ὁ περί ὁ γυνή ἐλπίς  ὁ πότος .
407483	tlg0007.tlg021.perseus-grc2	ὡς δʼ ἐπανῆλθεν ὁ Χάρων οἴκαδε καὶ διεσκευασμένους τοὺς ἄνδρας εὗρεν οὐχ ὡς ἄν τινα νίκην ἢ σωτηρίαν ἐλπίζοντας, ἀλλʼ ὡς ἀποθανουμένους λαμπρῶς καὶ μετὰ φόνου πολλοῦ τῶν πολεμίων, τὸ μὲν ἀληθὲς αὐτοῖς ἔφραζε τοῖς περὶ τὸν Πελοπίδαν, πρὸς δὲ τοὺς ἄλλους ἐψεύσατο λόγους τινὰς τοῦ Ἀρχίου περὶ πραγμάτων ἑτέρων πλασάμενος.	ὡς δέ ἐπανέρχομαι ὁ Χάρων οἴκαδε καί  ὁ ἀνήρ εὑρίσκω οὐ ὡς ἄν τις νίκη ἤ σωτηρία ἐλπίζω , ἀλλά ὡς ἀποθνῄσκω λαμπρός καί μετά φόνος πολύς ὁ πολέμιος , ὁ μέν ἀληθής αὐτός φράζω ὁ περί ὁ Πελοπίδης , πρός δέ ὁ ἄλλος ψεύδω λόγος  ὁ Ἀρχίας περί πρᾶγμα ἕτερος πλάσσω .
407484	tlg0007.tlg021.perseus-grc2	ἔτι δὲ τοῦ πρώτου παραφερομένου δεύτερον ἐπῆγεν ἡ τύχη χειμῶνα τοῖς ἀνδράσιν.	ἔτι δέ ὁ πρῶτος παραφέρω δεύτερος ἐπάγω ὁ τύχη χειμών ὁ ἀνήρ .
407485	tlg0007.tlg021.perseus-grc2	ἧκε γάρ τις ἐξ Ἀθηνῶν παρὰ Ἀρχίου τοῦ ἱεροφάντου πρὸς Ἀρχίαν τὸν ὁμώνυμον, ξένον ὄντα καὶ φίλον, ἐπιστολὴν κομίζων οὐ κενὴν ἔχουσαν οὐδὲ πεπλασμένην ὑπόνοιαν, ἀλλὰ σαφῶς ἕκαστα περὶ τῶν πρασσομένων φάσκουσαν, ὡς ὕστερον ἐπεγνώσθη·	ἵημι γάρ τις ἐκ Ἀθήνη παρά Ἀρχίας ὁ  πρός Ἀρχίας ὁ ὁμώνυμος , ξένος εἰμί καί φίλος , ἐπιστολή κομίζω οὐ κενός ἔχω οὐδέ  ὑπόνοια , ἀλλά σαφής ἕκαστος περί ὁ πράσσω φάσκω , ὡς ὕστερος ἐπιγιγνώσκω ·
407486	tlg0007.tlg021.perseus-grc2	τότε δὲ μεθύοντι τῷ Ἀρχίᾳ προσαχθεὶς ὁ γραμματοφόρος καὶ τὴν ἐπιστολὴν ἐπιδούς, ὁ ταύτην, ἔφη, πέμψας ἐκέλευσεν εὐθὺς ἀναγνῶναι·	τότε δέ μεθύω τῷ Ἀρχίας  ὁ γραμματοφόρος καί ὁ ἐπιστολή ἐπιδίδωμι , ὁ οὗτος , φημί , πέμπω κελεύω εὐθύς ἀναγιγνώσκω ·
407487	tlg0007.tlg021.perseus-grc2	περὶ σπουδαίων γάρ τινων γεγράφθαι.	περί σπουδαῖος γάρ  γράφω .
407488	tlg0007.tlg021.perseus-grc2	καὶ ὁ Ἀρχίας μειδιάσας, οὐκοῦν εἰς αὔριον ἔφη, τὰ σπουδαῖα.	καί ὁ Ἀρχίας μειδάω , οὐκοῦν εἰς αὔριον φημί , ὁ σπουδαῖος .
407489	tlg0007.tlg021.perseus-grc2	καὶ τὴν ἐπιστολὴν δεξάμενος ὑπὸ τὸ προσκεφάλαιον ὑπέθηκεν, αὐτὸς δὲ πάλιν τῷ Φιλλίδᾳ περὶ ὧν ἐτύγχανον διαλεγόμενοι προσεῖχεν.	καί ὁ ἐπιστολή δέχομαι ὑπό ὁ προσκεφάλαιον ὑποτίθημι , αὐτός δέ πάλιν τῷ  περί ὅς τυγχάνω  προσέχω .
407490	tlg0007.tlg021.perseus-grc2	ὁ μὲν οὖν λόγος οὗτος ἐν παροιμίας τάξει περιφερόμενος μέχρι νῦν διασῴζεται παρὰ τοῖς Ἕλλησι.	ὁ μέν οὖν λόγος οὗτος ἐν παροιμία τάξις περιφέρω μέχρι νῦν διασῴζω παρά ὁ Ἕλλην .
407491	tlg0007.tlg021.perseus-grc2	τῆς δὲ πράξεως δοκούσης ἔχειν ἤδη τὸν οἰκεῖον καιρόν, ἐξώρμων δίχα διελόντες αὑτούς, οἱ μὲν περὶ Πελοπίδαν καὶ Δαμοκλείδαν ἐπὶ τὸν Λεοντίδαν καὶ τὸν Ὑπάτην ἐγγὺς ἀλλήλων οἰκοῦντας, Χάρων δὲ καὶ Μέλων ἐπὶ τὸν Ἀρχίαν καὶ Φίλιππον, ἐσθῆτας ἐπενδεδυμένοι γυναικείας τοῖς θώραξι, καὶ δασεῖς στεφάνους ἐλάτης τε καὶ πεύκης περικείμενοι κατασκιάζοντας τὰ πρόσωπα.	ὁ δέ πρᾶξις δοκέω ἔχω ἤδη ὁ οἰκεῖος καιρός ,  δίχα διαιρέω ἑαυτοῦ , ὁ μέν περί Πελοπίδης καί  ἐπί ὁ  καί ὁ  ἐγγύς ἀλλήλων οἰκέω , Χάρων δέ καί Μέλων ἐπί ὁ Ἀρχίας καί Φίλιππος , ἐσθής  γυναικεῖος ὁ θώραξ , καί   ἐλάτη τε καί πεύκη   ὁ πρόσωπον .
407492	tlg0007.tlg021.perseus-grc2	διὸ καὶ ταῖς θύραις τοῦ συμποσίου τὸ πρῶτον ἐπιστάντες, κρότον ἐποίησαν καὶ θόρυβον οἰομένων ἃς πάλαι προσεδόκων γυναῖκας ἥκειν.	διό καί ὁ θύρα ὁ  ὁ πρῶτος ἐφίστημι , κρότος ποιέω καί θόρυβος  ὅς πάλαι προσδοκάω γυνή ἥκω .
407493	tlg0007.tlg021.perseus-grc2	ἐπεὶ δὲ περιβλέψαντες ἐν κύκλῳ τὸ συμπόσιον καὶ τῶν κατακεκλιμένων ἕκαστον ἀκριβῶς καταμαθόντες ἐσπάσαντο τὰς μαχαίρας, καὶ φερόμενοι διὰ τῶν τραπεζῶν ἐπὶ τὸν Ἀρχίαν καὶ Φίλιππον ἐφάνησαν οἵπερ ἦσαν, ὀλίγους μὲν ὁ Φιλλίδας τῶν κατακειμένων ἔπεισεν ἡσυχίαν ἄγειν, τοὺς δὲ ἄλλους ἀμύνεσθαι μετὰ τῶν πολεμάρχων ἐπιχειροῦντας καὶ συνεξανισταμένους διὰ τὴν μέθην οὐ πάνυ χαλεπῶς ἀπέκτειναν.	ἐπεί δέ  ἐν κύκλος ὁ συμπόσιον καί ὁ  ἕκαστος ἀκριβής καταμανθάνω  ὁ μάχαιρα , καί φέρω διά ὁ  ἐπί ὁ Ἀρχίας καί Φίλιππος  οἷπερ εἰμί , ὀλίγος μέν ὁ Φιλλίδας ὁ  πείθω ἡσυχία ἄγω , ὁ δέ ἄλλος ἀμύνω μετά ὁ πολέμαρχος ἐπιχειρέω καί  διά ὁ μέθη οὐ πάνυ χαλεπός ἀποκτείνω .
407494	tlg0007.tlg021.perseus-grc2	τοῖς δὲ περὶ τὸν Πελοπίδαν ἐργωδέστερον ἀπήντα τὸ πρᾶγμα·	ὁ δέ περί ὁ Πελοπίδης ἐργώδης  ὁ πρᾶγμα ·
407495	tlg0007.tlg021.perseus-grc2	καὶ γὰρ ἐπὶ νήφοντα καὶ δεινὸν ἄνδρα τὸν Λεοντίδαν ἐχώρουν, καὶ κεκλεισμένην τὴν οἰκίαν εὗρον ἤδη καθεύδοντος, καὶ πολὺν χρόνον κόπτουσιν αὐτοῖς ὑπήκουεν οὐδείς.	καί γάρ ἐπί  καί δεινός ἀνήρ ὁ  χωρέω , καί κλείω ὁ οἰκία εὑρίσκω ἤδη καθεύδω , καί πολύς χρόνος κόπτω αὐτός ὑπακούω  .
407496	tlg0007.tlg021.perseus-grc2	μόλις δέ ποτε τοῦ θεράποντος αἰσθομένου προϊόντος ἔνδοθεν καὶ τὸν μοχλὸν ἀφαιροῦντος, ἅμα τῷ πρῶτον ἐνδοῦναι καὶ χαλάσαι τὰς θύρας ἐμπεσόντες ἀθρόοι καὶ τὸν οἰκέτην ἀνατρέψαντες ἐπὶ τὸν θάλαμον ὥρμησαν.	μόλις δέ ποτε ὁ   πρόειμι ἔνδον καί ὁ μοχλός  , ἅμα τῷ πρῶτος ἐνδίδωμι καί χαλάω ὁ θύρα ἐμπίπτω ἀθρόος καί ὁ οἰκέτης ἀνατρέπω ἐπί ὁ θάλαμος ὁρμάω .
407497	tlg0007.tlg021.perseus-grc2	ὁ δὲ Λεοντίδας αὐτῷ τεκμαιρόμενος τῷ κτύπῳ καὶ δρόμῳ τὸ γιγνόμενον, ἐσπάσατο μὲν τὸ ἐγχειρίδιον ἐξαναστάς, ἔλαθε δὲ αὐτὸν καταβαλεῖν τὰ λύχνα καὶ διὰ σκότους αὐτοὺς ἑαυτοῖς περιπετεῖς ποιῆσαι τοὺς ἄνδρας, ἐν δὲ φωτὶ πολλῷ καθορώμενος, ὑπήντα πρὸς τὰς θύρας αὐτοῖς τοῦ θαλάμου, καὶ τὸν πρῶτον εἰσιόντα Κηφισόδωρον πατάξας κατέβαλε, πεσόντος δὲ τούτου δευτέρῳ συνεπλέκετο τῷ Πελοπίδᾳ·	ὁ δέ  αὐτός  τῷ κτύπος καί δρόμος ὁ  , σπάω μέν ὁ ἐγχειρίδιον  , λανθάνω δέ αὐτός καταβάλλω ὁ  καί διά  αὐτός ἑαυτοῦ περιπετής ποιέω ὁ ἀνήρ , ἐν δέ φάος πολύς καθοράω ,  πρός ὁ θύρα αὐτός ὁ θάλαμος , καί ὁ πρῶτος εἴσειμι Κηφισόδωρος πατάσσω καταβάλλω , πίπτω δέ οὗτος δεύτερος συμπλέκω τῷ Πελοπίδης ·
407498	tlg0007.tlg021.perseus-grc2	καὶ τὴν μάχην χαλεπὴν ἐποίει καὶ δύσεργον ἡ στενότης τῶν θυρῶν καὶ κείμενος ἐμποδὼν ἤδη νεκρὸς ὁ Κηφισόδωρος.	καί ὁ μάχη χαλεπός ποιέω καί  ὁ στενότης ὁ θύρα καί  ἐμποδών ἤδη νεκρός ὁ Κηφισόδωρος .
407499	tlg0007.tlg021.perseus-grc2	ἐκράτησε δʼ οὖν ὁ Πελοπίδας, καὶ κατεργασάμενος τὸν Λεοντίδαν ἐπὶ τὸν Ὑπάτην εὐθὺς ἐχώρει μετὰ τῶν σὺν αὐτῷ.	κρατέω δέ οὖν ὁ Πελοπίδης , καί  ὁ  ἐπί ὁ  εὐθύς χωρέω μετά ὁ σύν αὐτός .
407500	tlg0007.tlg021.perseus-grc2	καὶ παρεισέπεσον μὲν εἰς τὴν οἰκίαν ὁμοίως, αἰσθόμενον δὲ ταχέως καὶ καταφυγόντα πρὸς τοὺς γείτονας, ἐκ ποδῶν διώξαντες εἷλον καὶ διέφθειραν.	καί  μέν εἰς ὁ οἰκία ὅμοιος , αἰσθάνομαι δέ ταχύς καί καταφεύγω πρός ὁ γείτων , ἐκ πούς διώκω αἱρέω καί διαφθείρω .
407501	tlg0007.tlg021.perseus-grc2	διαπραξάμενοι δὲ ταῦτα καὶ τοῖς περὶ Μέλωνα συμβαλόντες ἔπεμψαν μὲν εἰς τὴν Ἀττικὴν ἐπὶ τοὺς ὑπολελειμμένους ἐκεῖ τῶν φυγάδων, ἐκάλουν δὲ τοὺς πολίτας ἐπὶ τὴν ἐλευθερίαν, καὶ τοὺς προσιόντας ὥπλιζον, ἀφαιροῦντες ἀπὸ τῶν στοῶν τὰ περικείμενα σκῦλα, καὶ τὰ περὶ τὴν οἰκίαν ἐργαστήρια δορυξόων καὶ μαχαιροποιῶν ἀναρρηγνύντες.	δέ οὗτος καί ὁ περί Μέλων συμβάλλω πέμπω μέν εἰς ὁ Ἀττική ἐπί ὁ ὑπολείπω ἐκεῖ ὁ φυγάς , καλέω δέ ὁ πολίτης ἐπί ὁ ἐλευθερία , καί ὁ  ὁπλίζω , ἀφαιρέω ἀπό ὁ  ὁ  σκῦλον , καί ὁ περί ὁ οἰκία ἐργαστήριον  καί  ἀναρρήγνυμι .
407502	tlg0007.tlg021.perseus-grc2	ἧκον δὲ βοηθοῦντες αὐτοῖς μετὰ τῶν ὅπλων οἱ περὶ Ἐπαμεινώνδαν καὶ Γοργίδαν, συνειλοχότες οὐκ ὀλίγους τῶν νέων καὶ τῶν πρεσβυτέρων τοὺς βελτίστους, ἡ δὲ πόλις ἤδη μὲν ἀνεπτόητο πᾶσα, καὶ πολὺς θόρυβος ἦν καὶ φῶτα περὶ τὰς οἰκίας καὶ διαδρομαὶ πρὸς ἀλλήλους, οὔπω δὲ συνειστήκει τὸ πλῆθος, ἀλλʼ ἐκπεπληγμένοι πρὸς τὰ γινόμενα καὶ σαφὲς οὐδὲν εἰδότες ἡμέραν περιέμενον.	ἥκω δέ βοηθέω αὐτός μετά ὁ ὅπλον ὁ περί Ἐπαμεινώνδας καί  ,  οὐ ὀλίγος ὁ νέος καί ὁ πρέσβυς ὁ βελτίων , ὁ δέ πόλις ἤδη μέν  πᾶς , καί πολύς θόρυβος εἰμί καί φώς περί ὁ οἰκία καί διαδρομή πρός ἀλλήλων , οὔπω δέ συνίστημι ὁ πλῆθος ,  ἐκπλήσσω πρός ὁ  καί σαφής οὐδείς οἶδα ἡμέρα  .
407503	tlg0007.tlg021.perseus-grc2	ὅθεν ἁμαρτεῖν οἱ τῶν Λακεδαιμονίων ἄρχοντες ἔδοξαν εὐθὺς οὐκ ἐπιδραμόντες οὐδὲ συμβαλόντες, αὐτὴ μὲν ἡ φρουρὰ περὶ χιλίους πεντακοσίους ὄντες, ἐκ δὲ τῆς πόλεως πρὸς αὐτοὺς πολλῶν συντρεχόντων, ἀλλὰ τὴν βοὴν καὶ τὰ πυρὰ καὶ τὸν ὄχλον χωροῦντα πανταχόθεν πολὺν φοβηθέντες ἡσύχαζον, αὐτὴν τὴν Καδμείαν κατέχοντες, ἅμα δὲ ἡμέρᾳ παρῆσαν μὲν ἐκ τῆς Ἀττικῆς οἱ φυγάδες ὡπλισμένοι, συνήθροιστο δὲ εἰς τὴν ἐκκλησίαν ὁ δῆμος.	ὅθεν  ὁ ὁ  ἄρχων δοκέω εὐθύς οὐ ἐπιτρέχω οὐδέ συμβάλλω , αὐτός μέν ὁ φρουρά περί χίλιοι πεντακόσιοι εἰμί , ἐκ δέ ὁ πόλις πρός αὐτός πολύς συντρέχω , ἀλλά ὁ βοή καί ὁ πυρά καί ὁ ὄχλος χωρέω πανταχόθεν πολύς φοβέω ἡσυχάζω , αὐτός ὁ  κατέχω , ἅμα δέ ἡμέρα πάρειμι μέν ἐκ ὁ  ὁ φυγάς ὁπλίζω , συναθροίζω δέ εἰς ὁ ἐκκλησία ὁ δῆμος .
407504	tlg0007.tlg021.perseus-grc2	εἰσῆγον δὲ τοὺς περὶ Πελοπίδαν Ἐπαμεινώνδας καὶ Γοργίδας ὑπὸ τῶν ἱερέων περιεχομένους στέμματα προτεινόντων καὶ παρακαλούντων τοὺς πολίτας τῇ πατρίδι καὶ τοῖς θεοῖς βοηθεῖν, ἡ δʼ ἐκκλησία ὀρθὴ πρὸς τὴν ὄψιν μετὰ κρότου καὶ βοῆς ἐξανέστη, δεχομένων τοὺς ἄνδρας ὡς εὐεργέτας καὶ σωτῆρας.	εἰσάγω δέ ὁ περί Πελοπίδης Ἐπαμεινώνδας καί Γοργίδας ὑπό ὁ  περιέχω στέμμα προτείνω καί παρακαλέω ὁ πολίτης ὁ πατρίς καί ὁ θεός βοηθέω , ὁ δέ   πρός ὁ ὄψις μετά κρότος καί βοείη ἐξανίστημι ,  ὁ ἀνήρ ὡς εὐεργέτης καί σωτήρ .
407505	tlg0007.tlg021.perseus-grc2	ἐκ δὲ τούτου βοιωτάρχης αἱρεθεὶς μετὰ Μέλωνος καὶ Χάρωνος ὁ Πελοπίδας εὐθὺς ἀπετείχιζε τὴν ἀκρόπολιν καὶ προσβολὰς ἐποιεῖτο πανταχόθεν, ἐξελεῖν σπουδάζων τοὺς Λακεδαιμονίους καὶ τὴν Καδμείαν ἐλευθερῶσαι πρὶν ἐκ Σπάρτης στρατὸν ἐπελθεῖν.	ἐκ δέ οὗτος  αἱρέω μετά Μέλων καί Χάρων ὁ Πελοπίδης εὐθύς ἀποτειχίζω ὁ ἀκρόπολις καί προσβολή ποιέω πανταχόθεν , ἐξαιρέω σπουδάζω ὁ  καί ὁ  ἐλευθερόω πρίν ἐκ Σπάρτη στρατός ἐπέρχομαι .
