id	filename	tokens	lemmas
707226	tlg0086.tlg034.1st1K-grc1	Ἔτι δὲ τρίτον παρὰ ταῦτα τὸν μέλλοντα ποιεῖν τι τῶν ἀνηκέστων δι’ ἄγνοιαν ἀναγνωρίσαι πρὶν ποιῆσαι.	ἔτι δέ τρίτος παρά οὗτος ὁ μέλλω ποιέω τι ὁ ἀνήκεστος διά ἄγνοια ἀναγνωρίζω πρίν ποιέω .
707227	tlg0086.tlg034.1st1K-grc1	Καὶ παρὰ ταῦτα οὐκ ἔστιν ἄλλως·	καί παρά οὗτος οὐ εἰμί ἄλλος ·
707228	tlg0086.tlg034.1st1K-grc1	ἢ γὰρ πρᾶξαι ἀνάγκη ἢ μή, καὶ εἰδότας ἢ μὴ εἰδότας.	τίη γάρ πράσσω ἀνάγκη ἤ μή , καί οἶδα ἤ μή οἶδα .
707229	tlg0086.tlg034.1st1K-grc1	Τούτων δὲ τὸ μὲν γινώσκοντα μελλῆσαι καὶ μὴ πρᾶξαι χείριστον·	οὗτος δέ ὁ μέν γιγνώσκω μέλλω καί μή πράσσω χείρων ·
707230	tlg0086.tlg034.1st1K-grc1	τό τε γὰρ μιαρὸν ἔχει, καὶ οὐ τραγικόν·	ὁ τε γάρ μιαρός ἔχω , καί οὐ τραγικός ·
707231	tlg0086.tlg034.1st1K-grc1	ἀπαθὲς γάρ.	ἀπαθής γάρ .
707232	tlg0086.tlg034.1st1K-grc1	Διόπερ οὐδεὶς ποιεῖ ὁμοίως, εἰ μὴ ὀλιγάκις, οἷος ἐν Ἀντιγόνῃ τὸν Κρέοντα ὁ Αἵμων.	ποιέω ὅμοιος , εἰ μή ὀλιγάκις , οἷος ἐν Ἀντιγόνη ὁ Κρέων ὁ Αἵμων .
707233	tlg0086.tlg034.1st1K-grc1	Τὸ δὲ πρᾶξαι δεύτερον.	δέ πράσσω δεύτερος .
707234	tlg0086.tlg034.1st1K-grc1	Βέλτιον δὲ τὸ ἀγνοοῦντα μὲν πρᾶξαι, πράξαντα δὲ ἀναγνωρίσαι·	δέ ὁ ἀγνοέω μέν πράσσω , πράσσω δέ ἀναγνωρίζω ·
707235	tlg0086.tlg034.1st1K-grc1	τό τε γὰρ μιαρὸν οὐ πρόσεστι, καὶ ἡ ἀναγνώρισις ἐκπληκτικόν.	ὁ τε γάρ μιαρός οὐ πρόσειμι , καί ὁ ἀναγνώρισις ἐκπληκτικός .
707236	tlg0086.tlg034.1st1K-grc1	Κράτιστον δὲ τὸ τελευταῖον, λέγω δὲ οἷον ἐν τῷ Κρεσφόντῃ ἡ Μερόπη μέλλει τὸν υἱὸν ἀποκτείνειν, ἀποκτείνει δὲ οὒ ἀλλ᾿ ἀνεγνώρισεν, καὶ ἐν τῇ Ἰφιγενείᾳ ἡ ἀδελφὴ τὸν ἀδελφόν, καὶ ἐν τῇ Ἕλλῃ ὁ υἱὸς τὴν μητέρα ἐκδιδόναι μέλλων ἀνεγνώρισεν.	δέ ὁ  , λέγω δέ οἷος ἐν ὁ Κρεσφόντης ὁ Μερόπη μέλλω ὁ υἱός ἀποκτείνω ,  δέ οὐ  ἀναγνωρίζω , καί ἐν ὁ Ἰφιγένεια ὁ ἀδελφή ὁ ἀδελφός , καί ἐν ὁ Ἕλλη ὁ υἱός ὁ μήτηρ ἐκδίδωμι μέλλω ἀναγνωρίζω .
707237	tlg0086.tlg034.1st1K-grc1	Διὰ γὰρ τοῦτο, ὅπερ πάλαι εἴρηται, οὐ περὶ πολλὰ γένη αἱ τραγῳδίαι εἰσίν.	διά γάρ οὗτος , ὅς πάλαι λέγω , οὐ περί πολύς γένος ὁ τραγῳδία εἰμί .
707238	tlg0086.tlg034.1st1K-grc1	Ζητοῦντες γὰρ οὐκ ἀπὸ τέχνης ἀλλ᾿ ἀπὸ τύχης εὗρον τὸ τοιοῦτον παρασκευάζειν ἐν τοῖς μύθοις·	γάρ οὐ ἀπό τέχνη  ἀπό τύχη εὑρίσκω ὁ τοιοῦτος παρασκευάζω ἐν ὁ μῦθος ·
707239	tlg0086.tlg034.1st1K-grc1	ἀναγκάζονται οὖν ἐπὶ ταύτας τὰς οἰκίας ἀπαντᾶν, ὅσαις τὰ τοιαῦτα συμβέβηκε πάθη.	ἀναγκάζω οὖν ἐπί οὗτος ὁ οἰκία ἀπαντάω ,  ὁ τοιοῦτος συμβαίνω πάθος .
707240	tlg0086.tlg034.1st1K-grc1	Περὶ μὲν οὖν τῆς τῶν πραγμάτων συστάσεως, καὶ ποίους τινὰς εἶναι δεῖ τοὺς μύθους, εἴρηται ἱκανῶς.	μέν οὖν ὁ ὁ πρᾶγμα σύστασις , καί ποιός  εἰμί δέω ὁ μῦθος , λέγω ἱκανός .
707241	tlg0086.tlg034.1st1K-grc1	Περὶ δὲ τὰ ἤθη τέτταρά ἐστιν ὧν δεῖ στοχάζεσθαι, ἓν μὲν καὶ πρῶτον, ὅπως χρηστὰ ᾖ.	δέ ὁ ἦθος  εἰμί ὅς δέω στοχάζομαι ,  μέν καί πρῶτος , ὅπως χρηστός εἰμί .
707242	tlg0086.tlg034.1st1K-grc1	Ἕξει δὲ ἦθος μέν, ἐὰν ὥσπερ ἐλέχθη ποιῇ φανερὰν ὁ λόγος ἢ ἡ πρᾶξις προαίρεσίν.	δέ ἦθος μέν , ἐάν ὥσπερ λέγω ποιέω φανερός ὁ λόγος ἤ ὁ πρᾶξις  .
707243	tlg0086.tlg034.1st1K-grc1	τινα, φαῦλον μὲν ἐὰν φαύλην, χρηστὸν δ᾿ ἐὰν χρηστήν.	τις , φαῦλος μέν ἐάν  ,   ἐάν χρηστός .
707244	tlg0086.tlg034.1st1K-grc1	Ἔστι δὲ ἐν ἑκάστῳ γένει·	εἰμί δέ ἐν ἕκαστος γένος ·
707245	tlg0086.tlg034.1st1K-grc1	καὶ γὰρ γυνή ἐστι χρηστὴ καὶ δοῦλος·	καί γάρ γυνή εἰμί χρηστός καί δοῦλος ·
707246	tlg0086.tlg034.1st1K-grc1	καίτοι γε ἴσως τούτων τὸ μὲν χεῖρον, τὸ δὲ ὅλως φαῦλόν ἐστιν.	καίτοι γε ἴσος οὗτος ὁ μέν χείρων , ὁ δέ ὅλος φαῦλος εἰμί .
707247	tlg0086.tlg034.1st1K-grc1	Δεύτερον δὲ τὰ ἁρμόττοντα·	δέ ὁ ἁρμόζω ·
707248	tlg0086.tlg034.1st1K-grc1	ἔστι γὰρ ἀνδρεῖον μὲν τὸ ἦθος, ἀλλ᾿ οὐχ ἁρμόττον γυναικὶ τὸ ἀνδρείαν ἢ δεινὴν εἶναι.	εἰμί γάρ ἀνδρεῖος μέν ὁ ἦθος ,  οὐ  γυνή ὁ ἀνδρεία τίη δεινός εἰμί .
707249	tlg0086.tlg034.1st1K-grc1	Τρίτον δὲ τὸ ὅμοιον·	δέ ὁ ὅμοιος ·
707250	tlg0086.tlg034.1st1K-grc1	τοῦτο γὰρ ἕτερον τοῦ χρηστὸν τὸ ἦθος καὶ ἁρμόττον ποιῆσαι, ὥσπερ εἴρηται.	οὗτος γάρ ἕτερος ὁ χρηστός ὁ ἦθος καί  ποιέω , ὥσπερ λέγω .
707251	tlg0086.tlg034.1st1K-grc1	Τέταρτον δὲ τὸ ὁμαλόν·	τέταρτος δέ ὁ ὁμαλός ·
707252	tlg0086.tlg034.1st1K-grc1	κἂν γὰρ ἀνώμαλός τις ᾖ ὁ τὴν μίμησιν παρέχων καὶ τοιοῦτον ἦθος ὑποτιθείς, ὅμως ὁμαλῶς ἀνώμαλον δεῖ εἶναι.	ἐάν γάρ ἀνώμαλος τις εἰμί ὁ ὁ μίμησις παρέχω καί  ἦθος  , ὅμως ὁμαλός ἀνώμαλος δέω εἰμί .
707253	tlg0086.tlg034.1st1K-grc1	Ἔστι δὲ παράδειγμα πονηρίας μὲν ἤθους μὴ ἀναγκαῖον οἷον ὁ Μενέλαος ὁ ἐν τῷ Ὀρέστῃ, τοῦ δὲ ἀπρεποῦς καὶ μὴ ἁρμόττοντος ὅ τε θρῆνος Ὀδυσσέως ἐν τῇ Σκύλλῃ καὶ ἡ τῆς Μελανίππης ῥῆσις, τοῦ δὲ ἀνωμάλου ἡ ἐν Αὐλίδι Ἰφιγένεια·	εἰμί δέ παράδειγμα πονηρία μέν ἦθος μή ἀναγκαῖον οἷος ὁ Μενέλαος ὁ ἐν ὁ Ὀρέστης , ὁ δέ  καί μή ἁρμόζω ὁ τε θρῆνος Ὀδυσσεύς ἐν ὁ Σκύλλα καί ὁ ὁ Μελανίππη ῥῆσις , ὁ δέ  ὁ ἐν Αὐλίς Ἰφιγένεια ·
707254	tlg0086.tlg034.1st1K-grc1	οὐδὲν γὰρ ἔοικεν ἡ ἱκετεύουσα τῇ ὑστέρᾳ.	οὐδείς γάρ ἔοικα ὁ ἱκετεύω ὁ ὕστερος .
707255	tlg0086.tlg034.1st1K-grc1	Χρὴ δὲ καὶ ἐν τοῖς ἤθεσιν, ὥσπερ καὶ ἐν τῇ τῶν πραγμάτων συστάσει, ἀεὶ ζητεῖν ἢ τὸ ἀναγκαῖον ἢ τὸ εἰκός, ὥστε τὸν τοιοῦτον τὰ τοιαῦτα λέγειν ἢ πράττειν ἢ ἀναγκαῖον ἢ εἰκός, καὶ τοῦτο μετὰ τοῦτο γίνεσθαι ἢ ἀναγκαῖον ἢ εἰκός.	δέ καί ἐν ὁ ἦθος , ὥσπερ καί ἐν ὁ ὁ πρᾶγμα σύστασις , ἀεί ζητέω τίη ὁ ἀναγκαῖον ἤ ὁ ἔοικα , ὥστε ὁ τοιοῦτος ὁ τοιοῦτος λέγω τίη πράσσω τίη ἀναγκαῖον τίη ἔοικα , καί οὗτος μετά οὗτος γίγνομαι τίη ἀναγκαῖος ἤ ἔοικα .
707256	tlg0086.tlg034.1st1K-grc1	Φανερὸν οὖν ὅτι καὶ τὰς λύσεις τῶν μύθων ἐξ αὐτοῦ δεῖ τοῦ μύθου συμβαίνειν, καὶ μὴ ὥσπερ ἐν τῇ Μηδείᾳ ἀπὸ μηχανῆς καὶ ἐν τῇ Ἰλιάδι τὰ περὶ τὸν ἀπόπλουν·	οὖν ὅτι2 καί ὁ λύσις ὁ μῦθος ἐκ αὐτός δέω ὁ μῦθος συμβαίνω , καί μή ὥσπερ ἐν ὁ Μήδεια ἀπό μηχανή καί ἐν ὁ Ἰλιάς ὁ περί ὁ ἀπόπλοος ·
707257	tlg0086.tlg034.1st1K-grc1	ἀλλὰ μηχανῇ χρηστέον ἐπὶ τὰ ἔξω τοῦ δράματος ἢ ὅσα πρὸ τοῦ γέγονεν, ἃ οὐχ οἷόν τε ἄνθρωπον εἰδέναι, ἢ ὅσα ὕστερον, ἃ δεῖται προαγορεύσεως καὶ ἀγγελίας·	ἀλλά  χράομαι ἐπί ὁ ἔξω ὁ δρᾶμα ἤ ὅσος πρό ὁ γίγνομαι , ὅς οὐ  τε ἄνθρωπος οἶδα , ἤ ὅσος ὕστερον , ὅς δέω προαγόρευσις καί ἀγγελία ·
707258	tlg0086.tlg034.1st1K-grc1	ἅπαντα γὰρ ἀποδίδομεν τοῖς θεοῖς ὁρᾶν.	ἅπας γάρ  ὁ θεός ὁράω .
707259	tlg0086.tlg034.1st1K-grc1	Ἄλογον δὲ μηδὲν εἶναι ἐν τοῖς πράγμασιν, εἰ δὲ μή, ἔξω τῆς τραγῳδίας, οἷον τὰ ἐν τῷ Οἰδίποδι τῷ Σοφοκλέους.	δέ  εἰμί ἐν ὁ πρᾶγμα , εἰ δέ μή , ἔξω ὁ τραγῳδία , οἷος ὁ ἐν ὁ Οἰδίπους ὁ Σοφοκλέης .
707260	tlg0086.tlg034.1st1K-grc1	Ἐπεὶ δὲ μίμησίς ἐστιν ἡ τραγῳδία βελτιόνων, ἡμᾶς δεῖ μιμεῖσθαι τοὺς ἀγαθοὺς εἰκονογράφους·	δέ μίμησις εἰμί ὁ τραγῳδία  , ἐγώ δέω μιμέομαι ὁ ἀγαθός εἰκονογράφος ·
707261	tlg0086.tlg034.1st1K-grc1	καὶ γὰρ ἐκεῖνοι ἀποδιδόντες τὴν ἰδίαν μορφήν, ὁμοίους ποιοῦντες, καλλίους γράφουσιν.	καί γάρ ἐκεῖνος  ὁ ἴδιος μορφή , ὅμοιος ποιέω , καλλίων γράφω .
707262	tlg0086.tlg034.1st1K-grc1	Οὕτω καὶ τὸν ποιητὴν μιμούμενον καὶ ὀργίλους καὶ ῥᾳθύμους καὶ τἆλλα τὰ τοιαῦτα ἔχοντας ἐπὶ τῶν ἠθῶν, ἐπιεικείας ποιεῖν παράδειγμα ἢ σκληρότητος δεῖ, οἷον τὸν Ἀχιλλέα Ἀγάθων καὶ Ὅμηρος.	οὕτως καί ὁ ποιητής  καί  καί  καί ἄλλος ὁ τοιοῦτος ἔχω ἐπί ὁ  , ἐπιείκεια ποιέω παράδειγμα τίη σκληρότης δέω , οἷος ὁ Ἀχιλλεύς Ἀγάθων καί Ὅμηρος .
707263	tlg0086.tlg034.1st1K-grc1	Ταῦτα δὴ δεῖ διατηρεῖν, καὶ πρὸς τούτοις τὰ παρὰ τὰς ἐξ ἀνάγκης ἀκολουθούσας αἰσθήσεις τῇ ποιητικῇ·	δή δέω διατηρέω , καί πρός οὗτος ὁ παρά ὁ ἐκ ἀνάγκη ἀκολουθέω  ὁ ποιητικός ·
707264	tlg0086.tlg034.1st1K-grc1	καὶ γὰρ κατ’ αὐτὰς ἔστιν ἁμαρτάνειν πολλάκις.	καί γάρ κατά αὐτός εἰμί ἁμαρτάνω πολλάκις .
707265	tlg0086.tlg034.1st1K-grc1	Εἴρηται δὲ περὶ αὐτῶν ἐν τοῖς ἐκδεδομένοις λόγοις ἱκανῶς.	δέ περί αὐτός ἐν ὁ  λόγος ἱκανός .
707266	tlg0086.tlg034.1st1K-grc1	Ἀναγνώρισις δὲ τί μέν ἐστιν, εἴρηται πρότερον·	δέ τι μέν εἰμί , λέγω πρότερος ·
707267	tlg0086.tlg034.1st1K-grc1	εἴδη δὲ ἀναγνωρίσεως, πρώτη μὲν ἡ ἀτεχνοτάτη, καὶ ᾗ πλεῖστοι χρῶνται δι’ ἀπορίαν, ἡ διὰ τῶν σημείων.	εἶδος δέ ἀναγνώρισις , πρῶτος μέν ὁ  , καί ὅς πλεῖστος χράω2 διά ἀπορία , ὁ διά ὁ σημεῖον .
707268	tlg0086.tlg034.1st1K-grc1	Τούτων δὲ τὰ μὲν σύμφυτα, οἷον λόγχην ἣν φοροῦσι Γηγενεῖς ἢ ἀστέρας οἵους ἐν τῷ Θυέστῃ Καρκίνος, τὰ δὲ ἐπίκτητα, καὶ τούτων τὰ μὲν ἐν τῷ σώματι, οἷον οὐλαί, τὰ δὲ ἐκτός, τὰ περιδέραια, καὶ οἷον ἐν τῇ Τυροῖ διὰ τῆς σκάφης.	οὗτος δέ ὁ μέν  , οἷος λόγχη ὅς φορέω  τίη ἀστήρ οἷος ἐν ὁ Θυέστης  , ὁ δέ  , καί οὗτος ὁ μέν ἐν ὁ σῶμα , οἷος οὐλαί , ὁ δέ ἐκτός , ὁ περιδέραιος , καί οἷος ἐν ὁ Τυρώ διά ὁ σκάφη .
707269	tlg0086.tlg034.1st1K-grc1	Ἔστι δὲ καὶ τούτοις χρῆσθαι ἢ βέλτιον ἢ χεῖρον, οἷον Ὀδυσσεὺς διὰ τῆς οὐλῆς ἄλλως ἀνεγνωρίσθη ὑπὸ τῆς τροφοῦ καὶ ἄλλως ὑπὸ τῶν συβοτῶν·	εἰμί δέ καί οὗτος χράω2 τίη βελτίων τίη χείρων , οἷος Ὀδυσσεύς διά ὁ οὐλή ἄλλος ἀναγνωρίζω ὑπό ὁ τροφός καί ἄλλος ὑπό ὁ συβότης ·
707270	tlg0086.tlg034.1st1K-grc1	εἰσὶ γὰρ αἱ μὲν πίστεως ἕνεκα ἀτεχνότεραι, καὶ αἱ τοιαῦται πᾶσαι, αἱ δὲ ἐκ περιπετείας, ὥσπερ ἡ ἐν τοῖς Νίπτροις, βελτίους.	εἰμί γάρ  μέν πίστις ἕνεκα  , καί ὁ τοιοῦτος πᾶς , ὁ δέ ἐκ περιπέτεια , ὥσπερ ὁ ἐν ὁ  , βελτίων .
707271	tlg0086.tlg034.1st1K-grc1	Δεύτεραι δὲ αἱ πεποιημέναι ὑπὸ τοῦ ποιητοῦ, διὸ ἄτεχνοι·	δέ ὁ ποιέω ὑπό ὁ ποιητής , διό ἄτεχνος ·
707272	tlg0086.tlg034.1st1K-grc1	οἷον Ὀρέστης ἐν τῇ Ἰφιγενείᾳ ἀνεγνώρισε τὴν ἀδελφήν, ἀναγνωρισθεὶς ὑπ’ ἐκείνης·	οἷος Ὀρέστης ἐν ὁ Ἰφιγένεια ἀναγνωρίζω ὁ ἀδελφή , ἀναγνωρίζω ὑπό ἐκεῖνος ·
707273	tlg0086.tlg034.1st1K-grc1	ἐκείνη μὲν γὰρ διὰ τῆς ἐπιστολῆς, ἐκεῖνος δὲ διὰ σημείων.	ἐκεῖνος μέν γάρ διά ὁ ἐπιστολή , ἐκεῖνος δέ διά σημεῖον .
707274	tlg0086.tlg034.1st1K-grc1	Ταῦτα οὖν αὐτὸς λέγει ἃ βούλεται ὁ ποιητής, ἀλλ᾿ οὐχ ὁ μῦθος.	οὗτος οὖν αὐτός λέγω ὅς βούλομαι ὁ ποιητής ,  οὐ ὁ μῦθος .
707275	tlg0086.tlg034.1st1K-grc1	Διὸ ἐγγὺς τῆς εἰρημένης ἁμαρτίας ἐστίν·	ἐγγύς ὁ λέγω ἁμαρτία εἰμί ·
707276	tlg0086.tlg034.1st1K-grc1	ἐξῆν γὰρ ἂν ἔνια καὶ ἐνεγκεῖν.	ἔξεστι γάρ ἄν ἔνιοι καί φέρω .
707277	tlg0086.tlg034.1st1K-grc1	Καὶ ἐν τῷ Σοφοκλέους Τηρεῖ ἡ τῆς κερκίδος φωνή.	καί ἐν τῷ Σοφοκλέης Τηρεύς ὁ ὁ κερκίς φωνή .
707278	tlg0086.tlg034.1st1K-grc1	Τρίτη δὲ ἡ διὰ μνήμης, τῷ αἰσθέσθαι τι ἰδόντα, ὥσπερ ἡ ἐν Κυπρίοις τοῖς Δικαιογένους, ἰδὼν γὰρ τὴν γραφὴν ἔκλαυσεν, καὶ ἡ ἐν Ἀλκίνου ἀπολόγῳ, ἀκούων γὰρ τοῦ κιθαριστοῦ καὶ μνησθεὶς ἐδάκρυσεν·	δέ ὁ διά μνήμη , τῷ αἰσθάνομαι τι ὁράω , ὥσπερ ὁ ἐν  ὁ Δικαιογένης , ὁράω γάρ ὁ γραφή κλαίω , καί ὁ ἐν Ἀλκίνοος ἀπόλογος , ἀκούω γάρ ὁ κιθαριστής καί μιμνήσκω δακρύω ·
707279	tlg0086.tlg034.1st1K-grc1	ὅθεν ἀνεγνωρίσθησαν.	ὅθεν ἀναγνωρίζω .
707280	tlg0086.tlg034.1st1K-grc1	Τετάρτη δὲ ἡ ἐκ συλλογισμοῦ, οἷον ἐν Χοηφόροις, ὅτι ὅμοιός τις ἐλήλυθεν, ὅμοιος δὲ οὐθεὶς ἀλλ᾿ ἢ Ὀρέστης·	δέ ὁ ἐκ συλλογισμός , οἷος ἐν  , ὅτι2  τις  , ὅμοιος δέ   ἤ Ὀρέστης ·
707281	tlg0086.tlg034.1st1K-grc1	οὗτος ἄρα ἐλήλυθεν.	οὗτος ἄρα  .
707282	tlg0086.tlg034.1st1K-grc1	Καὶ ἡ Πολυείδου τοῦ σοφιστοῦ περὶ τῆς Ἰφιγενείας·	καί ὁ  ὁ σοφιστής περί ὁ Ἰφιγένεια ·
707283	tlg0086.tlg034.1st1K-grc1	εἰκὸς γὰρ τὸν Ὀρέστην συλλογίσασθαι ὅτι ἥ τ᾿ ἀδελφὴ ἐτύθη καὶ αὐτῷ συμβαίνει θύεσθαι.	ἔοικα γάρ ὁ Ὀρέστης συλλογίζομαι ὅτι2 ὁ  ἀδελφή θύω καί αὐτός συμβαίνω θύω .
707284	tlg0086.tlg034.1st1K-grc1	Καὶ ἡ ἐν τῷ τοῦ θεοδέκτου Τυδεῖ, ὅτι ἐλθὼν ὡς εὑρήσων υἱὸν αὐτὸς ἀπόλλυται.	καί ὁ ἐν τῷ ὁ  Τυδεύς , ὅτι2 ἔρχομαι ὡς εὑρίσκω υἱός αὐτός ἀπόλλυμι .
707285	tlg0086.tlg034.1st1K-grc1	Καὶ ἡ ἐν τοῖς Φινείδαις·	καί ὁ ἐν ὁ Φινείδης ·
707286	tlg0086.tlg034.1st1K-grc1	ἰδοῦσαι γὰρ τὸν τόπον συνελογίσαντο τὴν εἱμαρμένην, ὅτι ἐν τούτῳ εἵμαρτο ἀποθανεῖν αὐταῖς·	γάρ ὁ τόπος συλλογίζομαι ὁ  , ὅτι2 ἐν οὗτος μείρομαι ἀποθνῄσκω αὐτός ·
707287	tlg0086.tlg034.1st1K-grc1	καὶ γὰρ ἐξετέθησαν ἐνταῦθα.	καί γάρ ἐκτίθημι ἐνταῦθα .
707288	tlg0086.tlg034.1st1K-grc1	Ἔστι δέ τις καὶ συνθετὴ ἐκ παραλογισμοῦ τοῦ θεάτρου, οἷον ἐν τῷ Ὀδυσσεῖ τῷ ψευδαγγέλῳ·	εἰμί δέ τις καί  ἐκ παραλογισμός ὁ  , οἷος ἐν ὁ Ὀδυσσεύς ὁ ψευδάγγελος ·
707289	tlg0086.tlg034.1st1K-grc1	τὸ μὲν γὰρ τόξον ἔφη γνώσεσθαι ὃ οὐχ ἑωράκει, ὁ δέ, ὡς δι’ ἐκείνου ἀναγνωριοῦντος, διὰ τούτου ἐποίησε παραλογισμόν.	ὁ μέν γάρ τόξον φημί γιγνώσκω ὅς οὐ ὁράω , ὁ δέ , ὡς διά ἐκεῖνος  , διά οὗτος ποιέω παραλογισμός .
707290	tlg0086.tlg034.1st1K-grc1	Πασῶν δὲ βελτίστη ἀναγνώρισις ἡ ἐξ αὐτῶν τῶν πραγμάτων, τῆς ἐκπλήξεως γιγνομένης δι’ εἰκότων, οἷον ἡ ἐν τῷ Σοφοκλέους Οἰδίποδι καὶ τῇ Ἰφιγενείᾳ·	δέ βέλτιστος ἀναγνώρισις ὁ ἐκ αὐτός ὁ πρᾶγμα , ὁ ἔκπληξις  διά ἔοικα , οἷος ὁ ἐν τῷ Σοφοκλέης Οἰδίπους καί ὁ Ἰφιγένεια ·
707291	tlg0086.tlg034.1st1K-grc1	εἰκὸς γὰρ βούλεσθαι ἐπιθεῖναι γράμματα.	ἔοικα γάρ βούλομαι ἐπιτίθημι γράμμα .
707292	tlg0086.tlg034.1st1K-grc1	Αἱ γὰρ τοιαῦται μόναι ἄνευ τῶν πεποιημένων σημείων καὶ περιδεραίων.	ὁ γάρ τοιοῦτος μόνος ἄνευ ὁ  σημεῖον καί περιδέραιος .
707293	tlg0086.tlg034.1st1K-grc1	Δεύτεραι δὲ αἱ ἐκ συλλογισμοῦ.	δέ ὁ ἐκ συλλογισμός .
707294	tlg0086.tlg034.1st1K-grc1	Δεῖ δὲ τοὺς μύθους συνιστάναι καὶ τῇ λέξει συναπεργάζεσθαι ὅτι μάλιστα πρὸ ὀμμάτων τιθέμενον·	δεῖ δέ ὁ μῦθος  καί ὁ λέξις συναπεργάζομαι ὅτι2 μάλιστα πρό ὄμμα τίθημι ·
707295	tlg0086.tlg034.1st1K-grc1	οὕτω γὰρ ἂν ἐναργέστατα ὁρῶν, ὥσπερ παρ’ αὐτοῖς γιγνόμενος τοῖς πραττομένοις, εὑρίσκοι τὸ πρέπον, καὶ ἥκιστ᾿ ἂν λανθάνοιτο τὰ ὑπεναντία.	οὕτως γάρ ἄν ἐναργής ὁράω , ὥσπερ παρά αὐτός  ὁ πράσσω ,  ὁ  , καί  ἄν  ὁ ὑπεναντίος .
707296	tlg0086.tlg034.1st1K-grc1	Σημεῖον δὲ τούτου ὃ ἐπετιμᾶτο Καρκίνῳ·	σημεῖον δέ οὗτος ὁ ἐπιτιμάω Καρκίνος ·
707297	tlg0086.tlg034.1st1K-grc1	ὁ γὰρ Ἀμφιάραος ἐξ ἱεροῦ ἀνῄει, ὃ μὴ ὁρῶντα τὸν θεατὴν ἐλάνθανεν, ἐπὶ δὲ τῆς σκηνῆς ἐξέπεσε, δυσχερανάντων τοῦτο τῶν θεατῶν.	ὁ γάρ Ἀμφιάραος ἐκ ἱερόν ἄνειμι ,  μή ὁράω ὁ θεατής λανθάνω , ἐπί δέ ὁ σκηνή ἐκπίπτω , δυσχεραίνω οὗτος ὁ θεατής .
707298	tlg0086.tlg034.1st1K-grc1	Ὅσα δὲ δυνατόν, καὶ τοῖς σχήμασι συναπεργαζόμενον.	δέ δυνατός , καί ὁ σχῆμα  .
707299	tlg0086.tlg034.1st1K-grc1	Πιθανώτατοι γὰρ ἀπὸ τῆς αὐτῆς φύσεως οἱ ἐν τοῖς πάθεσίν εἰσι, καὶ χειμαίνει ὁ χειμαζόμενος καὶ χαλεπαίνει ὁ ὀργιζόμενος ἀληθινώτατα.	γάρ ἀπό ὁ αὐτός φύσις ὁ ἐν ὁ πάθος εἰμί , καί χειμαίνω ὁ χειμάζω καί χαλεπαίνω ὁ ὀργίζω  .
707300	tlg0086.tlg034.1st1K-grc1	Διὸ εὐφυοῦς ἡ ποιητική ἐστιν ἢ μανικοῦ·	ὁ ποιητικός εἰμί ἤ μανικός ·
707301	tlg0086.tlg034.1st1K-grc1	τούτων γὰρ οἱ μὲν εὔπλαστοι οἱ δὲ ἐξεταστικοί εἰσιν.	οὗτος γάρ ὁ μέν εὔπλαστος ὁ δέ  εἰμί .
707302	tlg0086.tlg034.1st1K-grc1	Τούς τε λόγους τοὺς πεποιημένους δεῖ καὶ αὐτὸν ποιοῦντα ἐκτίθεσθαι καθόλου, εἶθ᾿ οὕτως ἐπεισοδιοῦν καὶ παρατείνειν.	τε λόγος ὁ  δέω καί αὐτός ποιέω ἐκτίθημι καθόλου ,  οὕτως ἐπεισοδιόω καί παρατείνω .
707303	tlg0086.tlg034.1st1K-grc1	Λέγω δὲ οὕτως ἂν θεωρεῖσθαι τὸ καθόλου, οἷον τῆς Ἰφιγενείας.	λέγω δέ οὕτως ἄν θεωρέω ὁ καθόλου , οἷος ὁ Ἰφιγένεια .
707304	tlg0086.tlg034.1st1K-grc1	Τυθείσης τινὸς κόρης καὶ ἀφανισθείσης ἀδήλως τοῖς θύσασιν, ἱδρυνθείσης δὲ εἰς ἄλλην χώραν, ἐν ᾗ νόμος ἦν τοὺς ξένους θύειν τῇ θεῷ, ταύτην ἔσχε τὴν ἱερωσύνην.	κόρη καί ἀφανίζω ἄδηλος ὁ  , ἱδρύω δέ εἰς ἄλλος χώρα , ἐν ὅς νόμος εἰμί ὁ ξένος θύω ὁ θεός , οὗτος ἔχω ὁ ἱερωσύνη .
707305	tlg0086.tlg034.1st1K-grc1	Χρόνῳ δ᾿ ὕστερον τῷ ἀδελφῷ συνέβη ἐλθεῖν τῆς ἱερείας.	ὕστερον τῷ ἀδελφός συμβαίνω ἔρχομαι ὁ ἱέρεια .
707306	tlg0086.tlg034.1st1K-grc1	Τὸ δὲ ὅτι ἀνεῖλεν ὁ θεὸς διά τιν᾿ αἰτίαν ἔξω τοῦ καθόλου ἐλθεῖν ἐκεῖ, καὶ ἐφ’ ὅ τι δέ, ἔξω τοῦ μύθου.	δέ ὅτι2 ἀναιρέω ὁ  διά  αἰτία ἔξω ὁ καθόλου ἔρχομαι ἐκεῖ , καί ἐπί ὅς  δέ , ἔξω ὁ μῦθος .
