id	filename	tokens	lemmas
799542	tlg0082.tlg004.1st1K-grc1	τὴν μέντοι τῶν τοιούτων γενι- κῶν εὐθεῖαν οὐκ ἔϲτιν εὑρεῖν οὔτε ἐν λόγῳ οὔτε ἐν χρήϲει δυναμένην ϲυνίϲταϲθαι, οὐ καθάπερ ἄλλα ἀτριβῆ ϲχήματα( ἐν ἀγνοίᾳ γὰρ τοῦ λόγου τινὲϲ γενόμενοι ὡϲ ἀτριβεῖϲ τὰϲ τοιαύταϲ εὐθείαϲ παραδέξονται), οὐδὲ μὴν ἐν ϲυντάξει τῇ κατ’ εὐθεῖαν, εἴγε οὐ ῥητὸν τὸ ἐμαυτόϲ ἢ ϲαυτόϲ, ἀλλ’ οὐδὲ ἡ τοιαύτη ϲύνταξιϲ, ἐμαυτοῦ δοῦλοϲ ἔτυψεν, ἢ ἐμαυτοῦ δοῦλοϲ ἔτυψα, τῆϲ ἀϲυνθέτου γενικῆϲ τὴν ϲύνταξιν τῆϲ εὐθείαϲ παραδεχομένηϲ ὁμοίωϲ ἁπάϲαιϲ γενικαῖϲ, ὡϲ ἐν τῷ ὁ δοῦλόϲ μου ἔτυψεν.	ὁ  ὁ τοιοῦτος  -  εὐθύς οὐ  εὑρίσκω οὔτε ἐν λόγος οὔτε ἐν    , οὐ καθά ἄλλος ἀτριβής  ( ἐν ἄγνοια γάρ ὁ λόγος  γίγνομαι       ) , οὐδέ μήν ἐν  ὁ κατά εὐθύς , εἰ οὐ ῥητός ὁ  ἤ  , ἀλλά οὐδέ ὁ τοιοῦτος  , ἐμαυτοῦ  τύφω , ἤ ἐμαυτοῦ  τύπτω ,    ὁ        ,  ἐν τῷ ὁ   τύφω .
799543	tlg0082.tlg004.1st1K-grc1	καὶ ϲυμφανὲϲ ὅτι οὐχ ἡ πτῶϲίϲ ἐϲτιν ἡ ἀπαράδεκτοϲ, τὸ δὲ ἐν αὐτῇ γενόμενον ϲχῆμα ϲύνθετον, ὅπερ ἐπενοήθη εἰϲ διάκριϲιντῆϲ ἐκ προϲώπου γενομένηϲ διαθέϲεωϲ εἰϲ τὸ αὐτὸ πρόϲωπον.	καί  ὅτι2 οὐ ὁ   ὁ  , ὁ δέ ἐν αὐτός γίγνομαι   , ὅς ἐπινοέω   τῆϲ ἐκ     ὁ αὐτός  .
799544	tlg0082.tlg004.1st1K-grc1	ὁ γὰρ οὕτω λέγων, ἐμαυτὸν ἔτυψα, διάθεϲιν ὁμολογεῖ τὴν ἐξ αὑτοῦ γενομένην εἰϲ αὑτόν, ὡϲ εἰ καὶ ἔλεγεν οὕτωϲ, ἐγὼ ἐμὲ αὐτὸν ἔτυψα.	ὁ γάρ οὕτως λέγω , ἐμαυτοῦ τύπτω ,  ὁμολογέω ὁ ἐκ ἑαυτοῦ γίγνομαι  ἑαυτοῦ ,  εἰ καί λέγω  ,   αὐτός τύπτω .
799545	tlg0082.tlg004.1st1K-grc1	τοῦ οὖν ῥήματοϲ ϲυνόντοϲ τῇ πλαγίᾳ πτώϲει κατὰ τὸ αὐτὸ ἀνέφικτον ἦν τι ἕτερον πρόϲωπον ἐν εὐθείᾳ πτώϲει ἐπινοῆϲαι, οὐ λέγω κατ’ αἰτιατικὴν ἢ δοτικήν·	ὁ οὖν   ὁ   κατά ὁ αὐτός ἀνέφικτος εἰμί τις ἕτερος  ἐν εὐθεῖα   , οὐ λέγω κατά  τίη δοτικός ·
799546	tlg0082.tlg004.1st1K-grc1	οὐδὲ γὰρ αὗταί τι ἔξωθεν πρόϲωπον ἐπιζητοῦϲιν·	οὐδέ γάρ  τις ἔξωθεν   ·
799547	tlg0082.tlg004.1st1K-grc1	ἡ μέντοι ἐπὶ κτῆμα φερομένη γενική, πρόϲωπον ἔχουϲα τοῦ κτήτοροϲ, ἐπιζητοῦϲα δὲ τὸ τοῦ κτήματοϲ, ἀπαράδεκτοϲ ἐγίνετο εἰϲ τὸ ἐπιδέξαϲθαι τὴν τούτου ὀνομαϲτικήν, καθὸ ἔμελλεν ἡ ἐκ τοῦ κτήματοϲ εὐθεῖα ἀνθέλκειν εἰϲ αὑτὴν τὸ ῥῆμα, ὥϲ γε καὶ ἐπὶ τῶν ἄλλων ϲυντάξεων προφανέϲ ἐϲτιν, Ἀριϲτάρχου γνώριμοϲ ἀνέγνω, φίλοϲ μου διαλέγεται.	ὁ  ἐπί κτῆμα φέρω  ,   ὁ  ,  δέ ὁ ὁ  ,  γίγνομαι  ὁ  ὁ οὗτος  , καθό μέλλω ὁ ἐκ ὁ  εὐθύς ἀνθέλκω   ὁ ῥῆμα ,  γε καί ἐπί ὁ ἄλλος    ,   ἀναγιγνώσκω ,   διαλέγω .
799548	tlg0082.tlg004.1st1K-grc1	οὐ δὴ οὖν ἐδύνατο τὸ μεταξὺ πῖπτον ῥῆμα ἐπαρκέϲαι ἀμφοτέροιϲ τοῖϲ προϲώποιϲ, διαφόροιϲ οὖϲιν, εἴγε δὴ τὸ ἐμαυτοῦ ἐϲτιν πρώτου προϲώπου, ᾧ δὴ πάντωϲ ὀφείλει ϲυντετάχθαι τοῦ αὐτοῦ προϲώπου ῥῆμα, ἐμαυτοῦ ἔτυψα παῖδα.	οὐ δή οὖν δύναμαι ὁ μεταξύ  ῥῆμα     ,   , εἰ δή ὁ ἐμαυτοῦ  πρῶτος  , ὅς δή    ὁ αὐτός  ῥῆμα , ἐμαυτοῦ τύπτω παῖς .
799549	tlg0082.tlg004.1st1K-grc1	ἀλλ’ εἰ καὶ ἡ ϲυνταϲϲομένη αἰτιατικὴ μετέλθοι εἰϲ εὐθεῖαν, οὐκ ἄλλο τι προϲλήψεται ῥῆμα ἢ τὸ τοῦ τρίτου προϲώπου, παῖϲ ἔτυψε.	ἀλλά εἰ καί ὁ   μετέρχομαι  εὐθύς , οὐ ἄλλος τις  ῥῆμα ἤ ὁ ὁ τρίτος  ,  τύφω .
799550	tlg0082.tlg004.1st1K-grc1	καὶ ἔνθεν οὔτε τὸ ἐμαυτοῦ ἔτυψα παῖϲ ϲυϲτατόν, οὔτε μὴν τὸ παῖϲ ἔτυψεν ἐμαυτοῦ ἢ ἐμαυτόν.	καί ἔνθεν οὔτε ὁ ἐμαυτοῦ τύπτω   , οὔτε μήν ὁ  τύφω ἐμαυτοῦ ἤ ἐμαυτοῦ .
799551	tlg0082.tlg004.1st1K-grc1	ὅτι δὲ τὸ διάφορον πρόϲωπον αἴτιόν ἔϲτι τοῦ ἀκαταλλήλου, ϲαφὲϲ ἂν γένοιτο, εἰ ἡ ἐν τρίτῳ νοουμένη εὐθεῖα κατὰ τὴν ὑπαρκτικὴν ϲύνταξιν τῶν ῥημάτων ἐπινοηθείη καὶ ἐν πρώτῳ προϲώπῳ, εἰμὶ δοῦλοϲ·	ὅτι2 δέ ὁ διάφορος  αἴτιος  ὁ ἀκατάλληλος ,  ἄν γίγνομαι , εἰ ὁ ἐν τρίτος  εὐθύς κατά ὁ   ὁ ῥῆμα ἐπινοέω καί ἐν πρῶτος  , εἰμί  ·
799552	tlg0082.tlg004.1st1K-grc1	ἐφ’ οὗ εἰ καὶ προϲθείημεν τὸ ἐμαυτοῦ, κατάλληλα ἂν γένοιτο τὰ τοῦ λόγου, καθὸ τὸ ῥῆμα οὐκέτι ἀνθέλκεται ὑπὸ διαφόρων προϲώπων.	ἐπί οὗ εἰ καί  ὁ ἐμαυτοῦ ,  ἐάν γίγνομαι ὁ ὁ λόγος ,  ὁ ῥῆμα οὐκέτι ἀνθέλκω ὑπό διάφορος  .
799553	tlg0082.tlg004.1st1K-grc1	καὶ ἔτι ἐπὶ δευτέρου, ϲαυτοῦ εἶ ὑπηρέτηϲ, καὶ ἐπὶ τρίτου, ἑαυτοῦ ἐϲτιν ἐπίβολοϲ.	καί ἔτι ἐπί  ,  εἶμι  , καί ἐπί  , ἑαυτοῦ   .
799554	tlg0082.tlg004.1st1K-grc1	ἐφ’ ἧϲ ϲυντάξεωϲ εἴ τιϲ πάλιν παραλάβοι τὰϲ ἁπλᾶϲ ἀντωνυμίαϲ, προϲχωρήϲει ἡ εὐθεῖα ἐν προϲώπῳ νοουμένη μετὰ τοῦ ϲυνόντοϲ ῥήματοϲ, ἐπίβολοϲ αὐτοῦ ἐϲτι, δοῦλόϲ μου εἰ.	ἐπί   εἰ  πάλιν παραλαμβάνω    ,  ὁ εὐθύς ἐν   μετά ὁ   ,  αὐτός  ,   εἰ .
799555	tlg0082.tlg004.1st1K-grc1	Καὶ τοϲαῦτα μὲν περὶ τῆϲ ϲυντάξεωϲ.	καί  μέν περί   .
799556	tlg0082.tlg004.1st1K-grc1	Περὶ δὲ τῆϲ ἀνυποϲτάτου εὐθείαϲ ἡ ἀπόδειξιϲ πάλιν ἂν γένοιτο τῇδε.	δέ    ὁ  πάλιν ἄν γίγνομαι ὅδε .
799557	tlg0082.tlg004.1st1K-grc1	Ἔφαμεν ἐν τοῖϲ προκειμένοιϲ τὰϲ μὲν πλαγίαϲ πτώϲειϲ ἀναφέρεϲθαι ἐπ’ εὐθείαϲ τῶν μεταξὺ ῥημάτων τὴν μὲν ἐνέργειανταῖϲ εὐθείαιϲ ἀναπεμπόντων, τὸ δὲ πάθοϲ ταῖϲ πλαγίαιϲ, ὡϲ Διονύϲιοϲ ἔτυψεν Θέωνα, ἐγώ ϲε ἐτίμηϲα.	ἐν    μέν    ἐπί  ὁ  ῥῆμα ὁ μέν ἐνέργεια ταῖϲ   , ὁ δέ    ,   τύφω  ,    .
799558	tlg0082.tlg004.1st1K-grc1	( τὸ δὲ πάθοϲ ἐγγενόμενον κατὰ τὰϲ πλαγίαϲ μεθίϲτηϲιν αὐτὰϲ εἰϲ εὐθεῖαν, τῆϲ προκατειλεγμένηϲ εὐθείαϲ τρεπομένηϲ εἰϲ γενικὴν μετὰτῆϲ ὑπό προθέϲεωϲ, ἐγώ ϲε ἔδειρα, ϲὺ ἐδάρηϲ ὑπ’ ἐμοῦ.	( ὁ δέ   κατά      εὐθύς ,       μετά τῆϲ ὑπό  ,   δέρω ,   ὑπό ἐμός .
799559	tlg0082.tlg004.1st1K-grc1	) ἦν μέντοι καὶ τοῦτο ὁμόλογον, τό τινα διάθεϲιν ἐμποιῆϲαι οὐ μόνον εἰϲ ἕτερον πρόϲωπον ἀλλὰ καὶ εἰϲ τὸ ἑαυτοῦ.	) εἰμί  καί οὗτος ὁμόλογος , ὁ τις   οὐ μόνος  ἕτερος  ἀλλά καί  ὁ ἑαυτοῦ .
799560	tlg0082.tlg004.1st1K-grc1	ἐξ ἧϲ ϲυντάξεωϲ ἐπενοεῖτο τὸ διϲϲὸν ϲχῆμα τῆϲ ἀντωνυμίαϲ, λέγω τὸ ἁπλοῦν, ὅπερ ἐϲτὶν ἐν μεταβάϲει ἑτέρου προϲώπου, καὶ τὸ ϲύνθετον, ὅπερ τὴν ἐκ τοῦ αὐτοῦ προϲώπου διάθεϲιν ὑποϲτρέφουϲαν εἶχεν εἰϲ ταὐτό, τὸ διατεθὲν καὶ διατιθὲν πρόϲωπον( ἔνθεν καὶ ἀντανακλώμενον ἐκλήθη, ἀπὸ μεταφορᾶϲ τῶν εἰϲ αὑτὰ ἀντανακλωμένων ϲωμάτων, ἢ αὐτοπαθέϲ·	ἐκ   ἐπινοέω ὁ     , λέγω ὁ ἁπλόος , ὅς  ἐν  ἕτερος  , καί ὁ  , ὅς ὁ ἐκ ὁ αὐτός    ἔχω  αὐτός , ὁ  καί   ( ἔνθεν καί  καλέω , ἀπό  ὁ  ἑαυτοῦ   , τίη  ·
799561	tlg0082.tlg004.1st1K-grc1	τὰ γὰρ ἁπλᾶ τῶν προϲώπων ἐδείχθη ἀλλοπαθῆ, τουτέϲτιν ὑπὸ ἄλλου προϲώπου διατιθέμενα), πάνυ καὶ τῶν φωνῶν ϲυνῳκειωμένων τῇ τοῦ ϲυμφραζομένου ἑνώϲει·	ὁ γάρ  ὁ  δείκνυμι  ,  ὑπό ἄλλος  διατίθημι ) , πάνυ καί ὁ   ὁ ὁ   ·
799562	tlg0082.tlg004.1st1K-grc1	ἐπεὶ γὰρ ἓν πρόϲωπον τὸ διατιθὲν καὶ τὸ διατιθέμενον, μία καὶ ἡ φωνὴ κατὰ ϲύνθεϲιν ἐγένετο, ἐμαυτὸν ἔπαιϲα, ὑπ’ ἐμαυτοῦ ἐπλήγην.	ἐπεί γάρ   ὁ  καί ὁ διατίθημι ,  καί ὁ φωνή κατά  γίγνομαι , ἐμαυτοῦ  , ὑπό ἐμαυτοῦ  .
799563	tlg0082.tlg004.1st1K-grc1	« Εἴπερ οὖν αἱ πλάγιοι ἐπιζητοῦϲιν εὐθείαϲ, ἵν᾿  ἡ διάθεϲιϲ προφανὴϲ γένηται ἡ ἔκ τινοϲ γινομένη», πῶϲ ἡ ϲαυτοῦ γενήϲεται ϲαυτόϲ;	«  οὖν ὁ πλάγιος   ,  ὁ   γίγνομαι ὁ ἐκ   » ,  ὁ    ;
799564	tlg0082.tlg004.1st1K-grc1	γενομένη γὰρ πλαγίαν ἐπιζητήϲει ἐφ’ ἣν τὰ τῆϲ ϲυντάξεωϲ ἐρείϲειεν φήϲει τιϲ,« πῶϲ δὴ πλαγία οὖϲα ἐν τῇ ϲαυτόν οὐκ ἐπιζητήϲει εὐθεῖαν ἐξ ἧϲ ἡ διάθεϲιϲ»;	γίγνομαι γάρ   ἐπί ὅς ὁ      , «  δή πλάγιος  ἐν ὁ  οὐ  εὐθύς ἐκ  ὁ  » ;
799565	tlg0082.tlg004.1st1K-grc1	πρὸϲ ὃν φαίημεν ὡϲ ἔνεϲτιν ἡ εὐθεῖα διὰ τοῦ ῥήματοϲ, ϲαυτὸν ἔπαιϲαϲ, τουτέϲτιν ϲύ.	ὅς    ὁ εὐθύς διά ὁ  ,   ,   .
799566	tlg0082.tlg004.1st1K-grc1	γενομένη γὰρ ἐν τῷ ϲαυτὸϲ ἔπαιϲαϲ δύο ϲυνέξει εὐθείαϲ, τήν τε ἐκ τῆϲ ἀντωνυμίαϲ καὶ τὴν ἐκ τοῦ ῥήματοϲ, δι’ὃ λόγον καταϲτῆϲαι οὐκ ἂν δύναιντο, εἰ μὴ ἡ ἑτέρα αὐτῶν πλαγία γένοιτο.	γίγνομαι γάρ ἐν ὁ   γε   , ὁ τε ἐκ   καί ὁ ἐκ ὁ  , διά ὃ λόγος  οὐ ἄν δύναμαι , εἰ μή ὁ ἕτερος αὐτός  γίγνομαι .
799567	tlg0082.tlg004.1st1K-grc1	καὶ ἡ μὲν ἐκ τοῦ ῥήματοϲ παρυφιϲταμένη ἄκλιτοϲ, καθὸ ἄπτωτα τὰ ῥήματα·	καί ὁ μέν ἐκ ὁ    ,   ὁ ῥῆμα ·
799568	tlg0082.tlg004.1st1K-grc1	ἡ μέντοι ἐκ τῆϲ ἀντωνυμίαϲ ἐφικτὴ εἰϲ τὸ κλιθῆναι.	ὁ μέντοι ἐκ     ὁ κλίνω .
799569	tlg0082.tlg004.1st1K-grc1	Ἔτι κἀκεῖνό τιϲ ἐπιζητήϲει, ὡϲ.	ἔτι    ,  .
799570	tlg0082.tlg004.1st1K-grc1	« εἴπερ ἐκ τοῦ ῥήματοϲ παρυφίϲτατοι εὐθεῖα, οὕτωϲ καὶ ἐκ τῆϲ ἐμαυτόϲ καὶ ϲαυτόϲ ὑποϲτήϲεται πλαγία κατὰ τὸ ἄρχον μέροϲ τῆϲ ἀντωνυμίαϲ, ἐμαυτὸϲ ἔπαιϲα, τοιούτου ὄντοϲ τοῦ λόγου, ἐμὲ αὐτὸϲ ἔπαιϲα, ὡϲ εἰ καὶ χωρὶϲ τῆϲ ἐπιταγματικῆϲ φαίημεν ἐμέ φημι, καὶ οὐδὲν ἐμποδὼν τὸ ϲυϲτῆναι τὸ ἐμαυτὸϲ ἔπαιϲα ».	« εἴπερ ἐκ ὁ    ,  καί ἐκ   καί   πλάγιος κατά ὁ     ,   , τοιοῦτος  ὁ λόγος ,    ,  εἰ καί      φημί , καί οὐδείς ἐμποδών ὁ  ὁ    .
799571	tlg0082.tlg004.1st1K-grc1	ἀλλ’ ἔϲτι γε πρὸϲ τὸ τοιοῦτο φάναι, ὡϲ οὐ μία πλαγία ἐϲτὶν ἡ παρυφιϲταμένη, αἱ τρεῖϲ δέ τί γὰρ μᾶλλον ἐν τῷ ἐμαυτόϲ ἔγκειται ἡ ἐμέ ἢ ἐμοῦ ἢ ἐμοί;	ἀλλά  γε  ὁ  φημί ,  οὐ    ὁ  , ὁ  δέ τίς γάρ μᾶλλον ἐν τῷ  ἔγκειμαι ὁ  ἤ  τίη  ;
799572	tlg0082.tlg004.1st1K-grc1	καὶ ἦν χρεία τῶν τοιούτων πτώϲεων ὑπὲρ τοῦ τὸ κατάλληλον προφανὲϲ γίνεϲθαι, ἄδηλον δὲ γίνεται κατὰ τὴν ϲύνθεϲιν·	καί εἰμί χρεία ὁ τοιοῦτος  ὑπέρ ὁ ὁ κατάλληλος   , ἄδηλος δέ γίγνομαι κατά ὁ  ·
799573	tlg0082.tlg004.1st1K-grc1	περιϲϲὸν ἡγητέον τὸ ἄδηλον προκρῖναι τοῦ προφανοῦϲ καὶ ϲυνήθουϲ.	ἡγέομαι ὁ ἄδηλος προκρίνω ὁ  καί  .
799574	tlg0082.tlg004.1st1K-grc1	Ἀλλ’ ἴϲωϲ πρὸϲ τὸ τοιοῦτόν τιϲ πάλιν ἐνϲτήϲεται, ὡϲ«τα ἀμφίβολα πρὸϲ τῶν ϲυνταϲϲομένων ἐκλύεται·	ὁ   πάλιν  ,  « τα ἀμφίβολος  ὁ  ἐκλύω ·
799575	tlg0082.tlg004.1st1K-grc1	εἴπερ οὖν τὰ ϲυνιόντα τῶν ῥημάτων οὐ πρὸϲ πᾶϲαν πλαγίαν πτῶϲιν εὐθέτιϲται ϲυνίϲταϲθαι, ἀλλ’ ἃ μὲν γενικὴν αἰτεῖ, ἃ δὲ αἰτιατικήν, τινὰ δὲ δοτικήν, διὰ τῆϲ ϲυντάξεωϲ τοῦ ῥήματοϲ τὸ ἄδηλον τῆϲ πτώϲεωϲ προφανὲϲ γενήϲεται.	εἴπερ οὖν ὁ  ὁ ῥῆμα οὐ       , ἀλλά ὅς μέν γενικός αἰτέω , ὅς δέ  ,  δέ δοτικός , διά   ὁ  ὁ ἄδηλος     .
799576	tlg0082.tlg004.1st1K-grc1	φέρε γὰρ εἶναι τὸ τοιοῦτον, ἐμαυτὸϲ ἀκούω·	φέρω γάρ εἰμί ὁ  ,  ἀκούω ·
799577	tlg0082.tlg004.1st1K-grc1	τὸ ἀκούω γενικὴν μηνύει ἐγκειμένην, ἐφ’ ἣν φέρεται·	ὁ ἀκούω  μηνύω  , ἐπί ὅς φέρω ·
799578	tlg0082.tlg004.1st1K-grc1	ἐμαυτὸϲ τύπτω·	·
799579	tlg0082.tlg004.1st1K-grc1	διὰ τοῦ τύπτω ἡ ἐμέ αἰτιατικὴ δηλωθήϲεται».	διά ὁ  ὁ    » .
799580	tlg0082.tlg004.1st1K-grc1	ἀλλ’ ἐκεῖνο πάλιν ἀνακύψει, ὡϲ ἔνια ἐπὶ δύο πτώϲειϲ φέρεται, τέμνω ϲέ- τέμνω ϲοί, γυμνάζω ϲέ γυμνάζω ϲοί·	ἀλλά ἐκεῖνος πάλιν  ,  ἔνιοι ἐπί γε  φέρω ,   -   , γυμνάζω  γυμνάζω  ·
799581	tlg0082.tlg004.1st1K-grc1	καὶ πῶϲ ἐπὶ τῶν τοιούτων τὸ ἐμαυτὸϲ τέμνω διάκριϲιν τῆϲ πτώϲεωϲ ποιήϲεται;	καί  ἐπί ὁ τοιοῦτος ὁ  τέμνω     ;
799582	tlg0082.tlg004.1st1K-grc1	οὐδὲ γὰρ ἐκ παραθέϲεωϲ ἄρθρων τὸ τοιοῦτο βοηθεῖται.	οὐδέ γάρ ἐκ  ἄρθρον ὁ   .
799583	tlg0082.tlg004.1st1K-grc1	μένον μέντοι τὸ ϲύνθετον ϲχῆμα τῇ ϲυνηθεϲτέρᾳ παραδόϲει διακρίνει τὸ ἐμαυτὸν τέμνω καὶ ἐμαυτῷ τέμνω.	μένω  ὁ   ὁ   διακρίνω ὁ ἐμαυτοῦ τέμνω καί ἐμαυτοῦ τέμνω .
799584	tlg0082.tlg004.1st1K-grc1	Τὸ δὲ μεῖζον, εἰ καί τιϲ ἀποϲταίητῆϲ τοιαύτηϲ ἀποδείξεωϲ, πάλιν μάτην τὰ τῆϲ ζητήϲεωϲ καταϲτήϲεται·	δέ μέγας , εἰ καί   τῆϲ   , πάλιν μάτην ὁ    ·
799585	tlg0082.tlg004.1st1K-grc1	παραδεχθεῖϲα γὰρ ἡ ἐμαυτόϲ ἄκλιτοϲ γενήϲεται.	γάρ ὁ    .
799586	tlg0082.tlg004.1st1K-grc1	οὔτε γὰρ κατὰ τὸν λόγον τῆϲ ϲυνθέϲεωϲ δύναται κλίνεϲθαι, λέγω ἐν μέϲῃ τῇ λέξει, καθὸ ἅπαξ ϲυντεθέντα τὰ πτωτικὰ ἄκλιτά ἐϲτιν·	οὔτε γάρ κατά ὁ λόγος   δύναμαι  , λέγω ἐν  ὁ λέγω ,  ἅπαξ  ὁ    ·
799587	tlg0082.tlg004.1st1K-grc1	ἀλλ’ οὐδὲ κατὰ τὸ τέλοϲ·	ἀλλά οὐδέ κατά ὁ  ·
799588	tlg0082.tlg004.1st1K-grc1	ἀεὶ γὰρ ἡ εὐθεῖα ἕϲτηκεν μετὰ τοῦ ῥήματοϲ, ἐγὼ ἀκούω ϲου, ἐγὼ ἐτίμων ϲε, ἐγώ ϲοι χαρίζομαι.	ἀεί γάρ ὁ εὐθύς  μετά ὁ  ,  ἀκούω  ,    ,   χαρίζω .
799589	tlg0082.tlg004.1st1K-grc1	καὶ δὴ ἐν τῷ ἐμαυτὸϲ ἔτυψα ἡ αἰτιατικὴ νοείϲθω ἐκ τοῦ ἔτυψα.	καί δή ἐν ὁ  τύπτω ὁ   ἐκ ὁ τύπτω .
799590	tlg0082.tlg004.1st1K-grc1	οὐχὶ οὖν γενήϲεται ἄκλιτοϲ ἡ ἐμαυτόϲ κατὰ μὲν τὸ τέλοϲ διὰ τὸ ῥῆμα, κατὰ δὲ τὸ ἄρχον διὰ τὴν ϲύνθεϲιν;	οὐ οὖν   ὁ  κατά μέν ὁ  διά ὁ ῥῆμα , κατά δέ ὁ ἄρχω διά ὁ  ;
799591	tlg0082.tlg004.1st1K-grc1	καὶ εἰ τοῦτο ὑγιέϲ, πῶϲ οὐχὶ μάταιον τῆϲ ἐμαυτοῦ ζητεῖν εὐθεῖαν;	καί εἰ οὗτος  ,  οὐ μάταιος  ἐμαυτοῦ ζητέω εὐθύς ;
799592	tlg0082.tlg004.1st1K-grc1	γενομένηϲ γὰρ ἡ εὐθεῖα οὐχ ἕξει πλαγίαν, καὶ δῆλον ὡϲ καὶ πάλιν τῶν πλαγίων οὐϲῶν οὐκ ἐγγενήϲεται ἡ εὐθεῖα.	γάρ ὁ εὐθύς  ἔχω  , καί δῆλος  καί πάλιν ὁ πλάγιον  οὐ  ὁ εὐθύς .
799593	tlg0082.tlg004.1st1K-grc1	Ἀκολούθωϲ μέντοι προϲκείϲεται καὶ τὸ αἴτιον τοῦ μὴ ϲυντεθῆναι τὴν εὐθεῖαν.	καί ὁ αἴτιος ὁ μή  ὁ εὐθύς .
799594	tlg0082.tlg004.1st1K-grc1	ἔϲτω γὰρ ϲύνταξιϲ ἡ ἐγὼ αὐτὸϲ ὕβριϲα καὶ παθητικῶϲ ἐγὼ αὐτὸϲ ὑβρίϲθην, ἐφ’ οἷϲ ὁμόλογόν ἐϲτινὡϲ ἐν δυϲὶ προϲώποιϲ αἱ ἐγγενόμεναί εἰϲ διαθέϲειϲ, ἥ τε τοῦ ὑβρίϲαντοϲ τε τοῦ ὑβριϲθέντοϲ.	γάρ  ὁ    καί     , ἐπί    ὡϲ ἐν   ὁ    , ὁ τε ὁ  τε ὁ  .
799595	tlg0082.tlg004.1st1K-grc1	( εἰ γὰρ πάλιν μοναδικὴ γένοιτο ἡ διάθεϲιϲ ἐκ τοῦ αὐτοῦ προϲώπου εἰϲ τὸ αὐτό, ὥϲτε φάναι ἐγὼαὐτὸϲ ὕβριϲα ἐμέ, ὑποϲτρέψει τὰ τῆϲ ϲυντάξεωϲ εἰϲ τὴν ϲύνθετον πλαγίαν ἐν τῷ ἐμαυτὸν ὕβριϲα)— ϲαφὲϲ δὲ κἀκεῖνο, ὡϲ αἱ ϲυνθέϲειϲ πρὸϲ ἐξαλλαγὴν τῶν κατὰ παράθεϲιν ἐπενοήθηϲαν.	( εἰ γάρ πάλιν  γίγνομαι ὁ  ἐκ ὁ αὐτός   ὁ αὐτός ,  φημί  αὐτὸϲ   ,  ὁ    ὁ   ἐν ὁ ἐμαυτοῦ  ) —  δέ  ,  ὁ    ὁ κατά   .
799596	tlg0082.tlg004.1st1K-grc1	εἰ γὰρ τὴν αὐτὴν ϲημαϲίαν εἶχον τοῖϲ κατὰ παράθεϲιν, κἂν πάντωϲ παρέλκοντα ἦν τὰ ϲυντιθέμενα τῶν ϲχημάτων.	εἰ γάρ ὁ αὐτός  ἔχω  κατά  , ἐάν   εἰμί ὁ  ὁ  .
799597	tlg0082.tlg004.1st1K-grc1	διαφέρει τὸ χὴν καὶ ἀλώπηξ τοῦ χηναλώπηξ, τὸ μιϲῶν γυναῖκα τοῦ μιϲογύνηϲ, ἄλλα πλεῖϲτα.	διαφέρω ὁ  καί ἀλώπηξ ὁ  , ὁ  γυνή ὁ  , ἄλλος  .
799598	tlg0082.tlg004.1st1K-grc1	εἰ δὴ οὖν τὸ ἐγὼ αὐτόϲ ϲυντεθὲν πλέον τι ἐϲήμαινεν τοῦ κατὰ παράθεϲιν, ἀναγκαία ἦν ἡ ϲύνθεϲιϲ·	εἰ δή οὖν ὁ    πολύς τις  ὁ κατά  , ἀναγκαῖος εἰμί ὁ  ·
799599	tlg0082.tlg004.1st1K-grc1	νυνὶ δὲ οὐχ οὕτωϲ ἔχει.	νυνί δέ οὐ  ἔχω .
799600	tlg0082.tlg004.1st1K-grc1	ὅπου γ’ οὖν ἐγένετο διαφορά τιϲ ἐκ τῆϲ ϲυνθέϲεωϲ, ἐκεῖϲε καὶ προϲεχώρηϲεν τὰ τῆϲ ϲυνθέϲεωϲ.	ὅπου  οὖν γίγνομαι διαφορά  ἐκ   ,  καί  ὁ   .
799601	tlg0082.tlg004.1st1K-grc1	αἱ πλάγιαι ἁπλαῖ οὖϲαι ϲύνταξιν τὴν ἐφ’ ἕτερον πρόϲωπον ἔχουϲιν, ϲυντεθεῖϲαί γε μὴν ἠλλοτρίωνται τῆϲ μεταβάϲεωϲ τοῦ προϲώπου.	ὁ πλάγιος ἁπλόος   ὁ ἐπί ἕτερος   ,  γε μήν    ὁ  .
799602	tlg0082.tlg004.1st1K-grc1	ὅπερ οὐκ ἐνεχώρει, ὡϲ ἔφαμέν γε, καὶ ἐπὶ τῆϲ εὐθείαϲ.	ὅς οὐ ἐγχωρέω ,   γε , καί ἐπί   .
799603	tlg0082.tlg004.1st1K-grc1	δεόντωϲ ἄρα ἡ εὐθεῖα ἀπροϲδεὴϲ ἐγένετο τῆϲ ϲυνθέϲεωϲ.	ἄρα ὁ εὐθύς  γίγνομαι   .
799604	tlg0082.tlg004.1st1K-grc1	Οὐ μόνον δὲ αἱ ἀντωνυμίαι ἐκ τῶν πλαγίων ἀρχὴν ἔϲχον ϲυνθέϲεωϲ, ἀλλὰ καὶ τὸ ἀλλήλων·	οὐ μόνος δέ ὁ  ἐκ ὁ πλάγιον ἀρχή   , ἀλλά καί ὁ ἀλλήλων ·
799605	tlg0082.tlg004.1st1K-grc1	οὐ γὰρ δή γε ἡ τούτου εὐθεῖα πάλιν ϲυϲτατή.	οὐ γάρ δή γε ὁ οὗτος εὐθύς πάλιν  .
799606	tlg0082.tlg004.1st1K-grc1	ἡ γὰρ τοῦ ῥήματοϲ ϲύνταξιϲ τὴν ἐν τοῖϲ δύο προϲώποιϲ μετάβαϲιν δηλοῖ·	ὁ γάρ ὁ   ὁ ἐν  γε   δηλόω ·
799607	tlg0082.tlg004.1st1K-grc1	τὸ γὰρ ἀλλήλων ἤκουϲαν τοιοῦτόν τί ἐϲτιν, ἄλλοι ἄλλων, ἀλλήλουϲ ἔπαιϲαν, ἄλλοι ἄλλουϲ.	ὁ γάρ ἀλλήλων   τίς  , ἄλλος ἄλλος ,   , ἄλλος  .
799608	tlg0082.tlg004.1st1K-grc1	ἐγγενομένηϲ γὰρ τῆϲ εὐθείαϲ ἐν τῷ ἄλληλοι νοηθήϲεται τὸ ἄλλοι ἄλλοι, ὅπερ ἄλογον·	γάρ   ἐν τῷ   ὁ ἄλλος ἄλλος , ὅς ἄλογος ·
799609	tlg0082.tlg004.1st1K-grc1	οὐ γὰρ κατακλείει διάνοιαν διὰ τὸ ἐπάλληλον τῶν δύο εὐθειῶν.	οὐ γάρ κατακλείω διάνοια διά ὁ ἐπάλληλος ὁ γε εὐθεῖα .
799610	tlg0082.tlg004.1st1K-grc1	— Ἔϲτιν γε μὴν οὐχ ὅμοιον τῇ ἀντωνυμικῇ ϲυνθέϲει.	—  γε μήν οὐ ὅμοιος ὁ   .
799611	tlg0082.tlg004.1st1K-grc1	ἡ μὲν γὰρ τὴν αὐτοπάθειαν ϲημαίνει, ἑαυτοὺϲ ἔτυψαν, ἡ δὲ τὴν ἐκ προϲώπων πρὸϲ ἕτερα πρόϲωπα μετάβαϲιν.	ὁ μέν γάρ ὁ αὐτοπάθεια  ,   , ὁ δέ ὁ ἐκ   ἕτερος   .
