id	filename	tokens	lemmas
1243263	tlg0057.tlg057.1st1K-grc1	τοιούτῳ μίγματι πέφυκε πονεῖν, καθ’ὃ καὶ ἀπορίαν τοῦ ἰδιώματος ἐμποιεῖ.	τοιοῦτος μῖγμα φύω πονέω , κατά ὃ καί ἀπορία ὁ ἰδίωμα ἐμποιέω .
1243264	tlg0057.tlg057.1st1K-grc1	ἐν ταύτῃ τῇ ῥήσει πάλιν ὁ Ἀρχιγένης εὐθέως κατὰ τὴν ἀρχὴν ὅλκιμον εἶναί φησι τὸν πόνον τοῦ ἥπατος.	ἐν οὗτος ὁ  πάλιν ὁ  εὐθύς κατά ὁ ἀρχή ὅλκιμος εἰμί φημί ὁ πόνος ὁ ἧπαρ .
1243265	tlg0057.tlg057.1st1K-grc1	ἔστι μὲν οὖν ἄηθες τοὔνομα τοῖς Ἕλλησιν τὸ ὅλκιμον, ὥστ’ οὐδὲ τί σημαίνει ῥᾴδιον εὑρεῖν·	εἰμί μέν οὖν  ὄνομα ὁ Ἕλλην ὁ ὅλκιμος ,  οὐδέ τι σημαίνω  εὑρίσκω ·
1243266	tlg0057.tlg057.1st1K-grc1	ἐκ γὰρ πολλῆς χρήσεως ἡ τῶν σημαινομένων εὕρεσις γίνεται·	ἐκ γάρ πολύς χρῆσις ὁ ὁ σημαίνω εὕρεσις γίγνομαι ·
1243267	tlg0057.tlg057.1st1K-grc1	τοὺς δ’ οὖν χρησαμένους αὐτῷ τὸ γλίσχρον οἶδα δηλοῦντας, ὃ ὥσπερ ὁ ἰξός ἐστιν, ὥστε μέρους λαβόμενον ἕλκειν δι’ αὐτοῦ δύνασθαι τὸ συνεχές.	ὁ  οὖν  αὐτός ὁ γλίσχρος οἶδα δηλόω ,  ὥσπερ ὁ ἰξός εἰμί , ὥστε μέρος  ἕλκω διά αὐτός δύναμαι ὁ συνεχής .
1243268	tlg0057.tlg057.1st1K-grc1	οὕτω δὲ καὶ τὸ σταὶς ὅλκιμον εἴρηται τὸ τῶν πυρῶν, καὶ μάλιστα τὸ κάλλιστα πεφυραμένον·	οὕτως δέ καί ὁ  ὅλκιμος λέγω ὁ ὁ πυρός , καί μάλιστα ὁ καλός φυράω ·
1243269	tlg0057.tlg057.1st1K-grc1	οὐχ ὅλκιμον δὲ τὸ τῶν κριθῶν καὶ τὸ τῆς κέγχρου.	οὐ ὅλκιμος δέ ὁ ὁ κριθή καί ὁ ὁ  .
1243270	tlg0057.tlg057.1st1K-grc1	τό γε μὴν τοῦ ἥπατος ἄλγημα κατὰ τοῦτο τὸ σημαινόμενον οὔκ ἄν ποτε γένοιθ’ ὅλκιμον, ὥστ’ ἄλλό τι ζητητέον ἡμῖν ἐστιν.	ὁ γε μήν ὁ ἧπαρ ἄλγημα κατά οὗτος ὁ σημαίνω  ἄν ποτε  ὅλκιμος ,   τι ζητέω  εἰμί .
1243271	tlg0057.tlg057.1st1K-grc1	εἷς μὲν δή τις τῶν πρεσβευόντων τὴν Ἀρχιγένους αἵρεσιν ὅλκιμον ἔφησεν πόνον εἰρῆσθαι τὸν τοῦ ἥπατος, ἐπειδὴ καθέλκει φλεγμαῖνόν τε καὶ σκληρούμενον τὴν κλεῖν·	μέν δή τις ὁ πρεσβεύω ὁ  αἵρεσις  φημί πόνος λέγω ὁ ὁ ἧπαρ , ἐπεί καθέλκω  τε καί  ὁ κλείς ·
1243272	tlg0057.tlg057.1st1K-grc1	ἕτερος δὲ τὸ χρονίζον·	ἕτερος δέ ὁ χρονίζω ·
1243273	tlg0057.tlg057.1st1K-grc1	ἄλλος δὲ τὸ μέτριον·	ἄλλος δέ ὁ  ·
1243274	tlg0057.tlg057.1st1K-grc1	εἰσὶ δ’ οἳ τὸ βραδὺ, τοῦτο δ’ εἶναι τὸ ἀντικείμενον τῷ ὀξεῖ, καί φασι τὸ μὲν κατεπεῖγον καὶ σφοδρὸν, ὡς μηδεμίαν ἀνάπαυλαν ποιεῖσθαι, καλεῖν αὐτὸν ὀξὺ, τὸ δ’ ἐναντίον, ὅπερ ἐστι τὸ βραδὺ, ὅλκιμον εἰρηκέναι·	εἰμί  ὁ ὁ  , οὗτος  εἰμί ὁ  τῷ  , καί φημί ὁ μέν κατεπείγω καί  , ὡς μηδείς ἀνάπαυλα ποιέω , καλέω αὐτός ὀξύς2 , ὁ  ἐναντίος , ὅς εἰμί ὁ  , ὅλκιμος λέγω ·
1243275	tlg0057.tlg057.1st1K-grc1	τινὲς δὲ τὸν βάρους ἔμφασιν ἔχοντα φασὶν εἰρῆσθαι ὅλκιμον ἤτοι βαρὺν πόνον·	δέ ὁ βᾶρος ἔμφασις ἔχω φημί λέγω ὅλκιμος ἤτοι βαρύς πόνος ·
1243276	tlg0057.tlg057.1st1K-grc1	ὀνομάζεσθαι γὰρ ἐν τῇ συνηθείᾳ κατὰ τοῦ βάρους τὴν ὁλκήν.	ὀνομάζω γάρ ἐν ὁ συνήθεια κατά ὁ βάρος ὁ ὁλκή .
1243277	tlg0057.tlg057.1st1K-grc1	πολλὰ δὲ καὶ ἄλλα διαφόρως ἐξηγούμενοι λέγουσιν οἱ θαυμάζοντες ἃ μηδεὶς νοεῖ.	πολύς δέ καί  διάφορος  λέγω ὁ θαυμάζω ὅς  νοέω .
1243278	tlg0057.tlg057.1st1K-grc1	τὸ μὲν οὖν ὅλκιμον ὄνομα, τὸ κατὰ τὴν ἀρχὴν τῆς ῥήσεως εἰρημένον, ὅτι μηδὲν ἡμᾶς διδάσκει, πρόδηλον ἤδη γέγονεν·	ὁ μέν οὖν ὅλκιμος ὄνομα , ὁ κατά ὁ ἀρχή ὁ  λέγω , ὅτι2  ἐγώ διδάσκω , πρόδηλος ἤδη γίγνομαι ·
1243279	tlg0057.tlg057.1st1K-grc1	ἐπισκεψώμεθα δ’ ἐφεξῆς, τί ποτ’ ἐστὶν ὁ ἐμπεφυκὼς πόνος, ἥπατος ἴδιος εἶναι καὶ αὐτὸς εἰρημένος.	ἐφεξῆς , τι  εἰμί ὁ  πόνος ,  ἴδιος εἰμί καί αὐτός λέγω .
1243280	tlg0057.tlg057.1st1K-grc1	ἐμοὶ μὲν δὴ πιθανώτερον εἶναι δοκεῖ, τῷ διαΐσσοντι τὸν ἐμπεφυκότα κατ’ ἐναντίωσιν εἰρῆσθαι πρὸς αὐτοῦ·	μέν δή πιθανός εἰμί δοκέω , τῷ  ὁ  κατά  λέγω πρός αὐτός ·
1243281	tlg0057.tlg057.1st1K-grc1	τί γὰρ ἂν ἄλλο τις ὑπολάβοι;	τι γάρ ἄν ἄλλος τις ὑπολαμβάνω ;
1243282	tlg0057.tlg057.1st1K-grc1	καὶ μὴν εἴ τις ἄλλος πόνος εἰς συμπάθειαν ἄγει πολλὰ τῶν πέριξ σωμάτων, οὕτω καὶ ὁ τοῦ ἥπατος, ὅς γε καὶ μέχρι τῆς κλειδὸς ἐκτείνεται, καὶ δύσπνοιαν ἐπιφέρει πολλάκις, ἐνίοτε δὲ καὶ βῆχα καὶ δυσεντερίαν, εἴς γε μὴν τὰς νόθας πλευρὰς οὐκ ὀλιγάκις ἐναργῶς διικνεῖται·	καί μήν εἰ τις ἄλλος πόνος εἰς συμπάθεια ἄγω πολύς ὁ πέριξ σῶμα , οὕτως καί ὁ ὁ ἧπαρ , ὅς γε καί μέχρι ὁ κλείς ἐκτείνω , καί δύσπνοια ἐπιφέρω πολλάκις , ἐνίοτε δέ καί  καί δυσεντερία ,  γε μήν ὁ  πλευρά οὐ ὀλιγάκις ἐναργής διικνέομαι ·
1243283	tlg0057.tlg057.1st1K-grc1	πῶς ἂν οὖν ἀληθῶς λέγοιτο κατὰ χώραν μένειν;	πῶς ἄν οὖν ἀληθής λέγω κατά χώρα μένω ;
1243284	tlg0057.tlg057.1st1K-grc1	ἆρ’ οὖν ἄμεινόν ἐστιν τὸν ἐμπεφυκότα πόνον εἰρῆσθαι δοκεῖν, τὸν οἷον ἐμπεπαρμένον;	οὖν ἀμείνων εἰμί ὁ  πόνος λέγω δοκέω , ὁ οἷος ἐμείρω ;
1243285	tlg0057.tlg057.1st1K-grc1	καὶ μὴν ἥκιστα τοιοῦτός ἐστιν ὁ τοῦ ἥπατος, ὡς ἀρτίως ἐπιδέδεικται.	καί μήν ἥκιστος τοιοῦτος εἰμί ὁ ὁ  , ὡς ἄρτιος ἐπιδείκνυμι .
1243286	tlg0057.tlg057.1st1K-grc1	ἐδείχθη δ’ ἔμπροσθεν, ὅτι μηδ’ ὁ ναρκώδης πόνος ἴδιός ἐστι μορίου τινὸς, ἀλλὰ διαθέσεως μᾶλλον·	δείκνυμι  ἔμπροσθεν , ὅτι2  ὁ  πόνος ἴδιος εἰμί μόριον  , ἀλλά διάθεσις μᾶλλον ·
1243287	tlg0057.tlg057.1st1K-grc1	εἰ δὲ δὴ καὶ μορίου τινὸς, οὐδαμῶς ἥπατος, ἀλλ’, εἴπερ ἄρα, τῶν νευρωδῶν σωμάτων.	εἰ δέ δή καί μόριον  , οὐδαμῶς  , ἀλλά , εἴπερ ἄρα , ὁ  σῶμα .
1243288	tlg0057.tlg057.1st1K-grc1	ὁ δ’ ἀτειρῶς ἐγκείμενος μάχεται τῷ ναρκώδει, βίαιός τις ὢν καὶ συνεχής·	ὁ    μάχομαι τῷ  , βίαιος τις εἰμί καί συνεχής ·
1243289	tlg0057.tlg057.1st1K-grc1	ἔστι δ’ οὐ τοιοῦτος ὁ τοῦ ἥπατος, ἀλλὰ μᾶλλον βαρύς·	εἰμί  οὐ τοιοῦτος ὁ ὁ  , ἀλλά μᾶλλον βαρύς ·
1243290	tlg0057.tlg057.1st1K-grc1	οὐ μὴν οὐδὲ ὁ βαρὺς ἴδιος ἥπατος ἐξαιρέτως, ἀλλὰ κοινὸς σπληνὶ καὶ νεφροῖς φλεγμαίνουσιν.	οὐ μήν οὐδέ ὁ βαρύς ἴδιος ἥπατος ἐξαιρετός , ἀλλά κοινός  καί νεφρός φλεγμαίνω .
1243291	tlg0057.tlg057.1st1K-grc1	ὁ δ’ Ἀρχιγένης οὐκ οἶδα πῶς ἐπὶ μόνου τοῦ σπληνὸς ἐμνημόνευσεν τῆς τοιαύτης ἰδέας τοῦ πόνου, μηδ’ Ἱπποκράτους ἀκούσας εἰπόντος, καὶ ἐς νεφρὸν ὀδύνη βαρεῖα.	ὁ   οὐ οἶδα πῶς ἐπί μόνος ὁ σπλήν μνημονεύω ὁ τοιοῦτος ἰδέα ὁ πόνος ,  Ἱπποκράτης ἀκούω λέγω , καί εἰς  ὀδύνη βαρύς .
1243292	tlg0057.tlg057.1st1K-grc1	τοῦτο μὲν οὖν ἔλαττον ἁμάρτημα, μέγιστον δὲ, ὅπερ εἴωθε ποιεῖν, ὀνόματα γράφων ἑτέρων αἰσθήσεων οἰκεῖα, καθάπερ καὶ νῦν ἐπὶ νεφρῶν μὲν τοὺς αὐστηροὺς πόνους, ἐπὶ κύστεως δὲ τοὺς στύφοντας·	οὗτος μέν οὖν  ἁμάρτημα , μέγας δέ , ὅς εἴωθα ποιέω , ὄνομα γράφω ἕτερος αἴσθησις οἰκεῖος , καθά καί νῦν ἐπί  μέν ὁ αὐστηρός πόνος , ἐπί κύστις δέ ὁ  ·
1243293	tlg0057.tlg057.1st1K-grc1	ἔστι γὰρ ταῦτα χυμῶν ὀνόματα, δι’ ὀργάνου μὲν τῆς γλώττης, αἰσθήσεως δὲ τῆς γευστικῆς διαγινωσκόμενα.	εἰμί γάρ οὗτος χυμός ὄνομα , διά  μέν ὁ γλῶσσα , αἴσθησις δέ ὁ   .
1243294	tlg0057.tlg057.1st1K-grc1	γενικώτερον μὲν οὖν τι πρᾶγμα δηλοῦται πρὸς τῆς στῦφον φωνῆς, εἰδικώτερον δὲ﻿ πρός τε τῆς αὐστηρὸν καὶ στρυφνόν·	μέν οὖν τι πρᾶγμα δηλόω πρός ὁ  φωνή ,  δέ ﻿ πρός τε ὁ αὐστηρός καί στρυφνός ·
1243295	tlg0057.tlg057.1st1K-grc1	ἄμφω μὲν γὰρ στύφει, μᾶλλον δὲ τὸ στρυφνὸν, οἷόν πέρ ἐστιν ἡ ὀμφακῖτις ὀνομαζομένη κηκίς·	ἄμφω μέν γάρ στύφω , μᾶλλον δέ ὁ στρυφνός ,  περ εἰμί ὁ  ὀνομάζω κηκίς ·
1243296	tlg0057.tlg057.1st1K-grc1	αὐστηραὶ δ’ εἰσὶ καὶ ῥοαὶ πολλαὶ καὶ τὰ κυδώνια μῆλα καὶ ἄλλα πάμπολλα τῶν ἐδωδίμων, ἀηδῆ γε μὴν τὰ στρυφνὰ, μὴ ὅτι τὰ φάρμακα μόνον, καθάπερ ὑποκιστὶς καὶ βαλαύστιον καὶ κηκὶς καὶ ῥοῦς, ἀλλὰ καὶ τῶν ἐδωδίμων ὅσα τοιαῦτα.	εἰμί καί ῥοή πολύς καί ὁ κυδώνιος μῆλον καί ἄλλος πάμπολυς ὁ ἐδώδιμος , ἀηδής γε μήν ὁ στρυφνός , μή ὅτι2 ὁ φάρμακον μόνος , καθά ὑποκιστίς καί  καί κηκίς καί  , ἀλλά καί ὁ  ὅσος τοιοῦτος .
1243297	tlg0057.tlg057.1st1K-grc1	διόπερ οὐδὲ νοῆσαι δυνατόν ἐστιν, ὁποῖόν τινα βούλεται τὸν αὐστηρὸν ἢ τὸν στρυφνὸν εἶναι πόνον ὁ Ἀρχιγένης, οὐ μᾶλλον ἢ τὸν κυανοῦν, ἢ τὸν ἐρυθρὸν, ἢ φαιὸν, ἤ τινα ἄλλον ἀπὸ τῶν χρωμάτων ὀνομαζόμενον.	οὐδέ νοέω δυνατός εἰμί ,  τις βούλομαι ὁ αὐστηρός τίη ὁ στρυφνός εἰμί πόνος ὁ  , οὐ μᾶλλον τίη ὁ  , ἤ ὁ ἐρυθρός , ἤ φαιός , ἤ τις ἄλλος ἀπό ὁ χρῶμα ὀνομάζω .
1243298	tlg0057.tlg057.1st1K-grc1	ὅπερ δέ τις ἔλεγεν τῶν Ἀρχιγενείων διδασκάλων, ἐπισκέψασθαι καιρός·	ὅς δέ τις λέγω ὁ  διδάσκαλος , ἐπισκοπέω καιρός ·
1243299	tlg0057.tlg057.1st1K-grc1	ἐδόκει γὰρ αὐτῷ τὰς ἰδιότητας τῶν πόνων ἑρμηνεύειν ὁ Ἀρχιγένης φιλοτιμούμενος, ἀῤῥήτους κατά γε τἀληθὲς οὔσας, εἰς τὴν τοιαύτην ἀτοπίαν ἀφικνεῖσθαι τῶν ὀνομάτων·	δοκέω γάρ αὐτός ὁ ἰδιότης ὁ πόνος ἑρμηνεύω ὁ   ,  κατά γε ἀληθής εἰμί , εἰς ὁ τοιοῦτος ἀτοπία ἀφικνέομαι ὁ ὄνομα ·
1243300	tlg0057.tlg057.1st1K-grc1	οὐκ εἰδὼς ὅτι μία μὲν ἑκάστη τῶν ποιοτήτων ἐστὶ ῥητὴ κατά τε τὴν ἁφὴν καὶ τὴν γεῦσιν, ἔνθαδ’ ἅμα πολλαὶ ποιότητες ἐμφαίνονται κατὰ μίαν οὐσίαν, ἐνταῦθα καὶ γενέσθαι συμβαίνει τὴν ἰδιότητα, καὶ μάλιστ’ ἐπὶ τῆς γεύσεως, ὁπόταν, εἰ τύχοι, καὶ πικρότητός τε καὶ γλυκύτητος αὐστηρότητός τε καὶ δριμύτητος ἐμφαίνηταί τι κατὰ μίαν οὐσίαν·	οὐ οἶδα ὅτι2  μέν ἕκαστος ὁ  εἰμί ῥητός κατά τε ὁ ἁφή καί ὁ γεῦσις , ἔνθα δ’ ἅμα πολύς ποιότης  κατά  οὐσία , ἐνταῦθα καί γίγνομαι συμβαίνω ὁ ἰδιότης , καί  ἐπί ὁ γεῦσις ,  , εἰ τυγχάνω , καί  τε καί   τε καί   τις κατά  οὐσία ·
1243301	tlg0057.tlg057.1st1K-grc1	ἰδιότης γάρ τις οὕτως γίνεται περὶ τὴν γεῦσιν, ἄῤῥητος μὲν, εἴ τις ἐθέλοι δι’ ἑνὸς ὀνόματος αὐτὴν δηλῶσαι, ῥητὴ δ’, εἰ καθ’ ἑκάστην τῶν ποιοτήτων διέρχοιτο μετὰ τοῦ καὶ τὸ μᾶλλόν τε καὶ ἧττον οὐκ ἀδύνατον εἶναι προσδηλοῦν.	ἰδιότης γάρ τις οὕτως γίγνομαι περί ὁ γεῦσις , ἄρρητος μέν , εἰ τις ἐθέλω διά  ὄνομα αὐτός δηλόω , ῥητός  , εἰ κατά ἕκαστος ὁ   μετά ὁ καί ὁ  τε καί ἥσσων οὐ ἀδύνατος εἰμί  .
1243302	tlg0057.tlg057.1st1K-grc1	οὕτω δὲ καὶ τὰς βοτάνας ἁπάσας τε καὶ τὴν ἄλλην ὕλην ἐδήλωσαν οὐκ ὀλίγοι τῶν ἰατρῶν, ἐξηγούμενοι τῶν ποιοτήτων ἑκάστην, ὅσαι ταῖς ἑρμηνευομέναις οὐσίαις ὑπάρχουσιν.	οὕτως δέ καί ὁ βοτάνη ἅπας τε καί ὁ ἄλλος ὕλη δηλόω οὐ ὀλίγος ὁ ἰατρός ,  ὁ  ἕκαστος , ὅσος ὁ  οὐσία ὑπάρχω .
1243303	tlg0057.tlg057.1st1K-grc1	ὥστε καὶ ὁ Ἀρχιγένης, εἰ μὲν ἑνὶ περιλαβεῖν ὀνόματι τὴν ὅλην ἰδιότητα τῆς οὐσίας ἐπεχείρει, παντάπασιν ἀμαθὴς ὑπῆρχεν, ὅπερ οὐ προσήκει λέγειν ἐπ’ Ἀρχιγένους·	ὥστε καί ὁ  , εἰ μέν  περιλαμβάνω ὄνομα ὁ ὅλος ἰδιότης ὁ οὐσία ἐπιχειρέω , παντάπασι ἀμαθής ὑπάρχω , ὅς οὐ προσήκω λέγω ἐπί  ·
1243304	tlg0057.tlg057.1st1K-grc1	εἰ δὲ τὰς ἁπλᾶς ποιότητας, αὗται μὲν οὐκ εἰσὶν ἄῤῥητοι, τὸ δὲ ποσὸν ἐν αὐταῖς ἄῤῥητον μὲν ἀκριβεῖ μέτρῳ, ῥητὸν δ’ ὡς ἐν πλάτει.	εἰ δέ ὁ ἁπλόος ποιότης , οὗτος μέν οὐ εἰμί  , ὁ δέ  ἐν αὐτός  μέν ἀκριβής μέτρον , ῥητός  ὡς ἐν πλάτος .
1243305	tlg0057.tlg057.1st1K-grc1	οὔκουν ἔτι χρὴ μηκύνειν, πεφηνυίας σαφῶς τῆς ἰδέας τῶν λόγων ᾗ χρῆσθαι δεῖ τὸν ἑρμηνεύειν ἐπιχειροῦντα τῶν αἰσθητῶν πραγμάτων ὁτιοῦν.	οὐκοῦν ἔτι χρή μηκύνω ,  σαφής ὁ  ὁ λόγος ὅς χράω2 δέω ὁ ἑρμηνεύω ἐπιχειρέω ὁ αἰσθητός πρᾶγμα ὁτιοῦν .
1243306	tlg0057.tlg057.1st1K-grc1	ἴδια μὲν γὰρ ἔχομεν ἁπασῶν τῶν ἁπτῶν ποιοτήτων ὀνόματα, καθάπερ γε καὶ τῶν γευστῶν·	ἴδιος μέν γάρ ἔχω ἅπας ὁ ἁπτός  ὄνομα , καθά γε καί ὁ  ·
1243307	tlg0057.tlg057.1st1K-grc1	ἴδια δὲ τῶν ὁρατῶν, ὥσπερ καὶ τῶν ἀκουστῶν, καὶ χρῆσθαι προσήκει πᾶσιν αὐτοῖς, ὡς ἔθος ἐστὶν τοῖς Ἕλλησι, μήτε στύφοντα μήτ’ αὐστηρὸν ὀνομάζοντα πόνον, ἴδιαι γὰρ αὗται χυμῶν προσηγορίαι.	ἴδιος δέ ὁ ὁρατός , ὥσπερ καί ὁ  , καί χράω2 προσήκω πᾶς αὐτός , ὡς ἔθος εἰμί ὁ Ἕλλην , μήτε στύφω   ὀνομάζω πόνος , ἴδιος γάρ οὗτος χυμός  .
1243308	tlg0057.tlg057.1st1K-grc1	καὶ πάμπολλοι πρὸ Ἀρχιγένους ἰατροὶ τὰς διαφορὰς τῶν πόνων γράψαντες οὐκ ἐτόλμησαν ἑτέροις ὀνόμασι χρήσασθαι τῶν συνηθῶν, ἃ καὶ παρ’ αὐτῶν τῶν καμνόντων ἐστὶν ἀκοῦσαι·	καί πάμπολυς πρό  ἰατρός ὁ διαφορά ὁ πόνος γράφω οὐ τολμάω ἕτερος ὄνομα χράομαι ὁ  , ὅς καί παρά αὐτός ὁ κάμνω εἰμί ἀκούω ·
1243309	tlg0057.tlg057.1st1K-grc1	καὶ γὰρ οὕτως ἀλγεῖν ποτε λέγουσιν, ὡς ὑπὸ βελόνης νύττεσθαι δοκεῖν·	καί γάρ οὕτως ἀλγέω ποτε λέγω , ὡς ὑπό βελόνη  δοκέω ·
1243310	tlg0057.tlg057.1st1K-grc1	οὕτως αὖ πάλιν, ὡς ὑπὸ τρυπάνου τιτρᾶσθαι καὶ θλᾶσθαι δοκεῖν καὶ διασπᾶσθαι καὶ τείνεσθαι καὶ ἀνασπᾶσθαι καὶ κατασπᾶσθαι, καὶ βάρους τινὸς αἴσθησιν ἔχειν, ἐνίοτε μὲν ἐκκρεμαμένου τῶν ὑπερκειμένων, ἐνίοτεδ’ ἐγκειμένου τοῖς περιέχουσιν.	οὕτως αὖ πάλιν , ὡς ὑπό   καί  δοκέω καί διασπάω καί τείνω καί ἀνασπάω καί κατασπάω , καί βᾶρος   ἔχω , ἐνίοτε μέν ἐκκρεμάννυμι ὁ  , ἐνίοτε δ’  ὁ περιέχω .
1243311	tlg0057.tlg057.1st1K-grc1	τὰ μὲν οὖν τοιαῦτα πάντα συνετὰ, στύφοντες δὲ καὶ στρυφνοὶ καὶ αὐστηροὶ πόνοι τῶν ἀσυνέτων τε ἅμα καὶ ἀχρήστων εἰσίν·	ὁ μέν οὖν τοιοῦτος πᾶς συνετός , στύφω δέ καί  καί αὐστηρός πόνος ὁ  τε ἅμα καί ἄχρηστος εἰμί ·
1243312	tlg0057.tlg057.1st1K-grc1	ὅπερ ἐχρῆν ἐννενοηκέναι τὸν Ἀρχιγένην, διδάσκειν γε βουλόμενον ἡμᾶς διαγνωστικοὺς γίνεσθαι τῶν πεπονθότων τόπων.	ὅς χρή ἐννοέω ὁ  , διδάσκω γε  ἐγώ  γίγνομαι ὁ πάσχω τόπος .
1243313	tlg0057.tlg057.1st1K-grc1	εἰ μὴ γὰρ ἐξ ὧν οἱ κάμνοντες αὐτοὶ λέγουσι διαγνωσόμεθα, λῆρος ἂν εἴη μακρὸς ὁ περὶ τῶν ἀλγημάτων λόγος·	εἰ μή γάρ ἐκ ὅς ὁ κάμνω αὐτός λέγω  , λῆρος ἄν εἰμί μακρός ὁ περί ὁ ἄλγημα λόγος ·
1243314	tlg0057.tlg057.1st1K-grc1	εἰ δὲ παρ’ ἐκείνων χρὴ πυνθάνεσθαι, τίνα τρόπον ἀλγοῦσι, λέγουσι δ’ οὐδέποτε στρυφνὸν ἢ αὐστηρὸν ἢ ἀτειρὸν ἢ ὅλκιμον πόνον, πάλιν ἄχρηστος τοιαύτη διδασκαλία.	εἰ δέ παρά ἐκεῖνος χρή πυνθάνομαι , τις τρόπος ἀλγέω , λέγω  οὐδέποτε στρυφνός τίη αὐστηρός τίη  ἤ ὅλκιμος πόνος , πάλιν ἄχρηστος τοιοῦτος διδασκαλία .
1243315	tlg0057.tlg057.1st1K-grc1	καὶ μὲν δὴ καὶ κατ’ ἐκεῖνον τὸν λόγον, ἐν ᾧ φασι τὰς ἰδιότητας τῶν πόνων ἐπιχειρεῖν ἑρμηνεύειν τὸν Ἀρχιγένην, τὸ τῆς τοιαύτης διδασκαλίας ἀδύνατόν τε ἅμα καὶ ἄχρηστον ἐμφαίνεται.	καί μέν δή καί κατά ἐκεῖνος ὁ λόγος , ἐν ὅς φημί ὁ ἰδιότης ὁ πόνος ἐπιχειρέω ἑρμηνεύω ὁ  , ὁ ὁ τοιοῦτος διδασκαλία ἀδύνατος τε ἅμα καί ἄχρηστος ἐμφαίνω .
1243316	tlg0057.tlg057.1st1K-grc1	πρῶτον μὲν ἄῤῥητός ἐστιν ἡ ἰδιότης πᾶσα κατ’ αὐτούς·	πρῶτος μέν  εἰμί ὁ ἰδιότης πᾶς κατά αὐτός ·
1243317	tlg0057.tlg057.1st1K-grc1	εἰ δὲ τοῦτο, πάντως δήπου καὶ ἀδύνατον εἰς διδασκαλίαν ἐλθεῖν, ὡς ἂν μόνοις γινωσκομένην τοῖς αἰσθητῶς αὐτὴν ἐγνωκόσιν.	εἰ δέ οὗτος , πᾶς  καί  εἰς διδασκαλία ἔρχομαι , ὡς ἄν μόνος γιγνώσκω ὁ αἰσθητός αὐτός γιγνώσκω .
1243318	tlg0057.tlg057.1st1K-grc1	ἔπειτα δὲ καὶ ἄγνωστος ἡμῖν τοῖς μὴ πεπονθόσιν ἐστὶν, εἰ μὴ ἄρα πάντ’ ἔπαθεν ὁ Ἀρχιγένης τὰ τοῦ σώματος μόρια·	ἔπειτα δέ καί ἄγνωστος  ὁ μή πάσχω εἰμί , εἰ  ἄρα  πάσχω ὁ  ὁ ὁ σῶμα μόριον ·
1243319	tlg0057.tlg057.1st1K-grc1	κᾂν συγχωρηθῇ δὲ τοῦτο, τίς ἂν πιστεύσειεν ὅτι καὶ πάντα τὰ κάθ’ ἕκαστον μόριον ἔπαθεν εἷς ἄνθρωπος;	συγχωρέω δέ οὗτος , τις ἐάν πιστεύω ὅτι2 καί πᾶς ὁ  ἕκαστος  πάσχω  ἄνθρωπος ;
1243320	tlg0057.tlg057.1st1K-grc1	ὑποκείσθω δ’, εἰ βούλει, καὶ τοῦτο, καίτοι γ’ ἀδύνατόν ἐστιν·	ὑπόκειμαι  , εἰ βούλομαι , καί οὗτος , καίτοι  ἀδύνατος εἰμί ·
1243321	tlg0057.tlg057.1st1K-grc1	ἀλλ’ ὅτι κατὰ τὴν μήτραν οὐκ ἔπαθεν ὁ Ἀρχιγένης ἄντικρυς δῆλον·	ἀλλά ὅτι2 κατά ὁ μήτρα οὐ  ὁ  ἄντικρυς δῆλος ·
1243322	tlg0057.tlg057.1st1K-grc1	καὶ μὴν καὶ τὰς κατ’ αὐτὴν ἰδιότητας γράφει, μόναις ταῖς πεπονθυίαις γυναιξὶν γιγνωσκομένας·	καί μήν καί ὁ κατά αὐτός  γράφω , μόνος ὁ  γυνή  ·
