id	filename	tokens	lemmas
947700	tlg0007.tlg018.perseus-grc2	οὐ μὴν ἀλλʼ ὁ Τιμολέων παρεβοήθει σῖτον ἐκ Κατάνης μικραῖς ἁλιάσι καὶ λεπτοῖς ἀκατίοις ἀποστέλλων, ἃ μάλιστα χειμῶνι παρεισέπιπτε διὰ τῶν βαρβαρικῶν τριήρων ὑποπορευόμενα, πρὸς τὸν κλύδωνα καὶ τὸν σάλον ἐκείνων διϊσταμένων, ἃ δὴ συνορῶντες οἱ περὶ τὸν Μάγωνα καὶ τὸν Ἱκέτην ἐβούλοντο τὴν Κατάνην ἑλεῖν, ἐξ ἧς εἰσέπλει τὰ ἐπιτήδεια τοῖς πολιορκουμένοις καὶ λαβόντες τῆς δυνάμεως τὴν μαχιμωτάτην ἐξέπλευσαν ἐκ τῶν Συρακουσῶν, ὁ δὲ Κορίνθιος Νέων οὗτος γὰρ ἦν ἄρχων τῶν πολιορκουμένων κατιδὼν ἀπὸ τῆς ἄκρας τοὺς ὑπολελειμμένους τῶν πολεμίων ἀργῶς καὶ ἀμελῶς φυλάττοντας ἐξαίφνης ἐπέπεσε διεσπαρμένοις αὐτοῖς·	οὐ μήν  ὁ Τιμολέων παραβοηθέω σῖτος ἐκ Κατάνη μικρός ἅλιας καί   ἀποστέλλω ,  μάλιστα χειμών  διά ὁ βαρβαρικός   , πρός ὁ κλύδων καί ὁ σάλος ἐκεῖνος  ,  δή συνοράω ὁ περί ὁ Μάγων καί ὁ  βούλομαι ὁ Κατάνη αἱρέω , ἐκ ὅς εἰσπλέω ὁ ἐπιτήδειος ὁ πολιορκέω καί λαμβάνω ὁ δύναμις ὁ  ἐκπλέω ἐκ ὁ  , ὁ δέ Κορίνθιος Νέων οὗτος γάρ εἰμί ἄρχων ὁ πολιορκέω καθοράω ἀπό ὁ ἄκρα ὁ ὑπολείπω ὁ πολέμιος ἀργός καί ἀμελής φυλάσσω ἐξαίφνης ἐπιπίπτω διασπείρω αὐτός ·
947701	tlg0007.tlg018.perseus-grc2	καὶ τοὺς μὲν ἀνελών, τοὺς δὲ τρεψάμενος, ἐκράτησε καὶ κατέσχε τὴν λεγομένην Ἀχραδινήν, ὃ κράτιστον ἐδόκει καὶ ἀθραυστότατον ὑπάρχειν τῆς Συρακουσίων μέρος πόλεως, τρόπον τινὰ συγκειμένης καὶ συνηρμοσμένης ἐκ πλειόνων πόλεων, εὐπορήσας δὲ καὶ σίτου καὶ χρημάτων οὐκ ἀφῆκε τὸν τόπον, οὐδʼ ἀνεχώρησε πάλιν ἐπὶ τὴν ἄκραν, ἀλλὰ φραξάμενος τὸν περίβολον τῆς Ἀχραδινῆς καὶ συνάψας τοῖς ἐρύμασι πρὸς τὴν ἀκρόπολιν διεφύλαττε.	καί ὁ μέν ἀναιρέω , ὁ δέ τρέπω , κρατέω καί κατέχω ὁ λέγω  , ὅς  δοκέω καί  ὑπάρχω ὁ  μέρος πόλις , τρόπος   καί  ἐκ  πόλις , εὐπορέω δέ καί σῖτος καί χρῆμα οὐ ἀφίημι ὁ τόπος , οὐδέ ἀναχωρέω πάλιν ἐπί ὁ ἄκρα , ἀλλά φράσσω ὁ περίβολος ὁ Ἀχραδινή καί συνάπτω ὁ ἔρυμα πρός ὁ ἀκρόπολις διαφυλάσσω .
947702	tlg0007.tlg018.perseus-grc2	τοὺς δὲ περὶ τὸν Μάγωνα καὶ τὸν Ἱκέτην ἐγγὺς ἤδη τῆς Κατάνης ὄντας ἱππεὺς ἐκ Συρακουσῶν καταλαβὼν ἀπήγγειλε τὴν ἅλωσιν τῆς Ἀχραδινῆς.	ὁ δέ περί ὁ Μάγων καί ὁ  ἐγγύς ἤδη ὁ Κατάνη εἰμί ἱππεύς ἐκ Συράκουσαι καταλαμβάνω ἀπαγγέλλω ὁ ἅλωσις ὁ Ἀχραδινή .
947703	tlg0007.tlg018.perseus-grc2	καὶ συνταραχθέντες ἀνεχώρησαν διὰ ταχέων, οὔτε λαβόντες ἐφʼ ἣν ἐξῆλθον οὔτε φυλάξαντες ἣν εἶχον.	καί συνταράσσω ἀναχωρέω διά ταχύς , οὔτε λαμβάνω  ὅς ἐξέρχομαι οὔτε φυλάσσω ὅς ἔχω .
947704	tlg0007.tlg018.perseus-grc2	ταῦτα μὲν οὖν ἔτι τῇ προνοίᾳ καὶ ἀρετῇ δίδωσί τινα πρὸς τὴν τύχην ἀμφισβήτησιν τὸ δʼ ἐπὶ τούτοις γενόμενον παντάπασιν ἔοικε συμβῆναι κατʼ εὐτυχίαν.	οὗτος μέν οὖν ἔτι ὁ πρόνοια καί ἀρετή δίδωμι τις πρός ὁ τύχη  ὁ δέ ἐπί οὗτος γίγνομαι παντάπασι ἔοικα συμβαίνω  εὐτυχία .
947705	tlg0007.tlg018.perseus-grc2	οἱ γὰρ ἐν τοῖς Θουρίοις διατρίβοντες στρατιῶται τῶν Κορινθίων ἅμα μὲν δεδιότες τὰς Καρχηδονίων τριήρεις, αἳ παρεφύλαττον αὐτοὺς μετὰ Ἄννωνος, ἅμα δʼ ἐφʼ ἡμέρας πολλὰς ἐξηγριωμένης ὑπὸ πνεύματος τῆς θαλάττης, πεζῇ διὰ Βρεττίων ὥρμησαν πορεύεσθαι·	ὁ γάρ ἐν ὁ Θούριος διατρίβω στρατιώτης ὁ  ἅμα μέν δείδω ὁ  τριήρης , ὁ παραφυλάσσω αὐτός μετά Ἄννων , ἅμα δέ  ἡμέρα πολύς  ὑπό πνεῦμα ὁ θάλασσα , πεζός διά  ὁρμάω πορεύω ·
947706	tlg0007.tlg018.perseus-grc2	καὶ τὰ μὲν πείθοντες, τὰ δὲ βιαζόμενοι τοὺς βαρβάρους εἰς Ῥήγιον κατέβαινον ἔτι πολὺν χειμῶνα τοῦ πελάγους ἔχοντος.	καί ὁ μέν πείθω , ὁ δέ βιάζω ὁ  εἰς Ῥήγιον καταβαίνω ἔτι πολύς χειμών ὁ πέλαγος ἔχω .
947707	tlg0007.tlg018.perseus-grc2	ὁ δὲ τῶν Καρχηδονίων ναύαρχος, ὡς οὐ προσεδόκα τοὺς Κορινθίους καὶ μάτην ᾤετο καθῆσθαι, πείσας αὐτὸς ἑαυτὸν νενοηκέναι τι τῶν σοφῶν καὶ πανούργων πρὸς ἀπάτην, στεφανώσασθαι τοὺς ναύτας κελεύσας καὶ κοσμήσας τὰς τριήρεις ἀσπίσιν Ἑλληνικαῖς καὶ φοινικίσιν, ἔπλει πρὸς τὰς Συρακούσας.	ὁ δέ ὁ  ναύαρχος , ὡς οὐ  ὁ  καί μάτην οἴομαι  , πείθω αὐτός ἑαυτοῦ νοέω τι ὁ σοφός καί  πρός  , στεφανόω ὁ ναύτης κελεύω καί κοσμέω ὁ τριήρης ἀσπίς Ἑλληνικός καί  , πλέω πρός ὁ Συράκουσαι .
947708	tlg0007.tlg018.perseus-grc2	καὶ παρὰ τὴν ἀκρόπολιν χρώμενος ῥοθίῳ μετὰ κρότου καὶ γέλωτος ἐβόα τοὺς Κορινθίους ἥκειν νενικηκὼς καὶ κεχειρωμένος, ἐν τῇ θαλάττῃ λαβὼν διαπλέοντας, ὡς δή τινα δυσθυμίαν τοῖς πολιορκουμένοις παρέξων.	καί παρά ὁ ἀκρόπολις χράω2 ῥόθιος μετά κρότος καί γέλως βοάω ὁ  ἥκω νικάω καί  , ἐν ὁ θάλασσα λαμβάνω διαπλέω , ὡς δή  δυσθυμία ὁ πολιορκέω παρέχω .
947709	tlg0007.tlg018.perseus-grc2	ἐκείνου δὲ ταῦτα ληροῦντος καὶ φενακίζοντος ἐκ τῶν Βρεττίων καταβεβηκότες οἱ Κορίνθιοι εἰς τὸ Ῥήγιον, ὡς οὐδεὶς παρεφύλαττε καὶ τὸ πνεῦμα κατεσβεσμένον παραλόγως ἀκύμονα τὸν πόρον ἰδεῖν καὶ λεῖον παρεῖχε, ταχὺ πληρώσαντες τὰ πορθμεῖα καὶ τὰς ἁλιάδας τὰς παρούσας ἀνήγοντο καὶ διεκομίζοντο πρὸς τὴν Σικελίαν, οὕτως ἀσφαλῶς καὶ διὰ τοσαύτης γαλήνης ὥστε τοὺς ἵππους παρὰ τὰ πλοῖα παρανηχομένους ἐκ ῥυτήρων ἐφέλκεσθαι.	ἐκεῖνος δέ οὗτος ληρέω καί φενακίζω ἐκ ὁ  καταβαίνω ὁ  εἰς ὁ Ῥήγιον , ὡς  παραφυλάσσω καί ὁ πνεῦμα  παράλογος ἀκύμαντος ὁ πόρος ὁράω καί  παρέχω , ταχύς πληρόω ὁ πορθμεῖον καί ὁ ἅλιας ὁ πάρειμι ἀνάγω καί διακομίζω πρός ὁ Σικελία , οὕτως ἀσφαλής καί διά τοσοῦτος γαλήνη ὥστε ὁ ἵππος παρά ὁ πλοῖον  ἐκ ῥυτήρ ἐφέλκω .
947710	tlg0007.tlg018.perseus-grc2	περαιωθέντων δὲ πάντων ὁ Τιμολέων δεξάμενος αὐτοὺς τήν τε Μεσσήνην εὐθὺς εἶχε, καὶ συνταξάμενος ἐβάδιζεν ἐπὶ τὰς Συρακούσας, οἷς εὐτύχει καὶ κατώρθου μᾶλλον ἢ τῇ δυνάμει πεποιθώς·	περαιόω δέ πᾶς ὁ Τιμολέων δέχομαι αὐτός ὁ τε Μεσσήνη εὐθύς ἔχω , καί  βαδίζω ἐπί ὁ Συράκουσαι , ὅς εὐτυχέω καί  μᾶλλον ἤ ὁ δύναμις πείθω ·
947711	tlg0007.tlg018.perseus-grc2	οὐ γὰρ ἦσαν οἱ σὺν αὐτῷ πλείους τετρακισχιλίων.	οὐ γάρ εἰμί ὁ σύν αὐτός πολύς τετρακισχίλιοι .
947712	tlg0007.tlg018.perseus-grc2	ἀγγελλομένης δὲ τῆς ἐφόδου τῷ Μάγωνι θορυβούμενος καὶ δεδοικὼς ἔτι μᾶλλον εἰς ὑποψίαν ἦλθεν ἐκ τοιαύτης προφάσεως.	δέ ὁ ἔφοδος3 τῷ Μάγων θορυβέω καί δείδω ἔτι μᾶλλον εἰς ὑποψία ἔρχομαι ἐκ τοιοῦτος πρόφασις .
947713	tlg0007.tlg018.perseus-grc2	ἐν τοῖς περὶ τήν πόλιν τενάγεσι, πολὺ μὲν ἐκ κρηνῶν πότιμον ὕδωρ, πολὺ δʼ ἐξ ἑλῶν καὶ ποταμῶν καταρρεόντων εἰς τήν θάλατταν δεχομένοις, πλῆθος ἐγχέλεων νέμεται, καὶ δαψίλεια τῆς ἄγρας τοῖς βουλομένοις ἀεὶ πάρεστι.	ἐν ὁ περί ὁ πόλις τέναγος , πολύς μέν ἐκ κρήνη πότιμος ὕδωρ , πολύς δέ ἐκ ἕλος καί ποταμός καταρρέω εἰς ὁ θάλασσα  , πλῆθος ἔγχελυς νέμω , καί δαψίλεια ὁ ἄγρα ὁ  ἀεί πάρειμι .
947714	tlg0007.tlg018.perseus-grc2	ταύτας οἱ παρʼ ἀμφοτέρων μισθοῦ στρατευόμενοι σχολῆς οὔσης καὶ ἀνοχῶν συνεθήρευον.	οὗτος ὁ παρά ἀμφότερος μισθός στρατεύω σχολή εἰμί καί   .
947715	tlg0007.tlg018.perseus-grc2	οἷα δʼ Ἕλληνες ὄντες καὶ πρὸς ἀλλήλους οὐκ ἔχοντες ἰδίων ἀπεχθειῶν πρόφασιν, ἐν μὲν ταῖς μάχαις διεκινδύνευον εὐρώστως, ἐν δὲ ταῖς ἀνοχαῖς προσφοιτῶντες ἀλλήλοις διελέγοντο.	οἷος δέ Ἕλλην εἰμί καί πρός ἀλλήλων οὐ ἔχω ἴδιος  πρόφασις , ἐν μέν ὁ μάχη διακινδυνεύω εὔρωστος , ἐν δέ ὁ ἀνοχή προσφοιτάω ἀλλήλων διαλέγω .
947716	tlg0007.tlg018.perseus-grc2	καὶ τότε κοινὸν περὶ τήν ἁλιείαν ἔχοντες ἔργον ἐν λόγοις ἦσαν, θαυμάζοντες τῆς θαλάσσης τήν εὐφυΐαν καὶ τῶν χωρίων τήν κατασκευήν.	καί τότε κοινός περί ὁ ἁλιεία ἔχω ἔργον ἐν λόγος εἰμί , θαυμάζω ὁ θάλασσα ὁ εὐφυΐα καί ὁ χωρίον ὁ κατασκευή .
947717	tlg0007.tlg018.perseus-grc2	καὶ τις εἶπε τῶν παρὰ τοῖς Κορινθίοις στρατευομένων τοσαύτην μέντοι πόλιν τὸ μέγεθος καὶ τοσούτοις ἐξησκημένην καλοῖς ὑμεῖς Ἕλληνες ὄντες ἐκβαρβαρῶσαι προθυμεῖσθε, τοὺς κακίστους καὶ φονικωτάτους Καρχηδονίους ἐγγυτέρω κατοικίζοντες ἡμῶν, πρὸς οὓς ἔδει πολλὰς εὔχεσθαι Σικελίας προκεῖσθαι τῆς Ἑλλάδος·	καί τις λέγω ὁ παρά ὁ   τοσοῦτος  πόλις ὁ μέγεθος καί τοσοῦτος  καλός  Ἕλλην εἰμί  προθυμέομαι , ὁ κακός καί   ἐγγύς κατοικίζω ἐγώ , πρός ὅς δέω πολύς εὔχομαι Σικελία πρόκειμαι ὁ Ἑλλάς ·
947718	tlg0007.tlg018.perseus-grc2	ἢ δοκεῖτε τούτους στρατὸν ἀγείραντας ἀπὸ στηλῶν Ἡρακλείων καὶ τῆς Ἀτλαντικῆς ἥκειν θαλάττης δεῦρο κινδυνεύσοντας ὑπὲρ τῆς Ἱκέτου δυναστείας;	τίη δοκέω οὗτος στρατός  ἀπό  Ἡράκλειος καί ὁ  ἥκω θάλασσα δεῦρο  ὑπέρ ὁ  δυναστεία ;
947719	tlg0007.tlg018.perseus-grc2	ὃς εἰ λογισμὸν εἶχεν ἡγεμόνος, οὐκ ἂν ἐξέβαλλε τοὺς πατέρας οὐδʼ ἐπῆγε τῇ πατρίδι τοὺς πολεμίους, ἀλλὰ καὶ τιμῆς καὶ δυνάμεως ἐτύγχανεν ὅσης πρέπει, Κορινθίους καὶ Τιμολέοντα πείσας.	ὅς εἰ λογισμός ἔχω ἡγεμών , οὐ ἐάν ἐκβάλλω ὁ πατήρ οὐδέ ἐπάγω ὁ πατρίς ὁ πολέμιος , ἀλλά καί τιμή καί δύναμις τυγχάνω ὅσος πρέπω ,  καί Τιμολέων πείθω .
947720	tlg0007.tlg018.perseus-grc2	τούτους τοὺς λόγους οἱ μισθοφόροι διεθρόησαν ἐν τῷ στρατοπέδῳ, καὶ παρέσχον ὑποψίαν τῷ Μάγωνι προδίδοσθαι, χρῄζοντι πάλαι προφάσεως.	οὗτος ὁ λόγος ὁ μισθοφόρος διαθροέω ἐν ὁ στρατόπεδον , καί παρέχω ὑποψία τῷ Μάγων προδίδωμι , χρῄζω πάλαι πρόφασις .
947721	tlg0007.tlg018.perseus-grc2	διὸ καὶ δεομένου τοῦ Ἱκέτου παραμένειν καὶ διδάσκοντος ὅσῳ βελτίονές εἰσι τῶν πολεμίων, μᾶλλον οἰόμενος ἀρετῇ καὶ τύχῃ λείπεσθαι Τιμολέοντος ἢ πλήθει δυνάμεως ὑπερβάλλειν, ἄρας εὐθὺς ἀπέπλευσεν εἰς Λιβύην, αἰσχρῶς κατʼ οὐδένα λογισμὸν ἀνθρώπινον ἐκ τῶν χειρῶν ἀφεὶς Σικελίαν.	διό καί δέω ὁ  παραμένω καί διδάσκω ὅσος  εἰμί ὁ πολέμιος , μᾶλλον  ἀρετή καί τύχη λείπω Τιμολέων ἤ πλῆθος δύναμις ὑπερβάλλω , αἴρω εὐθύς ἀποπλέω εἰς Λιβύη , αἰσχρός   λογισμός  ἐκ ὁ χείρ ἀφίημι Σικελία .
947722	tlg0007.tlg018.perseus-grc2	τῇ δʼ ὑστεραίᾳ παρῆν ὁ Τιμολέων ἐπὶ μάχην συντεταγμένος·	ὁ δέ ὑστεραῖος πάρειμι ὁ Τιμολέων ἐπί μάχη συντάσσω ·
947723	tlg0007.tlg018.perseus-grc2	ὡς δὲ τὴν φυγὴν ἐπυνθάνοντο καὶ τὴν ἐρημίαν ἑώρων τῶν νεωρίων, γελᾶν αὐτοῖς ἐπῄει τὴν ἀνανδρίαν τοῦ Μάγωνος, καὶ περιϊόντες ἐκήρυττον ἐν τῇ πόλει μήνυτρα τῷ φράσαντι τὸν Καρχηδονίων στόλον ὅπῃ σφᾶς ἀποδέδρακεν.	ὡς δέ ὁ φυγή πυνθάνομαι καί ὁ ἐρημία ὁράω ὁ  , γελάω αὐτός ἔπειμι2 ὁ ἀνανδρία ὁ Μάγων , καί  κηρύσσω ἐν ὁ πόλις μήνυτρον τῷ  ὁ  στόλος ὅπῃ σφεῖς  .
947724	tlg0007.tlg018.perseus-grc2	οὐ μὴν ἀλλὰ τοῦ Ἱκέτου φιλομαχοῦντος ἔτι καὶ τὴν λαβὴν οὐ προϊεμένου τῆς πόλεως, ἀλλὰ ἐμπεφυκότος οἷς κατεῖχε μέρεσι καρτεροῖς οὖσι καὶ δυσπροσμάχοις, διελὼν ὁ Τιμολέων τὴν δύναμιν αὐτὸς μὲν ᾗ βιαιότατον ἦν παρὰ τὸ ῥεῖθρον τοῦ Ἀνάπου προσέβαλλεν, ἄλλους δʼ ἐκ τῆς Ἀχραδινῆς ἐκέλευεν ἐπιχειρεῖν, ὧν Ἰσίας ἡγεῖτο ὁ Κορίνθιος, τοὺς δὲ τρίτους ἐπῆγον ἐπὶ τὰς Ἐπιπολὰς Δείναρχος καὶ Δημάρετος, οἱ τὴν ὑστέραν ἀγαγόντες ἐκ Κορίνθου βοήθειαν.	οὐ μήν ἀλλά ὁ   ἔτι καί ὁ λαβή οὐ προΐημι ὁ πόλις , ἀλλά  ὅς κατέχω μέρος καρτερός εἰμί καί  , διαιρέω ὁ Τιμολέων ὁ δύναμις αὐτός μέν ὅς βίαιος εἰμί παρά ὁ ῥεῖθρον ὁ Ἄναπος προσβάλλω , ἄλλος δέ ἐκ ὁ Ἀχραδινή κελεύω ἐπιχειρέω , ὅς   ὁ Κορίνθιος , ὁ δέ τρίτος ἐπάγω ἐπί ὁ Ἐπιπολαί Δείναρχος καί Δημάρατος , ὁ ὁ ὕστερος ἄγω ἐκ Κόρινθος βοήθεια .
947725	tlg0007.tlg018.perseus-grc2	ἅμα δὲ καὶ πανταχόθεν τῆς ἐφόδου γενομένης καὶ τῶν περὶ τὸν Ἱκέτην ἀνατραπέντων καὶ φευγόντων, τὸ μὲν ἁλῶναι τὴν πόλιν κατʼ ἄκρας καὶ γενέσθαι ταχέως ὑποχείριον ἐκπεσόντων τῶν πολεμίων δίκαιον ἀναθεῖναι τῇ τῶν μαχομένων ἀνδραγαθίᾳ καὶ τῇ δεινότητι τοῦ στρατηγοῦ, τὸ δὲ μὴ ἀποθανεῖν τινα μηδὲ τρωθῆναι τῶν Κορινθίων ἴδιον ἔργον αὑτῆς ἡ Τιμολέοντος ἐπεδείξατο τύχη, καθάπερ διαμιλλωμένη πρὸς τὴν ἀρετὴν τοῦ ἀνδρός, ἵνα τῶν ἐπαινουμένων αὐτοῦ τὰ μακαριζόμενα μᾶλλον οἱ πυνθανόμενοι θαυμάζωσιν.	ἅμα δέ καί πανταχόθεν ὁ ἔφοδος3 γίγνομαι καί ὁ περί ὁ  ἀνατρέπω καί φεύγω , ὁ μέν ἁλίσκομαι ὁ πόλις  ἄκρα καί γίγνομαι ταχύς ὑποχείριος ἐκπίπτω ὁ πολέμιος δίκαιος ἀνατίθημι ὁ ὁ  ἀνδραγαθία καί ὁ δεινότης ὁ στρατηγός , ὁ δέ μή ἀποθνῄσκω τις μηδέ τιτρώσκω ὁ  ἴδιος ἔργον ἑαυτοῦ ὁ Τιμολέων ἐπιδείκνυμι τύχη , καθά  πρός ὁ ἀρετή ὁ ἀνήρ , ἵνα ὁ ἐπαινέω αὐτός ὁ  μᾶλλον ὁ  θαυμάζω .
947726	tlg0007.tlg018.perseus-grc2	οὐ γὰρ μόνον Σικελίαν πᾶσαν οὐδʼ Ἰταλίαν εὐθὺς ἡ φήμη κατέσχεν, ἀλλʼ ἡμερῶν ὀλίγων ᾗ Ἑλλὰς διήχει τὸ μέγεθος τοῦ κατορθώματος, ὥστε τὴν τῶν Κορινθίων πόλιν ἀπιστοῦσαν εἰ διαπέπλευκεν ὁ στόλος, ὁμοῦ καὶ σεσῳσμένους καὶ νενικηκότας ἀκούειν τοὺς ἄνδρας.	οὐ γάρ μόνος Σικελία πᾶς  Ἰταλία εὐθύς ὁ φήμη κατέχω ,  ἡμέρα ὀλίγος ὅς Ἑλλάς  ὁ μέγεθος ὁ κατόρθωμα , ὥστε ὁ ὁ  πόλις ἀπιστέω εἰ  ὁ στόλος , ὁμοῦ καί  καί νικάω ἀκούω ὁ ἀνήρ .
947727	tlg0007.tlg018.perseus-grc2	οὕτως εὐρόησαν αἱ πράξεις, καὶ τοσοῦτο τῷ κάλλει τῶν ἔργων τὸ τάχος ἡ τύχη προσέθηκεν.	οὕτως  ὁ πρᾶξις , καί τοσοῦτος τῷ κάλλος ὁ ἔργον ὁ τάχος ὁ τύχη προστίθημι .
947728	tlg0007.tlg018.perseus-grc2	γενόμενος δὲ τῆς ἄκρας κύριος οὐκ ἔπαθε Δίωνι ταὐτὸ πάθος, οὐδʼ ἐφείσατο τοῦ τόπου διὰ τὸ κάλλος καὶ τὴν πολυτέλειαν τῆς κατασκευῆς, ἀλλὰ τὴν ἐκεῖνον διαβαλοῦσαν, εἶτʼ ἀπολέσασαν ὑποψίαν φυλαξάμενος ἐκήρυξε τῶν Συρακοσίων τὸν βουλόμενον παρεῖναι μετὰ σιδήρου καὶ συνεφάπτεσθαι κατασκαπτομένων τῶν τυραννικῶν ἐρυμάτων.	γίγνομαι δέ ὁ ἄκρα κύριος2 οὐ πάσχω Δίων αὐτός πάθος ,  φείδομαι ὁ τόπος διά ὁ κάλλος καί ὁ πολυτέλεια ὁ κατασκευή , ἀλλά ὁ ἐκεῖνος  , εἶτα    κηρύσσω ὁ  ὁ  παρίημι μετά σίδηρος καί συνεφάπτομαι  ὁ τυραννικός ἔρυμα .
947729	tlg0007.tlg018.perseus-grc2	ὡς δὲ πάντες ἀνέβησαν, ἀρχὴν ἐλευθερίας ποιησάμενοι βεβαιοτάτην τὸ κήρυγμα καὶ τὴν ἡμέραν ἐκείνην, οὐ μόνον τὴν ἄκραν, ἀλλὰ καὶ τὰς οἰκίας καὶ τὰ μνήματα τῶν τυράννων ἀνέτρεψαν καὶ κατέσκαψαν.	ὡς δέ πᾶς ἀναβαίνω , ἀρχή ἐλευθερία ποιέω βέβαιος ὁ κήρυγμα καί ὁ ἡμέρα ἐκεῖνος , οὐ μόνος ὁ ἄκρα , ἀλλά καί ὁ οἰκία καί ὁ μνῆμα ὁ τύραννος ἀνατρέπω καί κατασκάπτω .
947730	tlg0007.tlg018.perseus-grc2	εὐθὺς δὲ τὸν τόπον συνομαλύνας ἐνῳκοδόμησε τὰ δικαστήρια, χαριζόμενος τοῖς πολίταις καὶ τῆς τυραννίδος ὑπερτέραν ποιῶν τὴν δημοκρατίαν.	εὐθύς δέ ὁ τόπος  ἐνοικοδομέω ὁ δικαστήριον , χαρίζω ὁ πολίτης καί ὁ τυραννίς  ποιέω ὁ δημοκρατία .
