id	filename	tokens	lemmas
407535	tlg0007.tlg021.perseus-grc2	ἐφοβοῦντο γὰρ ἐγγὺς ὄντας οἱ Θηβαῖοι τοὺς Ὀρχομενίους καί τὴν διαδοχὴν τῶν Λακεδαιμονίων, ὅσον δὲ νικῆσαι κατὰ κράτος καί διεξελθεῖν διὰ παντὸς ἡσσωμένου τοῦ στρατεύματος, ἐξεβιάσαντο·	φοβέω γάρ ἐγγύς εἰμί ὁ  ὁ  καί ὁ διαδοχή ὁ  , ὅσος δέ νικάω κατά κράτος καί διεξέρχομαι διά πᾶς  ὁ στράτευμα , ἐκβιάζω ·
407536	tlg0007.tlg021.perseus-grc2	καί στήσαντες τρόπαιον καί νεκροὺς σκυλεύσαντες ἀνεχώρησαν ἐπʼ οἴκου μέγα φρονοῦντες.	καί ἵστημι τρόπαιον καί νεκρός σκυλεύω ἀναχωρέω ἐπί οἶκος μέγας φρονέω .
407537	tlg0007.tlg021.perseus-grc2	ἐν γὰρ τοσούτοις, ὡς ἔοικε, πολέμοις Ἑλληνικοῖς καί βαρβαρικοῖς πρότερον οὐδέποτε Λακεδαιμόνιοι πλείονες ὄντες ὑπʼ ἐλαττόνων ἐκρατήθησαν, ἀλλʼ οὐδὲ ἴσοι πρὸς ἴσους ἐκ παρατάξεως συμβαλόντες.	ἐν γάρ τοσοῦτος , ὡς ἔοικα ,  Ἑλληνικός καί βαρβαρικός πρότερος οὐδέποτε   εἰμί   κρατέω ,  οὐδέ ἴσος πρός ἴσος ἐκ παράταξις συμβάλλω .
407538	tlg0007.tlg021.perseus-grc2	ὅθεν ἦσαν ἀνυπόστατοι τὰ φρονήματα, καί τῇ δόξῃ καταπληττόμενοι τοὺς ἀντιταττομένους, οὐδὲ αὐτοὺς ἀξιοῦντας ἀπʼ ἴσης δυνάμεως τὸ ἴσον φέρεσθαι Σπαρτιάταις, εἰς χεῖρας συνέστησαν, ἐκείνη δὲ ἡ μάχη πρώτη καί τοὺς ἄλλους ἐδίδαξεν Ἕλληνας ὡς οὐχ ὁ Εὐρώτας οὐδʼ ὁ μεταξὺ Βαβύκας καί Κνακιῶνος τόπος ἄνδρας ἐκφέρει μαχητὰς καί πολεμικούς, ἀλλὰ παρʼ οἷς ἂν αἰσχύνεσθαι τὰ αἰσχρὰ καί τολμᾶν ἐπὶ τοῖς καλοῖς ἐθέλοντες ἐγγένωνται νέοι καί τοὺς ψόγους τῶν κινδύνων μᾶλλον φεύγοντες, οὗτοι φοβερώτατοι τοῖς ἐναντίοις εἰσί.	ὅθεν εἰμί  ὁ φρόνημα , καί ὁ δόξα  ὁ ἀντιτάσσω , οὐδέ αὐτός ἀξιόω ἀπό ἴσος δύναμις ὁ ἴσος φέρω Σπαρτιάτης , εἰς χείρ συνίστημι , ἐκεῖνος δέ ὁ μάχη πρῶτος καί ὁ ἄλλος διδάσκω Ἕλλην ὡς οὐ ὁ Εὐρώτης οὐδέ ὁ μεταξύ  καί  τόπος ἀνήρ ἐκφέρω μαχητής καί πολεμικός , ἀλλά παρά ὅς ἐάν αἰσχύνω ὁ αἰσχρός καί τολμάω ἐπί ὁ καλός ἐθέλω  νέος καί ὁ ψόγος ὁ κίνδυνος μᾶλλον φεύγω , οὗτος  ὁ ἐναντίος εἰμί .
407539	tlg0007.tlg021.perseus-grc2	τὸν δʼ ἱερὸν λόχον, ὥς φασι, συνετάξατο Γοργίδας πρῶτος ἐξ ἀνδρῶν ἐπιλέκτων τριακοσίων, οἷς ἡ πόλις ἄσκησιν καὶ δίαιταν ἐν τῇ Καδμείᾳ στρατοπεδευομένοις παρεῖχε, καὶ διὰ τοῦθʼ ὁ ἐκ πόλεως λόχος ἐκαλοῦντο·	ὁ δέ ἱερός λόχος , ὡς φημί , συντάσσω Γοργίδας πρῶτος ἐκ ἀνήρ ἐπίλεκτος τριακόσιοι , ὅς ὁ πόλις ἄσκησις καί δίαιτα ἐν ὁ  στρατοπεδεύω παρέχω , καί διά  ὁ ἐκ πόλις λόχος καλέω ·
407540	tlg0007.tlg021.perseus-grc2	τὰς γὰρ ἀκροπόλεις ἐπιεικῶς οἱ τότε πόλεις ὠνόμαζον.	ὁ γάρ ἀκρόπολις ἐπιεικής ὁ τότε πόλις ὀνομάζω .
407541	tlg0007.tlg021.perseus-grc2	ἔνιοι δέ φασιν ἐξ ἐραστῶν καὶ ἐρωμένων γενέσθαι τὸ σύστημα τοῦτο, καὶ Παμμένους ἀπομνημονεύεταί τι μετὰ παιδιᾶς εἰρημένον·	ἔνιοι δέ φημί ἐκ  καί ἐράω γίγνομαι ὁ σύστημα οὗτος , καί Παμμένης  τι μετά παιδιά λέγω ·
407542	tlg0007.tlg021.perseus-grc2	οὐ γὰρ ἔφη τακτικὸν εἶναι τὸν Ὁμήρου Νέστορα κελεύοντα κατὰ φῦλα καὶ φρήτρας συλλοχίζεσθαι τοὺς Ἕλληνας, ὡς φρήτρη φρήτρηφιν ἀρήγῃ, φῦλα δὲ φύλοις, δέον ἐραστὴν παρʼ ἐρώμενον τάττειν.	οὐ γάρ φημί τακτικός εἰμί ὁ Ὅμηρος Νέστωρ κελεύω κατά φῦλον καί φράτρα  ὁ Ἕλλην , ὡς φράτρα φράτρα ἀρήγω , φῦλον δέ φῦλον , δέω ἐραστός παρά ἐράω τάσσω .
407543	tlg0007.tlg021.perseus-grc2	φυλέτας μὲν γὰρ φυλετῶν καὶ φράτορας φρατόρων οὐ πολὺν λόγον ἔχειν ἐν τοῖς δεινοῖς, τὸ δʼ ἐξ ἐρωτικῆς φιλίας συνηρμοσμένον στῖφος ἀδιάλυτον εἶναι καὶ ἄρρηκτον, ὅταν οἱ μὲν ἀγαπῶντες τοὺς ἐρωμένους, οἱ δὲ αἰσχυνόμενοι τοὺς ἐρῶντας ἐμμένωσι τοῖς δεινοῖς ὑπὲρ ἀλλήλων.	φυλέτης μέν γάρ  καί φράτηρ φράτηρ οὐ πολύς λόγος ἔχω ἐν ὁ δεινός , ὁ δέ ἐκ ἐρωτικός φιλία συναρμόζω στῖφος ἀδιάλυτος εἰμί καί ἄρρηκτος , ὅταν ὁ μέν ἀγαπάω ὁ ἐράω , ὁ δέ αἰσχύνω ὁ ἐράω ἐμμένω ὁ δεινός ὑπέρ ἀλλήλων .
407544	tlg0007.tlg021.perseus-grc2	καὶ τοῦτο θαυμαστὸν οὐκ ἔστιν, εἴγε δὴ καὶ μὴ παρόντας αἰδοῦνται μᾶλλον ἑτέρων παρόντων, ὡς ἐκεῖνος ὁ τοῦ πολεμίου κείμενον αὑτὸν ἐπισφάττειν μέλλοντος δεόμενος καὶ ἀντιβολῶν διὰ τοῦ στέρνου διεῖναι τὸ ξίφος, ὅπως, ἔφη, μή με νεκρὸν ὁ ἐρώμενος ὁρῶν κατὰ νώτου τετρωμένον αἰσχυνθῇ.	καί οὗτος θαυμαστός οὐ εἰμί , εἰ δή καί μή πάρειμι αἰδέομαι μᾶλλον ἕτερος πάρειμι , ὡς ἐκεῖνος ὁ ὁ πολέμιος  ἑαυτοῦ ἐπισφάζω μέλλω δέω καί ἀντιβολέω διά ὁ στέρνον διΐημι ὁ ξίφος , ὅπως , φημί , μή  νεκρός ὁ ἐρώμενος ὁράω κατά νῶτος τιτρώσκω  .
407545	tlg0007.tlg021.perseus-grc2	λέγεται δὲ καὶ τὸν Ἰόλεων τοῦ Ἡρακλέους ἐρώμενον ὄντα κοινωνεῖν τῶν ἄθλων καὶ παρασπίζειν.	λέγω δέ καί ὁ Ἰόλαος ὁ Ἡρακλέης ἐράω εἰμί κοινωνέω ὁ ἆθλος καί  .
407546	tlg0007.tlg021.perseus-grc2	Ἀριστοτέλης δὲ καὶ καθʼ αὑτὸν ἔτι φησὶν ἐπὶ τοῦ τάφου τοῦ Ἰόλεω τὰς καταπιστώσεις ποιεῖσθαι τοὺς ἐρωμένους καὶ τοὺς ἐραστάς.	Ἀριστοτέλης δέ καί  ἑαυτοῦ ἔτι φημί ἐπί ὁ τάφος ὁ  ὁ  ποιέω ὁ ἐράω καί ὁ ἐραστής .
407547	tlg0007.tlg021.perseus-grc2	εἰκὸς οὖν καὶ τὸν λόχον ἱερὸν προσαγορεύεσθαι, καθότι καὶ Πλάτων ἔνθεον φίλον τὸν ἐραστὴν προσεῖπε.	ἔοικα οὖν καί ὁ λόχος ἱερός προσαγορεύω ,  καί Πλάτων ἔνθεος φίλος ὁ ἐραστής προσαγορεύω .
407548	tlg0007.tlg021.perseus-grc2	λέγεται δὲ διαμεῖναι μέχρι τῆς ἐν Χαιρωνείᾳ μάχης ἀήττητον·	λέγω δέ διαμένω μέχρι ὁ ἐν Χαιρώνεια μάχη ἀήσσητος ·
407549	tlg0007.tlg021.perseus-grc2	ὡς δὲ μετὰ τὴν μάχην ἐφορῶν τοὺς νεκροὺς ὁ Φίλιππος ἔστη κατὰ τοῦτο τὸ χωρίον ἐν ᾧ συνετύγχανε κεῖσθαι τοὺς τριακοσίους, ἐναντίους ἀπηντηκότας ταῖς σαρίσαις ἅπαντας ἐν τοῖς ὅπλοις καὶ μετʼ ἀλλήλων ἀναμεμιγμένους, θαυμάσαντα καὶ πυθόμενον ὡς ὁ τῶν ἐραστῶν καὶ τῶν ἐρωμένων οὗτος εἴη λόχος, δακρῦσαι καὶ εἰπεῖν ἀπόλοιντο κακῶς οἱ τούτους τι ποιεῖν ἢ πάσχειν αἰσχρὸν ὑπονοοῦντες.	ὡς δέ μετά ὁ μάχη ἐφοράω ὁ νεκρός ὁ Φίλιππος ἵστημι κατά οὗτος ὁ χωρίον ἐν ὅς συντυγχάνω κεῖμαι ὁ τριακόσιοι , ἐναντίος ἀπαντάω ὁ  ἅπας ἐν ὁ ὅπλον καί μετά ἀλλήλων  , θαυμάζω καί πυνθάνομαι ὡς ὁ ὁ ἐραστός καί ὁ ἐράω οὗτος εἰμί λόχος , δακρύω καί λέγω  κακός ὁ οὗτος τι ποιέω τίη πάσχω αἰσχρός ὑπονοέω .
407550	tlg0007.tlg021.perseus-grc2	ὅλως δὲ τῆς περὶ τοὺς ἐραστὰς συνηθείας οὐχ, ὥσπερ οἱ ποιηταὶ λέγουσι, Θηβαίοις τὸ Λαΐου πάθος ἀρχὴν παρέσχεν, ἀλλʼ οἱ νομοθέται τὸ φύσει θυμοειδὲς αὐτῶν καὶ ἄκρατον ἀνιέναι καὶ ἀνυγραίνειν εὐθὺς ἐκ παίδων βουλόμενοι, πολὺν μὲν ἀνεμίξαντο καὶ σπουδῇ καὶ παιδιᾷ πάσῃ τὸν αὐλόν, εἰς τιμὴν καὶ προεδρίαν ἄγοντες, λαμπρὸν δὲ τὸν ἔρωτα ταῖς παλαίστραις ἐνεθρέψαντο, συγκεραννύντες τὰ ἤθη τῶν νέων.	ὅλος δέ ὁ περί ὁ ἐραστής συνήθεια οὐ , ὥσπερ ἕ ποιητής λέγω ,  ὁ Λαΐας πάθος ἀρχή παρέχω , ἀλλά ὁ νομοθέτης ὁ φύσις θυμοειδής αὐτός καί ἄκρατος ἄνειμι καί  εὐθύς ἐκ παῖς  , πολύς μέν  καί σπουδή καί παιδιά πᾶς ὁ αὐλός , εἰς τιμή καί προεδρία ἄγω , λαμπρός δέ ὁ ἔρως ὁ παλαίστρα  , συγκεράννυμι ὁ ἦθος ὁ νέος .
407551	tlg0007.tlg021.perseus-grc2	ὀρθῶς δὲ πρὸς τοῦτο καὶ τὴν ἐξ Ἄρεως καὶ Ἀφροδίτης γεγονέναι λεγομένην θεὸν τῇ πόλει συνῳκείωσαν, ὡς, ὅπου τὸ μαχητικὸν καὶ πολεμικὸν μάλιστα τῷ μετέχοντι πειθοῦς καὶ χαρίτων ὁμιλεῖ καὶ σύνεστιν, εἰς τὴν ἐμμελεστάτην καὶ κοσμιωτάτην πολιτείαν διʼ Ἁρμονίας καθισταμένων ἁπάντων.	ὀρθός δέ πρός οὗτος καί ὁ ἐκ Ἄρης καί Ἀφροδίτη γίγνομαι λέγω  ὁ πόλις  , ὡς , ὅπου ὁ  καί πολεμικός μάλιστα τῷ μετέχω πειθώ καί  ὁμιλέω καί σύνειμι , εἰς ὁ ἐμμελής καί  πολιτεία διά ἁρμονία καθίστημι ἅπας .
407552	tlg0007.tlg021.perseus-grc2	τὸν οὖν ἱερὸν λόχον τοῦτον ὁ μὲν Γοργίδας διαιρῶν εἰς τὰ πρῶτα ζυγά καὶ παρʼ ὅλην τὴν φάλαγγα τῶν ὁπλιτῶν προβαλλόμενος ἐπίδηλον οὐκ ἐποίει τὴν ἀρετὴν τῶν ἀνδρῶν, οὐδʼ ἐχρῆτο τῇ δυνάμει πρὸς κοινὸν ἔργον, ἅτε δὴ διαλελυμένῃ καὶ πρὸς πολὺ μεμιγμένῃ τὸ φαυλότερον, ὁ δὲ Πελοπίδας, ὡς ἐξέλαμψεν αὐτῶν ἡ ἀρετὴ περὶ Τεγύρας, καθαρῶς καὶ περὶ αὐτὸν ἀγωνισαμένων, οὐκέτι διεῖλεν οὐδὲ διέσπασεν, ἀλλʼ ὥσπερ σώματι χρώμενος ὅλῳ προεκινδύνευε τοῖς μεγίστοις ἀγῶσιν.	ὁ οὖν ἱερός λόχος οὗτος ὁ μέν Γοργίδας διαιρέω εἰς ὁ πρῶτος ζυγόν καί παρά ὅλος ὁ φάλαγξ ὁ ὁπλίτης προβάλλω ἐπίδηλος οὐ ποιέω ὁ ἀρετή ὁ ἀνήρ , οὐδέ χράω2 ὁ δύναμις πρός κοινός ἔργον ,  δή  καί πρός πολύς  ὁ  , ὁ δέ Πελοπίδης , ὡς ἐκλάμπω αὐτός ὁ ἀρετή περί  , καθαρός καί περί αὐτός  , οὐκέτι διαιρέω οὐδέ  , ἀλλά ὥσπερ σῶμα χράω2   ὁ μέγας ἀγών .
407553	tlg0007.tlg021.perseus-grc2	ὥσπερ γὰρ οἱ ἵπποι θᾶσσον ὑπὸ τοῖς ἅρμασιν ἢ καθʼ αὑτοὺς ἐλαυνόμενοι θέουσιν, οὐχ ὅτι μᾶλλον ἐμπίπτοντες ἐκβιάζονται τὸν ἀέρα τῷ πλήθει ῥηγνύμενον, ἀλλʼ ὅτι συνεκκαίει τὸν θυμὸν ἡ μετʼ ἀλλήλων ἅμιλλα καὶ τὸ φιλόνεικον, οὕτως ᾤετο τοὺς ἀγαθοὺς ζῆλον ἀλλήλοις καλῶν ἔργων ἐνιέντας ὠφελιμωτάτους εἰς κοινὸν ἔργον εἶναι καὶ προθυμοτάτους.	ὥσπερ γάρ ὁ ἵππος ταχύς ὑπό ὁ ἅρμα ἤ κατά ἑαυτοῦ ἐλαύνω θέω , οὐ ὅτι2 μᾶλλον ἐμπίπτω  ὁ ἀήρ τῷ πλῆθος ῥήγνυμι , ἀλλά ὅτι2  ὁ θυμός ὁ  ἀλλήλων  καί ὁ φιλόνικος , οὕτως οἴομαι ὁ ἀγαθός ζῆλος ἀλλήλων καλός ἔργον  ὠφέλιμος εἰς κοινός ἔργον εἰμί καί πρόθυμος .
407554	tlg0007.tlg021.perseus-grc2	ἐπεὶ δὲ Λακεδαιμόνιοι πᾶσι τοῖς Ἕλλησιν εἰρήνην συνθέμενοι πρὸς μόνους Θηβαίους ἐξήνεγκαν τὸν πόλεμον, ἐνεβεβλήκει δὲ Κλεόμβροτος ὁ βασιλεύς ἄγων ὁπλίτας μυρίους, ἱππεῖς δὲ χιλίους, ὁ δὲ κίνδυνος οὐ περὶ ὧν πρότερον ἦν Θηβαίοις, ἀλλʼ ἄντικρυς ἀπειλὴ καὶ καταγγελία διοικισμοῦ, καὶ φόβος οἷος οὔπω τὴν Βοιωτίαν κατεῖχεν, ἐξιὼν μὲν ἐκ τῆς οἰκίας ὁ Πελοπίδας, καὶ τῆς γυναικὸς ἐν τῷ προπέμπειν δακρυούσης καὶ παρακαλούσης σῴζειν ἑαυτόν, ταῦτα, εἶπεν, ὦ γύναι, τοῖς ἰδιώταις χρὴ παραινεῖν, τοῖς δὲ ἄρχουσιν ὅπως τοὺς ἄλλους σῴζωσιν·	ἐπεί δέ  πᾶς ὁ Ἕλλην εἰρήνη  πρός μόνος  ἐκφέρω ὁ πόλεμος , ἐμβάλλω δέ Κλεόμβροτος ὁ βασιλεύς ἄγω ὁπλίτης μυρίος , ἱππεύς δέ χίλιοι , ὁ δέ κίνδυνος οὐ περί ὅς  εἰμί  ,  ἄντικρυς ἀπειλή καί καταγγελία  , καί φόβος οἷος οὔπω ὁ Βοιωτία κατέχω , ἔξειμι μέν ἐκ ὁ οἰκία ὁ Πελοπίδης , καί ὁ γυνή ἐν τῷ προπέμπω δακρύω καί παρακαλέω σῴζω ἑαυτοῦ , οὗτος , λέγω , ὦ γυνή , ὁ ἰδιώτης χρή παραινέω , ὁ δέ ἄρχω ὅπως ὁ ἄλλος σῴζω ·
407555	tlg0007.tlg021.perseus-grc2	ἐλθὼν δὲ εἰς τὸ στρατόπεδον καὶ τοὺς βοιωτάρχας καταλαβὼν οὐχ ὁμογνωμονοῦντας, πρῶτος Ἐπαμεινώνδᾳ προσέθετο γνώμην ψηφιζομένῳ διὰ μάχης ἰέναι τοῖς πολεμίοις, βοιωτάρχης μὲν οὐκ ἀποδεδειγμένος, ἄρχων δὲ τοῦ ἱεροῦ λόχου, καὶ πιστευόμενος, ὡς ἦν δίκαιον ἄνδρα τηλικαῦτα δεδωκότα τῇ πατρίδι σύμβολα εἰς τὴν ἐλευθερίαν.	ἔρχομαι δέ εἰς ὁ στρατόπεδον καί ὁ  καταλαμβάνω οὐ ὁμογνωμονέω , πρῶτος   γνώμη  διά μάχη εἶμι ὁ πολέμιος , Βοιωτάρχης μέν οὐ ἀποδείκνυμι , ἄρχω δέ ὁ ἱερόν  , καί πιστεύω , ὡς εἰμί δίκαιος ἀνήρ  δίδωμι ὁ πατρίς  εἰς ὁ ἐλευθερία .
407556	tlg0007.tlg021.perseus-grc2	ὡς οὖν ἐδέδοκτο διακινδυνεύειν καὶ περὶ τὰ Λεῦκτρα τοῖς Λακεδαιμονίοις ἀντεστρατοπέδευον, ὄψιν εἶδε κατὰ τοὺς ὕπνους ὁ Πελοπίδας εὖ μάλα διαταράξασαν αὐτόν, ἔστι γὰρ ἐν τῷ Λευκτρικῷ πεδίῳ τὰ σήματα τῶν τοῦ Σκεδάσου θυγατέρων, ἃς Λευκτρίδας καλοῦσι διὰ τὸν τόπον·	ὡς οὖν δοκέω διακινδυνεύω καί περί ὁ Λεῦκτρα ὁ  ἀντιστρατοπεδεύω , ὄψις ὁράω κατά ὁ ὕπνος ὁ Πελοπίδης εὖ μάλα  αὐτός , εἰμί γάρ ἐν ὁ  πεδίον ὁ σῆμα ὁ ὁ Σκέδασος θυγάτηρ , ὅς  καλέω διά ὁ τόπος ·
407557	tlg0007.tlg021.perseus-grc2	ἐκεῖ γὰρ αὐταῖς ὑπὸ ξένων Σπαρτιατῶν βιασθείσαις συνέβη ταφῆναι.	ἐκεῖ γάρ αὐτός ὑπό ξένος Σπαρτιάτης  συμβαίνω θάπτω .
407558	tlg0007.tlg021.perseus-grc2	γενομένης δὲ χαλεπῆς οὕτω καὶ παρανόμου πράξεως, ὁ μὲν πατήρ, ὡς οὐκ ἔτυχεν ἐν Λακεδαίμονι δίκης, ἀρὰς κατὰ τῶν Σπαρτιατῶν ἀρασάμενος ἔσφαξεν ἑαυτὸν ἐπὶ τοῖς τάφοις τῶν παρθένων, χρησμοὶ δὲ καὶ λόγια τοῖς Σπαρτιάταις ἀεὶ προὔφαινον εὐλαβεῖσθαι καὶ φυλάττεσθαι τὸ Λευκτρικὸν μήνιμα, μὴ πάνυ τῶν πολλῶν συνιέντων, ἀλλʼ ἀμφιγνοούντων τὸν τόπον, ἐπεὶ καὶ τῆς Λακωνικῆς πολίχνιον πρὸς τῇ θαλάσσῃ Λεῦκτρον ὀνομάζεται, καὶ πρὸς Μεγάλῃ πόλει τῆς Ἀρκαδίας τόπος ἐστὶν ὁμώνυμος, τὸ μὲν οὖν πάθος τοῦτο πολὺ τῶν Λευκτρικῶν ἦν παλαιότερον.	γίγνομαι δέ  οὕτως καί παράνομος πρᾶξις , ὁ μέν πατήρ , ὡς οὐ τυγχάνω ἐν Λακεδαίμων δίκη , ἀρά κατά ὁ Σπαρτιάτης  σφάζω ἑαυτοῦ ἐπί ὁ τάφος ὁ παρθένος , χρησμός δέ καί λόγιον ὁ Σπαρτιάτης ἀεί προφαίνω εὐλαβέομαι καί φυλάσσω ὁ  μήνιμα , μή πάνυ ὁ πολύς  ,  ἀμφιγνοέω ὁ τόπος , ἐπεί καί ὁ   πρός ὁ θάλασσα Λεῦκτρον ὀνομάζω , καί πρός μέγας πόλις ὁ Ἀρκαδία τόπος εἰμί ὁμώνυμος , ὁ μέν οὖν πάθος οὗτος πολύς ὁ  εἰμί  .
407559	tlg0007.tlg021.perseus-grc2	ὁ δὲ Πελοπίδας ἐν τῷ στρατοπέδῳ κατακοιμηθεὶς ἔδοξε τάς τε παῖδας ὁρᾶν περὶ τὰ μνήματα θρηνούσας καὶ καταρωμένας τοῖς Σπαρτιάταις, τόν τε Σκέδασον κελεύοντα ταῖς κόραις σφαγιάσαι παρθένον ξανθήν, εἰ βούλοιτο τῶν πολεμίων ἐπικρατῆσαι.	ὁ δέ Πελοπίδης ἐν ὁ στρατόπεδον κατακοιμάω δοκέω ὁ τε παῖς ὁράω περί ὁ μνῆμα  καί  ὁ Σπαρτιάτης , ὁ τε  κελεύω ὁ κόρη  παρθένος ξανθός , εἰ βούλομαι ὁ πολέμιος ἐπικρατέω .
407560	tlg0007.tlg021.perseus-grc2	δεινοῦ δὲ καὶ παρανόμου τοῦ προστάγματος αὐτῷ φανέντος ἐξαναστὰς ἐκοινοῦτο τοῖς τε μάντεσι καὶ τοῖς ἄρχουσιν.	δεινός δέ καί παράνομος ὁ πρόσταγμα αὐτός φαίνω ἐξανίστημι κοινόω ὁ τε μάντις καί ὁ ἄρχω .
407561	tlg0007.tlg021.perseus-grc2	ὧν οἱ μὲν οὐκ εἴων παραμελεῖν οἱ δʼ·	ὅς ὁ μέν οὐ ἐάω παραμελέω ὁ δέ ·
407562	tlg0007.tlg021.perseus-grc2	ἀπειθεῖν, τῶν μὲν παλαιῶν προφέροντες Μενοικέα τόν Κρέοντος καὶ Μακαρίαν τὴν Ἡρακλέους, τῶν δʼ ὕστερον Φερεκύδην τε τόν σοφὸν ὑπὸ Λακεδαιμονίων ἀναιρεθέντα καὶ τὴν δορὰν αὐτοῦ κατά τι λόγιον ὑπὸ τῶν βασιλέων φρουρουμένην, Λεωνίδαν τε τῷ χρησμῷ τρόπον τινὰ προθυσάμενον ἑαυτὸν ὑπὲρ τῆς Ἑλλάδος, ἔτι δὲ τοὺς ὑπὸ Θεμιστοκλέους σφαγιασθέντας Ὠμηστῇ Διονύσῳ πρὸ τῆς ἐν Σαλαμῖνι ναυμαχίας·	ἀπειθέω , ὁ μέν παλαιός προφέρω Μενοικεύς ὁ Κρέων καί Μακαρίη ὁ Ἡρακλέης , ὁ δέ ὕστερον Φερεκύδης τε ὁ σοφός ὑπό  ἀναιρέω καί ὁ δορά αὐτός κατά τι  ὑπό ὁ βασιλεύς φρουρέω , Λεωνίδης τε ὁ χρησμός τρόπος   ἑαυτοῦ ὑπέρ ὁ Ἑλλάς , ἔτι δέ ὁ ὑπό Θεμιστοκλέης   Διόνυσος πρό ὁ ἐν Σαλαμίς ναυμαχία ·
407563	tlg0007.tlg021.perseus-grc2	ἐκείνοις γὰρ ἐπιμαρτυρῆσαι τὰ κατορθώματα·	ἐκεῖνος γάρ ἐπιμαρτυρέω ὁ κατόρθωμα ·
407564	tlg0007.tlg021.perseus-grc2	τοῦτο δέ, ὡς Ἀγησίλαον ἀπὸ τῶν αὐτῶν Ἀγαμέμνονι τόπων ἐπὶ τοὺς αὐτοὺς στρατευόμενον πολεμίους ᾔτησε μὲν ἡ θεὸς τὴν θυγατέρα σφάγιον καὶ ταύτην εἶδε τὴν ὄψιν ἐν Αὐλίδι κοιμώμενος, ὁ δʼ οὐκ ἔδωκεν, ἀλλʼ ἀπομαλθακωθεὶς κατέλυσε τὴν στρατείαν ἄδοξον καὶ ἀτελῆ γενομένην.	οὗτος δέ , ὡς  ἀπό ὁ αὐτός Ἀγαμέμνων τόπος ἐπί ὁ αὐτός  πολέμιος αἰτέω μέν ὁ  ὁ θυγάτηρ  καί οὗτος ὁράω ὁ ὄψις ἐν Αὐλίς κοιμάω , ὁ δέ οὐ δίδωμι , ἀλλά  καταλύω ὁ στρατεία ἄδοξος καί ἀτελής γίγνομαι .
407565	tlg0007.tlg021.perseus-grc2	οἱ δὲ τοὐναντίον ἀπηγόρευον, ὡς οὐδενὶ τῶν κρειττόνων καὶ ὑπὲρ ἡμᾶς ἀρεστὴν οὖσαν οὕτω βάρβαρον καὶ παράνομον θυσίαν·	ὁ δέ ἐναντίον ἀπαγορεύω , ὡς  ὁ  καί ὑπέρ ἐγώ  εἰμί οὕτως βάρβαρος καί παράνομος θυσία ·
407566	tlg0007.tlg021.perseus-grc2	οὐ γὰρ τοὺς Τυφῶνας ἐκείνους οὐδὲ τοὺς Γίγαντας ἄρχειν, ἀλλὰ τόν πάντων πατέρα θεῶν καὶ ἀνθρώπων·	οὐ γάρ ὁ Τυφῶν ἐκεῖνος οὐδέ ὁ Γίγας ἄρχω , ἀλλά ὁ πᾶς πατήρ θεός καί ἄνθρωπος ·
