id	filename	tokens	lemmas
1220587	tlg0615.tlg001.opp-grc1	Ἑξῆς δὲ βουλόμενος τὰς τῶν ἀκολάστων διαφορὰς φανερὰς ποιῆσαι διαιρεῖ πρότερον τὰς ἐπιθυμίας αἷς ἀκολουθοῖεν ἂν καὶ ἡδοναί·	ἑξῆς δέ  ὁ ὁ ἀκόλαστος διαφορά φανερός ποιέω διαιρέω πρότερος ὁ ἐπιθυμία ὅς ἀκολουθέω ἐάν καί ἡδονή ·
1220588	tlg0615.tlg001.opp-grc1	καὶ ὅσα εἴδη ἐπιθυμίας, τοσαῦτα καὶ ἡδονῶν·	καί ὅσος εἶδος ἐπιθυμία , τοσοῦτος καί  ·
1220589	tlg0615.tlg001.opp-grc1	ὥστ’ εἰ φανεῖεν αἱ ἡδοναί, δῆλα ἔσται καὶ τὰ τῶν ἀκολασιῶν εἴδη.	εἰ  ὁ ἡδονή , δῆλος εἰμί καί ὁ ὁ  εἶδος .
1220590	tlg0615.tlg001.opp-grc1	ἄλλαι γὰρ περὶ ἄλλην ἡδονὴν ἀκολασίαι.	ἄλλος γάρ περί ἄλλος ἡδονή ἀκολασία .
1220591	tlg0615.tlg001.opp-grc1	τῶν δὴ ἐπιθυμιῶν αἱ μὲν κοιναί, αἱδ’ ἴδιοι καὶ ἐπίθετοι·	ὁ δή ἐπιθυμία ὁ μέν κοινός , ὁ δ’ ἴδιος καί ἐπίθετος ·
1220592	tlg0615.tlg001.opp-grc1	κοινὰς μὲν οὖν λέγει τὰς φυσικάς·	κοινός μέν οὖν λέγω ὁ  ·
1220593	tlg0615.tlg001.opp-grc1	αὗταιδ’ εἰσίν, ὡς προελθὼν λέγει, ὧν ἐνδεεῖς ὄντες ὀρεγόμεθα ἀναπληρώσεως, οἷον ἡ τῆς ξηρᾶς τροφῆς ἐπιθυμία καὶ τῆς ὑγρᾶς.	οὗτος δ’ εἰμί , ὡς προέρχομαι λέγω , ὅς ἐνδεής εἰμί ὀρέγω ἀναπλήρωσις , οἷος ὁ ὁ ξηρός τροφή ἐπιθυμία καί ὁ  .
1220594	tlg0615.tlg001.opp-grc1	εἴη δ ἂν σὺν ταύταις καὶ ἡ τῆς εὐνῆς μάλιστα τοῖς ἡβῶσιν·	εἰμί  ἄν σύν οὗτος καί ὁ ὁ εὐνή μάλιστα ὁ  ·
1220595	tlg0615.tlg001.opp-grc1	ἰδίους δὲ καὶ ἐπιθέτους προσεπιμηχανᾶταί τινας ταῖς φυσικαῖς ἢ καὶ ὅλως παρὰ φύσιν·	ἴδιος δέ καί ἐπίθετος  τις ὁ φυσικός ἤ καί ὅλος παρά φύσις ·
1220596	tlg0615.tlg001.opp-grc1	ἐπιθέτους δ’ αὐτὰς ὀνομάζει, δι’ ὃ πρόσκεινται καὶ οὐχ ὑπ’ αὐτῆς εἰσιν εἰσηγμέναι τῆς φύσεως·	ἐπίθετος  αὐτός ὀνομάζω , διά ὁ πρόσκειμαι καί οὐ ὑπό αὐτός εἰμί εἰσάγω ὁ φύσις ·
1220597	tlg0615.tlg001.opp-grc1	εἴη ἄν οὖν ἡ διαίρεσις τοιαύτη τῶν ἐπιθυμιῶν·	εἰμί ἄν οὖν ὁ διαίρεσις τοιοῦτος ὁ ἐπιθυμία ·
1220598	tlg0615.tlg001.opp-grc1	αἱ μὲν φυσικαὶ αἱδ’ ἴδιοι·	ὁ μέν φυσικός ὁ δ’ ἴδιος ·
1220599	tlg0615.tlg001.opp-grc1	τῶν δ’ ἰδίων αἱ μὲν ἐν τοῖς φυσικοῖς νοσηματικαί τινων, αἱ δὲ παντελῶς παρὰ φύσιν.	ὁ  ἴδιος ὁ μέν ἐν ὁ φυσικός   , ὁ δέ παντελής παρά φύσις .
1220600	tlg0615.tlg001.opp-grc1	τὸ μὲν οὗν κυρίως φυσικόν ἐστιν ἁπλῶς ὀρέγεσθαι πλησμονῆς σμονῆς τὸν ἐνδεᾶ·	ὁ μέν  κύριος φυσικός εἰμί ἁπλόος ὀρέγω   ὁ ἐνδεής ·
1220601	tlg0615.tlg001.opp-grc1	ἐν δὲ τούτῳ ἐφ’ ἕν φησιν ἁμαρτάνειν, ὅταν ὑπερεμπίπλασθαί τινος ὀρέγωνται οὐ πάντως πολυτελῶν βρωμάτων ἢ πομάτων ἐπιθυμουντες ἀλλ᾿ ἐνίοτε καὶ τῶν τυχόντων.	ἐν δέ οὗτος ἐπί  φημί ἁμαρτάνω , ὅταν    οὐ πᾶς πολυτελής βρῶμα ἤ    ἐνίοτε καί ὁ τυγχάνω .
1220602	tlg0615.tlg001.opp-grc1	ὀλίγοι δ’ εἰσὶν οἱ τοιοῦτοι καὶ ἀνδραποδωδέστατοι·	ὀλίγος  εἰμί ὁ τοιοῦτος καί ἀνδραποδώδης ·
1220603	tlg0615.tlg001.opp-grc1	καλοῦνται δὲ γάστριες.	καλέω δέ  .
1220604	tlg0615.tlg001.opp-grc1	τῶν δ’ ἰδίων ἡδονῶν αἱ μέν εἰσιν, ὡς ἔφαμεν ἐν ταῖς φυσικῖς, οὐκ ἐπὶ τὸ πλέον οὖσαι ἀπλῶς·	ὁ  ἴδιος  ὁ μέν εἰμί , ὡς  ἐν ὁ  , οὐ ἐπί ὁ πλέως εἰμί  ·
1220605	tlg0615.tlg001.opp-grc1	αὗται γὰρ εἴρηνται ὅτι ἐν αὐτῇ τῇ ὀρέξει τῆς πλησμονῆς οὐχ ὑπερβάλλουσιν, ἀλλὰ τῷ ἐπιτεταμένως εχειν περί τι καὶ σφοδρῶς, οἳ δὴ καὶ φιλοτοιοῦτοι λέγονται, οἷον φίλοινοι καὶ φιλογύναιοι καὶ φιλόψυχοι.	οὗτος γάρ λέγω ὅτι2 ἐν αὐτός ὁ ὀρέγω ὁ πλησμονή οὐ ὑπερβάλλω , ἀλλά τῷ   περί τις καί σφοδρός , ὁ δή καί  λέγω , οἷος φίλοινος καί  καί  .
1220606	tlg0615.tlg001.opp-grc1	διό φησι τὴν μὲν τῆς τροφῆς ὄρεξιν καὶ τῆς εὐνῆς φυσικὴν εἶναι, τὰς δὲ τοιάσδε ἢ τοιάσδε οὐκέτι παντὸς οὐδὲ τῶν αὐτῶν.	φημί ὁ μέν ὁ τροφή ὄρεξις καί ὁ εὐνή φυσικός εἰμί , ὁ δέ  ἤ  οὐκέτι πᾶς οὐδέ ὁ αὐτός .
1220607	tlg0615.tlg001.opp-grc1	οιο φαίνεται ἡμέτερον εἶναι·	φαίνω ἡμέτερος εἰμί ·
1220608	tlg0615.tlg001.opp-grc1	δηλονότι οἱ μὲν ἁπλῶς ὀρέγονται ἀναπληρώσεως, οὐδὲν περιεργαζόμενοι περὶ τὴν τροφήν, οἱ δὲ πάντως πολυτελοῦς γλίχονται καὶ περὶ τὴν πολυτέλειαν ἐπτόηνται ὄψων ἢ οἴνων.	ὁ μέν ἁπλόος ὀρέγω ἀναπλήρωσις , οὐδείς  περί ὁ τροφή , ὁ δέ πᾶς  γλίχομαι καί περί ὁ πολυτέλεια πτοέω ὄψον ἤ οἶνος .
1220609	tlg0615.tlg001.opp-grc1	† οἵτινες ἤδη ἡμέτερον τὸ ἢ νενοσηκέναι πρὸς ταῦτα ἢ μή·	† ὅστις ἤδη ἡμέτερος ὁ τίη  πρός οὗτος τίη μή ·
1220610	tlg0615.tlg001.opp-grc1	ἀλλ’ ἔχειν γέ τί φησι φυσικὸν τὰς τοιαύτας·	ἀλλά ἔχω γε τι φημί φυσικός ὁ τοιοῦτος ·
1220611	tlg0615.tlg001.opp-grc1	ἕτερα γ·	ἕτερος  ·
1220612	tlg0615.tlg001.opp-grc1	ὰρ ἑτέροις ἡδέα καὶ ἐνίοις γε τὰ τυχόντα ἡδίω ἐστὶ τῶν πολυτελῶν.	ἕτερος ἡδύς καί ἔνιοι γε ὁ τυγχάνω  εἰμί ὁ πολυτελής .
1220613	tlg0615.tlg001.opp-grc1	δῆλον δ’ ὅτι καὶ φύσει οἱ μὲν πρὸς τοὺς τοιούσδε ἡδέως ἔχουσι χυμούς, οἷον πρὸς τοὺς γλυκεῖς οἴνους ἢ αὐστηρούς.	δῆλος  ὅτι2 καί φύσις ὁ μέν πρός ὁ τοιόσδε ἡδύς ἔχω  , οἷος πρός ὁ  οἶνος ἤ  .
1220614	tlg0615.tlg001.opp-grc1	τοῦτο μὲν οὖν ἴσως φυσικόν, τὸ δ’ ἐπτοῆσθαι περί τι καὶ σφοδρῶς ἔχειν ἤδη ἡμέτερον, πρὸς ὃ νῦν ἐφ’ ἓν τὸ φυσικὸν ἔφησεν, εἰρημένων καὶ τούτων τῶν ἁμαρτιῶν ἐν τοῖς φυσικοῖς·	οὗτος μέν οὖν ἴσος φυσικός , ὁ  πτοέω περί τι καί σφοδρός ἔχω ἤδη ἡμέτερος , πρός ὅς νῦν ἐπί  ὁ φυσικός φημί , λέγω καί οὗτος ὁ  ἐν ὁ  ·
1220615	tlg0615.tlg001.opp-grc1	ἢ ὅτι, ὥσπερ προείπομεν, φυσικὴ ἐπιθυμία ἐστὶ τῆς ἀναπληρώσεως·	τίη ὅτι2 , ὥσπερ προαγορεύω , φυσικός ἐπιθυμία εἰμί ὁ ἀναπλήρωσις ·
1220616	tlg0615.tlg001.opp-grc1	ἐν δὲ ταύτῃ τὸ ὑπερπληροῦσθαι ἁμάρτημα·	ἐν δέ οὗτος ὁ ὑπερπληρόω ἁμάρτημα ·
1220617	tlg0615.tlg001.opp-grc1	αἱ δ᾿ ἐπιτεταμέναι† καὶ νοεῖν γάρ τι καὶ διαθέσεως περὶ ὃ ἤδη ἴδιοι εἶεν φυσικαὶ μέν, παρεκβαίνουσι δέ πὼς τὴν φύσιν τῷ ἴδιόν τι εἶδος παρέχειν ἐπιθυμιῶν.	ὁ   † καί νοέω γάρ τις καί διάθεσις περί ὅς ἤδη  εἰμί φυσικός μέν , παρεκβαίνω δέ πως ὁ φύσις τῷ ἴδιος τις εἶδος παρέχω ἐπιθυμιάω .
1220618	tlg0615.tlg001.opp-grc1	ὅτι δ’ οὕτως λέγει, προελθὼν σαφέστερον ποιεῖ·	ὅτι2  οὕτως λέγω , προέρχομαι σαφής ποιέω ·
1220619	tlg0615.tlg001.opp-grc1	λέγει γὰρ περὶ τὰς ἰδίας τῶν ἡδονῶν πολλοὶ καὶ πολλαχῶς διαμαρτάνουσι.	λέγω γάρ περί ὁ ἴδιος ὁ ἡδονή πολύς καί πολλαχῶς διαμαρτάνω .
1220620	tlg0615.tlg001.opp-grc1	Τῶν γὰρ φιλοτοιούτων λεγομένων ἕως καὶ ὡς οὐχ οἱ πολλοί χαίρουσιν.	ὁ γάρ  λέγω ἕως καί ὡς οὐ ὁ πολύς χαίρω .
1220621	tlg0615.tlg001.opp-grc1	ἐν γὰρ τούτοις δύο εἴδη ὑπογράφει τῶν ἰδίων ἡδονῶν, τὸ μὲν ἕτερον τῶν χαιρόντων οἷς μὴ δεῖ, ὃ καὶ παντελῶς παρὰ φύσιν ἐστὶν καὶ οὐδὲ ὀνομάζειν ἄξιον·	ἐν γάρ οὗτος γε εἶδος ὑπογράφω ὁ ἴδιος  , ὁ μέν ἕτερος ὁ χαίρω ὅς μή δέω , ὅς καί παντελής παρά φύσις εἰμί καί οὐδέ ὀνομάζω ἄξιος ·
1220622	tlg0615.tlg001.opp-grc1	τὰ εἴδη ταῦτα τῶν ἀκολάστων·	ὁ εἶδος οὗτος ὁ ἀκόλαστος ·
1220623	tlg0615.tlg001.opp-grc1	πολλὰ γάρ ἐστιν ὑφ’ ἓν τὰ παρὰ φύσιν τῶν ἐπιθυμιῶν εἶδος τεταγμένων·	πολύς γάρ εἰμί ὑπό  ὁ παρά φύσις ὁ ἐπιθυμία εἶδος  ·
1220624	tlg0615.tlg001.opp-grc1	ἄλλο δ’ ἐστὶ τὸ μᾶλλον ἢ ὡς οἱ πολλοὶ χαίρειν ὡς δεῖ·	ἄλλος  εἰμί ὁ μᾶλλον ἤ ὡς ἕ πολύς χαίρω ὡς δέω ·
1220625	tlg0615.tlg001.opp-grc1	μέτρον μὲν οἱ πολλοί εἰσι·	μέτρον μέν ἕ πολύς εἰμί ·
1220626	tlg0615.tlg001.opp-grc1	σχεδὸν γάρ τι οἱ πολλοὶ φέροντες ἐπὶ τὸ μὴ ὑπερβάλλειν ἐν ταῖς ἡδοναῖς, οὐ μὴν ἀκριβοῦσιν.	σχεδόν γάρ τις ὁ πολύς φέρω ἐπί ὁ μή ὑπερβάλλω ἐν ὁ ἡδονή , οὐ μήν ἀκριβόω .
1220627	tlg0615.tlg001.opp-grc1	οἱ μὲν οὗν ἀκόλαστοι μᾶλλον ἢ χεῖρον ἢ ὡς οἱ πολλοὶ χαίρουσιν, οἱ δὲ σώφρονες ἄμεινον τῶν πολλῶν·	ὁ μέν  ἀκόλαστος μᾶλλον τίη χείρων τίη ὡς ἕ πολύς χαίρω , ὁ δέ  ἀμείνων ὁ πολύς ·
1220628	tlg0615.tlg001.opp-grc1	τὸ δὲ μὴ ὡς δεῖ ἢ ὡς δεῖ τοιοῦτόν ἐστιν, ὅτι ὡς οὐ δεῖ ποιοῦσι τὸ μᾶλλον ἢ ὡς δεῖ·	ὁ δέ μή ὡς δέω τίη ὡς δέω τοιοῦτος εἰμί , ὅτι2 ὡς οὐ δέω ποιέω ὁ μᾶλλον ἤ ὡς δέω ·
1220629	tlg0615.tlg001.opp-grc1	ὥσπερ οὖν τῶν ἐπιθυμιῶν δύο τὰ ἀνωτάτω εἴδη, τὸ μὲν κοινόν, τὸδ’ ἴδιον, τοῦ δ’ ἰδίου τὸ μὲν ἐν τοῖς κατὰ φύσιν, οὕτως καὶ τῶν ἡδονῶν τοσαῦτα ἄν εἴη εἴδη ἀκολασίας καὶ αὗται παρέχονται διττὸν εἶδος.	ὥσπερ οὖν ὁ ἐπιθυμία γε ὁ  εἶδος , ὁ μέν κοινός , ὁ δ’ ἴδιος , ὁ  ἴδιος ὁ μέν ἐν ὁ κατά φύσις , οὕτως καί ὁ ἡδονή τοσοῦτος ἄν εἰμί εἶδος ἀκολασία καί οὗτος παρέχω δισσός εἶδος .
1220630	tlg0615.tlg001.opp-grc1	ἢ γὰρ τῶν παρὰ φύσιν ἡδονῶν ἐφίενται ἢ ἐν τοῖς κατὰ φύσιν μᾶλλον ἢ δεῖ καὶ οὐχ ὡς δεῖ αἱ νοσηματικαὶ γίνονται·	τίη γάρ ὁ παρά φύσις  ἐφίημι τίη ἐν ὁ κατά φύσις μᾶλλον τίη δέω καί  ὡς δέω ὁ  γίγνομαι ·
1220631	tlg0615.tlg001.opp-grc1	ὑπὸ δὲ ταῦτα εἴδη πλείω, φιλοψία, φιλοινία καὶ ὅσαι τοιαῦται.	ὑπό δέ οὗτος εἶδος  ,  ,  καί ὅσος τοιοῦτος .
1220632	tlg0615.tlg001.opp-grc1	Ἡ μὲν οὖν περὶ τὰς ἡδονὰς ὑπερβολὴ ὅτι ἀκολασία, δῆλον, περὶ δὲ τὰς λύπας λέγεται εἶναι ἡ σωφροσύνη καὶ ἡ ἀκολασία οὐ τῷ ὑπομένειν καθάπερ ἀνδρεία, ἀλλ’ ὡς ἤδη προείρηται πολλάκις, τῷ μὴ λυπεῖσθαι μὲν τῇ ἀπουσίᾳ τῶν ἡδονῶν ὁ σώφρων λέγεται, τῷ δὲ λυπεῖσθαι ὁ ἀκόλαστος.	ὁ μέν οὖν περί ὁ ἡδονή ὑπερβολή ὅτι2 ἀκολασία , δῆλος , περί δέ ὁ λύπη λέγω εἰμί ὁ σωφροσύνη καί ὁ ἀκολασία οὐ τῷ ὑπομένω καθά ἀνδρεία , ἀλλά ὡς ἤδη προαγορεύω πολλάκις , τῷ μή λυπέω μέν ὁ ἀπουσία ὁ ἡδονή ὁ σώφρων λέγω , τῷ δέ λυπέω ὁ ἀκόλαστος .
1220633	tlg0615.tlg001.opp-grc1	λυπεῖται γάρ, ὥς φησιν, ἀποτυγχάνων, καὶ ἐπιθυμῶν δὲ λυπεῖται·	λυπέω γάρ , ὡς φημί , ἀποτυγχάνω , καί ἐπιθυμέω δέ λυπέω ·
1220634	tlg0615.tlg001.opp-grc1	πᾶσα γὰρ ἐπιθυμία μετὰ λύπης.	πᾶς γάρ ἐπιθυμία μετά λύπη .
1220635	tlg0615.tlg001.opp-grc1	ὁ γὰρ ἡδονῆς σφόδρα ἐπιθυμῶν σφόδρα λυπεῖται.	ὁ γάρ ἡδονή σφόδρα ἐπιθυμέω σφόδρα λυπέω .
1220636	tlg0615.tlg001.opp-grc1	θαυμαστῷ δ’ ἔοικε τὸ καὶ διὰ τὴν ἡδονὴν λυπεῖσθαι·	ἔοικα ὁ καί διά ὁ ἡδονή λυπέω ·
1220637	tlg0615.tlg001.opp-grc1	ἔστι δ’ οὐ θαυμαστόν·	εἰμί  οὐ θαυμαστός ·
1220638	tlg0615.tlg001.opp-grc1	οὐ γὰρ ἔχων τις ἡδονὴν ἤδη λυπεῖται ἀλλ’ ἐφιέμενος αὐτῆς καὶ ἡγούμενος αὑτὸν ἐνδεᾶ τῶν ἡδίστων εἶναι.	οὐ γάρ ἔχω τις ἡδονή ἤδη λυπέω ἀλλά ἐφίημι αὐτός καί  ἑαυτοῦ ἐνδεής ὁ ἡδύς εἰμί .
1220639	tlg0615.tlg001.opp-grc1	οἱ δὲ περὶ τὰς ἡδονὰς ἐλλείποντες οὐ πάνυ γίνονται·	ὁ δέ περί ὁ ἡδονή ἐλλείπω οὐ πάνυ γίγνομαι ·
1220640	tlg0615.tlg001.opp-grc1	οὔτε γὰρ ἀνθρωπικὴ οὔτε παντὸς ζῴου ἡ τοιαύτη ἀναισθησία.	οὔτε γάρ  οὔτε πᾶς ζῷον ὁ τοιοῦτος ἀναισθησία .
1220641	tlg0615.tlg001.opp-grc1	καὶ γὰρ τὰ ἄλλα ζῷα διακ·	καί γάρ ὁ ἄλλος ζῷον  ·
1220642	tlg0615.tlg001.opp-grc1	ρίνει τὸ ἐν τῇ τροφῇ ἡδὺ καὶ λυπηρόν.	ὁ ἐν ὁ τροφή ἡδύς καί λυπηρός .
1220643	tlg0615.tlg001.opp-grc1	〈 εἰ δέ τῳ μὴ διαφέρει ἕτερον〉 ἑτέρου πρὸς ἡδονήν, ἀψύχῳ ἔοικεν.	〈 εἰ δέ τις μή διαφέρω ἕτερος 〉 ἕτερος πρός ἡδονή , ἄψυχος ἔοικα .
1220644	tlg0615.tlg001.opp-grc1	ἔστι δὲ ἀνώνυμος διὰ τὸ μηδὲ γίνεσθαι, καλεῖ δὲ αὐτὸν ἐνίοτε ἀναίσθητον.	εἰμί δέ ἀνώνυμος διά ὁ μηδέ γίγνομαι , καλέω δέ αὐτός ἐνίοτε ἀναίσθητος .
1220645	tlg0615.tlg001.opp-grc1	ὁ δὲ σώφρων μέσως ἔχει περὶ πάντα·	ὁ δέ σώφρων μέσος ἔχω περί πᾶς ·
1220646	tlg0615.tlg001.opp-grc1	οὔτε γὰρ χαίρει οἷς ὁ ἀκόλαστος( ὁ μὲν γὰρ ταῖς ὑπερβολαῖς ἡδονῶν ἥδεται, ὁ δὲ ταῖς ὑπερβολαῖς δυσχεραίνει), οὔτε δὲ ὅλως οἷς μὴ δεῖ χαίρει.	οὔτε γάρ χαίρω ὅς ὁ ἀκόλαστος ( ὁ μέν γάρ ὁ ὑπερβολή ἡδονή ἥδομαι , ὁ δέ ὁ ὑπερβολή δυσχεραίνω ) , οὔτε δέ ὅλος ὅς μή δέω χαίρω .
1220647	tlg0615.tlg001.opp-grc1	τὰς μὲν γὰρ ἐν ταῖς φυσικαῖς ἡδοναῖς ἀμετρίας οὐ προσίεται, τῶν δὲ παρὰ φύσιν οὐδὲ ἀκούειν ἀνέχεται οὐδὲ ἐπιθυμεῖ·	ὁ μέν γάρ ἐν ὁ φυσικός ἡδονή ἀμετρία οὐ προσίημι , ὁ δέ παρά φύσις οὐδέ ἀκούω ἀνέχω οὐδέ ἐπιθυμέω ·
1220648	tlg0615.tlg001.opp-grc1	ἀλλ’ ἢ μετρίως τῶν ἀναγκαὶ καίων καὶ ὅσα πρὸς ὑγίειάν ἐστι καὶ εὐεξίαν φέροντα, τούτων ὀρέγεται, μετρίως δὲ καὶ οὐχ ὥστε παρὰ τὸ καλὸν αὐτῶν τινος ἐφίεσθαι οὐδ’ ὑπὲρ τὴν οὐσίαν·	ἀλλά τίη μέτριος ὁ  καίω καί ὅσος πρός ὑγίεια εἰμί καί  φέρω , οὗτος ὀρέγω , μέτριος δέ καί οὐ ὥστε παρά ὁ καλός αὐτός  ἐφίημι οὐδέ ὑπέρ ὁ οὐσία ·
1220649	tlg0615.tlg001.opp-grc1	καὶ γὰρ τοῦτο οἰκεῖον τῷ σώφρονι μὴ ὑπὲρ τὴν οὐσίαν χρῆσθαι ταῖς ἡδοναῖς.	καί γάρ οὗτος οἰκεῖος τῷ  μή ὑπέρ ὁ οὐσία χράω2 ὁ ἡδονή .
1220650	tlg0615.tlg001.opp-grc1	Ἔστι μὲν οὖν καὶ ἡ δειλία καὶ ἡ ἀκολασία τῶν ἑκουσίων·	εἰμί μέν οὖν καί ὁ δειλία καί ὁ ἀκολασία ὁ ἑκούσιος ·
1220651	tlg0615.tlg001.opp-grc1	τὴν μὲν γὰρ ἡδονὴν ἑκόντες αἱρούμεθα, ἡ δὲ ἀκολασία τῷ μὴ αἱρεῖσθαι ἃς μὴ δεῖ ἡδονάς.	ὁ μέν γάρ ἡδονή  αἱρέω , ὁ δέ ἀκολασία τῷ μή αἱρέω ὅς μή δέω ἡδονή .
1220652	tlg0615.tlg001.opp-grc1	ὑπὲρ δὲ τῆς ἡδονῆς καὶ τῆς λύπης ἄκοντες ἐξελαυνόμεθα καὶ διωκόμεθα·	ὑπέρ δέ ὁ ἡδονή καί ὁ λύπη   καί διώκω ·
1220653	tlg0615.tlg001.opp-grc1	τοιοῦτον δὲ καὶ ἡ δειλία.	τοιοῦτος δέ καί ὁ δειλία .
1220654	tlg0615.tlg001.opp-grc1	καὶ ἡ μὲν λύπη ἐξίστησι τῶν κατά φύσιν καὶ φθείρει πὼς τὴν τοῦ ἔχοντος φύσιν, ἡ δὲ ἡδονὴ οὐδὲν ἔχει τοιοῦτον, ὥς φησιν.	καί ὁ μέν λύπη ἐξίστημι ὁ κατά φύσις καί φθείρω  ὁ ὁ ἔχω φύσις , ὁ δέ ἡδονή  ἔχω  , ὡς φημί .
1220655	tlg0615.tlg001.opp-grc1	ἐξίστανται μὲν οὖν τινες καὶ ὑπὸ τῶν ἡδονῶν ἀλλ’ οὐχ οὕτως ὥστε συγχεῖσθαι τὴν φυσικὴν κατάστασιν, ὅπερ δοκεῖ κατὰ τὴν ἀλγηδόνα μᾶλλον εἶναι καὶ τὸν πόνον·	ἐξίστημι μέν οὖν τις καί ὑπό ὁ ἡδονή ἀλλά οὐ οὕτως ὡς συγχέω ὁ φυσικός κατάστασις , ὅς δοκέω κατά ὁ ἀλγηδών μᾶλλον εἰμί καί ὁ πόνος ·
1220656	tlg0615.tlg001.opp-grc1	διὸ καὶ ἐπονειδιστότερον τόδε τοῦ ἧττον ἑκουσίου.	διό καί ἐπονειδίζω ὅδε ὁ ἥσσων ἑκούσιος .
1220657	tlg0615.tlg001.opp-grc1	ἔτι δὲ τὸ ἐθισθῆναι πρὸς τὸ κρατεῖν τῶν ἡδονῶν ῥᾴον’·	ἔτι δέ ὁ ἐθίζω πρός ὁ κρατέω ὁ ἡδονή  ·
1220658	tlg0615.tlg001.opp-grc1	ἀκίνδυνοι γὰρ οἱ εἰθισμένοι ὥστε ἐπονείδιστον εἰκότως μᾶλλον τὸ μὴ ἐθίσαι ἑαυτὸν πρὸς τὸ μὴ ἀντέχειν ταῖς ἡδοναῖς.	ἀκίνδυνος γάρ ὁ ἐθίζω ὥστε  εἰκός μᾶλλον ὁ μή ἐθίζω ἑαυτοῦ πρός ὁ μή ἀντέχω ὁ ἡδονή .
1220659	tlg0615.tlg001.opp-grc1	ἢ τὸ μὴ ἐθίσαι πρὸς ὑπομονὴν τῶν φόβων.	τίη ὁ μή ἐθίζω πρός ὑπομονή ὁ  .
1220660	tlg0615.tlg001.opp-grc1	ἔχει δέ τινα καὶ ἄλλην ἐναντίωσιν τὰ κατὰ τὴν δειλίαν πρὸς τὰ κατὰ τὴν ἀκολασίαν.	ἔχω δέ τις καί ἄλλος ἐναντίωσις ὁ κατά ὁ δειλία πρός ὁ κατά ὁ ἀκολασία .
1220661	tlg0615.tlg001.opp-grc1	ἡ μὲν γὰρ δειλία αὐτὴ ἄλυπος·	ὁ μέν γάρ δειλία αὐτός ἄλυπος ·
1220662	tlg0615.tlg001.opp-grc1	οὐ γὰρ ἄχθεται ὁ τὴν ἕξιν ἔχων αὐτήν, τὰ δὲ καθ’ ἕκαστον συμβαίνοντα ἐπ’ αὐτῇ λυπηρὰ καὶ δεινά.	οὐ γάρ ἄχθομαι ὁ ὁ ἕξις ἔχω αὐτός , ὁ δέ κατά ἕκαστος συμβαίνω ἐπί αὐτός λυπηρός καί δεινός .
1220663	tlg0615.tlg001.opp-grc1	ἐξίστανται γὰρ ἐν τοῖς δεινοῖς καὶ φοβούμενοι ἀνιῶνται καὶ δεινῶς ἀσχημονοῦσιν·	ἐξίστημι γάρ ἐν ὁ δεινός καί φοβέω ἀνιάω καί δεινός  ·
1220664	tlg0615.tlg001.opp-grc1	ἀνάπαλιν δὲ 〈 τὰ κατὰ τὰς ἡδονάς·	δέ  ὁ κατά ὁ ἡδονή ·
1220665	tlg0615.tlg001.opp-grc1	〉 διὸ καὶ ἑκούσια φαίνονται·	〉 διό καί ἑκούσιος φαίνω ·
1220666	tlg0615.tlg001.opp-grc1	ἐπιθυμοῦντι γὰρ καὶ ἡδομένῳ γίνεται.	ἐπιθυμέω γάρ καί  γίγνομαι .
1220667	tlg0615.tlg001.opp-grc1	ἡ δ’ ἕξις λυπηρά·	ὁ  ἕξις λυπηρός ·
1220668	tlg0615.tlg001.opp-grc1	ἀνιῶνται γὰρ ἐπὶ τῇ ἀκολασίᾳ οἱ ἔχοντες αὐτὴν διὰ τὸ ἐπονείδιστον αὐτὴν σφόδρα εἶναι·	ἀνιάω γάρ ἐπί ὁ ἀκολασία ὁ ἔχω αὐτός διά ὁ ἐπονειδίζω αὐτός σφόδρα εἰμί ·
1220669	tlg0615.tlg001.opp-grc1	διό φησιν οὐδεὶς γὰρ ἐπιθυμεῖ ἀκόλαστος εἶναι.	φημί  γάρ ἐπιθυμέω ἀκόλαστος εἰμί .
1220670	tlg0615.tlg001.opp-grc1	Τὸ δ’ ὄνομα τῆς ἀκολασίας, ὥς φησι, φέρομεν καὶ ἐπὶ τὰς παιδικὰς ἁμαρτίας.	ὄνομα ὁ ἀκολασία , ὡς φημί , φέρω καί ἐπί ὁ παιδικός ἁμαρτία .
1220671	tlg0615.tlg001.opp-grc1	λέγομεν γάρ τινας παῖδας ἀκολάστους, ὅσοι ἂν ἀπειθεῖς ὦσι τοῖς παιδαγωγοῖς καὶ πολλὰ ἁμαρτάνωσι παιδικὰ ἀμαρτήματα.	λέγω γάρ τις παῖς ἀκόλαστος , ὅσος ἐάν ἀπειθής εἰμί ὁ  καί πολύς  παιδικά  .
