id	filename	tokens	lemmas
1219511	tlg0615.tlg001.opp-grc1	καὶ γὰρ ἕξις οὖσα δέδεικται καὶ προαιρετική, εἴτε προαίρεσίς ἐστιν εἴτε μή δέδεικται δὲ καὶ ἐν μεσότητι οὖσα οὐ κατὰ τὸ πρᾶγμα ἀλλὰ τῇ πρὸς ἡμάς·	καί γάρ ἕξις εἰμί δείκνυμι καί προαιρετικός , εἴτε προαίρεσις εἰμί εἴτε μή δείκνυμι δέ καί ἐν μεσότης εἰμί οὐ κατά ὁ πρᾶγμα ἀλλά ὁ πρός  ·
1219512	tlg0615.tlg001.opp-grc1	τὸν δὲ ὅρον τῆς μεσότητος ἔχομεν παρὰ τοῦ λόγου, ὦ ὁρίζεται μήτε πλεῖον εἶναι μήτ’ ἔλαττον·	ὁ δέ ὅρος ὁ μεσότης ἔχω παρά ὁ λόγος , ὦ ὁρίζω  πλέως εἰμί   ·
1219513	tlg0615.tlg001.opp-grc1	ὁ γὰρ λόγος εὖ ὑπαγορεύει τὰ ἐν ταῖς πράξεσι.	ὁ γάρ λόγος εὖ ὑπαγορεύω ὁ ἐν ὁ πρᾶξις .
1219514	tlg0615.tlg001.opp-grc1	ταῦτα μὲν οὖν ἀποχρώντως ἔχει εἰς τὸν τῆς ἀρετῆς λόγον, τὰ δ’ ἄλλα ὥσπερ ἐξηγητικά ἐστι τῶν ἐν τῷ ὁρισμῷ.	οὗτος μέν οὖν ἀποχρώντως ἔχω εἰς ὁ ὁ ἀρετή λόγος , ὁ  ἄλλος ὥσπερ ἐξηγητικός εἰμί ὁ ἐν ὁ ὁρισμός .
1219515	tlg0615.tlg001.opp-grc1	εἶπε γὰρ αὐτὴν ἐν μεσότητι εἶναι τῇ ὡρισμένῃ λόγῳ.	λέγω γάρ αὐτός ἐν μεσότης εἰμί ὁ ὁρίζω λόγος .
1219516	tlg0615.tlg001.opp-grc1	καὶ ἐπεξηγεῖται ποίῳ λόγῳ·	καί ἐπεξηγέομαι ποιός λόγος ·
1219517	tlg0615.tlg001.opp-grc1	τῶ τοῦ φρονίμου καὶ ᾧ ἄν ὁ φρόνιμος ὁρίσειεν.	τῷ ὁ φρόνιμος καί ὅς ἄν ὁ φρόνιμος ὁρίζω .
1219518	tlg0615.tlg001.opp-grc1	πάλιν δὲ ἐπεὶ μεσότητι εἴρηκεν, ὑπομιμνήσκει ὥς ἐστι μεσότης διὰ τὸ μεταξὺ εἶναι δύο κακιῶν τῆς τε καθ’ ὑπερβολὴν καὶ τῆς κατ’ ἔλλειψιν·	πάλιν δέ ἐπεί μεσότης λέγω , ὑπομιμνήσκω ὡς εἰμί  διά ὁ μεταξύ εἰμί γε κακία ὁ τε κατά ὑπερβολή καί ὁ κατά ἔλλειψις ·
1219519	tlg0615.tlg001.opp-grc1	πῶς δ’ ἐστὶν ἡ μὲν καθ’ ὑπερβολήν, ἡ δὲ κατ’ ἔλλειψιν, καὶ τοῦτο ὑπομιμνήσκει.	πῶς  εἰμί ὁ μέν κατά ὑπερβολή , ὁ δέ κατά ἔλλειψις , καί οὗτος ὑπομιμνήσκω .
1219520	tlg0615.tlg001.opp-grc1	ὑπερβολαὶ γὰρ καὶ ἐλλείψεις αἱ κακίαι τῷ τὰς μὲν ἐλλείπειν, τὰς δὲ ὑπερβάλλειν ἔν τε τοῖς πάθεσι καὶ ταῖς πράξεσιν, ἡ δὲ ἀρειὴ τὸ μέσον καὶ αἱρεῖται καὶ εὑρίσκει.	ὑπερβολή γάρ καί ἐλλείπω ὁ κακία τῷ ὁ μέν ἐλλείπω , ὁ δέ ὑπερβάλλω ἐν τε ὁ πάθος καί ὁ πρᾶξις , ὁ δέ  ὁ μέσος καί αἱρέω καί εὑρίσκω .
1219521	tlg0615.tlg001.opp-grc1	Ὅ δὲ ἑξῆς ἐπιφέρει ἔχει τινὰ ἀπορίαν·	δέ ἑξῆς ἐπιφέρω ἔχω  ἀπορία ·
1219522	tlg0615.tlg001.opp-grc1	φησὶ γὰρ κατὰ μὲν τὴν οὐσίαν καὶ τὸν λόγον τὸν τὸ τί ἦν εἶναι λέγοντα μεσότητα εἶναι τὴν ἀρετήν·	φημί γάρ κατά μέν ὁ οὐσία καί ὁ λόγος ὁ ὁ τι εἰμί εἰμί λέγω μεσότης εἰμί ὁ ἀρετή ·
1219523	tlg0615.tlg001.opp-grc1	κατὰ δὲ τὸ ἄριστον καὶ τὸ εὖ ἀκρότητα.	κατά δέ ὁ ἄριστον καί ὁ εὖ ἀκρότης .
1219524	tlg0615.tlg001.opp-grc1	ἢ μήποτε τοῦτο μὲν αὐτῇ ὑπάρχει, τὸ δὲ εἶναι καὶ ἡ οὐσία αὐτῆς κατὰ τὴν μεσότητα εὑρίσκεται.	τίη μήποτε οὗτος μέν αὐτός ὑπάρχω , ὁ δέ εἰμί καί ὁ οὐσία αὐτός κατά ὁ μεσότης εὑρίσκω .
1219525	tlg0615.tlg001.opp-grc1	ὥσπερ γὰρ καὶ ἐν ταῖς ἀποδείξεσι τὸ κυριώτατον ἡ αἰτία, ὃς καὶ μέσος ὅρος ἐστίν, οὕτως καὶ ἐν τοῖς ὁρισμοῖς, εἴ τις παραλαμβάνειν δύναιτο, δι’ ἣν τοιοῦ- τόν ἐστι τὸ ὁριστόν, τὸ εἶναι αὐτῷ τί ποτέ ἐστιν ἀποδώσει.	ὥσπερ γάρ καί ἐν ὁ ἀπόδειξις ὁ κύριος ὁ αἰτία , ὅς καί μέσος ὅρος εἰμί , οὕτως καί ἐν ὁ  , εἰ τις παραλαμβάνω δύναμαι , διά ὅς  - ὁ εἰμί ὁ  , ὁ εἰμί αὐτός τίς ποτε εἰμί ἀποδίδωμι .
1219526	tlg0615.tlg001.opp-grc1	εἴρηται δὲ περὶ τούτων ὑπ’ αὐτοῦ ἐν τοῖς Ὑστέροις ἀναλυτικοῖς.	λέγω δέ περί οὗτος ὑπό αὐτός ἐν ὁ  ἀναλυτικός .
1219527	tlg0615.tlg001.opp-grc1	ἔστι δὲ αἰτία τοῦ εἶναι ἀρετὴν ἑκάστην ἡ ἐν τοῖς πάθεσι καὶ ταῖς πράξεσι μεσότης.	εἰμί δέ αἰτία ὁ εἰμί ἀρετή ἕκαστος ὁ ἐν ὁ πάθος καί ὁ πρᾶξις  .
1219528	tlg0615.tlg001.opp-grc1	τὸ δὲ εἶναι ἀκρότητα τὴν κατὰ τὸ εὖ ἔοικε τοῖς ὑπ’ αὐτοῦ λεγομένοις συμπερασματικοῖς ὅροις, οἷον τί ἐστι τετραγωνισμός·	ὁ δέ εἰμί ἀκρότης ὁ κατά ὁ εὖ ἔοικα ὁ ὑπό αὐτός λέγω  ὅρος , οἷος τίς εἰμί  ·
1219529	tlg0615.tlg001.opp-grc1	ὁ μὲν τοιοῦτος ὁρισμὸς‘ μέσης εὕρεσις’ ἀποδίδωσι τὴν αἰτίαν, καθ’ ἣν τετραγωνίζεται, ὁ δὲ εἰπὼν τετραγωνισμὸν εἶναι τὸ ἴσον εὑρεῖν ἑτερομήκει τετράγωνον συμπέρασμα εἴρηκε.	ὁ μέν τοιοῦτος ὁρισμός ‘ μέσος εὕρεσις ’ ἀποδίδωμι ὁ αἰτία , κατά ὅς  , ὁ δέ λέγω  εἰμί ὁ ἴσος εὑρίσκω  τετράγωνος συμπέρασμα λέγω .
1219530	tlg0615.tlg001.opp-grc1	δείξας γὰρ ὁ γεωμέτρης τῷ ἀπὸ τῆς μέσης τῶν περιεχουσῶν τὸ ἑτερόμηκες πλευρῶν ἴσον τὸ ὑπὸ τῶν πλευρῶν περιεχόμενον ἐποίσει συμπέρασμα ἴσον ἄρα εὕρηται τετράγωνον τῷ δοθέντι ἑτερομήκει.	δείκνυμι γάρ ὁ  τῷ ἀπό ὁ μέσος ὁ περιέχω ὁ ἑτερομήκης πλευρά ἴσος ὁ ὑπό ὁ πλευρόν  ἐπιφέρω συμπέρασμα ἴσος ἄρα εὑρίσκω τετράγωνος τῷ δίδωμι  .
1219531	tlg0615.tlg001.opp-grc1	τοιοῦτον δὲ καὶ ἐπὶ τῶν τῆς ἀρετῆς ὁρισμῶν ἐστιν·	τοιοῦτος δέ καί ἐπί ὁ ὁ ἀρετή ὁρισμός εἰμί ·
1219532	tlg0615.tlg001.opp-grc1	ὁ μὲν γὰρ εἰπὼν μεσότητα εἶναι καὶ ἐν πάθεσι καὶ πράξεσι τὴν οὐσίαν αὐτῆς εἴρηκε καὶ δι’ ὅ ἐστιν ἀρειή, ὁ δὲ εἰπὼν ἀκρότητα κατὰ τὸ εὖ ὥσπερ.	ὁ μέν γάρ λέγω μεσότης εἰμί καί ἐν πάθος καί πρᾶξις ὁ οὐσία αὐτός λέγω καί διά ὅς εἰμί ἀρειά , ὁ δέ λέγω ἀκρότης κατά ὁ εὖ ὥσπερ .
1219533	tlg0615.tlg001.opp-grc1	συμπέρασμα λέγει.	συμπέρασμα λέγω .
1219534	tlg0615.tlg001.opp-grc1	ἐπεὶ γάρ ἐστι μεσότης ἐν πάθεσι καὶ πράξεσιν, εἴη ἂν ἀκρότης κατὰ τὸ εὖ.	ἐπεί γάρ εἰμί  ἐν πάθος καί πρᾶξις , ἐάω ἐάν  κατά ὁ εὖ .
1219535	tlg0615.tlg001.opp-grc1	Οὐ πᾶν δέ φησι πάθος οὐδὲ πᾶσαν πρᾶξιν ἐπιδέχεσθαι τὴν μεσότητα.	οὐ πᾶς δέ φημί πάθος οὐδέ πᾶς πρᾶξις ἐπιδέχομαι ὁ μεσότης .
1219536	tlg0615.tlg001.opp-grc1	ἔνια μὲν γὰρ τῶν παθῶν ἐπιδέχεται μεσότητα, ὅταν ᾧ δεῖ κα ἐφ’ ὅσον δεῖ καὶ πρὸς οὓς δεῖ καὶ κατὰ τοὺς ἄλλους γίνηται διορισμούς·	μέν γάρ ὁ πάθη ἐπιδέχομαι μεσότης , ὅταν ὅς δέω  ἐπί ὅσος δέω καί πρός ὅς δέω καί κατά ὁ ἄλλος γίγνομαι  ·
1219537	tlg0615.tlg001.opp-grc1	ἢ γάρ ἐστι καθ’ ὑπερβολήν, ὅταν ἐπὶ πλεῖον ἤδη γίνηται ἢ πρὸς οὓς οὐ δεῖ ἢ ὅλως κατὰ παράβασίν τινα τῶν διωρισμένων περὶ τῆς μεσότητος·	τίη γάρ εἰμί κατά ὑπερβολή , ὅταν ἐπί πλέως ἤδη γίγνομαι ἤ πρός ὅς οὐ δέω τίη ὅλος κατά   ὁ  περί ὁ μεσότης ·
1219538	tlg0615.tlg001.opp-grc1	τὸν αὐτὸν δὲ τρόπον καὶ ἡ κατ’ ἔλλειψιν ὀργὴ ἡμαρτημένον ἐστὶ τῷ ἐνδεῖν τοῦ προσήκοντος μέτρου.	ὁ αὐτός δέ τρόπος καί ὁ κατά ἔλλειψις ὀργή ἁμαρτάνω εἰμί τῷ ἐνδέω ὁ προσήκω  .
1219539	tlg0615.tlg001.opp-grc1	καὶ μὴν ἐπὶ τῶν πράξεων εἰσί τινες ἐπιδεχόμεναι μεσότητα καὶ ὑπερβολὴν καὶ ἔνδειαν, οἷον ἐπὶ δόσει χρημάτων καὶ γὰρ ἐπὶ πλέον δοῦναι ἔστιν, ὅπερ τῆς καθ’ ὑπερβολὴν κακίας ἔργον, καὶ ἐπ’ ἔλαττον, ὅπερ τῆς κατ’ ἔλλειψιν, καὶ μέσως, ὅπερ μόνης τῆς ἀρετῆς ἔργον ἐστίν.	καί μήν ἐπί ὁ πρᾶξις εἰμί τις  μεσότης καί ὑπερβολή καί ἔνδεια , οἷος ἐπί δόσις χρῆμα καί γάρ ἐπί πολύς δίδωμι εἰμί , ὅς ὁ κατά ὑπερβολή κακία ἔργον , καί ἐπί ἐλάσσων , ὅς ὁ κατά ἔλλειψις , καί μέσος , ὅς μόνος ὁ ἀρετή ἔργον εἰμί .
1219540	tlg0615.tlg001.opp-grc1	ἐν μὲν οὖν τοῖς τοιούτοις πάθεσι καὶ ταῖς τοιαύταις πράξεσίν ἐστι καὶ ἡ ὑπερβολὴ καὶ ἡ μεσότης καὶ ἡ ἔνδεια·	ἐν μέν οὖν ὁ τοιοῦτος πάθος καί ὁ τοιοῦτος πρᾶξις εἰμί καί ὁ ὑπερβολή καί ὁ μεσότης καί ὁ ἔνδεια ·
1219541	tlg0615.tlg001.opp-grc1	ἔνια δὲ πάθη καὶ ἔνιαι πράξεις οὐκ ἐπιδέχονται τὸ μέσον, ἀλλ’ εὐθύς, ὥς φησιν, ὠνόμασται τὸ πάθος ἢ ἡ πρᾶξις μετὰ τῆς φαυλότητος συνειλημμένα·	ἔνιοι δέ πάθος καί ἔνιοι πρᾶξις  ἐπιδέχομαι ὁ μέσος , ἀλλά εὐθύς , ὡς φημί , ὀνομάζω ὁ πάθος ἤ ὁ πρᾶξις μετά ὁ φαυλότης συλλαμβάνω ·
1219542	tlg0615.tlg001.opp-grc1	οἷον ἐν μὲν πάθεσιν ἐπιχαιρεκακία φθόνος ἀναισχυντία, ἐν δὲ πράξεσι μοιχεία κλοπὴ ἀνδροφονία.	οἷος ἐν μέν πάθος  φθόνος  , ἐν δέ πρᾶξις  κλοπή  .
1219543	tlg0615.tlg001.opp-grc1	οὐ γὰρ ἔστιν εἰπεῖν τὸν μέν τινα εἶναι μέσον φθόνον καὶ ἐπαινετόν, τὸν δέ τινα ὑπερβάλλοντα καὶ τοῦτον ψεκτόν, ἀλλ’ ἁπλῶς ὁ φθόνος κακόν·	οὐ γάρ εἰμί λέγω ὁ μέν τις εἰμί μέσος φθόνος καί ἐπαινετός , ὁ δέ τις ὑπερβάλλω καί οὗτος ψεκτός , ἀλλά ἁπλόος ὁ φθόνος κακός ·
1219544	tlg0615.tlg001.opp-grc1	ὁμοίως καὶ ἐπιχαιρεκακία καὶ ἀναισχυντία.	ὅμοιος καί ἐπιχαιρεκακία καί  .
1219545	tlg0615.tlg001.opp-grc1	τὸν αὐτὸν δὲ τρόπον καὶ ἐπὶ τῶν εἰρημένων πράξεων ἔχει·	ὁ αὐτός δέ τρόπος καί ἐπί ὁ λέγω πρᾶξις ἔχω ·
1219546	tlg0615.tlg001.opp-grc1	οὔτε γὰρ ἐν τῇ μοιχείᾳ οὔτε ἐν τῇ ἀνδροφο.	οὔτε γάρ ἐν ὁ μοιχεία οὔτε ἐν ὁ  .
1219547	tlg0615.tlg001.opp-grc1	νίᾳ οὔτε ἐν τῇ κλοπῇ κατορθοῦν οὐδέποτε ἔστιν οὔτε δὲ εὖ ἢ τὸ μέσον ἐπαινετὸν ἐν αὐτοῖς ἐν τῷ ἣν δεῖ καὶ ὅτε δεῖ καὶ ὡς δεῖ μοιχεύειν, ἀλλ’ ἁπλῶς τὸ ποιεῖν ὁτιοῦν κακὸν καὶ ἀδίκημά ἐστιν.	οὔτε ἐν ὁ  κατορθόω οὐδέποτε εἰμί οὔτε δέ εὖ τίη ὁ μέσος  ἐν αὐτός ἐν τῷ ὅς δέω καί ὅτε δέω καί ὡς δέω μοιχεύω , ἀλλά ἁπλόος ὁ ποιέω ὁτιοῦν κακός καί  εἰμί .
1219548	tlg0615.tlg001.opp-grc1	οὐ δεῖ δὲ ταράττεσθαι ὑπὸ τῶν λεγόντων τινὰς μοιχείας ἐπαινετάς, οἷον εἴ τις τυράννου γυναῖκα διαφθέίρας τούτῳ τῷ τρόπῳ προσελθὼν καὶ ἀποκτείνας τὸν τύραννον ἐλευθερώσεις τὴν πατρίδα·	οὐ δέω δέ ταράσσω ὑπό ὁ λέγω  μοιχεία ἐπαινετός , οἷος εἰ τις τύραννος γυνή  οὗτος ὁ τρόπος προσέρχομαι καί ἀποκτείνω ὁ τύραννος ἐλευθερόω ὁ πατρίς ·
1219549	tlg0615.tlg001.opp-grc1	οὐ γάρ ἐστι μοιχεία τοῦτο, ἀλλά νῦν ἐμφαίνει κατὰ τοὔνομα ἡ μοιχεία τὴν ἀκολασίαν καὶ τὴν ἧτταν τῶν ἡδονῶν καὶ τὴν παρανομίαν, καθάπερ καὶ ἡ ἀνδροφονία οὐ λέγεται τὸ ὅπως ἀποκτεῖναί τινα·	οὐ γάρ εἰμί μοιχεία οὗτος , ἀλλά νῦν ἐμφαίνω κατά ὄνομα ὁ μοιχεία ὁ ἀκολασία καί ὁ ἧσσα ὁ ἡδονή καί ὁ παρανομία , καθά καί ὁ ἀνδροφονία οὐ λέγω ὁ ὅπως ἀποκτείνω τις ·
1219550	tlg0615.tlg001.opp-grc1	ἀποκτείναι γὰρ ἄν τις δικαίως καὶ ἐπαινετῶς, οἷον πολέμιον λῃστήν·	ἀποκτείνω γάρ ἄν τις δίκαιος καί  , οἷος πολέμιος λῃστής ·
1219551	tlg0615.tlg001.opp-grc1	ἀλλ’ ἐν τῷ ὀνόματι τῆς ἀνδροφονίας παρείληπται τὸ ἀδίκως καὶ παρανόμως ἀποκτεῖναι.	ἀλλά ἐν τῷ ὄνομα ὁ ἀνδροφονία παραλαμβάνω ὁ ἄδικος καί παράνομος ἀποκτείνω .
1219552	tlg0615.tlg001.opp-grc1	† Χεῖρον δὲ εἰς τὸ μὴ εἶναι μεσότητα μηδεμίαν ἐν ταῖς εἰρημέναις πράξεσι, μεταβαίνει ἐπὶ τὰς μοχθηρὰς ἕξεις, ἐκ τούτων ἐνδεικνύμενος τὸ προ κείμενον αὐτῷ.	†  δέ εἰς ὁ μή εἰμί μεσότης μηδείς ἐν ὁ  πρᾶξις , μεταβαίνω ἐπί ὁ  ἕξις , ἐκ οὗτος ἐνδείκνυμι ὁ   αὐτός .
1219553	tlg0615.tlg001.opp-grc1	ὥσπερ γὰρ περὶ τὸ ἀδικεῖν καὶ ἀκολασταίνειν καὶ δειλαίνειν οὐκ ἔστιν ὑπερβολὴ καὶ ἔλλειψις καὶ μεσότης, ἀλλ ' ὅλη ἡ τοιαύτη ἕξις ἡμαρτημένη ἐστίν, οὕτως οὐδ' ἐν ταῖς εἰρημέναις πράξεσιν ἔνεστιν ὑπερβολὴ καὶ μεσότης καὶ ἔνδεια.	ὥσπερ γάρ περί ὁ ἀδικέω καί ἀκολασταίνω καί δειλαίνω οὐ εἰμί ὑπερβολή καί ἔλλειψις καί μεσότης ,   ὅλος ὁ τοιοῦτος ἕξις ἁμαρτάνω εἰμί , οὕτως  ' ἐν ὁ  πρᾶξις ἔνειμι ὑπερβολή καί  καί  .
1219554	tlg0615.tlg001.opp-grc1	ζηιεῖται δὲ πῶς εἶπε περὶ τὸ ἀδικεῖν καὶ δειλαίνειν μὴ εἶναι μεσότητα καὶ ὑπερβολὴν καὶ ἔλλειψιν.	δέ πῶς λέγω περί ὁ ἀδικέω καί δειλαίνω μή εἰμί μεσότης καί ὑπερβολή καί ἔλλειψις .
1219555	tlg0615.tlg001.opp-grc1	εἰ γάρ εἰσιν ἀνέσεις καὶ ἐπιτάσεις ταῖς κακίαις, εἴη ἄν καὶ ἐπίτασις καὶ ἄνεσις ἐν τί δειλία, ὁμοίως καὶ ἐν τῇ ἀκολασίᾳ, ὥστε οὐδὲν κωλύει ὐπερβολῆς ὑπερβολὴν εἶναι ἄλλην ἄλλης μᾶλλον καὶ ἐλλείψεως ἔλλειψιν.	εἰ γάρ εἰμί  καί ἐπίτασις ὁ κακία , εἰμί ἄν καί ἐπίτασις καί ἄνεσις ἐν τίς δειλία , ὅμοιος καί ἐν ὁ ἀκολασία , ὥστε  κωλύω  ὑπερβολή εἰμί ἄλλος ἄλλος μᾶλλον καί ἔλλειψις ἔλλειψις .
1219556	tlg0615.tlg001.opp-grc1	ἡ διχῶς λέγεται ἡ ὑπερβολὴ καὶ ἡ ἔλλειψις ἡ ἐν ταῖς κακίαις, ἡ μὲν ἐν αὐτῇ τῇ κακίᾳ ὥστε ἄλλην ἄλλης ὑπερβάλλειν μᾶλλον καὶ ἄλλην ἄλλης μᾶλλον ἐνδεῖν, ἄλλως δὲ λέγεται ἡ ὑπερβολὴ καὶ ἡ ἔλλειψις ὡς πρὸς τὴν μεσότητα καὶ ἀρετήν.	ὁ διχῶς λέγω ὁ ὑπερβολή καί ὁ ἔλλειψις ὁ ἐν ὁ κακία , ὁ μέν ἐν αὐτός ὁ κακία ὥστε ἄλλος ἄλλος ὑπερβάλλω μᾶλλον καί ἄλλος ἄλλος μᾶλλον ἐνδέω , ἄλλος δέ λέγω ὁ ὑπερβολή καί ὁ ἔλλειψις ὡς πρός ὁ μεσότης καί ἀρετή .
1219557	tlg0615.tlg001.opp-grc1	κατὰ μὲν οὖν τὸ πρότερον τῶν ῥηθέντων ἐνδέχεται ὑπερβάλὶο͂σθαι ἄλλην ὑπ’ ἄλλης κακίας καὶ ἐπιτείνεσθαι μᾶλλον καὶ ἀνίεσθαι, ὡς δὲ πρὸς τὴν μεσότητα σκοποῦντι οὐκ ἔστ·	κατά μέν οὖν ὁ πρότερος ὁ λέγω ἐνδέχομαι  ἄλλος ὑπό ἄλλος κακία καί ἐπιτείνω μᾶλλον καί ἀνίημι , ὡς δέ πρός ὁ μεσότης σκοπέω οὐ  ·
1219558	tlg0615.tlg001.opp-grc1	ι τῆς ὑπερ- βολῆς τὸ μὲν ὑπερβολὴ τὸ δὲ ἔλλειψις.	ὁ  - βολή ὁ μέν ὑπερβολή ὁ δέ ἔλλειψις .
1219559	tlg0615.tlg001.opp-grc1	ἔσται γὰρ οὕτως τις, φησί, μεσό- μεσότης καὶ ἀρετὴ ἐν αὐτῇ τῇ κακίᾳ·	γάρ οὕτως τις , φημί ,  -  καί ἀρετή ἐν αὐτός ὁ κακία ·
1219560	tlg0615.tlg001.opp-grc1	τοῦτο δὲ ἀδύνατον.	οὗτος δέ ἀδύνατος .
1219561	tlg0615.tlg001.opp-grc1	κατὰ δὴ τοῦτον τὸν λόγον οὔτε ὑπερβολὴ ὑπερβολῆς ἔσται οὔτε ἔλλειψις ἐλλείψεως, ἵνα μὴ με- σότητες·	κατά δή οὗτος ὁ λόγος οὔτε ὑπερβολή ὑπερβολή  οὔτε ἔλλειψις ἔλλειψις , ἵνα μή  -  ·
1219562	tlg0615.tlg001.opp-grc1	ὦσιν ἐν ταῖς κακίαις.	εἰμί ἐν ὁ κακία .
1219563	tlg0615.tlg001.opp-grc1	ἔτι δὲ καὶ ἐκ τῶν ἀρετῶν δῆλον·	ἔτι δέ καί ἐκ ὁ ἀρετή δῆλος ·
1219564	tlg0615.tlg001.opp-grc1	ὥσπερ γὰρ τῆς σωφροσύνης καὶ τῆς ἀνδρείας καὶ ὅλως τῆς ἀρετῆς μεσότητος οὔσης οὐκ ἔστιν ἐν αὐτῇ τῇ μεσότητι τὸ μὲν ὑπερβολὴ τὸ δὲ ἔλλειψις τὸ δὲ μέσον, διὰ τὸ <τὸ> μέσον εἶναι ἄκρον κατὰ τὸ εὖ καὶ ὡρίσθαι·	ὥσπερ γάρ ὁ σωφροσύνη καί ὁ ἀνδρεία καί ὅλος ὁ ἀρετή μεσότης εἰμί οὐ εἰμί ἐν αὐτός ὁ μεσότης ὁ μέν ὑπερβολή ὁ δέ ἔλλειψις ὁ δέ μέσος , διά ὁ  μέσος εἰμί ἄκρος κατά ὁ εὖ καί ὁρίζω ·
1219565	tlg0615.tlg001.opp-grc1	τοῦτο δὲ εἰ ἔχει οὕτως, οὐδὲ τῶν κακιῶν ἐστι μεσότης οὐδ’ ὑπερβολὴ καὶ ἔλλειψις, ἀλλ’ ὡς ἄν πράττηται τὰ κατὰ τὴν κακίαν, ἁμαρτάνεται, καὶ τῶν ἐφ’ ἑκάτερα μερῶν τῆς ἀρετῆς τὸ μὲν ὑπερβολή ἐστι πᾶν, τὸ δ’ ἔλλειψις.	οὗτος δέ εἰ ἔχω οὕτως , οὐδέ ὁ  εἰμί  οὐδέ ὑπερβολή καί ἔλλειψις , ἀλλά ὡς ἄν  ὁ κατά ὁ κακία , ἁμαρτάνω , καί ὁ ἐπί ἑκάτερος μέρος ὁ ἀρετή ὁ μέν ὑπερβολή εἰμί πᾶς , ὁ  ἔλλειψις .
1219566	tlg0615.tlg001.opp-grc1	εἰ δὲ ταῦτα οὕτως ἔχει, οὐδὲν θαυμαστὸν καὶ τὰς εἰρημένας πράξεις μοιχείαν καὶ κλοπὴν μὴ ἔχειν τὸ μέσον ἀλλ’ ὅλην εἶναι τὴν πρᾶξιν κακήν, ὁμοίως δὲ καὶ τὰ λεχθέντα πάθη.	εἰ δέ οὗτος οὕτως ἔχω , οὐδείς θαυμαστός καί ὁ  πρᾶξις μοιχεία καί κλοπή μή ἔχω ὁ μέσος ἀλλά ὅλος εἰμί ὁ πρᾶξις κακός , ὅμοιος δέ καί ὁ λέγω πάθος .
1219567	tlg0615.tlg001.opp-grc1	ὅπως ἄν γίνηται, ἡμαρτημένα εἶναι, φθόνον ἐπιχαιρεκακίαν ἀναισχυντίαν.	ὅπως ἄν γίγνομαι , ἁμαρτάνω εἰμί , φθόνος ἐπιχαιρεκακία ἀναισχυντία .
1219568	tlg0615.tlg001.opp-grc1	ἀρ’ οὖν πάθη μέν ἐστιν οὐκ ἐπιδεχόμενα τὸ εὗ, ὁμοίως δὲ καὶ πράξεις, πάθη δὲ ἕτερα οὐκ ἔστιν οὐδὲ πράξεις καὶ τὸ φαῦλον ὅλως οὐκ ἐπιδεχόμεναι;	οὖν πάθος μέν εἰμί οὐ  ὁ  , ὅμοιος δέ καί πρᾶξις , πάθος δέ ἕτερος οὐ εἰμί οὐδέ πρᾶξις καί ὁ φαῦλος ὅλος οὐ  ;
1219569	tlg0615.tlg001.opp-grc1	ἢ οὐκ ἄπορον καὶ τοιαῦτα εὑρεῖν οἷον νέμεσιν μὲν καὶ αἰδῶ, πάθη ἐπαινετά, ἀριστείας τυραννοκτονίας, πράξεις ἐπαινετὰς συνειλημμένον ἐχούσας τὸ εὖ ἐν τῶ ὀνόματι;	τίη οὐ ἄπορος καί τοιοῦτος εὑρίσκω οἷος νέμεσις μέν καί αἰδώς , πάθος ἐπαινετός , ἀριστεία τυραννοκτονία , πρᾶξις  συλλαμβάνω ἔχω ὁ εὖ ἐν  ὄνομα ;
