id	filename	tokens	lemmas
708459	tlg0551.tlg008.perseus-grc2	ἡ δὲ πόλις, ἀπαγγελθεισης τῆς συμφορᾶς, οἱ μὲν ἐν ταῖς ὁδοῖς ἐθρήνουν τε τοὺς οἰκείους ἀνακαλοῦντες, καὶ σφᾶς ὡς αὐτικα ἁλωσομένους ὠλοφύροντο, αἱ δὲ γυναῖκες ἱκέτευον ἐν τοῖς ἱεροῖς μετὰ τῶν τέκνων λῆξαί ποτε τὰς συμφορὰς τῇ πόλει, οἱ δʼ ἄρχοντες θυσίαις τε καὶ εὐχαῖς ἱλάσκοντο τοὺς θεούς, εἴ τι μήνιμα ἐνοχλεῖ, κορεσθῆναι τοῖς γεγονόσιν.	ὁ δέ πόλις ,  ὁ συμφορά , ὁ μέν ἐν ὁ ὁδός θρηνέω τε ὁ οἰκεῖος ἀνακαλέω , καί σφεῖς ὡς   ὀλοφύρομαι , ὁ δέ γυνή ἱκετεύω ἐν ὁ ἱερός μετά ὁ τέκνον λήγω ποτε ὁ συμφορά ὁ πόλις , ὁ δέ ἄρχων θυσία τε καί εὐχή ἱλάομαι ὁ θεός , εἰ τι μήνιμα ἐνοχλέω , κορέννυμι ὁ γίγνομαι .
708460	tlg0551.tlg008.perseus-grc2	ἡ δὲ βουλὴ Κόιντον μὲν Φάβιον, τὸν συγγραφέα τῶνδε τῶν ἔργων, ἐς Δελφοὺς ἔπεμπε χρησόμενον περὶ τῶν παρόντων, δούλους δὲ ἐς ὀκτακισχιλίους τῶν δεσποτῶν ἐπιδόντων ἠλευθέρου, ὅπλα τε καὶ τόξα τοὺς ἐν ἄστει πάντας ἐργάζεσθαι παρεσκεύαζε, καὶ συμμάχους, καὶ ὥς, τινὰς συνέλεγεν.	ὁ δέ βουλή Κόϊντος μέν Φάβιος , ὁ  ὅδε ὁ ἔργον , εἰς Δελφοί πέμπω  περί ὁ πάρειμι , δοῦλος δέ εἰς ὀκτακισχίλιοι ὁ δεσπότης   , ὅπλον τε καί τόξον ὁ ἐν ἄστυ πᾶς ἐργάζομαι παρασκευάζω , καί σύμμαχος , καί ὡς ,  συλλέγω .
708461	tlg0551.tlg008.perseus-grc2	Κλαύδιόν τε Μάρκελλον μέλλοντα πλεῖν ἐς Σικελίαν, ἐς τὸν Ἀννίβου πόλεμον μετέφερεν.	Κλαύδιος τε Μάρκελλος μέλλω πλέω εἰς Σικελία , εἰς ὁ Ἀννίβας πόλεμος μεταφέρω .
708462	tlg0551.tlg008.perseus-grc2	ὁ δὲ τὸν μὲν στόλον ἐμερίσατο τῷ συνάρχῳ Φουρίῳ, καὶ τὸ μέρος ἔπεμψεν ἐς τὴν Σικελίαν, αὐτὸς δὲ τοὺς δούλους ἄγων καὶ ὅσους ἄλλους ἐδύνατο τῶν πολιτῶν ἢ συμμάχων, γενομένους ἅπαντας ἐς μυρίους πεζοὺς καὶ δισχιλίους ἱππέας, ἐς τὸ Τεανὸν παρῆλθε, καὶ ὅ τι πράξειν ὁ Ἀννίβας μέλλοι παρεφύλασσεν.	ὁ δέ ὁ μέν στόλος μερίζω τῷ  Φούριος , καί ὁ μέρος πέμπω εἰς ὁ Σικελία , αὐτός δέ ὁ δοῦλος ἄγω καί ὅσος  δύναμαι ὁ πολίτης τίη σύμμαχος , γίγνομαι ἅπας εἰς μυρίος πεζός καί δισχίλιοι ἱππεύς , εἰς ὁ  παρέρχομαι , καί ὅς  πράσσω ὁ Ἀννίβας μέλλω παραφυλάσσω .
708463	tlg0551.tlg008.perseus-grc2	Ἀννιβου δὲ δόντος τοῖς αἰχμαλώτοις ἐς Ῥώμην πρεσβεύσασθαι περὶ σφῶν, εἰ θέλοιεν αὐτοὺς οἱ ἐν ἄστει λύσασθαι χρημάτων, καὶ τοὺς αἱρεθέντας ὑπʼ αὐτῶν τρεῖς, ὧν ἡγεῖτο Γναῖος Σεμπρώνιος, ὁρκώσαντος ἐς αὐτὸν ἐπανήξειν, οἱ μὲν οἰκεῖοι τῶν ἁλόντων, περιστάντες τὸ βουλευτήριον, ἐπηγγέλλοντο λύσεσθαι τοὺς οἰκείους ἕκαστος ἰδίοις χρήμασι, καὶ παρεκάλουν τὴν βουλὴν τοῦτο σφίσιν ἐπιτρέψαι, καὶ ὁ δῆμος αὐτοῖς συνεδάκρυε καὶ συνεδεῖτο·	δέ δίδωμι ὁ αἰχμάλωτος εἰς Ῥώμη πρεσβεύω περί σφεῖς , εἰ  αὐτός ἕ ἐν ἄστυ λύω χρῆμα , καί ὁ αἱρέω ὑπό αὐτός  , ὅς  Γνάιος  , ὁρκόω εἰς αὐτός ἐπανήκω , ὁ μέν οἰκεῖος ὁ  , περιίστημι ὁ βουλευτήριον , ἐπαγγέλλω λύω ὁ οἰκεῖος ἕκαστος ἴδιος χρῆμα , καί παρακαλέω ὁ βουλή οὗτος σφεῖς ἐπιτρέπω , καί ὁ δῆμος αὐτός συνδακρύω καί συνδέω ·
708464	tlg0551.tlg008.perseus-grc2	τῶν δὲ βουλευτῶν οἱ μὲν οὐκ ἠξίουν ἐπὶ τοσαῖσδε συμφοραῖς ἄλλους τοσούσδε βλαβῆναι τὴν πόλιν, οὐδὲ δούλους μὲν ἐλευθεροῦν τοὺς δὲ ἐλευθέρους ὑπερορᾶν, οἱ δʼ οὐκ ᾤοντο δεῖν αὐτοὺς ἐθίζειν τῷδε τῷ ἐλέῳ φεύγειν, ἀλλʼ ἢ νικᾶν μαχομένους ἢ ἀποθνήσκειν ὡς οὐκ ὂν οὐδʼ ὑπὸ τῶν οἰκείων ἐλεεῖσθαι τὸν φυγόντα.	ὁ δέ  ὁ μέν οὐ ἀξιόω ἐπί  συμφορά ἄλλος τοσόσδε  ὁ πόλις , οὐδέ δοῦλος μέν ἐλευθερόω ὁ δέ ἐλεύθερος ὑπεροράω , ὁ δέ οὐ οἴομαι δέω αὐτός ἐθίζω ὅδε τῷ ἔλεος φεύγω ,  τίη νικάω  ἤ ἀποθνῄσκω ὡς οὐ  οὐδέ ὑπό ὁ οἰκεῖος ἐλεέω ὁ φεύγω .
708465	tlg0551.tlg008.perseus-grc2	πολλῶν δὲ παραδειγμάτων ἐς ἑκάτερα λεχθέντων, οὐκ ἐπέτρεψεν ἡ βουλὴ τοῖς συγγενέσι λύσασθαι τοὺς αἰχμαλώτους, ἡγουμένη, πολλῶν σφίσιν ἔτι κινδύνων ἐπόντων, οὐ συνοίσειν ἐς τὸ μέλλον τὴν ἐν τῷ παρόντι φιλανθρωπίαν, τὸ δʼ ἀπάνθρωπον, εἰ καὶ σκυθρωπὸν εἴη, πρός τε τὰ μέλλοντα χρήσιμον ἔσεσθαι καὶ ἐν τῷ παρόντι καταπλήξειν Ἀννίβαν τῷ τολμήματι.	πολύς δέ παράδειγμα εἰς ἑκάτερος λέγω , οὐ ἐπιτρέπω ὁ βουλή ὁ  λύω ὁ αἰχμάλωτος ,  , πολύς σφεῖς ἔτι κίνδυνος ἔπειμι , οὐ συμφέρω εἰς ὁ μέλλω ὁ ἐν ὁ πάρειμι φιλανθρωπία , ὁ δέ  , εἰ καί σκυθρωπός εἰμί , πρός τε ὁ μέλλω χρήσιμος εἰμί καί ἐν ὁ πάρειμι καταπλήσσω Ἀννίβας τῷ τόλμημα .
708466	tlg0551.tlg008.perseus-grc2	Σεμπρώνιος οὖν καὶ οι σὺν αὐτῷ δύο τῶν αἰχμαλώτων πρὸς Ἀννίβαν ἐπανῄεσαν.	οὖν καί  σύν αὐτός γε ὁ αἰχμάλωτος πρός Ἀννίβας ἐπάνειμι .
708467	tlg0551.tlg008.perseus-grc2	ὁ δʼ ἔστι μὲν οὓς ἀπέδοτο τῶν αἰχμαλώτων, ἔστι δʼ οὓς ὑπʼ ὀργῆς ἀνῄρει, καὶ τοῖς σώμασι τὸν ποταμὸν ἐγεφύρου καὶ ἐπέρα.	ὁ δέ εἰμί μέν ὅς ἀποδίδωμι ὁ αἰχμάλωτος , εἰμί δέ ὅς ὑπό ὀργή ἀναιρέω , καί ὁ σῶμα ὁ ποταμός  καί  .
708468	tlg0551.tlg008.perseus-grc2	ὅσοι δʼ ἦσαν ἀπὸ τῆς βουλῆς ἢ ἄλλως ἐπιφανεῖς, μονομαχεῖν αὐτοὺς ὑπὸ θεαταῖς τοῖς Λίβυσιν ἠνάγκασε, πατέρας τε υἱοῖς καὶ ἀδελφοὺς ἀδελφοῖς, οὐδὲν ἐκλείπων ὑπεροψίας ὠμῆς.	ὅσος δέ εἰμί ἀπό ὁ βουλή ἤ ἄλλος  , μονομαχέω αὐτός ὑπό θεατός ὁ Λίβυς ἀναγκάζω , πατήρ τε υἱός καί ἀδελφός ἀδελφός , οὐδείς ἐκλείπω ὑπεροψία ὠμός .
708469	tlg0551.tlg008.perseus-grc2	μετὰ δὲ τοῦτʼ ἐπιὼν τὰ ὑπὸ Ῥωμαίοις ἐλυμαίνετο, καὶ Πετηλίνοις μηχανήματα προσῆγεν.	μετά δέ  ἔπειμι ὁ ὑπό  λυμαίνομαι , καί Πετηλῖνος μηχάνημα προσάγω .
708470	tlg0551.tlg008.perseus-grc2	οἱ δʼ ὀλίγοι μὲν ἦσαν, ὑπὸ δὲ τόλμης μετὰ τῶν γυναικῶν ἐπεξέθεον αὐτῷ, καὶ πολλὰ καὶ γενναῖα ἔδρων, τάς τε μηχανὰς αὐτοῦ συνεχῶς ἐνεπίμπρασαν, οὐχ ἧσσον αὐτοῖς τῶν γυναικῶν ἀνδριζομένων.	ὁ δέ ὀλίγος μέν εἰμί , ὑπό δέ τόλμα μετά ὁ γυνή ἐπεκθέω αὐτός , καί πολύς καί γενναῖος δράω , ὁ τε μηχανή αὐτός συνεχής ἐμπίμπρημι , οὐ ἥσσων αὐτός ὁ γυνή ἀνδρίζω .
708471	tlg0551.tlg008.perseus-grc2	ὀλιγώτεροι δε γιγνόμενοι καθʼ ἕκαστον ἔργον ἐκακοπάθουν μάλιστα ὑπὸ λιμοῦ·	ὀλίγος   καθά ἕκαστος ἔργον κακοπαθέω μάλιστα ὑπό λιμός ·
708472	tlg0551.tlg008.perseus-grc2	καὶ ὁ Ἀννίβας αἰσθανόμενος περιετείχισεν αὐτούς, καὶ Ἄννωνα ἐπέστησε τῇ πολιορκίᾳ.	καί ὁ Ἀννίβας  περιτειχίζω αὐτός , καί Ἄννων ἐφίστημι ὁ πολιορκία .
708473	tlg0551.tlg008.perseus-grc2	οἱ δʼ, ἐπιτείνοντος αὐτοῖς τοῦ κακοῦ, πρῶτα μὲν τοῦς ἀχρείους σφῶν ἐς μάχας ἐξέβαλον ἐς τὸ μεσοτείχιον, καὶ κτιννυμένους ὑπὸ τοῦ Ἄννωνος ἐφεώρων ἀλύπως ὡς εὐμοιρότερον ἀποθνήσκοντας.	ὁ δέ , ἐπιτείνω αὐτός ὁ κακός , πρῶτος μέν  ἀχρεῖος σφεῖς εἰς μάχη ἐκβάλλω εἰς ὁ μεσοτείχιος , καί κτείνω ὑπό ὁ Ἄννων ἐφοράω ἄλυπος ὡς εὔμοιρος ἀποθνῄσκω .
708474	tlg0551.tlg008.perseus-grc2	τῷ δʼ αὐτῷ λόγῳ καὶ οἱ λοιποὶ πάμπαν ἀποροῦντες ἐξέδραμον ἐπὶ τοὺς πολεμίους, καὶ πολλὰ μὲν καὶ γενναῖα καὶ τότε ἔδρασαν, ὑπὸ δὲ ἀτροφίας καὶ ἀσθενείας σωμάτων οὐδʼ ὑποστρέψαι δυνάμενοι διεφθάρησαν ἅπαντες ὑπὸ τῶν Λιβύων.	τῷ δέ αὐτός λόγος καί ὁ λοιπός πάμπαν ἀπορέω2 ἐκτρέχω ἐπί ὁ πολέμιος , καί  μέν καί  καί τότε δράω , ὑπό δέ ἀτροφία καί ἀσθένεια σῶμα  ὑποστρέφω  διαφθείρω ἅπας ὑπό ὁ Λίβυς .
708475	tlg0551.tlg008.perseus-grc2	καὶ τὴν πόλιν εἷλεν ὁ Ἄννων, ἐκφυγόντων καὶ ὣς ἀπʼ αὐτῆς ὀλίγων τῶν δραμεῖν δυνηθέντων.	καί ὁ πόλις αἱρέω ὁ Ἄννων ,  καί ὡς ἀπό αὐτός ὀλίγος ὁ τρέχω δύναμαι .
708476	tlg0551.tlg008.perseus-grc2	τούτους διερριμμένους οἱ Ῥωμαῖοι σπουδῇ συνῆγον, καὶ γενομένους ἐς ὀκτακοσίους κατήγαγόν τε καὶ συνῴκισαν μετὰ τόνδε τὸν πόλεμον αὖθις ἐς τὴν πατρίδα, ἀγάμενοι τῆς τε περὶ σφᾶς εὐνοίας καὶ τοῦ παραδόξου τῆς προθυμίας.	οὗτος  ὁ  σπουδή συνάγω , καί γίγνομαι εἰς ὀκτακόσιοι  τε καί συνοικίζω μετά  ὁ πόλεμος αὖθις εἰς ὁ πατρίς ,  ὁ τε περί σφεῖς εὔνοια καί ὁ παράδοξος ὁ προθυμία .
708477	tlg0551.tlg008.perseus-grc2	τῶν δὲ Κελτιβήρων ἱππέων, οἳ ἐμισθοφόρουν Ἀννίβᾳ, λαμπρῶς ἀγωνιζομένων, ὅσοι Ῥωμαίων ἐστρατήγουν ἐν Ἰβηρίᾳ, τοσούσδε ἑτέρους τὰς πόλεις τὰς ὑπὸ σφίσιν αἰτήσαντες ἐς ἀντίπαλον ἐκείνων ἔπεμψαν ἐς τὴν Ἰταλίαν, οἳ τοῖς ὁμοεθνέσιν, ὅτε πλησίον Ἀννίβου στρατοπεδεύοιεν, ἀναμιγνύμενοι μετέμειθον αὐτούς.	ὁ δέ Κελτίβηρες ἱππεύς , ὁ μισθοφορέω  , λαμπρός  , ὅσος  στρατηγέω ἐν Ἰβηρία , τοσόσδε ἕτερος ὁ πόλις ὁ ὑπό σφεῖς αἰτέω εἰς ἀντίπαλος ἐκεῖνος πέμπω εἰς ὁ Ἰταλία , ὁ ὁ ὁμοεθνής , ὅτε πλησίος Ἀννίβας στρατοπεδεύω ,   αὐτός .
708478	tlg0551.tlg008.perseus-grc2	καὶ πολλῶν μετατιθεμένων τε καὶ αὐτομολούντων ἢ ἀποδιδρασκόντων οὐδὲ τὸ λοιπὸν ἦν ἔτι τῷ Ἀννίβᾳ πιστόν, ὑποπτευόμενόν τε ὑπʼ ἐκείνου καὶ ὑποπτεύοντες αὐτόν.	καί πολύς  τε καί αὐτομολέω ἤ ἀποδιδράσκω οὐδέ ὁ λοιπός εἰμί ἔτι ὁ Ἀννίβας πιστόν , ὑποπτεύω τε ὑπό  καί ὑποπτεύω αὐτός .
708479	tlg0551.tlg008.perseus-grc2	κάκιον οὖν ἔπρασσεν ὁ Ἀννίβας τὸ ἀπὸ τοῦδε.	κακός οὖν πράσσω ὁ Ἀννίβας ὁ ἀπό ὅδε .
708480	tlg0551.tlg008.perseus-grc2	Ἀργύριππα δʼ ἐστὶ πόλις ἐν τῇ Δαυνίᾳ, ἣν Διομήδης ὁ Ἀργεῖος λέγεται κτίσαι.	δέ εἰμί πόλις ἐν ὁ Δαυνία , ὅς Διομήδης ὁ Ἀργεῖος λέγω κτίζω .
708481	tlg0551.tlg008.perseus-grc2	καί τις ἔκγονος εἶναι τοῦ Διομήδους νομιζόμενος, Δάσιος, ἀνὴρ εὐμετάβολός τε τὸ φρόνημα καὶ οὐ Διομήδους ἄξιος, Ῥωμαίων περὶ Κάννας τὴν μεγάλην ἧτταν ἡττημένων ἀπέστησε τὴν πατρίδα πρὸς τοὺς Λίβυας ἀπὸ Ῥωμαίων.	καί τις ἔκγονος εἰμί ὁ Διομήδης νομίζω , Δάσιος , ἀνήρ εὐμετάβολος τε ὁ φρόνημα καί οὐ  ἄξιος ,  περί  ὁ μέγας ἧσσα  ἀφίστημι ὁ πατρίς πρός ὁ Λίβυς ἀπό  .
708482	tlg0551.tlg008.perseus-grc2	τότε δʼ αὖ δυσπραγοῦντος Ἀννίβου ἔλαθεν ἐς Ῥώμην διιππεύσας, καὶ ἐπὶ τὴν βουλὴν ἐπαχθεὶς ἔφη δύνασθαι τὸ ἁμάρτημα ἰάσασθαι καὶ μεταβαλεῖν αὖθις ἐς Ῥωμαίους τὴν πόλιν.	τότε δέ αὖ δυσπραγέω Ἀννίβας λανθάνω εἰς Ῥώμη διιππεύω , καί ἐπί ὁ βουλή ἐπάγω φημί δύναμαι ὁ ἁμάρτημα ἰάομαι καί μεταβάλλω αὖθις εἰς  ὁ πόλις .
708483	tlg0551.tlg008.perseus-grc2	οἱ δʼ ὀλίγου μὲν αὐτὸν καὶ διέφθειραν, ἐξέβαλον δʼ εὐθὺς ἐκ τῆς πόλεως.	ὁ δέ  μέν αὐτός καί διαφθείρω , ἐκβάλλω δέ εὐθύς ἐκ ὁ πόλις .
708484	tlg0551.tlg008.perseus-grc2	ὁ δὲ καὶ τούσδε καὶ τὸν Ἀννίβαν δεδιὼς ἠλᾶτο ἀνὰ τὴν χώραν, καὶ ὁ μὲν Ἀννίβας αὐτοῦ τὴν γυναῖκα καὶ τὰ τέκνα ζῶντας ἔκαυσε, τὰ δὲ Ἀργύριππα ἑτέρων ἐνδόντων εἷλε Φάβιος Μάξιμος νυκτός, καὶ κτείνας ὅσους ηὗρε Λιβύων, φρουρὰν ἐπέστησε τῇ πόλει.	ὁ δέ καί ὅδε καί ὁ Ἀννίβας δείδω ἐλαύνω ἀνά ὁ χώρα , καί ὁ μέν Ἀννίβας αὐτός ὁ γυνή καί ὁ τέκνον ζήω καίω , ὁ δέ  ἕτερος  αἱρέω Φάβιος Μάξιμος νύξ , καί κτείνω ὅσος εὑρίσκω Λίβυς , φρουρά ἐφίστημι ὁ πόλις .
708485	tlg0551.tlg008.perseus-grc2	Τάραντα δὲ φρουρουμένην ὑπὸ Ῥωμαιων Κονωνεὺς ὧδε προύδωκεν.	Τάρας δέ φρουρέω ὑπό  Κονωνεύς ὧδε προδίδωμι .
708486	tlg0551.tlg008.perseus-grc2	κυνηγετεῖν εἴθιστο ὁ Κονωνεύς, καὶ φέρων ἀεί τι τῷ φρουράρχῳ Λιουίῳ συνήθης ἐκ τοῦδε ἐγεγένητο.	κυνηγετέω ἐθίζω ὁ Κονωνεύς , καί φέρω ἀεί τις ὁ φρούραρχος  συνήθης ἐκ ὅδε γίγνομαι .
708487	tlg0551.tlg008.perseus-grc2	ὡς δὲ ἐν πολεμουμένῃ χώρᾳ, νυκτὸς ἔφη δεῖν κυνηγετεῖν καὶ νυκτὸς φέρειν τὰ λαμβανόμενα.	ὡς δέ ἐν  χώρα , νύξ φημί δέω κυνηγετέω καί νύξ φέρω ὁ λαμβάνω .
708488	tlg0551.tlg008.perseus-grc2	νυκτὸς οὖν αὐτῷ τῶν πυλῶν ἀνοιγομένων, συνθέμενος Ἀννίβᾳ καὶ στρατιώτας λαβών, τοὺς μὲν ἔκρυψεν ἐν λόχμῃ τινὶ πλησίον, τοὺς δʼ ἐπακολουθεῖν ἐκέλευσεν ἑαυτῷ διʼ ὀλίγου, τοὺς δὲ σὺν αὐτῷ προσιέναι, θώρακας ἔνδοθεν ὑπεζωσμένους καὶ ξίφη, τὰ δʼ ἐκτὸς ὡς ἂν ἐς κυνηγέτας ἐσκευασμένους.	νύξ οὖν αὐτός ὁ πύλη  , συντίθημι  καί στρατιώτης λαμβάνω , ὁ μέν κρύπτω ἐν λόχμη  πλησίος , ὁ δέ ἐπακολουθέω κελεύω ἑαυτοῦ διά ὀλίγος , ὁ δέ σύν αὐτός πρόσειμι2 , θώραξ ἔνδον  καί ξίφος , ὁ δέ ἐκτός ὡς ἄν εἰς κυνηγέτης σκευάζω .
708489	tlg0551.tlg008.perseus-grc2	κάπρον τε αὐτοῖς ἐπὶ ξύλων ἐπιθεὶς ἧκε νυκτὸς ἐπὶ τὰς πύλας.	κάπρος τε αὐτός ἐπί ξύλον  ἵημι νύξ ἐπί ὁ πύλη .
708490	tlg0551.tlg008.perseus-grc2	καὶ τῶν φυλάκων, ὥσπερ ἔθος ἦν, ἀνοιξάντων, οἱ μὲν συνεσελθόντες αὐτῷ τοὺς ἀνοίξαντας αὐτίκα διεχρῶντο, οἱ δʼ ἑπόμενοι κατὰ σπουδὴν συνεσέπιπτον ἐκείνοις, καὶ τοὺς ἀπὸ τῆς λόχμης ἐδέχοντο, καὶ τὰς πύλας ἀνεῴγνυον τῷ Ἀννίβᾳ.	καί ὁ φύλαξ , ὥσπερ ἔθος εἰμί , ἀνοίγνυμι , ὁ μέν συνεισέρχομαι αὐτός ὁ ἀνοίγνυμι αὐτίκα διαχράομαι , ὁ δέ  κατά σπουδή συνεισπίπτω ἐκεῖνος , καί ὁ ἀπό ὁ λόχμη δέχομαι , καί ὁ πύλη ἀνοίγνυμι τῷ Ἀννίβας .
708491	tlg0551.tlg008.perseus-grc2	ὁ δὲ ἔσω παρελθὼν τῆς μὲν ἄλλης πόλεως εὐθὺς ἐκράτει, καὶ τοὺς Ταραντίνους ἑταιρισάμενος τὴν ἄκραν ἔτι φρουρουμένην ἐπολιόρκει.	ὁ δέ εἴσω παρέρχομαι ὁ μέν ἄλλος πόλις εὐθύς κρατέω , καί ὁ Ταραντῖνος  ὁ ἄκρα ἔτι φρουρέω πολιορκέω .
708492	tlg0551.tlg008.perseus-grc2	ὧδε μὲν Κονωνεὺς Τάραντα προύδωκε·	ὧδε μέν Κονωνεύς Τάρας προδίδωμι ·
708493	tlg0551.tlg008.perseus-grc2	Ῥωμαῖοι δʼ ὅσοι τὴν ἀκρόπολιν εἶχον, ε͂ς μὲν πεντακισχιλίους ἦσαν, καὶ αὐτοῖς Ταραντίνων τέ τινες προσεχώρουν, καὶ ὁ τῆς ἐν Μεταποντίῳ φρουρᾶς ἡγεμὼν τὸ ἥμισυ τῆς φρουρᾶς ἔχων ἦλθε, βελῶν τε καὶ ὀργάνων πολλῶν ηὐπόρουν, ὡς ἀπὸ τείχους εὐμαρῶς ἀμύνεσθαι τὸν Ἀννίβαν.	δέ ὅσος ὁ ἀκρόπολις ἔχω ,  μέν πεντακισχίλιοι εἰμί , καί αὐτός Ταραντῖνος τε τις προσχωρέω , καί ὁ ὁ ἐν Μεταπόντιον φρουρά  ὁ ἥμισυς ὁ φρουρά ἔχω ἔρχομαι , βέλος τε καί ὄργανον πολύς εὐπορέω , ὡς ἀπό τεῖχος εὐμαρής ἀμύνω ὁ Ἀννίβας .
708494	tlg0551.tlg008.perseus-grc2	ηὐπόρει δὲ καὶ ὁ Ἀννίβας.	εὐπορέω δέ καί ὁ Ἀννίβας .
708495	tlg0551.tlg008.perseus-grc2	πύργους τε οὖν καὶ καταπέλτας ἐπάγων καὶ χελώνας ἔνια διέσειε, καὶ δρεπάνοις ἀπὸ κάλων ἐπάλξεις τε κατέσυρε καὶ τὸ τεῖχος ἀπεγύμνου.	πύργος τε οὖν καί  ἐπάγω καί χελώνη   , καί  ἀπό κάλως ἔπαλξις τε κατασύρω καί ὁ τεῖχος ἀπογυμνόω .
708496	tlg0551.tlg008.perseus-grc2	οἱ δὲ λίθους μὲν ἐπὶ τὰς μηχανὰς ἀφιέντες πολλὰ συνέτριβον, βρόχοις δὲ τὰ δρέπανα περιέσπων, καὶ πολλάκις ἐκθέοντες ἄφνω συνετάρασσον ἀεί τι καὶ κτείναντες ἐπανῄεσαν.	ὁ δέ λίθος μέν ἐπί ὁ μηχανή  πολύς συντρίβω , βρόχος δέ ὁ δρέπανον  , καί πολλάκις ἐκθέω ἄφνω συνταράσσω ἀεί τις καί κτείνω ἐπάνειμι .
708497	tlg0551.tlg008.perseus-grc2	ὡς δὲ καὶ πνεῦμά ποτε λάβρον ἐθεάσαντο, οἱ μὲν ἀπὸ τοῦ τείχους δᾷδας ἡμμένας καὶ στύππιον καὶ πίσσαν αὐτοῦ τοῖς μηχανήμασιν ἐπερρίπτουν, οἱ δὲ καὶ ἐκδραμόντες ὑπέθηκαν.	ὡς δέ καί πνεῦμα ποτε λάβρος θεάομαι , ὁ μέν ἀπό ὁ τεῖχος δαΐς  καί  καί  αὐτός ὁ μηχάνημα ἐπιρρίπτω , ὁ δέ καί ἐκτρέχω ὑποτίθημι .
708498	tlg0551.tlg008.perseus-grc2	ἀπογνοὺς οὖν ὁ Ἀννίβας τῆσδε τῆς πείρας περιετείχισε τὴν πόλιν, χωρίς γε τοῦ πρὸς θαλάσσῃ μέρους·	ἀπογιγνώσκω οὖν ὁ Ἀννίβας ὅδε ὁ πείρω περιτειχίζω ὁ πόλις , χωρίς γε ὁ πρός θάλασσα μέρος ·
708499	tlg0551.tlg008.perseus-grc2	οὐ γὰρ ἦν καὶ τοῦτο δυνατόν.	οὐ γάρ εἰμί καί οὗτος δυνατός .
708500	tlg0551.tlg008.perseus-grc2	καὶ παραδοὺς Ἄννωνι τὴν πολιορκίαν, ἐς Ἰάπυγας ἀνεχώρει.	καί παραδίδωμι Ἄννων ὁ πολιορκία , εἰς Ἰάπυγες ἀναχωρέω .
708501	tlg0551.tlg008.perseus-grc2	λιμένες δʼ εἰσὶ τοῖς Ταραντινοις πρὸς βορρᾶν ἄνεμον ἐκ πελάγους ἐσπλέοντι διὰ ἰσθμοῦ, καὶ τὸν ἰσθμὸν ἀπέκλειον γεφύραις, ὧν τότε κρατοῦντες οἱ Ῥωμαίων φρουροὶ σφίσι μὲν ἐδέχοντο τὴν ἀγορὰν ἐκ θαλάσσης, Ταραντίνοις δʼ ἐκώλυον ἐσκομίζεσθαι.	λιμήν δέ εἰμί ὁ  πρός  ἄνεμος ἐκ πέλαγος εἰσπλέω διά ἰσθμός , καί ὁ ἰσθμός  γέφυρα , ὅς τότε κρατέω ὁ  φρουρός σφεῖς μέν δέχομαι ὁ ἀγορά ἐκ θάλασσα , Ταραντῖνος δέ κωλύω εἰσκομίζω .
