id	filename	tokens	lemmas
1243988	tlg0057.tlg057.1st1K-grc1	﻿ ἀλλὰ κᾀνταῦθα καθάπερ ἐπὶ τῶν προειρημένων μυῶν, οὕτως κᾀπὶ τούτων ἀναγκαῖόν ἐστι, πολλάκις μὲν αὐτοὺς τοὺς μῦς ἴδιόν τι πάθημα πάσχειν, ὁπόσα τὰ τῶν μυῶν ἴσμεν, ἐνίοτε δὲ τῶν ἐμφυομένων εἰς αὐτοὺς νεύρων τι πεπονθέναι.	﻿ ἀλλά  καθά ἐπί ὁ προαγορεύω μῦς , οὕτως  οὗτος ἀναγκαῖος εἰμί , πολλάκις μέν αὐτός ὁ μῦς ἴδιος τι πάθημα πάσχω , ὁπόσος ὁ ὁ μῦς οἶδα , ἐνίοτε δέ ὁ ἐμφύω εἰς αὐτός  τι πάσχω .
1243989	tlg0057.tlg057.1st1K-grc1	ὁ μὲν οὖν ἀνατείνων αὐτὸν παραλυθεὶς χαλαρὸν ἀποδείξει τὸ βλέφαρον, ὡς μὴ δύνασθαι διανοίγειν τὸν ὀφθαλμόν·	ὁ μέν οὖν ἀνατείνω αὐτός  χαλαρός ἀποδείκνυμι ὁ βλέφαρον , ὡς μή δύναμαι  ὁ ὀφθαλμός ·
1243990	tlg0057.tlg057.1st1K-grc1	οἱ κατασπῶντες δὲ, δύο γάρ εἰσιν αὐτοὶ, κλείειν ἀδυνατήσουσιν·	ὁ κατασπάω δέ , γε γάρ εἰμί αὐτός , κλέω  ·
1243991	tlg0057.tlg057.1st1K-grc1	εἰ δ’ ὁ ἕτερος αὐτῶν πάθοι μόνος, ἐπὶ τὸν ἀντικείμενον αὐτῶν μῦν παρασπασθήσεται τὸ βλέφαρον, ὡς δοκεῖν κεκλάσθαι κατὰ μέσην τὴν ἐπὶ τῷ πέρατι περιγραφὴν αὐτῶν, καὶ τὸ μὲν ἕτερον μέρος, ὃ κατὰ τὸν πεπονθότα μῦν ἐστι, ἀνεσπάσθαι, τὸδ’ ἕτερον,ὃ κατὰ τὸν ἀπαθῆ, κατεσπάσθαι.	εἰ  ὁ ἕτερος αὐτός πάσχω μόνος , ἐπί ὁ  αὐτός   ὁ βλέφαρον , ὡς δοκέω κλάω κατά μέσος ὁ ἐπί τῷ  περιγραφή αὐτός , καί ὁ μέν ἕτερος μέρος , ὅς κατά ὁ πάσχω  εἰμί ,  , ὁ δ’ ἕτερος , ὃ κατά ὁ  , κατασπάω .
1243992	tlg0057.tlg057.1st1K-grc1	ταῦτα μὲν οὖν ἴδια πάθη τῶν κατὰ τὸν ὀφθαλμόν ἐστι μορίων, ἀφανεῖς ἔχοντα τοὺς πάσχοντας τόπους, ἕτεραδ’ ἐξ ἄλλων ἐπ’ αὐτὸν ὁρμᾶται κατὰ συμπάθειαν.	οὗτος μέν οὖν ἴδιος πάθος ὁ κατά ὁ ὀφθαλμός εἰμί μόριον , ἀφανής ἔχω ὁ πάσχω τόπος , ἕτερος δ’ ἐκ ἄλλος ἐπί αὐτός ὁρμάω κατά συμπάθεια .
1243993	tlg0057.tlg057.1st1K-grc1	τοῖς γοῦν τῶν ὑποχεομένων φαντάσμασιν ὅμοια φαίνεται, μηδεμιᾶς οὔσης ἰδιοπαθείας κατὰ τὸν ὀφθαλμὸν, ἀλλ’ ἐπὶ συμπαθείᾳ τῇ κατὰ τὸ στόμα τῆς κοιλίας, ἢ κατὰ τὸν ἐγκέφαλον.	ὁ γοῦν ὁ   ὅμοιος φαίνω , μηδείς εἰμί  κατά ὁ ὀφθαλμός , ἀλλά ἐπί  ὁ κατά ὁ στόμα ὁ κοιλία , ἤ κατά ὁ ἐγκέφαλος .
1243994	tlg0057.tlg057.1st1K-grc1	ἀλλὰ καὶ ταῦτα διορίζεσθαι χρὴ τῶν ἀπὸ τῆς γαστρὸς ἀρχομένων, πρῶτον μὲν τῷ τὸν ἕτερον ὀφθαλμὸν μόνον ἢ ἀμφοτέρους ὁμοίως φαντάζεσθαι·	ἀλλά καί οὗτος διορίζω χρή ὁ ἀπό ὁ γαστήρ ἄρχω , πρῶτος μέν τῷ ὁ ἕτερος ὀφθαλμός μόνος ἤ ἀμφότερος ὅμοιος φαντάζω ·
1243995	tlg0057.tlg057.1st1K-grc1	τοὐπίπαν γὰρ αἱ μὲν ἐπὶ τῇ κατὰ τὴν γαστέρα κακοχυμίᾳ γινόμεναι φαντασίαι τοῖς ὀφθαλμοῖς ἀμφοτέροις ὡσαύτως συμβαίνουσιν, αἱ δ’ ἐπὶ ταῖς ὑποχύσεσιν οὔτ’ ἄρχονται κατ’ ἀμφοτέρους, οὔθ’ ὁμοίως φαίνονται·	ἐπίπαν γάρ  μέν ἐπί ὁ κατά ὁ γαστήρ    ὁ ὀφθαλμός ἀμφότερος ὡσαύτως συμβαίνω , ὁ  ἐπί ὁ   ἄρχω κατά ἀμφότερος ,  ὅμοιος φαίνω ·
1243996	tlg0057.tlg057.1st1K-grc1	δευτέρῳ δ’ ἐφεξῆς τῷ κατὰ τὸν χρόνον·	δεύτερος  ἐφεξῆς τῷ κατά ὁ χρόνος ·
1243997	tlg0057.tlg057.1st1K-grc1	εἰ γὰρ ἤτοι τριῶν ἢ τεττάρων μηνῶν ἢ καὶ πλειόνων ἤδη φαίνοιτο τὰ τῶν ὑποχεομένων συμπτώματα, σοὶ δὲ κατασκεψαμένῳ τὰς κόρας μηδὲν ἀχλυῶδες ἐμφαινόμενον εὑρίσκοιτο, διὰ τὸ στόμα τῆς κοιλίας αὐτοὺς πάσχοντας εὑρήσεις·	εἰ γάρ ἤτοι  ἤ τέσσαρες μείς ἤ καί πολύς ἤδη φαίνω ὁ ὁ  σύμπτωμα ,  δέ  ὁ κόρη   ἐμφαίνω  , διά ὁ στόμα ὁ κοιλία αὐτός πάσχω εὑρίσκω ·
1243998	tlg0057.tlg057.1st1K-grc1	οὔπω δ’ ὄντος ἀξιολόγου τοῦ χρόνου, πρῶτον μὲν ἐρωτήσεις εἰ διηνεκῶς ἐν ἁπάσαις ταῖς ἡμέραις ἀφ’ ἧς ἤρξατο πάσχειν οὕτω διατελεῖ φαινόμενα, μηδεμιᾶς ἡμέρας ἐν τῷ μεταξὺ γενομένης ἀμέμπτου τελέως, ἢ παρενέπεσόν τινες ἀμέμπτως ὑγιεῖς, ὡς δοκεῖν ἀκριβῶς ὑγιεῖς εἶναι·	οὔπω  εἰμί ἀξιόλογος ὁ χρόνος , πρῶτος μέν ἐρωτάω εἰ διηνεκής ἐν ἅπας ὁ ἡμέρα ἀπό ὅς ἄρχω πάσχω οὕτως διατελέω φαίνω , μηδείς ἡμέρα ἐν ὁ  γίγνομαι ἄμεμπτος τέλειος , ἤ  τις ἄμεμπτος  , ὡς δοκέω ἀκριβής  εἰμί ·
1243999	tlg0057.tlg057.1st1K-grc1	τὸ μὲν γὰρ διηνεκὲς ὡς ἔνδειξιν ὑποχύσεως ἔχει, τὸ δὲ διαλεῖπον ὑποψίαν τῶν κατὰ τὴν γαστέρα, καὶ μᾶλλον ὅτ’ ἃν ἐπὶ ταῖς ἀκριβέσιν εὐπεψίαις μηδὲν ἑαυτῷ λέγῃ φαίνεσθαι φάντασμα, πολὺ δὲ μᾶλλον ὅταν ἅμα τῇ γενέσει τῶν φαντασμάτων αἰσθάνηταί τινος ἐν τῷ στόματι τῆς κοιλίας δήξεως, ἔτι δὲ μᾶλλον ὅταν ἐπὶ τοῖσδε, τῶν δακνόντων ἐμεθέντων, παύηται τὰ συμπτώματα.	ὁ μέν γάρ διηνεκής ὡς ἔνδειξις  ἔχω , ὁ δέ  ὑποψία ὁ κατά ὁ γαστήρ , καί μᾶλλον  ὅς ἐπί ὁ    ἑαυτοῦ λέγω φαίνω φάντασμα , πολύς δέ μᾶλλον ὅταν ἅμα ὁ γένεσις ὁ φάντασμα  τις ἐν ὁ στόμα ὁ   , ἔτι δέ μᾶλλον ὅταν ἐπί ὅδε , ὁ   , παύω ὁ σύμπτωμα .
1244000	tlg0057.tlg057.1st1K-grc1	ταῦτα μὲν οὖν εὐθέως κατὰ τὴν πρώτην ἡμέραν, ἐν ᾗπερ ἂν ἴδῃς τὸν ἄνθρωπον, ἐξ ἀνακρίσεως ὑπάρξει σοι μαθεῖν, ὅτ’ ἂν, ὡς ἔφην, ἀκριβῶς κατὰ φύσιν ἔχωσιν οἱ ὀφθαλμοί·	οὗτος μέν οὖν εὐθύς κατά ὁ πρῶτος ἡμέρα , ἐν  ἄν ὁράω ὁ ἄνθρωπος , ἐκ ἀνάκρισις ὑπάρχω  μανθάνω ,  ἄν , ὡς φημί , ἀκριβής κατά φύσις ἔχω ὁ ὀφθαλμός ·
1244001	tlg0057.tlg057.1st1K-grc1	τῆς δὲ θατέρου κόρης ἀχλυωδεστέρας, ἢ θολωδεστέρας, ἢ συνελόντι φάναι, μὴ καθαρᾶς ἀκριβῶς φαινομένης, ὑποχύσεώς ἐστιν ἀρχή·	ὁ δέ  κόρη  , τίη  , ἤ συναιρέω φαίνω , μή  ἀκριβής φαίνω ,  εἰμί ἀρχή ·
1244002	tlg0057.tlg057.1st1K-grc1	ἐὰν δ’ ἔνιοι φύσει τὰς κόρας μὴ πάνυ τι καθαρὰς ἔχωσιν, ἐπισκεπτέον ἐστὶν, εἰ ἀμφότεραι παραπλησίως φαίνονται διακείμεναι, καὶ εἰ πρὸς τούτῳ μηδέπω χρόνος ἱκανὸς ἐπὶ τοῖς τῆς ὑποχύσεως συμπτώμασιν προγεγονὼς ὑπάρχει·	ἐάν  ἔνιοι φύσις ὁ κόρη μή πάνυ τις καθαρός ἔχω , ἐπισκοπέω εἰμί , εἰ ἀμφότερος παραπλήσιος φαίνω  , καί εἰ πρός οὗτος μηδέπω χρόνος ἱκανός ἐπί ὁ ὁ  σύμπτωμα προγίγνομαι ὑπάρχω ·
1244003	tlg0057.tlg057.1st1K-grc1	κᾂν ταῦθ’ οὕτως ἔχῃ, κέλευσον ἀρκεσθῆναι τροφῇ τῆς συνήθους ἐλάττονι, μηδὲν ἐχούσῃ κακόχυμον.	οὕτως ἔχω , κελεύω  τροφή ὁ  ἐλάσσων ,  ἔχω  .
1244004	tlg0057.tlg057.1st1K-grc1	εἶτα κατὰ τὴν ὑστεραίαν εὐπεπτηκότος ἀκριβῶς αὐτοῦ, πυθοῦ περὶ τῶν κατὰ τὴν ὄψιν φαντασμάτων·	εἶτα κατά ὁ ὑστεραῖος  ἀκριβής αὐτός , πυνθάνομαι περί ὁ κατά ὁ ὄψις φάντασμα ·
1244005	tlg0057.tlg057.1st1K-grc1	εἰ μὲν γὰρ ἤτοι μηδ’ ὅλως ἢ ἀμυδρῶς φαίνοιτο, στομαχικὸν ἦν τὸ σύμπτωμα·	εἰ μέν γάρ ἤτοι  ὅλος τίη ἀμυδρός φαίνω , στομαχικός εἰμί ὁ σύμπτωμα ·
1244006	tlg0057.tlg057.1st1K-grc1	μενόντων δ’ ὁμοίων αὐτῶν, οὐ κατὰ συμπάθειαν, ἀλλὰ κατὰ διάθεσιν οἰκείαν εἰδέναι χρὴ ταῦτα συμπίπτοντα τοῖς ὀφθαλμοῖς, ἔτι δὲ μᾶλλον, ἐὰν τοῦ δι’ ἀλόης φαρμάκου λαβὼν, ὁμοίως ἔχῃ·	μένω  ὅμοιος αὐτός , οὐ κατά συμπάθεια , ἀλλά κατά διάθεσις οἰκεῖος οἶδα χρή οὗτος συμπίπτω ὁ ὀφθαλμός , ἔτι δέ μᾶλλον , ἐάν ὁ διά ἀλόη  λαμβάνω , ὅμοιος ἔχω ·
1244007	tlg0057.tlg057.1st1K-grc1	λέγω δὲ διὰ τῆς ἀλόης, ὃ προσαγορεύουσιν ἔνιοι μὲν ἱερὰν πικρὰν, ἔνιοι δὲ ἁπλῶς πικράν.	λέγω δέ διά ὁ ἀλόη , ὅς προσαγορεύω ἔνιοι μέν  πικρός , ἔνιοι δέ ἁπλόος πικρός .
1244008	tlg0057.tlg057.1st1K-grc1	εἰ γὰρ στομαχικὸν εἴη τὸ σύμπτωμα, θεραπευθήσεται ῥᾷστα διὰ τῆς τοῦ φαρμάκου τούτου πόσεως, ἅμα ταῖς εὐπεψίαις, ὡς συνελθεῖν εἰς ταὐτὸν ἀμφότερα, τήν τε διάγνωσιν τοῦ πεπονθότος τόπου καὶ τὴν θεραπείαν αὐτοῦ.	εἰ γάρ στομαχικός εἰμί ὁ σύμπτωμα ,  ῥᾴδιος διά ὁ ὁ  οὗτος πόσις2 , ἅμα ὁ  , ὡς συνέρχομαι εἰς αὐτός ἀμφότερος , ὁ τε διάγνωσις ὁ πάσχω τόπος καί ὁ θεραπεία αὐτός .
1244009	tlg0057.tlg057.1st1K-grc1	ἐγὼ δὲ, ὡς ἴστε, καὶ χωρὶς τοῦ θεάσασθαι τοὺς οὕτω πάσχοντας ἐθεράπευσα διὰ γραμμάτων ἐνίους ἐν ἄλλοις ὄντας ἔθνεσιν·	δέ , ὡς οἶδα , καί χωρίς ὁ θεάομαι ὁ οὕτως πάσχω θεραπεύω διά γράμμα ἔνιοι ἐν  εἰμί ἔθνος ·
1244010	tlg0057.tlg057.1st1K-grc1	καὶ γὰρ ἐκ τῆς Ἰβηρίας καὶ τῆς Κελτικῆς καὶ Ἀσίας καὶ Θρᾴκης καὶ ἄλλων χωρίων ἐπιστειλάντων μοί τινων, εἴ τι πρὸς ἀρχὰς ὑποχύσεως, μήπω μηδεμιᾶς ἐναργῶς φαινομένης βλάβης ἐν τῇ κόρῃ, φάρμακον ἔχοιμι δόκιμον, ἀποστέλλειν αὐτοῖς, ἠξίωσα δηλωθῆναί μοι πρότερον, εἰ ἐκ τοῦ πολλοῦ χρόνου πάσχουσι, καὶ τἄλλα περὶ ὧν ὀλίγον ἔμπροσθεν εἶπον·	καί γάρ ἐκ ὁ Ἰβηρία καί ὁ  καί Ἀσία καί Θρᾴκη καί ἄλλος χωρίον ἐπιστέλλω   , εἰ τις πρός ἀρχή  , μήπω  ἐναργής φαίνω βλάβη ἐν ὁ κόρη , φάρμακον ἔχω δόκιμος , ἀποστέλλω αὐτός , ἀξιόω  ἐγώ  , εἰ ἐκ ὁ πολύς χρόνος πάσχω , καί  περί ὅς ὀλίγος ἔμπροσθεν λέγω ·
1244011	tlg0057.tlg057.1st1K-grc1	εἶτα τοῖς ἐπιστείλασιν, ἓξ μῆνας ἢ ἐνιαυτὸν ἀπὸ τῆς ἀρχῆς γεγονέναι φασκόντων, ἀμφοτέρων ὁμοίως τῶν ὀφθαλμῶν ἐπὶ μὲν ταῖς εὐπεψίαις ἄμεινον ἐχόντων, παροξυνομένων δὲ ἐπὶ ταῖς ἀπεψίαις καὶ ταῖς τοῦ στομάχου δήξεσιν, ἐμεσάντων τε χολῆς καὶ καθισταμένων, οὐδὲν ἔτι περὶ τῆς κόρης ἀξιώσας πυθέσθαι, βεβαίως ἔγνων ὡς οὐκ ἰδιοπάθειαν ἀλλὰ συμπάθειαν εἶναι τῶν ὀφθαλμῶν ἐπὶ τῇ γαστρί·	εἶτα ὁ  ,  μείς ἤ ἐνιαυτός ἀπό ὁ ἀρχή γίγνομαι φάσκω , ἀμφότερος ὅμοιος ὁ ὀφθαλμός ἐπί μέν ὁ  ἀμείνων ἔχω , παροξύνω δέ ἐπί ὁ  καί ὁ ὁ στόμαχος  ,  τε χολή καί καθίστημι ,  ἔτι περί ὁ κόρη ἀξιόω πυνθάνομαι , βέβαιος γιγνώσκω ὡς οὐ  ἀλλά συμπάθεια εἰμί ὁ ὀφθαλμός ἐπί ὁ γαστήρ ·
1244012	tlg0057.tlg057.1st1K-grc1	καὶ πέμψας αὐτοῖς τὴν πικρὰν, ἐκείνους μὲν πρῶτον καὶ μάλιστα, διὰ ἐκείνων δὲ καὶ ἄλλους πολλοὺς τῶν ὁμοεθνῶν αὐτοῖς ἰασάμην·	καί πέμπω αὐτός ὁ πικρός , ἐκεῖνος μέν πρῶτος καί μάλιστα , διά ἐκεῖνος δέ καί ἄλλος πολύς ὁ ὁμοεθνής αὐτός  ·
1244013	tlg0057.tlg057.1st1K-grc1	ὄντες γὰρ αὐτοὶ πάντες οἷς ἔπεμψα πεπαιδευμένοι, μαθόντεςδ’ ἐξ ὧν αὐτοῖς ἐπέστειλα τὰς διαγνώσεις τῶν πεπονθότων τόπων, αὐτοί τε τοῦ λοιποῦ ῥᾳδίως ἐγνώριζον αὐτοὺς, ἐθεράπευόν τε τῷ πικρῷ φαρμάκῳ.	εἰμί γάρ  πᾶς ὅς πέμπω παιδεύω , μανθάνω δ’ ἐκ  αὐτός ἐπιστέλλω ὁ διάγνωσις ὁ  τόπος , αὐτός τε ὁ  ῥᾴδιος γνωρίζω αὐτός , θεραπεύω τε ὁ πικρός φάρμακος .
1244014	tlg0057.tlg057.1st1K-grc1	παραπλήσια δὲ τοῖς τῶν ὑποχεομένων συμπτώματα γίνεται πολλάκις ἐγκεφάλου πάσχοντος ἔν τισι φρενιτίδων εἴτε εἴδεσιν εἴτε διαφοραῖς ἐθέλοις ὀνομάζειν.	παραπλήσιος δέ ὁ ὁ  σύμπτωμα γίγνομαι πολλάκις  πάσχω ἐν   εἴτε εἶδος εἴτε  ἐθέλω ὀνομάζω .
1244015	tlg0057.tlg057.1st1K-grc1	εἰσὶν μὲν γὰρ αὐτῆς ἁπλαῖ μὲν δύο, σύνθετος δὲ ἐξ ἀμφοῖν ἡ τρίτη.	εἰμί μέν γάρ αὐτός  μέν γε , σύνθετος δέ ἐκ ἄμφω ὁ τρίτος .
1244016	tlg0057.tlg057.1st1K-grc1	τινὲς μὲν γὰρ τῶν φρενιτικῶν, οὐδὲν ὅλως σφαλλόμενοι περὶ τὰς αἰσθητικὰς διαγνώσεις τῶν ὁρατῶν, οὐ κατὰ φύσιν ἔχουσι ταῖς διανοητικαῖς κρίσεσιν·	μέν γάρ ὁ φρενιτικός , οὐδείς ὅλος σφάλλω περί ὁ  διάγνωσις ὁ ὁρατός , οὐ κατά φύσις ἔχω ὁ  κρίσις ·
1244017	tlg0057.tlg057.1st1K-grc1	ἔνιοι δ’ ἔμπαλιν ἐν μὲν ταῖς διανοήσεσιν οὐδὲν σφάλλονται, παρατυπωτικῶς δὲ κινοῦνται κατὰ τὰς αἰσθήσεις, ἄλλοις δέ τισιν κατ’﻿ ἄμφω βεβλάφθαι συμβέβηκεν.	ἔνιοι  ἔμπαλιν ἐν μέν ὁ   σφάλλω ,  δέ κινέω κατά ὁ αἴσθησις ,  δέ  κατά ﻿ ἄμφω βλάπτω συμβαίνω .
1244018	tlg0057.tlg057.1st1K-grc1	ὁ δὲ τρόπος ἑκατέρας τῆς βλάβης τοιόσδ’ ἐστίν.	ὁ δέ τρόπος ἑκάτερος ὁ βλάβη  εἰμί .
1244019	tlg0057.tlg057.1st1K-grc1	καταλειφθείς τις ἐπὶ τῆς οἰκίας ἐν Ῥώμῃ μεθ’ ἑνὸς ἐριουργοῦ παιδὸς, ἀναστὰς ἀπὸ τῆς κλίνης ἧκεν ἐπὶ τῆς θυρίδος, δι’ ἧς οἷόντ’ ἦν ὁρᾶσθαί τε αὐτὸν καὶ ὁρᾷν τοὺς παριόντας.	καταλείπω τις ἐπί ὁ οἰκία ἐν Ῥώμη μετά    , ἀνίστημι ἀπό ὁ κλίνη ἵημι ἐπί ὁ θυρίς , διά ὅς  τ’ εἰμί ὁράω τε αὐτός καί  ὁ πάρειμι2 .
1244020	tlg0057.tlg057.1st1K-grc1	εἶτα τῶν ὑαλίνων σκευῶν ἕκαστον ἐπιδεικνὺς αὐτοῖς, εἰ κελεύοιεν αὐτὸ βάλλειν, ἐπυνθάνετο.	εἶτα ὁ ὑάλινος σκευή ἕκαστος ἐπιδείκνυμι αὐτός , εἰ κελεύω αὐτός βάλλω , πυνθάνομαι .
1244021	tlg0057.tlg057.1st1K-grc1	τῶν δὲ μετὰ γέλωτος ἀξιούντων τε βαλεῖν καὶ κροτούντων ταῖς χερσὶν, ὁ μὲν ἔβαλεν ἐφεξῆς ἅπαντα προχειριζόμενος, οἱ δὲ γελῶντες ἐκεκράγεισαν.	ὁ δέ μετά γέλως ἀξιόω τε βάλλω καί κροτέω ὁ χείρ , ὁ μέν βάλλω ἐφεξῆς ἅπας  , ὁ δέ γελάω  .
1244022	tlg0057.tlg057.1st1K-grc1	ὕστερον δέ ποτε πυθόμενος αὐτῶν, εἰ καὶ τὸν ἐριουργὸν κελεύοιεν βληθῆναι, κελευσάντων αὐτῶν, ὁ μὲν ἔβαλεν, οἱ δὲ ἐπεὶ καταφερόμενον ἐξ ὕψους ἐθεάσαντο, γελῶντες μὲν ἐπαύσαντο, πεσόντα δὲ προσδραμόντες ἀνείλοντο συντριβέντα.	ὕστερον δέ ποτε πυνθάνομαι αὐτός , εἰ καί ὁ  κελεύω βάλλω , κελεύω αὐτός , ὁ μέν βάλλω , ὁ δέ ἐπεί καταφέρω ἐκ ὕψος θεάομαι , γελάω μέν ἐπαύω , πίπτω δέ προστρέχω ἀναιρέω  .
1244023	tlg0057.tlg057.1st1K-grc1	τὸ δ’ ἐναντίον οὐ μόνον ἐπ’ ἄλλων, ἀλλὰ καὶ ἐμαυτῷ συμβὰν οἶδα μειρακίῳ τὴν ἡλικίαν ὄντι.	ὁ  ἐναντίος οὐ μόνος ἐπί ἄλλος , ἀλλά καί ἐμαυτοῦ  οἶδα μειράκιον ὁ ἡλικία εἰμί .
1244024	tlg0057.tlg057.1st1K-grc1	πυρέττων γὰρ ἐν θέρει πυρετῷ διακαεῖ, τῆς τε κλίνης ἐξέχειν τινα κάρφη, κατὰ τὴν χρόαν ὀρφνώδη, καὶ τῶν ἱματίων ὁμοίας κροκύδας ἐνόμιζον·	γάρ ἐν θέρος   , ὁ τε κλίνη ἐξέχω τις  , κατά ὁ χροιά  , καί ὁ ἱμάτιον ὅμοιος κροκύς νομίζω ·
1244025	tlg0057.tlg057.1st1K-grc1	εἶτ’ ἀφαιρεῖν μὲν αὐτὰς ἐπεχείρουν, οὐδενὸς δὲ ὑπὸ τῶν δακτύλων ἀναφερομένου, συνεχέστερόν τε καὶ σφοδρότερον ἐπεχείρουν οὕτω πράττων.	ἀφαιρέω μέν αὐτός ἐπιχειρέω ,  δέ ὑπό ὁ δάκτυλος ἀναφέρω ,  τε καί σφοδρός ἐπιχειρέω οὕτως πράσσω .
1244026	tlg0057.tlg057.1st1K-grc1	ἑταίρων δὲ δυοῖν παρόντων ἀκούσας ἀλλήλοιν λεγόντων, ὡς οὗτος ἤδη κροκυδίζει τε καὶ καρφολογεῖ, συνῆκα μὲν ὡς αὐτὸ τοῦτο πεπόνθοιμι τὸ λεγόμενον ὑπ’ αὐτῶν, ἀκριβῶς δὲ παρακολουθῶν ἐμαυτῷ μὴ παραπαίοντι κατὰ τὴν λογιστικὴν δύναμιν, ὀρθῶς, ἔφην, λέγετε, καὶ βοηθεῖτέ μοι, μὴ φρενιτίσω.	ἑταῖρος δέ  πάρειμι ἀκούω  λέγω , ὡς οὗτος ἤδη  τε καί  , συνίημι μέν ὡς αὐτός οὗτος  ὁ λέγω ὑπό αὐτός , ἀκριβής δέ παρακολουθέω ἐμαυτοῦ μή  κατά ὁ λογιστικός δύναμις , ὀρθός , φημί , λέγω , καί βοηθέω  , μή  .
1244027	tlg0057.tlg057.1st1K-grc1	τραπομένων δ’ αὐτῶν ἐπὶ τὰς προσηκούσας ἐπιβροχὰς τῆς κεφαλῆς, δι’ ὅλης τῆς ἡμέρας καὶ νυκτὸς ἐνύπνια μέν μοι ταραχώδη τινὰ συνέπεσεν ἄχρι τοῦ βοῆσαί τε καὶ ἀναπηδῆσαι πρὸς ταῦτα, κατέστη δὲ τὰ συμπτώματα πάντα κατὰ τὴν ἑξῆς ἡμέραν.	αὐτός ἐπί ὁ προσήκω  ὁ κεφαλή , διά ὅλος ὁ ἡμέρα καί νύξ ἐνύπνιος μέν  ταραχώδης  συμπίπτω ἄχρι ὁ βοάω τε καί ἀναπηδάω πρός οὗτος , καθίστημι δέ ὁ σύμπτωμα πᾶς κατά ὁ ἑξῆς ἡμέρα .
1244028	tlg0057.tlg057.1st1K-grc1	εὔδηλον οὖν ὅτι τῶν συμπτωμάτων ἡ γένεσις ἐπὶ μὲν αἰτίᾳ μιᾷ καὶ τῇ αὐτῇ κατ’ εἶδος, οὐκ ἐκ τοῦ αὐτοῦ δὲ πρωτοπαθοῦντος ὁρμᾶται τόπου, τοῖς ἐπ’ ἐγκεφάλῳ τε καὶ γαστρὶ κατὰ συμπάθειαν, ὡς εἴρηται, πάσχουσιν·	εὔδηλος οὖν ὅτι2 ὁ σύμπτωμα ὁ γένεσις ἐπί μέν αἰτία  καί ὁ αὐτός κατά εἶδος , οὐ ἐκ ὁ αὐτός δέ  ὁρμάω τόπος , ὁ ἐπί ἐγκέφαλος τε καί  κατά συμπάθεια , ὡς λέγω , πάσχω ·
1244029	tlg0057.tlg057.1st1K-grc1	ὅτ’ ἂν γὰρ ἀθροισθῇ τις ἐν ἐγκεφάλῳ χολώδης χυμὸς ἅμα πυρετῷ διακαεῖ, παραπλήσιόν τι πάσχει τοῖς ὑπὸ πυρὸς ὀπτωμένοις, καὶ κατὰ τοῦτο λιγνύν τινα γεννᾷν πέφυκεν, ὥσπερ κᾀν τοῖς λύχνοις τοὔλαιον·	ἄν γάρ ἀθροίζω τις ἐν ἐγκέφαλος  χυμός ἅμα πυρετός  , παραπλήσιος τι πάσχω ὁ ὑπό πῦρ  , καί κατά οὗτος λιγνύς   φύω , ὥσπερ  ὁ λύχνος ἔλαιον ·
1244030	tlg0057.tlg057.1st1K-grc1	ἥτις λιγνὺς συνδιεκπίπτουσα τοῖς ἐπὶ τὸν ὀφθαλμὸν ἀφικνουμένοις ἀγγείοις, αἰτία γίνεται τῶν φαντασμάτων αὐτοῖς·	ὅστις λιγνύς  ὁ ἐπί ὁ ὀφθαλμός   , αἰτία γίγνομαι ὁ φάντασμα αὐτός ·
