id	filename	tokens	lemmas
472101	tlg2001.tlg042.opp-grc1	κἄν ᾖ δὲ εἰλημμένον τό τε ‘ πᾶν τὸ κατὰ φύσιν οἰκεῖον’ καὶ‘ παν τὸ κατὰ φύσιν ἀγαθόν’ καὶ συμπέρασμα ἐπὶ τούτῳ‘ τὸ ὑγίεια ἄρα ἀγαθόν’, τὸ‘ ἡ μὲν ὑγίεια οἰκεῖον’ ἔσται πάλιν παρειμένον, αἰ δὲ‘ πᾶν τὸ οἰκεῖον κατὰ φύσιν, πᾶν τὸ κατὰ φύσιν δεικνύοιεν δεικνύοιεν τὴν εἰλημμένην πρότασιν τὴν‘ πᾶν τὸ οἰκεῖον ἀγαθόν’.	εἰμί δέ λαμβάνω ὁ τε  πᾶς ὁ κατά φύσις οἰκεῖος ’ καί ‘  ὁ κατά φύσις ἀγαθός ’ καί συμπέρασμα ἐπί οὗτος ‘ ὁ  ἄρα ἀγαθός ’ , ὁ ‘ ὁ μέν ὑγίεια οἰκεῖος ’ εἰμί πάλιν παρίημι , εἰ δέ ‘ πᾶς ὁ οἰκεῖος κατά φύσις , πᾶς ὁ κατά φύσις δείκνυμι δείκνυμι ὁ λαμβάνω πρότασις ὁ ‘ πᾶς ὁ οἰκεῖος ἀγαθός ’ .
472102	tlg2001.tlg042.opp-grc1	β ' χρὴ δὲ μὴ ἁπλῶς βλέπειν πρὸς τὸ συμπέρασμα καὶ ἐν τοῖς ἀναγκαίως τι ἕπεται, ἡγεῖσθαι συλλογισμὸν εἶναι.	χρή δέ μή ἁπλόος βλέπω πρός ὁ συμπέρασμα καί ἐν ὁ ἀναγκαῖος τις  ,  συλλογισμός εἰμί .
472103	tlg2001.tlg042.opp-grc1	οὐ γάρ, εἰ ὁ συλλογισμὸς ἐξ ἀνάγκης δείκνυσί τι, ἤδη καὶ ἔνθα ἂν ᾖ ἐξ ἀνάγκης τι δεικνύμενον τῷ τοῖς κειμένοις ἕπεσθαι, τοῦτο συλλογισμός ἐστιν·	οὐ γάρ , εἰ ὁ συλλογισμός ἐκ ἀνάγκη δείκνυμι τι , ἤδη καί ἔνθα ἄν εἰμί ἐκ ἀνάγκη τι δείκνυμι τῷ ὁ   , οὗτος συλλογισμός εἰμί ·
472104	tlg2001.tlg042.opp-grc1	ἐπὶ πλέον γὰρ τὸ ἀναγκαῖον τοῦ συλλογισμοῦ.	ἐπί πολύς γάρ ὁ ἀναγκαῖον ὁ συλλογισμός .
472105	tlg2001.tlg042.opp-grc1	διὸ οὐχί, εἰ ἕπεται ἐξ ἀνάγκης ληφθέντι τῷ τὸΑ τῷ Β ἴσον εἶναι καὶ τὸΓ τῷ Β τὸ καὶ τὸ Α τῷΓ ἴσον εἶναι, ἤδη καὶ συλλογισμὸς τοῦτο.	διό οὐ , εἰ  ἐκ ἀνάγκη λαμβάνω τῷ ὁ Α τῷ  ἴσος εἰμί καί ὁ Γ τῷ  ὁ καί ὁ  τῷ Γ ἴσος εἰμί , ἤδη καί συλλογισμός οὗτος .
472106	tlg2001.tlg042.opp-grc1	ἔσται δὲ συλλογιστικῶς τὸ συνιστάμενον, ἄν προσλαβόντες καθόλου πρότασιν τὴν λέγουσαν“ τὰ τῷ αὐτῷ ἴσα καὶ ἀλλήλοις ἐστὶν ἴσα’’ τὰ εἰλημμένα δύο ὡς προτάσεις εἰς μίαν συστείλωμεν πρότασιν, ἣ ἴσον ταῖς δύο δύναται·	δέ συλλογιστικός ὁ συνίστημι , ἄν προσλαμβάνω καθόλου πρότασις ὁ λέγω “ ὁ τῷ αὐτός ἴσος καί ἀλλήλων εἰμί ἴσος ’ ’ ὁ λαμβάνω γε ὡς πρότασις εἰς   πρότασις , ὁ ἴσος ὁ γε δύναμαι ·
472107	tlg2001.tlg042.opp-grc1	ἔστι δ’ αὕτη ‘ τὰ δὲΑ καὶ Γ τῷ αὐτῷ τῷ γὰρΒ) ἴσα·	εἰμί  οὗτος  ὁ δέ Α καί  τῷ αὐτός τῷ γάρ Β ) ἴσος ·
472108	tlg2001.tlg042.opp-grc1	συνάγεται γὰρ κατὰ συλλογισμὸν οὕτως τὸΑ καὶ τὸΓ ἀλλήλοις εἶναι ἴσα.	συνάγω γάρ κατά συλλογισμός οὕτως ὁ Α καί ὁ Γ ἀλλήλων εἰμί ἴσος .
472109	tlg2001.tlg042.opp-grc1	| ὅμοιον τούτῳ καὶ τὸ λαβόντας τὸ Α μεῖζον εἶναι τοῦΒ καὶ τὸ Β τοῦΓ εἰρῆσθαι συλλογιστικῶς δείκνυσθαι τὸ καὶ τὸ A <τοῦ Γ> μεῖζον εἶναι, ἐπεὶ ἀναγκαίως τοῦτο ἕπεται.	| ὅμοιος οὗτος καί ὁ λαμβάνω ὁ  μέγας εἰμί ὁ Β καί ὁ  ὁ Γ λέγω συλλογιστικός δείκνυμι ὁ καί ὁ    μέγας εἰμί , ἐπεί ἀναγκαῖος οὗτος  .
472110	tlg2001.tlg042.opp-grc1	ἀλλ’ οὔπω συλλογισμὸς τοῦτο, ἄν μὴ προσληφθῇ καθόλου πρότασις ἡ λέγουσα‘ πᾶν τὸ τοῦ μείζονός τινος μεῖζον καὶ τοῦ ἐλάττονος ἐκείνου μεῖζόν ἐστι’, τὰ δὲ κείμενα δύο πρότασις γένηται μία ἡ ἐλάττων ἐν τῷ συλλογισμῷ λέγουσα‘ τὸ δὲΑ τοῦ Β μείζονος ὄντος τοῦΓ μεῖζόν ἐστι’·	ἀλλά οὔπω συλλογισμός οὗτος , ἄν   καθόλου πρότασις ὁ λέγω ‘ πᾶς ὁ ὁ   μέγας καί ὁ ἐλάσσων ἐκεῖνος μέγας εἰμί ’ , ὁ δέ  γε πρότασις γίγνομαι  ὁ ἐλάσσων ἐν ὁ συλλογισμός λέγω ‘ ὁ δέ Α ὁ  μέγας εἰμί ὁ Γ μέγας εἰμί ’ ·
472111	tlg2001.tlg042.opp-grc1	συναχθήσεται γὰρ οὕτως τὸ καὶ τὸΑ τοὐ Γ μεῖζον εἶναι κατὰ συλλογισμόν.	γάρ οὕτως ὁ καί ὁ Α   μέγας εἰμί κατά συλλογισμός .
472112	tlg2001.tlg042.opp-grc1	ἐπεὶ ἀναγκαίως γε πολλάκις ληφθεῖσί τισιν ἀκολουθεῖ καὶ παρὰ τὴν τῆς ὕλης ἰδιότητα καίτοι ἀσυλλογίστως κειμένων, ἐφ’ οἷς τὸ ἀναγκαῖον, ὡς ἐπὶ τῶν ὁρισμῶν καὶ τῶν ἱδίων ἐν δευτέρῳ σχήματι δύο καταφατικῶν ληφθεισῶν προτάσεων.	ἐπεί ἀναγκαῖος γε πολλάκις   ἀκολουθέω καί παρά ὁ ὁ ὕλη ἰδιότης  ἀσυλλόγιστος  , ἐπί ὅς ὁ ἀναγκαῖον , ὡς ἐπί ὁ ὁρισμός καί ὁ  ἐν δεύτερος σχῆμα γε  λαμβάνω πρότασις .
472113	tlg2001.tlg042.opp-grc1	ὁμοίως γονέων, οἷον ὁ Α τῷ Β.	ὅμοιος γονεύς , οἷος ὁ  τῷ  .
472114	tlg2001.tlg042.opp-grc1	ἀλλὰ καὶ ὁ Β τῷΓ ἐκ τῶν αὐτῶν ἐστι γονέων·	ἀλλά καί ὁ  τῷ Γ ἐκ ὁ αὐτός εἰμί  ·
472115	tlg2001.tlg042.opp-grc1	ὁ Α ἄοα τῷΓ ἐκ τῶν αὐτῶν γονέων ἐστί.	ὁ   τῷ Γ ἐκ ὁ αὐτός  εἰμί .
472116	tlg2001.tlg042.opp-grc1	λείπει γὰρ πρὸς τὸ συλλογισμόν γενέσθαι καθόλου πρότασις ἡ λέγουσα πάντας τοὺς τῷ αὐτῷ ἐκ τῶν ἀυτῶν γονέων ὄντας ἀδελφοὺς εἶναι·	λείπω γάρ πρός ὁ  γίγνομαι καθόλου πρότασις ὁ λέγω πᾶς ὁ τῷ αὐτός ἐκ ὁ  γονεύς εἰμί ἀδελφός εἰμί ·
472117	tlg2001.tlg042.opp-grc1	ᾗ προτάσει ἂν προστεθῇ ἡ διῃρημένη μία γενομένη ἡ λέγουσα ἰοὶ δὲΑ καὶΓ ἐκ τῶν αὐτῶν γονέων εισι τῳ Β᾿·	ὅς  ἄν προστίθημι ὁ διαιρέω  γίγνομαι ὁ λέγω ἰός δέ Α καί Γ ἐκ ὁ αὐτός     ·
472118	tlg2001.tlg042.opp-grc1	οὕτως γὰρ συνάγεται τὸ τοὺς ΑΓ ἀδελφοὺς εἶναι.	οὕτως γάρ συνάγω ὁ ὁ  Γ ἀδελφός εἰμί .
472119	tlg2001.tlg042.opp-grc1	ὅτι γὰρ διὰ τὴν καθόλου πρότασιν τὴν προστεθειμένην ὁ συλλογισμός, δῆλον ἐκ του μή, ἄν μὴ τὸ καθόλου ἀληθὲς ἧ μηκέτ᾿ ἀληθὲς εἶναι τὸ ἐπὶ τοῖς οὕτω ληφθεῖσι συμπέρασμα·	ὅτι2 γάρ διά ὁ καθόλου πρότασις ὁ  ὁ συλλογισμός , δῆλος ἐκ  μή , ἄν μή ὁ καθόλου ἀληθής ἧ  ἀληθής εἰμί ὁ ἐπί ὁ οὕτως λαμβάνω συμπέρασμα ·
472120	tlg2001.tlg042.opp-grc1	οὐ γὰρ ἔτι ἀληθὲς γίνεται, ἂν λάβωμεν‘ ὁ Α τοῦ Β ἀδελφός ἐστιν, ὁ Β τοῦΓ ἀδελφός ἀστι᾿, τὸ καὶ τὸνΑ τοῦΓ ἐξ ἀνάγκης ἀδελφὸν εἶναι τῳ μη εἶναι την καθόλου πρότασιν ἀληθῆ τὴν ὅτι οἱ τῷ αὐτῷ ἀδελφοὶ καὶ ἀλλήλοις εἰσὶν οἱ ἀδελφοί.	οὐ γάρ ἔτι ἀληθής γίγνομαι , ἐάν λαμβάνω ‘ ὁ  ὁ  ἀδελφός εἰμί , ὁ  ὁ Γ ἀδελφός  , ὁ καί ὁ Α ὁ Γ ἐκ ἀνάγκη ἀδελφός εἰμί   εἰμί  καθόλου πρότασις ἀληθής ὁ ὅτι2 ὁ τῷ αὐτός ἀδελφός καί ἀλλήλων εἰμί ὁ ἀδελφός .
472121	tlg2001.tlg042.opp-grc1	ὁ γὰρ παῖδα ἔχων καὶ ἀγαγόμενος ἄλλην γυναῖκα παῖδα καὶ αὐτὴν ἔχουσαν ἄν σχῇ ἐκ ταύτης παῖδα, ἑκατέρου μὲν τῶν προυπαρχοντων αύτοις παιδίων ἀδελφὸς ἔσται τοῦτο, οὐ μὴν διὰ τοῦτο καὶ ἀλλήλων ἀδελφοὶ οἱ προϋπάρχοντες.	ὁ γάρ παῖς ἔχω καί  ἄλλος γυνή παῖς καί αὐτός ἔχω ἄν ἔχω ἐκ οὗτος παῖς , ἑκάτερος μέν ὁ   παιδίον ἀδελφός  οὗτος , οὐ μήν διά οὗτος καί ἀλλήλων ἀδελφός ὁ προϋπάρχω .
472122	tlg2001.tlg042.opp-grc1	Τοιοῦτοί εἰσιν, οὓς λέγουσιν οἱ νεώτεροι ἀμεθόδως περαίνοντας.	εἰμί , ὅς λέγω ὁ νέος  περαίνω .
472123	tlg2001.tlg042.opp-grc1	| οὓς ὅτι μὲν <μὴ> λέγουσι συλλογιστικῶς συνάγειν, ὑγιῶς λέγουσι·	ὅς ὅτι2 μέν  λέγω συλλογιστικός συνάγω , ὑγιής λέγω ·
472124	tlg2001.tlg042.opp-grc1	πολλοὶ γὰρ εἰσι τοιοῦτοι.	πολύς γάρ εἰμί τοιοῦτος .
472125	tlg2001.tlg042.opp-grc1	ὅτι δὲ ἡγοῦνται ὁμοίους αὐτοὺς εἶναι τοῖς κατηγορικοῖς συλλογισμοῖς, περὶ ὧν ἡ παροῦσα πραγματεία, οὕτως λαμβανομένους, ὡς τιθέασιν αὐτούς, τοὐ παντὸς διαμαρτάνουσιν·	ὅτι2 δέ  ὅμοιος αὐτός εἰμί ὁ  συλλογισμός , περί ὅς ὁ πάρειμι πραγματεία , οὕτως λαμβάνω , ὡς τίθημι αὐτός ,  πᾶς διαμαρτάνω ·
472126	tlg2001.tlg042.opp-grc1	εἰ γὰρ ἦσαν τούτοις ὅμοιοι, εἶχον ἄν καὶ τὸ εἶναι συλλογισμοί.	εἰ γάρ εἰμί οὗτος ὅμοιος , ἔχω ἄν καί ὁ εἰμί  .
472127	tlg2001.tlg042.opp-grc1	νῦν δὲ οἱ μὲν πολλοὶ τῶν τοιούτων λόγων ἐκ πάντων ἐπὶ μέρους εἰσίν·	νῦν δέ ὁ μέν πολύς ὁ τοιοῦτος λόγος ἐκ πᾶς ἐπί μέρος εἰμί ·
472128	tlg2001.tlg042.opp-grc1	ἡμεῖς δὲ ἐδείξαμεν μηδένα τῶν κατηγορικῶν συλλογισμῶν γινόμενον χωρὶς καθόλου προτάσεως.	δέ δείκνυμι  ὁ  συλλογισμός  χωρίς καθόλου πρότασις .
472129	tlg2001.tlg042.opp-grc1	εἰ γὰρ ἐγίνετό τι κατὰ συλλογισμὸν συμπέρασμα ἐπὶ δύο προτάσεσιν ἐν μέρει, ἔδει ἐπὶ πάσης ὕλης τὸ ὅμοιον γίνεσθαι συμπέρασμα·	εἰ γάρ  τις κατά συλλογισμός συμπέρασμα ἐπί γε  ἐν μέρος , δέω ἐπί πᾶς ὕλη ὁ ὅμοιος γίγνομαι συμπέρασμα ·
472130	tlg2001.tlg042.opp-grc1	διὸ καὶ οὗτοι οὐκ ὄντες καθ’ αὑτοὺς συλλογιστικοὶ προστεθείσης αὐτοῖς τῆς καθόλου προτάσεως, ὡς εἴρηται, γίνονται συλλογισμοί.	διό καί οὗτος οὐ εἰμί κατά ἑαυτοῦ συλλογιστικός προστίθημι αὐτός ὁ καθόλου πρότασις , ὡς λέγω , γίγνομαι συλλογισμός .
472131	tlg2001.tlg042.opp-grc1	ἡ γὰρ αἰτία τοῦ τοὺς λεγομένους ἀμεθόδως περαίνειν ἔχειν ἐξ ἀνάγκης τοῖς κειμένοις ἑπόμενον τὸ δοκοῦν συνάγεσθαι παρὰ τὸ καὶ ἐν τούτοις ἀληθῆ εἶναι τὴν καθόλου πρότασιν ὄντων τοιούτων τῶν λαμβανομένων, ἣν παραλεί- πουσι·	ὁ γάρ αἰτία ὁ ὁ λέγω  περαίνω ἔχω ἐκ ἀνάγκη ὁ   ὁ δοκέω συνάγω παρά ὁ καί ἐν οὗτος ἀληθής εἰμί ὁ καθόλου πρότασις εἰμί τοιοῦτος ὁ λαμβάνω , ὅς  -  ·
472132	tlg2001.tlg042.opp-grc1	διαιροῦσι δὲ τὴν ἐλάττονα εἰς δύο προτάσεις.	διαιρέω δέ ὁ ἐλάσσων εἰς γε πρότασις .
472133	tlg2001.tlg042.opp-grc1	τοιοῦτοι γάρ εἰσιν οἱ τοιοίδε·	τοιοῦτος γάρ εἰμί ἕ τοιόσδε ·
472134	tlg2001.tlg042.opp-grc1	λέγει Δίων, ὅτι ἡμέρα ἐστίν·	λέγω Δίων , ὅτι2 ἡμέρα εἰμί ·
472135	tlg2001.tlg042.opp-grc1	ἀλλὰ καὶ ἀληθεύει Δίων·	ἀλλά καί ἀληθεύω Δίων ·
472136	tlg2001.tlg042.opp-grc1	ἡμέρα ἄρα ἐστί.	ἡμέρα ἄρα εἰμί .
472137	tlg2001.tlg042.opp-grc1	πάλιν λέγει Δίων, ὅτι ἡμέρα ἐστίν·	πάλιν λέγω Δίων , ὅτι2 ἡμέρα εἰμί ·
472138	tlg2001.tlg042.opp-grc1	ἀλλὰ καὶ ἡμέρα ἐστίν·	ἀλλά καί ἡμέρα εἰμί ·
472139	tlg2001.tlg042.opp-grc1	ἀληθεύει ἄρα Δίων.	ἀληθεύω ἄρα Δίος .
472140	tlg2001.tlg042.opp-grc1	προσληφθέντι μὲν γὰρ τῷ εἶναι τοῦτο, ὅ λέγει τις, ἕπεται τὸ ἀληθεύειν αὐτόν·	μέν γάρ τῷ εἰμί οὗτος ,  λέγω τις ,  ὁ ἀληθεύω αὐτός ·
472141	tlg2001.tlg042.opp-grc1	εἰ δὲ ἀληθεύειν προσληφθείη, ἕπεται τὸ εἶναι τοῦτο, ὃ λέγει εἶναι.	εἰ δέ ἀληθεύω  ,  ὁ εἰμί οὗτος , ὅς λέγω εἰμί .
472142	tlg2001.tlg042.opp-grc1	ἐν ἑκατέρω γὰρ τῶν λόγων παρειάθησαν καθόλου προτάσεις ἀληθεῖς οὖσαι, ἐν τῷ μὲν τὸ‘ πᾶν, ὃ λέγων τις ἀληθεύει, ἐκεῖνο ἔστιν·	ἐν  γάρ ὁ λόγος  καθόλου πρότασις ἀληθής εἰμί , ἐν τῷ μέν ὁ ‘ πᾶς , ὅς λέγω τις ἀληθεύω , ἐκεῖνος εἰμί ·
472143	tlg2001.tlg042.opp-grc1	ἀληθεύει δὲ Δίων λέγων, ὅτι ἡμέρα ἀστίν᾿, ὃ διῄρηται εἴς τε τὸ‘ λέγει Δίων, ὅτι ἡμέρα ἐστί’ καὶ τὸ‘ ἀλλὰ καὶ ἀληθεύει Δίων’, ἐφ’ οἷς συμπέρασμα κατὰ συλλογισμὸν τὸ‘ ἡμέρα ἄρα ἐστίν, ὃ λέγει Δίων’·	ἀληθεύω δέ Δίος λέγω , ὅτι2 ἡμέρα  ,   εἰς τε ὁ ‘ λέγω Δίος , ὅτι2 ἡμέρα εἰμί ’ καί ὁ ‘ ἀλλά καί ἀληθεύω Δίων ’ , ἐπί ὅς συμπέρασμα κατά συλλογισμός ὁ ‘ ἡμέρα ἄρα εἰμί , ὅς λέγω Δίος ’ ·
472144	tlg2001.tlg042.opp-grc1	ἐν δὲ τῷ ἑτέρῳ ἡ μὲν παρειμένη πρότασις οὖσα καθόλου ἐστὶν ὅτι ὁ τὸ ὂν λέγων, ὅτι ἐστίν, ἀληθεύει·	ἐν δέ τῷ ἕτερος ὁ μέν παρίημι πρότασις εἰμί καθόλου εἰμί ὅτι2 ὁ ὁ  λέγω , ὅτι2 εἰμί , ἀληθεύω ·
472145	tlg2001.tlg042.opp-grc1	διῄρηται δὲ ἡ‘ Δίων δὲ ἡμέρας οὔσης λέγει, ὅτι ἡμέρα ἐστίν’·	διαιρέω δέ ὁ ‘ Δίος δέ ἡμέρα εἰμί λέγω , ὅτι2 ἡμέρα εἰμί ’ ·
472146	tlg2001.tlg042.opp-grc1	αὕτη γὰρ διῄρηται εἴς τε τὴν‘ λέγει Δίων, ὅτι ἡμέρα ἐστί’ καὶ τὴν‘ ἡμέρα ἐστί‘.	οὗτος γάρ διαιρέω εἰμί τε ὁ ‘ λέγω Δίων , ὅτι2 ἡμέρα εἰμί ’ καί ὁ ‘ ἡμέρα εἰμί ‘ .
472147	tlg2001.tlg042.opp-grc1	δυμπέρασμα γὰρ συλλογιστικῶς, οὐκέτ’ ἀμεθόδως| οὕτω ληφθεισῶν τῶν προτάσεων τὸ‘ Δίων ἀληθεύει’.	γάρ συλλογιστικός ,   | οὕτως λαμβάνω ὁ πρότασις ὁ ‘ Δίων ἀληθεύω ’ .
472148	tlg2001.tlg042.opp-grc1	ὅσον δὴ οἱ οὕτως λαμβανόμενοι τῶν ἐκείνως διαφέρουσι, τοσοῦτον καὶ οἱ κατηγορικοὶ συλλογισμοὶ τῶν λεγομένων ἀμεθόδως περαίνειν.	ὅσος δή ὁ οὕτως λαμβάνω ὁ ἐκεῖνος διαφέρω ,  καί ὁ  συλλογισμός ὁ λέγω  περαίνω .
472149	tlg2001.tlg042.opp-grc1	Ἐπ᾿ ἐνίων μὲν οὖν λόγων οὐ χαλεπὸν τὸ συνιδεῖν, τί ἐνδοῖ πρὸς τὸ πλήρη συλλογισμὸν γίνεσθαι, καὶ τί περιττὸν εἴληπται, ὡς ἐφ’ ὧν προειρήκαμεν λόγων·	ἔνιοι μέν οὖν λόγος οὐ χαλεπός ὁ συνοράω ,   πρός ὁ   γίγνομαι , καί τι περισσός λαμβάνω , ὡς ἐπί ὅς προαγορεύω λόγος ·
472150	tlg2001.tlg042.opp-grc1	δῆλον γὰρ ἐν τούτοις τὸ παρειμένον.	δῆλος γάρ ἐν οὗτος ὁ παρίημι .
472151	tlg2001.tlg042.opp-grc1	ἀλλὰ καὶ ἐφ’ ὧν ἄλλο τι συμπέρασμα ἐπενήνεκται καὶ οὐ τὸ ἐκ τῶν κειμένων συναγόμενον, ὡς ἔχει ἐπὶ τοῦ Ἐπικούρου λόγου ἠρωτημένου τοῦ‘ θάνατος οὐδὲν πρὸς ἡμᾶς·	ἀλλά καί ἐπί ὅς ἄλλος τι συμπέρασμα  καί οὐ ὁ ἐκ ὁ  συνάγω , ὡς ἔχω ἐπί ὁ Ἐπίκουρος λόγος  ὁ ‘ θάνατος  πρός  ·
472152	tlg2001.tlg042.opp-grc1	τὸ γὰρ διαλυθὲν ἀναισθητεῖ, τὸδ’ ἀναισθητοῦν οὐδὲν πρὸς ἡμᾶς᾿.	ὁ γάρ διαλύω ἀναισθητέω , ὁ δ’  οὐδείς πρός  .
472153	tlg2001.tlg042.opp-grc1	ἀλλ’ οὐ τοῦτο τὸ συναγόμενον, ἀλλ’ ὅτι τὸ διαλυθὲν οὐδὲν πρὸς ἡμᾶς ἐν πρώτῳ σχήματι.	ἀλλά οὐ οὗτος ὁ συνάγω , ἀλλά ὅτι2 ὁ διαλύω  πρός ἐγώ ἐν πρῶτος σχῆμα .
472154	tlg2001.tlg042.opp-grc1	ὁμοίως καὶ ἐπὶ τοῦ Παρμενίδου λόγου συνάγοντος, ὅτι τὸ ὄν, <ἐκ τῶν‘ τὸ παρὰ τὸ ὄν,τὸ> οὐκ ὄν,<τὸ> οὐκ ὂν καὶ καὶ συναγόμενον φανερόν ἐστι·	ὅμοιος καί ἐπί ὁ Παρμενίδης λόγος συνάγω , ὅτι2 ὁ εἰμί ,  ὁ ‘ ὁ παρά ὁ εἰμί , τὸ> οὐ  , <τὸ> οὐ εἰμί καί καί συνάγω  εἰμί ·
472155	tlg2001.tlg042.opp-grc1	συνάγεται γὰρ ἐκ τῶν κειμένων τὸ παρὰ τὸ ὂν μηδὲν εἶναι ἐν πρώτῳ σχήματι, ἀλλ’ οὐ τὸ‘ ἓν ἄρα τὸ ὄν’, ὡς ἐκεῖνος οἴεται.	συνάγω γάρ ἐκ ὁ  ὁ παρά ὁ εἰμί  εἰμί ἐν πρῶτος σχῆμα , ἀλλά οὐ ὁ ‘  ἄρα ὁ  , ὡς ἐκεῖνος οἴομαι .
472156	tlg2001.tlg042.opp-grc1	δεῖ γὰρ καθόλου τὸ συμπέρασμα ἐκ τῶν ἄκρων τῶν εἰλημμένων ἐν ταῖς προτάσεσι ταῖς δύο συγκεῖσθαι.	δέω γάρ καθόλου ὁ συμπέρασμα ἐκ ὁ ἄκρος ὁ  ἐν ὁ πρότασις ὁ γε σύγκειμαι .
472157	tlg2001.tlg042.opp-grc1	ἄκροι δέ εἰσιν ἐν ταῖς προτάσεσιν οἱ ἀνὰ ἅπαξ εἰλημμένοι ἐν τῇ θέσει τῶν προτάσεων·	ἄκρος δέ εἰμί ἐν ὁ  ὁ ἀνά ἅπαξ λαμβάνω ἐν ὁ θέσις ὁ πρότασις ·
472158	tlg2001.tlg042.opp-grc1	ὁ γὰρ ἐν ἀμφοτέραις κείμενος ταῖς προτάσεσι καὶ ἑκατέρῳ τῶν ἄκρων συναπτόμενος ὁ μέσος ἐστίν.	ὁ γάρ ἐν ἀμφότερος  ὁ πρότασις καί ἑκάτερος ὁ   ὁ  εἰμί .
472159	tlg2001.tlg042.opp-grc1	ἐπ’ ἐνίων μὲν οὖν, ὡς ἔφην, ῥᾷον τὸ φωρᾶσαι τὴν κατὰ λόγους ἁμαρτίαν·	ἐπί ἔνιοι μέν οὖν , ὡς φημί ,  ὁ φωράω ὁ κατά λόγος ἁμαρτία ·
472160	tlg2001.tlg042.opp-grc1	ἐπ’ ἐνίων δὲ οὐ ῥᾴδιον συνιδεῖν, ἀλλὰ δοκοῦσι συλλογισμοὶ εἶναι, οὐκ ὄντες, διὰ τὸ τοῖς κειμένοις ἕπεσθαι τὸ ἐπιφερόμενον ἐξ ἀνάγκης, ὡς ἐφ’ ὧν γε ἤδη εἰρήκαμεν, δῆλόν ἐστι καὶ ἐφ’ οὗ νῦν παραθησόμεθα παραδείγματος, ὅ ἐστι τοιοῦτον·	ἐπί ἔνιοι δέ οὐ  συνοράω , ἀλλά δοκέω συλλογισμός εἰμί , οὐ εἰμί , διά ὁ ὁ   ὁ ἐπιφέρω ἐκ ἀνάγκη , ὡς ἐπί ὅς γε ἤδη λέγω , δῆλος εἰμί καί ἐπί οὗ νῦν  παράδειγμα , ὅς εἰμί τοιοῦτος ·
472161	tlg2001.tlg042.opp-grc1	μὴ οὐσίας ἀναιρουμένης οὐκ ἀναιρεῖται οὐσία·	μή οὐσία  οὐ ἀναιρέω  ·
472162	tlg2001.tlg042.opp-grc1	ἐξ ὧν δέ ἐστί τι ἀναιρουμένων καὶ τὸ ἐκ τούτων φθείρεται.	ἐκ ὅς δέ εἰμί τι ἀναιρέω καί ὁ ἐκ οὗτος φθείρω .
472163	tlg2001.tlg042.opp-grc1	ἐκ γὰρ τούτων ἀναγκαῖον τὸ οὐσίας μέρος εἶναι οὐσίαν·	ἐκ γάρ οὗτος ἀναγκαῖον ὁ οὐσία μέρος εἰμί οὐσία ·
472164	tlg2001.tlg042.opp-grc1	οὐ μὴν συλλογιστικῶς δέδεικται, ἀλλὰ λείπουσί τινες προτάσεις πρὸς τὸ γενέσθαι <σθλλογισμόν, τουτέστιν οὐχ ἃ ἔδει κεῖνται, ἀλλ’ αἱ μὲν ἰσοδυναμοῦσι> ταῖς, ἐξ ὧν δειχθείη ἄν τι τὸ δέ τι παρεᾶται.	οὐ μήν συλλογιστικός δείκνυμι , ἀλλά λείπω τις πρότασις πρός ὁ γίγνομαι  ,  οὐ ὅς δέω κεῖμαι , ἀλλά ὁ μέν  ὁ , ἐκ ὅς δείκνυμι ἄν τι ὁ δέ τι  .
472165	tlg2001.tlg042.opp-grc1	ἄν δὴ εἰς ἐκείνας μεταληφθῶσιν αὗται αἱ κείμεναι καὶ προσληφθείη τὸ| λεῖπον, συλλογισμὸς ἔσται.	ἄν δή εἰς   οὗτος ὁ  καί  ὁ | λείπω , συλλογισμός εἰμί .
472166	tlg2001.tlg042.opp-grc1	τῇ μὲν γὰρ‘ οὐσίας μὴ ἀναιρουμένης οὐκ ἀναιρεῖται οὐσία’ ἴσον δύναται αὐτῇ ἡ ἀντιστρέφουσα ἡ λέγουσα‘ τὸ συναναιροῦν οὐσίαν οὐσία ἐστίν·	ὁ μέν γάρ ‘ οὐσία μή ἀναιρέω οὐ ἀναιρέω οὐσία ’ ἴσος δύναμαι αὐτός ὁ  ὁ λέγω ‘ ὁ  οὐσία  εἰμί ·
