id	filename	tokens	lemmas
471201	tlg2001.tlg042.opp-grc1	τὸ γὰρ δι’ ἐπαγωγῆς δειχθὲν προτάσεων ἡ Β ἦν διὰ συλλογισμοῦ δεδειγμένη, ὥστε καὶ οὕτως δύο συλλο- γισμοί.	ὁ γάρ διά ἐπαγωγή  πρότασις ὁ  εἰμί διά συλλογισμός  , ὥστε καί οὕτως γε  -  .
471202	tlg2001.tlg042.opp-grc1	εἰ δ’ οὖν ἀξιῴη τις καὶ τὸν τοιοῦτον ἕνα συλλογισμὸν εἶναι τῷ πρὸς τὴν τοῦ τελευταίου συμπεράσματος δεῖξιν καὶ τὰς τῶν προτάσεων δείξεις συντελεῖν, οὐ φιλονεικητέον πρὸς τοῦτο, ἀλλὰ γνωστέον, ὅτι οὕτως μὲν καὶ τοῦτον τὸν τρόπον ἐγχωρεῖ διὰ πλειόνων ὅρων καὶ προτάσεων γίνεσθαι τὸ αὐτὸ συμπέρασμα ἐμπεριεχομένων πλειόνων συμπερασμάτων τῷ παντὶ λόγῳ.	εἰ  οὖν   καί ὁ τοιοῦτος  συλλογισμός εἰμί τῷ πρός ὁ ὁ τελευταῖος συμπέρασμα  καί ὁ ὁ πρότασις δεῖξις συντελέω , οὐ  πρός οὗτος , ἀλλά γιγνώσκω , ὅτι2 οὕτως μέν καί οὗτος ὁ τρόπος ἐγχωρέω διά πολύς ὅρος καί πρότασις γίγνομαι ὁ αὐτός συμπέρασμα   συμπέρασμα ὁ πᾶς λόγος .
471203	tlg2001.tlg042.opp-grc1	ὡς δὲ τὸΓ διὰ τῶνΑ,Β, ἀδύνατον, τουτέστιν‘ οὕτως δέ, ὡς διὰ δύο προτάσεων δείκνυταί τι, λέγειν καὶ διὰ πλειόνων προσεχῶν λαμβανομένων καὶ μηδὲν ἄλλο ἀλλ’ ἢ τὸ προκείμενον συμπέρασμα συναγουσῶν ἀδύνατον’.	ὡς δέ ὁ Γ διά ὁ Α , Β , ἀδύνατος ,  ‘ οὕτως δέ , ὡς διά γε πρότασις  τις , λέγω καί διά πολύς  λαμβάνω καί  ἄλλος ἀλλά τίη ὁ  συμπέρασμα  ἀδύνατος ’ .
471204	tlg2001.tlg042.opp-grc1	Ὅτι μὲν οὖν πᾶς συλλογισμὸς διὰ τριῶν ὅρων καὶ διὰ προτάσεων προσε- χῶν δύο δείκνυται, δι’ ὑποθέσεως δεικτέον.	ὅτι2 μέν οὖν πᾶς συλλογισμός διά  ὅρος καί διά πρότασις  - χοῦς γε δείκνυμι , διά ὑπόθεσις δείκνυμι .
471205	tlg2001.tlg042.opp-grc1	εἰ γὰρ οἷόν τε διὰ πλειόνων, ἔστω τὸE δεδειγμένον διὰ προτάσεων τῶνΑ ΒΓΔ.	εἰ γάρ  τε διά πολύς , εἰμί ὁ E δείκνυμι διά πρότασις ὁ Α  Γ Δ .
471206	tlg2001.tlg042.opp-grc1	καὶ ποιητέον τὴν δεῖξιν ἐπὶ τοῦ πρώτου σχήματος·	καί ποιέω ὁ  ἐπί ὁ πρῶτος σχῆμα ·
471207	tlg2001.tlg042.opp-grc1	ὡς γὰρ ἄν ἐπὶ τούτου δειχθῇ, οὕτως ἔσται καὶ ἐπὶ τῶν ἄλλων σχημάτων.	ὡς γάρ ἄν ἐπί οὗτος δείκνυμι , οὕτως εἰμί καί ἐπί ὁ ἄλλος σχῆμα .
471208	tlg2001.tlg042.opp-grc1	οὐκοῦν εἰ τὸ E συλλο| γιστικῶς δείκνυται ται διὰ τῶν Α ΒΓΔ προτάσεων, προτάσεων, ἀνάγκη ἐν αὐταῖς εἶναι τὸ μέν τι ὡς ὅλον τὸ δὲ ὡς μέρος, τουτέστι τὴν μέν τινα πρότασιν καθόλου τὴν δὲ ὑπὸ ταύτην ἀδύνατον γὰρ ἄλλως γενέσθαι συλλογισμὸν μὴ τοῦ μὲν καθόλου ληφθέντος τοῦ δὲ ἐπὶ μέρους καὶ ἐν τούτῳ περιεχομένου.	οὐκοῦν εἰ ὁ   |  δείκνυμι  διά ὁ   Γ Δ πρότασις , πρότασις , ἀνάγκη ἐν αὐτός εἰμί ὁ μέν τι ὡς ὅλος ὁ δέ ὡς μέρος ,  ὁ μέν τις πρότασις καθόλου ὁ δέ ὑπό οὗτος ἀδύνατος γάρ ἄλλος γίγνομαι συλλογισμός μή ὁ μέν καθόλου λαμβάνω ὁ δέ ἐπί μέρος καί ἐν οὗτος περιέχω .
471209	tlg2001.tlg042.opp-grc1	δέδεικται γάρ, ὅτι, εἰ εἴη συλλογισμός, ἀνάγκη τινὰς τῶν δεικτικῶν συλλογιστικῶς τοῦ προκειμένου πρὸς ἀλλήλους οὕτως ἔχειν ὡς τὸν μὲν περιέχειν τὸν δὲ περιέχεσθαι.	δείκνυμι γάρ , ὅτι2 , εἰ εἰμί συλλογισμός , ἀνάγκη  ὁ δεικτικός συλλογιστικός ὁ  πρός ἀλλήλων οὕτως ἔχω ὡς ὁ μέν περιέχω ὁ δέ περιέχω .
471210	tlg2001.tlg042.opp-grc1	τοῦτο γὰρ δέδεικται μὲν καὶ πρὸ ὀλίγου, εἰρήκαμεν δὲ αὐτὸ <καὶ> ἐν τῇ τῶν συλλογισμῶν καταριθμήσει τε καὶ ἐκθέσει·	οὗτος γάρ δείκνυμι μέν καί πρό ὀλίγος , λέγω δέ αὐτός  ἐν ὁ ὁ συλλογισμός  τε καί  ·
471211	tlg2001.tlg042.opp-grc1	αὕτη γὰρ ἦν πρώτη γένεσις τῶν συλλογισμῶν·	οὗτος γάρ εἰμί πρῶτος γένεσις ὁ συλλογισμός ·
471212	tlg2001.tlg042.opp-grc1	τῷ γὰρ ἐν ὅλῳ ἄλλῳ ἄλλον εἶναι καὶ τῷ κατὰ παντὸς ἄλλον ἄλλου λέγεσθαι τούτων τῶν ἀναποδείκτων τούτων συλλογισμῶν εὑρέσεις.	τῷ γάρ ἐν ὅλος ἄλλος ἄλλος εἰμί καί τῷ κατά πᾶς ἄλλος ἄλλος λέγω οὗτος ὁ ἀναπόδεικτος οὗτος συλλογισμός εὕρεσις .
471213	tlg2001.tlg042.opp-grc1	οὐ μόνον δὲ ἔδει τοὺς ὅρους οὕτως ἔχειν πρὸς ἀλλήλους ἀλλὰ καὶ τῶν προτάσεων τὴν μὲν καθόλου εἶναι πρὸς τὸ κείμενον, ἣν καὶ μείζονα ἐλέγομεν, τὴν δὲ ἐλάττονά τε καὶ ὑπὸ ταύτην.	οὐ μόνος δέ δέω ὁ ὅρος οὕτως ἔχω πρός ἀλλήλων ἀλλά καί ὁ πρότασις ὁ μέν καθόλου εἰμί πρός ὁ  , ὅς καί μέγας  , ὁ δέ  τε καί ὑπό οὗτος .
471214	tlg2001.tlg042.opp-grc1	δεήσει γοῦν καὶ ἐπὶ τῶνABΓ Δ προτάσεων τοῦτο γίνεσθαι καὶ εἶναί τινα σχέσιν αὐτῶν πρὸς ἀλλήλας τοιαύτην ὡς συνῆφθαί τε ἀλλήλαις καὶ εἶναι τὴν μὲν καθόλου τὴν δὲ ὑπ’ αὐτήν, εἰ συναχθήσεταί τι δι’ αὐτῶν συλλογιστικῶς.	δέω2 γοῦν καί ἐπί ὁ A B Γ  πρότασις οὗτος γίγνομαι καί εἰμί τις σχέσις αὐτός πρός ἀλλήλων τοιοῦτος ὡς  τε ἀλλήλων καί εἰμί ὁ μέν καθόλου ὁ δέ ὑπό αὐτός , εἰ  τι διά αὐτός συλλογιστικός .
471215	tlg2001.tlg042.opp-grc1	ἐχέτωσαν οὖν οὕτω πρὸς ἀλλήλας αἱ προτάσεις, ἥ τεΑ καὶ Β.	οὖν οὕτως πρός ἀλλήλων ὁ  , ὁ τε Α καί  .
471216	tlg2001.tlg042.opp-grc1	οὐκοῦν εἰ οὕτως ἔχουσι πρὸς ἀλλήλας, δῆλον ὡς συναχθήσεταί τι ἐξ αὐτῶν·	οὐκοῦν εἰ οὕτως ἔχω πρός ἀλλήλων , δῆλος ὡς  τις ἐκ αὐτός ·
471217	tlg2001.tlg042.opp-grc1	ὅταν γὰρ δύο προτάσεις οὕτως ἔχειν ληφθῶσι πρὸς ἀλλήλας, ἐξ ἀνάγκης συνάγεταί τι ἐξ αὐ·	ὅταν γάρ γε  οὕτως ἔχω λαμβάνω πρός ἀλλήλων , ἐκ ἀνάγκη  τις ἐκ  ·
471218	tlg2001.tlg042.opp-grc1	τῶν, καὶ δείκνυται συλλογιστικῶς τὸ δεικνύμεον, καὶ συναγόμενον ἐκ τῶν Α, Β προτάσεων οὕτως ἐχουσῶν πρὸς ἀλλήλας ἤτοι τὸE έσται, ὅπερ ἦν προκείμενον δείκνυσθαι ἐκ τῶν ΑBΓ Δ προτάσεων, ἢ τὸ τερον τῶνΓ,Δ, ἃ καὶ αὐτὰ συνακτικὰ μετὰ τῶν Α, Β ἔκειτο τοῦ E, ἢ οὔτε τὸE ὔτε τὸΓ οὔτε τὸΔ ἀλλὰ ἄλ| λο τι παρὰ ταῦτα πάντα.	ὁ , καί δείκνυμι συλλογιστικός ὁ  , καί συνάγω ἐκ ὁ  ,  πρότασις οὕτως ἔχω πρός ἀλλήλων ἤτοι ὁ E  , ὅς εἰμί  δείκνυμι ἐκ ὁ  B Γ  πρότασις , τίη ὁ  ὁ Γ , Δ ,  καί αὐτός  μετά ὁ  ,  κεῖμαι ὁ  , ἤ οὔτε ὁ E  ὁ Γ οὔτε ὁ Δ ἀλλά  |  τι παρά οὗτος πᾶς .
471219	tlg2001.tlg042.opp-grc1	εἴ μὲν οὖν τὸΕ, εἴη ἄν ἐκ τῶν δύο μόνων, τοῦ τεΑ καὶ τοῦ Β, συναγόμενον τὸΕ ἀλλ’ οὔκ ἐκ τῶν ὑποτεθέντων τεσσάρων.	εἰ μέν οὖν ὁ Ε , εἰμί ἄν ἐκ ὁ γε  , ὁ τε Α καί ὁ  , συνάγω ὁ Ε ἀλλά οὐ ἐκ ὁ  τέσσαρες .
471220	tlg2001.tlg042.opp-grc1	τὰ δὲ δύο, τὸ Γ καὶ τὸΔ, τουτέστιν αἱ προτάσεις αἱ δύο αἱ λοιπαί, εἰ μὲν καὶ αὐταὶ οὕτως ἔχουσι πρὸς ὰλλήλας ὡς τὴν μὲν καθόλου εἶναι, τὴν μείζονα πρότασιν, τὴν δ’ ἐλάττονά τε καὶ ὑπ’ ἐκείνην ὡς γίνεσθαι συλλογιστικὴν ὑπ’ αὐτῶν συζυγίαν, συναχθήσεταί τι καὶ ἐκ τούτων συλλογιστικῶς, καὶ ἤτοι τὸE ἢ τῶνΑ καὶ τῶν Β τὸ ἕτερον ἢ ἄλλο τι παρὰ ταῦτα.	ὁ δέ γε , ὁ  καί ὁ Δ ,  ὁ πρότασις ὁ γε ὁ λοιπός , εἰ μέν καί αὐτός οὕτως ἔχω πρός  ὡς ὁ μέν καθόλου εἰμί , ὁ μέγας πρότασις , ὁ   τε καί ὑπό ἐκεῖνος ὡς γίγνομαι  ὑπό αὐτός συζυγία ,  τις καί ἐκ οὗτος συλλογιστικός , καί ἤτοι ὁ E τίη ὁ Α καί ὁ  ὁ ἕτερος ἤ ἄλλος τις παρά οὗτος .
471221	tlg2001.tlg042.opp-grc1	εἰ μὲν οὖν τὸE ἐκ τούτων συνάγεται ὥσπερ καὶ ἐκ τῶνΑ, Β, πλείους ἔσονται συλλογισμοὶ τοῦ αὐτοῦ·	εἰ μέν οὖν ὁ E ἐκ οὗτος συνάγω ὥσπερ καί ἐκ ὁ Α ,  , πολύς εἰμί συλλογισμός ὁ αὐτός ·
471222	tlg2001.tlg042.opp-grc1	ἐδείχθη γάρ, ὅτι, ἄν τὸ αὐτὸ συμπέρασμα δι’ ἄλλων καὶ δι’ ἄλλων προτάσεων γίνηται, πλείους οἱ συλλογισμοί.	δείκνυμι γάρ , ὅτι2 , ἄν ὁ αὐτός συμπέρασμα διά ἄλλος καί διά ἄλλος πρότασις γίγνομαι , πολύς ὁ συλλογισμός .
471223	tlg2001.tlg042.opp-grc1	ἀλλὰ κἄν τῶνΑ, Β τὸ ἕτερον ὑπὸ τῶνΓ,Δ συνάγεται, καὶ οὕτω πλείους οἱ συλλογισμοὶ τὴν ἑτέραν πρότασιν τῶνΑ, Β, αἳ ἦσαν τοῦE συλλογιστιαί, συμπέρασμα εἶναι ἐπὶ ταῖςΓ,Δ προτάσεσιν.	ἀλλά  ὁ Α ,  ὁ ἕτερος ὑπό ὁ Γ , Δ συνάγω , καί οὕτως πολύς ὁ συλλογισμός ὁ ἕτερος πρότασις ὁ Α ,  , ὁ εἰμί ὁ E  , συμπέρασμα εἰμί ἐπί ὁ Γ , Δ  .
471224	tlg2001.tlg042.opp-grc1	ἔστι δὲ ἡ τοιαύτη σύνθεσις κατὰ τὸ τρίτον ὑπὸ τῶν νεωτέρων καλούμενον〈 θέμα〉 γινομένη, ὅ ἐστιν ὑπὸ τὸ προκείμενον ἡμῖν θεώρημα συνθετικόν, εἴ γε τοῦ μέν ἐστι περιοχή, ὥσπερ εἰρήκαμεν, ὅταν ἔκ τινων συνάγεταί τι, τὸ δὲ συναγόμενον μετὰ τινὸς ἢ τινῶν συνάγει τι, καὶ τὰ συνακτικὰ αὐτοῦ, μεθ’ οὗ ἢ μεθ’ ὧν συνάγει τι ἐκεῖνο, καὶ αὐτὰ τὸ αὐτὸ συνάξει᾿ εἰ δὲ μήτε τοῦE τὸ Γ,Δ μήτε τῶν Α, Β τοῦ ἑτέρου εἴη συλλογιστικά, ἄλλο δέ τι συλλογίζοιτο, πλείους τε ὁμοίως ἔσονται οἱ συλλογισμοὶ καὶ ἀσύναπτοι καὶ οὐδὲν κοινὸν πρὸς ἀλλήλους ἔχοντες·	εἰμί δέ ὁ τοιοῦτος σύνθεσις κατά ὁ τρίτος ὑπό ὁ νεώτερος καλέω 〈  〉  , ὅς εἰμί ὑπό ὁ  ἐγώ θεώρημα  , εἰ γε ὁ μέν εἰμί  , ὥσπερ λέγω , ὅταν ἐκ   τις , ὁ δέ συνάγω μετά  ἤ  συνάγω τι , καί ὁ  αὐτός , μετά οὗ τίη μετά ὅς συνάγω τις ἐκεῖνος , καί αὐτός ὁ αὐτός  εἰ δέ  ὁ E ὁ  , Δ μήτε ὁ  ,  ὁ ἕτερος εἰμί συλλογιστικός , ἄλλος δέ τις συλλογίζομαι , πολύς τε ὅμοιος εἰμί ὁ συλλογισμός καί  καί  κοινός πρός ἀλλήλων ἔχω ·
471225	tlg2001.tlg042.opp-grc1	οὔτε γὰρ αὐτὰ τὰΓ, Δ συνῆπται τῷΑ οὔτε τὸ δεικνύμενον ἐξ αὐτῶν, εἴ γε τὰ μὲν Α, Β τοῦE δεικτικά εἰσι, τὰ δὲΓ,Δ ἔξωθέν τινος ἄλλου καὶ οὔτε τοῦE οὔτε τῶν Α, Β τινός.	οὔτε γάρ αὐτός ὁ Γ ,  συνάπτω τῷ Α οὔτε ὁ δείκνυμι ἐκ αὐτός , εἰ γε ὁ μέν  ,  ὁ E δεικτικός εἰμί , ὁ δέ Γ , Δ ἔξωθεν  ἄλλος καί οὔτε ὁ E οὔτε ὁ  ,   .
471226	tlg2001.tlg042.opp-grc1	Εἰ δὲ μὴ οὕτως ἔχοιεν αἱ προτάσεις πρὸς ἀλλήλας αἱ Β,Γ ὡς ἔχειν συλλογιστικῶς τὸ συνάγειν, οὐκ ἀναγκαίως ἔσονται εἰλημμέναι·	εἰ δέ μή οὕτως ἔχω ὁ  πρός ἀλλήλων ὁ  , Γ ὡς ἔχω συλλογιστικός ὁ συνάγω , οὐ ἀναγκαῖος  λαμβάνω ·
471227	tlg2001.tlg042.opp-grc1	καὶ γὰρ χωρὶς τοῦ ληφθῆναι| αὐτὰς τὸ E συνήγετο ἄν ἐκ τῶν Α, Β.	καί γάρ χωρίς  λαμβάνω | αὐτός ὁ  συνάγω ἄν ἐκ ὁ  ,  .
471228	tlg2001.tlg042.opp-grc1	παρελκόντως οὖν καὶ μάτην ἔσται εἰλημμένα καὶ ἀχρήστως, εἰ μὴ ἐπαγωγῆς χάριν <ὡς> σασθαί τι τῶν τοῦΑ δεικτικῶν δι’ αὐτῶν ἢ κρύψεως χάριν ὡς διὰ τὴν τούτων παράθεσιν τὸν προσθιαλεγόμενον συγχωρεῖν ῥᾷον ταῖς τοῦ προκειμένου συλλογιστικαῖς προτάσεσι τῷ ταύτας ἐν μέσῳ τιθεμένας ἀποκρύπτειν καὶ μὴ ἐᾶν τὸ συμβησόμενον ἐκ τῶν συγχωρηθέντων καταφανὲς γίνεσθαι καὶ γνώρι- μον.	οὖν καί μάτην εἰμί λαμβάνω καί ἄχρηστος , εἰ μή ἐπαγωγή χάρις   τι ὁ ὁ Α δεικτικός διά αὐτός τίη  χάρις ὡς διά ὁ οὗτος παράθεσις ὁ  συγχωρέω ῥᾴδιος ὁ ὁ   πρότασις τῷ οὗτος ἐν μέσος  ἀποκρύπτω καί μή ἐάω ὁ συμβαίνω ἐκ ὁ συγχωρέω καταφανής γίγνομαι καί  -  .
471229	tlg2001.tlg042.opp-grc1	ῥᾷον γὰρ οἱ οὐκ εἰδότες τὸ συναχθησόμενον ἐκ τῶν συγχωρηθέντων συγχωροῦσιν, ὃ ποιοῦσιν αἱ κρύψεως χάριν τοῦ συμπεράσματος ἔξωθεν ἐπι- λαμβανόμεναι προτάσεις·	ῥᾴδιος γάρ ὁ οὐ οἶδα ὁ  ἐκ ὁ συγχωρέω συγχωρέω , ὁ ποιέω ὁ  χάριν ὁ συμπέρασμα ἔξωθεν ἐπί - λαμβάνω  ·
471230	tlg2001.tlg042.opp-grc1	τοῦτο δὲ ποιοῦσιν οἱ διαλεκτικοί·	οὗτος δέ ποιέω ὁ διαλεκτικός ·
471231	tlg2001.tlg042.opp-grc1	τε καὶ σοφισταί.	τε καί σοφιστής .
471232	tlg2001.tlg042.opp-grc1	ἢ εἴ τινος ἄλλου ἕνεκα, οἷον ὄγκου καὶ αὐξήσεως ἢ τοῦ σαφέστερον εἶναι τὸν λόγον·	τίη εἰ  ἄλλος ἕνεκα , οἷος ὄγκος καί αὔξησις ἤ ὁ σαφής εἰμί ὁ λόγος ·
471233	tlg2001.tlg042.opp-grc1	αἱ γὰρ παρὰ τὰς ἀναγκαίας προτάσεις λαμβανόμεναι τούτων τινὸς χάριν εἰώθασι λαμβάνεσθαι, ὡς δεδείχαμεν ἐν τῷ τελευταίῳ τῶν τοπικῶν, δι ἐπαγωγῆς μέν, ὅταν ἡ καθόλου πρότασις δέηται πίστεως, ὡς ἐδείξαμεν ἐν τῷ συνάγοντι λόγῳ τὴν πολιτικὴν ἀγαθοῦ τινος ἐφίεσθαι ἡ γὰρ πρότασις ἡ ‘ πᾶσα μέθοδος ἀγαθοῦ τινος ἐφίεται᾿ δι’ ἐπαγωγῆς ἐδείκνυτο), αὐξήσεως δέ, ὅταν μηκῦναί τις τὸν λόγον βούληται, ὡς ποιοῦσι πολλάκις οἱ συγγραφεῖς·	ὁ γάρ παρά ὁ ἀνάγκη πρότασις λαμβάνω οὗτος  χάρις εἴωθα λαμβάνω , ὡς  ἐν ὁ τελευταῖος ὁ τοπικός ,  ἐπαγωγή μέν , ὅταν ὁ καθόλου πρότασις δέω πίστις , ὡς δείκνυμι ἐν ὁ  λόγος ὁ πολιτικός   ἐφίημι ὁ γάρ πρότασις ὁ  πᾶς μέθοδος ἀγαθός τις  διά ἐπαγωγή δείκνυμι ) , αὔξησις δέ , ὅταν  τις ὁ λόγος βούλομαι , ὡς ποιέω πολλάκις ὁ συγγραφεύς ·
471234	tlg2001.tlg042.opp-grc1	οὐ γὰρ ἀρκούμενοι ψιλαῖς μόναις ταῖς τοῦ προκειμένου δεικτικαῖς προτάσεσιν ἔξωθέν τινας ἐπεμβάλλουσι κόσμου τε χάριν καὶ ὄγκου τοῦ κατὰ τὸν λόγον, ἢ τῶν ἐν ταῖς προτάσεσι κειμένων τι, ὁποῖόν ἐστιν, ἐξηγούμενοι ἤ τι ἄλλο ἐνείροντες τῷ λόγῳ.	οὐ γάρ ἀρκέω  μόνος ὁ ὁ     τις ἐπεμβάλλω κόσμος τε χάρις καί ὄγκος ὁ κατά ὁ λόγος , ἤ ὁ ἐν ὁ πρότασις  τις ,  εἰμί ,  ἤ τις ἄλλος  τῷ λόγος .
471235	tlg2001.tlg042.opp-grc1	οἷον εἰ βουλόμενος δεῖξαί τις τὸ καλὸν ὠφέλιμον λάβοι πρότασιν τὴν‘ πᾶν καλὸν ἀγαθόν᾿ ἔπειτα περὶ τοῦ καλοῦ τινα προστιθείη λέγων καὶ ἐπαινετὸν τῇ αὑτοῦ φύσει καὶ δι’ αὑτὸ αἱρετόν·	οἷος εἰ  δείκνυμι τις ὁ καλός ὠφέλιμος λαμβάνω πρότασις ὁ ‘ πᾶς καλός  ἔπειτα περί ὁ καλός τις  λέγω καί  ὁ ἑαυτοῦ φύσις καί διά ἑαυτοῦ αἱρετός ·
471236	tlg2001.tlg042.opp-grc1	τὸ γὰρ καλὸν πρὸς ἑαυτὸ ἐπισπώμενον δι’ αὑτὸ αἱρετόν·	ὁ γάρ καλός πρός ἑαυτοῦ ἐπισπάω διά ἑαυτοῦ αἱρετός ·
471237	tlg2001.tlg042.opp-grc1	ἀλλὰ μὴν| καὶ τὴν πλείστην μοῖραν ἔχειν πρὸς εὐδαιμονίαν αὐτό.	ἀλλά μήν | καί ὁ πλεῖστος μοῖρα ἔχω πρός εὐδαιμονία αὐτός .
471238	tlg2001.tlg042.opp-grc1	καὶ γὰρ μήτε εἰς κατασκευὴν τοῦ τὸ καλὸν αἱρετὸν εἶναι ταῦτα λαμβάνων τῷ μὴ ἀμφισβητεῖσθαι τοῦτο μήτε ὡς πρὸς τὴν δεῖξιν τοῦ προκειμένου ἄλλως δ’ αὐτὰ προστιθεὶς καὶ αὐξήσεως αὐτὰ προστίθησι τοῦ λόγου, ὄγκον τινὰ περιτιθεὶς αὐτῷ καὶ φεύγων τὸ ἐκ τῆς τέχνης ξηρόν τε καὶ ψιλόν.	καί γάρ μήτε εἰς κατασκευή ὁ ὁ καλός αἱρετός εἰμί οὗτος λαμβάνω τῷ μή ἀμφισβητέω οὗτος μήτε ὡς πρός ὁ  ὁ  ἄλλος  αὐτός προστίθημι καί αὔξησις αὐτός προστίθημι ὁ λόγος , ὄγκος   αὐτός καί φεύγω ὁ ἐκ ὁ τέχνη ξηρός τε καί ψιλός .
471239	tlg2001.tlg042.opp-grc1	κρύψεως δὲ ὑπὲρ τοῦ μὴ δυσχεραίνειν μηδὲ ἀνανεύειν τὸν ἀποκρινόμενον ἀλλὰ ῥᾷον τὸ φαινόμενον διδόναι μὴ συνορῶντα τὸ συμβησόμενον.	δέ ὑπέρ ὁ μή δυσχεραίνω μηδέ ἀνανεύω ὁ ἀποκρίνω ἀλλά  ὁ φαίνω δίδωμι μή συνοράω ὁ συμβαίνω .
471240	tlg2001.tlg042.opp-grc1	οἷον εἰ βουλόμενός τις δεῖξαι, ὅτι ἡ ὑγεία ἀγαθόν, λαβὼν τὴν ὑγείαν ὠφέλιμον εἶναι τῷ ἀγαθῷ μὴ εὐθὺς ἐρωτῴη, <εἰ> τὸ τῷ ὠφέλιμον ἀγαθόν, διὰ τὸ μὴ δώσειν τὸν ἀντιλέγοντα τῷ δοθέντος τὸ συμβησόμενον φανερὸν εἶναι, ἀλλὰ ἐν μέσῳ ἄλλα τινὰ ἐρωτῶν, οἷον εἰ ἀγαθός ἐστιν ὁ τὰς ἀρετὰς ἔχων, καὶ εἰ ἡ ἀρετὴ ἀγαθόν, ὡς ἐπαινετόν ἐστι, καὶ εἰ δι αὑτὴν αἱρετή, ἃ οὐδὲν μὲν αὐτῷ συντελεῖ, πρὸς ὃ βούλεται δεῖξαι, διασπᾷ δὲ τὴν συνέχειαν τῶν συναγουσῶν τὸ προκείμενον προτάσεων, εἶτα ἐπὶ τούτοις ἐξετάσει, εἰ τὸ τῷ ἀγαθῷ ὠφέλιμον δύναταί ποτε κακὸν εἶναι ἢ ἀγαθόν ἐστιν ἀεί·	οἷος εἰ  τις δείκνυμι , ὅτι2 ὁ ὑγίεια ἀγαθός , λαμβάνω ὁ ὑγίεια ὠφέλιμος εἰμί τῷ ἀγαθός μή εὐθύς  ,  ὁ τῷ ὠφέλιμος ἀγαθός , διά ὁ μή δίδωμι ὁ ἀντιλέγω τῷ δίδωμι ὁ συμβαίνω φανερός εἰμί , ἀλλά ἐν μέσος ἄλλος  ἔρως , οἷος εἰ ἀγαθός εἰμί ὁ ὁ ἀρετή ἔχω , καί εἰ ὁ ἀρετή ἀγαθός , ὡς  εἰμί , καί εἰ    , ὅς οὐδείς μέν αὐτός συντελέω , πρός ὅς βούλομαι δείκνυμι , διασπάω δέ ὁ συνέχεια ὁ  ὁ  πρότασις , εἶτα ἐπί οὗτος ἐξετάζω , εἰ ὁ τῷ ἀγαθός ὠφέλιμος  ποτε κακός εἰμί ἤ ἀγαθός εἰμί ἀεί ·
471241	tlg2001.tlg042.opp-grc1	ῥᾷον γὰρ οὕτως λήψεται, ἢ <εἰ> εὐθὺς αὐτὸ αἰτῶ.	ῥᾴδιος γάρ οὕτως  , ἤ  εὐθύς αὐτός αἰτέω .
471242	tlg2001.tlg042.opp-grc1	ἢ δύναται τὸ τοῦτο καὶ δι’ ἐπαγωγῆς λαβεῖν λέγων‘ ὡς τὸ τῷ.	τίη δύναμαι ὁ οὗτος καί διά ἐπαγωγή λαμβάνω λέγω ‘ ὡς ὁ τῷ .
471243	tlg2001.tlg042.opp-grc1	μουσικῷ μουσικὸν καἰ <τὸ> τῷ τέκτονι τεκτονικόν, οὕτως καὶ τὸ τῷ ἀγαθῷ ἀγαθόν’.	μουσικός μουσικός   ὁ τέκτων τεκτονικός , οὕτως καί ὁ τῷ ἀγαθός ἀγαθός ’ .
