id	filename	tokens	lemmas
470280	tlg2001.tlg042.opp-grc1	ἐπειδὴ δὲ οὐκ ἀδύνατόν ἐστιν μεταλαμβάνειν αὐτὴν εἰς καταφατικήν, μεταλαμβανομένη ποιεῖ τὴν συζυγίαν συλλογιστικήν.	ἐπεί δέ οὐ ἀδύνατος εἰμί μεταλαμβάνω αὐτός εἰς  ,  ποιέω ὁ συζυγία  .
470281	tlg2001.tlg042.opp-grc1	πότε δὲ ἕκαστον αὐτῶν καὶ δι’ ἣν αἰτίαν, εἰρήκαμεν, ὅτι δι’ ἑαυτῶν μὲν δείκνυνται, ὅτε ἔχουσι τὴν ἐλάττονα καταφατικὴν εἴτε ὑπάρχουσαν εἴτε ἐνδεχομένην, δι’ ἀντιστροφῆς δέ, ὅτε ἡ ἐλάττων ἐστὶν ἀποφατικὴ ἐνδεχομένη·	πότε δέ ἕκαστος αὐτός καί διά  αἰτία , λέγω , ὅτι2 διά ἑαυτοῦ μέν  , ὅτε ἔχω ὁ ἐλάσσων  εἴτε ὑπάρχω εἴτε  , διά  δέ , ὅτε ὁ ἐλάσσων εἰμί   ·
470282	tlg2001.tlg042.opp-grc1	δι’ ἣν δὲ αἰτίαν, ὅτι τῶν μὲν συλλογιστικῶν συζυγιῶν χαρακτηριστικὸν τὸ ἐν πρώτῳ σχήματι τὴν ἐλάττονα εἶναι καταφατικήν,| καὶ ὅτι ἡ ἀποφατικὴ ἐνδεχομένη κατὰ τὸν ἐνδεχομένου προσδιορισμὸν δύναται 85 μεταληφθῆναι εἰς τὴν καταφατικήν.	διά ὅς δέ αἰτία , ὅτι2 ὁ μέν συλλογιστικός   ὁ ἐν πρῶτος σχῆμα ὁ  εἰμί  , | καί ὅτι2 ὁ   κατά ὁ   δύναμαι   εἰς ὁ  .
470283	tlg2001.tlg042.opp-grc1	Ἐὰν δὲ ἡ μὲν μείζων τῶν προτάσεων καθόλου ἐνδεχομένη ἡ δὲ ἑτέρα <ἡ> ἐλάττων μερικὴ ᾖ καταφατικὴ ὑπάρχουσα, τῆς μείζονος εἴτε ἀποφατικῆς οὔσης συλλογισμὸς γίνεται, ὥσπερ ἐγίνετο καὶ ἐπὶ τῶν τοιούτων καθόλου προτάσεων, τουτέστιν ἐνδεχόμενον ἔσται τὸ συμπέρασμα.	δέ ὁ μέν μέγας ὁ πρότασις καθόλου  ὁ δέ ἕτερος  ἐλάσσων  εἰμί  ὑπάρχω , ὁ μέγας εἴτε ἀποφατικός εἰμί συλλογισμός γίγνομαι , ὥσπερ γίγνομαι καί ἐπί ὁ τοιοῦτος καθόλου πρότασις ,   εἰμί ὁ συμπέρασμα .
470284	tlg2001.tlg042.opp-grc1	δείκνυνται καὶ οὗτοι οἱ συλλογισμοὶ τῇ αὐτῇ δείξει, διὰ τοῦ κατὰ παντὸς καὶ τοῦ κατὰ μηδενός.	καί οὗτος ὁ συλλογισμός ὁ αὐτός δείκνυμι , διά ὁ κατά πᾶς καί ὁ κατά  .
470285	tlg2001.tlg042.opp-grc1	εἰ γὰρ τὸΑ παντὶ τῷΒ ὑπάρχειν ἐνδέχεται, τὸ δὲ Β τινὶ τῷΓ ὑπαρχόντως μόνον, καὶ τὸΑ ἄρα τινὶ τῷΓ ἐνδεχομένως ὑπάρχει.	εἰ γάρ ὁ Α πᾶς τῷ Β ὑπάρχω ἐνδέχομαι , ὁ δέ   τῷ Γ  μόνος , καί ὁ Α ἄρα  τῷ Γ ἐνδέχομαι ὑπάρχω .
470286	tlg2001.tlg042.opp-grc1	ἐπεὶ γὰρ γὰρ τὸ Α ἐνδεχομένως παντὶ τῷ Β, πᾶσιν ἄρα τοῖς μέρεσιν αὐτοῦ ἐνδεχομένως τὶ δὲ τῶν τοῦ Γ μέρος αὐτοῦ ἐστι·	ἐπεί γάρ γάρ ὁ  ἐνδέχομαι πᾶς τῷ  , πᾶς ἄρα ὁ μέρος αὐτός ἐνδέχομαι  δέ ὁ ὁ  μέρος αὐτός εἰμί ·
470287	tlg2001.tlg042.opp-grc1	τὸΑ ἄρα ἐνδεχομένως <τινὶ> ὑπάρχει.	ὁ Α ἄρα ἐνδέχομαι  ὑπάρχω .
470288	tlg2001.tlg042.opp-grc1	ὁμοίως δὲ ἔχει καὶ ἐπὶ τῆς ἀποφατικῆς.	ὅμοιος δέ ἔχω καί ἐπί ὁ ἀποφατικός .
470289	tlg2001.tlg042.opp-grc1	ὅροι δὲ ὑπνοῦν, περιπατοῦν, ζῶον·	δέ  ,  , ζάω ·
470290	tlg2001.tlg042.opp-grc1	τὸ ὑπνοῦν παντὶ περιπατητικῷ ἐνδεχομένως ὑπάρχει ἢ οὐχ ὑπάρχει, περιπατητικὸν τινὶ ζῴῳ ὑπαρχόντως, καὶ συνάγεται῾ τὸ ὑπνοῦν τινὶ ζώῳ ἐνδέχεται᾿.	ὁ  πᾶς περιπατητικός ἐνδέχομαι ὑπάρχω ἤ οὐ ὑπάρχω , περιπατητικός    , καί συνάγω ῾ ὁ     .
470291	tlg2001.tlg042.opp-grc1	Ὅταν δὲ ἡ μὲν καθόλου ὑπάρχουσα ᾖ ἡ δὲ ἐλάττων ἐνδεχομένη, ὥσπερ ἐπὶ τῶν καθόλου συζυγιῶν τὰς οὕτως ἐχούσας ἐλέγομεν πάσας συλλογιστικὰς εἶναι, ὅπως ἂν κατὰ ποιὸν ἔχωσιν, οὕτω καὶ ἐπὶ τούτων φημί, καὶ ἁπλῶς εἰπεῖν, οἷα εἶχον συμπεράσματα αἱ καθόλου συζυγίαι, τὰ αὐτὰ ταῦτα ἕξουσι καὶ αἱ ὁμοίως ἐκείναις κτὰ τὸ ποιὸν ἔχουσαι μερικαί.	δέ ὁ μέν καθόλου ὑπάρχω εἰμί ὁ δέ ἐλάσσων  , ὥσπερ ἐπί ὁ καθόλου  ὁ οὕτως ἔχω λέγω πᾶς  εἰμί , ὅπως ἄν κατά  ἔχω , οὕτως καί ἐπί οὗτος φημί , καί ἁπλόος λέγω , οἷος ἔχω συμπέρασμα ὁ καθόλου συζυγία , ὁ αὐτός οὗτος ἔχω καί ὁ ὅμοιος   ὁ  ἔχω  .
470292	tlg2001.tlg042.opp-grc1	ἀτελεῖς δέ εἰσι καὶ αὗται πᾶσαι αἱ συζυ- γίαι ὥσπερ καὶ αἱ καθόλου αἱ ὁμοίως αὐταῖς ἔχουσαι, διότι οὐκ ἐκ τοῦ κατὰ παν- τὸς καὶ τοῦ κατὰ μηδενὸς δείκνυνται ἀλλὰ δεόνται τῆς <διὰ> τοῦ πᾶσαι·	ἀτελής δέ εἰμί καί οὗτος πᾶς ὁ  -  ὥσπερ καί ὁ καθόλου ὁ ὅμοιος αὐτός ἔχω , διότι οὐ ἐκ ὁ κατά  -  καί ὁ κατά  δείκνυμι ἀλλά  ὁ  ὁ πᾶς ·
470293	tlg2001.tlg042.opp-grc1	πλὴν οἱ μὲν διὰ τοῦ ἀδυνάτου δειχθήσονται, οἱ δὲ καὶ διὰ τῆς ἀντιστρο- φῆς·	ὁ μέν διά ὁ   , ὁ δέ καί διά ὁ  - φημί ·
470294	tlg2001.tlg042.opp-grc1	καὶ γὰρ οἱ δι’ ἀντιστοοφῆς δεικνύμενοι δεόνται καὶ τῆς δι’ ἀδυνάτου δείξεως.	καί γάρ ἕ διά  δείκνυμι  καί ὁ διά ἀδύνατος δεῖξις .
470295	tlg2001.tlg042.opp-grc1	δείκνυνται οὖν διὰ μὲν τοῦ ἀδυνάτου μόνον οἱ ἔχοντες τὴν ἐλάττονα καταφατικήν, ὥσπερ καὶ ἐπὶ τῶν καθόλου.	δείκνυμι οὖν διά μέν ὁ ἀδύνατος μόνος ὁ ἔχω ὁ   , ὥσπερ καί ἐπί ὁ καθόλου .
470296	tlg2001.tlg042.opp-grc1	εἰ γὰρ τὸ Α παντὶ ἢ μηδενὶ τῷΑ ὑπάρχει, τὸ δὲ| Β τῷΓ τινὶ ἐνδεχομένως, λέγω δή, ὅτι συνάγεται τὸΑ τινὶ ἢ οὐ παντὶ τῷΓ ἐν·	εἰ γάρ ὁ  πᾶς τίη  τῷ Α ὑπάρχω , ὁ δέ |  τῷ Γ  ἐνδέχομαι , λέγω δή , ὅτι2 συνάγω ὁ Α  ἤ οὐ πᾶς τῷ Γ ἐν ·
470297	tlg2001.tlg042.opp-grc1	85v δέχεσθαι ὑπάρχειν, ἐπὶ μὲν τῆς ἐχούσης τὴν μείζονα ἀποφατικὴν τὸ μὴ παντί, ἐπὶ δὲ τῆς ἐχούσης αὐτὴν καταφατικὴν τὸ τινί.	δέχομαι ὑπάρχω , ἐπί μέν ὁ ἔχω ὁ μέγας  ὁ μή  , ἐπί δέ ὁ ἔχω αὐτός  ὁ  .
470298	tlg2001.tlg042.opp-grc1	εἰ δὲ τοῦτο ψεῦδος, ἀληθῆ τὰ ἀντιφατικῶς ἀντικείμεναι, ἐπὶ μὲν τῆς καταφατικῆς τὸ῾ ἐξ ἀνάγκης οὐδενί᾿, ἐπὶ δὲ τῆς ἀποφατικῆς τὸ ῾ παντί᾿.	εἰ δέ οὗτος ψεῦδος , ἀληθής ὁ   , ἐπί μέν ὁ  ὁ ῾ ἐκ ἀνάγκη  , ἐπί δέ ὁ ἀποφατικός ὁ   .
470299	tlg2001.tlg042.opp-grc1	ἀλλ’ ἀμφοτέραις ἀδύνατόν τι ἀκολουθεῖ, ἐπὶ τῆς καταφατικῆς μέν, εἰ τὸ <Α> ἐξ ἀνάγκης μηδενὶ τῷΓ κατὰ τὸ δὲ Β τῷΓ ὑπάρχει τινί·	ἀλλά ἀμφότερος ἀδύνατος τις ἀκολουθέω , ἐπί ὁ  μέν , εἰ ὁ  ἐκ ἀνάγκη μηδείς τῷ Γ κατά ὁ δέ  τῷ Γ ὑπάρχω  ·
470300	tlg2001.tlg042.opp-grc1	μεταληψόμεθα γὰρ πάλιν διὰ τὸ σαφὲς τὴν ἐν- δεχομένην εἰς τὴν ὑπάρχουσαν·	μεταλαμβάνω γάρ πάλιν διά ὁ σαφής ὁ ἐν -  εἰς ὁ ὑπάρχω ·
470301	tlg2001.tlg042.opp-grc1	τὸΑ ἄρα οὐ παντὶ τῷ Β ὑπάρχει·	ὁ Α ἄρα οὐ πᾶς τῷ  ὑπάρχω ·
470302	tlg2001.tlg042.opp-grc1	ἦν δὲ καὶ παντί, ὅπερ ἀδύνατον.	εἰμί δέ καί  , ὅς ἀδύνατος .
470303	tlg2001.tlg042.opp-grc1	τὸ ἀδύνατον ἠκολούθησε διὰ τὸ ὑποθέσθαι τὸ <τὸΑ τῷΓ ἐξ ἀνάγκης μηδενί·	ὁ ἀδύνατος ἀκολουθέω διά ὁ ὑποτίθημι ὁ  Α τῷ Γ ἐκ ἀνάγκη  ·
470304	tlg2001.tlg042.opp-grc1	ψεῦδος ἄρα τοῦτο, ἀληθὲς δὲ τὸ κατὰ πάντα ἀντικείμενον τὸ ῾ ἐνδέχεται τὸ Α τῷ # x003E;	ψεῦδος ἄρα οὗτος , ἀληθής δέ ὁ κατά   ὁ  ἐνδέχομαι ὁ  τῷ   ;
470305	tlg2001.tlg042.opp-grc1	τινί᾿, ὅπερ ἔδει δεῖξαι.	, ὅς δέω δείκνυμι .
470306	tlg2001.tlg042.opp-grc1	ὁμοίως καὶ ἐπὶ ἔχει·	ὅμοιος καί ἐπί ἔχω ·
470307	tlg2001.tlg042.opp-grc1	λέγω γάρ, ὅτι συνάγει τὸΑ τῷΓ ἐνδέχεσθαι μὴ παντὶ ὑπάρχειν.	λέγω γάρ , ὅτι2 συνάγω ὁ Α τῷ Γ ἐνδέχομαι μή  ὑπάρχω .
470308	tlg2001.tlg042.opp-grc1	εἰ γὰρ τοῦτο ψεῦδος, ἀληθὲς τὸ κατὰ πάντα ἀντικείμενον τὸ῾ ἀνάγκη παντί’·	εἰ γάρ οὗτος ψεῦδος , ἀληθής ὁ κατά   ὁ ῾ ἀνάγκη  ·
470309	tlg2001.tlg042.opp-grc1	ἐπεὶ οὖν τὸ Α τῷΓ ἀνάγκη παντί, τὸ δὲ Β τῷΓ ὑπάρχει τινί, τὸ Α τινὶ τῷ Β·	ἐπεί οὖν ὁ  τῷ Γ ἀνάγκη  , ὁ δέ  τῷ Γ ὑπάρχω  , ὁ   τῷ  ·
470310	tlg2001.tlg042.opp-grc1	ἦν δὲ καὶ μηδενί, ὅπερ ἀδύνατον·	εἰμί δέ καί  , ὅς ἀδύνατος ·
470311	tlg2001.tlg042.opp-grc1	ψεῦδος ἄρα τὸ ῾ ἀνάγκη παντὶ τῷΓ τὸ Α᾿, ἀληθὲς δὲ τὸ ἐνδέχεσθαι μὴ παντί, ὅπερ ἔδει δεῖξαι.	ψεῦδος ἄρα ὁ  ἀνάγκη πᾶς τῷ Γ ὁ  , ἀληθής δέ ὁ ἐνδέχομαι μή  , ὅς δέω δείκνυμι .
470312	tlg2001.tlg042.opp-grc1	καὶ οὗτοι μὲν οἱ διὰ τοῦ ἀδυνάτου μόνου δεικνύμενοι, διὰ δὲ τοῦ ἀδυνάτου καὶ ἐλάττονος οὕτως ἡ δι’ ἀδυνάτου γίνεται δεῖξις, ὥσπερ καὶ ἐπὶ τῶν πρότερον.	καί οὗτος μέν ὁ διά ὁ ἀδύνατος  δείκνυμι , διά δέ ὁ  καί ἐλάσσων οὕτως ὁ διά  γίγνομαι δεῖξις , ὥσπερ καί ἐπί ὁ  .
470313	tlg2001.tlg042.opp-grc1	σημειωτέον δέ, ὡς διαστήματα τὰς προτάσεις καλοῦμεν, ἐπειδὴ ἐξομοιῶσαι βουλόμεθα τὰ ἐν συλλογισμοῖς τοῖς κατὰ γεωμετρίαν.	δέ , ὡς διάστημα ὁ πρότασις καλέω , ἐπεί ἐξομοιόω βούλομαι ὁ ἐν  ὁ κατά γεωμετρία .
470314	tlg2001.tlg042.opp-grc1	εἰκότως οὖν ὥσπερ αἱ προτάσεις ἀνάλογον〈 ἔχουσαι〉 ταῖς γραμμαῖς διαστήματα καλοῦνται ὥσπερ αἱ γραμμαί, οὕτως καὶ οἱ συλλογισμοὶ ἀνάλογον τοῖς σχήμασιν ἔχοντες, διότι ὥσπερ ἐκεῖνα ἐκ γραμμῶν οὕτως καὶ οὗτοι ἐκ προτάσεων σύγκεινται, σχήματα ἐκλήθησαν.	εἰκός οὖν ὥσπερ ὁ πρότασις  〈 ἔχω 〉 ὁ γραμμή διάστημα καλέω ὥσπερ ὁ γραμμή , οὕτως καί ὁ συλλογισμός  ὁ σχῆμα ἔχω , διότι ὥσπερ ἐκεῖνος ἐκ  οὕτως καί οὗτος ἐκ πρότασις σύγκειμαι , σχῆμα καλέω .
470315	tlg2001.tlg042.opp-grc1	Ὅταν δὲ ἡ ἐλάττων πρότασις οὖσα μερικὴ ἀποφατικὴ ὑπάρχουσα ληφθῇ, οὑν φημι ἔσεσθαι συλλογισμόν, καὶ εἰκότως·	δέ ὁ ἐλάσσων πρότασις εἰμί   ὑπάρχω λαμβάνω , ὗς φημί εἰμί συλλογισμός , καί εἰκός ·
470316	tlg2001.tlg042.opp-grc1	οὐκέτι γὰρ ἡ μερικὴ ὑπάρχουσα ἀποφατικὴ μεταλαμβάνεται εἰς τὴν καταφατικήν.	οὐκέτι γάρ ὁ  ὑπάρχω  μεταλαμβάνω εἰς ὁ  .
470317	tlg2001.tlg042.opp-grc1	δεικτέον δὲ αὐτήν, ὅτι ἀσυλλόγιστός ἐστι, διὰ τοῦ ἀορίστου, ὥσπερ καὶ ἐν τοῖς ἁπλοῖς συλλογισμοῖς ἐλέγομεν τοῖς ἔχουσι μερικὴν ἀποφατικήν, ὅτι δείκνυνται αἱ τοιαῦται ἀσυλλόγι- στοι ἐκ τοῦ ἀόριστον ἔχειν τὴν μερικὴν ἀπορατικήν.	δείκνυμι δέ αὐτός , ὅτι2  εἰμί , διά ὁ ἀόριστος , ὥσπερ καί ἐν ὁ ἁπλόος  λέγω ὁ ἔχω   , ὅτι2  ὁ τοιοῦτος  -  ἐκ ὁ ἀόριστος ἔχω ὁ   .
470318	tlg2001.tlg042.opp-grc1	ἐπειδὴ γὰρ ἀληθεύει ἢ δι’ ἑαυτὴν ἢ διὰ τὴν καθόλου ἀποφατικήν, ὅταν μὲν δι’ ἑαυτὴν ἀληθεύῃ, ὐποδύεται συλλογιστικὴν συζυγίαν ἰῷ δύνασθαι μεταλαμβάνεσθαι εἰς τὴν καταφατικήν, διότι, ὃ μὴ ὑπάρχει παντί, τοῦτο τινὶ ὑπάρχει·	ἐπεί γάρ ἀληθεύω τίη διά ἑαυτοῦ τίη διά ὁ καθόλου  , ὅταν μέν διά ἑαυτοῦ ἀληθεύω ,   συζυγία ἰός δύναμαι μεταλαμβάνω εἰς ὁ  , διότι , ὅς μή ὑπάρχω  , οὗτος  ὑπάρχω ·
470319	tlg2001.tlg042.opp-grc1	διὰ τοῦτο ἐκβλητέον αὐτὴν ὡς ἀόριστον.	διά οὗτος ἐκβάλλω αὐτός ὡς ἀόριστος .
470320	tlg2001.tlg042.opp-grc1	ὅταν δὲ λάβωμεν αὐτὴν διὰ τὴν καθόλου ἀληθεύουσαν, τότε προδήλως ἀσυλλόγιστος οὖσα ἐλέγχεται·	ὅταν δέ λαμβάνω αὐτός διά ὁ καθόλου  , τότε πρόδηλος ἀσυλλόγιστος εἰμί ἐλέγχω ·
470321	tlg2001.tlg042.opp-grc1	συνάγει γὰρ καὶ τὸ παντὶ καὶ τὸ μηδενί.	συνάγω γάρ καί ὁ  καί ὁ  .
470322	tlg2001.tlg042.opp-grc1	ἔστωσαν οὖν ὅροι τοῦ μὲν παντὶ κινούμενον, λευκόν, βαδίζον·	οὖν ὅρος ὁ μέν πᾶς κινέω , λευκός , βαδίζω ·
470323	tlg2001.tlg042.opp-grc1	κινούμενον παντὶ λευκῷ ἐνδέχεται ὑπάρχειν, λευκὸν ὑπαρχέτω μὴ παντὶ βαδίζοντι, καὶ συνάγεται κίνησις παντὶ βαδίζοντι ἐξ ἀνάγκης.	κινέω πᾶς λευκός ἐνδέχομαι ὑπάρχω , λευκός ὑπάρχω μή πᾶς βαδίζω , καί συνάγω κίνησις πᾶς βαδίζω ἐκ ἀνάγκη .
470324	tlg2001.tlg042.opp-grc1	τοῦ δὲ μηδενὶ κίνησις, λευκόν, ἑστώς·	ὁ δέ  κίνησις , λευκός , ἵστημι ·
470325	tlg2001.tlg042.opp-grc1	κίνησις ἐνδεχομένως παντὶ λευκῷ, λευκὸν μὴ τινὶ βαδίζοντι ὑπαρχόντως, καὶ κίνησις οὐδενὶ ἑστῶτι ἐξ ἀνάγκης.	ἐνδέχομαι πᾶς  , λευκός μή  βαδίζω  , καί κίνησις  ἵστημι ἐκ ἀνάγκη .
470326	tlg2001.tlg042.opp-grc1	λειπόμεναί εἰσι συζυγίαι αἱ ἔχουσαι τὴν μείζονα μερικὴν τὴν δὲ ἐλάττονα καθόλου, αἵτινες ἀσυλλόγιστοι πᾶσαί εἰσιν, ὅπως ἂν ἔχωσι τοῦ τε τρόπου καὶ τοῦ ποιοῦ.	εἰμί συζυγία ὁ ἔχω ὁ μέγας μερικός ὁ δέ  καθόλου , ὅστις ἀσυλλόγιστος πᾶς εἰμί , ὅπως ἄν ἔχω ὁ τε τρόπος καί ὁ  .
470327	tlg2001.tlg042.opp-grc1	ὁμοίως δέ, κἂν μερικαὶ ἀμφότεραι ληφθῶσι, κἄν ἀμφότεραι ἀδιόριστοι ἢ ἡ μὲν μερικὴ ἡ δὲ ἀδιόριστος·	ὅμοιος δέ , ἐάν  ἀμφότερος λαμβάνω , ἐάν ἀμφότερος ἀδιόριστος ἤ ὁ μέν  ὁ δέ  ·
470328	tlg2001.tlg042.opp-grc1	καὶ αὗται γὰρ πάλιν, ὅπως ἂν ἔχωσι κατά τε τὸ ποιὸν καὶ τοὺς τρόπους, πᾶσαι ἀσυλλόγιστοί εἰσιν.	καί οὗτος γάρ πάλιν , ὅπως ἄν ἔχω κατά τε ὁ  καί ὁ τρόπος , πᾶς  εἰμί .
470329	tlg2001.tlg042.opp-grc1	ἀπόδειξις δὲ τοῦ ἀσυλλογίστους αὐτὰς εἶναι ἡ αὐτή, ἥπερ καὶ ἐπὶ τῶν ἀσυλλογίστων·	ἀπόδειξις δέ ὁ  αὐτός εἰμί ὁ αὐτός ,  καί ἐπί ὁ ἀσυλλόγιστος ·
470330	tlg2001.tlg042.opp-grc1	αὕτη δέ ἐστιν ἡ παραδειγματική.	οὗτος δέ εἰμί ὁ  .
470331	tlg2001.tlg042.opp-grc1	εὑρίσκονται γὰρ ὅροι συνάγοντες καὶ τὸ παντὶ καὶ τὸ μηδενί·	εὑρίσκω γάρ  συνάγω καί ὁ πᾶς καί ὁ  ·
470332	tlg2001.tlg042.opp-grc1	ἐφ’ ὧν δὲ καὶ τὸ παντὶ καὶ τὸ μηδενὶ συνήγετο, αὗται ἀσυλλόγιστοι ἦσαν διὰ τὴν ἀοριστίαν.	ἐπί ὅς δέ καί ὁ  καί ὁ  συνάγω , οὗτος ἀσυλλόγιστος εἰμί διά ὁ  .
470333	tlg2001.tlg042.opp-grc1	ἔστωσαν οὖν ὅροι πάντων κοινοὶ τοῦ μὲν παντὶ ἐπιστήμη, κινούμενον, γραμματική·	οὖν  πᾶς κοινός ὁ μέν πᾶς ἐπιστήμη , κινέω , γραμματικός ·
470334	tlg2001.tlg042.opp-grc1	ἐπιστήμη τινὶ κινουμένῳ ἐνδεχομένως ὑπάρχει ἢ μὴ ὑπάρχει, κίνησις παντὶ ἢ μηδενὶ γραμματικῷ ὑπαρχέτω, καὶ | συνάγεται ἐπιστήμη ν παντὶ γραμματικῷ ἐξ ἀνάγκης.	ἐπιστήμη  κινέω ἐνδέχομαι ὑπάρχω τίη μή ὑπάρχω , κίνησις πᾶς τίη μηδείς  ὑπάρχω , καί  συνάγω ἐπιστήμη  πᾶς γραμματικός ἐκ ἀνάγκη .
470335	tlg2001.tlg042.opp-grc1	τοῦ δὲ μηδενὶ ἐπιστήμη, κίνησις, ἵππος ἢ ἁπλῶς ἄλογον·	ὁ δέ  ἐπιστήμη , κίνησις , ἵππος ἤ ἁπλόος ἄλογος ·
470336	tlg2001.tlg042.opp-grc1	ἐπιστήμη ἐνδεχομένως τινὶ κινουμένῳ ἢ μὴ παντί, κίνησις υπαρχέτω παντὶ ἢ μηδενὶ ἵππῳ, καὶ συνάγεται ἐπιστήμη ἐξ ἀνάγκης οὐδενὶ ἵππῳ.	ἐπιστήμη ἐνδέχομαι  κινέω τίη μή  , κίνησις  πᾶς τίη μηδείς ἵππος , καί συνάγω ἐπιστήμη ἐκ ἀνάγκη οὐδείς ἵππος .
470337	tlg2001.tlg042.opp-grc1	καὶ ἐπὶ τῶν ἄλλων ὁμοίως.	καί ἐπί ὁ  ὅμοιος .
470338	tlg2001.tlg042.opp-grc1	Φανερὸν οὗν, ὅτι τῆς μείζονος προτάσεως καθόλου οὔσης ἀεὶ γίνεται συλλογισμός, ὅταν ἡ ἐλάττων καταφατικὴ εἴη.	, ὅτι2 ὁ μέγας πρότασις καθόλου εἰμί ἀεί γίγνομαι συλλογισμός , ὅταν ὁ ἐλάσσων  εἰμί .
470339	tlg2001.tlg042.opp-grc1	ζητητέον δέ, μή ποτε οἱ ὅροι οἱ ληφθέντες εἰς τὸ δεῖξαι τὴν συζυγίαν τὴν ἔχουσαν τὴν ἐλάττονα μερικὴν ἀποφατικὴν ὑπάρχουσαν τῆς μείζονος καθόλου οὔσης ἐνδεχομένης ἀποφατικῆς ἢ καταφατικῆς, ἐὰν οἱ αὐτοὶ ὅροι ληφθῶσι καὶ τῆς ἐλάττονος μερικῆς κατα- φατικῆς ὑπαρχούσης οὔσης, δείξουσιν αὐτὴν ἀσυλλόγιστον• συνάξουσι γὰρ καὶ τὸ πὰν καὶ τὸ μηδενὶ ἐξ ἀνάγκης.	ζητέω δέ , μή ποτε ὁ  ὁ λαμβάνω εἰς ὁ δείκνυμι ὁ συζυγία ὁ ἔχω ὁ  μερικός  ὑπάρχω ὁ μέγας καθόλου εἰμί  ἀποφατικός ἤ  , ἐάν ἕ αὐτός  λαμβάνω καί ὁ ἐλάσσων   -  ὑπάρχω εἰμί ,  αὐτός ἀσυλλόγιστος •  γάρ καί ὁ  καί ὁ μηδείς ἐκ ἀνάγκη .
470340	tlg2001.tlg042.opp-grc1	λέγω γὰρ οὕτως·	λέγω γάρ οὕτως ·
470341	tlg2001.tlg042.opp-grc1	κίνησις παντὶ λευκῷ ἐνδεχομένως, λευκὸν τινὶ βαδίζοντι ὑπαρχόντως, καὶ συνάγεται κίνησις παντὶ βαδίζοντι ἐξ ἀνάγκης.	κίνησις πᾶς λευκός ἐνδέχομαι , λευκός  βαδίζω  , καί συνάγω κίνησις πᾶς βαδίζω ἐκ ἀνάγκη .
470342	tlg2001.tlg042.opp-grc1	καὶ τὸ οὐδενὶ οὕτως·	καί ὁ  οὕτως ·
470343	tlg2001.tlg042.opp-grc1	κίνησις παντὶ λευκῷ ἐνδεχομένως, λευκὸν ὑπαρχέτω τινὶ ἑστῶτι, καὶ κίνησις οὐδενὶ ἑστῶτι ἐξ ἀνάγκης.	κίνησις πᾶς λευκός ἐνδέχομαι , λευκός ὑπάρχω  ἵστημι , καί κίνησις  ἵστημι ἐκ ἀνάγκη .
470344	tlg2001.tlg042.opp-grc1	ὁμοίως, κἄν ἐνδεχομένως ὑπάρχῃ ἡ μερική, τὰ αὐτὰ πάλιν συμβαίνει, ὥστε ἐκ τῶν ὅρων τούιων δειχθήσονται καὶ αὗται ἀσυλλόγιστοι.	ὅμοιος , ἐάν ἐνδέχομαι ὑπάρχω ὁ  , ὁ αὐτός πάλιν συμβαίνω , ὥστε ἐκ ὁ    καί οὗτος ἀσυλλόγιστος .
470345	tlg2001.tlg042.opp-grc1	τί οὖν ἐροῦμεν;	τίς οὖν ἐρέω ;
470346	tlg2001.tlg042.opp-grc1	εἴπομεν ἤδη, ὅτι δεῖ τὴν μείζονα πρότασιν μὴ ὁρίζεσθαι χρόνῳ ὑπὸ τῆς ἐλάττονος·	λέγω ἤδη , ὅτι2 δέω ὁ μέγας πρότασις μή ὁρίζω χρόνος ὑπό ὁ ἐλάσσων ·
470347	tlg2001.tlg042.opp-grc1	ὡρί- ζετο δὲ χρόνῳ, ὁπηνίκα ὑπερέτεινεν ὁ μέσος ὅρος τὸν μείζονα.	-  δέ χρόνος , ὁπηνίκα τείνω ὁ  ὅρος ὁ μέγας .
