id	filename	tokens	lemmas
761551	tlg4015.tlg001.opp-grc1	ἐπειδὴ οὖν πᾶν σῶμα διαιρετόν ἐστι, διέλωμεν, φησί, τόδε τι τὸ σῶμα εἰς τρία, εἰ τύχοι·	ἐπεί οὖν πᾶς σῶμα διαιρετός εἰμί , διαιρέω , φημί , ὅδε  ὁ σῶμα εἰς  , εἰ τυγχάνω ·
761552	tlg4015.tlg001.opp-grc1	ἕκαστον οὖν τῶν τμημάτων πότερον ἄπειρον ἔχει τὴν δύναμιν ἢ πεπερασμένην;	ἕκαστος οὖν ὁ τμῆμα πότερος ἤπειρος ἔχω ὁ δύναμις ἤ  ;
761553	tlg4015.tlg001.opp-grc1	εἰ μὲν οὖν ἄπειρον, τῷ ὅλῳ τὸ μέρος ἰσοδύναμον ἔσται, ὅπερ ἄτοπον καὶ ἀδύνατον.	εἰ μέν οὖν ἤπειρος , τῷ ὅλος ὁ μέρος  εἰμί , ὅς ἄτοπος καί ἀδύνατος .
761554	tlg4015.tlg001.opp-grc1	εἰ δὲ πεπερασμένην, καὶ τὸ ἐκ τῶν πεπερασμένων συγκείμενον δῆλον ὅτι καὶ αὐτὸ πάντως πεπερασμένον ἐστίν·	εἰ δέ περαίνω , καί ὁ ἐκ ὁ   δῆλος ὅτι2 καί αὐτός πᾶς περαίνω εἰμί ·
761555	tlg4015.tlg001.opp-grc1	ὥστε καὶ ἡ τοῦ ὅλου σώματος δύναμις περερασμένη ἔσται καὶ οὐκ ἄπειρος·	ὡς καί ὁ ὁ  σῶμα δύναμις  εἰμί καί οὐ ἄπειρος ·
761556	tlg4015.tlg001.opp-grc1	οὐδὲν ἄρα σῶμα πεπερασμένον ἄπειρον ἔχει δύναμιν·	οὐδείς ἄρα σῶμα περαίνω ἤπειρος ἔχω δύναμις ·
761557	tlg4015.tlg001.opp-grc1	οὐδὲν δὲ σῶμα μεγέθει ἐστὶν ἄπειρον ἔδειξε γὰρ αὐτὸς ἐν τῇ Φυσικῇ καὶ τοῦτο)·	δέ σῶμα μέγεθος εἰμί ἤπειρος δείκνυμι γάρ αὐτός ἐν ὁ  καί οὗτος ) ·
761558	tlg4015.tlg001.opp-grc1	οὐδὲν ἄρα σῶμα ἄπειρον ἔχει δύναμιν·	οὐδείς ἄρα σῶμα ἄπειρος2 ἔχω δύναμις ·
761559	tlg4015.tlg001.opp-grc1	εἰ δὲ τοῦτο, ὅπερ ἄρα ἄπειρον ἔχει δύναμιν, οὐκ ἔστι σῶμα·	εἰ δέ οὗτος , ὅς ἄρα ἤπειρος ἔχω δύναμις , οὐ εἰμί σῶμα ·
761560	tlg4015.tlg001.opp-grc1	οὐκοῦν ἀσώματος ἡ πρώτη οὐσία, ἐπειδὴ καὶ ἀπειροδύναμος.	οὐκοῦν  ὁ πρῶτος οὐσία , ἐπεί καί  .
761561	tlg4015.tlg001.opp-grc1	οὐ μόνον δὲ τὴν νοητὴν οὐσίαν κρείττονα οἶδε τῶν συνθέτων, ἀλλὰ καὶ τὴν διανοητήν, καὶ δείκνυσι τοῦτο ἐν τῇ Ἀποδεικτικῇ·	οὐ μόνος δέ ὁ νοητός οὐσία κρείσσων οἶδα ὁ σύνθετος , ἀλλά καί ὁ  , καί δείκνυμι οὗτος ἐν ὁ  ·
761562	tlg4015.tlg001.opp-grc1	λέγει γὰρ ὅτι ὡς ἔχει ἡ αἴσθησις πρὸς τὰ αἰσθητά, οὕτως ἔχει καὶ ἡ ἀπόδειξις πρὸς τὰ ἀποδεικτά·	λέγω γάρ ὅτι2 ὡς ἔχω ὁ αἴσθησις πρός ὁ αἰσθητός , οὕτως ἔχω καί ὁ ἀπόδειξις πρός ὁ  ·
761563	tlg4015.tlg001.opp-grc1	οὐκοῦν καὶ ἐναλλάξ, ὡς αἴσθησις πρὸς ἀπόδειξιν ἔχει, οὕτως ἕξει καὶ τὰ αἰσθητὰ πρὸς τὰ ἀποδεικτά·	οὐκοῦν καί  , ὡς αἴσθησις πρός ἀπόδειξις ἔχω , οὕτως ἔχω καί ὁ αἰσθητός πρός ὁ  ·
761564	tlg4015.tlg001.opp-grc1	εἰ οὖν χείρων ἡ αἴσθησις τῆς ἀποδείξεως, διότι ἡ μὲν αἴσθησις περὶ τὰ μερικὰ ἡ δὲ 〈 ἀπόδειξις 〉 περὶ τὰ καθόλου καταγίνεται, καὶ τὰ αἰσθητὰ ἄρα τῶν ἐπιστητῶν χείρω·	εἰ οὖν χείρων ὁ αἴσθησις ὁ ἀπόδειξις , διότι ὁ μέν αἴσθησις περί ὁ  ὁ δέ  ἀπόδειξις  περί ὁ καθόλου καταγίγνομαι , καί ὁ αἰσθητός ἄρα ὁ  χειρόω ·
761565	tlg4015.tlg001.opp-grc1	ὥστε οἶδεν οὐ μόνον τὴν νοητὴν κρείττονα τῶν συνθέτων, ἀλλὰ καὶ τὴν διανοητήν.	ὥστε οἶδα οὐ μόνος ὁ  κρείσσων ὁ  , ἀλλά καί ὁ  .
761566	tlg4015.tlg001.opp-grc1	ἐνταῦθα δέ, ὡς εἴπομεν, τὰς δευτέρας καλεῖ πρώτας διὰ τὰς πολλάκις εἰρημένας αἰτίας.	ἐνταῦθα δέ , ὡς λέγω , ὁ δεύτερος καλέω πρῶτος διά ὁ πολλάκις  αἰτία .
761567	tlg4015.tlg001.opp-grc1	p.	.
761568	tlg4015.tlg001.opp-grc1	2a12 Ἢ μήτε καθ’ ὑποκειμένου τινὸς λέγεται μήτε ἐν ὑπο κειμενῳ τινι ἐστι.	μήτε κατά   λέγω  ἐν    εἰμί .
761569	tlg4015.tlg001.opp-grc1	Ζητοῦσι δὲ τί δή ποτε τὴν τιμιωτέραν τῶν κατηγοριῶν, τὴν οὐσίαν, δι’ ἀποφάσεως ὡρίσατο, εἴπερ τῶν καταφάσεων ἀτιμοτέρας εἶναί φαμεν τὰς ἀποφάσεις.	δέ τι δή ποτε ὁ  ὁ κατηγορία , ὁ οὐσία , διά ἀπόφασις ὁρίζω , εἴπερ ὁ   εἰμί φημί ὁ ἀπόφασις .
761570	tlg4015.tlg001.opp-grc1	λέγομεν οὖν ὅτι τοὐναντίον μὲν οὖν οἱ| δι’ ἀποφάσεως ὁρισμοὶ μᾶλλον σεμνύνουσι τὸ ὑποκείμενον·	λέγω οὖν ὅτι2 ἐναντίον μέν οὖν ὁ | διά ἀπόφασις  μᾶλλον  ὁ  ·
761571	tlg4015.tlg001.opp-grc1	οὕτω γοῦν καὶ τὸ θεῖον σημᾶναι βουλόμενοι οὐ καταφάσκομέν τι περὶ αὐτοῦ, ὥς φησιν ὁ θεῖος Πλάτων’, ἀλλ’ εἰς ἀποφάσεις ἐρχόμεθα·	οὕτως γοῦν καί ὁ θεῖος σημαίνω  οὐ  τι περί αὐτός , ὡς φημί ὁ θεῖος Πλάτων ’ , ἀλλά εἰς ἀπόφασις ἔρχομαι ·
761572	tlg4015.tlg001.opp-grc1	ἐρωτῶντος γὰρ Σωκράτους τὸν Τίμαιον τί ἐστι ὁ θεός, λέγει ἐκεῖνος ὅτι τί μὲν οὐκ ἔστιν οἶδα, τί δὲ ἔστιν οὐκ οἶδα·	ἐρωτάω γάρ Σωκράτης ὁ Τίμαιος τίς εἰμί ὁ θεός , λέγω ἐκεῖνος ὅτι2 τίς μέν οὐ εἰμί οἶδα , τίς δέ εἰμί οὐ οἶδα ·
761573	tlg4015.tlg001.opp-grc1	ὅτι μὲν γὰρ οὕτε σῶμα οὔτε χρῶμα οὔτε ἄγγελος οὔτε τι τῶν τοιούτων ἐστί, κρείττων δὲ ἢ κατὰ ταῦτα οἶδα, τί δὲ ἔστιν οὐκ οἶδα.	ὅτι2 μέν γάρ  σῶμα οὔτε χρῶμα οὔτε ἄγγελος οὔτε τι ὁ τοιοῦτος εἰμί , κρείσσων δέ τίη κατά οὗτος οἶδα , τίς δέ εἰμί οὐ οἶδα .
761574	tlg4015.tlg001.opp-grc1	ὥστε κοσμοῦσι μᾶλλον οἱ ὁρισμοὶ οἱ τοιοῦτοι ἔστιν ὅτε τὸ ὑποκείμενον μένον χωρίζοντες αὐτὸ πάντων τῶν καταδεεστέρων.	ὥστε κοσμέω μᾶλλον ὁ  ὁ τοιοῦτος εἰμί ὅτε ὁ  μένω χωρίζω αὐτός πᾶς ὁ  .
761575	tlg4015.tlg001.opp-grc1	καὶ ἐπὶ τῆς ὕλης δὲ τὸν ὁρισμὸν δι’ ἀποφάσεως εἰώθασιν ἀποδιδόναι, ἥτις μήτε ἄνθρωπός ἐστι λέγοντες μήτε λίθος μήτε πῦρ μήτε ὅλως σῶμα, χεῖρον δέ τι ἢ κατὰ ταῦτα·	καί ἐπί ὁ ὕλη δέ ὁ ὁρισμός διά ἀπόφασις εἴωθα ἀποδίδωμι , ὅστις μήτε ἄνθρωπος εἰμί λέγω μήτε λίθος μήτε πῦρ μήτε  σῶμα , χείρων δέ τι τίη κατά οὗτος ·
761576	tlg4015.tlg001.opp-grc1	διό φασι τὴν ὕλην τῷ θείῳ ἀνομοίως ὡμοιῶσθαι, ὡμοιῶσθαι μὲν ὅτι δι’ ἀποφάσεως τῶν ἄλλων σημαίνεται ἑκάτερον, ἀνομοίως δὲ ὅτι τοῦ μὲν κρείττονος ὄντος ἢ κτὰ πάντα τὰ ὄντα ἀποφάσκομεν πάντα, τῆς δὲ ὕλης χείρονος οὔσης ἢ κατὰ πάντα τὰ ὄντα ἀποφάσκομεν πάντα.	φημί ὁ ὕλη τῷ θεῖος2 ἀνόμοιος ὁμοιόω , ὁμοιόω μέν ὅτι2 διά ἀπόφασις ὁ ἄλλος σημαίνω  , ἀνόμοιος δέ ὅτι2 ὁ μέν  εἰμί ἤ  πᾶς ὁ εἰμί  πᾶς , ὁ δέ ὕλη χείρων εἰμί ἤ κατά πᾶς ὁ εἰμί  πᾶς .
761577	tlg4015.tlg001.opp-grc1	Ζητητέον δὲ εἰ ἐφαρμόζει ὁ ὁρισμὸς οὗτος καὶ ἐπὶ τῶν νοητῶν οὐσιῶν, οἷον ἀγγέλου καὶ τῶν τοιούτων, ὡς δύνασθαι ταῦτα λέγειν μήτε ἐν ὑποκειμένῳ εἶναι μήτε καθ’ ὑποκειμένου τινὸς λέγεσθαι·	δέ εἰ ἐφαρμόζω ὁ ὁρισμός οὗτος καί ἐπί ὁ νοητός  , οἷος ἄγγελος καί ὁ τοιοῦτος , ὡς δύναμαι οὗτος λέγω μήτε ἐν  εἰμί μήτε κατά   λέγω ·
761578	tlg4015.tlg001.opp-grc1	δοκεῖ γάρ πὼς καὶ ἐπ’ αὐτῶν ἐφαρμόζειν ὁ λόγος.	δοκέω γάρ  καί ἐπί αὐτός ἐφαρμόζω ὁ λόγος .
761579	tlg4015.tlg001.opp-grc1	ἀλλὰ λέγομεν ὅτι οὐκ ἐφαρμόζει·	ἀλλά λέγω ὅτι2 οὐ ἐφαρμόζω ·
761580	tlg4015.tlg001.opp-grc1	αἱ γὰρ εἰλημμέναι ἀποφάσεις ἐν τῷ ὁρισμῷ οὐ μόνον ἄρσιν σημαίνουσιν, ἀλλὰ καὶ θέσιν·	ὁ γάρ λαμβάνω ἀπόφημι ἐν ὁ ὁρισμός οὐ μόνος ἄρσις σημαίνω , ἀλλά καί θέσις ·
761581	tlg4015.tlg001.opp-grc1	πρὸς ἀντιδιαστολὴν γὰρ ἑτέρων λέγονται·	πρός  γάρ ἕτερος λέγω ·
761582	tlg4015.tlg001.opp-grc1	τὸ μὲν γὰρ μὴ ἐν ὑποκειμένῳ, ὅ ἐστιν ἡ οὐσία, πρὸς ἀντιδιαστολὴν τοῦ ἐν ὑποκειμένῳ, τοῦτ’ ἔστι τῶν συμβεβηκότων, εἴρηται, τὸ δὲ οὐ καθ’ ὑποκειμένου πρὸς ἀντιδιαστολὴν τοῦ καθ’ ὑποκειμένου·	ὁ μέν γάρ μή ἐν  ,  εἰμί ὁ οὐσία , πρός  ὁ ἐν  ,  εἰμί ὁ συμβαίνω , λέγω , ὁ δέ οὐ κατά  πρός  ὁ κατά  ·
761583	tlg4015.tlg001.opp-grc1	ὥσπερ δὲ τὸ φῶς διττόν ἐστι, τὸ μὲν πρὸς ἀντιδιαστολὴν τοῦ σκότους, λέγω δὴ τὸ ἐν τῷ ἀέρι, τὸ δὲ ἄσχετον καὶ μηδὲν ἔχον ἀντικείμενον ὡς τὸ ἡλιακόν, οὕτω καὶ τὰς ἐνταῦθα ἀποφάσεις ποτὲ μὲν φήσομεν καθ’ ἑαυτὰς καὶ μὴ πρὸς ἀντι- διαστολὴν λέγεσθαι ποτὲ δὲ πρὸς ἀντιδιαστολὴν τῶν ἀντικειμένων.	ὥσπερ δέ ὁ φάος δισσός εἰμί , ὁ μέν πρός  ὁ σκότος , λέγω δή ὁ ἐν ὁ  , ὁ δέ ἄσχετος καί  ἔχω  ὡς ὁ  , οὕτως καί ὁ ἐνταῦθα ἀπόφασις ποτε μέν φημί κατά ἑαυτοῦ καί μή πρός  - διαστολή λέγω ποτε δέ πρός  ὁ  .
761584	tlg4015.tlg001.opp-grc1	εἰ μὲν οὖν ἐνταῦθα μὴ πρὸς ἀντιδιαστολὴν τῶν ἀντικειμένων παρελαμβάνοντο αἱ ἀποφάσεις, εἶχέ πὼς λόγον τὸ καὶ ἐπὶ τῶν νοητῶν οὐσιῶν ἐφαρμόζειν τὸν ὁρισμόν, διότι οὔτε ἐν ὑποκειμένῳ τινὶ ὑπάρχουσιν οὔτε καθ’ ὑποκειμένου τινὸς κατηγοροῦνται·	εἰ μέν οὖν ἐνταῦθα μή πρός  ὁ   ὁ ἀπόφημι ,  πως λόγος ὁ καί ἐπί ὁ νοητός  ἐφαρμόζω ὁ ὁρισμός , διότι οὔτε ἐν   ὑπάρχω οὔτε κατά   κατηγορέω ·
761585	tlg4015.tlg001.opp-grc1	νῦν δὲ πρὸς ἀντιδιαστολὴν παραληφθεισῶν τῶν ἀποφάσεων τὰς μὲν μερικὰς οὐσίας σεμνύνομεν εἰκότως διὰ τοῦ ὁρισμοῦ, διὰ μὲν τοῦ μὴ ἐν ὑποκειμένῳ χωρίζοντες αὐτὰς τῶν συμβεβηκότῶν διὰ δὲ τοῦ μὴ καθ’ ὑποκειμένου τῶν καθ’ ὑποκειμένου, κἀνταῦθα δὲ τὸ σεμνὸν αὐταῖς προσάπτομεν λέγοντες αὐτὰς μὲν ἑτέροις χρείαν παρέχειν μηδενὸς δὲ δέεσθαι τὰ γὰρ καθόλου τῶν μερικῶν δέονται πρὸς κατηγορίαν, ταῦτα δὲ ἐκείνων οὐκέτι), τῖς δὲ νοηταῖς οὐσίαις οὐδεμίαν προσοίσομεν ἀξίαν διὰ τούτων·	νῦν δέ πρός   ὁ ἀπόφασις ὁ μέν  οὐσία  εἰκός διά ὁ ὁρισμός , διά μέν ὁ μή ἐν  χωρίζω αὐτός ὁ  διά δέ ὁ μή κατά  ὁ κατά  , ἐνταῦθα δέ ὁ σεμνός αὐτός προσάπτω λέγω αὐτός μέν ἕτερος χρεία παρέχω  δέ δέω ὁ γάρ καθόλου ὁ  δέω πρός κατηγορία , οὗτος δέ ἐκεῖνος οὐκέτι ) ,  δέ  οὐσία οὐδείς προσφέρω ἄξιος διά οὗτος ·
761586	tlg4015.tlg001.opp-grc1	οὐδὲν γὰρ μέγα, εἰ ταύτας εἴποιμεν μὴ εἶναι ἐν ὑποκειμένῳ·	οὐδείς γάρ μέγας , εἰ οὗτος  μή εἰμί ἐν  ·
761587	tlg4015.tlg001.opp-grc1	οὐδὲ γὰρ ἀντιδιῄρηται αὐταῖς συμβεβηκός τι·	οὐδέ γάρ  αὐτός  τι ·
761588	tlg4015.tlg001.opp-grc1	οὐδὲ γὰρ ὅλως δεκτικαί εἰσι συμβεβηκότων.	οὐδέ γάρ ὅλος  εἰμί συμβαίνω .
761589	tlg4015.tlg001.opp-grc1	καὶ τί λέγω περὶ τῶν νοητῶν οὐσιῶν, ὅπου γε οὐδὲ ἐπὶ ψυχῆς μόνης ἁρμόσει ὁ λόγος, ὅταν θεωρῶμεν αὐτὴν ἀπολελυμένην τῆς σχέσεως τῆς πρὸς τὸ σῶμα καὶ ἐξομοιωθεῖσαν θεῷ καὶ τὸ κοσμικὸν ἐπισκοποῦσαν ἀγαθόν;	καί τι λέγω περί ὁ νοητός  , ὅπου γε οὐδέ ἐπί ψυχή μόνος ἁρμόζω ὁ λόγος , ὅταν θεωρέω αὐτός  ὁ σχέσις ὁ πρός ὁ σῶμα καί  θεός καί ὁ   ἀγαθός ;
761590	tlg4015.tlg001.opp-grc1	ὁπηνίκα δὲ ἐν γενέσει θεωρεῖται καὶ τοῖς σώμασι συμπεπλεγμένη, τότε καὶ ἐπ’ αὐτῆς ἁρμόσει ὁ ὁρισμὸς ἅτε ὑποκειμένης συμβεβηκόσιν·	ὁπηνίκα δέ ἐν γένεσις θεωρέω καί ὁ σῶμα  , τότε καί ἐπί αὐτός ἁρμόζω ὁ ὁρισμός ἅτε  συμβαίνω ·
761591	tlg4015.tlg001.opp-grc1	ὑπόκειται γὰρ τῇ φιλοσοφίᾳ ἢ γραμματικῇ ἢ ἄλλῃ τινὶ ἐπιστήμῃ, ἅτινα περὶ αὐτὴν συμβέβηκε·	ὑπόκειμαι γάρ ὁ φιλοσοφία τίη γραμματικός ἤ ἄλλος  ἐπιστήμη , ὅστις περί αὐτός συμβαίνω ·
761592	tlg4015.tlg001.opp-grc1	τῶν δὲ δύο τῶν εἰλημμένων ἐν τῷ ὁρισμῷ τὸ μέν ἐστι τῇ φύσει πρῶτον τὸ δὲ τῇ διδασκαλίᾳ·	ὁ δέ γε ὁ  ἐν ὁ ὁρισμός ὁ μέν εἰμί ὁ φύσις  ὁ δέ ὁ διδασκαλία ·
761593	tlg4015.tlg001.opp-grc1	οὐσίας γὰρ| οὔσης καὶ συμβεβηκότος καὶ καθολικοῦ καὶ μερικοῦ, φύσει μὲν πρότερον ἡ οὐσία, διότι αὐτὴ μὲν αὐθυπόστατος πόστατος ἐκεῖνα δὲ ἐν ταύτῃ ἔχει τὸ εἶναι.	οὐσία γάρ | εἰμί καί συμβαίνω καί  καί  , φύσις μέν πρότερος ὁ οὐσία , διότι αὐτός μέν   ἐκεῖνος δέ ἐν οὗτος ἔχω ὁ εἰμί .
761594	tlg4015.tlg001.opp-grc1	κατὰ δὲ τὸν σκοπὸν τῆς προ- κειμένης διδασκαλίας πρότερον τὸ μερικόν·	κατά δέ ὁ  ὁ  -  διδασκαλία πρότερος ὁ  ·
761595	tlg4015.tlg001.opp-grc1	καὶ γὰρ τὸ καθόλου τῇ φύσει πρότερον.	καί γάρ ὁ καθόλου ὁ φύσις  .
761596	tlg4015.tlg001.opp-grc1	τῶν οὖν εἰλημμένων ἐν τῷ ὁρισμῷ τὸ μέν ἐστι πρῶτον ἐκ τῆς τῶν πραγμάτων φύσεως, τὸ δὲ·	ὁ οὖν  ἐν ὁ ὁρισμός ὁ μέν εἰμί πρῶτος ἐκ ὁ ὁ πρᾶγμα φύσις , ὁ δέ ·
761597	tlg4015.tlg001.opp-grc1	ἐκ τοῦ σκοποῦ τῆς διδασκαλίας.	ἐκ ὁ σκοπός ὁ διδασκαλία .
761598	tlg4015.tlg001.opp-grc1	καὶ σκόπει ὅτι οὐ μάτην προέλαβε τὴν περὶ τοῦ καθ’ ὑποκειμένου καὶ ἐν ὑποκειμένῳ διδασκαλίαν, ἐπεὶ ἔμελλεν ἡμῖν ἀσαφὴς εἶναι ὁ ὁρισμὸς τῶν ἐν αὐτῷ παραλαμβανομένων φωνῶν ἀγνώστων οὐσῶν.	καί σκοπέω ὅτι2 οὐ μάτην προλαμβάνω ὁ περί ὁ κατά  καί ἐν  διδασκαλία , ἐπεί μέλλω  ἀσαφής εἰμί ὁ ὁρισμός ὁ ἐν αὐτός παραλαμβάνω φωνέω ἄγνωστος εἰμί .
761599	tlg4015.tlg001.opp-grc1	p.	.
761600	tlg4015.tlg001.opp-grc1	2a14 Δεύτεραι δὲ οὐσίαι λέγονται.	δέ οὐσία λέγω .
761601	tlg4015.tlg001.opp-grc1	Ἄξιον δὲ ζητῆσαι ἐνταῦθα ποίῳ τρόπῳ κέχρηται διαιρέσεως ἐν τῇ οὐσίᾳ.	Ἄξιος δέ ζητέω ἐνταῦθα ποιός τρόπος χράω διαίρεσις ἐν ὁ οὐσία .
761602	tlg4015.tlg001.opp-grc1	τῶν γὰρ διαιρουμένων τὰ μὲν ὡς γένος εἰς εἴδη διαιροῦνται ὡς τὸ ζῷον εἰς λογικὸν καὶ ἄλογον, τὰ δὲ ὡς ὅλον εἰς μέρη ὡς τὸ σῶμα εἰς χεῖρας καὶ πόδας καὶ κεφαλὴν καὶ τὰ λοιπά, τὰ δὲ ὡς ὁμώνυμος φωνὴ εἰς διάφορα σημαινόμενα ὡς ὁ μῦς εἴς τε τὸν θαλάσσιον καὶ τὸν γηγενῆ.	ὁ γάρ  ὁ μέν ὡς γένος εἰς εἶδος διαιρέω ὡς ὁ ζῷον εἰς  καί ἄλογος ,  δέ ὡς  εἰς μέρος ὡς ὁ σῶμα εἰς χείρ καί πούς καί κεφαλή καί ὁ λοιπός , ὁ δέ ὡς ὁμώνυμος φωνή εἰς  σημαίνω ὡς ὁ μῦς  τε ὁ θαλάσσιος καί ὁ γηγενής .
761603	tlg4015.tlg001.opp-grc1	ἴδωμεν οὖν εἰ κατὰ μίαν τῶν διαιρέσεων τούτων διαιρεῖ τὴν οὐσίαν εἴς τε τὴν πρώτην καὶ τὴν δευτέραν.	οὖν εἰ κατά  ὁ διαίρεσις οὗτος διαιρέω ὁ οὐσία εἰς τε ὁ πρῶτος καί ὁ δεύτερος .
761604	tlg4015.tlg001.opp-grc1	φαμὲν οὖν ὅτι πρῶτον μὲν οὐκ ἔστιν ἡ διαίρεσις αὕτη τῶν ὡς γένος εἰς εἴδη διαιρουμένων·	φημί οὖν ὅτι2 πρῶτος μέν οὐ εἰμί ὁ διαίρεσις οὗτος ὁ ὡς γένος εἰς εἶδος διαιρέω ·
761605	tlg4015.tlg001.opp-grc1	παρα- κολουθεῖ γὰρ τῇ τοιαύτῃ διαιρέσει τὸ ἀναιρεθέντος ἑνὸς εἴδους μὴ συναναιριῖσθαι τὰ λοιπά·	-  γάρ ὁ τοιοῦτος διαίρεσις ὁ ἀναιρέω  εἰδοί μή  ὁ λοιπός ·
761606	tlg4015.tlg001.opp-grc1	ἀναιρεθέντος γὰρ ἀνθρώπου οὐ συναναιρεῖται τὰ λοιπὰ ζῷα, ἅπερ εἰσὶν εἴδη τοῦ ζῴου·	ἀναιρέω γάρ ἄνθρωπος οὐ συναναιρέω ὁ λοιπός ζῷον , ὅς εἰμί εἶδος ὁ ζῷον ·
761607	tlg4015.tlg001.opp-grc1	ἐνταῦθα μέντοι ἀναιρεθεί|σης σὴς τῆς δευτέρας οὐσίας συναναιρεῖται καὶ ἡ πρώτη·	ἐνταῦθα    ὁ δεύτερος οὐσία συναναιρέω καί ὁ πρῶτος ·
761608	tlg4015.tlg001.opp-grc1	γένους γὰρ καὶ εἴδους μὴ ὄντος οὐδὲ ἄτομα ἔσται.	γένος γάρ καί εἶδος μή εἰμί οὐδέ  εἰμί .
761609	tlg4015.tlg001.opp-grc1	ἄλλως τε οὐδὲν εἶδος ἕτερον εἶδος περιέχειν δύναται τῶν κατὰ τὴν αὐτὴν διαίρεσιν ἀντιδιαιρεθέντων ἀλλήλοις·	ἄλλος τε  εἶδος ἕτερος εἶδος περιέχω δύναμαι ὁ κατά ὁ αὐτός διαίρεσις  ἀλλήλων ·
761610	tlg4015.tlg001.opp-grc1	οὐδὲ γὰρ περιέχει ὁ ἄνθρωπος τὸν ἵππον, εἰ εἰς ταῦτα διαιρεθείη τὸ ζῷον, ἀλλ’ οὐδὲ τὸ λογικὸν ζῷον πάλιν περιέχει τὸ ἄλογον ἢ ἔμπαλιν, εἰ ἡ τοῦ ζῴου διαίρεσις εἰς αὐτὰ πάλιν γίνεται.	οὐδέ γάρ περιχέω ὁ ἄνθρωπος ὁ ἵππος , εἰ εἰς οὗτος διαιρέω ὁ ζῷον , ἀλλά οὐδέ ὁ λογικός ζῷον πάλιν περιέχω ὁ ἄλογος τίη ἔμπαλιν , εἰ ὁ ὁ ζῷον διαίρεσις εἰς αὐτός πάλιν γίγνομαι .
761611	tlg4015.tlg001.opp-grc1	ἀλλ’ οὐδὲ ὅλως οὕτως διαιρεῖν δυνατὸν ὡς θάτερον ἐν θατέρῳ περιέχεσθαι, οἷον ὅτι τοῦ ζῴου τὸ μὲν ἄλογον τὸ δὲ ἵππος·	ἀλλά οὐδέ ὅλος οὕτως διαιρέω δυνατός ὡς ἕτερος ἐν ἕτερος περιέχω , οἷος ὅτι2 ὁ ζῷον ὁ μέν ἄλογος ὁ δέ ἵππος ·
761612	tlg4015.tlg001.opp-grc1	περιέχεται γὰρ ἐν τῷ ἀλόγῳ καὶ ὁ ἵππος·	περιέχω γάρ ἐν τῷ  καί ὁ ἵππος ·
761613	tlg4015.tlg001.opp-grc1	οὔτε γὰρ ἀωτιδιαιπεῖται τῷ περιέχοντι τὸ περιεχόμενον.	οὔτε γάρ  τῷ περιέχω ὁ περιέχω .
761614	tlg4015.tlg001.opp-grc1	λέγομεν δὲ τοῦ ζῴου τὸ μὲν ἄλογον εἶναι τὸ δὲ λογικόν, ἐπειδὴ ἴσην ἀπόστασιν τοῦ γένους ἀφεστηκότα ταῦτα οὐδέτερον ἐν ἑτέρῳ περιέχεται.	λέγω δέ ὁ ζῷον ὁ μέν ἄλογος εἰμί ὁ δέ λογικός , ἐπεί ἴσος ἀπόστασις ὁ γένος ἀφίστημι οὗτος οὐδέτερος ἐν ἕτερος περιέχω .
761615	tlg4015.tlg001.opp-grc1	ἐνταῦθα μέντοι γε ἡ δευτέρα οὐσία τὴν πρώτην περιέχει·	ἐνταῦθα  γε ὁ δεύτερος οὐσία ὁ πρῶτος περιχέω ·
761616	tlg4015.tlg001.opp-grc1	περιεκτικὸν γὰρ τὸ εἶδος τῶν ἀτόμων καὶ ἔτι μᾶλλον τὸ γένος.	γάρ ὁ εἶδος ὁ  καί ἔτι μᾶλλον ὁ γένος .
