id	filename	tokens	lemmas
1111151	tlg4034.tlg003.opp-grc1	ἐξ ὑγροῦ γὰρ τὴν σύστασιν ἔχοντες τῷ περιττεύσαντι ὑγρῷ ἐκ τῆς τοῦ σώματος αὐτῶν συστάσεως χρῶνται εἰς τροφήν.	ἐκ  γάρ ὁ σύστασις ἔχω τῷ   ἐκ ὁ ὁ σῶμα αὐτός σύστασις χράω2 εἰς τροφή .
1111152	tlg4034.tlg003.opp-grc1	λέγει δὲ καὶ τὰ ἐφήμερα ζῷα ζῆν μίαν ἡμέραν, τοὺς δὲ τέττιγας πλείονας μὲν ἡμέρας ζῆν τῆς μιᾶς, ἣν ζῶσι τὰ ἐφήμερα, ὀλίγας δέ.	λέγω δέ καί ὁ ἐφήμερος ζῷον ζήω  ἡμέρα , ὁ δέ τέττιξ πολύς μέν ἡμέρα ζήω ὁ  , ὅς ζήω ὁ ἐφήμερος , ὀλίγος δέ .
1111153	tlg4034.tlg003.opp-grc1	Ταῦτα εἰπὼν ἐφεξῆς πάλιν περὶ τῶν ἐκτὸς μορίων τῶν ἐντόμων λέγει, καί φησιν αὐτὰ μὴ εἶναι πολυμερῆ·	οὗτος λέγω ἐφεξῆς πάλιν περί ὁ ἐκτός μόριος ὁ ἔντομος λέγω , καί φημί αὐτός μή εἰμί πολυμερής ·
1111154	tlg4034.tlg003.opp-grc1	οὐ γὰρ ἔχουσιν αὐχένα καὶ χεῖρας καὶ τά τοιαῦτα·	οὐ γάρ ἔχω αὐχήν καί χείρ καί ὁ τοιοῦτος ·
1111155	tlg4034.tlg003.opp-grc1	εἰσὶ δὲ πολύποδα, καὶ τὴν αἰτίαν τῆς πολυποδίας λέγει σαφῶς.	εἰμί δέ  , καί ὁ αἰτία ὁ  λέγω σαφής .
1111156	tlg4034.tlg003.opp-grc1	ἔχουσι δέ, φησί, πλείονας ἐντομάς, διότι καὶ ἀρχὰς πλείονας, αἱ δὲ ἀρχαὶ αἰ ἀναλογοῦσαι τῇ καρδίᾳ αἱ ἐντομαί εἰσιν, ἐν αἷς εἰσιν αἱ αἰσθητικαὶ ψυχαί.	ἔχω δέ , φημί , πολύς ἐντομή , διότι καί ἀρχή πολύς , ὁ δέ ἀρχή   ὁ καρδία ὁ  εἰμί , ἐν ὅς εἰμί ὁ αἰσθητικός ψυχή .
1111157	tlg4034.tlg003.opp-grc1	διὰ δὲ ταύτας ἐστὶ τὰ τοιαῦτα ζῷα καὶ πολύποδα, ὅπως ἀνέχωνταί τε καὶ φέρωνται ὡσπερεὶ μέλη παραλελυμένα ὑπὸ τῶν ποδῶν.	διά δέ οὗτος εἰμί ὁ τοιοῦτος ζῷον καί  , ὅπως  τε καί φέρω  μέλος  ὑπό ὁ πούς .
1111158	tlg4034.tlg003.opp-grc1	ὅσα δὲ τῶν ἐντόμων ὀλιγόποδά ἐστιν, ἀντὶ ποδῶν δέδωκεν αὐτοῖς ἡ φύσις πτερά.	ὅσος δέ ὁ   εἰμί , ἀντί πούς δίδωμι αὐτός ὁ φύσις  .
1111159	tlg4034.tlg003.opp-grc1	λέγει δὲ τοῖς βίοις ἑδραῖα τὰ μὴ ἐκτοπιζόμενα καὶ πόρρω ἀποπλανώμενα, καὶ λέγει ἔχειν αὐτὰ καὶ ἔλυτρα ἐν τοῖς πτεροῖς διὰ τὴν ἑδραιότητα καὶ δυσκινησίαν·	λέγω δέ ὁ βίος  ὁ μή  καί   , καί λέγω ἔχω αὐτός καί ἔλυτρον ἐν ὁ πτερόν διά ὁ  καί  ·
1111160	tlg4034.tlg003.opp-grc1	δυσκίνητα γὰρ ὄντα καὶ διὰ τοῦτο μᾶλλον δυνάμενα βλάπτεσθαι ὑπὸ τῶν ἐπιβουλευόντων, δέδοται αὐτοῖς τὰ ἔλυτρα εἰς σκέπην καὶ βοήθειαν.	δυσκίνητος γάρ ὄντα καί διά οὗτος μᾶλλον  βλάπτω ὑπό ὁ ἐπιβουλεύω , δίδωμι αὐτός ὁ ἔλυτρον εἰς σκέπη καί βοήθεια .
1111161	tlg4034.tlg003.opp-grc1	τὰ δὲ πτερά, φησί, τῶν τοιούτων εἰσὶν ὑμένες δερματικοί, οἵτινες διὰ τὴν σκληρότητα τοῦ σαρκώδους ψυχόμενοι ἀφίστανται τοῦ σώματος, ὥσπερ καὶ τὰ τῶν δένδρων φύλλα, ἐπειδὰν ὁ ὀπὸς παγῇ.	ὁ δέ  , φημί , ὁ τοιοῦτος εἰμί ὑμήν  , ὅστις διά ὁ σκληρότης ὁ   ἀφίστημι ὁ σῶμα , ὥσπερ καί ὁ ὁ δένδρον φύλλον , ἐπεί ὁ ὀπός πηγή .
1111162	tlg4034.tlg003.opp-grc1	ὥστε καὶ διὰ τοῦτο ἄν εἴη αὐτοῖς ὑπὸ | τῆς φύσεως τὰ ἔλυτρα δεδομένα, ἵνα θερμαίνηται ὑπὸ τούτων τὰ πτερὰ καὶ μὴ ταχέως ψύχηται.	ὥστε καί διά οὗτος ἄν εἰμί αὐτός ὑπό  ὁ φύσις ὁ ἔλυτρον  , ἵνα  ὑπό οὗτος ὁ πτερόν καί μή ταχύς ψύχω .
1111163	tlg4034.tlg003.opp-grc1	εἰπὼν δὲ τὰ ἔντομα ἔχειν τὰς ἐντομὰς πλείονας διὰ τὸ καὶ τὰς ἀρχὰς πλείονας, λέγει καὶ ἄλλην αἰτίαν τούτου λίαν σαφῶς‘ καὶ τὰ μὲν ἑλικτὰ τῶν ἐντόμων συνελίττεται, τὰ δὲ μὴ ἑλικτὰ συνιόντα καὶ εἰς ἑαυτὰ συνιζάνοντα ὥσπερ σπόγγοι, ἐπειδάν τις αὐτῶν ἅψηται, σκληρύνεται εἰ γὰρ τὸ μανούμενον μαλακόν, τὸ πυκνούμενον καὶ εἰς ἑαυτὸ συνιζάνον δῆλον ὡς σκληρόν.	λέγω δέ ὁ ἔντομος ἔχω ὁ ἐντομή πολύς διά ὁ καί ὁ ἀρχή  , λέγω καί ἄλλος αἰτία οὗτος λίαν σαφής ‘ καί ὁ μέν  ὁ   , ὁ δέ μή  σύνειμι2 καί εἰς   ὥσπερ  , ἐπεί τις αὐτός  ,  εἰ γάρ ὁ  μαλακός , ὁ  καί εἰς  συνιζάνω δῆλος ὡς σκληρός .
1111164	tlg4034.tlg003.opp-grc1	σαφῆ δὲ τὰ ἑξῆς.	σαφής δέ ὁ ἑξῆς .
1111165	tlg4034.tlg003.opp-grc1	Λέγει δὲ τὰς μελίττας ἐν ἑαυταῖς ἔχειν τὸ κέντρον, ἀλλ’ οὐκ ἐκτός.	λέγω δέ ὁ μέλισσα ἐν  ἔχω ὁ κέντρον , ἀλλά οὐ ἐκτός .
1111166	tlg4034.tlg003.opp-grc1	καὶ μίαν μὲν ἐπήγαγε τοῦ ἐντὸς ἔχειν τὸ κέντρον αἰτίαν τὸ εἶναι πτηνά·	καί  μέν ἐπάγω ὁ ἐντός ἔχω ὁ κέντρον αἰτία ὁ εἰμί πτηνός ·
1111167	tlg4034.tlg003.opp-grc1	πτηνὰ γὰρ ὄντα δύναται φεύγειν τὰ ἐπιβουλεύοντα, ἕως ἄν ἐκβάλωσι τὰ κέντρα πρὸς ἄμυναν, ὥστε οὐκ ἀνάγκη ἐκτὸς καὶ ἕτοιμον ἔχειν τὸ κέντρον ἄλλην δὲ πάλιν αἰτίαν ἐπήγαγε λίαν σαφῶς αὐτὴν ἑρμηνεύσας.	πτηνός γάρ ὄντα δύναμαι φεύγω ὁ ἐπιβουλεύω , ἕως ἄν ἐκβάλλω ὁ κέντρον πρός  , ὥστε οὐ ἀνάγκη ἐκτός καί ἑτοῖμος ἔχω ὁ κέντρον ἄλλος δέ πάλιν αἰτία ἐπάγω λίαν σαφής αὐτός  .
1111168	tlg4034.tlg003.opp-grc1	ἀλλὰ ταύταις μὲν οὐκ ἀνάγκη τὸ κέντρον ἐκτὸς ἔχειν, τοῖς δὲ σκορπίοις πεζοῖς οὖσι καὶ μὴ δυναμένοις τάχιον ὑπὸ τῶν ἐπιβουλευόντων ἀμύνεσθαι, ἀναγκαῖον ἐπὶ ταῦτα, τουτέστιν ἐκτὸς ἔχειν τὸ κέντρον.	ἀλλά οὗτος μέν οὐ ἀνάγκη ὁ κέντρον ἐκτός ἔχω , ὁ δέ  πεζός εἰμί καί μή   ὑπό ὁ ἐπιβουλεύω ἀμύνω , ἀναγκαῖον ἐπί οὗτος ,  ἐκτός ἔχω ὁ κέντρον .
1111169	tlg4034.tlg003.opp-grc1	εἰ δὲ μή, οὐκ ἂν εἴη χρήσιμον αὐτοῖς·	εἰ δέ μή , οὐ ἄν εἰμί χρήσιμος αὐτός ·
1111170	tlg4034.tlg003.opp-grc1	φονευθήσονται γὰρ θᾶττον τοῦ ἐκβαλεῖν τὸ κέντρον.	γάρ ταχύς ὁ ἐκβάλλω ὁ κέντρον .
1111171	tlg4034.tlg003.opp-grc1	τὰ δὲ μικρὰ καὶ δίπτερα καὶ διὰ τοῦτο ἀσθενῆ λέγει ἔχειν ἔμπροσθεν τὸ κέντρον·	ὁ δέ μικρός καί  καί διά οὗτος ἀσθενής λέγω ἔχω ἔμπροσθεν ὁ κέντρον ·
1111172	tlg4034.tlg003.opp-grc1	μόλις γὰρ δύναται καὶ τοῖς ἔμπροσθεν τύπτειν δι’ ἀσθένειαν·	μόλις γάρ δύναμαι καί ὁ ἔμπροσθεν τύπτω διά ἀσθένεια ·
1111173	tlg4034.tlg003.opp-grc1	τὰ γὰρ ἐκ τῶν ὄπισθεν τύπτοντα ἰσχυρὰ πάντα.	ὁ γάρ ἐκ ὁ ὄπισθεν τύπτω ἰσχυρός πᾶς .
1111174	tlg4034.tlg003.opp-grc1	λέγει δὲ καὶ ὅτι βέλτιόν ἐστιν, ἐν οἷς ἐνδέχεται μὴ τὸ αὐτὸ ὄργανον ἔχειν ἐπὶ ἀνομοίας χρήσεις, ἔχε.	λέγω δέ καί ὅτι2 βελτίων εἰμί , ἐν ὅς ἐνδέχομαι μή ὁ αὐτός ὄργανον ἔχω ἐπί  χράω2 , ἔχω .
1111175	tlg4034.tlg003.opp-grc1	.	.
1111176	tlg4034.tlg003.opp-grc1	ν ἄλλο πρὸς ἄλλην.	ἄλλος πρός ἄλλος .
1111177	tlg4034.tlg003.opp-grc1	ᾗ γὰρ ἐνδέχεται εἰς δύο πράξεις δύο ὄργανα εἶναι, οἷον ἄλλο μὲν πρὸς τὸ ὁρᾶν, ἄλλο δὲ πρὸς τὸ ἀκούειν, οὐκ εἴωθεν ἡ φύσις ἓν ποιεῖν καὶ τὸ αὐτό, οἶον οὖς καὶ πρὸς τὸ ἀκούειν καὶ πρὸς τὸ ὁρᾶν, ἀλλ’ ὥσπερ εἴρηται, ἄλλο μὲν πρὸς τὴν ἄκουσιν, ἄλλο δὲ πρὸς τὴν ὅρασιν ἀποδίδωσιν.	ὅς γάρ ἐνδέχομαι εἰς γε πρᾶξις γε ὄργανον εἰμί , οἷος ἄλλος μέν πρός ὁ ὁράω , ἄλλος δέ πρός ὁ ἀκούω , οὐ  ὁ φύσις  ποιέω καί ὁ αὐτός , οἶος οὖς καί πρός ὁ ἀκούω καί πρός ὁ ὁράω , ἀλλά ὥσπερ λέγω , ἄλλος μέν πρός ὁ  , ἄλλος δέ πρός ὁ ὅρασις  .
1111178	tlg4034.tlg003.opp-grc1	οὐ γάρ ἐστιν ἡ φύσις εὐτελὴς καὶ φειδωλός.	οὐ γάρ εἰμί ὁ φύσις εὐτελής καί φειδωλός .
1111179	tlg4034.tlg003.opp-grc1	ἵνα τὸ αὐτὸ καὶ ἓν ὄργανον ἀπεργάσηται πρὸς δύο πράξεις ὥσπερ ἡ χαλκευτική·	ἵνα ὁ αὐτός καί  ὄργανος  πρός γε πρᾶξις ὥσπερ ὁ χαλκευτικός ·
1111180	tlg4034.tlg003.opp-grc1	ἐκείνη γὰρ διὰ μικροπρέπειαν καὶ φειδωλίαν ἀπεργάζεται πρόμηκες σιδήριον, καὶ χρῆται τῷ αὐτῷ καὶ ἑνὶ προμήκει σιδηρίῳ καὶ ὡς λύχνῳ καὶ ὡς ὀβελίσκῳ, ὃ δὴ καὶ ὀβελισκολύχνιον ἐπονομάζεται.	ἐκεῖνος γάρ διά  καί φειδωλία ἀπεργάζομαι  σιδήριον , καί χράω2 τῷ αὐτός καί  προμήκης σιδήριον καί ὡς λύχνος καί ὡς ὀβελίσκος , ὅς δή καί  ἐπονομάζω .
1111181	tlg4034.tlg003.opp-grc1	σάφ᾿ ἡ δὲ τὰ ἑξῆς.	ὁ δέ ὁ ἑξῆς .
1111182	tlg4034.tlg003.opp-grc1	τὸ δὲ ἀεὶ γὰρ χαρακίζουσιν αἱ μυῖαι τοῖς προσθίοις σκέλεσι, τὸ δὴ χαρακίζουσιν ἴσον ἐστὶ τῷ ἀποκαθαίρουσιν·	ὁ δέ ἀεί γάρ  ὁ μυῖα ὁ πρόσθιος σκέλος , ὁ δή  ἴσος εἰμί τῷ  ·
1111183	tlg4034.tlg003.opp-grc1	ἀεὶ γὰρ ἀποκαθαίρουσι τοὺς ὀφθαλμοὺς τοῖς προσθίοις σκέλεσιν.	ἀεί γάρ  ὁ ὀφθαλμός ὁ πρόσθιος σκέλος .
1111184	tlg4034.tlg003.opp-grc1	ὡς γὰρ οἱ χάρακες ἀπερύκουσι τοὺς πολεμίους, οὕτω καὶ τὰ πρόσθια σκέλη τῶν μυιῶν αποδιώκουσι τὰ προσπίπτοντα τοῖς ὀφθαλμοῖς.	ὡς γάρ ἕ χάραξ  ὁ πολέμιος , οὕτως καί ὁ πρόσθιος σκέλος ὁ   ὁ προσπίπτω ὁ ὀφθαλμός .
1111185	tlg4034.tlg003.opp-grc1	ὅτι δέ, φησί, καὶ τὰ ὀπίσθια σκέλη μείζω ἐστὶν διὰ τὸ αἴρεσθαι ἀπὸ τῆς γῆς, μᾶλλον δῆλον ἐπὶ τῶν πηδητικῶν, οἷον ἐπὶ τῶν ἀκρίδων καὶ ψυλλῶν.	ὅτι2 δέ , φημί , καί ὁ ὀπίσθιος σκέλος μέγας εἰμί διά ὁ αἴρω ἀπό ὁ γῆ , μᾶλλον δῆλος ἐπί ὁ  , οἷος ἐπί ὁ ἀκρίς καί ψύλλα .
1111186	tlg4034.tlg003.opp-grc1	ὅταν γὰρ κάμψαντα τὰ ὀπίσθια σκέλη καὶ ταπεινότερα γενόμενα ἐκ τῆς καμπῆς πάλιν ἐκτείνῃ.	ὅταν γάρ  ὁ ὀπίσθιος σκέλος καί  γίγνομαι ἐκ ὁ καμπή πάλιν  .
1111187	tlg4034.tlg003.opp-grc1	ἀνάγκη αἴρεσθαι μᾶλλον·	ἀνάγκη αἴρω μᾶλλον ·
1111188	tlg4034.tlg003.opp-grc1	εἰ γὰρ κάμψαντα ταπεινοῦται καὶ ἴσα ἐκ τῆς καμπῆς γένηται τοῖς προσθίοις τά ὀπίσθια.	εἰ γάρ  ταπεινόω καί ἴσος ἐκ ὁ καμπή γίγνομαι ὁ πρόσθιος ὁ  .
1111189	tlg4034.tlg003.opp-grc1	ἀνάγκη ἐκταθέντα αἴρεσθαι καὶ ὑψηλότερα γίνεσθαι τὰ ὀπίσθια τῶν προσθίων.	ἀνάγκη  αἴρω καί ὑψηλός γίγνομαι ὁ  ὁ  .
1111190	tlg4034.tlg003.opp-grc1	οὐκ ἔχουσι δὲ τὰ πηδαλιώδη σκέλη ἔμπροσθεν αἵ τε μυῖαι καὶ ἀκρίδες καὶ αἱ ψύλλαι καὶ τὰ ὅμοια, ἀλλ’ ὄπισθεν, ὅτι ἀνάγκη τὴν καμπὴν εἴσω, τουτέστι πρὸς τὴν κοιλίαν καὶ τὰ στέρνα ἔχειν, οὐδὲν δὲ τῶν τοιούτων ζῴων τὰ πρόσθια σκέλη ὑπὸ τὴν κοιλίαν καὶ τὰ στέρνα κάμπτει, ἀλλ’ εἰς τὰ πλάγια.	οὐ ἔχω δέ ὁ  σκέλος ἔμπροσθεν ὁ τε μυῖα καί ἀκρίς καί ὁ ψύλλα καί ὁ ὅμοιος , ἀλλά ὄπισθεν , ὅτι2 ἀνάγκη ὁ καμπή εἴσω ,  πρός ὁ κοιλία καί ὁ στέρνον ἔχω ,  δέ ὁ τοιοῦτος ζῷον ὁ πρόσθιος σκέλος ὑπό ὁ κοιλία καί ὁ στέρνον κάμπτω , ἀλλά εἰς ὁ πλάγιον .
1111191	tlg4034.tlg003.opp-grc1	τὴν δ᾿ ἀνάγκην τοῦ τὰ ὄπισθεν εἴσω κάμπτειν, τὰ δὲ πρόσθια εἰς τὰ σκέλη εἴρηκεν ἐν τῇ Περὶ ζῴων πορείας.	ὁ  ἀνάγκη ὁ ὁ ὄπισθεν εἴσω κάμπτω , ὁ δέ  εἰς ὁ σκέλος λέγω ἐν ὁ περί ζῷον πορεία .
1111192	tlg4034.tlg003.opp-grc1	σαφῆ δὲ τὰ ἑξῆς.	σαφής δέ ὁ ἑξῆς .
1111193	tlg4034.tlg003.opp-grc1	Λέγει δὲ ὅτι πάντα τὰ τοῦ σώματος τῶν ὀστρακοδέρμων μόρια ἀνώνυμά ἐστι, πλὴν τοῦ δι’ οὗ δέχονται τὴν τροφήν·	λέγω δέ ὅτι2 πᾶς ὁ ὁ σῶμα ὁ  μόριον  εἰμί , πλήν ὁ διά οὗ δέχομαι ὁ τροφή ·
1111194	tlg4034.tlg003.opp-grc1	τοῦτο γὰρ μόνον καλεῖται στόμα.	οὗτος γάρ μόνος καλέω στόμα .
1111195	tlg4034.tlg003.opp-grc1	τὰ δὲ μαλακόστρακα πάντα πρὸς τῷ νευστικὰ εἶναι καὶ πορευτικά ἐστιν.	ὁ δέ  πᾶς πρός τῷ νευστικός εἰμί καί  εἰμί .
1111196	tlg4034.tlg003.opp-grc1	ὅσα δέ, φησίν, ἔχει χηλάς, οὐ πρὸς τὸ πορεύεσθαι ἔχει αὐτάς, ἀλλὰ πρὸς τὸ λαμβάνειν·	δέ , φημί , ἔχω χηλή , οὐ πρός ὁ πορεύω ἔχω αὐτός , ἀλλά πρός ὁ λαμβάνω ·
1111197	tlg4034.tlg003.opp-grc1	διὸ καὶ ἑλίσσουσι καὶ συστρέφουσιν αὐτὰς πρὸς τὸ στόμα, ὥσπερ καὶ ἡμεῖς τἀς χεῖρας.	διό καί  καί συστρέφω αὐτός πρός ὁ στόμα , ὥσπερ καί   χείρ .
1111198	tlg4034.tlg003.opp-grc1	πλάτας δὲ λέγει τὰς κώπας.	πλάτης δέ λέγω ὁ κώπη .
1111199	tlg4034.tlg003.opp-grc1	οἱ δὲ μικροὶ πάμπαν, φησί, καρκίνοι ἁλίσκονται διὰ τῶν μικρῶν ἰχθυδίων·	ὁ δέ μικρός πάμπαν , φημί ,  ἁλίσκομαι διά ὁ μικρός  ·
1111200	tlg4034.tlg003.opp-grc1	τοῦτο γὰρ ἐδήλωσε διὰ τοῦ οἱ δὲ πάμπαν μικροὶ καρκίνοι, οἳ ἁλίσκονται ἐν τοῖς μικροῖς ἰχθυδίοις.	οὗτος γάρ δηλόω διά ὁ ὁ δέ πάμπαν μικρός  , ὁ ἁλίσκομαι ἐν ὁ μικρός  .
1111201	tlg4034.tlg003.opp-grc1	ἢ τὸ λεγόμενον ἴσον ἐστὶν τῷ οἳ ἁλίσκονται μετὰ τῶν μικρῶν ἰχθυδίων·	τίη ὁ λέγω ἴσος εἰμί τῷ ὁ ἁλίσκομαι μετά ὁ μικρός  ·
1111202	tlg4034.tlg003.opp-grc1	συναλίσκονται γὰρ ταῖς μικραῖς ἀθερίναις καὶ ἀμίαις καὶ τοῖς τοιούτοις.	γάρ ὁ μικρός  καί  καί ὁ τοιοῦτος .
1111203	tlg4034.tlg003.opp-grc1	τὰ δὲ καραβοειδῆ λέ|γει ἔχειν πολλοὺς πόδας διὰ τὸ μὴ μᾶλλον νευστικὰ εἶναι ἢ πορευτικά·	ὁ δέ   ἔχω πολύς πούς διά ὁ μή μᾶλλον νευστικός εἰμί ἤ  ·
1111204	tlg4034.tlg003.opp-grc1	εἰ μὲν γὰρ ἦσαν μᾶλλον νευστικώτερα, εἶχον ἂν ὀλίγους πόδας.	εἰ μέν γάρ εἰμί μᾶλλον  , ἔχω ἐάν ὀλίγος πούς .
1111205	tlg4034.tlg003.opp-grc1	ἐπεὶ δὲ μᾶλλόν εἰσι πορευτικώτερα, ἔχουσι πολλοὺς πόδας.	ἐπεί δέ  εἰμί  , ἔχω πολύς πούς .
1111206	tlg4034.tlg003.opp-grc1	εἴρηται δὲ καὶ τούτων ἡ αἰτία ἐν τῷ Περὶ πορείας ζῴων.	λέγω δέ καί οὗτος ὁ αἰτία ἐν τῷ  πορεία ζῷον .
1111207	tlg4034.tlg003.opp-grc1	αἱ δὲ θήλειαι τῶν καράβων ἔχουσι τὰ κάτω πλακωδέστερα, καὶ αἱ θήλειαι τῶν καρκίνων τὰ ἐν τῷ ἐπιπτύγματι δασύτερα, διότι τὰ ᾠὰ πρὸς αὐτὰ ἐκτείνουσι καὶ ἀποτίθενται, ἔνθα καὶ ζῷα γινόμενα ἐξέρχεται.	ὁ δέ θῆλυς ὁ  ἔχω ὁ κάτω  , καί ὁ  ὁ καρκίνος ὁ ἐν ὁ  δασύς , διότι ὁ ᾠόν πρός αὐτός ἐκτείνω καί ἀποτίθημι , ἔνθα καί ζῷον  ἐξέρχομαι .
1111208	tlg4034.tlg003.opp-grc1	εὐρυχωρότερα γὰρ ὄντα καὶ μείζω τά τε κάτω τῶν καράβων καὶ τὰ ἐν τῷ ἐπιπτύγματι τῶν καρκίνων χώραν ἔχει τοῖς ᾠοῖς μᾶλλον, τουτέστι χώραν δίδωσι μονῆς τοῖς ᾠοῖς.	γάρ ὄντα καί μέγας ὁ τε κάτω ὁ  καί ὁ ἐν ὁ  ὁ  χώρα ἔχω ὁ  μᾶλλον ,  χώρα δίδωμι μονή ὁ  .
1111209	tlg4034.tlg003.opp-grc1	τὰ δὲ ἑξῆς σαφῆ.	ὁ δέ ἑξῆς σαφής .
1111210	tlg4034.tlg003.opp-grc1	Λέγει δὲ τὰ μαλάκια τὸ κύτος τοῦ σώματος ἔχειν ἀδιόριστον·	λέγω δέ ὁ  ὁ κύτος ὁ σῶμα ἔχω ἀδιόριστος ·
1111211	tlg4034.tlg003.opp-grc1	οὐ γὰρ ἔχει στέρνα ὡρισμένα καὶ διηρθρωμένα πλευράς τε καὶ τὰ λοιπά, ἀλλ᾿ ἀόριστα καὶ ἄδηλα, καὶ τούτου τοῦ κύτους ἔχει τοὺς πόδας ἔμπροσθεν περὶ τὴν κεφαλήν, ἐντὸς μέν, φησί, τῶν ὀφθαλμῶν, τουτέστιν οὐκ ἐγγὺς τῶν ὀφθαλμῶν, ἀλλ’ ὀλίγον πορρώτερον ἐπὶ τὸ ἔμπροσθεν, οἷον εἴ τις νοήσειε τὴν ἑαυτοῦ χεῖρα τὸ κύτος τοῦ πολύποδος, ἐν δὲ τῷ ἄκρῳ ἑνὸς τῶν δακτύλων τοὺς ὀφθαλμούς, ἐν δὲ τῇ καμπῇ τοῦ πρώτου κονδύλου τοῦ μετὰ τὸν ὄνυχα τοὺς πόδας καὶ λέγει ὅτι ἐντὸς τῶν ὀφθαλμῶν εἰσιν οἱ πόδες, τοιοῦτόν τί ἐστι καὶ ἐπὶ τῶν πολυπόδων·	οὐ γάρ ἔχω στέρνον ὁρίζω καί  πλευρά τε καί ὁ λοιπός ,  ἀόριστος καί ἄδηλος , καί οὗτος ὁ κύτος ἔχω ὁ πούς ἔμπροσθεν περί ὁ κεφαλή , ἐντός μέν , φημί , ὁ ὀφθαλμός ,  οὐ ἐγγύς ὁ ὀφθαλμός , ἀλλά ὀλίγος  ἐπί ὁ ἔμπροσθεν , οἷος εἰ τις νοέω ὁ ἑαυτοῦ χείρ ὁ κύτος ὁ πολύπους , ἐν δέ τῷ ἄκρον  ὁ δάκτυλος ὁ ὀφθαλμός , ἐν δέ ὁ  ὁ πρῶτος κόνδυλος ὁ μετά ὁ ὄνυξ ὁ πούς καί λέγω ὅτι2 ἐντός ὁ ὀφθαλμός εἰμί ὁ πούς , τοιοῦτος τίς εἰμί καί ἐπί ὁ  ·
1111212	tlg4034.tlg003.opp-grc1	ἢ τὸ ἐντὸς ἀντὶ τοὐ ἔμπροσθε.	τίη ὁ ἐντός ἀντί   .
1111213	tlg4034.tlg003.opp-grc1	ἔχουσι μὲν οὖν, ὡς εἴρηται, τοὺς πόδας ἐντὸς τῶν ὀφθαλμῶν, περὶ δὲ τὸ στόμα καὶ τοὺς ὀδόντας, τουτέστιν ἔχουσι μὲν ἐντὸς τῶν ὀφθαλμῶν, πλησίον δὲ καὶ ἐγγὺς τοῦ στόματος καὶ τῶν ὀδόντων·	ἔχω μέν οὖν , ὡς λέγω , ὁ πούς ἐντός ὁ ὀφθαλμός , περί δέ ὁ στόμα καί ὁ ὀδούς ,  ἔχω μέν ἐντός ὁ ὀφθαλμός , πλησίος δέ καί  ὁ στόμα καί ὁ ὀδούς ·
1111214	tlg4034.tlg003.opp-grc1	τὸ γὰρ περὶ τὸ στόμα ἴσον ἐστὶ τῷ πλησίον τοῦ στόματος.	ὁ γάρ περί ὁ στόμα ἴσος εἰμί τῷ πλησίος ὁ στόμα .
1111215	tlg4034.tlg003.opp-grc1	καὶ τὰ μὲν ἄλλα ζῷα, ὅσα ἔχει πόδας, τοὺς μὲν ἔχει ἔμπροσθεν, ὥσπερ τὰ τετράποδα, τοὺς δὲ ὄπισθεν, τὰ δὲ πάντας ἐκ τοῦ πλαγίου, ὡς τὰ ἄναιμα καὶ ὅλως τὰ πολύποδα.	καί ὁ μέν ἄλλος ζῷον , ὅσος ἔχω πούς , ὁ μέν ἔχω ἔμπροσθεν , ὥσπερ ὁ τετράπους , ὁ δέ ὄπισθεν , ὁ δέ πᾶς ἐκ ὁ πλάγιον , ὡς ὁ ἄναιμος καί ὅλος ὁ  .
1111216	tlg4034.tlg003.opp-grc1	τὸ δὲ γένος τὸ τῶν πολυπόδων ἰδίως καὶ διαφερόντως παρὰ τὰ εἰρημένα ζῷα ἔχει τοὺς πόδας·	ὁ δέ γένος ὁ ὁ  ἴδιος καί διαφερόντως παρά ὁ λέγω ζῷον ἔχω ὁ πούς ·
1111217	tlg4034.tlg003.opp-grc1	πάντας γὰρ ἔχουσιν ἐπὶ τὸ καλούμενον ἔμπροσθεν.	πᾶς γάρ ἔχω ἐπί ὁ καλέω ἔμπροσθεν .
