id	filename	tokens	lemmas
1110372	tlg4034.tlg003.opp-grc1	αὕτη δ’ ἐστὶν ἡ ἁφή, ἁφῆς δὲ αἰσθητήριον ἡ σάρξ) εἰ δὴ τὸ ζῷον μᾶλλον ὥρισται τῇ ἁφῇ, ἁφῆς δὲ αἰσθητήριον ἡ σάρξ, δῆλον ὅτι ἡ σὰρξ καθ’ αὑτὸ το-.	οὗτος   ὁ ἁφή , ἁφή δέ αἰσθητήριον ὁ σάρξ ) εἰ δή ὁ ζῷον μᾶλλον ὁρίζω ὁ ἁφή , ἁφή δέ αἰσθητήριον ὁ σάρξ , δῆλος ὅτι2 ὁ σάρξ κατά ἑαυτοῦ  - .
1110373	tlg4034.tlg003.opp-grc1	̓ς ζῴοις ἐστίν, ὥσπερ καὶ τῇ ὄψει ὁ ὀφθαλμός.	εἰμί , ὥσπερ καί ὁ ὄψις ὁ ὀφθαλμός .
1110374	tlg4034.tlg003.opp-grc1	εἰπὼν δὲ ὅτι τῆς ἁφῆς αἰσθητήριόν ἐστιν ἡ σάρξ, ἐπήγαγεν ἤτοι τὸ πρῶτον, ὥσπερ ἡ κόρη τῆς ὄψεως, ἢ τὸ δι’ οὗ συνειλγͅμaένον.	λέγω δέ ὅτι2 ὁ ἁφή  εἰμί ὁ σάρξ , ἐπάγω ἤτοι ὁ πρῶτος , ὥσπερ ὁ κόρη ὁ ὄψις , ἤ ὁ διά οὗ  .
1110375	tlg4034.tlg003.opp-grc1	ἔσται δὲ τὸ λεγόμενον δῆλον, εἰ προείπομεν ὅτι ὥσπερ ἡ διαφ́νεια τοῦ ἀέρος διαπορθμεύει τὰ χρώματα χωρὶς ὕλης πρὸς τὴν κόρην, ἥτις πρῶτον αἰσθητήριόν ἐστι τῆς ὄψεως, οὕτω καὶ ἡ σὰρξ πρὸς τὸ ἔμφυτον θερμόν, ὅπερ ἐστὶ πρῶτον αἰσθητήριον τῆς ἁφῆς.	δέ ὁ λέγω δῆλος , εἰ προαγορεύω ὅτι2 ὥσπερ ὁ  ὁ ἀήρ  ὁ χρῶμα χωρίς ὕλη πρός ὁ κόρη , ὅστις πρῶτος  εἰμί ὁ ὄψις , οὕτως καί ὁ σάρξ πρός ὁ ἔμφυτος θέρμος , ὅς εἰμί πρῶτος αἰσθητήριον ὁ ἁφή .
1110376	tlg4034.tlg003.opp-grc1	ἀλλ’ ἡ μὲν σὰρξ συμφυὴς οὖσα ἡμῖν δοκεῖ ὅτι αὕτη ἐστὶ τὸ πρῶτον αἰσθη- τήριον, ὁδ’ ἀήρ, μὴ συμφυὴς ὢν τῷ ὀφθαλμῷ ἀλλ’ ἁπτόμενος, διάδηλός ἐστιν ὅτιI οὐκ ἔστι τὸ πρῶτον αἰσθητήριον τῆς ὄψεως·	ἀλλά ὁ μέν σάρξ συμφυής εἰμί ἐγώ δοκέω ὅτι2 οὗτος εἰμί ὁ πρῶτος  -  , ὁ δ’ ἀήρ , μή συμφυής εἰμί τῷ ὀφθαλμός ἀλλά ἅπτω ,  εἰμί ὅτι2 I οὐ εἰμί ὁ πρῶτος  ὁ ὄψις ·
1110377	tlg4034.tlg003.opp-grc1	εἰ δ ἦν τῷ ὀφθαλμῷ συμφυής, ἐδόκει ἂν καὶ οὗτος πρῶτον αἰσθητήριον τῆς ὄψεως.	εἰ  εἰμί τῷ ὀφθαλμός συμφυής , δοκέω ἄν καί οὗτος πρῶτος αἰσθητήριον ὁ ὄψις .
1110378	tlg4034.tlg003.opp-grc1	τούτων οὕτω προλεχθέντων τὸ λεγόμενον εἴη ἄν τοιοῦτον·	οὗτος οὕτως  ὁ λέγω εἰμί ἄν τοιοῦτος ·
1110379	tlg4034.tlg003.opp-grc1	τῆς ἁφῆς αἰσθητήριόν ἐστιν ἡ σάρξ, ἤτοι τὸ πρῶτον, ὥσπερ ἡ κόρη τῆς ὄψεως, ἢ τὸ δι’ οὗ συνειλημμένον, τουτέστιν ἢ τὸ δι’ οὗ αἰσθάνεται, ἤτοι ἢ τὸ διαπορθμευ- τιὶ̣ὸν ὥσπερ ὁ ἀήρ.	ὁ ἁφή  εἰμί ὁ σάρξ , ἤτοι ὁ πρῶτος , ὥσπερ ὁ κόρη ὁ ὄψις , ἤ ὁ διά οὗ συλλαμβάνω ,  ἤ ὁ διά οὗ  , ἤτοι τίη ὁ  -  ὥσπερ ὁ ἀήρ .
1110380	tlg4034.tlg003.opp-grc1	τὸ δὲ σὺ ν ε ιλ γέ μ μ ἑ ν ο ν ἀντὶ τοῦ συμ? υές·	ὁ δέ     γε   ἕ    ἀντί ὁ  ?  ·
1110381	tlg4034.tlg003.opp-grc1	συμφυὴς γάρ ἐστιν ἡμῖν ἡ σάρξ, ἀλλ’ οὐ χωρὶς ὥσπερ ὁ ἀήρ.	συμφυής γάρ εἰμί  ὁ σάρξ , ἀλλά οὐ χωρίς ὥσπερ ὁ ἀήρ .
1110382	tlg4034.tlg003.opp-grc1	ἀλλὰ διὰ τί, ὥσπερ ἐπὶ τῆς ἁφῆς τὸ αἰσθητήριον, δι’ οὗ τὸ πρῶτον αἰσθητήριον τὰ ἁπτὰ δέχεται, σάρξ ἐστιν, οὐ καὶ τὸ τῆς ὄψεως καὶ τὸ τῆς ἀκοῆς σὰρξ ἦν, ἀλλὰ τῆς μὲν ἡ διαφάνεια τοῦ ἀέρος, τῆς δὲ ἀκοῆς ὁμοίως τὸ διηχὲς τοῦ αὐτοῦ ἀέρος;	ἀλλά διά τι , ὥσπερ ἐπί ὁ ἁφή ὁ αἰσθητήριον , διά οὗ ὁ πρῶτος αἰσθητήριον ὁ  δέχομαι , σάρξ εἰμί , οὐ καί ὁ ὁ ὄψις καί ὁ ὁ ἀκοή  εἰμί , ἀλλά ὁ μέν ὁ διαφάνεια ὁ ἀήρ , ὁ δέ ἀκοή ὅμοιος ὁ  ὁ αὐτός ἀήρ ;
1110383	tlg4034.tlg003.opp-grc1	ἢ ἐπὶ μὲν τῶν δύο τούτων, φησίν, αἰσθήσεων ἀδύνατον ἦν σάρκινον γενέ- σθαι τὸ αἰσθητήριον τὸ ἀναλογοῦν τῇ σαρκί, καὶ οὐδὲν ἂν ἦν προὔργου οὐδ’ ὠφέλιμον.	τίη ἐπί μέν ὁ γε οὗτος , φημί , αἴσθησις ἀδύνατος εἰμί σάρκινος  -  ὁ αἰσθητήριον ὁ  ὁ σάρξ , καί  ἀνά εἰμί  οὐδέ ὠφέλιμος .
1110384	tlg4034.tlg003.opp-grc1	πολλῶν γὰρ οὖσα ἀντιληπτικὴ ἡ ἁφή, σκληρῶν μαλακῶν, ψυχρῶν θερμῶν, τραχέων λείων καὶ ἄλλων πολλῶν, εὐλόγως καὶ τὸ αἰσθη- τήριον αὐτῆς συνέστησεν ἡ φύσις ἐκ πολλῶν·	πολύς γάρ εἰμί  ὁ ἁφή , σκληρός  , ψυχρός θερμός , τραχύς  καί ἄλλος πολύς , εὔλογος καί ὁ  -  αὐτός συνίστημι ὁ φύσις ἐκ πολύς ·
1110385	tlg4034.tlg003.opp-grc1	ἡ δὲ ὄψις ἑνὸς οὖσα γένους( χρώματος γάρ) καὶ ἡ ἀκοὴ ψόφων ἁπλοῦν καὶ τὸ ἀναλογοῦν τῇ σαρκὶ αἰσθητήριον ἀπειργάσατο.	ὁ δέ ὄψις  εἰμί γένος ( χρῶμα γάρ ) καί ὁ ἀκοή ψόφος ἁπλόω καί ὁ  ὁ σάρξ αἰσθητήριον ἀπεργάζομαι .
1110386	tlg4034.tlg003.opp-grc1	σωματῶδες οὖν εἴρηκε τὴν σάρκα αἰσθηθήριον 15 ἀντὶ τοῦ σύνθετον καὶ ἐκ πλειόνων συγκείμενον.	οὖν λέγω ὁ σάρξ   ἀντί ὁ σύνθετος καί ἐκ   .
1110387	tlg4034.tlg003.opp-grc1	ἀλλὰ κατὰ μὲν τὸν λόγον οὕτω δῆλον ὅτι ἡ σὰρξ πρῶτόν ἐστι καὶ ἀρχή κατὰ δὲ τὴν αἴσθησιν οὕτως, ἐπειδὴ τἆλλα πάντα, οἷον νεῦρα σάρκες τρίχες, λοιπὰ δι’ αὐτήν εἰσιν, οὗ δὲ ἕνεκα τὰ λοιπά ἐστι, τοῦτο πρῶτον ἐκείνων ἐστὶ τῇ φύσει.	ἀλλά κατά μέν ὁ λόγος οὕτως δῆλος ὅτι2 ὁ   εἰμί καί ἀρχή κατά δέ ὁ αἴσθησις οὕτως , ἐπεί ἄλλος πᾶς , οἷος νεῦρον σάρξ θρίξ , λοιπός διά αὐτός εἰμί , οὗ δέ ἕνεκα ὁ λοιπός εἰμί , οὗτος πρῶτος ἐκεῖνος εἰμί ὁ φύσις .
1110388	tlg4034.tlg003.opp-grc1	σαφῆ δὲ τὰ λοιπά.	σαφής δέ ὁ λοιπός .
1110389	tlg4034.tlg003.opp-grc1	τόδε ἡ δὲ χελώνη καὶ τὸ τῶν ἑμύδων γένος ὁμοίως ἔχειν δοκεῖ τούτοις εἴρηται ἀντὶ τοῦ ὁμοίως τοῖς λεχθεῖσιν ἔχει τὸ μὲν σαρκῶδες ἐντός, τὸ δὲ συνέχον καὶ φυλάττον ἐκτός.	ὅδε ὁ δέ χελώνη καί ὁ ὁ  γένος ὅμοιος ἔχω δοκέω οὗτος λέγω ἀντί ὁ ὅμοιος ὁ λέγω ἔχω ὁ μέν σαρκώδης ἐντός , ὁ δέ συνόχωκα καί φυλάσσω ἐκτός .
1110390	tlg4034.tlg003.opp-grc1	τὰ δ’ ἔντομα καὶ τά μαλάκια ἐναντίως ἔχει καὶ ἑαυτοῖς καὶ τοῖς ἔχουσιν ἐκτὸς τὴν βοήθειαν.	ὁ  ἔντομος καί ὁ  ἐναντίος ἔχω καί ἑαυτοῦ καί ὁ ἔχω ἐκτός ὁ βοήθεια .
1110391	tlg4034.tlg003.opp-grc1	αὐτίκα ἡ μὲν σηπία ἔχει ἐν τῶ κύτει, ὃ καλεῖται κεφαλή, τὸ σηπίον, ὁ δὲ πολύπους τοῦτο οὐκ ἔχει.	αὐτίκα ὁ μέν σηπία ἔχω ἐν  κύτος , ὅς καλέω κεφαλή , ὁ  , ὁ δέ πολύπους2 οὗτος οὐ ἔχω .
1110392	tlg4034.tlg003.opp-grc1	ἡ δὲ αἰτία, ὅτι τὸ μὲν τῆς σηπίας εὐμῆκες ὂν εἰ μὴ εἶχε τὸ σηπίον, ἵν’ ὀρθοῖ αὑτὸ καὶ ὄρθιον ἵστασθαι παρασκευάζῃ, ἐκινεῖτο ἂν ὧδε κἀκεῖσε ὥσπερ αἱ κατεψυγμέναι χεῖρες, τὸ δὲ τοῦ πολύποδος διὰ τὸ βραχύτατον εἶναι καὶ χωρίς τινος στερεωτέρου δύναται ἀνορθοῦσθαι.	ὁ δέ αἰτία , ὅτι2 ὁ μέν ὁ σηπία  εἰμί εἰ μή ἔχω ὁ  ,  ὀρθόω ἑαυτοῦ καί ὄρθιος  παρασκευάζω , κινέω ἐάν ὧδε ἐκεῖσε ὥσπερ ὁ  χείρ , ὁ δέ ὁ  διά ὁ βραχύς εἰμί καί χωρίς   δύναμαι ἀνορθόω .
1110393	tlg4034.tlg003.opp-grc1	Ἔχει δ ' ὁμοίως ἥ τε τῶν ὀστῶν καὶ τῶν φλεβῶν φύσις.	ἔχω   ὅμοιος  τε ὁ  καί ὁ  φύσις .
1110394	tlg4034.tlg003.opp-grc1	Ὥσπερ γὰρ αἱ φλέβες ἀπὸ μιᾶς εἰσιν ἀρχῆς τῆς καρδίας, οὕτως καὶ τὰ ὀστᾶ ἐκ τῆς ῥάχεως.	ὥσπερ γάρ ὁ φλέψ ἀπό  εἰμί ἀρχή ὁ καρδία , οὕτως καί ὁ ὀστέον ἐκ ὁ ῥάχις .
1110395	tlg4034.tlg003.opp-grc1	καὶ διὰ τοῦτο οὐδέν ἐστιν ὀστοῦν αὐτὸ καθ’ αὑτὸ ἀποκεκριμένον, ἀλλὰ πᾶν συνεχές ἐστι πρὸς ἄλλο ἢ ἁπτόμενον, κἀκεῖνο πρὸς ἄλλο·	καί διά οὗτος  εἰμί  αὐτός κατά ἑαυτοῦ ἀποκρίνω , ἀλλά πᾶς συνεχής εἰμί πρός ἄλλος τίη ἅπτω ,  πρός ἄλλος ·
1110396	tlg4034.tlg003.opp-grc1	ἅπαντα δὲ τελευτῶσιν εἰς τὴν ῥάχιν.	ἅπας δέ  εἰς ὁ ῥάχις .
1110397	tlg4034.tlg003.opp-grc1	εἴτε δὲ ὀστοῦν ἦν τι καθ’ αὑτὸ εἴτε φλέψ, μάτην ἂν ἦν ἑκάτερον τούτων.	εἴτε δέ  εἰμί τις κατά ἑαυτοῦ εἴτε  , μάτην ἐάν εἰμί ἑκάτερος οὗτος .
1110398	tlg4034.tlg003.opp-grc1	ἡ γὰρ φλὲψ εἰ μὴ συνεχὴς ἦν τὴν ἀρχήν, οὐκ ἂν ἐσώζετο αἷμα ἐν αὐτῇ·	ὁ γάρ  εἰ μή συνεχής εἰμί ὁ ἀρχή , οὐ ἄν σῴζω αἷμα ἐν αὐτός ·
1110399	tlg4034.tlg003.opp-grc1	ἀλλὰ πᾶσα φλὲψ γέγονε διὰ τὸ σώζεσθαι ἐν αὐτῇ αἷμα.	ἀλλά πᾶς φλέψ γίγνομαι διά ὁ σῴζω ἐν αὐτός αἷμα .
1110400	tlg4034.tlg003.opp-grc1	καὶ πῶς οὐκ ἂν ἐσώζετο ἐν αὐτῇ αἷμα ἐπήγαγεν εἰπὼν ἡ γὰρ ἀπ’ ἐκείνης θερμότης κωλύει πήγνυσθαι, ἡ ἀπὸ τῆς καρδίας, ἥτις καρδία ἀρχὴ τῶν φλεβῶν ἐστιν·	καί πῶς οὐ ἄν σῴζω ἐν αὐτός αἷμα ἐπάγω λέγω ὁ γάρ ἀπό ἐκεῖνος  κωλύω πήγνυμι , ὁ ἀπό ὁ καρδία , ὅστις καρδία ἀρχή ὁ φλέψ εἰμί ·
1110401	tlg4034.tlg003.opp-grc1	ἡ οὖν θερμότης αὕτη κωλύει πήγνυσθαι τὸ ἐν ταῖς φλεψὶν ἐνὸν αἷμα.	ὁ οὖν θερμότης οὗτος κωλύω πήγνυμι ὁ ἐν ὁ φλέψ  αἷμα .
1110402	tlg4034.tlg003.opp-grc1	εἰ δὲ ἦν τις φλὲψ χωρὶς καθ’ ἑαυτήν, πῶς ἄν πρὸς αὐτὴν διεπέμπετο τὸ ἐκ τῆς καρδίας θερμόν;	εἰ δέ εἰμί τις  χωρίς κατά ἑαυτοῦ , πῶς ἄν πρός αὐτός διαπέμπω ὁ ἐκ ὁ καρδία θέρμος ;
1110403	tlg4034.tlg003.opp-grc1	τοῦτό τε εἰπὼν καὶ ὅτι πολυμερὴς τῇ διαιρέσει τῶν σπονδύλων ἐστὶν ἡ ῥάχις, ἐπήγαγεν ἐκ δὲ ταύτης τοῖς ἔχουσι κῶλα συνεχῆ πρὸς αὐτὴν τὰ τούτων ὀστᾶ τῶν ἁρμονιῶν ἐστιν.	τε λέγω καί ὅτι2  ὁ διαίρεσις ὁ  εἰμί ὁ ῥάχις , ἐπάγω ἐκ δέ οὗτος ὁ ἔχω κῶλον συνεχής πρός αὐτός ὁ οὗτος ὀστέον ὁ  εἰμί .
1110404	tlg4034.tlg003.opp-grc1	κῶλα δὲ κυρίως εἰσὶν αἵ τε χεῖρες καὶ οἱ πόδες.	κῶλον δέ κύριος εἰμί ὁ τε χείρ καί ὁ πούς .
1110405	tlg4034.tlg003.opp-grc1	τὸ δὲ λεγόμενον εἴη ἂν τοιοῦτον·	ὁ δέ λέγω εἰμί ἄν τοιοῦτος ·
1110406	tlg4034.tlg003.opp-grc1	τοῖς ζῴοις ὅσοις συμβέβηκεν ἔχειν κῶλα, τούτων τῶν ζῴων τὰ ὀστᾶ ἐκ τῶν ἁρμονιῶν τῆς ῥάχεως ἐστι συνεχῆ πρὸς αὐτήν·	ὁ  ὅσος συμβαίνω ἔχω κῶλον , οὗτος ὁ ζῷον ὁ ὀστέον ἐκ ὁ ἁρμονία ὁ ῥάχις εἰμί συνεχής πρός αὐτός ·
1110407	tlg4034.tlg003.opp-grc1	αἱ γὰρ τῆς ῥάχεως ἁρμονίαι συνεχίζουσι πρὸς αὐτὴν τὰ κῶλα τῶν ζῴων.	ὁ γάρ ὁ ῥάχις ἁρμονία  πρός αὐτός ὁ κῶλον ὁ ζῷον .
1110408	tlg4034.tlg003.opp-grc1	τῶν δὲ ὀστῶν, φησί, τὰ μέν εἰσι χάριν τῆς σαρκός τὰ δ’ ἕνεκα φυλακῆς, ὥσπερ αἱ συγκλείουσι πλευραὶ τὸ στῆθος·	ὁ δέ  , φημί , ὁ μέν εἰμί χάριν ὁ σάρξ ὁ  ἕνεκα φυλακή , ὥσπερ ὁ συγκλείω πλευρά ὁ στῆθος ·
1110409	tlg4034.tlg003.opp-grc1	χάριν γὰρ σωτηρίας αὗται τυγχάνουσι τῶν περὶ τὴν καρδίαν σπλάγχνων.	χάρις γάρ σωτηρία οὗτος τυγχάνω ὁ περί ὁ καρδία σπλάγχνον .
1110410	tlg4034.tlg003.opp-grc1	ἀλλὰ τὸ μὲν στέρνον ἅπαν ὀστοῖς περικλείεταί τε καὶ συνέχεται, τὸ δὲ μετὰ τὸ στῆθος ἄχρι τοῦ ἤτρου, ἐν ᾧ ἡ κοιλία καὶ τὰ ἔντερα κεῖται κάτωθεν τοῦ ὑποζώματος, τὸ δὴ μετὰ τὸ στῆθος ἄχρι τοῦ ἤτρου ἀνόστεον ἐστιν.	ἀλλά ὁ μέν στέρνον ἅπας   τε καί συνέχω , ὁ δέ μετά ὁ στῆθος ἄχρι ὁ  , ἐν ὅς ὁ κοιλία καί ὁ ἔντερον κεῖμαι κάτωθεν ὁ  , ὁ δή μετά ὁ στῆθος ἄχρι ὁ   εἰμί .
1110411	tlg4034.tlg003.opp-grc1	εἰ γὰρ ἦν ὀστῶδες, ἐπειδὴ τρωγόντων τῶν ζῴων ὀγκοῦται ἡ κοία ὑπὸ τῶν βρωμάτων, καὶ τῶν θηλειῶν ὑπό τε τούτων καὶ τῶν ἐμβρύων, ἐπειδὰν ὠδίνωσιν, ἐκωλύετ’ ἂν ἡ τῆς κοιλίας ἀνοίδησις καὶ ἐξόγκωσις·	εἰ γάρ εἰμί  , ἐπεί  ὁ ζῷον ὀγκόω ὁ ποῖος ὑπό ὁ βρῶμα , καί ὁ  ὑπό τε οὗτος καί ὁ ἔμβρυον , ἐπεί  ,  ἄν ὁ ὁ κοιλία  καί  ·
1110412	tlg4034.tlg003.opp-grc1	ὥστε συνέβαινεν ἐκ τούτου μήτε τὰ ἔμβρυα αὔξεσθαι καὶ ὀδύνας ἐγγίνεσθαι διὰ τὴν ἐκ τῶν βρωμάτων στενοχωρίαν.	ὥστε συμβαίνω ἐκ οὗτος  ὁ ἔμβρυον αὐξάνω καί ὀδύνη ἐγγίγνομαι διά ὁ ἐκ ὁ βρῶμα στενοχωρία .
1110413	tlg4034.tlg003.opp-grc1	Μετὰ ταῦτα λέγει ὅτι τοῖς ὄφεσιν ἀκανθώδης ἐστὶν ἡ τῶν ὀστῶν φύσις, πλὴν τοῖς λίαν μεγάλοις.	μετά οὗτος λέγω ὅτι2 ὁ   εἰμί ὁ ὁ  φύσις , πλήν ὁ λίαν μέγας .
1110414	tlg4034.tlg003.opp-grc1	πλὴν τῶν λίαν μεγάλων ὄφεων ὀστώδης ἡ τοιαύτη φύσις·	πλήν ὁ λίαν μέγας   ὁ τοιοῦτος φύσις ·
1110415	tlg4034.tlg003.opp-grc1	πρὸς γὰρ τὴν ἰσχὺν ἰσχυροτέρων δεῖται τῶν στερεωμάτων.	πρός γάρ ὁ ἰσχύς  δέω ὁ  .
1110416	tlg4034.tlg003.opp-grc1	τὰ δὲ καλούμενα σελάχη τὰς ἀκάνθας ἔχει οἷον χόνδρους·	ὁ δέ καλέω  ὁ ἄκανθα ἔχω οἷος  ·
1110417	tlg4034.tlg003.opp-grc1	χόνδρος δ’ ἐστὶ σαρκὸς μὲν σκληρότερος, ὀστοῦ δὲ μαλακώτερος.	εἰμί σάρξ μέν  ,  δέ μαλακός .
1110418	tlg4034.tlg003.opp-grc1	ἔχουσι δὲ τὰς ἀκάνθας χονδρώδεις, ἐπειδὴ πλατέα ὄντα οἷον θυρεοί, ἀνάγκη τὴν κίνησιν αὐτῶν ὑγροτέραν εἶναι·	ἔχω δέ ὁ ἄκανθα  , ἐπεί πλατύς εἰμί οἷος  , ἀνάγκη ὁ κίνησις αὐτός ὑγρός εἰμί ·
1110419	tlg4034.tlg003.opp-grc1	ὑγροτέρα δὲ ἡ κίνησις λέγεται λυγιζομένων καὶ καμπτομένων, ὥσπερ λύγος ἢ κάλαμος, τῶν χόνδρων, δι’ ὧν κινοῦνται.	ὑγρός δέ ὁ κίνησις λέγω  καί  , ὥσπερ  ἤ κάλαμος , ὁ  , διά ὅς κινέω .
1110420	tlg4034.tlg003.opp-grc1	τὰ γὰρ σελάχη τὴν κίνησιν ποιεῖται διπλούμενα·	ὁ γάρ  ὁ κίνησις ποιέω  ·
1110421	tlg4034.tlg003.opp-grc1	ἀπερειδόμενα γὰρ τῇ περιφερείᾳ τοῦ σώματος αὐτῶν καὶ κυρτούμενα οὕτω κινεῖται·	γάρ ὁ περιφέρεια ὁ σῶμα αὐτός καί  οὕτως κινέω ·
1110422	tlg4034.tlg003.opp-grc1	εἰ δὲ ἦσαν κραῦροι αἱ ἄκανθαι, οὐκ ἂν ἡδύναντο διπλοῦσθαι καὶ κάμπτεσθαι ἢ ὅλως κυρτοῦσθαι.	εἰ δέ εἰμί  ὁ  , οὐ ἄν   καί κάμπτω ἤ ὅλος κυρτόω .
1110423	tlg4034.tlg003.opp-grc1	ἄλλως τε καὶ τὸ γεῶδες πᾶν εἰς τὸ δέρμα καταναλώσασα ἡ φύσις( σκληρόδερμα γὰρ τὰ σελάχη) οὐκ ἠδυνήθη χορηγῆσαι καὶ ταῖς ἀκάνθαις ἐκ τοῦ γεώδους καὶ σκληροῦ.	ἄλλος τε καί ὁ γεώδης πᾶς εἰς ὁ δέρμα  ὁ φύσις (  γάρ ὁ  ) οὐ δύναμαι χορηγέω καί ὁ ἄκανθα ἐκ ὁ  καί σκληρός .
1110424	tlg4034.tlg003.opp-grc1	εἰσὶ δέ, φησί, καὶ ἐν τοῖς ζῳοτόκοις χονδρώδη τινὰ τὴν φύσιν, οἷον ῥῖνες καὶ ὦτα, εὐλόγως δέ·	εἰμί δέ , φημί , καί ἐν ὁ    ὁ φύσις , οἷος ῥίς καί οὖς , εὔλογος δέ ·
1110425	tlg4034.tlg003.opp-grc1	εἰ γὰρ μὴ τοιαῦτα ἦσαν ἀλλὰ κραῦρα, ἐπειδὴ ὑπερανεστηκότα εἰσὶ καὶ δυνάμενα μᾶλλον τῶν ἄλλων μορίων προσπταίειν, ἐθραύοντο ἄν.	εἰ γάρ μή τοιοῦτος εἰμί ἀλλά  , ἐπεί  εἰμί καί  μᾶλλον ὁ ἄλλος  προσπταίω , θραύω ἄν .
1110426	tlg4034.tlg003.opp-grc1	Ot μὲν οὖν τοῖς πεζοῖς ἀμύελοι χόνδροι κεχωρισμένῳ μυελῷ.	μέν οὖν ὁ   χόνδρος χωρίζω μυελός .
1110427	tlg4034.tlg003.opp-grc1	Τὸ ἑξῆς οὕτως ῾οἱ μὲν οὖν τοῖς πεζοῖς χόνδροι ἀμύελοι κεχωρισμένῳ μυελῷ’.	ἑξῆς οὕτως  μέν οὖν ὁ πεζός χόνδρος  χωρίζω μυελός ’ .
1110428	tlg4034.tlg003.opp-grc1	τὸ δὲ λεγόμενον κατασκευαστικόν ἐστι τοῦ διὰ τί οἱ τῶν πεζῶν ζῴων χόνδροι σκληρότεροί εἰσι τῶν ἐν τοῖς σελάχεσι χόνδρων.	ὁ δέ λέγω  εἰμί ὁ διά τι ὁ ὁ πεζός ζῷον χόνδρος  εἰμί ὁ ἐν ὁ   .
1110429	tlg4034.tlg003.opp-grc1	λέγει οὖν ὅτι ἐν τοῖς πεζοῖς ζῴοις χόνδροι κεχωρισμένους ἔχουσι τοὺς ἐν αὐτοῖς μυελοὺς καὶ καθ’ αὑτούς, ὥσπερ καὶ τὰ ὀστᾶ, καὶ διὰ τοῦτό εἰσι σκληροί, ἐν δὲ τοῖς σελάχεσιν ὁ μυελὸς ἀνακεκραμένος ὢν μετὰ τῶν χόνδρων καὶ οἷον ἀνεζυμωμένος μαλακωτέραν ἀπεργάζεται τὴν φύσιν αὐτῶν, ὥσπερ ἔλαιον πίσσῃ μιχθέν·	λέγω οὖν ὅτι2 ἐν ὁ πεζός ζῷον χόνδρος χωρίζω ἔχω ὁ ἐν αὐτός  καί κατά ἑαυτοῦ , ὥσπερ καί ὁ ὀστέον , καί διά  εἰμί σκληρός , ἐν δέ ὁ  ὁ μυελός  εἰμί μετά ὁ  καί οἷος  μαλακός ἀπεργάζομαι ὁ φύσις αὐτός , ὥσπερ ἔλαιον  μείγνυμι ·
1110430	tlg4034.tlg003.opp-grc1	καὶ γὰρ καὶ τοῦτο μαλακωτέραν τὴν πίσσαν ἀποτελεῖ 25 μιχθὲν μετ’ αὐτῆς.	καί γάρ καί οὗτος μαλακός ὁ πίσσα ἀποτελέω  μείγνυμι μετά αὐτός .
1110431	tlg4034.tlg003.opp-grc1	εἰπὼν δὲ ἀμυέλους τοὺς ἐν τοῖς πεζοῖς χόνδρους, καί- τοι ἔχοντας μυελόν, σαφηνίζων ὅπως εἶπεν αὐτοὺς ἀμυέλους, ἐπήγαγε τὸ κεχωρισμένῳ μυελῷ, ὡς ἄν εἰ ἔλεγε’ μὴ γὰρ πάμπαν ἀμύελοι τυρχάνουσιν·	λέγω δέ  ὁ ἐν ὁ πεζός  , καί - τοι ἔχω μυελός ,  ὅπως λέγω αὐτός  , ἐπάγω ὁ  μυελός , ὡς ἄν εἰ λέγω ’ μή γάρ πάμπαν   ·
1110432	tlg4034.tlg003.opp-grc1	νοῦσιν·	·
1110433	tlg4034.tlg003.opp-grc1	ἔνεστι γὰρ αὐτοῖς μυελός·	ἔνειμι γάρ αὐτός μυελός ·
1110434	tlg4034.tlg003.opp-grc1	ἀλλ’ ἐπειδὴ κεχωρισμένος ἐστὶ καὶ καθ’ ἑαυτόν, ὥσπερ καὶ ὁ οἶνος ἐν τῷ ἀμφορεῖ, καὶ οὐκ ἀναμεμιγμένος οὐδ’ ἀνακεκραμένος μετ’ αὐτῶν, τρόπον τινὰ ἀμύελόν ἐστιν’.	ἀλλά ἐπεί χωρίζω εἰμί καί κατά ἑαυτοῦ , ὥσπερ καί ὁ οἶνος ἐν ὁ  , καί οὐ ἀναμείγνυμι οὐδέ  μετά αὐτός , τρόπος   εἰμί ’ .
1110435	tlg4034.tlg003.opp-grc1	ἰστέον οὗν ὅτι τὸ χωριζόμενον καὶ καθ’ αὑτὸ εἶναι δυνάμενον ὥσπερ ὁ μυελὸς μαλακὴν εἰς ἅπαν ποιεῖ τοῦ χόνδρου τὴν σύστασιν καὶ ζυμώδη μιχθεὶς μετ’ αὐτοῦ.	οἶδα  ὅτι2 ὁ χωρίζω καί κατά ἑαυτοῦ εἰμί  ὥσπερ ὁ μυελός  εἰς ἅπας ποιέω ὁ χόνδρος ὁ σύστασις καί  μείγνυμι μετά αὐτός .
