id	filename	tokens	lemmas
763351	tlg4015.tlg001.opp-grc1	p.	.
763352	tlg4015.tlg001.opp-grc1	10.	.
763353	tlg4015.tlg001.opp-grc1	112 ἔτι δὲ πρὸς τούτοις εὐθύτης καὶ καμπυλότης, καὶ εἴ τι τούτοις ὅμοιον ἐστι.	ἔτι δέ πρός οὗτος  καί  , καί εἰ τι οὗτος ὅμοιος εἰμί .
763354	tlg4015.tlg001.opp-grc1	Ἀπὸ γὰρ εὐθύτητος παρωνύμως εὐθεῖα γραμμὴ λέγεται, ἀπὸ δὲ τῆς καμπυλότητος ἡ καμπύλη, καὶ ἔστι πάθη τῆς γραμμῆς ἡ εὐθύτης καὶ ἡ καμπυλότης·	ἀπό γάρ εὐθύτης παρώνυμος εὐθύς γραμμή λέγω , ἀπό δέ ὁ  ὁ  , καί εἰμί πάθος ὁ γραμμή ὁ  καί ὁ καμπυλότης ·
763355	tlg4015.tlg001.opp-grc1	ἰστέον γὰρ ὅτι τεσσάρων τούτων ὄντων ἐφεξῆς ἀλλήλοις, τοῦ τε | σημείου καὶ τῆς γραμμῆς καὶ τῆς ἐπιφανείς καὶ τοῦ σώματος, τὸ μὲν σημεῖον ἅτε ἀμερὲς ὂν οὔτε πάθος ἀνεδέξατο οὔτε σχῆμα, πολλῷ δὲ πλέον οὐδὲ μορφήν, ἡ δὲ γραμμὴ μίαν ἔχουσα διάστασιν πάθος μόνον ἀνεδέξατο ἡ γὰρ καμπύλη ἐστὶν ἢ εὐθεῖα ἢ εἴ τις ἄλλη λέγεται), ἡ δὲ ἐπιφάνεια δύο διαστάσεις ἔχουσα, τήν τε κατὰ μῆκος λέγω καὶ πλάτος, καὶ πάθος ἀνεδέξατο καὶ σχῆμα.	οἶδα γάρ ὅτι2  οὗτος εἰμί ἐφεξῆς ἀλλήλων , ὁ τε  σημεῖον καί ὁ γραμμή καί ὁ ἐπιφαίνω καί ὁ σῶμα , ὁ μέν σημεῖον ἅτε ἀμερής εἰμί οὔτε πάθος ἀναδέχομαι οὔτε σχῆμα , πολύς δέ πλέως οὐδέ μορφή , ὁ δέ γραμμή  ἔχω διάστασις πάθος μόνος ἀναδέχομαι ὁ γάρ   τίη εὐθύς ἤ εἰ τις ἄλλος λέγω ) , ὁ δέ ἐπιφάνεια γε διάστασις ἔχω , ὁ τε κατά μῆκος λέγω καί πλάτος , καί πάθος ἀναδέχομαι καί σχῆμα .
763356	tlg4015.tlg001.opp-grc1	πάθη μὲν οὖν ἐστι τῆς ἐπιφανείας τὸ στενόν τε καὶ τὸ πλατή, σχήματα δὲ τρίγωνον ἢ τετράγωνον καὶ ὅσα τοιαῦτα·	πάθος μέν οὖν εἰμί ὁ ἐπιφάνεια ὁ στενός τε καί ὁ  , σχῆμα δέ τρίγωνος τίη τετράγωνος καί ὅσος τοιοῦτος ·
763357	tlg4015.tlg001.opp-grc1	διότι γὰρ πᾶσα ἐπιφάνεια ὑπὸ γραμμῶν περιέχεται ἐπιφανείας γάρ, φησὶν Εὐκλείδης, πέρατα γραμμαί), διὰ τοῦτο εἰκότως καὶ σχήματα ἀνεδέξατο·	διότι γάρ πᾶς ἐπιφάνεια ὑπό γραμμή περιέχω ἐπιφάνεια γάρ , φημί Εὐκλείδης , πέρατος  ) , διά οὗτος εἰκός καί σχῆμα ἀναδέχομαι ·
763358	tlg4015.tlg001.opp-grc1	τὰ γὰρ σχήματα ἐκ γραμμῶν σύγκειται.	ὁ γάρ σχῆμα ἐκ γραμμή σύγκειμαι .
763359	tlg4015.tlg001.opp-grc1	τὸ μέντοι σῶμα τὰς τρεῖς ἔχον διαστάσεις, τήν τε κατὰ μῆκος καὶ βάθος καὶ πλάτος, καὶ πάθη ἀνεδέξατο καὶ σχήματα καὶ μορφάς·	ὁ  σῶμα ὁ  ἔχω διάστασις , ὁ τε κατά μῆκος καί βάθος καί πλάτος , καί πάθος ἀναδέχομαι καί σχῆμα καί μορφή ·
763360	tlg4015.tlg001.opp-grc1	πάθη μὲν τὸ παχύ τε καὶ λεπτόν, αχήματα δὲ διότι ἢ κυβικόν ἐστιν ἢ κυλινδρικὸν ἤ τι τοιοῦτον.	πάθος μέν ὁ παχύς τε καί λεπτός ,  δέ διότι τίη κυβικός εἰμί τίη  ἤ τι  .
763361	tlg4015.tlg001.opp-grc1	ἀλλὰ δὴ καὶ μορφὴν ἐπιδέχεται τὸ ἔμψυχον σῶμα.	ἀλλά δή καί μορφή ἐπιδέχομαι ὁ ἔμψυχος σῶμα .
763362	tlg4015.tlg001.opp-grc1	p.	.
763363	tlg4015.tlg001.opp-grc1	10a16 ὸ δὲ μανὸν καὶ τὸ πυκνὸν καὶ τὸ τραχὺ καὶ τὸ λεῖον δόξειε μὲν ἂν ποιόν τι σημαίνειν, ἔοικε δὲ ἀλλότρια τὰ τοιαῦτα εἶναι τῆς περὶ τὸ ποιὸν διαιρέσεως·	δέ μανός καί ὁ πυκνός καί ὁ τραχύς καί ὁ  δοκέω μέν ἄν ποιός τις σημαίνω , ἔοικα δέ ἀλλότριος ὁ τοιοῦτος εἰμί ὁ περί ὁ  διαίρεσις ·
763364	tlg4015.tlg001.opp-grc1	θέσιν γάρ τινα μᾶλλον φαί- νεται τῶν μορίων ἑκάτερον δηλοῦν.	θέσις γάρ τις μᾶλλον  -  ὁ μόριος  δηλόω .
763365	tlg4015.tlg001.opp-grc1	| Διότι γὰρ διάκειταί πὼς κατὰ τὴν μάνωσιν ἢ τὴν πύκνωσιν καὶ τὴν τραχύτητα καὶ τὴν λειότητα καὶ ἀπ’ αὐτῶν ὀνομάζεται τὰ μετέχοντα, δόξαν τινὰ ἔχουσι ποιοτήτων, οὐκ ἀληθὲς δὲ τοῦτο, ὑπὸ τὸ κεῖσθαι δὲ μᾶλλον ἀναχθήσεται·	γάρ   κατά ὁ  τίη ὁ πύκνωσις καί ὁ τραχύτης καί ὁ λειότης καί ἀπό αὐτός ὀνομάζω ὁ μετέχω , δόξα  ἔχω  , οὐ ἀληθής δέ οὗτος , ὑπό ὁ κεῖμαι δέ μᾶλλον  ·
763366	tlg4015.tlg001.opp-grc1	θέσιν γάρ τινα σημαίνουσι·	θέσις γάρ τις σημαίνω ·
763367	tlg4015.tlg001.opp-grc1	πυκνὸν γάρ ἐστιν οὗ τὰ μόρια σύνεγγυς κεῖται ὡς μὴ δύνασθαι δέξασθαι ἑτερογενὲς σῶμα, μανὸν δὲ τὸ διεστηκότα ἔχον τὰ μόρια ὡς δύνασθαι δέξασθαι ἑτερογενὲς σῶμα.	πυκνός γάρ εἰμί οὗ ὁ μόριον σύνεγγυς κεῖμαι ὡς μή δύναμαι δέχομαι  σῶμα , μανός δέ ὁ διΐστημι ἔχω ὁ μόριος ὡς δύναμαι δέχομαι  σῶμα .
763368	tlg4015.tlg001.opp-grc1	πάλιν λεῖον λέγομεν τὸ ἴσα ἀλλήλοις ἔχον τὰ μόρια καὶ ἴσως ἐξέχοντα, τραχὺ δὲ τὸ ἄνισα ἀλλήλοις κατὰ τὰς ἐξοχὰς ἔχον τὰ μόρια, οἷον λεῖον μὲν τὸ μῆλον ὁμαλὴ γὰρ τούτου ἐστὶν ἡ ἐπιφάνεια), τραχὺ δὲ τὸ πρόσωπον, διότι ἐξ ἀνωμάλων καὶ ἀνίσων σύγκειται μορίων, στόματος καὶ ῥινὸς καὶ ὀφθαλμῶν καὶ τῶν λοιπῶν τῶν μὲν προπετῆ ἐχόντων τὴν θέσιν τῶν’ δει κοίλην·	πάλιν λεῖος λέγω ὁ ἴσος ἀλλήλων ἔχω ὁ μόριον καί ἴσος ἐξέχω , τραχύς δέ ὁ  ἀλλήλων κατά ὁ ἐξοχή ἔχω ὁ μόριον , οἷος λεῖος μέν ὁ μῆλον ὁμαλός γάρ οὗτος εἰμί ὁ ἐπιφάνεια ) , τραχύς δέ ὁ πρόσωπον , διότι ἐκ  καί  σύγκειμαι μόριος , στόμα καί  καί ὀφθαλμός καί ὁ λοιπός ὁ μέν  ἔχω ὁ θέσις ὁ ’   ·
763369	tlg4015.tlg001.opp-grc1	οὐκοῦν θέσιν τινὰ μᾶλλον φαίνεται τὰ μόρια αὐτῶν δηλοῦντα.	οὐκοῦν θέσις  μᾶλλον φαίνω ὁ μόριον αὐτός δηλόω .
763370	tlg4015.tlg001.opp-grc1	καὶ τὸ μὲν τραχὺ καὶ τὸ λεῖον ὁμολογουμένως ὑπὸ τὸ κεῖσθαι ἀνάγονται διὰ τὰς εἰρημένας αἰτίας, μανὸν δὲ καὶ πυκνὸν ἐνταῦθα μόνον ἔλαβε τὸ ἐξ ἐπιτεχνήσεως·	καί ὁ μέν τραχύς καί ὁ  ὁμολογέω ὑπό ὁ κεῖμαι ἀνάγω διά ὁ λέγω αἰτία ,  δέ καί πυκνός ἐνταῦθα μόνος λαμβάνω ὁ ἐκ ἐπιτέχνησις ·
763371	tlg4015.tlg001.opp-grc1	τοῦτο γάρ ἐστι τὸ ὑπὸ τὸ κεῖσθαι ἀναγόμενον, οἷον εἴ τις τὸν ἱμάντα ἐκτείνας μανὸν ποιήσει·	οὗτος γάρ εἰμί ὁ ὑπό ὁ κεῖμαι ἀνάγω , οἷος εἰ τις ὁ ἱμάς ἐκτείνω  ποιέω ·
763372	tlg4015.tlg001.opp-grc1	οὐ γὰρ ὅλος δι’ ὅλου μανοῦται, ἀλλά τινων μορίων αὐτοῦ ἡ θέσις ἀμείβεται τῷ μᾶλλον ἀφεστηκέναι ἀλλήλων.	οὐ γάρ ὅλος διά   , ἀλλά  μόριος αὐτός ὁ θέσις ἀμείβω τῷ μᾶλλον ἀφίστημι ἀλλήλων .
763373	tlg4015.tlg001.opp-grc1	πάλιν εἴ τις τὴν χεῖρα πληρώσειε καρύων, τὸ ἐκ πάντων σῶμα μανὸν λέγεται παρὰ τὸ μὴ ἓν εἶναι·	πάλιν εἰ τις ὁ χείρ   , ὁ ἐκ πᾶς σῶμα μανός λέγω παρά ὁ μή  εἰμί ·
763374	tlg4015.tlg001.opp-grc1	μανὸν γὰρ λέγεται τὸ μὴ ἓν ὄν.	μανός γάρ λέγω ὁ μή   .
763375	tlg4015.tlg001.opp-grc1	ὁμοίως δὲ καὶ τὸ πυκνόν·	ὅμοιος δέ καί ὁ πυκνός ·
763376	tlg4015.tlg001.opp-grc1	ἐὰν γὰρ νοήσωμεν τὰ κάρυα συν- τεθρυμμένα, τὸ ἐκ πάντων σῶμα πυκνὸν ἔσται.	γάρ νοέω ὁ κάρυον  -  , ὁ ἐκ πᾶς σῶμα πυκνός εἰμί .
763377	tlg4015.tlg001.opp-grc1	καὶ πάλιν εἴ τις τὸν πόκον τῶν ἐρίων συνεσφιγμένον καὶ πεπυκνωμένον διαξαίνωνI ἀραιὸν ποιήσει, μανὸν λέγομεν.	καί πάλιν εἰ τις ὁ πόκος ὁ   καί πυκνόω  I ἀραιός ποιέω , μανός λέγω .
763378	tlg4015.tlg001.opp-grc1	καὶ ταύτην μὲν τὴν τεχνικὴν μάνωσιν ἢ πύκνωσιν ὑπὸ τὸ κεῖσθαι εἰκότως ἐνταῦθα ἀνάγει ὡς πρὸς εἰσαγομένους διαλεγόμενος, διότι κατὰ τὴν τῶν μορίων θέσιν ἢ πυκνὰ ἢ ἀραιὰ ταῦτα λέγονται.	καί οὗτος μέν ὁ τεχνικός  ἤ πυκνόω ὑπό ὁ κεῖμαι εἰκός ἐνταῦθα ἀνάγω ὡς πρός   , διότι κατά ὁ ὁ μόριος θέσις τίη πυκνός τίη ἀραιός οὗτος λέγω .
763379	tlg4015.tlg001.opp-grc1	οὐκ εἰσὶ δὲ ποιότητες, μήτε φυσικὴν ἔχοντα τὴν μάνωσιν ἢ πύκνωσιν μηδὲ ὅλα δι’ ὅλων ἢ πυκνὰ ὄντα ἢ μανά, ἀλλὰ κατὰ μόνην τὴν τῶν μορίων θέσιν, οὐχὶ δὲ καὶ αὐτῶν τῶν μορίων ἀναδεξαμένων τὴν ὁμοίαν τῶ ὅλῳ μάνωσιν. ’	οὐ εἰμί δέ  , μήτε φυσικός ἔχω ὁ  ἤ πυκνόω μηδέ ὅλος διά ὅλος τίη πυκνός εἰμί τίη μανός , ἀλλά κατά μόνος ὁ ὁ μόριος θέσις , οὐ δέ καί αὐτός ὁ μόριον  ὁ   ὅλος  .
763380	tlg4015.tlg001.opp-grc1	Ev δὲ τῇ Φυσικῇ ἀκροάσει ποιότητα εἶναι βούλεται τὴν φυσικὴν μάνωσιν ἢ πύκνωσιν τὴν περὶ ἓν καὶ τὸ αὐτὸ καταγινομένην ὑποκείμενον·	δέ ὁ φυσικός ἀκρόασις ποιότης εἰμί βούλομαι ὁ   ἤ πυκνόω ὁ περί  καί ὁ αὐτός   ·
763381	tlg4015.tlg001.opp-grc1	οἷον τὸ ὕδωρ φυσικὴν ἔχον πυκνότητα καὶ ὅλον δι’ ὅλου ἑαυτοῦ πυκνὸν ὂν ἐὰν ταύτην ἀποβαλὸν ἀραιωθῇ, ἀὴρ γίνεται, διὸ τὸ ξεστιαῖον ὕδωρ ποιήσειε τυχὸν δεκαξεστιαῖον ἀέρα.	οἷος ὁ ὕδωρ φυσικός ἔχω πυκνότης καί  διά  ἑαυτοῦ πυκνός εἰμί ἐάν οὗτος   , ἀήρ γίγνομαι , διό ὁ  ὕδωρ ποιέω   ἀήρ .
763382	tlg4015.tlg001.opp-grc1	καὶ τοῦτο γίνεται οὐκ εἰς μικρὰ μόρια τοῦ ὕδατος κατακερματιζομένου, ὥσπερ εἴ τις κονιορτοῦ τὴν χεῖρα πληρώσας ῥίψειεν ἐν ἀέρι καὶ πλεῖστον καταλάβοι τόπον ὁ κονιορτὸς τῷ ἐξηπλῶσθαι τὰ μόρια αὐτοῦ, ἐπεὶ εἰ τοῦτο ἦν, ἔδει καὶ ἡμᾶς εἰς μικρὰ διασκεδαννύντας τὸ ὕδωρ ἀέρα ποιεῖν.	καί οὗτος γίγνομαι οὐ εἰς μικρός μόριον ὁ ὕδωρ  , ὥσπερ εἰ τις κονιορτός ὁ χείρ πληρόω ῥίπτω ἐν ἀήρ καί πλεῖστος καταλαμβάνω τόπος ὁ  τῷ  ὁ μόριον αὐτός , ἐπεί εἰ οὗτος εἰμί , δέω καί ἐγώ εἰς μικρός  ὁ ὕδωρ ἀήρ ποιέω .
763383	tlg4015.tlg001.opp-grc1	εἰ δέ τις εἴποι‘ ἀλλ’ οὐ δυνάμεθα ἡμεῖς εἰς λεπτότατα οὕτω κατακερματίζειν τὸ ὕδωρ’, ἀλλ’ εἰ καὶ μὴ ἔργῳ δυνάμεθα, οὐδ’ ἄν τῷ λόγῳ ὑποθώμεθα, οὐδὲ οὕτως τοῦτο δυνατόν ἐστι;	εἰ δέ τις λέγω ‘ ἀλλά οὐ δύναμαι  εἰς λεπτός οὕτως  ὁ ὕδωρ ’ , ἀλλά εἰ καί μή ἔργον δύναμαι , οὐδέ ἄν τῷ λόγος ὑποθέω , οὐδέ οὕτως οὗτος δυνατός εἰμί ;
763384	tlg4015.tlg001.opp-grc1	τὰ γὰρ μόρια πάντως τοῦ ὕδατος ὑδάτιά ἐστι·	ὁ γάρ μόριον πᾶς ὁ ὕδωρ  εἰμί ·
763385	tlg4015.tlg001.opp-grc1	τὰ γὰρ μέρη τῷ ὅλῳ εἰσὶν ὅμοια κατ’ οὐσίαν, καὶ ἐξ ὧν ἕκαστον σύγκειται, εἰς ταῦτα καὶ δια- λύεται.	ὁ γάρ μέρος τῷ ὅλος εἰμί ὅμοιος κατά οὐσία , καί ἐκ ὅς ἕκαστος σύγκειμαι , εἰς οὗτος καί  - λύω .
763386	tlg4015.tlg001.opp-grc1	εἰ οὖν τὸ ὕδωρ ἐκ τῶν ὁμοίων μερῶν σύγκειται ὑδάτων ὄντων τὰ γὰρ μέρη, ὡς εἴπομεν, τῷ ὅλῳ ὅμοια), καὶ εἰς ταῦτα πάντως ἀναλύομενον μερίζεται.	εἰ οὖν ὁ ὕδωρ ἐκ ὁ ὅμοιος μέρος σύγκειμαι ὕδωρ εἰμί ὁ γάρ μέρος , ὡς λέγω , τῷ ὅλος ὅμοιος ) , καί εἰς οὗτος πᾶς  μερίζω .
763387	tlg4015.tlg001.opp-grc1	ἔμελλε δὲ μηδὲ συνεχὴς εἶναι ὁ ἀήρ, ἀλλὰ κεναῖς χώραις μεταξὺ διαλαμβάνεσθαι·	μέλλω δέ μηδέ συνεχής εἰμί ὁ ἀήρ , ἀλλά κενός χώρα μεταξύ διαλαμβάνω ·
763388	tlg4015.tlg001.opp-grc1	ἀνάγκη γὰρ ἢ συνεχῆ εἶναι τὰ μόρια τοῦ ὕδατος ἢ διῃρῆσθαι·	ἀνάγκη γάρ τίη συνεχής εἰμί ὁ μόριος ὁ ὕδωρ ἤ διαιρέω ·
763389	tlg4015.tlg001.opp-grc1	ἅπτεσθαι γὰρ ἀδύνατον·	ἅπτω γάρ ἀδύνατος ·
763390	tlg4015.tlg001.opp-grc1	ἁπτόμενα γὰρ| εὐθὺς συνεχῆ γίνεται διὰ τὴν ὑγρότητα.	ἅπτω γάρ | εὐθύς συνεχής γίγνομαι διά ὁ ὑγρότης .
763391	tlg4015.tlg001.opp-grc1	εἰ μὲν οὖν διῄρηται, οὐ συνεχὴς ὁ ἀήρ, ὅπερ ἐστὶ ψεῦδος καὶ παρὰ τὴν ἐνάργειαν.	εἰ μέν οὖν διαιρέω , οὐ συνεχής ὁ ἀήρ , ὅς εἰμί ψεῦδος καί παρά ὁ ἐνάργεια .
763392	tlg4015.tlg001.opp-grc1	εἰ δὲ συνῆπται, ὕδωρ ἔσται πάλιν τὸ ὅλον καὶ οὐκ ἀήp.	εἰ δέ συνάπτω , ὕδωρ εἰμί πάλιν ὁ ὅλος καί οὐ  .
763393	tlg4015.tlg001.opp-grc1	ὥστε οὐ κατακερματιζόμενον τὸ ὕδωρ ποιεῖ τὸν ἀέρα, ἀλλὰ πάντῃ τρεπόμενον καὶ ἀλλοιούμενον.	ὥστε οὐ  ὁ ὕδωρ ποιέω ὁ  , ἀλλά πᾶς τρέπω καί ἀλλοιόω .
763394	tlg4015.tlg001.opp-grc1	ὅτι δὲ ποιότητές εἰσι ταῦτα, σαφῶς δείκνυσιν ὁ Ἀριστοτέλης ἐν τῇ Φυσικῇ·	ὅτι2 δέ  εἰμί οὗτος , σαφής δείκνυμι ὁ Ἀριστοτέλης ἐν ὁ  ·
763395	tlg4015.tlg001.opp-grc1	λέγει γὰρ ὅτι ὥσπερ τὸ σῶμα ποιοτήτων ὂν δεκτικὸν μεταβάλλει κατὰ ταύτας καθ’ ὅλον ἑαυτὸ ἐκ λευκοῦ μέλαν γινόμενον καὶ ἐκ μέλανος λευκόν, οὕτως ἐπειδὴ καὶ ἡ μανότης καὶ ἡ πυκνότης εἰσὶ ποιότητες, εἰκότως καὶ κατὰ ταύτας τὸ σῶμα μεταβάλλει, καὶ δεχόμενον μὲν πυκνότητα γίνεται ὕδωρ, ἔτι δὲ μᾶλλον πυκνούμενον γίνεται γῆ, μεταβάλλον δὲ ἐκ πυκνότη- τος εἰς μανότητα γίνεται ἀήρ, ἔτι δὲ μᾶλλον μανωθὲν γίνεται πῦp.	λέγω γάρ ὅτι2 ὥσπερ ὁ σῶμα  εἰμί δεκτικός μεταβάλλω κατά οὗτος κατά ὅλος  ἐκ λευκόν μέλας  καί ἐκ  λευκός , οὕτως ἐπεί καί ὁ μανότης καί ὁ πυκνότης εἰμί  , εἰκός καί κατά οὗτος ὁ σῶμα μεταβάλλω , καί  μέν πυκνότης γίγνομαι ὕδωρ , ἔτι δέ μᾶλλον πυκνόω γίγνομαι γῆ , μεταβάλλω δέ ἐκ  -  εἰς μανότης γίγνομαι ἀήρ , ἔτι δέ μᾶλλον  γίγνομαι  .
763396	tlg4015.tlg001.opp-grc1	ἡ μὲν οὖν φυσικὴ μάνωσις ἡ πύκνωσις ἡ περὶ ἓν καταγινομένη ὑποκείμενον ποιότης ἐστίν, εἰ δὲ μὴ περὶ ἓν ἀλλὰ περὶ πλείονα σώματα καταγίνεται, κἂν φυσικὴ ᾖ, οὐ λέγεται ποιότης, ἀλλὰ θέσις, οἷον ἡ τῶν ὀδόντων πυκνότης ἢ μανότης·	ὁ μέν οὖν φυσικός  ὁ  ὁ περί     εἰμί , εἰ δέ μή περί  ἀλλά περί πολύς σῶμα καταγίγνομαι , ἐάν  εἰμί , οὐ λέγω  , ἀλλά θέσις , οἷος ὁ ὁ ὀδούς  ἤ  ·
763397	tlg4015.tlg001.opp-grc1	εἰ γὰρ καὶ ἐκ φύσεως ἐστιν, ἀλλὰ τῷ μὴ περὶ ἓν γίνεσθαι ὑποκείμενον ἀλλὰ περὶ πλείονα τοὺς ὀδόντας, οὐ λέγεται ποιότης, θέσις δὲ μᾶλλον.	γάρ καί ἐκ φύσις εἰμί , ἀλλά τῷ μή περί  γίγνομαι  ἀλλά περί πολύς ὁ ὀδούς , οὐ λέγω  , θέσις δέ μᾶλλον .
763398	tlg4015.tlg001.opp-grc1	ταῦτα μὲν ἐπὶ τοσοῦτον.	οὗτος μέν ἐπί τοσοῦτος .
763399	tlg4015.tlg001.opp-grc1	τοῦ δὲ Ἀριστοτέλους τὴν μὲν εὐθύτητα καὶ καμπυλότητα ποιότητας εἶναι λέγοντος, τραχύτητα δὲ καὶ λειότητα μηκέτι ποιότητας, θέσιν δὲ μόνην τῶν μορίων εἶναι τὸ τραχὺ καὶ τὸ λεῖον, ὡς ἔφθημεν εἰπόντες, ἀποροῦσί τινες ὅτι μήποτε καὶ τὸ εὐθὺ καὶ καμπύλον θέσιν μόνην τῶν μορίων δηλοῖ, εἴπερ εὐθεῖα γραμμή ἐστιν ἥτις ἐξ ἴσου τοῖς ἐφ’ ἑαυτῆς σημείοις κεῖται ἢ πάλιν ἧς τὰ μέσα τοῖς ἄκροις ἐπιπροσθεῖ·	ὁ δέ Ἀριστοτέλης ὁ μέν εὐθύτης καί  ποιότης εἰμί λέγω , τραχύτης δέ καί λειότης μηκέτι  , θέσις δέ μόνος ὁ μόριος εἰμί ὁ τραχύς καί ὁ  , ὡς  λέγω , ἀπορέω2 τις ὅτι2 μήποτε καί ὁ εὐθύς καί καμπύλος θέσις μόνος ὁ μόριος δηλόω , εἴπερ εὐθύς γραμμή εἰμί ὅστις ἐκ ἴσος ὁ ἐπί ἑαυτοῦ  κεῖμαι ἤ πάλιν ὅς ὁ  ὁ ἄκρον  ·
763400	tlg4015.tlg001.opp-grc1	δῆλον γὰρ ὅτι κἀνταῦθα ἡ τοιάδε θέσις τῶν τῆς γραμμῆς μορίων| ποιεῖ τὴν εὐθεῖαν, θείαν, ὥστε μηδὲν αὐτῆς μόριον ἐκτὸς ἡ ἐντὸς νεύειν ἀλλ’ ἐπιπροσθεῖν διὰ τὴν ἰσότητα τὰ μέσα τοῖς ἄκροις.	δῆλος γάρ ὅτι2 ἐνταῦθα ὁ τοιόσδε θέσις ὁ ὁ γραμμή μόριον | ποιέω ὁ εὐθύς , θεία , ὥστε  αὐτός μόριον ἐκτός ὁ ἐντός νεύω ἀλλά ἐπιπροσθέω διά ὁ ἰσότης ὁ  ὁ ἄκρον .
763401	tlg4015.tlg001.opp-grc1	καὶ τὸ καμπύλον δὲ μόνῃ τῇ τῶν μορίων θέσει τῆς εὐθύτητος διαφέρει·	καί ὁ  δέ μόνος ὁ ὁ μόριος θέσις ὁ εὐθύτης διαφέρω ·
763402	tlg4015.tlg001.opp-grc1	τῶν γὰρ μορίων αὐτῆς ἐπικαμ- πτομένων καὶ τῶν μὲν ἐκτὸς τῶν δὲ ἐντὸς νευόντων συμβαίνει τὴν καμπυλότητα γενέσθαι.	ὁ γάρ μόριος αὐτός  -  καί ὁ μέν ἐκτός ὁ δέ ἐντός νεύω συμβαίνω ὁ  γίγνομαι .
763403	tlg4015.tlg001.opp-grc1	ἢ οὖν καὶ τὸ τραχὺ καὶ τὸ λεῖον ποιότητες, ἢ εἰ ταῦτα θέσιν μόνην τῶν μορίων σημαίνει, τὸ αὐτὸ ἄν σημαίνοι καὶ τὸ εὐθὺ καὶ τὸ καμπύλον.	τίη οὖν καί ὁ τραχύς καί ὁ   , ἤ εἰ οὗτος θέσις μόνος ὁ μόριον σημαίνω , ὁ αὐτός ἄν σημαίνω καί ὁ εὐθύς καί ὁ  .
763404	tlg4015.tlg001.opp-grc1	ἡ μὲν οὖν ἀπορία τοιαύτη.	ὁ μέν οὖν ἀπορία τοιοῦτος .
763405	tlg4015.tlg001.opp-grc1	ἐπιλυόμεθα δὲ αὐτὴν τοῦτον τὸν τρόπον·	δέ αὐτός οὗτος ὁ τρόπος ·
763406	tlg4015.tlg001.opp-grc1	οὐκ ἔστι ταὐτὸν καμπύλην εἰπεῖν γραμμὴν καὶ κεκλασμένην• ἡ μὲν γὰρ κεκλασμένη γραμμὴ οὐκ ἀμείβει τὸ τῆς εὐθείας εἶδος, ᾗ εὐθεῖα εἴη, ἀλλὰ μόνον ἡ μία δύο γίνεται καὶ γωνίαν ποιεῖ, ἡ δὲ καμπύλη ἄλλο τὸ εἶδος ἔχει παρὰ τὴν εὐθεῖαν·	οὐ εἰμί αὐτός  λέγω γραμμή καί  • ὁ μέν γάρ  γραμμή οὐ ἀμείβω ὁ ὁ εὐθεῖα εἶδος , ὅς εὐθύς εἰμί , ἀλλά μόνος ὁ  γε γίγνομαι καί γωνία ποιέω , ὁ δέ  ἄλλος ὁ εἶδος ἔχω παρά ὁ εὐθύς ·
763407	tlg4015.tlg001.opp-grc1	τὸ γὰρ καμπύλον τὸ περιφερὲς σημαίνει.	ὁ γάρ καμπύλος ὁ περιφερής σημαίνω .
763408	tlg4015.tlg001.opp-grc1	ὅτι δὲ κατ’ εἶδος ἐξήλλακται ἡ περιφέρεια τῆς εὐθείας, πολλαχόθεν δῆλον.	ὅτι2 δέ κατά εἶδος  ὁ περιφέρεια ὁ εὐθεῖα , πολλαχόθεν δῆλος .
