id	filename	tokens	lemmas
1111971	tlg4034.tlg003.opp-grc1	Τὸ δὲ μέσον τοῦ σώματος μέρος δυνάμει μὲν ἕν, ἐνεργείᾳ δὲ ἀνάγκη γίνεσθαι πλείω.	δέ μέσος ὁ σῶμα μέρος δύναμις μέν  , ἐνέργεια δέ ἀνάγκη γίγνομαι πολύς .
1111972	tlg4034.tlg003.opp-grc1	Μέσον τοῦ σώματος λέγει τὴν καρδίαν καὶ τὸ ἐν αὐτῇ πνεῦμα.	ὁ σῶμα λέγω ὁ καρδία καί ὁ ἐν αὐτός πνεῦμα .
1111973	tlg4034.tlg003.opp-grc1	φησὶ δὲ ὅτι τὸ τῶν ζῴων μέσον δυνάμει μὲν ἕν, ἐνεργείᾳ δὲ δύο.	φημί δέ ὅτι2 ὁ ὁ ζῷον μέσος δύναμις μέν  ,  δέ γε .
1111974	tlg4034.tlg003.opp-grc1	ἐπειδὴ γὰρ ἀπ’ αὐτοῦ αἱ κινήσεις, ἀνάγκη ἐκτετινομένου τοῦ ἐν τῷ δεξιῷ τῆς καρδίας πνεύματος, καὶ συνεκτείνοντος ἑαυτῷ τὸ ἀπὸ τῆς καρμερει δίας νεῦρον ἢ νεῦρα, συνεκτείνεσθαι καὶ τὸ τῆς καρδίας μέρος καὶ κινεῖσθαι.	ἐπεί γάρ ἀπό αὐτός ὁ κινέω , ἀνάγκη  ὁ ἐν τῷ δεξιός ὁ καρδία πνεῦμα , καί  ἑαυτοῦ ὁ ἀπό ὁ  δῖος  ἤ  ,  καί ὁ ὁ καρδία μέρος καί κινέω .
1111975	tlg4034.tlg003.opp-grc1	ἀπὸ γὰρ αὐτῆς ὡς ἀπ’ ἀρχῆς τὰ νεῦρα τὴν ἀρχὴν ἔχει ὥσπερ καὶ αἱ φλέβες·	ἀπό γάρ αὐτός ὡς ἀπό ἀρχή ὁ νεῦρον ὁ ἀρχή ἔχω ὥσπερ καί ὁ φλέψ ·
1111976	tlg4034.tlg003.opp-grc1	ὥστε ὅταν τείνηται ὑπὸ τῆς τοῦ πνεύματος ἐκτάσεως τὸ νεῦρον, ἀνάγκη συντείνεσθαι τὸ τῆς καρδίας μέρος, ἐν ᾧ τὸ τεινόμενον νεῦρον ἐρρίζωται.	ὡς ὅταν τείνω ὑπό ὁ ὁ πνεῦμα ἔκτασις ὁ  , ἀνάγκη συντείνω ὁ ὁ καρδία μέρος , ἐν ὅς ὁ τείνω  ῥιζόω .
1111977	tlg4034.tlg003.opp-grc1	ἐπεὶ δ’ ἠρεμούντων τῶν ἀριστερῶν κινεῖται τὰ δεξιά, ὥσπερ πάλιν τῶν δεξιῶν τὰ ἀριστερά, ἀνάγκη κινουμένων τῶν δεξιῶν καὶ ἠρεμούντων τῶν ἀριστερῶν ἠρεμεῖν καὶ τὸ ἀριστερὸν μέρος τῆς καρδίας καὶ τὸ ἐν τούτῳ πνεῦμα.	ἐπεί  ἠρεμέω ὁ ἀριστερός κινέω ὁ δεξιός , ὥσπερ πάλιν ὁ δεξιός ὁ ἀριστερός , ἀνάγκη κινέω ὁ δεξιός καί ἠρεμέω ὁ ἀριστερός ἠρεμέω καί ὁ ἀριστερός μέρος ὁ καρδία καί ὁ ἐν  πνεῦμα .
1111978	tlg4034.tlg003.opp-grc1	οὐδὲν γὰρ κωλύει, καίπερ συνεχοῦς ὄντος ὅλου τοῦ ἐν τῇ καρδίᾳ πνεύματος, τὸ μὲν αὐτοῦ ἠρεμεῖν τὸ δὲ κινεῖσθαι·	γάρ κωλύω , καίπερ  εἰμί  ὁ ἐν ὁ καρδία πνεῦμα , ὁ μέν αὐτός ἠρεμέω ὁ δέ κινέω ·
1111979	tlg4034.tlg003.opp-grc1	καὶ γὰρ καὶ τοῦ ἐν ταῖς σκάφαις ὕδατος ὁρῶμεν τὸ μὲν κινούμενον, ὅπερ ἐκίνησεν ἡ χείρ, τὸδ’ ἠρεμοῦν.	καί γάρ καί ὁ ἐν ὁ σκάφη ὕδωρ ὁράω ὁ μέν κινέω , ὅς κινέω ὁ χείρ , ὁ δ’  .
1111980	tlg4034.tlg003.opp-grc1	ἠρεμοῦντος οὖν τοῦ ἀριστεροῦ μέρους τῆς καρδίας καὶ τοῦ ἐν αὐτῇ πνεύματος δῆλον ὅτι καὶ τὸ ἐν τούτῳ τῷ μέρει νεῦρον ἢ νεῦρα ἠρεμεῖ.	οὖν ὁ ἀριστερός μέρος ὁ καρδία καί ὁ ἐν αὐτός πνεῦμα δῆλος ὅτι2 καί ὁ ἐν οὗτος τῷ μέρος  ἤ νευρά ἠρεμέω .
1111981	tlg4034.tlg003.opp-grc1	εἰ δὲ τοῦτο, δῆλον ὅτι ἠρεμούντων τῶν δεξιῶν μερῶν τοῦ πνεύματος καὶ τῆς καρδίας κινεῖται τὰ ἀριστερά, καὶ ἠρεμούντων τῶν ἀριστερῶν κινεῖται τὰ δεξιά, ἀπερειδόμενα τὰ μὲν δεξιά, ὅτε κινεῖται, εἰς τὰ ἀριστερὰ ἠρεμοῦντα, καὶ ταῦτα εἰς τὰ δεξιά, ἐοικότα ὡς αὐτὸς ἐρεῖ προιὼν τοῖς τὰ νῶτα ἀπερείδουσι καὶ κινοῦσι τὰ σκέλη.	εἰ δέ οὗτος , δῆλος ὅτι2 ἠρεμέω ὁ δεξιός μέρος ὁ πνεῦμα καί ὁ καρδία  ὁ ἀριστερός , καί ἠρεμέω ὁ  κινέω ὁ δεξιός ,  ὁ μέν δεξιός , ὅτε κινέω , εἰς ὁ ἀριστερός ἠρεμέω , καί οὗτος εἰς ὁ δεξιός , ἔοικα ὡς αὐτός λέγω πρόειμι ὁ ὁ νῶτον  καί κινέω ὁ σκέλος .
1111982	tlg4034.tlg003.opp-grc1	ὡς γὰρ ὁ βραχίων ἀπερειδόμενος ὡς πρὸς ἠρεμοῦν τὸ ὠλέκρανον κινεῖται, οὕτως ἀνάγκη καὶ τὸ ἀριστερὸν τῆς καρδίας καὶ τοῦ πνεύματος ἀπερείδεσθαι πρὸς τὸ δεξιὸν ὡς πρὸς ἠρεμοῦν, καὶ τοῦτο πάλιν πρὸς τὸ ἀριστερόν, κινεῖσθαι δὲ ἀμφότερα ὑπὸ τῆς ψυχῆς, ἀκινήτου οὔσης| καθ’ ἑαυτήν.	ὡς γάρ ὁ βραχίων  ὡς πρός  ὁ   , οὕτως ἀνάγκη καί ὁ  ὁ καρδία καί ὁ πνεῦμα ἀπερείδω πρός ὁ δεξιός ὡς πρός  , καί οὗτος πάλιν πρός ὁ ἀριστερός , κινέω δέ ἀμφότερος ὑπό ὁ ψυχή , ἀκίνητος εἰμί | κατά ἑαυτοῦ .
1111983	tlg4034.tlg003.opp-grc1	τὰ γὰρ εἴδη καὶ αἱ ἕξεις ἀκίνητα καθ’ αὑτά·	ὁ γάρ εἶδος καί ὁ ἔχω ἀκίνητος κατά ἑαυτοῦ ·
1111984	tlg4034.tlg003.opp-grc1	τοιοῦτον δὲ καὶ ἡ ψυχὴ δέδεικται οὖσα.	τοιοῦτος δέ καί ὁ ψυχή δείκνυμι εἰμί .
1111985	tlg4034.tlg003.opp-grc1	κινουμένων δὲ τῶν δεξιῶν καὶ τῶν ἀριστερῶν κινεῖται καὶ τὰ ἐν τούτοις νεῦρα καὶ διὰ τῶν νεύρων τὰ κῶλα.	κινέω δέ ὁ  καί ὁ   καί ὁ ἐν οὗτος νεῦρον καί διά ὁ  ὁ κῶλον .
1111986	tlg4034.tlg003.opp-grc1	ὥστε ἓν ὃν τὸ πνεῦμα δυνάμει ἐν ταῖς κινήσεσιν ἐνεργείᾳ γίνεται δύο, ὁμοίως καὶ ἡ καρδία·	ὥστε  ὅς ὁ πνεῦμα δύναμις ἐν ὁ κίνησις ἐνέργεια γίγνομαι γε , ὅμοιος καί ὁ καρδία ·
1111987	tlg4034.tlg003.opp-grc1	ὡς γὰρ τὸ πνεῦμα, καὶ ἡ καρδία, καὶ ὡς αὕτη, καὶ τὸ πνεῦμα.	ὡς γάρ ὁ πνεῦμα , καί ὁ καρδία , καί ὡς οὗτος , καί ὁ πνεῦμα .
1111988	tlg4034.tlg003.opp-grc1	ἐπειδὴ γὰρ τὸ μὲ κινεῖται τῆς καρδίας καὶ τοῦ πνεύματος τὸ δὲ ἠρεμεῖ, δῆλον ὡς δύο εἰσὶν ἐνεργείᾳ·	ἐπεί γάρ ὁ  κινέω ὁ καρδία καί ὁ πνεῦμα ὁ δέ ἠρεμέω , δῆλος ὡς γε εἰμί ἐνέργεια ·
1111989	tlg4034.tlg003.opp-grc1	ἓν δὲ ἐνεργείᾳ γίνεται ἐν ταῖς ἠρεμίαις.	δέ ἐνέργεια γίγνομαι ἐν ὁ  .
1111990	tlg4034.tlg003.opp-grc1	ἀλλὰ περὶ μὲν τούτων τοσαῦτα εἰρήσθω, ἐπὶ δὲ τὴν λέξιν λοιπόν ἐστι τραπῆναι.	ἀλλά περί μέν οὗτος τοσοῦτος  , ἐπί δέ ὁ λέξις λοιπός εἰμί τέρπω .
1111991	tlg4034.tlg003.opp-grc1	εἰπὼν ὅτι ἐνεργείᾳ δύο γίνεται, συντόμως τὴν αἰτίαν τούτου ἐπήγαγεν εἰπὼν καὶ γὰρ ἅμα τὰ κῶλα κινεῖται ἀπὸ τῆς ἀρχῆς·	λέγω ὅτι2 ἐνέργεια γε γίγνομαι , σύντομος ὁ αἰτία οὗτος ἐπάγω λέγω καί γάρ ἅμα ὁ κῶλον κινέω ἀπό ὁ ἀρχή ·
1111992	tlg4034.tlg003.opp-grc1	πάλιν τὸ ἅμα ἀντὶ τοῦ παρὰ μέρος.	πάλιν ὁ ἅμα ἀντί ὁ παρά μέρος .
1111993	tlg4034.tlg003.opp-grc1	περὶ ὧν ἀκριβέστερον ἐν τῷ Περὶ ζῴων πορείας εἴρηται.	περί  ἀκριβής ἐν ὁ περί ζῷον πορεία λέγω .
1111994	tlg4034.tlg003.opp-grc1	ἐπεὶ οὖν τὸ μὲν ἠρεμεῖ τῶν κώλων, τὸ δὲ κινεῖται, ἀνάγκη καὶ τοῦ πνευματος καὶ τῆς καρδίας τὸ μὲν κινεῖσθαι, τὸ δὲ ἠρεμεῖν.	ἐπεί οὖν ὁ μέν ἠρεμέω ὁ κῶλον , ὁ δέ κινέω , ἀνάγκη καί ὁ  καί ὁ καρδία ὁ μέν κινέω , ὁ δέ ἠρεμέω .
1111995	tlg4034.tlg003.opp-grc1	Λέγω δὲ οἷον ἐπὶ τῆς ΑΒΓ τὸ Β κινεῖται, κινεῖ δὲ τὸ Α.	λέγω δέ οἷος ἐπί ὁ  ὁ  κινέω , κινέω δέ ὁ  .
1111996	tlg4034.tlg003.opp-grc1	Εἰπὼν ὅτι ἐνεργείᾳ γίνεται δύο δυνάμει ὄντα ἕν, δείκνυσι τοῦτο καὶ ἐπὶ καταγραφῆς, ὡς ἔθος αὐτῷ, ἅμα πρὸς τούτῳ δεικνύων ὅτι ἀνάγκη εἶναί τι ἀκίνητον, εἰ μέλλει κινήσεσθαι τὸ ζῷον.	ὅτι2  γίγνομαι γε δύναμις εἰμί  , δείκνυμι οὗτος καί ἐπί καταγραφή , ὡς ἔθος αὐτός , ἅμα πρός οὗτος δείκνυμι ὅτι2 ἀνάγκη εἰμί τις ἀκίνητος , εἰ μέλλω  ὁ ζῷον .
1111997	tlg4034.tlg003.opp-grc1	νενοήσθω δὴΑ ὅλη ἡ καρδία καὶ ὅλον τὸ ἐν αὐτῇ πνεῦμα, Β δὲ τὸ ἐν τῷ δεξιῷ μέρει τῆ καρδίας νεῦρον ἢ νεῦρα, καὶΓ ὁμοίως τὸ ἐν τῷ ἀριστερῷ μέρει αὐτῆς νεῦρον ἢ νεῦρα.	δή Α  ὁ καρδία καί ὅλος ὁ ἐν αὐτός πνεῦμα ,  δέ ὁ ἐν ὁ δεξιός μέρος τῆ καρδία  ἤ νεῦρον , καί Γ ὅμοιος  ἐν ὁ ἀριστερός μέρος αὐτός  τίη νευρά .
1111998	tlg4034.tlg003.opp-grc1	κινεῖται οὖν τὸ Β τὸ νεῦρον, κινεῖ δὲ τὸ Α τὸ μέρος τοῦ πνεύματος καὶ τὸ μέρος τῆς καρδίας κινούμενα ὑπὸ τῆς ψυχῆς.	κινέω οὖν ὁ  ὁ νεῦρον , κινέω δέ ὁ  ὁ μέρος ὁ πνεῦμα καί ὁ μέρος ὁ καρδία κινέω ὑπό ὁ ψυχή .
1111999	tlg4034.tlg003.opp-grc1	ἀλλ’ ἐπεί, ὡς δέδεικται, ἀνάγκη εἶναί τι ἠρεμοῦν, εἰ μέλλει γενέσθαι κίνησις, ἀνάγκη τὸ λοιπὸν μέρος τοῦ Α ἤτοι τῆς καρδίας καὶ τοῦ πνεύματος ἠρεμεῖν.	ἀλλά ἐπεί , ὡς δείκνυμι , ἀνάγκη εἰμί τι  , εἰ μέλλω γίγνομαι κίνησις , ἀνάγκη ὁ λοιπός μέρος ὁ  ἤτοι ὁ καρδία καί ὁ πνεῦμα ἠρεμέω .
1112000	tlg4034.tlg003.opp-grc1	ἓν ἄρα δυνάμει ὄντα τὰ AE ἐνεργείᾳ δύο ἔσται.	ἄρα δύναμις εἰμί ὁ  ἐνέργεια γε  .
1112001	tlg4034.tlg003.opp-grc1	ἐκάλεσε δὲ τὸ ἠρεμοῦν μέρος τοῦ πνεύματος καὶ τῆς καρδίαςE, ἵνα τῇ διαφορᾷ τοῦ στοιχείου δηλώσῃ καὶ τὸ διαφέρον τοῦ πνεύματος καὶ τῆς καρδίας.	καλέω δέ ὁ  μέρος ὁ πνεῦμα καί ὁ καρδία E , ἵνα ὁ διαφορά ὁ  δηλόω καί ὁ διαφέρω ὁ πνεῦμα καί ὁ καρδία .
1112002	tlg4034.tlg003.opp-grc1	διαφέρει γάρ, ὡς πολλάκις εἴρηται, τὸ ἠρεμοῦν τῆς καρδίας μέρος καὶ τοῦ πνεύματος πρὸς τὸ μὴ ἠρεμοῦν·	διαφέρω γάρ , ὡς πολλάκις λέγω , ὁ  ὁ καρδία μέρος καί ὁ πνεῦμα πρός ὁ μή  ·
1112003	tlg4034.tlg003.opp-grc1	ᾗ γὰρ τὰ μὲν κινεῖται τὰ δὲ ἠρεμεῖ, διαφέρουσιν.	ὅς γάρ ὁ μέν κινέω ὁ δέ ἠρεμέω , διαφέρω .
1112004	tlg4034.tlg003.opp-grc1	ἓν ἄρα δυνάμει ὄντα τὰ AE τουτέστιν ἓν ἄρα δυνάμει οὖσα ὅλη ἡ καρδία καὶ ὅλον τὸ πνεῦμα δύο εἰσὶν ἐνεργείᾳ.	ἄρα δύναμις εἰμί ὁ    ἄρα δύναμις εἰμί ὅλος ὁ καρδία καί ὅλος ὁ πνεῦμα γε εἰμί ἐνέργεια .
1112005	tlg4034.tlg003.opp-grc1	καὶ ἐπεὶ τὸ μὲν αὐτῆς ἠρεμεῖ τὸ δὲ κινεῖται, ἀνάγκη μὴ στιγμὴν εἶναι.	καί ἐπεί ὁ μέν αὐτός ἠρεμέω ὁ δέ κινέω , ἀνάγκη μή στιγμή εἰμί .
1112006	tlg4034.tlg003.opp-grc1	τοῦτο δὲ ταὐτόν ἐστι τῷ ἀνάγκη μὴ τοῦτο εἶναι τὴν ψυχήν.	οὗτος δέ αὐτός εἰμί τῷ ἀνάγκη μή οὗτος εἰμί ὁ ψυχή .
1112007	tlg4034.tlg003.opp-grc1	εἰ γὰρ τῶν κινουμένων τὸ μὲν.	εἰ γάρ ὁ  ὁ μέν .
1112008	tlg4034.tlg003.opp-grc1	αὐτῶν κινεῖται τὸ δὲ ἠρεμεῖ, ἡ δὲ ψυχὴ ἀμερὴς καὶ ἀσώματος, τῶν δ’ ἀμερῶν οὐ τὸ μὲν κινήσεται τὸ δὲ ἠρεμήσει( οὕτω γὰρ οὐκ ἄν ἦν ἀμερῆ) οὐκ ἂν εἴη οὔτε καρδία οὔτε αὐτὸ τὸ πνεῦμα ἡ ψυχή, ἀλλ’ ἄλλο τι εἶδος οὖσα τούτων καὶ ἀκίνητος.	αὐτός κινέω ὁ δέ ἠρεμέω , ὁ δέ ψυχή ἀμερής καί  , ὁ   οὐ ὁ μέν κινέω ὁ δέ ἠρεμέω ( οὕτως γάρ οὐ ἄν εἰμί ἀμερής ) οὐ ἄν εἰμί οὔτε  οὔτε αὐτός ὁ πνεῦμα ὁ ψυχή , ἀλλά ἄλλος τις εἶδος εἰμί οὗτος καί ἀκίνητος .
1112009	tlg4034.tlg003.opp-grc1	εἰ γὰρ κινεῖται, πάλιν τὰ αὐτὰ ἐροῦμεν ὅτι ἀνάγκη τὸ μὲν αὐτῆς κινεῖσθαι τὸ δὲ ἠρεμεῖν·	εἰ γάρ κινέω , πάλιν ὁ αὐτός ἐρέω ὅτι2 ἀνάγκη ὁ μέν αὐτός κινέω ὁ δέ  ·
1112010	tlg4034.tlg003.opp-grc1	οὕτω δὲ πάλιν σῶμα ἂν εἴη καὶ οὐκ ἀσώματον, καὶ οὐκ εἶδος, ἀλλ᾿ ὑποκείμενον καὶ ὕλη.	οὕτως δέ πάλιν σῶμα ἄν εἰμί καί  ἀσώματος , καί οὐ εἶδος ,   καί ὕλη .
1112011	tlg4034.tlg003.opp-grc1	Ἀλλὰ μὴν ἐνδέχεται τὸΓ τῷΒ ἅμα κινεῖσθαι.	ἀλλά μήν ἐνδέχομαι ὁ Γ τῷ Β ἅμα κινέω .
1112012	tlg4034.tlg003.opp-grc1	ΤὸΓ ἐν θατέρῳ τῆς καρδίας μέρει νεῦρον ἔθεμεν.	Γ ἐν ἕτερος ὁ καρδία μέρος  τίθημι .
1112013	tlg4034.tlg003.opp-grc1	τὸ δὲ ἅμα πάλιν ἀντὶ τοῦ παρὰ μέρος·	ὁ δέ ἅμα πάλιν ἀντί ὁ παρά μέρος ·
1112014	tlg4034.tlg003.opp-grc1	ἐνδέχεται γὰρ μετὰ τὸ κινηθῆναι τὸ δεξιὸν κινηθῆναι τὸ ἀριστερόν.	ἐνδέχομαι γάρ μετά ὁ κινέω ὁ δεξιός κινέω ὁ ἀριστερός .
1112015	tlg4034.tlg003.opp-grc1	ὥστε καὶ τὸ μέρος τῆς καρδίας, ἐν ᾧ ἐρρίζωται τὸ ἀριστερὸν νεῦρον, κινηθήσεται.	ὥστε καί ὁ μέρος ὁ καρδία , ἐν ὅς  ὁ ἀριστερός  ,  .
1112016	tlg4034.tlg003.opp-grc1	Ὥστ᾿ ἀνάγκη ἀμφοτέρας τὰς ἀρχὰς τὰς ἐν τῷΑ κινουμένας κινεῖν.	ἀνάγκη ἀμφότερος ὁ ἀρχή ὁ ἐν τῷ Α  κινέω .
1112017	tlg4034.tlg003.opp-grc1	Ἀρχὰς λέγων τὰ δεξιὰ καὶ ἀριστερὰ μέρη τῆς καρδίας καὶ τοῦ πνεύματος.	ἀρχή λέγω ὁ δεξιός καί ἀριστερός μέρος ὁ καρδία καί ὁ πνεῦμα .
1112018	tlg4034.tlg003.opp-grc1	ἦν δ᾿ ἄν καταλληλότερον, εἰ οὕτως εἶχεν ἡ γραφὴ ῾ὥστε ἀμφότερα τὰ μέρη τοῦΑ κινούμενα κινεῖν᾿.	εἰμί  ἄν  , εἰ οὕτως ἔχω ὁ γραφή  ἀμφότερος ὁ μέρος ὁ Α κινέω  .
1112019	tlg4034.tlg003.opp-grc1	οὐ γὰρ τὸ πνεῦμα μόνον κινεῖται, ἀλλὰ καὶ ἡ καρδία.	οὐ γάρ ὁ πνεῦμα μόνος κινέω , ἀλλά καί ὁ καρδία .
1112020	tlg4034.tlg003.opp-grc1	δεῖ τι ἄρα εἶναι παρὰ ταύτας τὰς ἀρχὰς ἕτερόν τι, ὅπερ κινήσει μὴ κινούμενον.	δέω τι ἄρα εἰμί παρά οὗτος ὁ ἀρχή   , ὅς κινέω μή κινέω .
1112021	tlg4034.tlg003.opp-grc1	ὡς γὰρ οἱ ἀπερείδοντες τὰ νῶτα καὶ κινοῦντες τὰ σκέλη ἄλλο τι ἔχουσιν ἐν αὑτοῖς τὸ κινοῦν τὰ σκέλη, οὕτω κἀνταῦθα εἷναι δεῖ τι ἄλλο παρὰ τὸ κινοῦν κινούμενον καὶ αὐτό.	ὡς γάρ ὁ  ὁ νῶτον καί κινέω ὁ σκέλος ἄλλος τις ἔχω ἐν ἑαυτοῦ ὁ  ὁ σκέλος , οὕτως ἐνταῦθα ἵημι δέω τις ἄλλος παρά ὁ  κινέω καί αὐτός .
1112022	tlg4034.tlg003.opp-grc1	ἀναλογεῖ δὲ τοῖς μὲν νώτοις τὸ δεξιὸν καὶ ἀριστερὸν τῆς καρδίας καὶ τοῦ πνεύματος, τοῖς δὲ σκέλεσι τὰ ΒΓ νεῦρα.	δέ ὁ μέν νῶτον ὁ δεξιός καί ἀριστερός ὁ καρδία καί ὁ πνεῦμα , ὁ δέ σκέλος ὁ  νεῦρον .
1112023	tlg4034.tlg003.opp-grc1	Κατὰ μὲν οὖν τὸν λόγον τὸν λέγοντα τὴν αἰτίαν τῆς κινήσεώς ἐστιν ἡ ὄρεξις τὸ μέσον, ὃ κινεῖ κινούμενον.	κατά μέν οὖν ὁ λόγος ὁ λέγω ὁ αἰτία ὁ  εἰμί ὁ ὄρεξις ὁ μέσος , ὅς κινέω κινέω .
1112024	tlg4034.tlg003.opp-grc1	Τὸ λεγόμενόν ἐστιν ὅτι κατὰ τὸν λόγον τὸν λέγοντα καὶ δεικνύντα τὸ αἴτιον τῆς κινήσεως φαίνεται ὅτι ἡ ὄρεξίς ἐστιν, ἥτις ἀκίνητος οὖσα, ἐπεὶ καὶ πᾶσα ἡ ψυχὴ ἀκίνητος, ἧς αὕτη μέρος ἢ δύναμις οὖσα τυγχάνει, ἥτις δὴ ἀκίνητος οὖσα κινεῖ τὸ κινούμενον καὶ κινοῦν.	εἰμί ὅτι2 κατά ὁ λόγος ὁ λέγω καί δείκνυμι ὁ αἴτιος ὁ κίνησις φαίνω ὅτι2 ὁ  εἰμί , ὅστις ἀκίνητος εἰμί , ἐπεί καί πᾶς ὁ ψυχή ἀκίνητος , ὅς οὗτος μέρος τίη δύναμις εἰμί τυγχάνω , ὅστις δή ἀκίνητος εἰμί κινέω ὁ κινέω καί  .
1112025	tlg4034.tlg003.opp-grc1	τοῦτο γὰρ δεῖ προσυπακούειν·	οὗτος γάρ δέω ὑπακούω ·
1112026	tlg4034.tlg003.opp-grc1	τὸ γὰρ πνεῦμα καὶ ἡ καρδία κινούμενα κινοῦσι.	ὁ γάρ πνεῦμα καί ὁ καρδία κινέω κινέω .
1112027	tlg4034.tlg003.opp-grc1	δύναταί τις τοῦ ὃ κινεῖ κινούμενον καὶ ἐπὶ τῆς ὀρέξεως ἀκούειν.	τις ὁ ὅς κινέω κινέω καί ἐπί ὁ ὄρεξις ἀκούω .
1112028	tlg4034.tlg003.opp-grc1	εἰ γὰρ καὶ μὴ κινεῖται ἡ ὄρεξις( τὰ γὰρ εἴδη ἀκίνητα) ἀλλ’ οὗν διεγείρεται ὑπὸ ὀρεκτῶν,| ἵν’ ᾖ τὸ κινούμενον ἀντὶ τοῦ‘ διεγειρόμενον καὶ ἐπιτήδειον γινόμενον πρὸς τὸ κινῆσαι τὸ ζῷον᾿.	γάρ καί μή κινέω ὁ ὄρεξις ( ὁ γάρ εἶδος ἀκίνητος ) ἀλλά   ὑπό  , |  εἰμί ὁ κινέω ἀντί ὁ ‘  καί ἐπιτήδειος  πρός ὁ κινέω ὁ  .
1112029	tlg4034.tlg003.opp-grc1	ἢ τὸ λεγόμενόν ἐστι διὰ τοῦ ὃ κινεῖ κινούμενον‘ κατὰ τὸν τοιοῦτον λόγον δόξειεν ἄν τὸ κινοῦν κινούμενον ὅτι ἡ ὄρεξίς ἐστιν·	τίη ὁ  εἰμί διά ὁ ὅς κινέω κινέω ‘ κατά ὁ τοιοῦτος λόγος δοκέω ἄν ὁ  κινέω ὅτι2 ὁ  εἰμί ·
1112030	tlg4034.tlg003.opp-grc1	οὐκ ἔστι δὲ αὕτη, ἀλλὰ δεῖ εἶναι σῶμά τι, ὃ κινεῖ κινούμενον καὶ αὐτό᾿.	οὐ εἰμί δέ οὗτος , ἀλλά δέω εἰμί σῶμα  , ὅς κινέω κινέω καί  .
1112031	tlg4034.tlg003.opp-grc1	Τὸ μὲν οὖν κινούμενον, μὴ πεφυκὸς δὲ κινεῖν δύναται πάσχειν κατὰ ἀλλοτρίαν δύναμιν.	μέν οὖν κινέω , μή φύω δέ κινέω δύναμαι πάσχω κατά ἀλλότριος δύναμις .
1112032	tlg4034.tlg003.opp-grc1	Πανάληθες καὶ τοῦτο·	καί οὗτος ·
1112033	tlg4034.tlg003.opp-grc1	πᾶν γὰρ ὃ κινεῖται μόνον, οὐ πέφυκε δὲ κινεῖν, πάσχει κατὰ τὴν τοῦ κινοῦντος δύναμιν καὶ ἄγεται ὡς ἄν ἐκεῖνο ἄγῃ.	πᾶς γάρ ὅς κινέω μόνος , οὐ φύω δέ κινέω , πάσχω κατά ὁ ὁ κινέω δύναμις καί ἄγω ὡς ἄν ἐκεῖνος ἄγω .
1112034	tlg4034.tlg003.opp-grc1	τοιοῦτον δέ τί ἐστι καὶ πᾶν σῶμα ζῴου·	τοιοῦτος δέ τίς εἰμί καί πᾶς σῶμα ζῷον ·
1112035	tlg4034.tlg003.opp-grc1	κατὰ γὰρ τὴν ψυχὴν καὶ αὐτὸ κινεῖται, ὥσπερ ὁ ὀρχηστὴς κατὰ τὴν ὄρχησιν.	κατά γάρ ὁ ψυχή καί αὐτός κινέω , ὥσπερ ὁ ὀρχηστής κατά ὁ ὄρχησις .
1112036	tlg4034.tlg003.opp-grc1	σαφῆ δὲ τὰ ἑξῆς.	σαφής δέ ὁ ἑξῆς .
1112037	tlg4034.tlg003.opp-grc1	περὶ δὲ τῆς τοῦ πνεύματος σωτηρίας οἰκεῖον ἦν εἰπεῖν ἐν τοῖς Περὶ τροφῆς.	περί δέ ὁ ὁ πνεῦμα σωτηρία οἰκεῖος εἰμί λέγω ἐν ὁ περί τροφή .
1112038	tlg4034.tlg003.opp-grc1	λέγει δ᾿ ἔχειν τὸ τοιοῦτον πνεῦμα πρὸς τὴν ψυχὴν ὥσπερ τὸ κινοῦν καὶ κινούμενον μέρος ἐν ταῖς καμπαῖς πρὸς τὸ ἀκίνητον.	λέγω  ἔχω ὁ  πνεῦμα πρός ὁ ψυχή ὥσπερ ὁ  καί κινέω μέρος ἐν ὁ καμπή πρός ὁ ἀκίνητος .
1112039	tlg4034.tlg003.opp-grc1	ὥσπερ δὲ οὐ τὰ μέρη ἀεὶ τὰ αὐτά ἐστιν, ἀλλ᾿ ἐν κινήσει( ἐν ἐπιρροῇ γὰρ καὶ οὕτως καὶ τὸ σύμφυτον πνεῦμα.	ὥσπερ δέ οὐ ὁ μέρος ἀεί ὁ αὐτός εἰμί ,  ἐν κινέω ( ἐν ἐπιρροή γάρ καί οὕτως καί ὁ σύμφυτος πνεῦμα .
1112040	tlg4034.tlg003.opp-grc1	Δεῖ δὲ τὸ μέλλον κινεῖν μὴ ἀλλοιώσει τοιοῦτον εἶναι.	δεῖ δέ ὁ μέλλω κινέω μή  τοιοῦτος εἰμί .
