id	filename	tokens	lemmas
762478	tlg4015.tlg001.opp-grc1	6a15 Ἐοίκασι δὲ καὶ τὸν τῶν ἄλλων ἐναντίων ὁρισμὸν ἀπὸ τούτων ἐπιφέρειν·	δέ καί ὁ ὁ ἄλλος ἐναντίος ὁρισμός ἀπό οὗτος ἐπιφέρω ·
762479	tlg4015.tlg001.opp-grc1	τὰ γὰρ πλεῖστον ἀλλήλων διεστηκότα τῶν ἐν τῷ αὐτῷ γένει ἐναντία ὁρίζονται.	ὁ γάρ πλεῖστος ἀλλήλων διΐστημι ὁ ἐν ὁ αὐτός γένος ἐναντίος ὁρίζω .
762480	tlg4015.tlg001.opp-grc1	᾿Επειδὴ κάτω, φησί, τὴν γῆν ὑπενόησαν εἶναι, αὕτη δὲ ὡς πρὸς ἕκαστον τοῦ κόσμου πέρας τὴν πλείστην διάστασιν διέστηκε, λέγω δὴ τὴν καιὰ διάμετρον, ἐναντίον δὲ τῷ ἄνω τὸ κάτω, ὑφ’ ἓν δὲ γένος ἀνάγονται ταῦτα τὸ ποσόν, ἐκ τούτων καὶ πᾶσι τοῖς ἐναντίοις τὸν ὁρισμὸν ἐπιφέρου- σιν ἐναντία λέγοντες εἶναι τὰ πλεῖστον ἀλλήλων διεστηκότα τῶν ὑπὸ τὸ αὐτὸ γένος.	κάτω , φημί , ὁ γῆ ὑπονοέω εἰμί , οὗτος δέ ὡς πρός ἕκαστος ὁ  πέρας ὁ πλεῖστος διάστασις διΐστημι , λέγω δή ὁ  διάμετρος , ἐναντίος δέ τῷ ἄνω2 ὁ κάτω , ὑπό  δέ γένος ἀνάγω οὗτος ὁ ποσός , ἐκ οὗτος καί πᾶς ὁ ἐναντίος ὁ ὁρισμός  -  ἐναντίος λέγω εἰμί ὁ πλεῖστος ἀλλήλων διΐστημι ὁ ὑπό ὁ αὐτός γένος .
762481	tlg4015.tlg001.opp-grc1	p.	.
762482	tlg4015.tlg001.opp-grc1	6a19 οὐ δοκεῖ δὲ τὸ ποσὸν ἐπιδέχεσθαι τὸ μᾶλλον καὶ τὸ ἦττον.	οὐ δοκέω δέ ὁ  ἐπιδέχομαι ὁ μᾶλλον καί ὁ  .
762483	tlg4015.tlg001.opp-grc1	Εἰπὼν ὅτι ἴδιον τοῦ ποσοῦ τὸ μηδὲν ἔχειν ἐναντίον καὶ δείξας ὅτι παντὶ τοῦτο ὑπάρχει, οὐ προσέθηκεν ΄οὐκ ἴδιον δὲ τοῦτο τοῦ ποσοῦ, ὅτι καὶ τῇ οὐσίᾳ ὑπάρχει’, ὥσπερ καὶ ἐπὶ τῆς οὐσίας ἐποίησε·	ὅτι2 ἴδιος ὁ  ὁ  ἔχω ἐναντίος καί δείκνυμι ὅτι2  οὗτος ὑπάρχω , οὐ προστίθημι  ἴδιος δέ οὗτος ὁ  , ὅτι2 καί ὁ οὐσία ὑπάρχω ’ , ὥσπερ καί ἐπί ὁ οὐσία ποιέω ·
762484	tlg4015.tlg001.opp-grc1	δῆλον γὰρ τοῦτο ἦν ἐκ τῶν περὶ τῆς οὐσίας εἰρημένων·	δῆλος γάρ οὗτος εἰμί ἐκ ὁ περί ὁ οὐσία λέγω ·
762485	tlg4015.tlg001.opp-grc1	εἰ γὰρ ἐκεῖ ἔλεγεν ὅτι οὐκ ἴδιον δὲ τῆς οὐσίας τὸ μηδὲν ἔχειν ἐναντίον, ὅτι καὶ τῷ ποσῷ ὑπάρχει’, δῆλον ὅτι κἀνταῦθα οὐκ διιὸν ἔσται τοῦ ποσοῦ, ὅτι καὶ τῇ οὐσίᾳ ὑπάρχει·	εἰ γάρ ἐκεῖ λέγω ὅτι2 οὐ ἴδιος δέ ὁ οὐσία ὁ  ἔχω ἐναντίος , ὅτι2 καί τῷ ποσός  , δῆλος ὅτι2 ἐνταῦθα οὐ   ὁ  , ὅτι2 καί ὁ οὐσία ὑπάρχω ·
762486	tlg4015.tlg001.opp-grc1	ὥστε τῶ ποσῷ οὐδέν ἐστιν ἐναντίον, ἀλλ’ εἰ ἄρα, δεῖ λέγειν ὅτι τὸ ποσὸν τῶν ἐναντίων ἐστὶ δεκτικόν, ὥσπερ ἐλέγομεν καὶ τῇ οὐσία μηδὲν μὲν εἶναι ἐναντίον, αὐτὴν δὲ τῶν ἐναντίων εἶναι δεκτικήν.	ὥστε τῷ   εἰμί ἐναντίος , ἀλλά εἰ ἄρα , δέω λέγω ὅτι2 ὁ  ὁ ἐναντίος εἰμί δεκτικός , ὥσπερ  καί ὁ   μέν εἰμί ἐναντίος , αὐτός δέ ὁ ἐναντίος εἰμί  .
762487	tlg4015.tlg001.opp-grc1	τί οὖν, φασίν, οὐκ ἔστι τὸ παχὺ καὶ τὸ λεπτὸν τοῦ ποσοῦ καὶ τὸ πλατὺ καὶ τὸ στενόν,| ἅπερ ἐναντία ἐστίν;	τίς οὖν , φημί , οὐ εἰμί ὁ παχύς καί ὁ λεπτός ὁ  καί ὁ πλατύς καί ὁ  , |  ἐναντίος εἰμί ;
762488	tlg4015.tlg001.opp-grc1	ἀλλὰ λέγομεν ὅτι ταῦτα οὔκ εἰσι ποσὰ ἀλλ’ ἐν ποσοῖς ἔχει τὸ εἶναι, ὥσπερ καὶ τὸ μέγα καὶ τὸ μικρόν·	ἀλλά λέγω ὅτι2 οὗτος οὐ εἰμί  ἀλλά ἐν  ἔχω ὁ εἰμί , ὥσπερ καί ὁ μέγας καί ὁ μικρός ·
762489	tlg4015.tlg001.opp-grc1	παχὺ γὰρ λέγομεν τὸ πολλὴν ἔχον τὴν κατὰ βάθος διάστασιν, καὶ πλατὺ τὸ τὴν κατὰ πλάτος, στενὸν δὲ καὶ λεπτὸν τὸ ὀλίγην ἔχον τὴν κατά τε βάθος καὶ πλάτος διάστασιν.	παχύς γάρ λέγω ὁ πολύς ἔχω ὁ κατά βάθος διάστασις , καί  ὁ ὁ κατά πλάτος , στενός δέ καί λεπτός ὁ ὀλίγος ἔχω ὁ κατά τε βάθος καί πλάτος διάστασις .
762490	tlg4015.tlg001.opp-grc1	καὶ ὅσα δὲ περὶ τῶν ἄλλων εἰρήκαμεν, μεγάλου λέγω καὶ μικροῦ καὶ πολλοῦ καὶ ὀλίγου, ταῦτα καὶ ἐπὶ τούτων ἐροῦμεν·	καί  δέ περί ὁ  λέγω , μέγας λέγω καί μικρός καί πολύς καί  , οὗτος καί ἐπί οὗτος ἐρέω ·
762491	tlg4015.tlg001.opp-grc1	καὶ γὰρ ταῦτα τῶν πρός τί ἐστιν.	καί γάρ οὗτος ὁ πρός τι εἰμί .
762492	tlg4015.tlg001.opp-grc1	p.	.
762493	tlg4015.tlg001.opp-grc1	6a19 Οὐ δοκεῖ δὲ τὸ ποσὸν ἐπιδέχεσθαι τὸ μᾶλλον καὶ τὸ ἧττον.	οὐ δοκέω δέ ὁ  ἐπιδέχομαι ὁ μᾶλλον καί ὁ ἥσσων .
762494	tlg4015.tlg001.opp-grc1	Ἐπ΄ ἄλλο μεταβέβηκεν ἴδιον τοῦ ποσοῦ, τὸ μὴ ἐπιδέχεσθαι τὸ μᾶλλον καὶ τὸ ἧττον.	ἄλλος μεταβαίνω ἴδιος ὁ  , ὁ μή ἐπιδέχομαι ὁ μᾶλλον καί ὁ ἥσσων .
762495	tlg4015.tlg001.opp-grc1	καὶ τοῦτο εἰκότως·	καί οὗτος εἰκός ·
762496	tlg4015.tlg001.opp-grc1	εἴρηται γὰρ ὅτι ὅπου ἐστὶν ἡ ἐναωτιότης, ἐκεῖ καὶ τὸ μᾶλλον καὶ τὸ ἧττον ἐκ τῆς τῶν ἐναντίων μίξεως γίνεται.	λέγω γάρ ὅτι2 ὅπου εἰμί ὁ  , ἐκεῖ καί ὁ μᾶλλον καί ὁ  ἐκ ὁ ὁ ἐναντίος μίξις γίγνομαι .
762497	tlg4015.tlg001.opp-grc1	ἰστέον δὲ ὅτι καὶ τοῦτο πάλιν ἀποδοκιμάζει ὡς καὶ τῇ οὐσίᾳ ὑπάρ- χον, καὶ ἐφ’ ἕτερον ἴδιον μεταβαίνει καί φησιν·	οἶδα δέ ὅτι2 καί οὗτος πάλιν ἀποδοκιμάζω ὡς καί ὁ οὐσία  -  , καί ἐπί ἕτερος ἴδιος μεταβαίνω καί φημί ·
762498	tlg4015.tlg001.opp-grc1	p.	.
762499	tlg4015.tlg001.opp-grc1	6a26 ἴδιον δὲ μάλιστα τοῦ ποσοῦ τὸ ἴσον τε καὶ ἄνι’ λέγεσθαι.	ἴδιος δέ μάλιστα ὁ  ὁ ἴσος τε καί  λέγω .
762500	tlg4015.tlg001.opp-grc1	| Τοῦτο κυρίως ἴδιόν ἐστι τοῦ ποσοῦ, ἐπειδὴ καὶ μόνῳ ὑπάρχει καὶ παντί.	| οὗτος κύριος ἴδιος εἰμί ὁ  , ἐπεί καί μόνος  καί  .
762501	tlg4015.tlg001.opp-grc1	γραμμὴ γὰρ γραμμῇ ἴση τε καὶ ἄνισος λέγεται καὶ τόπος τόπῳ καὶ ἐπιφάνεια ἐπιφανείᾳ καὶ σῶμα σώματι καὶ χρόνος χρόνῳ καὶ λόγος λόγῳ καὶ ἀριθμὸς ἀριθμῷ.	γραμμή γάρ γραμμή ἴσος τε καί ἄνισος λέγω καί τόπος τόπος καί  ἐπιφάνεια καί σῶμα σῶμα καί χρόνος χρόνος καί λόγος λόγος καί ἀριθμός ἀριθμός .
762502	tlg4015.tlg001.opp-grc1	ἐὰν δὲ ἐπ’ ἄλλου τινὸς λέγωμεν τὸ ἴσον καὶ ἄνισον, οὐ καθ’ αὑτὸ ἀλλὰ κατὰ συμβεβηκός·	ἐάν δέ ἐπί ἄλλος  λέγω ὁ ἴσος καί  , οὐ κατά ἑαυτοῦ ἀλλά κατά  ·
762503	tlg4015.tlg001.opp-grc1	οἷον λέγομεν ὅτι ἴσον ἐστὶ τοῦτο τὸ λευκὸν σῶμα τούτῳ τῷ λευκῷ σώματι, καὶ ἄνισον δὲ ὡσαύτως, οὐ καθὸ δὲ λευκὰ ἀλλὰ καθὸ σώματα, ἅπερ ἐστὶ τοῦ ποσοῦ.	οἷος λέγω ὅτι2 ἴσος εἰμί οὗτος ὁ λευκός σῶμα οὗτος ὁ λευκός σῶμα , καί  δέ ὡσαύτως , οὐ  δέ λευκόν ἀλλά  σῶμα , ὅς εἰμί ὁ  .
762504	tlg4015.tlg001.opp-grc1	ἀλλὰ μᾶλλον τὸ ὅμοιον καὶ τὸ ἀνόμοιον ἐπὶ τῶν τοιούτων ῥηθείη κυρίως·	ἀλλά μᾶλλον ὁ ὅμοιος καί ὁ ἀνόμοιος ἐπί ὁ τοιοῦτος ἐρῶ κύριος ·
762505	tlg4015.tlg001.opp-grc1	λευκὸν γὰρ λευκῷ ὅμοιον καὶ ἀνόμοιον λέγεται, καὶ ἐπὶ τῶν τοιούτων ὡσαύτως.	λευκός γάρ λευκός ὅμοιος καί ἀνόμοιος λέγω , καί ἐπί ὁ τοιοῦτος ὡσαύτως .
762506	tlg4015.tlg001.opp-grc1	Περὶ τῶν πρός τι.	περί ὁ πρός τις .
762507	tlg4015.tlg001.opp-grc1	p.	.
762508	tlg4015.tlg001.opp-grc1	6a36 Πρός τι δὲ τὰ τοιαῦτα λέγεται, ὅσα αὐτὰ ἅπερ ἐστὶν ἑτέρων εἶναι λέγεται.	τις δέ ὁ τοιοῦτος λέγω , ὅσος αὐτός ὅς εἰμί ἕτερος εἰμί λέγω .
762509	tlg4015.tlg001.opp-grc1	| Πρὸ τῆς τῶν πρός τι διδασκαλίας πέντε ταῦτα χρὴ ζητεῖν·	πρό ὁ ὁ πρός τις διδασκαλία πέντε οὗτος χρή ζητέω ·
762510	tlg4015.tlg001.opp-grc1	πρῶτον τὴν τάξιν αὐτῶν τὴν πρὸς τὰς κατηγορίας, δεύτερον τὴν αἰτίαν τῆς ἐπιγραφῆς, τρίτον τὴν ὑπόστασιν αὐτῶν τίς ἐστι, τέταρτον τὴν εἰς τὰ εἴδη διαίρεσιν, πέμπτον τὸν τρόπον τῆς διδασκαλίας.	ὁ τάξις αὐτός ὁ πρός ὁ κατηγορία , δεύτερος ὁ αἰτία ὁ ἐπιγραφή , τρίτος ὁ ὑπόστασις αὐτός τις εἰμί , τέταρτος ὁ εἰς ὁ εἶδος  , πέμπτος ὁ τρόπος ὁ διδασκαλία .
762511	tlg4015.tlg001.opp-grc1	πρῶτον οὖν τὴν τάξιν·	πρῶτος οὖν ὁ τάξις ·
762512	tlg4015.tlg001.opp-grc1	διὰ ποίαν αἰτίαν μετὰ τὸν τοῦ ποσοῦ λόγον ἔταξε τὸν περὶ τῶν πρός τι καὶ μὴ τὸν περὶ τοῦ ποιοῦ, καίτοι γε τὸ ποιὸν εἶδός τι καθ’ αὑτὸ ἔχει καὶ ὑπόστασιν, ταῦτα δὲ ἰδίαν οὐκ ἔχει ὑπόστασιν ἀλλ’ ἐν ταῖς ἄλλαις κατηγορίαις ἔχει τὸ εἶναι, τιμιώτερα δὲ τὰ καθ’ αὑτὰ ὑφεστηκότα τῶν ἐν σχέσει μόνῃ τὸ εἶναι ἐχόντων·	διά ποιός αἰτία μετά ὁ ὁ  λόγος τάσσω ὁ περί ὁ πρός τις καί μή ὁ περί ὁ  ,  γε ὁ  εἶδος τις κατά ἑαυτοῦ ἔχω καί ὑπόστασις , οὗτος δέ ἴδιος οὐ ἔχω ὑπόστασις ἀλλά ἐν ὁ ἄλλος κατηγορία ἔχω ὁ εἰμί , τίμιος δέ ὁ κατά   ὁ ἐν σχέσις μόνος ὁ εἰμί ἔχω ·
762513	tlg4015.tlg001.opp-grc1	δεῖ γὰρ αὐτό τι πρῶτον καθ’ αὑτὸ εἶναι, εἶθ’ οὕτως τὴν πρὸς ἕτερον ἀναλαβεῖν σχέσιν.	δέω γάρ  τις πρῶτος κατά  εἰμί ,  οὕτως ὁ πρός ἕτερος ἀναλαμβάνω σχέσις .
762514	tlg4015.tlg001.opp-grc1	λέγομεν οὖν ὅτι ὥσπερ ἐπὶ τοῦ ποσοῦ ἐποίησε καὶ δευτέραν ἔταξε τὴν περὶ τούτου διδασκαλίαν, διὰ τὸ μνημονεῦσαι αὐτοῦ ἐν τῷ περὶ τῆς οὐσίας λόγῳ, ἵνα μὴ ἐπὶ πολὺ ἐάσῃ τὸν ἀκροατὴν ἀγνοοῦντα τί ποτέ ἐστι τὸ ποσόν, οὕτω καὶ ἐνταῦθα ποιεῖ.	λέγω οὖν ὅτι2 ὥσπερ ἐπί ὁ  ποιέω καί δεύτερος τάσσω ὁ περί οὗτος διδασκαλία , διά ὁ μνημονεύω αὐτός ἐν τῷ περί ὁ οὐσία λόγος , ἵνα μή ἐπί πολύς ἐάω ὁ ἀκροατής ἀγνοέω τι ποτε εἰμί ὁ ποσός , οὕτως καί ἐνταῦθα ποιέω .
762515	tlg4015.tlg001.opp-grc1	ἐπειδὴ γὰρ ἐν τῷ περὶ τοῦ ποσοῦ λόγῳ ἐμνήσθη τῶν πρός τι, ἔνθα ἔλεγε τὸ μέγα καὶ τὸ μικρὸν καὶ τὸ πολὺ καὶ τὸ ὀλίγον τῶν πρός τι εἶναι, ἵνα μὴ ἐπὶ πολὺ ἐάσῃ ἡμᾶς ἀγνοοῦντας τίς ἡ φύσις τῶν πρός τι, εὐθέως τὸν περὶ τούτων ποιεῖται λόγον.	ἐπεί γάρ ἐν ὁ περί ὁ  λόγος μιμνήσκω ὁ πρός τι , ἔνθα λέγω ὁ μέγας καί ὁ μικρός καί ὁ πολύς καί ὁ ὀλίγος ὁ πρός τι εἰμί , ἵνα μή ἐπί πολύς ἐάω ἐγώ ἀγνοέω τις ὁ φύσις ὁ πρός τι , εὐθύς ὁ περί οὗτος ποιέω λόγος .
762516	tlg4015.tlg001.opp-grc1	διὰ τί δὲ ἐπιγέγραπται Περὶ τῶν πρός τι καὶ μὴ περὶ τοῦ πρός τι, ὥστε εἶναι τὴν ἐπιγραφὴν ἑνικήν;	διά τίς δέ ἐπιγράφω περί ὁ πρός τις καί μή περί ὁ πρός τι , ὥστε εἰμί ὁ ἐπιγραφή  ;
762517	tlg4015.tlg001.opp-grc1	λέγομεν ἐπειδὴ τὰ πρός τι σχέσις τίς ἐστιν, ἡ δὲ σχέσις τοὐλάχιστον ἐν δύο πράγμασι θεωρεῖται, διὰ τοῦτο πληθυντικῶς ἐπέγραψε·	λέγω ἐπεί ὁ πρός τις σχέσις τις εἰμί , ὁ δέ σχέσις ἐλάχιστος ἐν γε πρᾶγμα θεωρέω , διά οὗτος πληθυντικός ἐπιγράφω ·
762518	tlg4015.tlg001.opp-grc1	τὸ γὰρ δεξιὸν ἀριστεροῦ ἐστι δεξιὸν καὶ οὐκ ἄν τι εἴη αὐτὸ καθ’ αὑτὸ δεξιόν, καὶ ὁ πατὴρ υἱοῦ πατὴρ καὶ οὐκ ἄν τις καθ’ αὑτὸν εἴη πατὴρ μὴ πρὸς υἱὸν λεγόμενος.	ὁ γάρ δεξιός ἀριστερός εἰμί δεξιός καί οὐ ἄν  εἰμί αὐτός κατά ἑαυτοῦ δεξιός , καί ὁ πατήρ υἱός πατήρ καί οὐ ἄν τις κατά ἑαυτοῦ εἰμί πατήρ μή πρός υἱός λέγω .
762519	tlg4015.tlg001.opp-grc1	ἐπὶ δὲ τῆς οὐσίας| δυνατόν, μᾶλλον δὲ ἀναγκαῖον ἓν πρᾶγμα καθ’ αὑτὸ εἷναι οὐσίαν, οἷον ἄνθρωπον.	ἐπί δέ ὁ οὐσία | δυνατός , μᾶλλον δέ ἀναγκαῖος  πρᾶγμα κατά ἑαυτοῦ ἵημι οὐσία , οἷος ἄνθρωπος .
762520	tlg4015.tlg001.opp-grc1	ὁμοίως δὲ καὶ ἐπὶ τοῦ ποσοῦ.	ὅμοιος δέ καί ἐπί ὁ  .
762521	tlg4015.tlg001.opp-grc1	δυνατὸν γὰρ τὸ δίπηχυ μόνον ποσὸν λέγεσθαι.	δυνατός γάρ ὁ  μόνος  λέγω .
762522	tlg4015.tlg001.opp-grc1	δυνατὸν δὲ καὶ αὐτὰ μὲν τὰ πράγματα ῾τὰ περὶ τῶν πρός τῖ’ λέγεσθαι πληθυντικῶς, αὐτὴν δὲ τὴν κατηγορίαν ἑνικῶς ῾περὶ τοῦ πρός τῖ’, ὥσπερ καὶ ἐπὶ τοῦ ποσοῦ καὶ ἄλλων κατηγοριῶν ἑνικῶς προσφερόμεθα τὴν κατηγορίαν, δηλοῦντες διὰ τῆς ἐπιγραφῆς οὐ τὰ πράγματα τὰ ἐν αὐτῇ, ἀλλὰ τὴν κοινῶς κατ’ αὐτῶν λεγομένην φύσιν, ἐπεὶ καὶ ἡ σχέσις εἰ καὶ ἐν πλείοσίν ἐστιν, ἀλλ’ οὖν μία τίς ἐστι τῷ ὑποκειμένῳ, ὡς καὶ τὸ σπέρμα καὶ ὁ καρπὸς καὶ ἡ ἀνάβασις καὶ ἡ κατάβασις·	δυνατός δέ καί αὐτός μέν ὁ πρᾶγμα  περί ὁ πρός  λέγω πληθυντικός , αὐτός δέ ὁ κατηγορία ἑνικός  ὁ πρός  , ὥσπερ καί ἐπί ὁ  καί ἄλλος κατηγορία ἑνικός  ὁ κατηγορία , δηλόω διά ὁ ἐπιγραφή οὐ ὁ πρᾶγμα ὁ ἐν αὐτός , ἀλλά ὁ κοινός κατά αὐτός λέγω φύσις , ἐπεί καί ὁ σχέσις εἰ καί ἐν  εἰμί , ἀλλά οὖν  τις εἰμί τῷ  , ὡς καί ὁ σπέρμα καί ὁ καρπός καί ὁ ἀνάβασις καί ὁ κατάβασις ·
762523	tlg4015.tlg001.opp-grc1	μία γὰρ ἡ σχέσις τοῦ δούλου πρὸς τὸν δεσπότην, ἥτις ἀρχομένων μὲν ἡμῶν ἀπὸ τοῦ δούλου δουλεία λέγεται ἀπὸ δὲ τοῦ δεσπότου δεσποτεία.	γάρ ὁ σχέσις ὁ δοῦλος πρός ὁ δεσπότης , ὅστις ἄρχω μέν ἐγώ ἀπό ὁ δοῦλος δουλεία λέγω ἀπό δέ ὁ δεσπότης δεσποτεία .
762524	tlg4015.tlg001.opp-grc1	ὁμοίως καὶ ἐπὶ μαθητοῦ καὶ διδασκάλου καὶ τῶν λοιπῶν.	ὅμοιος καί ἐπί  καί διδάσκαλος καί ὁ λοιπός .
762525	tlg4015.tlg001.opp-grc1	ἀλλ’ ἵνα, ὡς εἴπομεν, ἐνδείξηται ὅτι ἡ τῶν πρός τι κατηγορία οὐδέποτε ἐν ἑνὶ πράγματι ὑφίσταται, διὰ τοῦτο πληθυντικῶς Περὶ τῶν πρός τι τὴν ἐπιγραφὴν πεποίηται.	ἀλλά ἵνα , ὡς λέγω ,  ὅτι2 ὁ ὁ πρός τις κατηγορία οὐδέποτε ἐν  πρᾶγμα ὑφίστημι , διά οὗτος πληθυντικός περί ὁ πρός τις ὁ ἐπιγραφή ποιέω .
762526	tlg4015.tlg001.opp-grc1	Περὶ δὲ τῆς ὑποστάσεως ταῦτά φαμεν·	δέ ὁ ὑπόστασις οὗτος φημί ·
762527	tlg4015.tlg001.opp-grc1	τινές φασι μηδὲν εἶναι τῶν πρός τι φύσει, ἀλλὰ ἀνάπλασμα εἶναι ταῦτα τῆς ἡμετέρας διανοίας, λέγοντες ὅτι οὕτως οὐκ ἔστι φύσει τὰ πρός τι ἀλλὰ θέσει, ὅτι δυνατὸν καὶ τὸν δεξιὸν ἀριστερὸν γενέσθαι καὶ τὸν ἀριστερὸν δεξιόν, καὶ ὁ πατὴρ καὶ υἱός ἐστι καὶ ὁ δοῦλος θέσει δοῦλος·	τις φημί  εἰμί ὁ πρός τις φύσις , ἀλλά  εἰμί οὗτος ὁ ἡμέτερος διάνοια , λέγω ὅτι2 οὕτως οὐ εἰμί φύσις ὁ πρός τις ἀλλά  , ὅτι2 δυνατός καί ὁ δεξιός ἀριστερός γίγνομαι καί ὁ ἀριστερός δεξιός , καί ὁ πατήρ καί υἱός εἰμί καί ὁ δοῦλος θέσις δοῦλος ·
762528	tlg4015.tlg001.opp-grc1	οὐδεὶς γάρ ἐστι φύσει δοῦλος·	γάρ εἰμί φύσις δοῦλος ·
762529	tlg4015.tlg001.opp-grc1	ὁ αὐτὸς γὰρ καὶ δεσπότης κατὰ ταὐτὸν ἑτέρου γένοιτ’ ἄν.	ὁ αὐτός γάρ καί δεσπότης κατά αὐτός ἕτερος  ἄν .
762530	tlg4015.tlg001.opp-grc1	οὗτοι δὲ οὐκ ὀρθῶς λέγουσιν·	οὗτος δέ οὐ ὀρθός λέγω ·
762531	tlg4015.tlg001.opp-grc1	οὕτω γὰρ ἔγνωσται ταῦτα τῇ φύσει, ὡς καὶ τὰ μόρια τοῦ σώματος ἐν σχέσει τινὶ τῇ πρὸς ἄλληλα θεωρεῖται·	οὕτως γάρ γιγνώσκω οὗτος ὁ φύσις , ὡς καί ὁ μόριον ὁ σῶμα ἐν σχέσις  ὁ πρός ἀλλήλων θεωρέω ·
762532	tlg4015.tlg001.opp-grc1	τὸ μὲν γάρ τι ὑπὸ τῆς φύσεως δεξιὸν τέτακται οἷον τὸ ἧπαρ, τὸ δέ τι ἀριστερὸν οἷον ὁ σπλήν, καὶ οὐκ ἄν ποτε γένοιτο οὔτε τὸ ἧπαρ ἀριστερὸν οὔτε ὁ σπλὴν| δεξιός, ἀλλ’ εἰ ἀμειφθείη τούτων ἡ τάξις, διέφθαρται τὸ ζῷον.	ὁ μέν γάρ τις ὑπό ὁ φύσις δεξιός τάσσω οἷος ὁ ἧπαρ , ὁ δέ τι ἀριστερός οἷος ὁ  , καί οὐ ἄν ποτε γίγνομαι οὔτε ὁ ἧπαρ ἀριστερός οὔτε ὁ  | δεξιός , ἀλλά εἰ  οὗτος ὁ τάξις , διαφθείρω ὁ ζῷον .
762533	tlg4015.tlg001.opp-grc1	καὶ ὁ θεὸς ἄρχει μόνως ἡμεῖς δὲ πάντες ὑπ’ αὐτοῦ ἀρχόμεθα, καὶ ἡ ψυχὴ μόνως κινεῖ τὸ σῶμα καὶ ἡ φύσις, τὸ δὲ σῶμα μόνως κινεῖται ὑπ’ αὐτῶν καὶ οὐκ ἀντικινεῖ αὐτά.	καί ὁ  ἄρχω μόνος ἐγώ δέ πᾶς ὑπό αὐτός ἄρχω , καί ὁ ψυχή μόνος κινέω ὁ σῶμα καί ὁ φύσις , ὁ δέ σῶμα μόνος κινέω ὑπό αὐτός καί οὐ  αὐτός .
762534	tlg4015.tlg001.opp-grc1	τινὲς δὲ ἐκ διαμέτρου τούτοις ἔχοντες πάντα τὰ πράγματα πρός τι ἔλεγον, ὧν εἷς ἦν Πρωταγόρας ὁ σοφιστής·	δέ ἐκ διάμετρος οὗτος ἔχω πᾶς ὁ πρᾶγμα πρός τις λέγω , ὅς  εἰμί Πρωταγόρας ὁ σοφιστής ·
762535	tlg4015.tlg001.opp-grc1	ἔλεγε γὰρ οὗτος ὅτι οὐδὲν τῶν πραγμάτων ὡρισμένην ἔχει φύσιν, διὸ καὶ ἔλεγεν ὅτι οὐκ ἔστι τινὰ ψευδῆ λέγειν·	λέγω γάρ οὗτος ὅτι2  ὁ πρᾶγμα ὁρίζω ἔχω φύσις , διό καί λέγω ὅτι2 οὐ εἰμί  ψευδής λέγω ·
762536	tlg4015.tlg001.opp-grc1	ἕκαστος γὰρ κατὰ τὸ φαινόμενον αὐτῷ καὶ δοκοῦν περὶ τῶν πραγμάτων ἀποφαίνεται οὐκ ἐχόντων ὡρισμένην φύσιν ἀλλ’ ἐν τῇ πρὸς ἡμᾶς σχέσει τὸ εἶναι ἐχόντων·	ἕκαστος γάρ κατά ὁ φαίνω αὐτός καί δοκέω περί ὁ πρᾶγμα ἀποφαίνω οὐ ἔχω ὁρίζω φύσις ἀλλά ἐν ὁ πρός ἐγώ σχέσις ὁ εἰμί ἔχω ·
762537	tlg4015.tlg001.opp-grc1	τοιγαροῦν οἱ μὲν ἰκτε- ριῶντες τὸ μέλι φασὶ πικρὸν εἶναι καὶ ἀληθεύουσί γε( ὃ γὰρ δοκεῖ καὶ φαίνεται αὐτοῖς, τοῦτο καὶ λέγουσιν), οἱ δὲ ὑγιαίνοντες γλυκὺ καὶ αὐτοὶ ὁμοίως ἀληθεύοντες.	ὁ μέν  -  ὁ μέλι φημί πικρός εἰμί καί  γε ( ὁ γάρ δοκέω καί φαίνω αὐτός , οὗτος καί λέγω ) , ὁ δέ ὑγιαίνω  καί αὐτός ὅμοιος ἀληθεύω .
