id	filename	tokens	lemmas
1109573	tlg4034.tlg003.opp-grc1	ΣΧΟΛΙΑ EII TO ΠΡΩΤΟΝ ΤΩΝ ΠΕΡΙ ΖΩΩΝ ΜΟΡΙΩΝ ΜΙΧΑΗΛ TOY ΕΘΕΣΙΟΥ.	.
1109574	tlg4034.tlg003.opp-grc1	Ὥσρερ ἐν τοῖς ἠθικοῖς ἐπιγραφομένοις Νικομαχείοις πρότερον προεῖπε ποταπὰς δεῖ ζητεῖν τὰς ἀποδείξεις τὰς περὶ τὰ καλὰ καὶ τὰ δίκαια γινομένας, ὁποῖόν τε τὸν περὶ τούτων ἀκουσόμενον εἶναι χρή, ὅτι πεπαιδευμένον( κρίνει γάρ, φησὶν ἐν ἐκείνοις, ἕκαστος καλῶς ἃ γινώσκει, καὶ τούτων ἐστὶν ἀγαθὸς κριτής·	ἐν ὁ ἠθικός ἐπιγράφω  πρότερος προαγορεύω  δέω ζητέω ὁ ἀπόδειξις ὁ περί ὁ καλός καί ὁ δίκαιος  ,  τε ὁ περί οὗτος  εἰμί χρή , ὅτι2 παιδεύω ( κρίνω γάρ , φημί ἐν ἐκεῖνος , ἕκαστος καλός ὅς γιγνώσκω , καί οὗτος εἰμί ἀγαθός κριτής ·
1109575	tlg4034.tlg003.opp-grc1	καθ’ ἕκαστον ἄρα ὁ πεπαιδευμένος) ὡς οὗν ἐν ἐκείνοις ταῦτα προειπὼν οὕτω τὸν περὶ τῶν ἠθῶν λόγον ἐποιήσατο, οὕτω κἀνταῦθα ποιεῖ καὶ ἐκτίθεται τὸν ἀκουσόμενον τῆς περὶ τῶν ζῴων μορίων καὶ τῶν αἰτιῶν, δι’ ἃς ταῦτα ἔχει τὰ ζῷα, πραγματείας, καί φησι περὶ πᾶσαν θεωρίαν τιμιωτέραν τε καὶ ταπεινοτέραν δύο ἕξεις εἰσίν, ὧν τὴν μὲν ἐπιστήμην προσαγορεύομεν καὶ τὸν ἔχοντα αὐτὴν ἐπιστήμονα καλοῦμεν, θατέραν δὲ παιδείαν καὶ τὸν ἀπ’ αὐτῆς πεπαιδευμένον᾿.	κατά ἕκαστος ἄρα ὁ παιδεύω ) ὡς  ἐν ἐκεῖνος οὗτος προαγορεύω οὕτως ὁ περί ὁ  λόγος ποιέω , οὕτως ἐνταῦθα ποιέω καί ἐκτίθημι ὁ  ὁ περί ὁ ζῷον μόριον καί ὁ αἴτιος , διά ὅς οὗτος ἔχω ὁ ζῷον , πραγματεία , καί φημί περί πᾶς θεωρία  τε καί  γε ἕξις εἰμί , ὅς ὁ μέν ἐπιστήμη προσαγορεύω καί ὁ ἔχω αὐτός  καλέω ,  δέ παιδεία καί ὁ ἀπό αὐτός  .
1109576	tlg4034.tlg003.opp-grc1	πεπαιδευμένος δὲ λέγεται οἷον φέρε εἰπεῖν ἐπὶ γεωμετρίας οὐχ ὁ ἔχων ἀκριβεστάτην πάντων ἕξιν τῶν γεωμετρικῶν θεωρημάτων ὁ γὰρ τοιοῦτος κυρίως ἐπιστήμων ὀνομάζεται), ἀλλ’ ὁ ἔχων γεωμετρικὰς ἀρχὰς καί τινων θεωρημάτων γνῶσιν καὶ δυνάμενος ἐκ τούτων κρίνειν τὸν διαλεγόμενον ὡς γεωμέτρην κατὰ τὰς γεωμετρικὰς ἀρχὰς καὶ ὡς δεῖ γεωμέτρην διαλέγεσθαι.	παιδεύω δέ λέγω οἷος φέρω λέγω ἐπί γεωμετρία οὐ ὁ ἔχω ἀκριβής πᾶς ἕξις ὁ γεωμετρικός θεώρημα ὁ γάρ τοιοῦτος κύριος ἐπιστήμων ὀνομάζω ) , ἀλλά ὁ ἔχω  ἀρχή καί  θεώρημα γιγνώσκω καί  ἐκ οὗτος κρίνω ὁ  ὡς  κατά ὁ  ἀρχή καί ὡς δέω  διαλέγω .
1109577	tlg4034.tlg003.opp-grc1	ὅστις οὖν ἔχει ἀρχὰς γεωμετρικὰς ἀριθμητικάς τε καὶ ἀστρονομικὰς καὶ φυσικάς, καὶ ἁπλῶς ἁπασῶν τεχνῶν τε καὶ ἐπιστημῶν, καὶ δυνάμενος ἐκ τούτων κρίνειν τόν τε φυσικόν, εἰ φυσικῶς διαλέγεται, καὶ τὸν μαθηματικόν, εἰ μαθηματικῶς, καὶ τοὺς ἄλλους ὁμοίως, ὁ δὴ τοιοῦτος ὀνομάζεται ὅλως πεπαιδευμένος ἤγουν περὶ ἅπαντα πεπαιδευμένος καὶ ἁπάντων ἀρχὰς ἔχων καὶ πάντων κριτικὸς νομιζόμενος, εἷς ὢν τῷ ἀριθμῷ·	ὅστις οὖν ἔχω ἀρχή   τε καί  καί  , καί ἁπλόος ἅπας τέχνη τε καί ἐπιστημόω , καί  ἐκ οὗτος κρίνω ὁ τε  , εἰ φυσικός διαλέγω , καί ὁ μαθηματικός , εἰ μαθηματικός , καί ὁ  ὅμοιος , ὁ δή τοιοῦτος ὀνομάζω ὅλος παιδεύω  περί ἅπας παιδεύω καί ἅπας ἀρχή ἔχω καί πᾶς κριτικός νομίζω ,  εἰμί ὁ ἀριθμός ·
1109578	tlg4034.tlg003.opp-grc1	οὐ γὰρ πολλοὶ ὁ τοιοῦτος, ἀλλ’ εἷς.	οὐ γάρ πολύς ὁ τοιοῦτος , ἀλλά  .
1109579	tlg4034.tlg003.opp-grc1	ὅστις δὲ ἔχει ἀρχὰς μιᾶς τινος φύσεως καὶ ἐπιστήμης, οἷον γεω- μετρίας μόνης, οὗτος διάκειται περὶ ἕν τι μόριον τῆς ὅλης ἐπιστήμης ὡς ὁ πρότερος περὶ ἅπαντα.	ὅστις δέ ἔχω ἀρχή   φύσις καί ἐπιστήμη , οἷος  -  μόνος , οὗτος διάκειμαι περί   μόριος ὁ ὅλος ἐπιστήμη ὡς ὁ πρότερος περί ἅπας .
1109580	tlg4034.tlg003.opp-grc1	ἐκ δὴ τούτων δῆλον ὅτι ὁ μὲν ἐπιστήμων καὶ πεπαιδευμένος ἐστίν, οὐ πᾶς δὲ πεπαιδευμένος ἐπιστ·	ἐκ δή οὗτος δῆλος ὅτι2 ὁ μέν ἐπιστήμων καί παιδεύω εἰμί , οὐ πᾶς δέ παιδεύω  ·
1109581	tlg4034.tlg003.opp-grc1	ήμων.	.
1109582	tlg4034.tlg003.opp-grc1	εἰ δὴ ἐπὶ πάντων οὕτως ἔχει, δεῖ καὶ τῆς περὶ φύσεως ἱστορίας ὑπάρχειν ἀρχὰς καὶ ὅρους τοιούτους, πρὸς οὓς ἀναφέρων ὁ ἀκροώμενος ἀποδέξεται τὰ δεικνύμενα χωρὶς τοῦ πῶς ἔχει τἀληθές.	εἰ δή ἐπί πᾶς οὕτως ἔχω , δέω καί ὁ περί φύσις ἱστορία ὑπάρχω ἀρχή καί ὅρος τοιοῦτος , πρός ὅς ἀναφέρω ὁ  ἀποδέχομαι ὁ δείκνυμι χωρίς ὁ πῶς ἔχω ἀληθής .
1109583	tlg4034.tlg003.opp-grc1	εἰ γὰρ τοῦτό ποτε θεωρεῖ, ἀλλ’ οὖν οὐ προηγουμένως ὁ πεπαιδευμένος σκοπεῖ, κἂν ἀληθὲς ἢ μὴ τὸ δεικνύμενον ᾖ ἐπιστήμονος γάρ ἐστι τοῦτο), ἀλλ’ ἔργον ἐστὶν αὐτῷ θεωρῆσαι, εἰ γεωμετρικόν ἐστι τὸ δεικνύμενον, εἰ ἐκ τῶν γεωμετρικῶν ἀρχῶν δεί- κνυται.	εἰ γάρ οὗτος ποτε θεωρέω , ἀλλά οὖν οὐ προηγέομαι ὁ παιδεύω σκοπέω , ἐάν ἀληθής τίη μή ὁ δείκνυμι εἰμί ἐπιστήμων γάρ εἰμί οὗτος ) , ἀλλά ἔργον εἰμί αὐτός θεωρέω , εἰ γεωμετρικός εἰμί ὁ δείκνυμι , εἰ ἐκ ὁ γεωμετρικός   -  .
1109584	tlg4034.tlg003.opp-grc1	Ταῦτ’ εἰπὼν ἐπάγει‘ ἆρα δεῖ λαβόντας ἑκάστην οὐσίαν περὶ ἑκάστης ἰδίᾳ ζητῆσαι, οἷον χωρὶς μὲν περὶ| ἀνθρώπου φύσεως καὶ ἰδίως περὶ λέον·	λέγω ἐπάγω ‘ ἆρα δέω λαμβάνω ἕκαστος οὐσία περί ἕκαστος ἴδιος ζητέω , οἷος χωρίς μέν περί | ἄνθρωπος φύσις καί ἴδιος περί λαός ·
1109585	tlg4034.tlg003.opp-grc1	τος, ἢ τὰ κοινῇ συμβεβηκότα πᾶσι κατά τι κοινὸν ὑποθεμένους’;	, τίη ὁ κοινῇ συμβαίνω πᾶς κατά τις κοινός  ;
1109586	tlg4034.tlg003.opp-grc1	οἷον ἐπεὶ συμβέβηκε καὶ ἀνθρώπῳ καὶ ἵππῳ καὶ λέοντι καὶ ἄλλοις πολλοῖς τὸ ἀναπνεῖν, τὸ αὔξειν, τὸ φθίνειν, δεῖ ὡς κοινόν τι πρᾶγμα καὶ κοινήν τινα φύσιν λαβεῖν τὸ ἀναπνευστικὸν καὶ ζητεῖν, ὅπως καὶ διὰ τί ἀναπνέουσι τὰ ἀνα- πνευστικὰ καὶ αὔξει τὰ αὐξητικά, ἢ χωρὶς μὲν ἰδεῖν ὅπως ὁ ἄνθρωπος ἀναπνεῖ καὶ ἰδίως ὅπως ὁ ἵππος;	οἷος  συμβαίνω καί ἄνθρωπος καί ἵππος καί  καί ἄλλος πολύς ὁ ἀναπνέω , ὁ αὐξάνω , ὁ φθίω , δέω ὡς κοινός τις πρᾶγμα καί κοινός  φύσις λαμβάνω ὁ  καί ζητέω , ὅπως καί διά τι ἀναπνέω ὁ  -  καί αὐξάνω ὁ  , ἤ χωρίς μέν ὁράω ὅπως ὁ ἄνθρωπος ἀναπνέω καί ἴδιος ὅπως ὁ ἵππος ;
1109587	tlg4034.tlg003.opp-grc1	εἰπὼν δὲ καὶ ὅτι πολλοῖς ἑτέροις οὖσιν ἀλλήλων τῷ εἴδει ὑπάρχει τὰ αὐτά, οἷον ὕπνος, ἀναπνοή, αὔξησις, φθίσις, θάνατος, ἐπήγαγε καὶ πρὸς τούτοις ὅσα τοιαῦτα τῶν λειπομένων παθῶν τε καὶ διαθέσεων, ὃ ἴσον ἄν εἴη τῷ καὶ πρὸς τούτοις ἄλλα πλεῖστα κοινῶς ὑπάρχει τοῖς ζῴοις, ἃ παραλέλειπται καὶ οὐ κατείλεκται νῦν ἡμῖν·	λέγω δέ καί ὅτι2 πολύς ἕτερος εἰμί ἀλλήλων τῷ εἶδος ὑπάρχω ὁ αὐτός , οἷος ὕπνος , ἀναπνοή , αὔξησις , φθίσις , θάνατος , ἐπάγω καί πρός οὗτος ὅσος τοιοῦτος ὁ λείπω πάθος τε καί διάθεσις ,  ἴσος  εἰμί τῷ καί πρός οὗτος ἄλλος πλεῖστος κοινός ὑπάρχω ὁ  , ὅς παραλείπω καί οὐ  νῦν ἐγώ ·
1109588	tlg4034.tlg003.opp-grc1	ταῦτα δ’ ἄν εἶεν ἐγρήγορσις, μακροβιότης, βραχυβιότης καὶ τὰ ὅμοια.	οὗτος  ἄν εἶἑν ἐγρήγορσις , μακροβιότης ,  καί ὁ ὅμοιος .
1109589	tlg4034.tlg003.opp-grc1	τὸ δὲ ἄδηλον γὰρ καὶ ἀδιόριστόν ἐστι λέγειν νῦν περὶ τούτων εἴρηται ἀντὶ τοῦ οὔπω γὰρ περὶ τούτων ὑπό τινος τῶν πρὸ ἡμῶν ἢ τῶν σὺν ἡμῖν ὄντων διώρισταί τε καὶ σεσαφήνισται, εἴτε χωρὶς δεῖ λέγειν εἴτε κοινῶς.	ὁ δέ ἄδηλος γάρ καί  εἰμί λέγω νῦν περί οὗτος λέγω ἀντί ὁ οὔπω γάρ περί οὗτος ὑπό   πρό ἐγώ τίη ὁ σύν  εἰμί  τε καί  , εἴτε χωρίς δέω λέγω εἴτε  .
1109590	tlg4034.tlg003.opp-grc1	εἰπὼν οὖν ὅτι πότερον δεῖ λαβόντας μίαν ἑκάστην οὐσίαν καὶ τὰ ἑξῆς, ἐπάγει φανερὸν δὲ καὶ ὅτι κατὰ μέρος μὲν λέγοντες περὶ πολλῶν ἐροῦμεν πολλάκις τὰ αὐτά, αἰνιττόμενος διὰ τούτων ὡς οὐ δεῖ χωρὶς περὶ ἑκάστου λέγειν, ὅπως τε ὁ ἵππος ἀναπνεῖ καὶ ὅπως ὁ ἄνθρωπος, ἀλλὰ ληπτέον ὡς μίαν τινὰ φύσιν τὸ ἀναπνευστικὸν καὶ σκοπητέον, ὅπως γίνεται.	λέγω οὖν ὅτι2 πότερος δέω λαμβάνω  ἕκαστος οὐσία καί ὁ ἑξῆς , ἐπάγω φανερός δέ καί ὅτι2 κατά μέρος μέν λέγω περί πολύς ἐρέω πολλάκις ὁ αὐτός ,  διά οὗτος ὡς οὐ δέω χωρίς περί ἕκαστος λέγω , ὅπως τε ὁ ἵππος ἀναπνέω καί ὅπως ὁ ἄνθρωπος , ἀλλά λαμβάνω ὡς   φύσις ὁ  καί  , ὅπως γίγνομαι .
1109591	tlg4034.tlg003.opp-grc1	ἐπεὶ δὲ τῶν κοινῶς ὑπαρχόντων τοῖς ζῴοις τὰ μέν ἐστι συνώνυμα, τὰδ’ ὁμώνυμα, θεὶς ὑποδείγματα τῶν συνωνύμων ὕπνον, ἀναπνοήν, αὔξησιν, φθίσιν, τίθησι καὶ τῶν ὁμωνύμων λέγων ἕτερα δὲ ἴσως ἐστὶν οἷς συμβαίνει τὴν μὲν κατηγορίαν ἔχειν τὴν αὐτήν, τὸ ἕτε ῥα ἀντὶ τοῦ ὁμώνυμα νῦν λαβών·	ἐπεί δέ ὁ κοινός ὑπάρχω ὁ  ὁ μέν εἰμί  , ὁ δ’ ὁμώνυμος , τίθημι ὑπόδειγμα ὁ  ὕπνος ,  , αὔξησις , φθίσις , τίθημι καί ὁ ὁμώνυμος λέγω ἕτερος δέ ἴσος εἰμί  συμβαίνω ὁ μέν κατηγορία ἔχω ὁ αὐτός , ὁ   ἀντί ὁ ὁμώνυμος νῦν λαμβάνω ·
1109592	tlg4034.tlg003.opp-grc1	ἡ γὰρ πορεία ὁμωνύμως βαδίσεως καὶ ἕρψεως καὶ πτήσεως κατηγορεῖται·	ὁ γάρ πορεία ὁμώνυμος βάδισις καί ἕρψις καί πτῆσις κατηγορέω ·
1109593	tlg4034.tlg003.opp-grc1	τὸ δὲ ἴσως ἢ ἀντὶ τοῦ ἁπλῶς καὶ καθόλου κεῖται ἢ διὰ φιλόσοφον εὐλάβειαν.	ὁ δέ ἴσος τίη ἀντί ὁ ἁπλόος καί καθόλου κεῖμαι τίη διά φιλόσοφος εὐλάβεια .
1109594	tlg4034.tlg003.opp-grc1	τὸ δὲ πότερον καθάπερ οἱ μαθηματικοὶ τὰ περὶ τὴν ἀστρολογίαν δεικνύουσιν, οὕτω δεῖ καὶ τὸν φυσικὸν ἴσον ἄν εἴη τῷ ἀρά γε ὥσπερ οἱ μαθηματικοὶ λαβόντες τὸ πρᾶγμα ὅτι ἐστὶν οὕτω τὰς αἰτίας, διὰ τί οὕτως ἔχει, ζητοῦσι λαβόντες γὰρ ἐξ αἰσθήσεως ὅτι τῶν ἀστέρων οἱ μὲν ἀεὶ δύνουσιν, ὡς τὸ λεγόμενον θυτήριον, ὡς ὁ στέφανος, οἱ δὲ οὐδέποτε ποιοῦνται δύσιν, ὡς ἡ ἄρκτος, οὕτω τὴν αἰτίαν διὰ τί οὕτως ἔχει ἐζήτησαν) οὕτω δεῖ καὶ τὸν φυσικὸν πρότερον ἰδεῖν, εἰ ἔχει τὰ ζῷα καρδίαν, πνεύμονα, φλέβας, καὶ οὕτω ζητῆσαι, διὰ τί ταῦτα ἔχουσι τὰ μόρια, ἢ ἀνάπαλιν;	ὁ δέ πότερος καθά ὁ μαθηματικός ὁ περί ὁ ἀστρολογία δείκνυμι , οὕτως δέω καί ὁ φυσικός ἴσος ἄν εἰμί τῷ  γε ὥσπερ ὁ μαθηματικός λαμβάνω ὁ πρᾶγμα ὅτι2 εἰμί οὕτως ὁ αἰτία , διά τίς οὕτως ἔχω , ζητέω λαμβάνω γάρ ἐκ αἴσθησις ὅτι2 ὁ  ὁ μέν ἀεί δύω , ὡς ὁ λέγω θυτήριον , ὡς ὁ στέφανος , ὁ δέ οὐδέποτε ποιέω δύσις , ὡς ὁ  , οὕτως ὁ αἰτία διά τίς οὕτως ἔχω ζητέω ) οὕτως δέω καί ὁ φυσικός πρότερος ὁράω , εἰ ἔχω ὁ ζῷον καρδία , πλεύμων ,  , καί οὕτως ζητέω , διά τι οὗτος ἔχω ὁ μόριον , ἤ  ;
1109595	tlg4034.tlg003.opp-grc1	Ἤ τῇ αἰσθήσει ὁρισάμενος.	ὁ αἴσθησις  .
1109596	tlg4034.tlg003.opp-grc1	‘ Ορίζεται τὴν ὑγείαν τῇ αἰσθήσει ὁ ἰατρός, ὅταν λαβὼν ὑγιᾶ χεῖρα φάσκῃ‘ ἐπειδὰν ἡ νοσοῦσα χεὶρ ἐνεργῇ ὡς αὕτη, τότε ὑγιανεῖ.	ὁ ὑγίεια ὁ αἴσθησις ὁ ἰατρός , ὅταν λαμβάνω  χείρ  ‘ ἐπεί ὁ  χείρ  ὡς οὗτος , τότε ὑγιαίνω .
1109597	tlg4034.tlg003.opp-grc1	ὁμοίως καὶ ἐπὶ οἰκίας ὅταν ἀφορῶν ὁ οἰκοδόμος πρὸς τὴν ἤδη οὖσαν ἑτέραν ὁμοίαν ἐκείνῃ ποιῇ.	ὅμοιος καί ἐπί οἰκία ὅταν ἀφοράω ὁ οἰκοδόμος πρός ὁ ἤδη εἰμί ἕτερος ὅμοιος ἐκεῖνος ποιέω .
1109598	tlg4034.tlg003.opp-grc1	εἰς ὃ πειρῶνται πάντες σχεδόν.	εἰς ὅς πειράω πᾶς σχεδόν .
1109599	tlg4034.tlg003.opp-grc1	Οἱ γὰρ πρεσβύτεροι τούτου φιλόσοφοι τὸ ὑλικὸν ἅπαντες ἐζήτουν αἴτιον καὶ περὶ ἐκεῖνο διέτριβον ἧττον φροντίσαντες τῶν ἄλλων αἰτίων, κἂν ἐπὶ μικρὸν καὶ ἐκείνων, ὅσον ὀνειρώξασθαι, ἥψαντο.	γάρ πρέσβυς οὗτος  ὁ ὑλικός ἅπας ζητέω αἴτιος καί περί ἐκεῖνος διατρίβω ἥσσων φροντίζω ὁ ἄλλος  , ἐάν ἐπί μικρός καί ἐκεῖνος , ὅσος  , ἅπτω .
1109600	tlg4034.tlg003.opp-grc1	Ἀλλ’ ὁ τρόπος τῆς ἀποδείξεως καὶ τῆς ἀνάγκης ἕτερος.	ὁ τρόπος ὁ ἀπόδειξις καί ὁ ἀνάγκη ἕτερος .
1109601	tlg4034.tlg003.opp-grc1	Ἕτερος, φησίν, ἐστὶν ὁ τρόπος τῆς ἀποδείξεως καὶ τῆς ἀνάγκης ἤγουν τῆς ὕλης ἐπί τε τῆς φυσικῆς καὶ τῶν θεωρητικῶν ἐπιστημῶν καὶ ἐπὶ τῶν τεχναστῶν·	ἕτερος , φημί , εἰμί ὁ τρόπος ὁ ἀπόδειξις καί ὁ ἀνάγκη  ὁ ὕλη ἐπί τε ὁ φυσικός καί ὁ θεωρητικός ἐπιστήμη καί ἐπί ὁ  ·
1109602	tlg4034.tlg003.opp-grc1	τοῦτο γὰρ δεῖ προσυπακούειν.	οὗτος γάρ δέω ὑπακούω .
1109603	tlg4034.tlg003.opp-grc1	τῆς μὲν γὰρ φυσικῆς ἀρχὴ τὸ ὄν·	ὁ μέν γάρ φυσικός ἀρχή ὁ εἰμί ·
1109604	tlg4034.tlg003.opp-grc1	ὡς ἤδη γὰρ ὄντα λαβοῦσα τὸν ἄνθρωπον, κἄν μήπω ἐστί, λέγει‘ ἐπειδὴ τοιονδί ἐστιν ὁ ἄνθρωπος, δεῖ τοιᾶσδε ὕλης᾿, καὶ οὕ φησιν ἐπειδὴ τοιαύτη ἐστὶν ἡ ὕλη, δεῖ ἄνθρωπον εἶναι.	ὡς ἤδη γάρ ὄντα λαμβάνω ὁ ἄνθρωπος , ἐάν μήπω εἰμί , λέγω ‘ ἐπεί  εἰμί ὁ ἄνθρωπος , δέω τοιόσδε  , καί οὗ φημί ἐπεί τοιοῦτος εἰμί ὁ ὕλη , δέω ἄνθρωπος εἰμί .
1109605	tlg4034.tlg003.opp-grc1	καὶ ἡ ἰατρικὴ ὁμοίως τὴν ὑγίειαν ὡς οὖσαν, κἂν μὴ ἔστι, καὶ ὁ γεωμέτρης τὸ τρίγωνον ὡς ὂν λαβὼν ζητεῖ, εἰ ἔχει τὰς τρεῖς γωνίας δυσὶν ὀρθαῖς ἴσας.	καί ὁ ἰατρικός ὅμοιος ὁ ὑγίεια ὡς εἰμί , ἐάν μή εἰμί , καί ὁ  ὁ τρίγωνος ὡς εἰμί λαμβάνω ζητέω , εἰ ἔχω ὁ  γωνία   ἴσος .
1109606	tlg4034.tlg003.opp-grc1	ἐπὶ δὲ τῶν τεχναστῶν οὐχ οὕτως, ἀλλ’ ὡς μὴ ὂν καὶ δυνάμενον γενέσθαι·	ἐπί δέ ὁ  οὐ οὕτως , ἀλλά ὡς μή εἰμί καί  γίγνομαι ·
1109607	tlg4034.tlg003.opp-grc1	φαμὲν γὰρ ἱεῖ ἔσται πρίων, δεῖ τοιᾶσδε ὕλης’, καὶ ἐπὶ τῆς οἰκίας ὁμοίως.	φημί γάρ ἵημι   , δέω τοιόσδε ὕλη ’ , καί ἐπί ὁ οἰκία ὅμοιος .
1109608	tlg4034.tlg003.opp-grc1	οὐδ’ ἔστιν εἰς ἀίδιον συναρτῆσαι.	οὐδέ εἰμί εἰς ἀΐδιος  .
1109609	tlg4034.tlg003.opp-grc1	Οὐ δυνατόν ἐστι, φησίν, εἰς ἀίδιον συναρτῆσαι τῆς τοιαύτης ἀποδείξεως ἤγουν τῆς ἀντιστρεφούσης τὴν ἀνάγκην ἐπὶ τῶν τεχναστῶν, ὥστε λέγειν‘ ἐπειδὴ ἡ | οἰκία τοδί ἐστι, δεῖ τοιαύτης ὕλης, καὶ ἐπεὶ τοιαύτη ὕλη ἐστίν, ἔσται οἰκία.	οὐ δυνατός εἰμί , φημί , εἰς ἀΐδιος  ὁ τοιοῦτος ἀπόδειξις  ὁ  ὁ ἀνάγκη ἐπί ὁ  , ὥστε λέγω ‘ ἐπεί ὁ  οἰκία  εἰμί , δέω τοιοῦτος ὕλη , καί ἐπεί τοιοῦτος ὕλη εἰμί ,  οἰκία .
1109610	tlg4034.tlg003.opp-grc1	ἐπὶ δὲ τῶν ἀιδίων δυνατὸν λέγειν‘ ἐπεὶ ὁ ἥλιος ἐν κριῷ ἐστιν, ἦν ἐν τοξότῃ, καὶ ἐπεὶ ἐν τοξότῃ ἐστίν, ἔστι ἐν κριῷ᾿.	ἐπί δέ ὁ  δυνατός λέγω ‘ ἐπεί ὁ ἥλιος ἐν  εἰμί , εἰμί ἐν  , καί ἐπεί ἐν  εἰμί , εἰμί ἐν  .
1109611	tlg4034.tlg003.opp-grc1	ἀλλὰ περὶ μὲν τούτων εἴρηκε καὶ ἐν τῷ δευτέρῳ τῆς Ἀποδεικτικῆς καὶ ἐν τῷ τέλει τῆς Περὶ γενέσεως καὶ φθορᾶς, καὶ ἐν τῇ Μετὰ τὰ φυσικά.	ἀλλά περί μέν οὗτος λέγω καί ἐν ὁ δεύτερος ὁ  καί ἐν ὁ τέλος ὁ περί γένεσις καί φθορά , καί ἐν ὁ μετά ὁ φυσικός .
1109612	tlg4034.tlg003.opp-grc1	Δεῖ δὲ μὴ λεληθέναι καὶ πότερον προσήκει λέγειν.	δεῖ δέ μή λανθάνω καί πότερος προσήκω λέγω .
1109613	tlg4034.tlg003.opp-grc1	Καὶ τοῦτό φησι δεῖν γινώσκειν ἡμᾶς, ἀρ’ οὕτω ποιητέον τὴν παροῦσαν σκέψιν, ὥσπερ οἱ πρὸ ἡμῶν ἐποίουν.	καί  φημί δέω γιγνώσκω  ,  οὕτως ποιέω ὁ πάρειμι σκέψις , ὥσπερ ἕ πρό  ποιέω .
1109614	tlg4034.tlg003.opp-grc1	ἐκεῖνοι γὰρ ἔλεγον ὅτι τὴν τοῦ πράγματος γένεσιν, ὅπως γίνεται, πρότερον ζητεῖν ἄξιον·	ἐκεῖνος γάρ λέγω ὅτι2 ὁ ὁ πρᾶγμα γένεσις , ὅπως γίγνομαι , πρότερος ζητέω ἄξιος ·
1109615	tlg4034.tlg003.opp-grc1	ταύτης γὰρ καταληφθείσης καὶ γνωρίμου γεγονυίας ἕπεται καὶ ἡ γνῶσις τῆς τοῦ πράγματος ὑπάρξεως καὶ τῆς οὐσίας αὐτοῦ.	οὗτος γάρ καταλαμβάνω καί γνώριμος   καί ὁ γνῶσις ὁ ὁ πρᾶγμα  καί ὁ οὐσία αὐτός .
1109616	tlg4034.tlg003.opp-grc1	ἀλλ’ ἐκεῖνοι μὲν οὕτως·	ἀλλά ἐκεῖνος μέν οὕτως ·
1109617	tlg4034.tlg003.opp-grc1	ὁ δὲ οὐκ ἀρέσκεται, ἀλλά φησιν ἔοικεν ἐντεῦθεν ἀρκτέον εἶναι, καθάπερ καὶ πρότερον εἴπομεν, καὶ ληπτέον τὰ ὑπάρχοντα ἑκάστῳ γένει ὡς ὑπάρχοντα, καὶ θεωρητέον τίνα τίσιν ὑπάρχει καὶ ἐστίν, οἷον τοῖς μὲν βουσὶν ἐχῖνος, σηπίᾳ δὲ τὸ σηπίον καὶ ἄλλοις ἄλλα.	ὁ δέ οὐ ἀρέσκω , ἀλλά φημί ἔοικα ἐντεῦθεν ἄρχω εἰμί , καθά καί πρότερος λέγω , καί  ὁ ὑπάρχω ἕκαστος γένος ὡς ὑπάρχω , καί θεωρέω  τίσις ὑπάρχω καί εἰμί , οἷος ὁ μέν   ,  δέ ὁ  καί  ἄλλος .
