id	filename	tokens	lemmas
1232815	tlg9019.tlg001.opp-grc1	ἡμεῖς δὲ πρὸ τῆς κατὰ τὴν λέξιν ἐξηγήσεως ζητήσωμεν πρῶτον μὲν τί ἐστι τρόπος καὶ πόσοι τρόποι, καὶ τί διαφέρει τῆς ὅλης ὁ καλούμενος τρόπος·	δέ πρό ὁ κατά ὁ λέξις ἐξήγησις ζητέω πρῶτος μέν τίς εἰμί τρόπος καί ποσός τρόπος , καί τι διαφέρω ὁ ὅλος ὁ καλέω τρόπος ·
1232816	tlg9019.tlg001.opp-grc1	δεύτερον δὲ τίς ὁ ἀριθμὸς τῶν τοιούτων προτάσεων.	δεύτερος δέ τις ὁ ἀριθμός ὁ τοιοῦτος  .
1232817	tlg9019.tlg001.opp-grc1	ἀρξώμεθα τοῦ τρόπου.	ὁ τρόπος .
1232818	tlg9019.tlg001.opp-grc1	τρόπος τοίνυν ἐστὶ πρόσρημα ἤγουν φωνὴ σημαῖνον τὸ πῶς ὑπάρχει τὸ κατηγορούμενον τῷ ὑποκειμένῳ.	τρόπος τοίνυν εἰμί πρόσρημα  φωνή σημαίνω ὁ πῶς ὑπάρχω ὁ κατηγορέω τῷ  .
1232819	tlg9019.tlg001.opp-grc1	καὶ ὁ μὲν προσδιορισμὸς τὸ ποσὸν ἐσήμανεν ἐρρέθη γὰρ ὅτι προσδιορισμός ἐστι πρόσρημα σημαῖνον ἐπὶ πόσον ὑπάρχει τὸ κατηγορούμενον τῷ ὑποκειμένῳ) ὁ δὲ τρόπος τὸ ποιὸν ἀφορίζεται.	καί ὁ μέν  ὁ   λέγω γάρ ὅτι2  εἰμί πρόσρημα σημαίνω ἐπί  ὑπάρχω ὁ κατηγορέω τῷ  ) ὁ δέ τρόπος ὁ  ἀφορίζω .
1232820	tlg9019.tlg001.opp-grc1	εἰσὶ δὲ τρόποι ἀριθμῷ μὲν σχεδὸν ἀπερίληπτοι καὶ ἀκατάληπτοι, ἀνακεφαλαιούμενοι δὲ εἰς τοὺς ὅ τρόπους τούτους ἀνάγονται, ἀναγκαῖον δέ φημι καὶ ἀδύνατον ἐνδεχόμενον, δυνατόν.	εἰμί δέ  ἀριθμός μέν σχεδόν ἀπερίληπτος καί  ,  δέ εἰς ὁ ὅς τρόπος οὗτος ἀνάγω , ἀναγκαῖος δέ φημί καί ἀδύνατος  , δυνατός .
1232821	tlg9019.tlg001.opp-grc1	πᾶν γὰρ ὅπερ ἄν εἴπῃ τις πάντως ἢ ἀναγκαῖον τρόπον σημαίνει, ὡς ὅτι ὁ ἥλιος ἀεὶ κινεῖται ἐνταῦθα γὰρ τὸ ἀεὶ εἰ καὶ μὴ κυρίως ἐστὶ τρόπος, ἀλλ’ οὖν τὸν ἀναγκαῖον ὑποκρίνεται τρόπον·	πᾶς γάρ ὅς ἄν λέγω τις πᾶς τίη ἀναγκαῖον τρόπος σημαίνω , ὡς ὅτι2 ὁ ἥλιος ἀεί  ἐνταῦθα γάρ ὁ ἀεί εἰ καί μή κύριος εἰμί τρόπος , ἀλλά οὖν ὁ ἀναγκαῖον ὑποκρίνω τρόπος ·
1232822	tlg9019.tlg001.opp-grc1	ἀναγκαίως γὰρ ὁ ἥλιος κινεῖται), ἢ ἐνδεχόμενον τρόπον σημαίνει, ὡς τὸ ῾Σωκράτης καλῶς βαδίζει’ τὸ καλῶς τοῦ ἐνδεχομένου τρόπου ἐστὶν αἴνιγμα), ἢ τὸν δυνατὸν τρόπον σημαίνει, ὡς τὸ ῾Σωκράτης πάνυ φιλεῖ’ τὸ πάνυ τὸ δυνατὸν σημαίνει ἢ τὸ ἀδύνατον, ὡς ἡνίκα εἴπωμεν῾ τὸν τὸν Σωκράτην ἀμήχανον πτερωτὸν εἶναι. ’	ἀναγκαῖος γάρ ὁ ἥλιος κινέω ) , τίη  τρόπος σημαίνω , ὡς ὁ  καλός βαδίζω ’ ὁ καλός ὁ  τρόπος εἰμί αἴνιγμα ) , τίη ὁ δυνατός τρόπος σημαίνω , ὡς ὁ  πάνυ φιλέω ’ ὁ πάνυ ὁ δυνατός σημαίνω τίη ὁ ἀδύνατος , ὡς ἡνίκα  ῾ ὁ ὁ Σωκράτης ἀμήχανος πτερωτός εἰμί .
1232823	tlg9019.tlg001.opp-grc1	ὥστε οἱ·	ὡς ἕ ·
1232824	tlg9019.tlg001.opp-grc1	δ εἰσὶν οὗτοι τρόποι, καὶ οὐκ ἔστιν ἄλλος, ὤας τινες τῶν ἐξηγητῶν Ἀριστοτέλους ἐφαντάσθησαν ἐν τῷ λέγειν αὐτὸν ἐν τοῖς Ἀναλυτικοῖς ὅτι πᾶσα πρότασις ἢ τοὐ ὑπάρχειν ἐστὶν ἢ τοῦ ἐξ ἀνάγκης ὑπάρχειν ἢ τοῦ ἐνδέχεσθαι ὑπάρχειν.	εἰμί οὗτος τρόπος , καί οὐ εἰμί ἄλλος , ἀάω τις ὁ ἐξηγητής Ἀριστοτέλης  ἐν τῷ λέγω αὐτός ἐν ὁ  ὅτι2 πᾶς πρότασις ἤ οὐ ὑπάρχω εἰμί ἤ ὁ ἐκ ἀνάγκη ὑπάρχω ἤ ὁ ἐνδέχομαι ὑπάρχω .
1232825	tlg9019.tlg001.opp-grc1	ἐνόμισαν γὰρ ἐκεῖ καὶ τὸν ὑπάρχοντα τρόπον** * ὅτι δὲ ἀδύνατον τὸν ὑπάρχοντα τρόπον εἶναι δῆλον καὶ ἐξ αὐτοῦ καθέστηκεν Ἀριστοτέλους καὶ ἐκ τῆς ἀληθείας·	νομίζω γάρ ἐκεῖ καί ὁ ὑπάρχω τρόπος * *  ὅτι2 δέ ἀδύνατος ὁ ὑπάρχω τρόπος εἰμί δῆλος καί ἐκ αὐτός καθίστημι Ἀριστοτέλης καί ἐκ ὁ ἀλήθεια ·
1232826	tlg9019.tlg001.opp-grc1	ἐξ αὐτοῦ μὲν τοῦ Ἀριστοτέλους, διότι οὐδαμοῦ ἐν τοῖς διαγράμμασιν τοῦ ὑπάρχοντος ἐμνημόνευσεν, ἀλλὰ μόνον τῶν δ τρόπων·	ἐκ αὐτός μέν ὁ Ἀριστοτέλης , διότι οὐδαμοῦ ἐν ὁ διάγραμμα ὁ ὑπάρχω μνημονεύω , ἀλλά μόνος ὁ  τρόπος ·
1232827	tlg9019.tlg001.opp-grc1	ἐκ δὲ τῆς ἀληθείας, ὅτι ἡ πρώτη διαφορὰ τῶν προτάσεων ἐστι κατὰ τὸ εἶναι αὐτὰς ἢ μετὰ τρόπου ἢ ἄνευ τρόπου.	ἐκ δέ ὁ ἀλήθεια , ὅτι2 ὁ πρῶτος διαφορά ὁ πρότασις εἰμί κατά ὁ εἰμί αὐτός τίη μετά τρόπος ἤ ἄνευ τρόπος .
1232828	tlg9019.tlg001.opp-grc1	τὴν μὲν οὖν ἄνευ τρόπου ᾿Αριστοτέλης ὑπάρχουσαν καλεῖ, ὡς τοῖς Ἀναλυτικοῖς λεχθή- σεται σὺν θεῷ, ἡνίκα διαλέξηται περὶ τῆς τῶν προτάσεων διαφέρει δὲ τρόπος ὕλης, ὅτι ἡ μὲν ὕλη συναναφαίνεται τῷ εἴδει τῶν προτάσεων, ὡς ἐρρέθη, ὁ δὲ τρόπος ἔξωθεν προστίθεται.	ὁ μέν οὖν ἄνευ τρόπος  ὑπάρχω καλέω , ὡς ὁ   -  σύν θεός , ἡνίκα  περί ὁ ὁ πρότασις διαφέρω δέ τρόπος ὕλη , ὅτι2 ὁ μέν ὕλη  τῷ εἶδος ὁ πρότασις , ὡς λέγω , ὁ δέ τρόπος ἔξωθεν προστίθημι .
1232829	tlg9019.tlg001.opp-grc1	οἷον ἐν τῷ λέγειν‘ Σωκράτης ζῷόν ἐστι’ συνανεφάνη ἡ ὕλη ὅτι ἀναγκαία ἐστί·	οἷος ἐν τῷ λέγω ‘   εἰμί ’  ὁ ὕλη ὅτι2 ἀναγκαῖος εἰμί ·
1232830	tlg9019.tlg001.opp-grc1	εἰ δὲ εἴπω ὅτι Σωκράτης ἐξ ἀνάγκης ζῷόν ἐστι, προσετέθη ἔξωθεν τὸ ἐξ ἀνάγκης ἤγουν ὁ τρόπος.	εἰ δέ λέγω ὅτι2  ἐκ ἀνάγκη ζῷον εἰμί , προστίθημι ἔξωθεν ὁ ἐκ ἀνάγκη  ὁ τρόπος .
1232831	tlg9019.tlg001.opp-grc1	διὸ καὶ διαφωνοῦσι πολλάκις·	διό καί  πολλάκις ·
1232832	tlg9019.tlg001.opp-grc1	εἰ μὲν γάρ ἐστιν ὕλη ἀναγκαία, ὁ δὲ τρόπος οὐκ ἀναγκαῖος, ψευδὴς εὑρεθήσεται ἡ πρότασις.	εἰ μέν γάρ εἰμί ὕλη ἀναγκαῖος , ὁ δέ τρόπος οὐ ἀναγκαῖος , ψευδής εὑρίσκω ὁ πρότασις .
1232833	tlg9019.tlg001.opp-grc1	οἷον῾ ἄνθρωπος ζῷόν ἐστιν’ ἡ ὕλη ἀναγκαία·	οἷος ῾ ἄνθρωπος  εἰμί ’ ὁ ὕλη ἀναγκαῖος ·
1232834	tlg9019.tlg001.opp-grc1	εἰ δὲ συνάψω ἐνδεχόμενον τρόπον τῇ ἀναγκαίᾳ καὶ εἴπω῾ ἄνθρωπος ἐνδεχομένως ζῷόν ἐστι’, ψευδῆ τὴν τοιαύτην πρότασιν ποιῶ.	εἰ δέ συνάπτω  τρόπος ὁ ἀνάγκη καί λέγω ῾ ἄνθρωπος ἐνδέχομαι ζῷον εἰμί ’ , ψευδής ὁ τοιοῦτος πρότασις ποιέω .
1232835	tlg9019.tlg001.opp-grc1	τὸ γὰρ ἐνδεχόμενον ὅπερ οὐκ ἔστι σημαίνει, δυνατὸν δὲ γενέσθαι.	ὁ γάρ  ὅς οὐ εἰμί σημαίνω , δυνατός δέ γίγνομαι .
1232836	tlg9019.tlg001.opp-grc1	ἐν οἷς τὸ ᾱ κεφάλλαιον.	ἐν  ὁ   .
1232837	tlg9019.tlg001.opp-grc1	Δεύτερον ἦν κεφάλαιον τίς ἡ ἀπαρίθμησις τῶν τοιούτων προτάσεων.	δεύτερος εἰμί κεφάλαιος τις ὁ ἀπαρίθμησις ὁ τοιοῦτος  .
1232838	tlg9019.tlg001.opp-grc1	γίνονται τοίνυν καταφάσεις ἐκ τῶν τοιούτων προτάσεων ݲαݲσݲοݲς διὰ αἰτίαν.	γίγνομαι τοίνυν  ἐκ ὁ τοιοῦτος   διά αἰτία .
1232839	tlg9019.tlg001.opp-grc1	ὁ τρόπος ἢ ἐν ταῖς προτάσεσιν εὑρίσκεται ταῖς συγκειμέναις ἐκ τοῦ ὑποκειμένου καὶ κατηγορουμένου μόνον ὡς τὸ῾ Σωκράτης ἐνδεχομένως βαδίζει, ἀναγκαίως ἀναπνεῖ’ καὶ τὰ τοιαῦτα, ἢ ἐν ταῖς προτάσεσι ταῖς ἐκ τοῦ <ὑποκειμένου καὶ> κατηγορουμένου καὶ τρίτου προσκατηγορουμένου.	ὁ τρόπος τίη ἐν ὁ  εὑρίσκω ὁ  ἐκ ὁ  καί κατηγορέω μόνος ὡς ὁ ῾  ἐνδέχομαι βαδίζω , ἀναγκαῖος ἀναπνέω ’ καί ὁ τοιοῦτος , τίη ἐν ὁ πρότασις ὁ ἐκ ὁ   κατηγορέω καί τρίτος  .
1232840	tlg9019.tlg001.opp-grc1	καὶ ἡνίκα μὲν ἐν ταῖς προτάσεσιν εὑρεθῇ ταῖς ἐκ τοῦ ὑποκειμένου καὶ κατηγορουμένου μόνον συγκειμέναις, τετραχῶς ποικίλλονται αἱ καταφάσεις.	καί ἡνίκα μέν ἐν ὁ  εὑρίσκω ὁ ἐκ ὁ  καί κατηγορέω μόνος  , τετραχῶς ποικίλλω ὁ  .
1232841	tlg9019.tlg001.opp-grc1	ὑπο- κείσθω τοίνυν τοῦτο, ὅπερ αὐτὸς κατὰ λέξιν φησίν, ὅτι ἡνίκα ἡ οὔ ἄρνησις τῷ τρόπω μὴ συνάπτηται, κατάφ·	- κεῖμαι τοίνυν οὗτος , ὅς αὐτός κατά λέξις φημί , ὅτι2 ἡνίκα ὁ οὐ ἄρνησις ὁ  μή  ,  ·
1232842	tlg9019.tlg001.opp-grc1	ασιν ποιεῖ.	ποιέω .
1232843	tlg9019.tlg001.opp-grc1	ἀνάγκη τοίνυν ἀμφοτέρους τοὺς ὅρους ἢ ὡρισμένους εἶναι ἢ ἀορίστους, ἢ τὸν μὲν ὡρισμένον τὸν δὲ ἀόριστον.	ἀνάγκη τοίνυν ἀμφότερος ὁ ὅρος τίη  εἰμί ἤ ἀόριστος , τίη ὁ μέν ὁρίζω ὁ δέ ἀόριστος .
1232844	tlg9019.tlg001.opp-grc1	καὶ τοῦτο διχῶς.	καί οὗτος διχῶς .
1232845	tlg9019.tlg001.opp-grc1	ἢ γὰρ ὁ μὲν ὑποκείμενος ὡρισμένος ἐστὶν ὁ δὲ κατηγορούμενος ἀόριστος, ἢ ὁ μὲν κατηγορούμενος ὡρισμένος ὁ δὲ ὑποκείμενος ἀόριστος.	τίη γάρ ὁ μέν  ὁρίζω εἰμί ὁ δέ  ἀόριστος , ἤ ὁ μέν  ὁρίζω ὁ δέ  ἀόριστος .
1232846	tlg9019.tlg001.opp-grc1	ἡνίκα δὲ πάλιν ὁ τρόπος εὑρεθῇ ἐν ταῖς προτάσεσι ταῖς ἐκ τοῦ ὑποκειμένου καὶ κατηγορουμένου καὶ τρίτου προσκατηγορουμένου συγκειμέναις, ὀκταχῶς ποικίλλονται αἱ καταφάσεις.	ἡνίκα δέ πάλιν ὁ τρόπος εὑρίσκω ἐν ὁ πρότασις ὁ ἐκ ὁ  καί κατηγορέω καί τρίτος   ,  ποικίλλω ὁ  .
1232847	tlg9019.tlg001.opp-grc1	ἀνάγκη γὰρ τοὺς τρεῖς ὅρους τόν τε κατηγορούμενον καὶ τὸν ὑποκείμενον καὶ τὸν τρίτον προσκατηγορούμενον ὑποκείσθω γὰρ νῦν καὶ ὁ τρίτος προσκατηγορούμενος ὅρος) ἢ ὡρισμένους εἶναι ἢ τοὺς τρεῖς ἀορίστους, ἢ τοὺς μὲν ὡρισμένους εἶναι, τοὺς δὲ ἀορίστους.	ἀνάγκη γάρ ὁ  ὅρος ὁ τε κατηγορέω καί ὁ  καί ὁ τρίτος  ὑπόκειμαι γάρ νῦν καί ὁ τρίτος  ὅρος ) τίη  εἰμί ἤ ὁ  ἀόριστος , ἤ ὁ μέν  εἰμί , ὁ δέ ἀόριστος .
1232848	tlg9019.tlg001.opp-grc1	καὶ τούτων πάλιν ἢ οἱ ἄκροι ὡρισμένοι εἰσὶν ὁ δὲ μέσος ἀόριστος, ἢ ἔμπαλιν οἱ μὲν ἄκροι ἀόριστοι ὁ δὲ μέσος ὡρισμένος, ἢ οἱ ἐφεξῆς πρῶτοι ὡρισμένοι ὁ δὲ τελευταῖος ἀόριστος, ἢ ἔμπαλιν ὁ μὲν τελευταῖος ὡρισμένος οἱ δὲ πρῶτοι ἀόριστοι, ἢ ὁ μὲνᾱ ὡρισμένος δὲ δύο οἱ τελευταῖοι ἀόριστοι, ἢ ἔμπαλιν ὁ μὲνᾱ ἀόριστος οἱ δὲ # x772;	καί οὗτος πάλιν ἤ ὁ ἄκρος ὁρίζω εἰμί ὁ δέ  ἀόριστος , τίη ἔμπαλιν ὁ μέν ἄκρος ἀόριστος ὁ δέ  ὁρίζω , ἤ ἕ ἐφεξῆς πρῶτος ὁρίζω ὁ δέ τελευταῖος ἀόριστος , ἤ ἔμπαλιν ὁ μέν τελευταῖος ὁρίζω ὁ δέ πρῶτος ἀόριστος , ἤ ὁ μέν ᾱ ὁρίζω δέ γε ὁ τελευταῖος ἀόριστος , ἤ ἔμπαλιν ὁ μέν ᾱ ἀόριστος ὁ δέ   ;
1232849	tlg9019.tlg001.opp-grc1	β ὡρισμένοι.	ὁρίζω .
1232850	tlg9019.tlg001.opp-grc1	τὰ δὲ παραδείγματα τούτων τῷ βουλομένῳ γράψαι ἦσαν οὖν τῶν προτάσεων τῶν ἐκ τοῦ ὑποκειμένου καὶ κατηγορουμένου μόνον καταφάσεις0, ἐνταῦθα δὲ γεγόνασιν ἡ ἐπὶ τῶν.	ὁ δέ παράδειγμα οὗτος τῷ  γράφω εἰμί οὖν ὁ πρότασις ὁ ἐκ ὁ  καί κατηγορέω μόνος  0 , ἐνταῦθα δέ γίγνομαι ὁ ἐπί ὁ .
1232851	tlg9019.tlg001.opp-grc1	ἐκ τρίτου προσκατηγορουμένου·	ἐκ τρίτος  ·
1232852	tlg9019.tlg001.opp-grc1	ὡς εἶναι τέως ιβ.	ὡς εἰμί τέως  .
1232853	tlg9019.tlg001.opp-grc1	ταύτας τὰς προτάσεις τὰς δώδεκα πολυπλασιάζομεν ἐπὶ τὰς ἐκεῖ προτάσεις ἤιοι ἐπὶ τὰ τέσσα|ρα εἴδη τῶν προτάσεων τῶν καταφατικῶν, φημὶ δὴ ἐπὶ τὴν καθ’ ἕκαστα, ἐπὶ τὴν ἀπροσδιόριστον, ἐπὶ τὴν μερικὴν προσδιωρισμένην, ἐπὶ τὴν καθόλου προσδιωρισμένην.	οὗτος ὁ πρότασις ὁ δώδεκα  ἐπί ὁ ἐκεῖ πρότασις  ἐπί ὁ  εἶδος ὁ πρότασις ὁ  , φημί δή ἐπί ὁ κατά ἕκαστος , ἐπί ὁ  , ἐπί ὁ μερικός  , ἐπί ὁ καθόλου  .
1232854	tlg9019.tlg001.opp-grc1	αἱ οὖν ιβ προτάσεις τετραπλασιαζόμεναι ἐπὶ ταύτας τὰς προτάσεις γίνονταιμ# x772;	ὁ οὖν  πρότασις  ἐπί οὗτος ὁ πρότασις γίγνομαι μ #  ;
1232855	tlg9019.tlg001.opp-grc1	η# x772;	#  ;
1232856	tlg9019.tlg001.opp-grc1	.	.
1232857	tlg9019.tlg001.opp-grc1	ταύτας τἀςμ# x772;	οὗτος  μ #  ;
1232858	tlg9019.tlg001.opp-grc1	η# x772;	#  ;
1232859	tlg9019.tlg001.opp-grc1	πολυπλασίασον ἐπὶ τὴν τριμέρειαν καὶ γίνονται ρμδ.	ἐπί ὁ  καί γίγνομαι  .
1232860	tlg9019.tlg001.opp-grc1	ταύτας πάλιν πολυπλασίασον ἐπὶ τὴν τριμέρειαν τῆς ὕλης, καὶ γίνονταιυλβ.	οὗτος πάλιν  ἐπί ὁ  ὁ ὕλη , καί γίγνομαι υλβ .
1232861	tlg9019.tlg001.opp-grc1	τούτων τοίνυν τῶν υλβ πολυπλασιαζομένων ἐπὶ τοὺς τρεῖς τρόπους γίνονται χίλιαι διακόσιαι ἐνενήκοντα ἐξ·	οὗτος τοίνυν ὁ   ἐπί ὁ  τρόπος γίγνομαι χίλιοι διακόσιοι  ἐκ ·
1232862	tlg9019.tlg001.opp-grc1	εἴπομεν δὲ τρεῖς καὶ μόνον τρόπους, διότι τὸν δυνατὸν καθολικώτερον λέγει μόνον τοῦ τε ἀναγκαίου καὶ ἐνδεχομένου καὶ διαιρεῖσθαι εἰς τοὺς δύο τούτους τρόπους.	λέγω δέ  καί μόνος τρόπος , διότι ὁ  καθολικός λέγω μόνος ὁ τε ἀναγκαῖος καί  καί διαιρέω εἰς ὁ γε οὗτος τρόπος .
1232863	tlg9019.tlg001.opp-grc1	οὐδὲν οὖν ἐστι τὸ διαιρούμενον παρὰ τὰ εἰς ἃ διαιρεῖται, καὶ διὰ τοῦτο τρεῖς καὶ μόνον τρόπους φαμέν, ἀναγκαῖον καὶ ἐνδεχόμενον καὶ γεγόνασιν οὖν εἰκότως καταφάσεις τῶν τοιούτων προτάσεων α# x772;	οὖν εἰμί ὁ διαιρέω παρά ὁ εἰς ὅς διαιρέω , καί διά οὗτος  καί μόνος τρόπος φημί , ἀναγκαῖον καί  καί γίγνομαι οὖν εἰκός  ὁ τοιοῦτος   #  ;
1232864	tlg9019.tlg001.opp-grc1	σ# x772;	σ #  ;
1232865	tlg9019.tlg001.opp-grc1	ο # x772;	;
1232866	tlg9019.tlg001.opp-grc1	ς# x772;	#  ;
1232867	tlg9019.tlg001.opp-grc1	.	.
1232868	tlg9019.tlg001.opp-grc1	προστιθέαμεν καὶ τὰς ἄλλας καταφάσεις τὰς τοῦβ καὶ γ# x772;	καί ὁ ἄλλος  ὁ ὁ β καί  #  ;
1232869	tlg9019.tlg001.opp-grc1	τμήματος.	τμῆμα .
1232870	tlg9019.tlg001.opp-grc1	οὖν τὰ τοῦ β# x772;	οὖν ὁ ὁ  #  ;
1232871	tlg9019.tlg001.opp-grc1	τμήματος οβ αἱ γενόμεναι ἐκ τοῦ κατηγορουμένου καὶ μόνον, αἱ δὲ του γ τμήματος αἱ γενόμεναι ἐκ του ὑποκειμένου καὶ κατηγορουμένου καὶ τρίτου προσκατηγορουμένου ρμδ.	τμῆμα  ὁ γίγνομαι ἐκ ὁ κατηγορέω καί μόνος , ὁ δέ   τμῆμα ὁ γίγνομαι ἐκ   καί κατηγορέω καί τρίτος   .
1232872	tlg9019.tlg001.opp-grc1	ταύτας οὖν τὰς τοὐ β# x772;	οὗτος οὖν ὁ οὐ  #  ;
1232873	tlg9019.tlg001.opp-grc1	καὶ γ# x772;	καί  #  ;
1232874	tlg9019.tlg001.opp-grc1	τμήματοςσ# x772;	τμῆμα σ #  ;
1232875	tlg9019.tlg001.opp-grc1	ι# x772;	ι #  ;
1232876	tlg9019.tlg001.opp-grc1	ς# x772;	#  ;
1232877	tlg9019.tlg001.opp-grc1	συνάπτοντες ταῖς α# x772;	συνάπτω ὁ  #  ;
1232878	tlg9019.tlg001.opp-grc1	σ# x772;	σ #  ;
1232879	tlg9019.tlg001.opp-grc1	ο # x772;	;
1232880	tlg9019.tlg001.opp-grc1	ς# x772;	#  ;
1232881	tlg9019.tlg001.opp-grc1	αφιβ.	.
1232882	tlg9019.tlg001.opp-grc1	καὶ ἐπειδή, ὅσαι καταφάσεις, δῆλον ὅτι τοσαῦται καὶ ἀποφάσεις εἰσίν, ἔσονται πᾶσαι αἱ ἀποφάσεις καὶ καταφάσεις ἤτοι πᾶσαι αἱ προτάσεις ἃς ἐν παρόντι βιβλίῳ παραδέδωκεν ὁ φιλόσοφος γκδ.	καί ἐπεί , ὅσος  , δῆλος ὅτι2 τοσοῦτος καί ἀπόφημι εἰμί , εἰμί πᾶς ὁ ἀπόφασις καί  ἤτοι πᾶς ὁ πρότασις ὅς ἐν πάρειμι βιβλίον  ὁ φιλόσοφος  .
1232883	tlg9019.tlg001.opp-grc1	ἐν οἷς σὺν θεῷ καὶ τὸ β# x772;	ἐν  σύν θεός καί ὁ  #  ;
1232884	tlg9019.tlg001.opp-grc1	κεφάλαιον καὶ ἡ παροῦσα πρᾶξις πεληροῦται.	κεφάλαιος καί ὁ πάρειμι πρᾶξις  .
1232885	tlg9019.tlg001.opp-grc1	<Πρᾶξις β.	.
1232886	tlg9019.tlg001.opp-grc1	> p.	>  .
1232887	tlg9019.tlg001.opp-grc1	21a34 τούτων δὲ διωρισμένων <σκεπτέον> ὅπως ἀποφάσεις καὶ καταφάσεις πρὸς ἀλλήλας, καὶ τὰ ἑξῆς.	οὗτος δέ   ὅπως ἀπόφημι καί  πρός ἀλλήλων , καί ὁ ἑξῆς .
1232888	tlg9019.tlg001.opp-grc1	Εἴπομεν δὲ καὶ ἐν τῇ προτεραίᾳ ὅτι ἐν τούτῳ τῷ δ τμήματι δια- λέγεται περὶ τῶν προτάσεων τῶν μετὰ τρόπου τὰ δύο ταῦτα ζητῶν θεωρήματα, πρῶτον μὲν πῶς αἱ ἀποφάσεις γίνονται ἐκ τῶν καταφάσεων, δεύτερον δὲ περὶ τῆς ἀκολουθίας τῶν τοιούτων προτάσεων, ζητῶν ἐν τῷᾱ κεφαλαίῳ, τίνι συνάπτειν δέον τὴν οὔ ἄρνησιν, πότερον τῷ τρόπῳ τῷ ἔστι καὶ ἁπλῶς τῷ ῥήματι.	δέ καί ἐν ὁ προτεραῖος ὅτι2 ἐν οὗτος τῷ  τμῆμα  - λέγω περί ὁ πρότασις ὁ μετά τρόπος ὁ γε οὗτος  θεώρημα , πρῶτος μέν πῶς ὁ ἀπόφασις γίγνομαι ἐκ ὁ  , δεύτερος δέ περί ὁ ἀκολουθία ὁ τοιοῦτος πρότασις , ζητέω ἐν τῷ ᾱ κεφάλαιος ,  συνάπτω δέω ὁ οὐ ἄρνησις , πότερος τῷ τρόπος τῷ εἰμί καί ἁπλόος ὁ ῥῆμα .
1232889	tlg9019.tlg001.opp-grc1	ἐπὶ μὲν γὰρ τῶν ἄλλων εἰδῶν τῶν προτάσεων ἐν τῷ εἶναι συνάπτομεν τὴν οὔ ἄρνησιν·	ἐπί μέν γάρ ὁ ἄλλος εἰδοί ὁ πρότασις ἐν τῷ εἰμί  ὁ οὐ ἄρνησις ·
1232890	tlg9019.tlg001.opp-grc1	εἰ γὰρ μὴ τοῦτο ἐποιοῦμεν, εὑρίσκετό ποτε συμψευδομένη ἡ κατάφασις τῇ ἀποφάσει.	εἰ γάρ μή οὗτος  ,  ποτε  ὁ κατάφασις ὁ ἀπόφημι .
1232891	tlg9019.tlg001.opp-grc1	τῆς γὰρ καταφάσεως τῆς λεγούσης ‘ τὸ ξύλον ἄνθρωπος λευκός ἐστι’ ψευδοῦς οὔσης εἰ μὲν ἐποιήσαμεν τὴν ἀπόφασιν‘ τὸ ξύλον ἄνθρωπος λευκὸς οὐκ ἔστν’, ἀληθῆ ταύτην ἀπεργαζόμεθα·	ὁ γάρ κατάφασις ὁ λέγω  ὁ ξύλον ἄνθρωπος λευκός εἰμί ’ ψευδής εἰμί εἰ μέν ποιέω ὁ ἀπόφασις ‘ ὁ ξύλον ἄνθρωπος λευκός οὐ  , ἀληθής οὗτος ἀπεργάζομαι ·
1232892	tlg9019.tlg001.opp-grc1	εἰ δὲ εἴπωμεν ‘ τὸ ξύλον ἄνθρωπός ἐστιν οὐ λευκός’, καὶ ταύτην ὁμοίως τῇ καταφάσει συμψευδομένην ἐδείκνυμεν.	εἰ δέ λέγω  ὁ ξύλον ἄνθρωπος εἰμί οὐ λευκός ’ , καί οὗτος ὅμοιος ὁ κατάφασις   .
1232893	tlg9019.tlg001.opp-grc1	τοῦτο γὰρ λέγει ἡ ἀπόφασις αὕτη, ὅτι τὸ ξύλον ἄνθρωπος μέν ἐστιν, οὐ λευκὸς δέ, ὅπερ παρὰ πᾶσιν ὁμολογούμενόν ἐστι ψεῦδος.	οὗτος γάρ λέγω ὁ ἀπόφασις οὗτος , ὅτι2 ὁ ξύλον ἄνθρωπος μέν εἰμί , οὐ  δέ , ὅς παρά πᾶς  εἰμί ψεῦδος .
