id	filename	tokens	lemmas
1231934	tlg9019.tlg001.opp-grc1	ζητήσωμεν οὖν, ὑπὸ ποῖον εἶδος τοῦ ἁπλοῦ λόγου ἀναφέρεται ὁ ὁριστικὸς λόγος.	ζητέω οὖν , ὑπό ποιός εἶδος ὁ ἁπλόος λόγος ἀναφέρω ὁ ὁριστικός λόγος .
1231935	tlg9019.tlg001.opp-grc1	καὶ ὑπὸ μὲν τὸν ἀποφαντικὸν αὐτὸς εἶπεν ὅτι οὐκ ἀναφέρεται.	καί ὑπό μέν ὁ  αὐτός λέγω ὅτι2 οὐ ἀναφέρω .
1231936	tlg9019.tlg001.opp-grc1	εἰ δέ τις εἴποι ὅτι τὸ ἔστιν προσυπακούεται καὶ ὑπὸ τὸν ἀποφαντικὸν ἀνάγεται.	εἰ δέ τις λέγω ὅτι2 ὁ εἰμί  καί ὑπό ὁ  ἀνάγω .
1231937	tlg9019.tlg001.opp-grc1	λέγομεν‘ οὐκοῦν πᾶν σχεδὸν ὄνομα συνυπακουόμενον ἔχον τὸ ῥῆμα, καὶ τὸ ῥῆμα συνυπακουόμενον ἔχον τὸ ὄνομα ἢ τὴν ἀντωνυμίαν ἢ τὸ ἀπαρέμφατον λόγος ἐστίν. ’	λέγω ‘ οὐκοῦν πᾶς σχεδόν ὄνομα  ἔχω ὁ ῥῆμα , καί ὁ ῥῆμα  ἔχω ὁ ὄνομα τίη ὁ  ἤ ὁ  λόγος εἰμί .
1231938	tlg9019.tlg001.opp-grc1	εἰ δὲ τοῦτο οὐκ ἀληθές, ἐκ τῶν εἰρημένων δῆλον ὅτι ἕτερον εἶδός ἐστιν τῶν λόγων ὁ καλούμενος ὁριστικὸς λόγος, καὶ ἔσονται οὐκέτι εἴδη τοῦ ἁπλοῦ λόγου ἀλλὰ ἕξ.	εἰ δέ οὗτος οὐ ἀληθής , ἐκ ὁ λέγω δῆλος ὅτι2 ἕτερος  εἰμί ὁ λόγος ὁ καλέω ὁριστικός λόγος , καί εἰμί οὐκέτι εἶδος ὁ ἁπλόος λόγος ἀλλά  .
1231939	tlg9019.tlg001.opp-grc1	εἰ γὰρ ἀποφαντικός, ὡς αὐτὸς λέγει, οὐκ ἔστι, πολὺ πρότερον οὐδὲ εὐκτικὸς οὐδὲ προστακτικὸς οὐδὲ ἄλλος λόγος.	εἰ γάρ  , ὡς αὐτός λέγω , οὐ εἰμί , πολύς πρότερος οὐδέ  οὐδέ  οὐδέ ἄλλος λόγος .
1231940	tlg9019.tlg001.opp-grc1	p.	.
1231941	tlg9019.tlg001.opp-grc1	17a13 Δι’ ὅτι δὲ ἕν τί ἐστι ἀλλ’ οὐ πολλὰ τὸ ζῷον πεζὸν δίπουν — οὐ γὰρ δὴ τῷ δύνεγγυς εἰρῆσθαι εἶς ἔσται·	ὅτι2 δέ  τίς εἰμί ἀλλά οὐ πολύς ὁ  πεζός   οὐ γάρ δή τῷ  λέγω εἶμι εἰμί ·
1231942	tlg9019.tlg001.opp-grc1	ἔστι δὲ ἄλλης τοῦτο πραγματείας είπεῖν.	εἰμί δέ ἄλλος οὗτος πραγματεία  .
1231943	tlg9019.tlg001.opp-grc1	λέγει γὰρ ἐν ἄλλοις, οἷον ἐν τῷσόμῳ <τῶν> Μετὰ τὰ φυσικά, ὅτι ἐπειδὴ τὸ·	λέγω γάρ ἐν ἄλλος , οἷος ἐν   μετά ὁ φυσικός , ὅτι2 ἐπεί ὁ ·
1231944	tlg9019.tlg001.opp-grc1	σημαινόμενον ἕν ἐστι, ταῦτα δὲ συμπληροῦσι τὴν οὐσίαν τοῦ σημαινομένου πράγματος, διὰ τοῦτο εἷς λόγ.	σημαίνω  εἰμί , οὗτος δέ  ὁ οὐσία ὁ σημαίνω πρᾶγμα , διά οὗτος   .
1231945	tlg9019.tlg001.opp-grc1	ος ἐστὶ καὶ οὐ πολλοὶ ὁ τοῦ ἀνθρώπου ὁρισμός.	εἰμί καί οὐ πολύς ὁ ὁ ἄνθρωπος ὁρισμός .
1231946	tlg9019.tlg001.opp-grc1	τί δὲ βούλεται αὐτῷ σημαίνειν τὸ οὐ γὰρ δὴ τῷ σύνεγγυς εἰρῆσθαι;	τι δέ βούλομαι αὐτός σημαίνω ὁ οὐ γάρ δή τῷ σύνεγγυς λέγω ;
1231947	tlg9019.tlg001.opp-grc1	φαμὲν ὅτι σύνεγγυς εἶπεν ἀντὶ τοῦ χωρὶς συνδέσμου.	φημί ὅτι2 σύνεγγυς λέγω ἀντί ὁ χωρίς σύνδεσμος .
1231948	tlg9019.tlg001.opp-grc1	ἐν οἷς σὺν θεῷ ἡ πρᾶξις.	ἐν  σύν θεός ὁ πρᾶξις .
1231949	tlg9019.tlg001.opp-grc1	Πρᾶξις σὺν θεῷ ςݲ.	πρᾶξις σύν θεός  .
1231950	tlg9019.tlg001.opp-grc1	p.	.
1231951	tlg9019.tlg001.opp-grc1	17a15 Ἔστιν δὲ εἷς λόγος ἀποφαντικὸς ἤ ὁ ἕν δηλῶν ἢ δηλῶν ὁ εἷς, πολλοὶ δὲ οἱ πολλὰ καὶ μὴ ἓν ἢ οἱ ἀσύνδετοι.	δέ  λόγος  ἤ ὁ  δηλόω τίη δηλόω ὁ  , πολύς δέ ἕ πολύς καί μή  ἤ ὁ  .
1231952	tlg9019.tlg001.opp-grc1	Μετὰ τὴν διαίρεσιν τῶν ἀποφαντικῶν λόγων κατὰ τὸ πρότερον καὶ τὸ·	μετά ὁ διαίρεσις ὁ  λόγος κατά ὁ πρότερος καί ὁ ·
1231953	tlg9019.tlg001.opp-grc1	ὕστερον ἤγουν δεύτερον παραδίδωσιν καὶ τὴν ἐπιδιαίρεσιν κατὰ τὸ ἓν καὶ τὸ πλῆθος, παρακατιὼν δὲ καὶ τὴν διαίρεσιν τὴν κατὰ <τὸ> ἁπλοῦν καὶ τὸ διαφέρει δὲ τῆς διαιρέσεως ἐκείνης ἤτοι τῆς πρώτης κατὰ τὸ πρότερον καὶ τὸ δεύτερον αὕτη, διότι ἐκείνη μὲν ἀπὸ τῆς λέξεως εἴληπραι, αὕτη δὲ ἀπὸ τῆς σημασίας.	ὕστερον  δεύτερος  καί ὁ  κατά ὁ  καί ὁ πλῆθος ,  δέ καί ὁ διαίρεσις ὁ κατά  ἁπλόω καί ὁ διαφέρω δέ ὁ διαίρεσις ἐκεῖνος ἤτοι ὁ πρῶτος κατά ὁ πρότερος καί ὁ δεύτερος οὗτος , διότι ἐκεῖνος μέν ἀπό ὁ λέξις  , οὗτος δέ ἀπό ὁ σημασία .
1231954	tlg9019.tlg001.opp-grc1	ἐκείνῃ μὲν γὰρ εἷς λόγος ἐλέγετο πρῶτος ὁ συγκείμενος ἀπὸ δύο λέξεων ὡς τὸ‘ Σωκράτης βαδίζει’, δεύτερον δὲ εἷς λόγος ἐλέγετο ὁ ἐκ τριῶν συγκείμενος, ὡς τὸ‘ Σωχράτης <οὐ> βαδίζει᾿·	ἐκεῖνος μέν γάρ  λόγος λέγω πρῶτος ὁ  ἀπό γε  ὡς ὁ ‘  βαδίζω ’ , δεύτερος δέ  λόγος λέγω ὁ ἐκ   , ὡς ὁ ‘    ·
1231955	tlg9019.tlg001.opp-grc1	ταῦτα δέ ἐστι ἡ κατάφασις καὶ ἡ ἀπόφασις ἡ ἐκ του ὑποκειμένου καὶ κατηγορουμένου μόνον συγκειμένη.	οὗτος δέ εἰμί ὁ κατάφασις καί ὁ ἀπόφασις ὁ ἐκ   καί κατηγορέω μόνος  .
1231956	tlg9019.tlg001.opp-grc1	οἱ δὲ ἄλλοι πάντες συνδέσμῳ εἷς, ὡς ἐλέχθη·	ὁ δέ ἄλλος πᾶς σύνδεσμος  , ὡς λέγω ·
1231957	tlg9019.tlg001.opp-grc1	‘ Σωκράτης βαδίζει καὶ Πλατῶν διαλέγετατ’,‘ εἰ ἥλιος ὑπὲρ γῆν, ἡμέρα ἐστίν.’	‘  βαδίζω καί   , ‘ εἰ  ὑπέρ γῆ , ἡμέρα εἰμί . ’
1231958	tlg9019.tlg001.opp-grc1	ἡ δὲ νῦν παραδοθησομένη διαίρεσις ἀπὸ τῆς σημασίας τῶν δηλουμένων.	ὁ δέ νῦν  διαίρεσις ἀπό ὁ σημασία ὁ δηλόω .
1231959	tlg9019.tlg001.opp-grc1	ἐπὶ τούτων μὲν γὰρ <εἰ> ἕν ἐστι τὸ δηλούμενον, καλεῖται ὁ ἐκεῖνος εἷς, κἂν ἀπὸ πολλῶν λέξεων σύγκειται κατά τε τὸ κατηγορούμενον καὶ τὸ ὑποκείμενον·	ἐπί οὗτος μέν γάρ   εἰμί ὁ δηλόω , καλέω ὁ ἐκεῖνος  , ἐάν ἀπό πολύς λέξις σύγκειμαι κατά τε ὁ κατηγορέω καί ὁ  ·
1231960	tlg9019.tlg001.opp-grc1	εἰ δὲ πολλὰ ὦσιν τὰ σημαινόμενα, ὡς ἔχει ἐπὶ τῶν ὁμωνύμων, κἀν συμβῇ ἀπὸ δύο λέξεων συγκεῖσθαι, εἴτε κατὰ τὸ ὑποκείμενον εἴτε κατὰ τὸ κατηγορούμενον εἴτε κατ’ ἀμφότερα, τότε πολλοὶ λέγονται λόγοι καὶ οὐχ εἷς ὡς δυνάμει.	εἰ δέ πολύς εἰμί ὁ σημαίνω , ὡς ἔχω ἐπί ὁ ὁμώνυμος , ἐν  ἀπό γε λέξις σύγκειμαι , εἴτε κατά ὁ  εἴτε κατά ὁ κατηγορέω εἴτε κατά ἀμφότερος , τότε πολύς λέγω λόγος καί οὐ  ὡς δύναμις .
1231961	tlg9019.tlg001.opp-grc1	*** τὴν διαίρεσιν, ὅτι τῶν άποφαντικῶν λήγων ὁ μὲν〈 ἐν καθ’〉 ἑνὸς κατηγορεῖ ἢ καταφατικῶς ἢ ἀποφατικῶς, οἶον καταφατικῶς μὲν οἷον‘ ἄνθρωπος βαδίζει’, ἀποφατικῶς δὲ οἷον‘ ἄνθρωπος οὐ βαδίζει’, ἢ σχέσιν τινὰ σημαίνει·	* * ὁ διαίρεσις , ὅτι2 ὁ   ὁ μέν 〈 ἐν κατά 〉  κατηγορέω ἤ  τίη  , οἶος  μέν οἷος ‘ ἄνθρωπος βαδίζω ’ ,  δέ οἷος ‘ ἄνθρωπος οὐ βαδίζω ’ , ἤ σχέσις  σημαίνω ·
1231962	tlg9019.tlg001.opp-grc1	καὶ εἰ | σχέσιν, ἢ κατὰ ἀκολουθίν ἢ κατὰ διάζευξιν.	καί εἰ  σχέσις , ἤ κατά  ἤ κατά διάζευξις .
1231963	tlg9019.tlg001.opp-grc1	κατὰ ἀκολουθίαν μὲν οἷον‘ εἰ ἥλιος ὑπὲρ γῆν, ἡμέρα ἐστίν’·	κατά ἀκολουθία μέν οἷος ‘ εἰ  ὑπέρ γῆ , ἡμέρα εἰμί ’ ·
1231964	tlg9019.tlg001.opp-grc1	τοῦτο γὰρ δηλοῖ ὅτι τοῦ ἡλίου ὑπὲρ γῆν ὄντος ἡμέρα ἐστίν·	οὗτος γάρ δηλόω ὅτι2 ὁ ἥλιος ὑπέρ γῆ εἰμί ἡμέρα εἰμί ·
1231965	tlg9019.tlg001.opp-grc1	κατὰ διάζευξιν δὲ ‘ ἤτοι ἡμέρα ἐστὶν ἢ νύξ ἐστιν’.	κατά διάζευξις δέ  ἤτοι ἡμέρα εἰμί ἤ νύξ εἰμί ’ .
1231966	tlg9019.tlg001.opp-grc1	εἰ δὲ μήτε σχέσιν ἔχει δηλουμένην, μήτε ἓν καθ’ ἑνὸς κατηγορεῖ λόγος, οὕτως οὐ λέγεται εἷς ἀλλὰ πολλοί, ἢ ὡς ἐπὶ τῶν ὁμωνύμων ἢ ὡς ἐπὶ τῶν ἀσυνδέτων.	εἰ δέ μήτε σχέσις ἔχω δηλόω ,   κατά  κατηγορέω λόγος , οὕτως οὐ λέγω  ἀλλά πολύς , ἤ ὡς ἐπί ὁ ὁμώνυμος ἤ ὡς ἐπί ὁ  .
1231967	tlg9019.tlg001.opp-grc1	οὕτως εἰρηκὼς τὴν διαίρεσιν ὑπογράφει τὴν ἀπόφανσιν, ἀλλ’ ὡς ἐκ τῶν ὑφ’ αὑτὴν λέγων ὅτι ἀπόφανσίς ἐστι λόγος σημαίνων τινὶ ὑπάρχειν ἢ μὴ ὑπάρχειν.	οὕτως λέγω ὁ διαίρεσις ὑπογράφω ὁ  , ἀλλά ὡς ἐκ ὁ ὑπό  λέγω ὅτι2  εἰμί λόγος σημαίνω  ὑπάρχω τίη μή ὑπάρχω .
1231968	tlg9019.tlg001.opp-grc1	τὸ δέ τινι ὑπάρχειν δηλοῖ τὴν κατάφασιν, τὸ δέ τινι μὴ ὑπάρχειν δηλοῖ τὴν ἀπόφασιν.	ὁ δέ  ὑπάρχω δηλόω ὁ κατάφασις , ὁ δέ  μή ὑπάρχω δηλόω ὁ ἀπόφασις .
1231969	tlg9019.tlg001.opp-grc1	ὅσα δὲ ἔδει πρὸς τοῦτο λέγεσθαι ἤδη φθάσαντες ἀπεδώκαμεν.	ὅσος δέ δέω πρός οὗτος λέγω ἤδη φθάνω  .
1231970	tlg9019.tlg001.opp-grc1	|p.	.
1231971	tlg9019.tlg001.opp-grc1	17a25 Κατάφασις δέ ἐστι λόγος ἀποφαντικός τινος κατά τινος, ἀπόφασις δέ ἐστι λόγος ἀποφαντικός τινος ἀπό τινος.	δέ εἰμί λόγος   κατά  , ἀπόφασις δέ εἰμί λόγος   ἀπό  .
1231972	tlg9019.tlg001.opp-grc1	συνάπτει δὲ τοῖς εἰρημένοις καὶ τὴν τρίτην διαίρεσιν κατὰ τὸ ἁπλοῦν οὖσαν καὶ τὸ σύνθετον λέγων ὅτι ἁπλῆ μὲν ἀπόφανσίς ἐστι κατάφασις ἢ ἀπόφασις, οἷον‘ Σωκράτης βαδίζει, Σωκράτης οὐ βαδίζει’, σύνθετος δὲ ἀπόφανσις ἡ ἐκ δύο ὃς καταφάσεων συγκειμένη ἢ ἐκ δύο ἀποφάσεων ἢ μιᾶς μὲν καταφάσεως μιᾶς δὲ ἀποφάσεως.	συνάπτω δέ ὁ λέγω καί ὁ τρίτος διαίρεσις κατά ὁ ἁπλόος εἰμί καί ὁ σύνθετος λέγω ὅτι2 ἁπλόος μέν  εἰμί κατάφασις ἤ ἀπόφασις , οἷος ‘  βαδίζω ,  οὐ βαδίζω ’ , σύνθετος δέ ἀπόφανσις ὁ ἐκ γε ὅς   τίη ἐκ γε ἀπόφασις τίη  μέν κατάφασις  δέ ἀπόφασις .
1231973	tlg9019.tlg001.opp-grc1	οὐ δεῖ θαυμάζειν ὅτι καὶ ἐν τῇ πρώτῃ διαιρέσει ἕνα λόγον εἶπεν τὸν δεσμῷ τὴν ἑνότητα ἔχοντα καὶ ἐνταῦθα πάλιν εἶπεν συνδέσμῳ εἷς.	οὐ δέω θαυμάζω ὅτι2 καί ἐν ὁ πρῶτος διαίρεσις  λόγος λέγω ὁ δεσμός ὁ ἑνότης ἔχω καί ἐνταῦθα πάλιν λέγω σύνδεσμος  .
1231974	tlg9019.tlg001.opp-grc1	καὶ γὰρ οὐδὲν ἀδύνατον ἔν τινι σκέλει τῆς πρώτης διαιρέσεως ἐμπεριέχεσθαι καί τι σκέλος τῆς δευτέρας διαιρέσεως κατ’ ἄλλην ἔννοιαν, ὡς ἔχει ἐπὶ τοὐ ποσοῦ.	καί γάρ  ἀδύνατος ἐν  σκέλος ὁ πρῶτος διαίρεσις ἐμπεριέχω καί τις  ὁ δεύτερος διαίρεσις κατά ἄλλος ἔννοια , ὡς ἔχω ἐπί   .
1231975	tlg9019.tlg001.opp-grc1	εἴπομεν γὰρ ἐκεῖ ὅτι τοῦ ποσοῦ τὸ μέν ἐστι διωρισμένον, τὸ δὲ συνεχές·	λέγω γάρ ἐκεῖ ὅτι2 ὁ  ὁ μέν εἰμί διορίζω , ὁ δέ συνεχής ·
1231976	tlg9019.tlg001.opp-grc1	καὶ πάλιν τοῦ ποσοῦ τὸ μέν ἐστι θετόν, τὸ δὲ ἄθετον.	καί πάλιν ὁ  ὁ μέν εἰμί θετός , ὁ δέ ἄθετος .
1231977	tlg9019.tlg001.opp-grc1	ἐνταῦθα γὰρ τὸ θετὸν πάντως ἐν τῷ συνεχεῖ ποσῷ θεωρεῖται·	ἐνταῦθα γάρ ὁ  πᾶς ἐν ὁ συνεχής  θεωρέω ·
1231978	tlg9019.tlg001.opp-grc1	εἴ τι μὲν γὰρ θετόν, πάντως συνεχές, οὐκ εἴ τι δὲ συνεχές, πάντως τοῦτο καὶ θετόν ἐστιν, ὡς ἐκεῖσε σαφέστατα τὴν ἀπόδειξιν ἐποιησάμεθα.	εἰ τι μέν γάρ θετός , πᾶς συνεχής , οὐ εἰ τις δέ  , πᾶς οὗτος καί θετός εἰμί , ὡς ἐκεῖσε σαφής ὁ ἀπόδειξις ποιέω .
1231979	tlg9019.tlg001.opp-grc1	πάλιν καὶ ἐν τῇ διαιρέσει τοῦ ζῴου τὸ αὐτὸ συμβέβηκεν.	πάλιν καί ἐν ὁ διαίρεσις ὁ  ὁ αὐτός συμβαίνω .
1231980	tlg9019.tlg001.opp-grc1	φαμὲν γὰρ τοῦ ζῴου τὸ μὲν λογικόν, τὸ δὲ ἄλογον·	φημί γάρ ὁ ζῷον ὁ μέν λογικός , ὁ δέ ἄλογος ·
1231981	tlg9019.tlg001.opp-grc1	καὶ πάλιν τοῦ ζῴου τὸ μὲν θνητόν, τὸ δὲ ἀθάνατον.	καί πάλιν ὁ ζῷον ὁ μέν θνητός , ὁ δέ ἀθάνατος .
1231982	tlg9019.tlg001.opp-grc1	καὶ ἐνταῦθα γὰρ δῆλον ὅτι ἔστι τὸ ἄλογον θνητὸν πάντως·	καί ἐνταῦθα γάρ δῆλος ὅτι2 εἰμί ὁ ἄλογος θνητός πᾶς ·
1231983	tlg9019.tlg001.opp-grc1	οὐ πάντως δὲ τὸ θνητὸν ἤδη καὶ ἄλογον·	οὐ πᾶς δέ ὁ θνητός ἤδη καί ἄλογος ·
1231984	tlg9019.tlg001.opp-grc1	ὁ γὰρ ἄνθρωπος θνητὸς μέν ἐστιν, οὐκ ἄλογος δέ, ἀλλὰ λογικὸς θνητός ἐστιν.	ὁ γάρ ἄνθρωπος θνητός μέν εἰμί , οὐ  δέ , ἀλλά  θνητός εἰμί .
1231985	tlg9019.tlg001.opp-grc1	καὶ ταῦτα μὲν ἄχρι τούτων.	καί οὗτος μέν ἄχρι οὗτος .
1231986	tlg9019.tlg001.opp-grc1	λοιπὸν ἄρχεται διαλέγεσθαι καὶ περὶ ἀντιφάσεως.	λοιπός ἄρχω διαλέγω καί περί ἀντίφασις .
1231987	tlg9019.tlg001.opp-grc1	τί δέ ἐστιν ἀντίφασις καὶ ποῖα τὰ χαρακτηρίζοντα ταύτην, ἐν ἑτέρᾳ θεωρίᾳ μαθησόμεθα.	τίς δέ εἰμί ἀντίφασις καί ποιός ὁ  οὗτος , ἐν ἕτερος θεωρία μανθάνω .
1231988	tlg9019.tlg001.opp-grc1	p.	.
1231989	tlg9019.tlg001.opp-grc1	17a15 Ἔστι δὲ εἶς λόγος ἀποφαντικὸς ἤ ὁ ἕν δηλῶν ἤ ὁ συνδέσμῳ εἷς, πολλοὶ δὲ οἱ πολλὰ καὶ μὴ ἕν.	εἰμί δέ εἶμι λόγος  ἤ ὁ  δηλόω ἤ ὁ σύνδεσμος  , πολύς δέ ἕ πολύς καί μή  .
1231990	tlg9019.tlg001.opp-grc1	ἄξιον δέ ἐστι ζητῆσαι διὰ τί προσέθηκεν καὶ μὴ ἕν, καὶ μὴ εἶπεν‘ πολλοὶ δέ εἰσιν οἱ πολλὰ σημαίνοντες’ καὶ ἠρκέσθη τούτοις.	ἄξιος δέ εἰμί ζητέω διά τίς προστίθημι καί μή  , καί μή λέγω ‘ πολύς δέ εἰμί ἕ πολύς σημαίνω ’ καί ἀρκέω οὗτος .
1231991	tlg9019.tlg001.opp-grc1	καὶ λέγομεν πρὸς τοῦτο ὅτι ἡ καθόλου ἀπόφασις καὶ πολλὰ σημαίνει καὶ ἕν·	καί λέγω πρός οὗτος ὅτι2 ὁ καθόλου ἀπόφασις καί πολύς σημαίνω καί  ·
1231992	tlg9019.tlg001.opp-grc1	ὁμοίως καὶ ἡ καθόλου κατάφασις.	ὅμοιος καί ὁ καθόλου κατάφασις .
1231993	tlg9019.tlg001.opp-grc1	οἷον‘ πᾶς ἄνθρωπος ἀναπνεῖ’ καὶ πάντας τοὺς καθ’ ἕκαστα σημαίνει ἀνθρώπους καὶ μίαν ἑνικὴν φύσιν σημαίνει τὴν ἀνθρωπίνην.	οἷος ‘ πᾶς ἄνθρωπος ἀναπνέω ’ καί πᾶς ὁ κατά ἕκαστος σημαίνω ἄνθρωπος καί   φύσις σημαίνω ὁ  .
1231994	tlg9019.tlg001.opp-grc1	οὕτως ἔχει καὶ ἡ ἔχουσα καθόλου ἀπόφασις‘ οὐσεὶς ἄνθρωπος ἵπταται.	οὕτως ἔχω καί ὁ ἔχω καθόλου ἀπόφασις ‘  ἄνθρωπος πέτομαι .
1231995	tlg9019.tlg001.opp-grc1	εἰ τοίνυν εἶπεν οὕτως ὅτι‘ πολλοὶ δὲ λόγοι εἰσὶν οἱ πολλὰ σημαίνοντες’, συμπεριελάμβανεν ἂν καὶ τὴν τοιαύτην πρότασιν.	εἰ τοίνυν λέγω οὕτως ὅτι2 ‘ πολύς δέ λόγος εἰμί ὁ πολύς σημαίνω ’ ,  ἐάν καί ὁ τοιοῦτος πρότασις .
1231996	tlg9019.tlg001.opp-grc1	p.	.
1231997	tlg9019.tlg001.opp-grc1	17a16 Ἢ ὁ συνδέσμῳ εἷς·	ὁ σύνδεσμος  ·
1231998	tlg9019.tlg001.opp-grc1	λέγει Ἰάμβλιχος ὅτι ἄνω τὸ‘ συνδέσμῳ εἶς’ ἐπὶ συμπλεκτικῶν συνδέσμων εἶπεν, τοὺς μὴ σημαίνοντας σχέσιν δύο πραγματων ἢ πολλῶν, ὡς τὸ‘ Σωκράτης βαδίζει καὶ Πλατῶν διαλέγεται’, ἐνταῦθα δὲ συνδέσμῳ εἷς εἶπεν αἰνιττόμενος τὰς ὑποθετικὰς προτάσεις, οἷον‘ εἰ ὁ ἥλιος ὑπὲρ γῆν, ἡμέρα ἐστίν.’	λέγω  ὅτι2 ἄνω2 ὁ ‘ σύνδεσμος εἶμι ’ ἐπί συμπλεκτικός  λέγω , ὁ μή σημαίνω σχέσις γε  ἤ πολύς , ὡς ὁ ‘  βαδίζω καί  διαλέγω ’ , ἐνταῦθα δέ σύνδεσμος  λέγω  ὁ  πρότασις , οἷος ‘ εἰ ὁ  ὑπέρ γῆ , ἡμέρα εἰμί . ’
1231999	tlg9019.tlg001.opp-grc1	οὐκ ἔστιν δὲ τοῦτο ἀληθές·	οὐ εἰμί δέ οὗτος ἀληθής ·
1232000	tlg9019.tlg001.opp-grc1	οὐδὲ γὰρ ἔχει δεῖξαι ὅτι ἐπὶ τῆς ἐννοίας ταύτης τέθεικεν ὁ φιλόσοφος τὸ ἢ συνδέσμῳ εἷς.	οὐδέ γάρ ἔχω δείκνυμι ὅτι2 ἐπί ὁ ἔννοια οὗτος  ὁ φιλόσοφος ὁ τίη σύνδεσμος  .
1232001	tlg9019.tlg001.opp-grc1	ἀλλ’ ὥσπερ εἶπον, οὐδὲν ἀδύνατον ἓν τῶν σκελῶν τῆς διαιρέσεως ἐν τῷ ἑτέρῳ θεωρεῖσθαι.	ἀλλά ὥσπερ λέγω ,  ἀδύνατος  ὁ  ὁ διαίρεσις ἐν ὁ ἕτερος θεωρέω .
1232002	tlg9019.tlg001.opp-grc1	αὐτὸς γὰρ παρακατιὼν λέγει εὐθὺς ὅτι ἁπλῆ ἀπόφανσίς ἐστιν ἡ ἓν καθ’ ἑνὸς κατηγοροῦσα, σύνθετος δὲ ἡ ἐκ τούτων συγκειμένη·	αὐτός γάρ  λέγω εὐθύς ὅτι2 ἁπλόος  εἰμί ὁ  κατά  κατηγορέω , σύνθετος δέ ὁ ἐκ οὗτος  ·
1232003	tlg9019.tlg001.opp-grc1	ὡσαυτως δὲ καὶ ἐπὶ τῶν| ἀποφάσεων.	δέ καί ἐπί ὁ | ἀπόφασις .
1232004	tlg9019.tlg001.opp-grc1	ὥστε ἐν τοῖς τρισὶ σκέλεσιν ἐξ ἀνάγκης τὸ αὐτὸ εἶπεν κατὰ τὸν Ἀμμώνιον.	ὡς ἐν ὁ  σκέλος ἐκ ἀνάγκη ὁ αὐτός λέγω κατά ὁ Ἀμμώνιος2 .
1232005	tlg9019.tlg001.opp-grc1	ἐν οἷς ἡ πρᾶξις.	ἐν  ὁ πρᾶξις .
1232006	tlg9019.tlg001.opp-grc1	Πρᾶξις σὺν θεῷ ζ΄.	πρᾶξις σύν θεός  .
1232007	tlg9019.tlg001.opp-grc1	p.	.
1232008	tlg9019.tlg001.opp-grc1	17a26 Ἐπεὶ δὲ ἔστι καὶ τὸ ὑπάρχον ἀποφαίνεσθαι ὡς μὴ ὑπάρχον καὶ τὸ μὴ ὑπάρχον ὡς ὑπάρχον καὶ τὸ ὑπάρχον ὡς ὑπάρχον καὶ τὸ μὴ ὑπάρχον ὡς μὴ ὑπάρχον καὶ τὰ ἑξῆς.	δέ εἰμί καί ὁ ὑπάρχω ἀποφαίνω ὡς μή ὑπάρχω καί ὁ μή ὑπάρχω ὡς ὑπάρχω καί ὁ ὑπάρχω ὡς ὑπάρχω καί ὁ μή ὑπάρχω ὡς μή ὑπάρχω καί ὁ ἑξῆς .
1232009	tlg9019.tlg001.opp-grc1	Ἀποδέωκεν τί ἐστιν ὁ καθόλου λόγος, ἔτι δὲ καὶ τί ἐστιν ἀπόφανσις, πρὸς τούτοις δὲ τί ἐστι κατάφασίς τε καὶ ἀπόφασις.	τι εἰμί ὁ καθόλου λόγος , ἔτι δέ καί τι εἰμί ἀπόφανσις , πρός οὗτος δέ τι εἰμί  τε καί ἀπόφασις .
1232010	tlg9019.tlg001.opp-grc1	ἐντεῦθεν ἄρχεται διδάσκειν καὶ περὶ τῆς καλουμένης ἀντιφάσεως καὶ προσδιορίζεται τί ἐστιν ἀντίφασις καὶ ποῖα τὰ συντρέχοντα εἰς τὸ δεῖν γενέσθαι ἀντίφασιν.	ἐντεῦθεν ἄρχω διδάσκω καί περί ὁ  ἀντίφασις καί  τι εἰμί ἀντίφασις καί ποιός ὁ  εἰς ὁ δέω γίγνομαι ἀντίφασις .
1232011	tlg9019.tlg001.opp-grc1	πρὸς δὲ τὴν εὕρεσιν ταύτης προλαμβάνει τι λημμάτιον.	πρός δέ ὁ εὕρεσις οὗτος προλαμβάνω  λημμάτιον .
