id	filename	tokens	lemmas
1232389	tlg9019.tlg001.opp-grc1	τι λημμάτιον ἀπό τινων πρὸς τὴν τοῦ ἐνδεχομένου ἀναίρεσιν.	τι  ἀπό  πρός ὁ ὁ  ἀναίρεσις .
1232390	tlg9019.tlg001.opp-grc1	ἔστι δὲ τοῦτο ὅτι τῇ ἀληθείᾳ τῶν λόγων ἕπεται ἡ ὕπαρξις τοῦ πράγματος καὶ τῷ ψεύδει τῶν λόγων ἡ ἀνυπαρξία.	εἰμί δέ οὗτος ὅτι2 ὁ ἀλήθεια ὁ λόγος  ὁ  ὁ πρᾶγμα καί ὁ ψεῦδος ὁ λόγος ὁ  .
1232391	tlg9019.tlg001.opp-grc1	ἀναιρεθήσεται <ἄρα> τὸ ἐνδεχόμενον.	ὁ  .
1232392	tlg9019.tlg001.opp-grc1	εἰ γὰρ ἀληθὴς ἦν ὁ λόγος ὁ λέγων χθὲς περὶ τοῦ σήμερον τεχθέντος παιδίου ὅτι τεχθήσεται παιδίον αὔριον μέγα τε καὶ λευκόν, πάντως καὶ τεχθήσεται.	εἰ γάρ ἀληθής εἰμί ὁ λόγος ὁ λέγω χθές περί ὁ σήμερον τίκτω παιδίον ὅτι2  παιδίον  μέγας τε καί λευκός , πᾶς καί τίκτω .
1232393	tlg9019.tlg001.opp-grc1	καὶ ἀντιστρόφως εἰ τεχθήσεται, πάντως ἀληθὴς ὁ λόγος.	καί ἀντίστροφος εἰ  , πᾶς ἀληθής ὁ λόγος .
1232394	tlg9019.tlg001.opp-grc1	πάλιν εἰ ψευδὴς ἦν ὁ λόγος ὁ λέγων ὅτι αὔριον τόδε τι γίνεται, οὑ γίνεται.	πάλιν εἰ ψευδής εἰμί ὁ λόγος ὁ λέγω ὅτι2 αὔριον ὅδε τις γίγνομαι ,  γίγνομαι .
1232395	tlg9019.tlg001.opp-grc1	καὶ ἐὰν οὐ γίνεται, ψευδὴς ὁ λόγος.	καί ἐάν οὐ γίγνομαι , ψευδής ὁ λόγος .
1232396	tlg9019.tlg001.opp-grc1	εἰ τοίνυν ὡρισμένων ἀληθές ἐστιν ἐπὶ τῶν καθ’ ἕκαστα γινομένων ὅτι τόδε τί ἐστιν αὔριον, οἶον ὅτι ἔσται ναυμαχία, πάντως ἔσται ναυμαχία, καὶ πάντα ἐξ ἀνάγκης γίνονται*** οὐδὲν γὰρ κωλύει εἰς τοσοῦτον πλῆθος ἐτῶν τὸν μὲν καταφάσκειν <τὸν δὲ ἀποφάσκειν>.	εἰ τοίνυν  ἀληθής εἰμί ἐπί ὁ κατά ἕκαστος  ὅτι2 ὅδε τίς εἰμί αὔριον , οἶος ὅτι2  ναυμαχία , πᾶς  ναυμαχία , καί πᾶς ἐκ ἀνάγκη γίγνομαι * * * οὐδείς γάρ κωλύω εἰς  πλῆθος ἔτος ὁ μέν   δέ  .
1232397	tlg9019.tlg001.opp-grc1	εἰ δὲ τοῦτο, ἄτοπον ἔσται τὸ ἀναιρεὶσθαι τὸ ἐνδεχόμενον.	εἰ δέ οὗτος , ἄτοπος εἰμί ὁ  ὁ  .
1232398	tlg9019.tlg001.opp-grc1	καὶ γὰρ βουλευτικοί ἐσμεν.	καί γάρ βουλευτικός εἰμί .
1232399	tlg9019.tlg001.opp-grc1	τὸ δὲ βουλεύεσθαι οὐκ ἔστιν μάτην.	ὁ δέ βουλεύω οὐ εἰμί μάτην .
1232400	tlg9019.tlg001.opp-grc1	οὐδὲν γὰρ μάτην|οὔτε ὁ θεὸς οὔτε ἡ φύσις ποιεῖ.	οὐδείς γάρ  ὁ  οὔτε ὁ φύσις ποιέω .
1232401	tlg9019.tlg001.opp-grc1	βουλευόμεθα δὲ οὔτε περὶ τῶν ἀναγκαίων οὔτε πεὶ τῶν ἀδυνάτων( οὐδεὶς γὰρ βουλεύεται ἢ‘ δεῖ με ἵπτασθαι’ ἢ‘ δεῖ με ἀναπνεῦσαι; ’	δέ οὔτε περί ὁ ἀναγκαῖος οὔτε  ὁ ἀδύνατος (  γάρ βουλεύω τίη ‘ δέω   ἤ ‘ δέω  ἀναπνέω ;
1232402	tlg9019.tlg001.opp-grc1	) ἀλλὰ περὶ τῶν ἐνδεχομένων.	) ἀλλά περί ὁ  .
1232403	tlg9019.tlg001.opp-grc1	ἔστιν ἄρα τὸ ἐνδεχόμενον.	εἰμί ἄρα ὁ  .
1232404	tlg9019.tlg001.opp-grc1	εἰ δὲ ἔστιν τὸ ἐνδεχομενον, οὐκ ἔστιν μία τῶν ἀντικειμένων τούτων τῶν προτάσεων ὡρισμένως πάντως ἢ άληθὴς ἢ ψευδής.	εἰ δέ εἰμί ὁ  , οὐ εἰμί  ὁ  οὗτος ὁ  ὁρίζω πᾶς τίη  ἤ ψευδής .
1232405	tlg9019.tlg001.opp-grc1	καὶ ταῦτα μέν εἰσιν τὰ παραδιδόμενα.	καί οὗτος μέν εἰμί ὁ παραδίδωμι .
1232406	tlg9019.tlg001.opp-grc1	ἐπιφέρει δὲ καὶ ἄλλην τελειοτέραν ἐπίλυσιν ἥν ἐν ἑτέρᾳ θεωρίᾳ σὺν θεῷ μαθησόμεθα.	ἐπιφέρω δέ καί ἄλλος τέλειος ἐπίλυσις ὅς ἐν ἕτερος θεωρία σύν θεός μανθάνω .
1232407	tlg9019.tlg001.opp-grc1	ρ.	.
1232408	tlg9019.tlg001.opp-grc1	18 α 28 Ἐπὶ μὲν οὖν τῶν ὄντων καὶ γενομένων ἀνάγκη τὴν κατάφασιν ἢ τὴν ἀπόφασιν ἀληθῆ ἢ ψευδῆ εἶναι.	μέν οὖν ὁ εἰμί καί γίγνομαι ἀνάγκη ὁ κατάφασις τίη ὁ ἀπόφασις ἀληθής ἤ ψευδής εἰμί .
1232409	tlg9019.tlg001.opp-grc1	ἐνταῦτα δεῖ προσθεῖναι τὸ ὡρισμένως, ἐπεὶ πάντως ἡ μὲν αὐτῶν ἀληθής ἡ δὲ ψευδής.	δέω προστίθημι ὁ ὁρίζω , ἐπεί πᾶς ὁ μέν αὐτός ἀληθής ὁ δέ ψευδής .
1232410	tlg9019.tlg001.opp-grc1	*** τί οὖν λέγομεν περὶ τοῦ θείου;	* * τι οὖν λέγω περί ὁ θεῖος ;
1232411	tlg9019.tlg001.opp-grc1	ἡμῖν μὲν γὰρ ἀόριστόν ἐστι καὶ οὐκ ἵσμιεν ἆρὰ γε ἔσται αὔριον ναυμαχία ἢ οὐκ ἔσται.	μέν γάρ ἀόριστος εἰμί καί    γε  αὔριον ναυμαχία ἤ οὐ εἰμί .
1232412	tlg9019.tlg001.opp-grc1	ὁ δὲ θεὸς ὡρισμένως ἐπίστατι τὅτι πάντως ἔσται ἤ οὐκ ἔσται.	ὁ δέ  ὁρίζω   πᾶς εἰμί ἤ οὐ εἰμί .
1232413	tlg9019.tlg001.opp-grc1	ἡμεῖς δὲ τὸ ὅλον τοῦτο ‘ ἥ ἔσται ἢ οὐκ ἔσται ἐπιστάμεθα, αὐτὸς δὲ τὸ ἕν, εἴτε ἔσται εἴτε οὐκ ἔσται.	δέ ὁ ὅλος οὗτος  ὁ εἰμί ἤ οὐ εἰμί ἐφίστημι , αὐτός δέ ὁ  , εἴτε  εἴτε οὐ  .
1232414	tlg9019.tlg001.opp-grc1	πρὸς δὲ τοῦτο λέγομεν ὅτι οὐ καθὸ ἐπίσταται, διὰ τοῦτο γίνεται( οὐ γάρ ἐστιν ἡ γνῶσις τοῦ θεωῦ αἰτία τοῦ γίνεσθαι τὸ πρὰγμα) ἀλλὰ τοὐναντίον.	πρός δέ οὗτος λέγω ὅτι2 οὐ καθό ἐφίστημι , διά οὗτος γίγνομαι ( οὐ γάρ εἰμί ὁ γνῶσις ὁ  αἰτία ὁ γίγνομαι ὁ  ) ἀλλά ἐναντίον .
1232415	tlg9019.tlg001.opp-grc1	ἐπειδὴ γὰρ τὸ πρᾶγμα, αἰτίαόν ἐστι τοῦτο τοῦ προγινώσκειν τὸ θεῖον.	ἐπεί γάρ ὁ πρᾶγμα ,  εἰμί οὗτος ὁ προγιγνώσκω ὁ θεῖον .
1232416	tlg9019.tlg001.opp-grc1	p.	.
1232417	tlg9019.tlg001.opp-grc1	18a34 Εἰ γὰρ πᾶσα κατάφασις καὶ ἀπόφασις ἀληθὴς ἤ ψευδής, καὶ ἅπαν ἀνάγκη ὑπάρχειν ἢ μὴ ὑπάρχειν.	γάρ πᾶς κατάφασις καί ἀπόφασις ἀληθής ἤ ψευδής , καί ἅπας ἀνάγκη ὑπάρχω ἤ μή ὑπάρχω .
1232418	tlg9019.tlg001.opp-grc1	ἐντεῦθεν λαμβάνει τὴν ὑπόθεσιν τὴν λέγουσαν ὅτι τῇ ἀληθείᾳ τῶν λόγων ἡ τῶν πραγμάτων ὕπαρξις καὶ τῷ ψεύδει τῶν λόγων ἡ τῶν πραγμάτων ἀνυπαρξία ἕπεται.	ἐντεῦθεν λαμβάνω ὁ ὑπόθεσις ὁ λέγω ὅτι2 ὁ ἀλήθεια ὁ λόγος ὁ ὁ πρᾶγμα  καί ὁ ψεῦδος ὁ λόγος ὁ ὁ πρᾶγμα   .
1232419	tlg9019.tlg001.opp-grc1	ἔστιν δὲ ὑπόθεσις ψευδὴς εἰς ἀδύνατον προαγομένη, καὶ ἔστιν τὸ σχῆμα τοῦτο εἰς ἀδύνατον ἀπαγωγή.	εἰμί δέ ὑπόθεσις ψευδής εἰς ἀδύνατος  , καί εἰμί ὁ σχῆμα οὗτος εἰς ἀδύνατος ἀπαγωγή .
1232420	tlg9019.tlg001.opp-grc1	p.	.
1232421	tlg9019.tlg001.opp-grc1	18a38 Ἄμφω γὰρ οὐχ ὑπάρξει ἅμα ἐπὶ τοῖς τοιούτοις.	γάρ οὐ ὑπάρχω ἅμα ἐπί ὁ τοιοῦτος .
1232422	tlg9019.tlg001.opp-grc1	τὰς ἀπροσδιορίστους αἰνιττόμενος τοῦτό φησιν τὰς ἐχούσας ἴδιον τὸ συναληθεύειν ἢ τὸ συμψεύδεσθαι.	ὁ    φημί ὁ ἔχω ἴδιος ὁ  ἤ ὁ  .
1232423	tlg9019.tlg001.opp-grc1	φησὶν τοίνυν ὅτι ἐπὶ τῶν καθ’ ἕκαστα προτάσεων οὐ συμβαίνει τοῦτο.	φημί τοίνυν ὅτι2 ἐπί ὁ κατά ἕκαστος πρότασις οὐ συμβαίνω οὗτος .
1232424	tlg9019.tlg001.opp-grc1	p.	.
1232425	tlg9019.tlg001.opp-grc1	18b9 Ἔτι εἰ ἔστι λευκὸν νῦν, ἀληθὲς ἦν εἰπεῖν πρότερον ὅτι ἔσται λευκόν.	ἔτι εἰ εἰμί λευκός νῦν , ἀληθής εἰμί λέγω  ὅτι2  λευκός .
1232426	tlg9019.tlg001.opp-grc1	ἐντεῦθεν κατασκευὴν λαμ|βάνει τῆς ληφθείσης ὑποθέσεως ὅτι τῇ ἀληθείᾳ τῶν λόγων ἡ τῶν πραγμάτων ἔκβασις ἀκολουθεῖ.	ἐντεῦθεν κατασκευή  ὁ λαμβάνω ὑπόθεσις ὅτι2 ὁ ἀλήθεια ὁ λόγος ὁ ὁ πρᾶγμα ἔκβασις ἀκολουθέω .
1232427	tlg9019.tlg001.opp-grc1	p.	.
1232428	tlg9019.tlg001.opp-grc1	18b16 Ἀλλὰ μὴν οὐδὲ ὡς οὐδέτερόν γε ἀληθὲς ἐνδέχεται λέγειν, οἷον ὅτι οὔτε ἔσται οὔτε οὐκ ἔσται καὶ τὰ ἑξῆς.	ἀλλά μήν οὐδέ ὡς οὐδέτερος γε ἀληθής ἐνδέχομαι λέγω , οἷος ὅτι2 οὔτε εἰμί οὔτε οὐ εἰμί καί ὁ ἑξῆς .
1232429	tlg9019.tlg001.opp-grc1	οὐ μόνον τοῦτο ἔσται ἄτοπον, ὅπερ εἶπεν, ἀμφοτέρας τὰς προτάσεις ψευδεῖς εἶναι, ἀλλὰ πρὸς τούτοις εὑρεθήσεται καὶ ἐσόμενον τὸ πρᾶγμα καὶ μὴ ἐσόμενον.	οὐ μόνος οὗτος   , ὅς λέγω , ἀμφότερος ὁ πρότασις ψευδής εἰμί , ἀλλά πρός οὗτος  καί  ὁ πρᾶγμα καί μή  .
1232430	tlg9019.tlg001.opp-grc1	εἰ μὲν γὰρ ψευδής ἐστιν ἡ κατάφασις ἡ λέγουσα ὅτι αὔριον ἔσται ναυμαχία*** ψευδοῦς γὰρ οὔσης τῆς καταφάσεως συμβαίνει τὴν ἀπόφασιν ἀληθεύειν, ἥτις ὑπέκειτο καὶ αὐτὴ ψευδής.	εἰ μέν γάρ ψευδής εἰμί ὁ κατάφασις ὁ λέγω ὅτι2 αὔριον εἰμί ναυμαχία * * *  γάρ εἰμί ὁ κατάφασις συμβαίνω ὁ ἀπόφασις ἀληθεύω , ὅστις ὑπόκειμαι καί αὐτός ψευδής .
1232431	tlg9019.tlg001.opp-grc1	εἰ δὲ πάλιν ψεύδεται ἡ ἀπόφασις ἡ λέγουσα῾ αὔριον οὐκ ἔσται ναυμαχία᾿, οὐκοῦν ἀληθεύει ἡ κατάφασις, καὶ ἔσται ναυμαχία, καὶ πάλιν τὸ αὐτὸ συμβήσεται.	εἰ δέ πάλιν ψεύδω ὁ ἀπόφασις ὁ λέγω ῾ αὔριον οὐ   , οὐκοῦν ἀληθεύω ὁ κατάφασις , καί  ναυμαχία , καί πάλιν ὁ αὐτός συμβαίνω .
1232432	tlg9019.tlg001.opp-grc1	p.	.
1232433	tlg9019.tlg001.opp-grc1	18b26 Τὰ μὲν δὴ συμβαίνοντα ἄτοπα ταῦτα καὶ τὰ τοιαῦτα ἕτερα.	μέν δή συμβαίνω ἄτοπος οὗτος καί ὁ τοιοῦτος ἕτερος .
1232434	tlg9019.tlg001.opp-grc1	ποῖά εἰσιν τὰ ἄτοπα, ὅτε μίαν τῶν προτάσεων τούτων εἴποι τις πάντως ὡρισμένως ψεύδεσθαι;	εἰμί ὁ ἄτοπος , ὅτε  ὁ πρότασις οὗτος λέγω τις πᾶς ὁρίζω ψεύδω ;
1232435	tlg9019.tlg001.opp-grc1	συμβήσεται ἄτοπόν τι τὸ ἀναιρεθῆναι τὸ ἐνδεχόμενον καὶ πάντα ἐξ ἀνάγκης γίνεσθαι.	συμβαίνω ἄτοπος τις ὁ ἀναιρέω ὁ  καί πᾶς ἐκ ἀνάγκη γίγνομαι .
1232436	tlg9019.tlg001.opp-grc1	p.	.
1232437	tlg9019.tlg001.opp-grc1	18b31 Ὥστε οὔτε βουλεύεσθαι δέοι ἄν οὔτε πραγματεύεσθαι.	ὥστε οὔτε βουλεύω δέω ἄν οὔτε πραγματεύομαι .
1232438	tlg9019.tlg001.opp-grc1	ἐντεῦθεν ὥσπερ συνηγορῶν τῷ εἶναι τὸ ἐνδεχόμενον προάγεται.	ἐντεῦθεν ὥσπερ συνηγορέω τῷ εἰμί ὁ  προάγω .
1232439	tlg9019.tlg001.opp-grc1	πραγματεύεσθαι δὲ λέγει τὸ ἐπιχειρεῖν ὅλως εἰς τὰ πράγματα.	πραγματεύομαι δέ λέγω ὁ ἐπιχειρέω ὅλος εἰς ὁ πρᾶγμα .
1232440	tlg9019.tlg001.opp-grc1	ἐν οἷς ἡ πρᾶξις.	ἐν  ὁ πρᾶξις .
1232441	tlg9019.tlg001.opp-grc1	<Πρᾶξις εݲ> p.	.
1232442	tlg9019.tlg001.opp-grc1	19a23 Τὸ μὲν οὖν εἶναι τὸ ὃν ὅταν ᾖ καὶ τὸ μὴ ὂν μὴ εἶναι ὅταν μὴ ᾖ, ἀνάγκη καὶ τὰ ἑξῆς.	μέν οὖν εἰμί ὁ ὅς ὅταν εἰμί καί ὁ μή εἰμί μή εἰμί ὅταν μή εἰμί , ἀνάγκη καί ὁ ἑξῆς .
1232443	tlg9019.tlg001.opp-grc1	Τὰς φερομένας ἀπορίας κατὰ τοῦ ἐνδεχομένου ἤδη μεμαθήκαμεν, ὅπως αὐτοῦ τὴν ἀναίρεσιν ποιεῖν ὑπελάμβανον.	φέρω ἀπορία κατά ὁ  ἤδη μανθάνω , ὅπως αὐτός ὁ ἀναίρεσις ποιέω ὑπολαμβάνω .
1232444	tlg9019.tlg001.opp-grc1	οὐ μὴν ἀλλὰ καὶ τὰς πρὸς αὐτὰς λύσεις ὑπηνέγκαμεν.	οὐ μήν ἀλλά καί ὁ πρός αὐτός λύσις  .
1232445	tlg9019.tlg001.opp-grc1	ἦν δὲ τὸ αݲ ἐπιχείρημα τὸ ἀπὸ τῆς θείας ὅπερ κατὰ τὸν Ἰάμβλιχον ἐπελύσαντο.	εἰμί δέ ὁ  ἐπιχείρημα ὁ ἀπό ὁ θεία ὅς κατά ὁ Ἰάμβλιχος  .
1232446	tlg9019.tlg001.opp-grc1	τὸ δὲ bݲ ἀπὸ τῆς ἀκολουθίας λόγων τε καὶ πραγμάτων, ὅτι εἰ τῇ ἀληθείᾳ τῶν λόγων*** καὶ τῷ ψεύδει τῶν λόγων ἡ ἀνυπαρξία τοῦ πράγματος καὶ τῇ ἀνυπαρξίᾳ τοῦ πράγματος τὸ.	ὁ δέ  ἀπό ὁ ἀκολουθία λόγος τε καί πρᾶγμα , ὅτι2 εἰ ὁ ἀλήθεια ὁ λόγος * * * καί τῷ ψεῦδος ὁ λόγος ὁ  ὁ πρᾶγμα καί ὁ  ὁ πρᾶγμα ὁ .
1232447	tlg9019.tlg001.opp-grc1	ψεῦδος τῶν λόγων, ἀναιρεθήσεται τὸ ἐνδεχόμενον.	ψεῦδος ὁ λόγος ,  ὁ  .
1232448	tlg9019.tlg001.opp-grc1	τοῦτο δὲ ἐπελύσατο Ἀριστοτέλης ἐκ τῆς προνοίας λέγων ὅτι εἰ ἐποίησεν ἡμᾶς ὁ θεὸς διὰ μέσης τῆς φύσεως βουλευτικούς, | βουλεύεσθαι δὲ οὔτε περὶ τῶν ἀναγκαίων ἔστιν οὕτε περὶ τῶν ἀδυνάτων, ἀλλὰ περὶ τῶν ἐνδεχομένων, δῆλον ὅτι ἔστι τὸ ἐνδεχόμενον.	οὗτος δέ  Ἀριστοτέλης ἐκ ὁ πρόνοια λέγω ὅτι2 εἰ ποιέω ἐγώ ὁ  διά μέσος ὁ φύσις βουλευτικός ,  βουλεύω δέ οὔτε περί ὁ ἀναγκαῖον εἰμί οὔτε περί ὁ ἀδύνατος , ἀλλά περί ὁ  , δῆλος ὅτι2 εἰμί ὁ  .
1232449	tlg9019.tlg001.opp-grc1	καὶ οὐ καθὸ ἀληθής ἐστιν <ὁ λόγος>, διὰ τοῦτο γίνεται τὸ πρᾶγμα, ἀλλὰ καθὸ γίνεται τὸ πρᾶγμα, διὰ τοῦτό ἐστιν ὁ λόγος ἀληθὴς ἐπὶ τῶν ἀληθῶν λόγων καὶ τῆς ὑπάρξεως τῶν πραγμάτων.	καί οὐ  ἀληθής εἰμί   , διά οὗτος γίγνομαι ὁ πρᾶγμα , ἀλλά  γίγνομαι ὁ πρᾶγμα , διά οὗτος εἰμί ὁ λόγος ἀληθής ἐπί ὁ ἀληθής λόγος καί ὁ  ὁ πρᾶγμα .
1232450	tlg9019.tlg001.opp-grc1	καὶ τοὐναντίον πάλιν οὐ καθὸ ψευδής ἐστιν ὁ λόγος, ἤδη διὰ τοῦτο ἡ ἀνυπαρξία τῶν πραγμάτων, ἀλλ’ ἐπειδὴ ἡ ἀνυπαρξία τῶν πραγμάτων, διὰ τοῦτο οὐκ ἔστιν ἀληθὴς ὁ λόγος ἀλλὰ ψευδής.	καί ἐναντίος πάλιν οὐ καθό ψευδής εἰμί ὁ λόγος , ἤδη διά οὗτος ὁ  ὁ πρᾶγμα , ἀλλά ἐπεί ὁ  ὁ πρᾶγμα , διά οὗτος οὐ εἰμί ἀληθής ὁ λόγος ἀλλά ψευδής .
1232451	tlg9019.tlg001.opp-grc1	πάντα ταῦτα κατὰ τὰ φθάσαντα διεξελθὼν νῦν ἔτι διηρθρωμένως τὴν αὐτὴν ἀπορίαν ἐπιλύεται.	πᾶς οὗτος κατά ὁ  διεξέρχομαι νῦν ἔτι  ὁ αὐτός ἀπορία ἐπιλύω .
1232452	tlg9019.tlg001.opp-grc1	ἐκ δὲ διαιρέσεως προάγει τὸν λόγον λέγων ὅτι τὸ ὂν διττόν ἐστιν ἤγουν τὸ ἀναγκαῖον, ἢ τὸ ἁπλῶς ἀναγκαῖον ἢ τὸ ἐξ ὑποθέσεως ἀναγκαῖον.	ἐκ δέ διαίρεσις προάγω ὁ λόγος λέγω ὅτι2 ὁ εἰμί  εἰμί  ὁ ἀναγκαῖος , τίη ὁ ἁπλόος ἀναγκαῖον ἤ ὁ ἐκ ὑπόθεσις ἀναγκαῖον .
1232453	tlg9019.tlg001.opp-grc1	καὶ ἐξ ὑποθέσεως ἀναγκαῖόν φαμεν, ἔστ’ ἂν ὑπάρχει τὸ κατηγορούμενον τῷ ὑποκχεμένῳ.	καί ἐκ ὑπόθεσις ἀναγκαῖος φημί ,  ἐάν ὑπάρχω ὁ κατηγορέω τῷ  .
1232454	tlg9019.tlg001.opp-grc1	δύναται δὲ τὸ αὐτό τοῦτο καὶ μὴ ὑπάρχειν, ὡς τὸ καθέζεσθαι τὸν Σωκράτη ἢ καθεύσειν·	δύναμαι δέ ὁ  οὗτος καί μή ὑπάρχω , ὡς ὁ ἕζομαι ὁ Σωκράτης τίη  ·
1232455	tlg9019.tlg001.opp-grc1	θεύδειν·	·
1232456	tlg9019.tlg001.opp-grc1	ἔστ’ ἂν γὰρ καθεύδει ὁ καθεύδων, ἐξ ἀνάγκης ὁ ὕπνος αὐτῷ ὑπάρχει.	ἄν γάρ καθεύδω ὁ καθεύδω , ἐκ ἀνάγκη ὁ ὕπνος αὐτός ὑπάρχω .
1232457	tlg9019.tlg001.opp-grc1	τὸ δὲ ἁπλῶς πάλιν ἀναγκαῖον διττόν·	ὁ δέ ἁπλόος πάλιν ἀναγκαῖον δισσός ·
1232458	tlg9019.tlg001.opp-grc1	ἢ ἐπὶ τῶν ἀιδίων ὑπάρχει ἢ ἐπὶ τῶν ἐν γενέσει καὶ φθορᾷ, ὅταν συστατικὴ διαφορὰ ὑπάρχῃ τοῦ ὑποκειμένου πράγματος.	τίη ἐπί ὁ ἀΐδιος ὑπάρχω τίη ἐπί ὁ ἐν γένεσις καί φθορά , ὅταν  διαφορά ὑπάρχω ὁ  πρᾶγμα .
1232459	tlg9019.tlg001.opp-grc1	῾συστατικὴ’ δὲ εἴπομεν, ἐπειδὴ ἐπὶ τοῦ ἐξ ὑποθέσεως ἀναγκαίου χωριζόμενον τὸ πρᾶγμα ἤτοι τὸ κατηγορούμενον οἷον τὸ βαδίζειν ἢ τὸ καθεύδειν οὐ φθείρει τὸ ὑποκείμενον, ἐνταῦθα δὲ οἷον ἐπὶ πυρὸς χωρισθεῖσα ἡ θερμότης τὸ ὑποκείμενον φθείρει, τοῦτ’ ἔστι τὸ πῦp.	δέ λέγω , ἐπεί ἐπί ὁ ἐκ ὑπόθεσις ἀναγκαῖος χωρίζω ὁ πρᾶγμα ἤτοι ὁ κατηγορέω οἷος ὁ βαδίζω ἤ ὁ καθεύδω οὐ φθείρω ὁ  , ἐνταῦθα δέ οἷος ἐπί πῦρ  ὁ θερμότης ὁ  φθείρω ,  εἰμί ὁ  .
1232460	tlg9019.tlg001.opp-grc1	ποῖον δέ ἐστι τὸ ἐπὶ τῶν ἀιδίων θεωρούμενον;	ποιός δέ εἰμί ὁ ἐπί ὁ ἀΐδιος θεωρέω ;
1232461	tlg9019.tlg001.opp-grc1	οἷον ὡς ἡνίκα φαμὲν῾ ὁ ἥλιος ἐξ ἀνάγκης κινεῖται᾿,῾ ὁ θεὸς ἐξ ἀνάγκης ἀγαθός ἐστιν᾿.	οἷος ὡς ἡνίκα φημί ῾ ὁ ἥλιος ἐκ ἀνάγκη  , ῾ ὁ  ἐκ ἀνάγκη ἀγαθός  .
1232462	tlg9019.tlg001.opp-grc1	ἐπὶ δὲ τῶν ἐν γενέσει καὶ φθορᾷ οἷον τόδε τὸ πῦρ·	ἐπί δέ ὁ ἐν γένεσις καί φθορά οἷος ὅδε ὁ πῦρ ·
1232463	tlg9019.tlg001.opp-grc1	οἷον τὸ μερικὸν εἴπομεν καὶ οὐ τὸ καθόλου, ἐπειδὴ τὸ μερικὸν τοῦτο γίνεται καὶ φθείρεται, τὸ δὲ καθόλου ἀεὶ ὡσαύτως ἔχει καὶ οὐ φθείρεται.	οἷος ὁ  λέγω καί οὐ ὁ καθόλου , ἐπεί ὁ  οὗτος γίγνομαι καί φθείρω , ὁ δέ καθόλου ἀεί ὡσαύτως ἔχω καί οὐ φθείρω .
1232464	tlg9019.tlg001.opp-grc1	οὕτως μὲν ἐπὶ τοῦ ὄντος θεωρεῖται τὸ ἀπλῶς ἀναγκαῖον καὶ τὸ ἐξ ὑποθέσεως.	οὕτως μέν ἐπί ὁ εἰμί θεωρέω ὁ  ἀναγκαῖος καί ὁ ἐκ ὑπόθεσις .
1232465	tlg9019.tlg001.opp-grc1	δῆλον δὲ ὅτι καὶ τὸ μὴ ὂν διττόν·	δῆλος δέ ὅτι2 καί ὁ μή εἰμί δισσός ·
1232466	tlg9019.tlg001.opp-grc1	τὸ μηδὲ ὅλως ὄν, ὅπερ οὔτε γέγονεν| οὔτε ἔστιν οὔτε ἔσται, οἷον σκινδαψὸς καὶ τὰ τοιαῦτα, ἢ τῇ μὲν ὃν πῇ δὲ μὴ ὄν, ὡς ἐπὶ τῶν ἐνδεχομένων.	ὁ μηδέ ὅλος εἰμί , ὅς οὔτε γίγνομαι | οὔτε εἰμί οὔτε  , οἷος  καί ὁ τοιοῦτος , ἤ ὁ μέν ὅς πῇ δέ μή εἰμί , ὡς ἐπί ὁ  .
1232467	tlg9019.tlg001.opp-grc1	ἀνάγκη τοίνυν, ὡς ἔχει τὸ ὂν πρὸς τὸ ἀναγκαῖον καὶ τὸ μὴ ἀναγκαῖον, οὕτως ἔχειν καὶ τοὺς λόγους·	ἀνάγκη τοίνυν , ὡς ἔχω ὁ εἰμί πρός ὁ ἀναγκαῖον καί ὁ μή ἀναγκαῖον , οὕτως ἔχω καί ὁ λόγος ·
1232468	tlg9019.tlg001.opp-grc1	καὶ ἐπειδὴ τὸ ὄν τὸ τὸ μὲν ἔστιν ἐξ ἀνάγκης ὡς ἐρρέθη, τὸ μέν ἐστιν ἁπλῶς καὶ〈 κυρίως〉 ἐξ ἀνάγκης, τὸ δὲ ἐξ ὑποθέσεως, οὕτως δεῖ ἔχειν καὶ τὴν ἀντίφασιν αὐτῶν πάντως** * τὴν μὲν τῆς ἀντι- φάσεως ἀληθῆ εἶναι ὡρισμένως, τὴν δὲ ψευδῆ·	καί ἐπεί ὁ  ὁ ὁ μέν εἰμί ἐκ ἀνάγκη ὡς λέγω , ὁ μέν εἰμί ἁπλόος καί 〈 κύριος 〉 ἐκ ἀνάγκη , ὁ δέ ἐκ ὑπόθεσις , οὕτως δέω ἔχω καί ὁ ἀντίφασις αὐτός πᾶς * *  ὁ μέν ὁ  - φάσις ἀληθής εἰμί ὁρίζω , ὁ δέ ψευδής ·
