id	filename	tokens	lemmas
318392	tlg9006.tlg011.opp-grc1	διὰ τοῦτο μηδ’ ἐλεεῖν εἶναι δίκαιον τοὺς τοιούτους μηδὲ φείδε- σθαι, ἀγρίως δὲ μᾶλλον πρὸς αὐτοὺς τοὺς πάντας ὁρᾶν καὶ ἐξελαύνειν ἀπάσης ἣν οἰκοῦσιν ἄνθρωποι γῆς, φιλανθρωπίαν, ὅσον τὸ κατ’ αὐτούς, ἐκ τοῦ βίου καὶ ἐπιείκειαν ἐξορίσαντας, τὸ ἀκοινώνητον δὲ καὶ θηριῶδες ἐπεισαγαγόντας.	διά οὗτος  ἐλεέω εἰμί δίκαιος ὁ τοιοῦτος   -  , ἄγριος δέ μᾶλλον πρός αὐτός ὁ πᾶς ὁράω καί ἐξελαύνω  ὅς οἰκέω ἄνθρωπος γῆ , φιλανθρωπία , ὅσος ὁ κατά αὐτός , ἐκ ὁ βίος καί ἐπιείκεια  , ὁ ἀκοινώνητος δέ καί   .
318393	tlg9006.tlg011.opp-grc1	τὸ γὰρ τοιοῦτον ἀδίκημα παρορώμενον ἀτιμώρητον οὐ πολλοῦ τινος χρόνου δεήσεται τοῦ μὴ τῆς λύμης ἀναπλῆσαι τοὺς πάντας.	ὁ γάρ  ἀδίκημα  ἀτιμώρητος οὐ πολύς τις χρόνος δέω2 ὁ μή ὁ λύμη ἀναπίμπλημι ὁ πᾶς .
318394	tlg9006.tlg011.opp-grc1	καὶ τὸ μετὰ ταῦτα πῶς ἄν τις ἐθελήσει τινὶ συν- θέσθαι ἢ μεταδοῦναι τῶν ἑαυτοῦ;	καί ὁ μετά οὗτος πῶς ἄν τις ἐθέλω   - τίθημι τίη μεταδίδωμι ὁ ἑαυτοῦ ;
318395	tlg9006.tlg011.opp-grc1	πῶς τίς τινος ἀντι- λήψεται καὶ καταπονουμένῳ χεῖρα ὀρέξει;	πῶς τις τις  - λαμβάνω καί καταπονέω χείρ ὀρέγω ;
318396	tlg9006.tlg011.opp-grc1	τίνι βοηθή- σει;	-  ;
318397	tlg9006.tlg011.opp-grc1	τινα προσλήψεται εἰδὼς ἀντὶ τοῦ χάριν ὀφείλειν τὸν εὖ πάσχοντα εἰς πολέμιον αὐτίκα ἀλλ’ ἐῶ τοὺς ἄλλους, αὐτοὶ δέ γε ἡμεῖς οἵτινες εἰώθα- μεν ἀεὶ σώζειν, εἵ τις δεόμενος ἵκετο, πῶς ἔτι τῆς ἐκ φύσεως φιλανθρωπίας ἑξόμεθα;	τις  οἶδα ἀντί ὁ χάρις ὀφείλω ὁ εὖ πάσχω εἰς πολέμιος αὐτίκα ἀλλά ἐάω ὁ ἄλλος , αὐτός δέ γε  ὅστις  -  ἀεί σῴζω , εἰ τις δέω ἱκνέομαι , πῶς ἔτι ὁ ἐκ φύσις φιλανθρωπία ἔχω ;
318398	tlg9006.tlg011.opp-grc1	τίνας ἐλεήσομεν καὶ σώσομεν κινδυνεύοντας;	καί σῴζω κινδυνεύω ;
318399	tlg9006.tlg011.opp-grc1	τίνας καταφεύγοντας εἰσδεξό- μεθα;	καταφεύγω  -  ;
318400	tlg9006.tlg011.opp-grc1	τίνων καὶ προστησόμεθα, ὥσπερ καταπεφευγότας Ποτιδαιάτας προσεδεξάμεθα καὶ προέστημεν;	τίνω καί  , ὥσπερ καταφεύγω Ποτειδεάτης  καί  ;
318401	tlg9006.tlg011.opp-grc1	οὐ γὰρ οἶμαί τινα γενέσθαι τοσοῦτον εὐήθη ὡς μετὰ πεῖραν ἑνὸς καὶ δυεῖν ἀγνωμόνων ἀνθρώπων αἱρεῖσθαι καὶ τρίτον ἄλλον εὐεργετεῖν.	οὐ γάρ   γίγνομαι τοσοῦτος  ὡς μετά πεῖρα  καί   ἄνθρωπος αἱρέω καί τρίτος ἄλλος εὐεργετέω .
318402	tlg9006.tlg011.opp-grc1	ταύτῃ τοι καὶ τοῖς δικαίοις εὖ παθεῖν διὰ τοὺς ἀμνήμονας εὐεργεσίας περιέσται ζημιοῦσθαι, καὶ τὸ κακὸν δὴ τοῦτο λυμανεῖται πᾶσι τοῖς ἀγαθοῖς, ὧς εἶναι δέον ἓν τοῦτο σπούδασμα πάν- τὰς ποιεῖσθαι ἀνθρώπους, εἴ τίς που καὶ παραφανείη πάθει τοιούτῳ κάτοχος ὤν, πάσῃ δυνάμει ἐκτρίβειν πειρᾶσθαι κἀκ τοῦ μέσου ποιεῖν.	οὗτος  καί ὁ δίκαιος εὖ πάσχω διά ὁ ἀμνήμων εὐεργεσία περίειμι ζημιόω , καί ὁ κακός δή οὗτος  πᾶς ὁ ἀγαθός , ὡς εἰμί δέω  οὗτος σπούδασμα  - ὁ ποιέω ἄνθρωπος , εἰ τις που καί παραφαίνω πάθος τοιοῦτος κάτοχος εἰμί , πᾶς δύναμις ἐκτρίβω πειράω ἐκ ὁ μέσης ποιέω .
318403	tlg9006.tlg011.opp-grc1	ὃ δὴ καὶ ἡμᾶς καλῶς λογισαμένους Ποτιδαιάτας μετελθεῖν οὐκ ἀξίως μὲν τῆς ἐκείνων λώβης, ὅμως τῆς γε τῶν Ἀθηναίων φύ- σεως οὐ πολὺ ἄποθεν, καὶ ἅμα καλῶς ἂν ἔχοι καὶ ἀποχρώντως ἡμῖν, εἰ τοῖς μικροῖς παιδευθέντες ἀγαθοὶ γενόμενοι περιεῖεν τῷ βίῳ ἢ παντάπασιν ἐκτριβέντες ἐκστῆναι τῶν ὄντων.	ὅς δή καί ἐγώ καλός  Ποτειδεάτης μετέρχομαι οὐ ἄξιος μέν ὁ ἐκεῖνος λώβη , ὅμως ὁ γε ὁ Ἀθήναιος  -  οὐ πολύς ἄποθεν , καί ἅμα καλός ἄν ἔχω καί ἀποχρώντως ἐγώ , εἰ ὁ μικρός παιδεύω ἀγαθός γίγνομαι  τῷ βίος τίη παντάπασι  ἐξίστημι ὁ εἰμί .
318404	tlg9006.tlg011.opp-grc1	εἰ δὲ καὶ οὕτως κακίας οὐκ ἀφέξονται, ἀλλ’ ᾧ γε τὴν ἀξίαν τοῦ τολμήματος ἀπο- τίσουσι δίκην ὧς τάχιστα παραστήσεται.	εἰ δέ καί οὕτως κακία οὐ  , ἀλλά ὅς γε ὁ ἀξία ὁ τόλμημα  - τίνω δίκη ὡς ταχύς παρίστημι .
318405	tlg9006.tlg011.opp-grc1	41.	.
318406	tlg9006.tlg011.opp-grc1	Πλὴν οὕτως τῆς εἰς ἐκείνους τιμωρίας ἐλλιπῶς ἐχούσης οὐκ ἀγαπῶσι Κορίνθιοι, ἀλλὰ μετεληλύθατε, φασίν, ἀνοσίως καὶ ἀπανθρώπως αὐτούς.	οὕτως ὁ εἰς ἐκεῖνος τιμωρία ἐλλιπής ἔχω οὐ ἀγαπάω  , ἀλλά  , φημί , ἀνόσιος καί ἀπάνθρωπος αὐτός .
318407	tlg9006.tlg011.opp-grc1	πῶς, ὦ χρηστοί, ἀνοσίως καὶ ἀπανθρώπως;	πῶς , ὦ χρηστός , ἀνόσιος καί ἀπάνθρωπος ;
318408	tlg9006.tlg011.opp-grc1	οὐκ ἦσαν ἡμῖν ἐχθροί;	οὐ εἰμί  ἐχθρός ;
318409	tlg9006.tlg011.opp-grc1	οὐ καθ’ ἡμῶν συνέστησαν;	οὐ κατά ἐγώ συνίστημι ;
318410	tlg9006.tlg011.opp-grc1	οὐκ ἐν εὐχῆς ἐποι- οῦντο μέρει πᾶν ὁτιοῦν τῶν δεινῶν τυχεῖν ἡμᾶς ὑπο- στάντας;	οὐ ἐν εὐχή  -  μέρος πᾶς ὁτιοῦν ὁ δεινός τυγχάνω ἐγώ  - ἵστημι ;
318411	tlg9006.tlg011.opp-grc1	οὐκ ἴδει δὲ καὶ ἀντὶ τούτων σφάττειν αὐτοὺς καὶ κατορύττειν ἢ βυθίζειν ἢ διὰ πυρὸς ἀφανίζειν;	οὐ  δέ καί ἀντί οὗτος σφάζω αὐτός καί κατορύσσω τίη  τίη διά πῦρ ἀφανίζω ;
318412	tlg9006.tlg011.opp-grc1	εἶτα τί τούτων ἐγένετ’ αὐτοῖς πρὸς ἡμῶν;	εἶτα τι οὗτος  αὐτός πρός  ;
318413	tlg9006.tlg011.opp-grc1	τούτων μὲν οὐδέν, τοὐναντίον δὲ πᾶν.	οὗτος μέν οὐδείς , ἐναντίος δέ πᾶς .
318414	tlg9006.tlg011.opp-grc1	ἀπέθανεν οὐδείς, οὔκουν ὑπ’ Ἀθηναίων, ἀλλ’ ὧς σὺν χρόνῳ παρεστησάμεθα τὴν πόλιν, περιεποιησάμεθα καὶ ζῆν ἀνήκαμεν καὶ περινοστεῖν ἐλευθέρους οὐκ ὄντας ἀξίους τοιούτου τυχεῖν οὐδενός.	ἀποθνῄσκω οὐδείς , οὐκοῦν ὑπό Ἀθήναιος , ἀλλά ὡς σύν χρόνος  ὁ πόλις ,  καί ζήω  καί περινοστέω ἐλεύθερος οὐ εἰμί ἄξιος τοιοῦτος τυγχάνω  .
318415	tlg9006.tlg011.opp-grc1	ἄνευ δὲ ὧν εἰρήκαμεν, τίς ποτε περὶ πολέμου νενομοθέτηκε καὶ μέτρα καὶ τρόπους εἰση- γησάμενος μάχης μέχρι τοσούτου διετάξατο προιέναι, περαιτέρω δὲ μή, καὶ οὕτως μὲν συμπλέκεσθαι, οὕτως δὲ οὐδαμῶς, καὶ τοὺς ἐχθροὺς μετιτέον εἶναι ἢ τιμω- ρητέον τόνδε τὸν τρόπον, ἀλλὰ μὴ τόνδε, καὶ δεῖν γε ἡμᾶς ἀκολουθεῖν αὐτῷ ἢ μὴ ἀκολουθοῦντας ἐπιτι- μᾶσθαι καὶ δίκας ὑπέχειν ὧς οὐ νομίμως οὐδὲ δικαίως τὴν ἀγωνίαν ποιησαμένους;	ἄνευ δέ ὅς λέγω , τις ποτε περί πόλεμος  καί μέτρον καί τρόπος  -  μάχη μέχρι τοσοῦτος διατάσσω πρόειμι ,  δέ μή , καί οὕτως μέν συμπλέκω , οὕτως δέ οὐδαμῶς , καί ὁ ἐχθρός μέτειμι2 εἰμί ἤ  -  ὅδε ὁ τρόπος , ἀλλά μή ὅδε , καί δέω γε ἐγώ ἀκολουθέω αὐτός τίη μή ἀκολουθέω  -  καί δίκη ὑπέχω ὡς οὐ νόμιμος οὐδέ δίκαιος ὁ ἀγωνία ποιέω ;
318416	tlg9006.tlg011.opp-grc1	οὐκ ἔστιν ὁ ταῦτα νομοθε- τῶν, οὐκ ἔστιν οὐδείς, ἀλλ’ ὧς ὁ καιρὸς φέρει, καὶ τἀς μάχας διαθετέον ἅπαντες λέγουσι, καὶ κοινὸς οὗτος ἅπασι νόμος, ὡς ἑκάστῳ ἐκ τῶν συμπιπτόντων παρί- σταται τὸν πόλεμον διαφέρειν.	οὐ εἰμί ὁ οὗτος  - ὁ , οὐ εἰμί οὐδείς , ἀλλά ὡς ὁ καιρός φέρω , καί  μάχη  ἅπας λέγω , καί κοινός οὗτος ἅπας νόμος , ὡς ἕκαστος ἐκ ὁ συμπίπτω  -  ὁ πόλεμος διαφέρω .
318417	tlg9006.tlg011.opp-grc1	τί λοιπὸν ἄγνοιαν τῶν κοινῇ γνωρίμων πλαττόμενοι ἅπερ ἀκώλυτα τειν ἡμῖν ἐγκαλεῖτε καὶ ἄλλων κατηγορεῖν ἐθέλοντες τόπον κατηγορίας ἑτέροις καθ’ ὑμῶν δίδοτε;	τι λοιπός ἄγνοια ὁ κοινῇ γνώριμος πλάσσω ὅς ἀκώλυτος   ἐγκαλέω καί  κατηγορέω ἐθέλω τόπος κατηγορία ἕτερος κατά ὑμός  ;
318418	tlg9006.tlg011.opp-grc1	ἢ ἔχετε λέγειν ὡς εἰσί τινες ἀνθρώπων παρ’ οἷς ταῦτα φυλάτ- τεται, ἢ εἰ μὴ παρ’ οὐδέσιν ἄλλοις, παρ’ ὑμῖν γοῦν τοῖς Κορινθίοις;	τίη ἔχω λέγω ὡς εἰμί τις ἄνθρωπος παρά ὅς οὗτος  -  , ἤ εἰ μή παρά οὐδείς  , παρά σύ γοῦν ὁ  ;
318419	tlg9006.tlg011.opp-grc1	καὶ εἶρξέ ποτέ τις ὑμᾶς ἣ νόμος ἢ λόγος μὴ τοῖς ἐνοῦσι χρῆσθαι παρεστώσῃ ςτῆς μάχης;	καί  ποτε τις  ὁ νόμος τίη λόγος μή ὁ  χράω2   μάχη ;
318420	tlg9006.tlg011.opp-grc1	οὐκ ἐκ παντός γε καὶ ὑμεῖς τρόπου τὸ συμφέρον διώ- κετε;	οὐ ἐκ πᾶς γε καί  τρόπος ὁ συμφέρω  -  ;
318421	tlg9006.tlg011.opp-grc1	οὐ μηχανᾶσθε;	οὐ  ;
318422	tlg9006.tlg011.opp-grc1	οὐκ ἐνεδρεύετε;	οὐ  ;
318423	tlg9006.tlg011.opp-grc1	οὐ λόχους κρύ- πτετε;	οὐ   -  ;
318424	tlg9006.tlg011.opp-grc1	οὐκ ἀφανῶς ἐπιτίθεσθε;	οὐ ἀφανής ἐπιτίθημι ;
318425	tlg9006.tlg011.opp-grc1	οὐ πολιορκεῖτε τῶν ἐναντίων τὰς πόλεις;	οὐ  ὁ ἐναντίος ὁ πόλις ;
318426	tlg9006.tlg011.opp-grc1	οὐ λιμῷ φθείρετε;	οὐ λιμός  ;
318427	tlg9006.tlg011.opp-grc1	οὐ πυρὶ λυ- μαίνεσθε;	οὐ πῦρ  - μαίνομαι ;
318428	tlg9006.tlg011.opp-grc1	οὐ περκόπτετε τὴν κύκλῳ χώραν;	οὐ  ὁ κύκλος χώρα ;
318429	tlg9006.tlg011.opp-grc1	οὐ πάντα ὑπὲρ ἑνὸς τοῦ κρείττους φανῆναι μετέρχεσθε;	οὐ πᾶς ὑπέρ  ὁ κρείσσων φαίνω  ;
318430	tlg9006.tlg011.opp-grc1	τί γοῦν ἅ μηδ’ αὐτοὶ φυλάσσοντες οὐδέποτε ὤφθητε καὶ ὑμῖν ἀντὶ τούτου προσηνέχθη οὐδείς, ἡμῖν ὧς μὴ φυλάξασιν ἐγκαλεῖτε;	τίς γοῦν   αὐτός φυλάσσω οὐδέποτε  καί  ἀντί οὗτος προσφέρω οὐδείς ,  ὡς μή  ἐγκαλέω ;
318431	tlg9006.tlg011.opp-grc1	εἶεν.	εἶἑν .
318432	tlg9006.tlg011.opp-grc1	ἀλλ’ ὁ Ποτιδαιάτας ἀσεβῆ καὶ ἀνόσια εἰργασμένος τίς, ὦ πρὸς θεῶν;	ἀλλά ὁ Ποτειδεάτης ἀσεβής καί ἀνόσιος  τις , ὦ πρός θεός ;
318433	tlg9006.tlg011.opp-grc1	Ἀθηναίων μὲν οὐδείς, οὐ μὰ τοὺς θεούς.	Ἀθήναιος μέν οὐδείς , οὐ μά ὁ θεός .
318434	tlg9006.tlg011.opp-grc1	νομίμῳ γὰρ καὶ δικαίῳ πρὸς αὐτοὺς ἐκεχρήμεθα τῷ πολέμῳ, αὐτοὶ δὲ κατ’ ἀλλήλων μανέντες ὑφ’ ἑαυτῶν ἐξανήλωντο.	γάρ καί δίκαιος πρός αὐτός  ὁ πόλεμος , αὐτός δέ κατά ἀλλήλων μαίνομαι ὑπό ἑαυτοῦ  .
318435	tlg9006.tlg011.opp-grc1	καὶ καλήν γε, ὦ δίκη παραβαθεῖσα, τὴν ἐπίνοιαν κατ’ αὐτῶν ἐξεῦρες ἅμα μὲν ἐκείνων τὴν πονηρίαν καὶ ἀγνωμο- σύνην παύουσα, ἄμα δὲ καὶ τῶν μελλόντων μιμεῖσθαι τοὺς ἀλιτηρίους ἐκείνους προανακόπτουσα τὰς ὁρμάς.	καί καλός γε , ὦ δίκη  , ὁ ἐπίνοια κατά αὐτός  ἅμα μέν ἐκεῖνος ὁ πονηρία καί  -   ,  δέ καί ὁ μέλλω μιμέομαι ὁ ἀλιτήριος ἐκεῖνος  ὁ ὁρμή .
318436	tlg9006.tlg011.opp-grc1	ὡς ἔδει γε τοιαύτην σε πᾶσιν ἀεὶ τοῖς πονηροῖς παρ- εστάναι καὶ ἀδικίας ἀνθρώπων μεθ’ ὁμοίας ἐξαίρειν τῆς ταχυτῆτος.	ὡς δέω γε τοιοῦτος  πᾶς ἀεί ὁ πονηρός  -  καί ἀδικία ἄνθρωπος μετά ὅμοιος ἐξαίρω ὁ ταχυτής .
318437	tlg9006.tlg011.opp-grc1	45.	.
318438	tlg9006.tlg011.opp-grc1	Πλὴν Ποτιδαιᾶται μέν, ὦ Λακεδαιμόνιοι, οὕτω μὲν ἡμῖν, οὕτω δὲ καὶ τοῖς πρὸ ἡμῶν ἀδικηθεῖ- σι θεοῖς τὴν ἀξίαν ἀπέδωκαν, Κορίνθιοι δὲ κατη- γοροῦσιν ἡμῶν ἀντὶ τούτων οὐ μᾶλλον ἐκείνων ὑπεραλγοῦντες ἢ τῷ πρὸς ἡμᾶς φθόνῳ κεκινημένοι.	Ποτειδεάτης μέν , ὦ  , οὕτως μέν  , οὕτως δέ καί ὁ πρό   -  θεός ὁ ἄξιος ἀποδίδωμι ,  δέ  -   ἀντί οὗτος οὐ μᾶλλον ἐκεῖνος  ἤ τῷ πρός ἐγώ φθόνος κινέω .
318439	tlg9006.tlg011.opp-grc1	τῷ τοῦτο δῆλον;	τῷ οὗτος δῆλος ;
318440	tlg9006.tlg011.opp-grc1	ἐξ ὧν ἀναστάντες εἰπεῖν τοῦ τε λόγου πρόφασιν ἔχοντες τὰ Ποτιδαιατῶν πάθη ὅμως ἔλαττον περὶ ἐκείνων εἰρήκασιν, ὁ δὲ πολὺς λόγος αὐτοῖς διε- γείρων ἦν ὑμᾶς ἐπὶ τὸν ἡμέτερον πόλεμον.	ἐκ ὅς ἀνίστημι λέγω ὁ τε λόγος πρόφασις ἔχω ὁ Ποτειδεάτης πάθος ὅμως  περί ἐκεῖνος λέγω , ὁ δέ πολύς λόγος αὐτός  -  εἰμί  ἐπί ὁ ἡμέτερος πόλεμος .
318441	tlg9006.tlg011.opp-grc1	ἤ οὐ μέ- μνησθε ὡς ἐγκελεύοντες ἦσαν ὑμῖν καθάπερ στρατηγοὶ στρατιώταις·	ἤ οὐ  -  ὡς  εἰμί  καθά στρατηγός στρατιώτης ·
318442	tlg9006.tlg011.opp-grc1	τί κάθησθε;	τι  ;
318443	tlg9006.tlg011.opp-grc1	τί ἀνατέτραφθε ὧς ἐφ’ ὕπνον;	τίς  ὡς ἐπί ὕπνος ;
318444	tlg9006.tlg011.opp-grc1	τί τὸ Δωρικὸν καὶ πάτριον οὐκ ἀναλαμ- βάνετε φρόνημα;	τι ὁ Δωρικός καί πάτριος   -  φρόνημα ;
318445	tlg9006.tlg011.opp-grc1	οὐχ ὁρᾶτε τοὺς ἀνθρώπους ὧς αὐξάνουσι καὶ προβαίνουσι καὶ μεῖζον φρο- νοῦσι τῆς φύσεως;	οὐ ὁράω ὁ ἄνθρωπος ὡς  καί  καί μέγας  -  ὁ φύσις ;
318446	tlg9006.tlg011.opp-grc1	οὐ καθέξετε σφᾶς;	οὐ  σφεῖς ;
318447	tlg9006.tlg011.opp-grc1	οὐ κατα- βαλεῖτι;	οὐ  -  ;
318448	tlg9006.tlg011.opp-grc1	οὐ ταπεινώσετε πρὶν ἢ φθάσουσιν ἄμαχοι γεγονότες;	οὐ  πρίν ἤ  ἄμαχος γίγνομαι ;
318449	tlg9006.tlg011.opp-grc1	46.	.
318450	tlg9006.tlg011.opp-grc1	Καὶ τὸ μὲν δὴ προβεβλημένον αὐτοῖς ἄλλον ἔχον ἀγῶνα εἰς τὴν καθ’ ἡμῶν, ὧς ὁρᾶτε, συμβολὴν ἀπεκρίθη, ἡμῖν δὲ πρὸς ταῦτα βραχὺς ἂν εἴη λόγος, ὅν δὴ αὐτίκα εἰπόντες καταβησόμεθα.	καί ὁ μέν δή προβάλλω αὐτός ἄλλος ἔχω ἀγών εἰς ὁ κατά  , ὡς ὁράω , συμβολή ἀποκρίνω , ἐγώ δέ πρός οὗτος βραχύς ἐάν εἰμί λόγος , ὅς δή αὐτίκα λέγω καταβαίνω .
318451	tlg9006.tlg011.opp-grc1	τὸ μὲν δὴ μείζους ἐθέλειν ἑαυτῶν γίνεσθαι καὶ προκόπτειν ἀεὶ οὐκ ἀρνούμεθα, ἐπειδήπερ οὐ μόνοις τοῖς Ἀθηναίοις ἔργον ἐστὶ σπουδαζόμενον οὐδὲ μόνοις τοῖς Ἕλλησιν, ἀλλὰ καὶ τούτοις καὶ βαρβάροις καὶ πᾶσιν ὧς ἔπος εἰπεῖν ἀνθρώποις.	ὁ μέν δή μέγας ἐθέλω ἑαυτοῦ γίγνομαι καί προκόπτω ἀεί οὐ ἀρνέομαι , ἐπεί οὐ μόνος ὁ Ἀθήναιος ἔργον εἰμί σπουδάζω οὐδέ μόνος ὁ Ἕλλην , ἀλλά καί οὗτος καί  καί πᾶς ὡς ἔπος λέγω ἄνθρωπος .
318452	tlg9006.tlg011.opp-grc1	φύσει γὰρ ἅπασι τὴν τοῦ πλείονος ἐπιθυμίαν ἴσμεν ἐντετηκέναι, κἂν εἴ τις αἱρῆται μετ- ιέναι καθ’ ἔνα τοὺς πάντας, οὐκ ἄν ποτε οὐδαμοῦ διαπίπτοντα τὸν λόγον εὑρήσει.	φύσις γάρ ἅπας ὁ ὁ πολύς ἐπιθυμία οἶδα ἐντήκω , ἐάν εἰ τις αἱρέω  -  κατά  ὁ πᾶς , οὐ ἄν ποτε οὐδαμοῦ διαπίπτω ὁ λόγος εὑρίσκω .
318453	tlg9006.tlg011.opp-grc1	καὶ οὐδαμῶς ἂν εἴη τοῦτό γε ἄπο τρόπου, εἰ κατὰ τὸ πεφυκὸς πᾶσιν ἀν- θρώποις καὶ ἡμεῖς κρείττους ἑαυτῶν καὶ μείζους ἐφιέ- μεθα γίνεσθαι.	καί οὐδαμῶς ἄν εἰμί  γε ἀπό τρόπος , εἰ κατά ὁ φύω πᾶς ἀνά -  καί  κρείσσων ἑαυτοῦ καί μέγας  -  γίγνομαι .
318454	tlg9006.tlg011.opp-grc1	ὅ δὲ ὅμως κἀν τῷ τοιούτῳ παρηλ- λαγμένον ἡμῖν καὶ οὐ ῥᾴδιον παρά τισιν ἄλλοις κατα- νοῆσαι, ὅτι τῶν μὲν ἄλλων ἀπάντων μηδεμίαν οἰκείων τε καὶ ἀλλοτρίων εἰδότων διαφορὰν κατὰ τοῦτο, ἀλλ’ ἐπ’ ἴσης τὴν ἑαυτῶν ἐπίδοσιν ἐξ ἁπάντων γίνεσθαι σπου- δαζόντων ἡμῖν οὐχ οὕτω πραγματεύεται τοῦτο.	ὅς δέ ὅμως ἐν ὁ τοιοῦτος  -  ἐγώ καί οὐ  παρά    - νοέω , ὅτι2 ὁ μέν ἄλλος  μηδείς οἰκεῖος τε καί ἀλλότριος οἶδα διαφορά κατά οὗτος , ἀλλά ἐπί ἴσος ὁ ἑαυτοῦ ἐπίδοσις ἐκ ἅπας γίγνομαι  -   οὐ οὕτως πραγματεύομαι οὗτος .
318455	tlg9006.tlg011.opp-grc1	ἀλλὰ τὸ μὲν Ἑλληνικὸν ἅπαν γένος ἀγαπῶμεν καὶ στέργομεν καὶ βουλοίμεθ’ ἂν πᾶν ἀγαθὸν αὐτοῖς γενέσθαι καί γε ὅσον πλεῖστόν ἐστι πρὸς αὐτοὺς ἐπιεικείᾳ χρώμεθα καὶ ἰσονομίᾳ ὑπερορῶντες καὶ τοῦ συμφέροντος ἑαυτῶν, εἴπερ κοινῶς τοῦτο τοῖς πᾶσι μέλλει συνοίσειν·	ἀλλά ὁ μέν Ἑλληνικός ἅπας γένος ἀγαπάω καί στέργω καί  ἄν πᾶς ἀγαθός αὐτός γίγνομαι καί γε ὅσος  εἰμί πρός αὐτός ἐπιείκεια χράω2 καί ἰσονομία ὑπεροράω καί ὁ συμφέρω ἑαυτοῦ , εἴπερ κοινός οὗτος ὁ πᾶς μέλλω συμφέρω ·
318456	tlg9006.tlg011.opp-grc1	βαρβά- ρους δὲ μισοῦμεν ἀεὶ καὶ πολεμοῦμεν καὶ φιλονεικοῦμεν ἐκ τῶν ἰδίων ἐκείνοις πραγμάτων ὀνομαστότεροι ἑαυτῶν φανῆναι καὶ περιφανέστεροι.	-  δέ μισέω ἀεί καί πολεμέω καί  ἐκ ὁ ἴδιος ἐκεῖνος πρᾶγμα  ἑαυτοῦ φαίνω καί  .
318457	tlg9006.tlg011.opp-grc1	κἂν ὅθεν ἡμᾶς τις ἐκ μικρῶν τὸ καταρχὰς μεγάλοι γεγόναμεν ἐξετάζῃ, οὐκ ἄλλοθεν ἢ ἐκ βαρβαρικῶν τροπαίων τοιοῦτ’ οὑς εὑρήσει γεγενημένους.	ἐάν ὅθεν ἐγώ τις ἐκ  ὁ καταρχή μέγας  ἐξετάζω , οὐ ἄλλος ἤ ἐκ βαρβαρικός τροπαῖος   εὑρίσκω  .
318458	tlg9006.tlg011.opp-grc1	πάμπρωτα μὲν γὰρ εὐθύς, ὅτε μετὰ τῶν ζώντων Θησεὺς ὁ ἡμέτερος ἦν, Ἀμαζόνας νενικήκαμεν, γυναῖκας μὲν ἂν ἴσως εἴποι τις, ἀλλὰ πολὺ τὴν ἀρρέ- νῶν παρελθούσας φύσιν, καὶ γέγονεν ἡμῖν ἐντεῦθεν οὐ μικρῷ τινι ἐπιδοῦναι.	μέν γάρ εὐθύς , ὅτε μετά ὁ ζήω Θησεύς ὁ ἡμέτερος εἰμί ,  νικάω , γυνή μέν ἄν ἴσος λέγω τις , ἀλλά πολύς ὁ  - νάω  φύσις , καί γίγνομαι ἐγώ ἐντεῦθεν οὐ μικρός  ἐπιδίδωμι .
318459	tlg9006.tlg011.opp-grc1	ἔπειτα διαβάντες εἰς τὴν Ἀσίαν Σάρδεις ἐπολιορκοῦμεν καὶ ὁ ἐκεῖθεν χρυσὸς μεγάλως τὰ τῶν Ἀθηναίων ἀνύψωσε πράγματα.	ἔπειτα διαβαίνω εἰς ὁ Ἀσία Σάρδεις  καί ὁ ἐκεῖθεν χρυσός μέγας ὁ ὁ Ἀθήναιος  πρᾶγμα .
318460	tlg9006.tlg011.opp-grc1	τρίτον τοὐν Μαραθῶνι τρόπαιον ἱστῶμεν καὶ προέβημεν ὅσον πλεῖστον ἐνῆν.	τρίτος  Μαραθών τρόπαιον  καί  ὅσος πλεῖστος ἔνειμι .
